longname,Never Married % [StatCan],Married (not divorced) % [StatCan],Divorced % [StatCan]
"Témiscaming Ville, Témiscamingue CRM, Quebec, Canada",0.43908629441624364,0.4390862944162436,0.1218274111675127
"Logy Bay-Middle Cove-Outer Cove Town, Division No. 1, Newfoundland and Labrador, Canada",0.3022670025188917,0.6372795969773299,0.060453400503778336
"Mandeville Municipalité, D'Autray CRM, Quebec, Canada",0.4545454545454546,0.39160839160839156,0.15384615384615383
"Daveluyville Ville, Arthabaska CRM, Quebec, Canada",0.5025773195876289,0.3865979381443299,0.11082474226804126
"Disraeli Ville, Les Appalaches CRM, Quebec, Canada",0.4097560975609756,0.44634146341463427,0.14390243902439023
"Brooke-Alvinston Municipality, Lambton County, Ontario, Canada",0.32545931758530167,0.5853018372703414,0.08923884514435695
"Anmore Village, Greater Vancouver Regional district, British Columbia, Canada",0.31017369727047145,0.6153846153846154,0.07444168734491315
"Port McNeill Town, Mount Waddington Regional district, British Columbia, Canada",0.37435897435897436,0.4974358974358975,0.1282051282051282
"Esterhazy Town, Division No. 5, Saskatchewan, Canada",0.2824427480916031,0.6259541984732824,0.09160305343511453
"Saint-Denis-sur-Richelieu Municipalité, La Vallée-du-Richelieu CRM, Quebec, Canada",0.49610389610389605,0.36103896103896105,0.14285714285714282
"Saint-Mathieu Municipalité, Roussillon CRM, Quebec, Canada",0.5415549597855228,0.33512064343163533,0.12332439678284182
"Saddle Hills County Municipal District, Division No. 19, Alberta, Canada",0.26016260162601595,0.6612466124661249,0.07859078590785902
"Outlook Town, Division No. 11, Saskatchewan, Canada",0.273936170212766,0.625,0.10106382978723408
"Assiniboia Town, Division No. 3, Saskatchewan, Canada",0.26700251889168775,0.6347607052896725,0.0982367758186399
"Fossambault-sur-le-Lac Ville, La Jacques-Cartier CRM, Quebec, Canada",0.5254691689008044,0.34852546916890076,0.12600536193029485
"Maskinongé Municipalité, Maskinongé CRM, Quebec, Canada",0.4887218045112781,0.37343358395989984,0.13784461152882205
"Saint-Éphrem-de-Beauce Municipalité, Beauce-Sartigan CRM, Quebec, Canada",0.4566929133858268,0.4540682414698162,0.08923884514435694
"Sunshine Coast F Regional District Electoral Area, Sunshine Coast Regional district, British Columbia, Canada",0.31239939575542974,0.5460984126197962,0.141502191624774
"Saint-Victor Municipalité, Robert-Cliche CRM, Quebec, Canada",0.45780051150895146,0.4552429667519181,0.08695652173913045
"Boissevain-Morton Municipality, Division No. 5, Manitoba, Canada",0.25268817204301053,0.6370967741935487,0.11021505376344075
"East River, Part 1 Fire District, Queens County, Prince Edward Island, Canada",0.328,0.5893333333333333,0.08266666666666665
"Okanagan-Similkameen I Regional District Electoral Area, Okanagan-Similkameen Regional district, British Columbia, Canada",0.2616136919315403,0.6381418092909535,0.10024449877750613
"Waterville Ville, Coaticook CRM, Quebec, Canada",0.5185185185185185,0.3589743589743589,0.12250712250712248
"Chetwynd District Municipality, Peace River Regional district, British Columbia, Canada",0.43229166666666663,0.44791666666666674,0.11979166666666671
"Lillooet District Municipality, Squamish-Lillooet Regional district, British Columbia, Canada",0.33985330073349634,0.530562347188264,0.1295843520782396
"Okanagan-Similkameen G Regional District Electoral Area, Okanagan-Similkameen Regional district, British Columbia, Canada",0.22911694510739852,0.5751789976133651,0.19570405727923626
"Kuujjuaq Village Nordique, Nord-du-Québec CDR, Quebec, Canada",0.7253000671859962,0.2010041582684171,0.07369577454558661
"North Frontenac Township, Frontenac County, Ontario, Canada",0.1938534278959811,0.6501182033096926,0.15602836879432624
"Gore Canton, Argenteuil CRM, Quebec, Canada",0.44146341463414634,0.4073170731707318,0.15121951219512186
"Brigham Municipalité, Brome-Missisquoi CRM, Quebec, Canada",0.4840425531914893,0.3856382978723405,0.1303191489361702
"Eastman Municipalité, Memphrémagog CRM, Quebec, Canada",0.4019607843137253,0.4289215686274512,0.16911764705882362
"Saint-Pamphile Ville, L'Islet CRM, Quebec, Canada",0.4683544303797468,0.43797468354430386,0.09367088607594934
"Beaverlodge Town, Division No. 19, Alberta, Canada",0.3223140495867769,0.5454545454545453,0.13223140495867772
"Port-Daniel--Gascons Municipalité, Le Rocher-Percé CRM, Quebec, Canada",0.5123762376237624,0.3935643564356436,0.09405940594059406
"Sainte-Madeleine Village, Les Maskoutains CRM, Quebec, Canada",0.5491803278688525,0.33606557377049173,0.11475409836065574
"Ermineskin 138 Indian Reserve, Division No. 11, Alberta, Canada",0.7884615384615384,0.1794871794871795,0.03205128205128205
"Fermont Ville, Sept-Rivières--Caniapiscau CDR, Quebec, Canada",0.7383720930232559,0.191860465116279,0.06976744186046513
"Tsawwassen Town, Greater Vancouver Regional district, British Columbia, Canada",0.3220779220779221,0.5636363636363636,0.11428571428571424
"Logan Lake District Municipality, Thompson-Nicola Regional district, British Columbia, Canada",0.2193211488250653,0.6214099216710183,0.1592689295039165
"Nominingue Municipalité, Antoine-Labelle CRM, Quebec, Canada",0.3961352657004833,0.44444444444444425,0.15942028985507242
"Saint-Alexandre-de-Kamouraska Municipalité, Kamouraska CRM, Quebec, Canada",0.5152354570637119,0.3850415512465374,0.09972299168975071
"Sainte-Geneviève-de-Berthier Municipalité, D'Autray CRM, Quebec, Canada",0.5013192612137204,0.3931398416886543,0.10554089709762536
"Mansfield-et-Pontefract Municipalité, Pontiac CRM, Quebec, Canada",0.38057742782152226,0.5249343832020998,0.09448818897637797
"Paquetville Parish, Gloucester County, New Brunswick, Canada",0.5123152709359607,0.3866995073891625,0.10098522167487686
"East Broughton Municipalité, Les Appalaches CRM, Quebec, Canada",0.47989276139410186,0.42359249329758714,0.09651474530831099
"Fort Smith Town, Region 5 Region, Northwest Territories, Canada",0.5041551246537397,0.39058171745152354,0.10526315789473688
"Saint-Marc-sur-Richelieu Municipalité, La Vallée-du-Richelieu CRM, Quebec, Canada",0.5315068493150686,0.347945205479452,0.12054794520547947
"Central Kootenay A Regional District Electoral Area, Central Kootenay Regional district, British Columbia, Canada",0.23832923832923833,0.6191646191646192,0.14250614250614244
"Neebing Municipality, Thunder Bay District, Ontario, Canada",0.29350649350649344,0.6051948051948053,0.10129870129870129
"Burin Town, Division No. 2, Newfoundland and Labrador, Canada",0.2835443037974684,0.6430379746835443,0.07341772151898734
"Central Manitoulin Municipality, Manitoulin District, Ontario, Canada",0.22807017543859642,0.6566416040100251,0.11528822055137848
"Deschambault-Grondines Municipalité, Portneuf CRM, Quebec, Canada",0.5171503957783642,0.34564643799472294,0.13720316622691295
"Minto Village, Queens County, New Brunswick, Canada",0.32051282051282043,0.558974358974359,0.12051282051282049
"Madoc Township, Hastings County, Ontario, Canada",0.3042328042328042,0.5846560846560847,0.11111111111111106
"Okanagan-Similkameen H Regional District Electoral Area, Okanagan-Similkameen Regional district, British Columbia, Canada",0.2326732673267327,0.599009900990099,0.16831683168316836
"Split Lake 171 Indian Reserve, Division No. 22, Manitoba, Canada",0.7122302158273381,0.2589928057553957,0.028776978417266192
"Alberton Fire District, Prince County, Prince Edward Island, Canada",0.29919137466307266,0.6118598382749328,0.08894878706199456
"Hatley Canton, Memphrémagog CRM, Quebec, Canada",0.4255319148936171,0.4441489361702127,0.13031914893617025
"West Interlake Municipality, Division No. 18, Manitoba, Canada",0.3260869565217388,0.5625000000000001,0.11141304347826092
"Pennfield Parish, Charlotte County, New Brunswick, Canada",0.2944297082228117,0.5915119363395226,0.11405835543766578
"Division No. 9, Subd. C, Division No. 9, Newfoundland and Labrador, Canada",0.2787286063569683,0.687041564792176,0.03422982885085574
"Woodstock Parish, Carleton County, New Brunswick, Canada",0.29891304347826075,0.6086956521739132,0.09239130434782607
"Opaskwayak Cree Nation 21E Indian Reserve, Division No. 21, Manitoba, Canada",0.5919732441471572,0.34448160535117056,0.06354515050167225
"Hardwicke Parish, Northumberland County, New Brunswick, Canada",0.3200992555831265,0.5682382133995038,0.1116625310173697
"Wendake Indian Reserve, Québec Territory, Quebec, Canada",0.5526315789473686,0.31578947368421045,0.13157894736842105
"qathet C Regional District Electoral Area, Powell River Regional district, British Columbia, Canada",0.2997416020671833,0.5503875968992249,0.14987080103359174
"Sainte-Cécile-de-Milton Municipalité, La Haute-Yamaska CRM, Quebec, Canada",0.5459940652818991,0.35014836795252224,0.10385756676557861
"Seekaskootch 119 Indian Reserve, Division No. 17, Saskatchewan, Canada",0.7314487632508834,0.20848056537102475,0.06007067137809186
"Hinchinbrooke Municipalité, Le Haut-Saint-Laurent CRM, Quebec, Canada",0.37994722955145127,0.48812664907651704,0.13192612137203164
"Calmar Town, Division No. 11, Alberta, Canada",0.35227272727272735,0.5028409090909091,0.14488636363636362
"Albanel Municipalité, Maria-Chapdelaine CRM, Quebec, Canada",0.4793388429752067,0.4214876033057851,0.09917355371900827
"Kelsey Rural Municipality, Division No. 21, Manitoba, Canada",0.36158192090395486,0.5536723163841808,0.0847457627118644
"St. Anthony Town, Division No. 9, Newfoundland and Labrador, Canada",0.30208333333333337,0.6380208333333333,0.05989583333333334
"Saint-Gédéon Municipalité, Lac-Saint-Jean-Est CRM, Quebec, Canada",0.45856353591160215,0.4198895027624309,0.12154696132596686
"Maple Creek Town, Division No. 4, Saskatchewan, Canada",0.3193277310924371,0.5714285714285714,0.10924369747899161
"Upper Miramichi Rural Community, Northumberland County, New Brunswick, Canada",0.2613333333333333,0.6266666666666667,0.11199999999999999
"Sainte-Béatrix Municipalité, Matawinie CRM, Quebec, Canada",0.517426273458445,0.3404825737265415,0.14209115281501336
"Northesk Parish, Northumberland County, New Brunswick, Canada",0.2948717948717948,0.6025641025641026,0.10256410256410255
"Nanton Town, Division No. 3, Alberta, Canada",0.22606382978723405,0.5984042553191489,0.17553191489361708
"Division No. 22, Unorganized, Division No. 22, Manitoba, Canada",0.5188679245283019,0.39622641509433965,0.08490566037735849
"Prairie View Municipality, Division No. 15, Manitoba, Canada",0.2756598240469213,0.6510263929618764,0.07331378299120248
"St. Mary's Municipal District, Guysborough County, Nova Scotia, Canada",0.22857142857142837,0.6441558441558444,0.12727272727272726
"Papineauville Municipalité, Papineau CRM, Quebec, Canada",0.44686648501362397,0.4114441416893734,0.14168937329700274
"Grand Bank Town, Division No. 2, Newfoundland and Labrador, Canada",0.22704081632653053,0.6785714285714287,0.09438775510204085
"Causapscal Ville, La Matapédia CRM, Quebec, Canada",0.5119363395225465,0.36604774535809015,0.12201591511936341
"Bonfield Township, Nipissing District, Ontario, Canada",0.30470914127423815,0.5706371191135734,0.1246537396121884
"Sainte-Anne-de-Sabrevois Paroisse, Le Haut-Richelieu CRM, Quebec, Canada",0.5306122448979592,0.34985422740524785,0.11953352769679298
"Saint-Paul-de-l'Île-aux-Noix Municipalité, Le Haut-Richelieu CRM, Quebec, Canada",0.4765840220385675,0.36914600550964183,0.15426997245179064
"Saint-Quentin Town, Restigouche County, New Brunswick, Canada",0.4343163538873996,0.4530831099195709,0.1126005361930295
"Okanagan-Similkameen A Regional District Electoral Area, Okanagan-Similkameen Regional district, British Columbia, Canada",0.2442159383033419,0.6401028277634961,0.11568123393316194
"Valcourt Ville, Le Val-Saint-François CRM, Quebec, Canada",0.47945205479452047,0.3917808219178082,0.12876712328767123
"Saint-Gervais Municipalité, Bellechasse CRM, Quebec, Canada",0.5386819484240687,0.3868194842406877,0.07449856733524357
"Dauphin Rural Municipality, Division No. 17, Manitoba, Canada",0.2773109243697483,0.6302521008403356,0.09243697478991612
"Biggar Town, Division No. 12, Saskatchewan, Canada",0.29914529914529914,0.5954415954415954,0.10541310541310543
"Puvirnituq Village Nordique, Nord-du-Québec CDR, Quebec, Canada",0.7777777777777778,0.1827956989247312,0.03942652329749103
"Fort Alexander 3 Indian Reserve, Division No. 19, Manitoba, Canada",0.6632996632996634,0.24579124579124575,0.09090909090909091
"Twillingate Town, Division No. 8, Newfoundland and Labrador, Canada",0.23437500000000008,0.6822916666666665,0.08333333333333333
"Redwater Town, Division No. 11, Alberta, Canada",0.35327635327635326,0.5099715099715099,0.13675213675213677
"Westfield Parish, Kings County, New Brunswick, Canada",0.3085399449035813,0.581267217630854,0.11019283746556471
"Pierreville Municipalité, Nicolet-Yamaska CRM, Quebec, Canada",0.48333333333333334,0.3888888888888889,0.1277777777777778
"Dundurn No. 314 Rural Municipality, Division No. 11, Saskatchewan, Canada",0.26470588235294124,0.6732026143790848,0.06209150326797387
"Sandy Lake 88 Indian Reserve, Kenora District, Ontario, Canada",0.6383763837638377,0.2730627306273063,0.08856088560885608
"Drummond Parish, Victoria County, New Brunswick, Canada",0.35632183908045983,0.543103448275862,0.10057471264367815
"Saint-Gédéon-de-Beauce Municipalité, Beauce-Sartigan CRM, Quebec, Canada",0.46086956521739136,0.44637681159420284,0.0927536231884058
"Canora Town, Division No. 9, Saskatchewan, Canada",0.32000000000000006,0.5542857142857143,0.1257142857142857
"Fraser Valley D Regional District Electoral Area, Fraser Valley Regional district, British Columbia, Canada",0.25073746312684364,0.6489675516224189,0.10029498525073745
"Okanagan-Similkameen F Regional District Electoral Area, Okanagan-Similkameen Regional district, British Columbia, Canada",0.2651933701657458,0.6464088397790055,0.08839779005524863
"Saint-Blaise-sur-Richelieu Municipalité, Le Haut-Richelieu CRM, Quebec, Canada",0.5130434782608695,0.3652173913043479,0.12173913043478249
"Lebel-sur-Quévillon Ville, Nord-du-Québec CDR, Quebec, Canada",0.5014662756598239,0.4193548387096775,0.07917888563049852
"Wasagamack Indian Reserve, Division No. 22, Manitoba, Canada",0.5384615384615384,0.4251012145748988,0.036437246963562764
"Saint-Barthélemy Paroisse, D'Autray CRM, Quebec, Canada",0.5043731778425656,0.37317784256559766,0.12244897959183673
"Penticton 1 Indian Reserve, Okanagan-Similkameen Regional district, British Columbia, Canada",0.2907608695652174,0.592391304347826,0.11684782608695655
"L'Ascension-de-Notre-Seigneur Paroisse, Lac-Saint-Jean-Est CRM, Quebec, Canada",0.49253731343283597,0.40895522388059685,0.09850746268656714
"Provost No. 52 Municipal District, Division No. 7, Alberta, Canada",0.2323529411764706,0.7147058823529413,0.052941176470588096
"Saint-Liguori Municipalité, Montcalm CRM, Quebec, Canada",0.5252225519287834,0.36201780415430274,0.11275964391691397
"Ucluelet District Municipality, Alberni-Clayoquot Regional district, British Columbia, Canada",0.47277936962750716,0.4068767908309456,0.12034383954154725
"Lumby Village, North Okanagan Regional district, British Columbia, Canada",0.30120481927710846,0.5572289156626505,0.14156626506024095
"Pouch Cove Town, Division No. 1, Newfoundland and Labrador, Canada",0.3362068965517241,0.5574712643678161,0.10632183908045975
"Richibucto 15 Indian Reserve, Kent County, New Brunswick, Canada",0.6870967741935484,0.21935483870967742,0.0935483870967742
"Baker Lake Hamlet, Kivalliq Region, Nunavut, Canada",0.6382978723404257,0.3156028368794325,0.04609929078014184
"Britannia No. 502 Rural Municipality, Division No. 17, Saskatchewan, Canada",0.2789968652037616,0.6426332288401255,0.07836990595611289
"Cochrane, Unorganized, North Part Unorganized, Cochrane District, Ontario, Canada",0.3030491442398985,0.598973255921423,0.0979775998386785
"Igloolik Hamlet, Qikiqtaaluk Region, Nunavut, Canada",0.7420634920634922,0.23809523809523808,0.01984126984126984
"Saint Andrews Town, Charlotte County, New Brunswick, Canada",0.28493150684931506,0.5917808219178082,0.12328767123287666
"Upton Municipalité, Acton CRM, Quebec, Canada",0.5000000000000001,0.3779761904761904,0.12202380952380949
"Cross Lake 19A Indian Reserve, Division No. 22, Manitoba, Canada",0.7063492063492063,0.25,0.04365079365079365
"Tofield Town, Division No. 10, Alberta, Canada",0.28700906344410876,0.5740181268882175,0.1389728096676737
"Fogo Island Town, Division No. 8, Newfoundland and Labrador, Canada",0.25095214861528836,0.6744634833710793,0.0745843680136323
"Bow Island Town, Division No. 1, Alberta, Canada",0.28424657534246583,0.6404109589041095,0.0753424657534247
"Sainte-Anne-de-la-Pérade Municipalité, Francheville CDR, Quebec, Canada",0.49421965317919075,0.3699421965317919,0.1358381502890174
"Saint-Nazaire Municipalité, Lac-Saint-Jean-Est CRM, Quebec, Canada",0.4796238244514107,0.4169278996865204,0.10344827586206896
"Louise Municipality, Division No. 4, Manitoba, Canada",0.24299065420560761,0.6760124610591899,0.08099688473520242
"Saint-Charles Parish, Kent County, New Brunswick, Canada",0.3223140495867768,0.5702479338842976,0.10743801652892566
"New-Wes-Valley Town, Division No. 7, Newfoundland and Labrador, Canada",0.24715907296397596,0.6667761557946068,0.08606477124141722
"Okanagan-Similkameen E Regional District Electoral Area, Okanagan-Similkameen Regional district, British Columbia, Canada",0.2395543175487466,0.6323119777158773,0.12813370473537614
"Potton Canton, Memphrémagog CRM, Quebec, Canada",0.3643835616438356,0.4958904109589041,0.13972602739726026
"East Kootenay B Regional District Electoral Area, East Kootenay Regional district, British Columbia, Canada",0.27745664739884396,0.6184971098265896,0.1040462427745665
"Saint-Esprit Municipalité, Montcalm CRM, Quebec, Canada",0.5164179104477613,0.35223880597014917,0.13134328358208958
"Mashteuiatsh Indian Reserve, Le Domaine-du-Roy CRM, Quebec, Canada",0.5744680851063829,0.3100303951367781,0.11550151975683892
"Saint-Ferdinand Municipalité, L'Érable CRM, Quebec, Canada",0.43019943019943024,0.44159544159544145,0.1282051282051282
"Digby Town, Digby County, Nova Scotia, Canada",0.3636363636363636,0.46022727272727276,0.17613636363636365
"Communauté Atikamekw de Manawan Indian Reserve, Matawinie CRM, Quebec, Canada",0.6398467432950192,0.3333333333333333,0.026819923371647503
"Squamish-Lillooet C Regional District Electoral Area, Squamish-Lillooet Regional district, British Columbia, Canada",0.42397660818713456,0.48245614035087714,0.09356725146198834
"Richibucto Parish, Kent County, New Brunswick, Canada",0.295507679559646,0.5846379213400018,0.11985439910035216
"Blackville Parish, Northumberland County, New Brunswick, Canada",0.35410764872521244,0.5580736543909348,0.08781869688385266
"Hemmingford Canton, Les Jardins-de-Napierville CRM, Quebec, Canada",0.4089552238805971,0.4716417910447761,0.11940298507462685
"Swift Current No. 137 Rural Municipality, Division No. 8, Saskatchewan, Canada",0.2599388379204895,0.6666666666666664,0.07339449541284415
"Obedjiwan 28 Indian Reserve, La Tuque Territory, Quebec, Canada",0.7100371747211897,0.24163568773234195,0.048327137546468404
"Saint Mary Parish, Kent County, New Brunswick, Canada",0.33720930232558144,0.563953488372093,0.09883720930232559
"Paintearth County No. 18 Municipal District, Division No. 7, Alberta, Canada",0.27848101265822756,0.6613924050632913,0.06012658227848114
"Barraute Municipalité, Abitibi CRM, Quebec, Canada",0.5092024539877301,0.3742331288343557,0.11656441717791416
"Kedgwick Rural Community, Restigouche County, New Brunswick, Canada",0.4839650145772595,0.4110787172011662,0.10495626822157435
"Kingsey Falls Ville, Arthabaska CRM, Quebec, Canada",0.5174603174603175,0.38412698412698415,0.09841269841269841
"Blucher No. 343 Rural Municipality, Division No. 11, Saskatchewan, Canada",0.2816455696202531,0.620253164556962,0.0981012658227848
"Alberni-Clayoquot F Regional District Electoral Area, Alberni-Clayoquot Regional district, British Columbia, Canada",0.27352941176470585,0.5941176470588236,0.1323529411764706
"Morris Town, Division No. 3, Manitoba, Canada",0.31761006289308175,0.5754716981132075,0.1069182389937107
"Manitouwadge Township, Thunder Bay District, Ontario, Canada",0.3391304347826087,0.5362318840579711,0.12463768115942034
"Fort Qu'Appelle Town, Division No. 6, Saskatchewan, Canada",0.3198757763975155,0.5652173913043478,0.1149068322981366
"Lac-Supérieur Municipalité, Les Laurentides CRM, Quebec, Canada",0.5217391304347826,0.33333333333333337,0.14492753623188406
"Dawn-Euphemia Township, Lambton County, Ontario, Canada",0.2870662460567823,0.6309148264984227,0.08201892744479497
"Lumsden No. 189 Rural Municipality, Division No. 6, Saskatchewan, Canada",0.2012578616352201,0.7358490566037736,0.06289308176100626
"Armstrong Rural Municipality, Division No. 18, Manitoba, Canada",0.3067484662576686,0.5828220858895705,0.11042944785276082
"Caplan Municipalité, Bonaventure CRM, Quebec, Canada",0.5000000000000001,0.38888888888888884,0.11111111111111113
"Kent Parish, Carleton County, New Brunswick, Canada",0.30882352941176466,0.5705882352941177,0.12058823529411761
"Wabush Town, Division No. 10, Newfoundland and Labrador, Canada",0.3949044585987259,0.5254777070063695,0.07961783439490444
"Saint-Patrice-de-Sherrington Municipalité, Les Jardins-de-Napierville CRM, Quebec, Canada",0.5092024539877301,0.4018404907975461,0.08895705521472395
"Fruitvale Village, Kootenay Boundary Regional district, British Columbia, Canada",0.28908554572271383,0.584070796460177,0.12684365781710916
"Petit-Rocher Village, Gloucester County, New Brunswick, Canada",0.35428571428571437,0.5114285714285713,0.13428571428571426
"Saint-Louis-de-Gonzague Paroisse, Beauharnois-Salaberry CRM, Quebec, Canada",0.5540540540540542,0.3378378378378378,0.10810810810810813
"Allardville Parish, Gloucester County, New Brunswick, Canada",0.4011299435028249,0.5056497175141242,0.09322033898305085
"Glovertown Town, Division No. 7, Newfoundland and Labrador, Canada",0.20535714285714285,0.7083333333333334,0.08630952380952381
"Chapleau Township, Sudbury District, Ontario, Canada",0.3806646525679758,0.5287009063444109,0.09063444108761327
"Saint-Élie-de-Caxton Municipalité, Maskinongé CRM, Quebec, Canada",0.47720364741641336,0.37386018237082064,0.14893617021276587
"Frontenac Islands Township, Frontenac County, Ontario, Canada",0.23863636363636376,0.6505681818181818,0.11079545454545453
"Picture Butte Town, Division No. 2, Alberta, Canada",0.2736842105263158,0.6385964912280702,0.08771929824561404
"Point Edward Village, Lambton County, Ontario, Canada",0.2536443148688047,0.6093294460641399,0.1370262390670554
"Oakview Rural Municipality, Division No. 15, Manitoba, Canada",0.28664495114006505,0.6188925081433229,0.0944625407166121
"One Hundred Mile House District Municipality, Cariboo Regional district, British Columbia, Canada",0.3134328358208955,0.5343283582089552,0.15223880597014922
"Manners Sutton Parish, York County, New Brunswick, Canada",0.2272727272727273,0.6636363636363636,0.10909090909090913
"Déléage Municipalité, La Vallée-de-la-Gatineau CRM, Quebec, Canada",0.4622641509433963,0.4245283018867923,0.11320754716981127
"Harrison Hot Springs Village, Fraser Valley Regional district, British Columbia, Canada",0.22551928783382794,0.6320474777448071,0.142433234421365
"Indian Head Town, Division No. 6, Saskatchewan, Canada",0.2920634920634921,0.5809523809523809,0.12698412698412698
"Provost Town, Division No. 7, Alberta, Canada",0.3618421052631579,0.5526315789473685,0.08552631578947369
"Venise-en-Québec Municipalité, Le Haut-Richelieu CRM, Quebec, Canada",0.3560830860534125,0.4688427299703264,0.17507418397626115
"Saint-François-du-Lac Municipalité, Nicolet-Yamaska CRM, Quebec, Canada",0.5015384615384615,0.363076923076923,0.13538461538461538
"Saint-Fulgence Municipalité, Le Saguenay-et-son-Fjord CDR, Quebec, Canada",0.49041524124100505,0.39235578624513384,0.11722897251386105
"Tofino District Municipality, Alberni-Clayoquot Regional district, British Columbia, Canada",0.5424998072234843,0.33412618854136394,0.12337400423515177
"Saint-Damien-de-Buckland Paroisse, Bellechasse CRM, Quebec, Canada",0.521604938271605,0.3580246913580246,0.12037037037037036
"Millet Town, Division No. 11, Alberta, Canada",0.29470198675496684,0.5430463576158941,0.16225165562913904
"Terrasse-Vaudreuil Municipalité, Vaudreuil-Soulanges CRM, Quebec, Canada",0.43887147335423193,0.420062695924765,0.14106583072100312
"Cariboo H Regional District Electoral Area, Cariboo Regional district, British Columbia, Canada",0.24848484848484859,0.6,0.15151515151515152
"Orkney No. 244 Rural Municipality, Division No. 9, Saskatchewan, Canada",0.26384364820846873,0.6384364820846908,0.09771986970684043
"Stanley 157 Indian Reserve, Division No. 18, Saskatchewan, Canada",0.6245059288537549,0.30830039525691705,0.06719367588932808
"Mattawa Town, Nipissing District, Ontario, Canada",0.34153846153846146,0.5015384615384616,0.15692307692307692
"East Kootenay A Regional District Electoral Area, East Kootenay Regional district, British Columbia, Canada",0.3419354838709677,0.5548387096774193,0.10322580645161294
"Northampton Parish, Carleton County, New Brunswick, Canada",0.28664495114006516,0.6221498371335505,0.0912052117263844
"Middleton Town, Annapolis County, Nova Scotia, Canada",0.334375,0.509375,0.15625000000000003
"Division No. 18, Unorganized, Division No. 18, Saskatchewan, Canada",0.34797297297297314,0.564189189189189,0.08783783783783788
"Saint-Michel-de-Bellechasse Municipalité, Bellechasse CRM, Quebec, Canada",0.49523809523809526,0.39682539682539686,0.10793650793650793
"Cross Lake 19 Indian Reserve, Division No. 22, Manitoba, Canada",0.6557377049180327,0.3073770491803279,0.036885245901639344
"Vallée-Jonction Municipalité, La Nouvelle-Beauce CRM, Quebec, Canada",0.4968553459119497,0.38993710691823896,0.11320754716981135
"Huron Shores Municipality, Algoma District, Ontario, Canada",0.23619631901840496,0.6503067484662576,0.11349693251533742
