"Saint-Isidore Paroisse, Roussillon CRM, Quebec, Canada",1689.4661041198103,455.5470841910538,67.25126894179954,73.82398299286037
"Labelle Municipalité, Les Laurentides CRM, Quebec, Canada",688.0337838137913,307.28358567793765,52.17274594254474,21.55237098170952
"Maria Municipalité, Avignon CRM, Quebec, Canada",1142.4206399750833,426.98964638177387,118.8374784518166,43.99572422726531
"Saint-Prime Municipalité, Le Domaine-du-Roy CRM, Quebec, Canada",866.5151664550814,349.6085130504943,48.944383366090165,30.95628516076124
"Athabasca Town, Division No. 13, Alberta, Canada",938.878256650329,588.132835344497,130.41530417370586,59.308845820964095
"Swan Valley West Municipality, Division No. 20, Manitoba, Canada",211.84047865720513,83.80583592747571,24.49832408913543,17.466324821857306
"Cocagne Rural Community, Kent County, New Brunswick, Canada",499.5994314300609,132.47464023428205,38.16595572028748,28.746055509434814
"Saint-Anicet Municipalité, Le Haut-Saint-Laurent CRM, Quebec, Canada",496.18801558021926,147.01755828146239,28.382833784685328,18.817240287787463
"Elkford District Municipality, East Kootenay Regional district, British Columbia, Canada",1509.5998617635616,557.1050596278583,141.81704128203165,54.26919410860384
"Wallace-Woodworth Rural Municipality, Division No. 6, Manitoba, Canada",230.8214641331816,96.89037868880575,18.550875450205005,9.348868792596175
"Macamic Ville, Abitibi-Ouest CRM, Quebec, Canada",701.7257443066777,369.4204313195699,74.63337311972036,25.739099717219737
"McDougall Municipality, Parry Sound District, Ontario, Canada",1124.1257473240505,281.0314368310126,32.72107307781355,29.204308545832824
"Minnedosa Town, Division No. 15, Manitoba, Canada",948.3697574748488,655.3625459504053,196.98069048066344,56.11701099804817
"Saint-Dominique Municipalité, Les Maskoutains CRM, Quebec, Canada",2390.4034258173388,716.530998971133,80.44524630862858,39.216262816870675
"Sainte-Catherine-de-Hatley Municipalité, Memphrémagog CRM, Quebec, Canada",493.58958823825134,150.19442108607942,57.57446034101722,66.057822356467
"Indian Brook 14 Indian Reserve, Hants County, Nova Scotia, Canada",6186.028982256152,1550.3116239627648,157.04185470817563,58.17408062793072
"Bonaventure Ville, Bonaventure CRM, Quebec, Canada",704.3544389933168,338.8200841190141,76.89775187477433,34.47920341424585
"Sainte-Anne-de-Sorel Municipalité, Pierre-De Saurel CRM, Quebec, Canada",2180.418291294274,601.4525324924742,157.42274171840873,165.38857482992552
"Black Diamond Town, Division No. 6, Alberta, Canada",1470.1560676728557,874.139111527089,213.68996732747286,92.7567251027496
"Wikwemikong Unceded Indian Reserve, Manitoulin District, Ontario, Canada",672.1846012931018,300.0924793252486,61.4174433115005,22.648942939168712
"Wakefield Parish, Carleton County, New Brunswick, Canada",587.306765106685,158.17919816525406,28.071698578473903,20.904303060362942
"Ferme-Neuve Municipalité, Antoine-Labelle CRM, Quebec, Canada",826.0343127104211,574.8264007366088,98.50015045366071,31.430068761273425
"Saint-Basile Ville, Portneuf CRM, Quebec, Canada",919.0317294455093,486.83481951704454,72.72003201471819,35.83500004037023
"Lacolle Municipalité, Le Haut-Richelieu CRM, Quebec, Canada",1050.706611365527,418.9282524366969,130.88583974902747,59.8083470803355
"Markstay-Warren Municipality, Sudbury District, Ontario, Canada",661.0877878432157,190.30323458362912,15.021922760161036,6.472854456680252
"Wawa Municipality, Algoma District, Ontario, Canada",1300.8959080218387,934.3445993979883,174.75798182796487,43.891013268484656
"Rougemont Municipalité, Rouville CRM, Quebec, Canada",1107.695734966273,345.9480629779269,95.57947979026378,71.39736645829521
"Saint-Gabriel-de-Brandon Municipalité, D'Autray CRM, Quebec, Canada",703.3158927221214,204.74915783225705,66.54680882447073,64.50009789995809
"Saint-Alexandre Municipalité, Le Haut-Richelieu CRM, Quebec, Canada",1021.5546039893212,530.1792285598409,104.49175749746193,44.77322581692174
"Victoria, Subd. A Subdivision of County Municipality, Victoria County, Nova Scotia, Canada",774.1658445478004,193.5414611369501,17.342202565417164,6.01221492118827
"Shippagan Town, Gloucester County, New Brunswick, Canada",1143.2738088110434,617.4563735909836,197.36496547071525,76.96273958581288
"Sundre Town, Division No. 6, Alberta, Canada",1825.4519218945825,619.0503055809309,186.91020710847573,63.26953998280567
"Weedon Municipalité, Le Haut-Saint-François CRM, Quebec, Canada",748.916922225393,300.04388760069656,45.33257328169731,18.98947625560054
"Peace River E Regional District Electoral Area, Peace River Regional district, British Columbia, Canada",480.91693589096036,120.97594588619378,13.910471106001202,6.080466734677564
"Moosomin Town, Division No. 5, Saskatchewan, Canada",1220.456409856168,951.8057411286667,211.1200203653928,54.03904827872062
"Plessisville Paroisse, L'Érable CRM, Quebec, Canada",808.3301521904414,276.67279503782413,130.77422982550888,91.71682000784693
"Strathcona C Regional District Electoral Area, Strathcona Regional district, British Columbia, Canada",651.7661877584,196.06593192927997,35.91535558709262,41.95829420377612
"Perry Township, Parry Sound District, Ontario, Canada",666.166617289481,172.1126779152775,18.36029441048832,14.118462333583395
"Sainte-Clotilde Municipalité, Les Jardins-de-Napierville CRM, Quebec, Canada",1230.3054838358998,367.8690272236108,56.32909067411731,36.265605623280166
"Atikokan Town, Rainy River District, Ontario, Canada",991.5114402931425,589.1176242050319,165.65222376642956,51.494666173840095
"Eeyou Istchee Baie-James Municipality, Nord-du-Québec CDR, Quebec, Canada",3807.6870514264306,955.9026877106546,60.55139704118123,15.598888792657881
"La Présentation Municipalité, Les Maskoutains CRM, Quebec, Canada",1498.1096724267063,405.88830235941043,61.77251002381197,47.71919793021707
"Pilot Butte Town, Division No. 6, Saskatchewan, Canada",1245.5738545516067,888.4991816828473,227.2815241738936,70.78421373033092
"Spaniard's Bay Town, Division No. 1, Newfoundland and Labrador, Canada",1154.5716826798462,316.3942174086892,114.28786355775908,101.28919372106438
"Saint-Elzéar Municipalité, La Nouvelle-Beauce CRM, Quebec, Canada",1013.2695624490236,518.2968399596482,126.61873970947296,47.69060728585312
"Sicamous District Municipality, Columbia-Shuswap Regional district, British Columbia, Canada",942.6143672181778,516.5274092003854,162.40552900958699,52.34367315423352
"Turner Valley Town, Division No. 6, Alberta, Canada",1940.1868980166348,866.9415401085192,206.18946518632976,91.89817320331743
"Central Kootenay I Regional District Electoral Area, Central Kootenay Regional district, British Columbia, Canada",1620.88717524279,421.43740538119874,55.15603989747075,28.338126741102617
"Cowichan Valley H Regional District Electoral Area, Cowichan Valley Regional district, British Columbia, Canada",637.4376196663894,178.7783868320741,93.9105572862975,90.31386498681945
"Grimshaw Town, Division No. 19, Alberta, Canada",1347.2333150634934,774.487481763839,198.200558062724,53.879294704562255
"Sandy Bay 5 Indian Reserve, Division No. 8, Manitoba, Canada",1525.3546969588729,385.0143080293694,45.802378955658945,37.345878926090094
"Russell-Binscarth Municipality, Division No. 16, Manitoba, Canada",700.9056173627768,557.3905288943458,102.51086505996358,29.109360924114572
"Front of Yonge Township, Leeds and Grenville United counties, Ontario, Canada",555.6505690418104,139.1677808204766,23.432728793742864,17.06209221110509
"Grand Manan Village, Charlotte County, New Brunswick, Canada",1655.8512171600794,413.96280429001985,32.48591580905607,15.403185587025956
"Algonquin Highlands Township, Haliburton County, Ontario, Canada",580.4594785072227,147.166418661406,16.434654289707996,9.438539996445519
"Saint-Martin Paroisse, Beauce-Sartigan CRM, Quebec, Canada",908.1169502203676,343.6625060521416,92.45260216444161,32.59594551279646
"Wickham Municipalité, Drummond CRM, Quebec, Canada",1032.7168676914541,398.74939061052834,41.54233163609381,31.58229748460207
"Saint-Charles-de-Bellechasse Municipalité, Bellechasse CRM, Quebec, Canada",1019.362579128419,567.4936602669482,116.75845080362659,40.8179130917752
"Saint-Côme Municipalité, Matawinie CRM, Quebec, Canada",666.5978351444351,177.47519896476683,29.0153078462264,18.4169857862615
"Saint-Chrysostome Municipalité, Le Haut-Saint-Laurent CRM, Quebec, Canada",788.9035613865333,384.20175854885713,63.15079522937585,35.66965390271348
"Sussex Parish, Kings County, New Brunswick, Canada",704.7496898446858,186.09440111344,34.25117434180148,33.78120750616119
"Division No. 7, Subd. E, Division No. 7, Newfoundland and Labrador, Canada",884.8425968805519,243.53712484367512,24.181004938076462,13.616979610748993
"Saint-Roch-de-Richelieu Municipalité, Pierre-De Saurel CRM, Quebec, Canada",2115.865813578231,658.5577936410926,94.00684961524047,73.55285694877368
"Black River-Matheson Township, Cochrane District, Ontario, Canada",460.67905692619945,150.54225973291318,18.755469469843714,7.491699155412569
"Laurier-Station Village, Lotbinière CRM, Quebec, Canada",1489.3672509264568,662.4348279930736,179.1442465922966,73.03662139882636
"O'Leary Fire District, Prince County, Prince Edward Island, Canada",362.48127522210876,90.63272371145797,13.137384613726734,11.418545341825576
"Scott Municipalité, La Nouvelle-Beauce CRM, Quebec, Canada",898.9567382067482,301.1385191981691,104.91883362663968,74.14688283983604
"Bedford Ville, Brome-Missisquoi CRM, Quebec, Canada",1293.9418821646489,873.3258546416176,218.59651450386485,70.3984295233628
"Huntingdon Ville, Le Haut-Saint-Laurent CRM, Quebec, Canada",1398.2142825838864,1060.8192529425685,225.52822067569977,72.19858355961817
"Meadow Lake No. 588 Rural Municipality, Division No. 17, Saskatchewan, Canada",322.194937516923,80.60858112633933,5.756883029676526,4.351801412762957
"Richmond, Subd. C Subdivision of County Municipality, Richmond County, Nova Scotia, Canada",775.2008999722228,204.17166626697355,22.181199370012177,16.195496043187674
"Souris-Glenwood Municipality, Division No. 7, Manitoba, Canada",803.0017370920779,594.7228428490107,123.58756254390954,32.88906124039376
"Dufferin Rural Municipality, Division No. 3, Manitoba, Canada",172.09311968469993,49.00945844923382,27.107816904738616,16.29641317146281
"Waskaganish Terres réservées aux Cris, Nord-du-Québec CDR, Quebec, Canada",2566.7384593871843,1321.1597425217526,131.0128848973891,50.45211696013082
"Saint-Bernard Municipalité, La Nouvelle-Beauce CRM, Quebec, Canada",833.9533180290837,417.58690992059843,81.13584015342516,47.01157634517722
"Tyendinaga Mohawk Territory Indian Reserve, Hastings County, Ontario, Canada",762.8708906803267,213.47530995684707,54.650982222080664,42.49303566646674
"Addington Highlands Township, Lennox and Addington County, Ontario, Canada",710.767133511022,180.34880417987057,13.24412192676805,4.993415680743031
"Saint-Léonard-d'Aston Municipalité, Nicolet-Yamaska CRM, Quebec, Canada",723.4979893979058,439.28576017616496,85.47664701764155,37.528263777877946
"Sainte-Croix Municipalité, Lotbinière CRM, Quebec, Canada",897.8891310941145,395.8888902039075,98.14246457364725,35.206745828935034
"La Ronge Town, Division No. 18, Saskatchewan, Canada",1599.146443704319,721.3889400262245,182.21492236729813,78.52030803734893
"Grey Rural Municipality, Division No. 9, Manitoba, Canada",283.6294107336696,153.46102798838373,20.575250058601956,6.893252248668552
"Cap-Chat Ville, La Haute-Gaspésie CRM, Quebec, Canada",796.3475720431969,255.6063810049532,61.28547005988236,26.50355997404176
"La Loche Northern Village, Division No. 18, Saskatchewan, Canada",2113.7640214093212,951.701484781228,157.20754245368937,49.8570980994495
"Bouctouche Town, Kent County, New Brunswick, Canada",1103.4857564238823,528.0802811336416,113.74499152743431,58.736043082357504
"Rosetown Town, Division No. 12, Saskatchewan, Canada",1467.8222384940266,1015.4331688042017,196.66656332687032,50.15101923347866
"Hébertville Municipalité, Lac-Saint-Jean-Est CRM, Quebec, Canada",1063.1652057702183,452.36876855313807,58.10941141315671,29.723100763334234
"North Shore Rural Municipality, Queens County, Prince Edward Island, Canada",994.6954760125404,249.11950284379242,34.949438742333044,29.28557586702745
"Vernon River Fire District, Queens County, Prince Edward Island, Canada",492.41100056212304,123.10275014053076,13.458336871454454,11.922768711034811
"Saint-Michel-des-Saints Municipalité, Matawinie CRM, Quebec, Canada",731.5373318900016,319.3331708499519,58.620349077524565,18.395515370039057
"Unity Town, Division No. 13, Saskatchewan, Canada",1331.8861008165377,1006.2540670265255,195.55784236618805,51.16455212806582
"Parry Sound, Unorganized, Centre Part Unorganized, Parry Sound District, Ontario, Canada",878.8037123203804,219.72644390263488,14.752578802160759,4.354992748922869
"Saint George Parish, Charlotte County, New Brunswick, Canada",864.91085726392,220.8685321195157,23.856719968689795,19.22414696531226
"Rivière-Beaudette Municipalité, Vaudreuil-Soulanges CRM, Quebec, Canada",649.8135828689111,265.7346589080792,93.29779140903645,60.11519270469001
"Fox Lake 162 Indian Reserve, Division No. 17, Alberta, Canada",2474.7437090753106,620.0369531523087,61.10251243448731,26.32295140527944
"Highlands District Municipality, Capital Regional district, British Columbia, Canada",3111.005391790002,777.7513479475004,168.8712177079535,179.82350006422118
"Magrath Town, Division No. 3, Alberta, Canada",1053.129733877883,719.8535095872355,198.8576864419693,52.72146213242061
"Pohénégamook Ville, Témiscouata CRM, Quebec, Canada",539.8433030455426,157.066234931044,27.73347051579008,15.919672046258807
"Rosthern No. 403 Rural Municipality, Division No. 15, Saskatchewan, Canada",300.3074220021445,104.2053635809796,18.935415913360846,10.946021187692295
"Holyrood Town, Division No. 1, Newfoundland and Labrador, Canada",1615.3127904187902,405.7140967280203,39.78776963612787,35.37061612979904
"Rimbey Town, Division No. 8, Alberta, Canada",1323.2165165332049,827.8727235451321,183.6890319631089,52.931220993985576
"Saint-François-Xavier-de-Brompton Municipalité, Le Val-Saint-François CRM, Quebec, Canada",1269.6524024617006,360.50522003104265,36.967264789121145,50.17338631050371
"Ville-Marie Ville, Témiscamingue CRM, Quebec, Canada",988.5547574373321,709.7390670344303,182.14246533605805,60.19515756017544
"Fraser Valley H Regional District Electoral Area, Fraser Valley Regional district, British Columbia, Canada",856.2859555552369,399.51605841618186,91.15277366465946,149.6806367039985
"Saint-Raphaël Municipalité, Bellechasse CRM, Quebec, Canada",1022.370950563715,484.98927094648457,59.20852019510273,27.923242667194977
"Sainte-Victoire-de-Sorel Municipalité, Pierre-De Saurel CRM, Quebec, Canada",1426.134004742017,402.20377970282397,93.76467402093499,112.26515682686717
"Berwick Town, Kings County, Nova Scotia, Canada",1077.0579658724823,564.8754468354454,216.68417146447828,79.67554956408621
"Saint-Damase Municipalité, Les Maskoutains CRM, Quebec, Canada",1226.9804158078496,505.8574987638608,76.12708733934632,43.62786909884786
"Cap-Pelé Village, Westmorland County, New Brunswick, Canada",1453.834047436746,367.43836344719534,77.9040300181326,50.78697967760404
"Northeastern Manitoulin and the Islands Municipality, Manitoulin District, Ontario, Canada",582.0750251823038,303.6488459178566,56.08881104301165,20.02974742926857
"Emerson-Franklin Municipality, Division No. 2, Manitoba, Canada",289.49611478775284,155.78924381114697,19.347056437745994,6.251525509600524
"Pessamit Indian Reserve, Manicouagan CRM, Quebec, Canada",1557.1908415569071,1024.4397277992032,147.37570745817598,48.04845452315698
"Sexsmith Town, Division No. 19, Alberta, Canada",1966.3498132614102,940.4466243068301,192.98317214054984,50.49826664748184
"Cowichan Indian Reserve, Cowichan Valley Regional district, British Columbia, Canada",1523.308000377495,553.5024844344525,426.0819189644893,354.1231600169353
"Sainte-Thècle Municipalité, Mékinac CRM, Quebec, Canada",848.9254807693676,355.6788077950883,75.78220280155053,34.61550814447379
"Killaloe, Hagarty and Richards Township, Renfrew County, Ontario, Canada",422.4408049669031,123.13335859432985,17.48779325632786,8.640008404159188
"Trenton Town, Pictou County, Nova Scotia, Canada",1219.476780144925,791.0499229320254,314.44672558963055,227.62173664915676
"Pembina Municipality, Division No. 4, Manitoba, Canada",527.102120554601,255.09454825532762,27.79820345395788,8.335252294186436
"Chase Village, Thompson-Nicola Regional district, British Columbia, Canada",1218.1595947757567,728.5992551938955,199.9522130228029,56.78477870059157
"Tumbler Ridge District Municipality, Peace River Regional district, British Columbia, Canada",1440.865590942322,933.0807830456979,190.11223807832417,47.52805951958104
"Nelson House 170 Indian Reserve, Division No. 22, Manitoba, Canada",2698.8705118600465,805.3402130487929,84.5316256328843,47.48457776568876
"Lunenburg Town, Lunenburg County, Nova Scotia, Canada",1122.8824955926143,775.0580027501694,201.5623622210928,73.21985098505432
"Hanna Town, Division No. 4, Alberta, Canada",1336.1718291334178,839.4371522450147,189.85017438037386,48.45756115284467
"Saint-Damien Paroisse, Matawinie CRM, Quebec, Canada",1077.2681326512281,280.47078183655685,38.1491339198301,24.1310618302263
"Léry Ville, Roussillon CRM, Quebec, Canada",1132.9125648190122,361.4711085416791,222.1947843220275,306.53272005910924
"Clearwater District Municipality, Thompson-Nicola Regional district, British Columbia, Canada",625.7727098474425,176.06962119791643,61.91667133443507,34.35316625427951
"Cowichan Valley G Regional District Electoral Area, Cowichan Valley Regional district, British Columbia, Canada",1630.9862522429794,505.9460297328013,150.3516477970325,101.81331568700593
"Salisbury Village, Westmorland County, New Brunswick, Canada",1388.773098330243,612.1337810391071,149.71942862216974,67.26930870010005
"High Prairie Town, Division No. 17, Alberta, Canada",1126.9946086573636,773.4020777448444,186.13571825546134,48.09696652047302
"Gracefield Ville, La Vallée-de-la-Gatineau CRM, Quebec, Canada",445.5823966352974,142.44206644155852,21.048040270692187,10.104907094707162
"Burrard Inlet 3 Indian Reserve, Greater Vancouver Regional district, British Columbia, Canada",10891.584023435937,2845.855104160389,1059.7382522934422,1069.733139124707
"Inkerman Parish, Gloucester County, New Brunswick, Canada",559.8841521695856,143.52194377651242,22.829445265158448,19.60050468245947
"Saint-Polycarpe Municipalité, Vaudreuil-Soulanges CRM, Quebec, Canada",1120.3305608939156,607.9912066513483,95.48917485417402,42.6785940005726
"Témiscaming Ville, Témiscamingue CRM, Quebec, Canada",1122.6230492659008,624.7896133881626,89.5456252283147,32.883995494289756
"Logy Bay-Middle Cove-Outer Cove Town, Division No. 1, Newfoundland and Labrador, Canada",1214.1620916121042,344.6552805707283,210.7005097170968,259.9346773173547
"Mandeville Municipalité, D'Autray CRM, Quebec, Canada",845.1228507555282,226.2309049902879,32.71991241817882,23.465486903700366
"Daveluyville Ville, Arthabaska CRM, Quebec, Canada",958.4731489453638,413.9334130430914,96.70915239908604,40.494513763197645
"Disraeli Ville, Les Appalaches CRM, Quebec, Canada",1118.05538259634,686.8253340429902,173.83698659212277,62.37896753423464
"Brooke-Alvinston Municipality, Lambton County, Ontario, Canada",392.31754192562886,159.71303113312302,35.40030302567249,14.600695016703373
"Anmore Village, Greater Vancouver Regional district, British Columbia, Canada",2561.4553264243577,692.455325543705,633.7386355582142,751.0336753640499
"Port McNeill Town, Mount Waddington Regional district, British Columbia, Canada",1447.5198818754652,749.8321686950345,181.8072986106458,47.80061823848554
"Esterhazy Town, Division No. 5, Saskatchewan, Canada",945.7590760735137,726.9035867548341,184.81428308867666,47.86010564360429
"Saint-Denis-sur-Richelieu Municipalité, La Vallée-du-Richelieu CRM, Quebec, Canada",1086.089117869781,492.9652551142211,72.96849278894486,45.63335913686549
"Saint-Mathieu Municipalité, Roussillon CRM, Quebec, Canada",1366.3694781560566,405.93641994787714,67.62428209723515,87.3201315799296
"Saddle Hills County Municipal District, Division No. 19, Alberta, Canada",233.23482986277827,59.08201805317274,3.9163484210827106,1.4002639775022614
"Outlook Town, Division No. 11, Saskatchewan, Canada",1373.9301185948352,892.8308880844343,188.21363110587336,48.49999062769391
"Assiniboia Town, Division No. 3, Saskatchewan, Canada",1194.7625822084858,918.0417313896941,187.0967320175439,47.488862375396046
"Fossambault-sur-le-Lac Ville, La Jacques-Cartier CRM, Quebec, Canada",828.1605235442768,368.47344504125516,150.23399049528783,115.1074703412098
"Maskinongé Municipalité, Maskinongé CRM, Quebec, Canada",807.8137626398935,436.81927399418566,87.38921819097342,44.56579057342595
"Saint-Éphrem-de-Beauce Municipalité, Beauce-Sartigan CRM, Quebec, Canada",804.2291795049092,435.0110874861868,89.89082147858186,31.466989342322517
"Sunshine Coast F Regional District Electoral Area, Sunshine Coast Regional district, British Columbia, Canada",617.8217670390095,257.66862443145595,148.70353952855433,98.49170909639216
"Saint-Victor Municipalité, Robert-Cliche CRM, Quebec, Canada",505.37866588354393,236.51374106021436,62.91454076060779,27.07691418121428
"Boissevain-Morton Municipality, Division No. 5, Manitoba, Canada",981.9527755411056,525.8799146060223,89.47330406753528,24.19106023737843
"East River, Part 1 Fire District, Queens County, Prince Edward Island, Canada",326.0751572693666,81.53258688501326,13.67642502744243,14.15512301432877
"Okanagan-Similkameen I Regional District Electoral Area, Okanagan-Similkameen Regional district, British Columbia, Canada",667.7779915862933,221.32402350658646,48.89475100311826,27.59774825757596
"Waterville Ville, Coaticook CRM, Quebec, Canada",865.6814718244005,300.4718387952405,71.81937519556092,43.7384361181256
"Chetwynd District Municipality, Peace River Regional district, British Columbia, Canada",1104.6851955515083,408.6003797722994,106.79358905379637,41.15103329384724
"Lillooet District Municipality, Squamish-Lillooet Regional district, British Columbia, Canada",984.5559847782158,417.6585222675764,122.50094437246538,49.101123450202465
"Okanagan-Similkameen G Regional District Electoral Area, Okanagan-Similkameen Regional district, British Columbia, Canada",763.7841563498516,237.2480766307301,39.89061432879987,19.867088881608613
"Kuujjuaq Village Nordique, Nord-du-Québec CDR, Quebec, Canada",924.8194590080623,563.5675840793551,126.12716899324501,42.030916927475666
"North Frontenac Township, Frontenac County, Ontario, Canada",548.0357330398715,137.00893325996788,9.208210477714593,3.856129245365789
"Gore Canton, Argenteuil CRM, Quebec, Canada",984.4355767965579,253.10808661544533,35.78605518163095,25.18283637550257
"Brigham Municipalité, Brome-Missisquoi CRM, Quebec, Canada",536.1309314539171,164.21665612863393,50.62542985828303,56.13018052938769
"Eastman Municipalité, Memphrémagog CRM, Quebec, Canada",448.3792110490701,140.70274665332013,43.280507231769285,29.487102108948054
"Saint-Pamphile Ville, L'Islet CRM, Quebec, Canada",903.7783516697424,376.61462684885754,44.29189680792355,26.730541618457398
"Beaverlodge Town, Division No. 19, Alberta, Canada",1177.2268549443277,663.142512633009,178.9131427465779,49.35115510753817
"Port-Daniel--Gascons Municipalité, Le Rocher-Percé CRM, Quebec, Canada",598.858772888496,150.59940128094922,17.691638244777813,10.35007336352854
"Sainte-Madeleine Village, Les Maskoutains CRM, Quebec, Canada",1429.7469579800693,701.6206721414618,243.55281646803198,88.45488585516803
"Ermineskin 138 Indian Reserve, Division No. 11, Alberta, Canada",2222.1506631690454,555.5376657922614,56.043421999887585,31.652882878927212
"Fermont Ville, Sept-Rivières--Caniapiscau CDR, Quebec, Canada",1703.2062179448426,1207.6936696259195,178.70101844556095,44.683191194323676
"Tsawwassen Town, Greater Vancouver Regional district, British Columbia, Canada",3854.2270378948897,1324.983525754646,762.9763102920643,445.9911632578213
"Logan Lake District Municipality, Thompson-Nicola Regional district, British Columbia, Canada",1547.5478532155344,674.3963097247902,161.123276852613,44.861799584028006
"Nominingue Municipalité, Antoine-Labelle CRM, Quebec, Canada",634.8716794050537,213.08835387375902,28.62982161222563,12.160611022920982
"Saint-Alexandre-de-Kamouraska Municipalité, Kamouraska CRM, Quebec, Canada",878.4528499588226,579.0416780995689,92.54852882924841,34.84933917604303
"Sainte-Geneviève-de-Berthier Municipalité, D'Autray CRM, Quebec, Canada",770.2980568193498,213.9172415223999,85.99322417090133,89.39872846725183
"Mansfield-et-Pontefract Municipalité, Pontiac CRM, Quebec, Canada",807.5303947049559,330.4492349454167,101.98001523226749,41.32796743732199
"Paquetville Parish, Gloucester County, New Brunswick, Canada",824.5069219680914,206.12673049202286,17.931704496042798,15.000362228352419
"East Broughton Municipalité, Les Appalaches CRM, Quebec, Canada",950.557145524079,707.2936293035483,174.24191839684426,48.360933931450575
"Fort Smith Town, Region 5 Region, Northwest Territories, Canada",762.7565782264336,399.4573844281395,113.37948935279574,40.885262355984196
"Saint-Marc-sur-Richelieu Municipalité, La Vallée-du-Richelieu CRM, Quebec, Canada",1341.2242978338238,361.06294480328773,50.8987078572388,45.215148370266654
"Central Kootenay A Regional District Electoral Area, Central Kootenay Regional district, British Columbia, Canada",458.670768186755,154.07164357973764,24.19602558531605,7.665670136373742
"Neebing Municipality, Thunder Bay District, Ontario, Canada",532.0698178544241,133.01745446360601,9.279777170505353,4.5963180553165435
"Burin Town, Division No. 2, Newfoundland and Labrador, Canada",970.5511751114083,249.60446880134714,48.61393784202902,32.6384046961825
