"Point May Town, Division No. 2, Newfoundland and Labrador, Canada",667.6587458360858,166.91468645902145,10.43216790368884,4.491584333931018
"Saint-Cléophas-de-Brandon Municipalité, D'Autray CRM, Quebec, Canada",367.5351315747328,91.8837828936832,12.662530186899868,14.39709975860908
"Laurier No. 38 Rural Municipality, Division No. 2, Saskatchewan, Canada",51.513359604383936,12.878339901095984,3.6011164890496254,3.0222139737124043
"Moricetown 1 Indian Reserve, Kitimat-Stikine Regional district, British Columbia, Canada",334.1423431313669,112.41245735474043,32.89286033355346,12.18219429279926
"Notre-Dame-de-Lourdes Parish, Madawaska County, New Brunswick, Canada",323.755124078666,80.9387810196665,7.788212541301226,5.778488215440228
"Redburn No. 130 Rural Municipality, Division No. 6, Saskatchewan, Canada",38.227381746277864,9.556845436569466,1.5487726082697475,2.0628808187118493
"Young Village, Division No. 11, Saskatchewan, Canada",374.5639242511806,211.2621456459976,20.523124272338105,5.3800504206543405
"Alexandra Rural Municipality, Queens County, Prince Edward Island, Canada",390.41970674910914,99.17121342881656,49.55718618885616,55.11087266535846
"Bishop's Cove Town, Division No. 1, Newfoundland and Labrador, Canada",674.8169587096362,201.21732090903913,88.08184014199496,73.18569534927495
"Brock No. 64 Rural Municipality, Division No. 1, Saskatchewan, Canada",69.96754450592275,17.491886126480686,2.500058897735189,1.933937817917738
"Fox Cove-Mortier Town, Division No. 2, Newfoundland and Labrador, Canada",735.8516162509092,183.9629040627273,14.170474040289111,8.81620491807754
"Gamètì Community Government, Region 3 Region, Northwest Territories, Canada",692.6018920329211,181.84083815483535,11.800833776476447,5.013380707394704
"Lake of the Rivers No. 72 Rural Municipality, Division No. 3, Saskatchewan, Canada",61.51970117736248,21.240869230423105,8.219531773291555,5.089563505055256
"Lost River No. 313 Rural Municipality, Division No. 11, Saskatchewan, Canada",205.65850170198442,51.414625425496105,3.2134140890935066,0.9458508795555547
"Baytona Town, Division No. 8, Newfoundland and Labrador, Canada",1278.3325029141033,319.58312572852583,19.973945358032864,10.185916357881302
"Big Grassy River 35G Indian Reserve, Rainy River District, Ontario, Canada",437.081323237293,109.27033080932326,11.042880125166946,5.092958178940652
"Division No. 2, Subd. E, Division No. 2, Newfoundland and Labrador, Canada",245.69972346132406,64.16417132013973,9.819099088643608,14.687433209455559
"Key West No. 70 Rural Municipality, Division No. 2, Saskatchewan, Canada",39.38419053913867,10.099681010229919,1.4301751957919113,1.2833056193231465
"Pinto Creek No. 75 Rural Municipality, Division No. 3, Saskatchewan, Canada",55.08916914670865,14.279559037567662,1.7389738303965052,1.085867888624983
"Saint-Elphège Paroisse, Nicolet-Yamaska CRM, Quebec, Canada",242.94019233647975,60.73504808411994,6.919752565585076,7.282369032041959
"Padoue Municipalité, La Mitis CRM, Quebec, Canada",295.2693433822632,73.8173358455658,5.453921589873069,4.4431285462964425
"Sakimay 74 Indian Reserve, Division No. 5, Saskatchewan, Canada",210.44103195382772,52.61025798845693,4.080732740876197,3.116253785739311
"Milton No. 292 Rural Municipality, Division No. 13, Saskatchewan, Canada",202.51156196663223,71.51106439004514,5.1245974146155415,1.542013253852199
"Czar Village, Division No. 7, Alberta, Canada",390.72025126018076,233.00283668653478,21.039577547565496,5.683451896732708
"Golden Days Summer Village, Division No. 11, Alberta, Canada",333.75304969412684,153.82581951352796,23.98715276377951,11.16651616854427
"Williams Lake 1 Indian Reserve, Cariboo Regional district, British Columbia, Canada",258.5086998246166,78.9921920778033,17.48265709560247,15.214057402740172
"Willowdale No. 153 Rural Municipality, Division No. 5, Saskatchewan, Canada",47.72594680587934,11.931486701469835,1.3425489554364718,4.56046296107573
"Halfway River 168 Indian Reserve, Peace River Regional district, British Columbia, Canada",1005.9932655560137,251.49831638900343,15.718644774312715,3.9296611935781787
"Peawanuck Indian Settlement, Kenora District, Ontario, Canada",592.9481714647623,179.53708543959914,19.655635471849074,4.9139088679622684
"Saint-François-Xavier-de-Viger Municipalité, Rivière-du-Loup CRM, Quebec, Canada",248.07036376856266,62.017590942140664,5.238259554111592,2.9049804314247925
"Sainte-Paule Municipalité, La Matanie CRM, Quebec, Canada",359.00200345561,89.7505008639025,8.58566817501198,2.909410351399516
"Waskatenau Village, Division No. 12, Alberta, Canada",541.9773511475912,296.3967634928223,21.07320986376069,6.809753529144977
"Chipman Village, Division No. 10, Alberta, Canada",470.16699286074055,195.05408732881847,19.878517089309064,6.509825355246548
"Lejeune Municipalité, Témiscouata CRM, Quebec, Canada",339.9446069032743,84.98615172581857,5.890673808340272,2.157649330127931
"Main Brook Town, Division No. 9, Newfoundland and Labrador, Canada",338.9508589659201,111.78629141134162,9.648283196461119,2.525290778957075
"Prairiedale No. 321 Rural Municipality, Division No. 13, Saskatchewan, Canada",345.24459590249677,86.31114897562419,5.89099729399696,1.8467796140480297
"Quatsino Subdivision 18 Indian Reserve, Mount Waddington Regional district, British Columbia, Canada",639.8494531639827,313.2169280048501,19.57605800030313,8.355634512324505
"Nanoose Indian Reserve, Nanaimo Regional district, British Columbia, Canada",616.3103024050301,241.72842524004636,110.62860094317645,92.40308631711024
"Skwah 4 Indian Reserve, Fraser Valley Regional district, British Columbia, Canada",629.7806570987182,734.2018904553045,1139.5334770436618,721.2876036444193
"Bear Island 1 Indian Reserve, Nipissing District, Ontario, Canada",684.8358928321423,171.2089732080356,19.416903057211233,4.854225764302808
"Cottlesville Town, Division No. 8, Newfoundland and Labrador, Canada",868.8503162155062,217.21257905387654,14.309594842418033,8.207160561827404
"Hazelwood No. 94 Rural Municipality, Division No. 1, Saskatchewan, Canada",43.54061787405819,10.885154468514548,0.7863167372839337,0.5239393772072333
"Katzie 1 Indian Reserve, Greater Vancouver Regional district, British Columbia, Canada",699.8225484570579,660.1851403348927,681.5461471129457,845.8184271378722
"Kelliher Village, Division No. 10, Saskatchewan, Canada",302.9475205292811,190.79807669547745,20.168649253577666,5.521991637213988
"Neskantaga Indian Reserve, Kenora District, Ontario, Canada",627.394003863107,156.84850096577674,19.416903057211233,4.854225764302808
"Schefferville Ville, Sept-Rivières--Caniapiscau CDR, Quebec, Canada",608.4623929274546,488.9239851783024,69.27642876406752,18.422184662886885
"Woody Point, Bonne Bay Town, Division No. 9, Newfoundland and Labrador, Canada",744.6155330964293,186.15388327410733,19.09989771974131,6.376715647681374
"Edenwold Village, Division No. 6, Saskatchewan, Canada",414.2482238961398,255.04088411516065,20.101989766981283,5.97355003485445
"Marten Falls 65 Indian Reserve, Kenora District, Ontario, Canada",1237.5888374825781,309.39720937064453,19.337325585665283,4.834331396416321
"North Tacla Lake Indian Reserve, Bulkley-Nechako Regional district, British Columbia, Canada",445.47665059005567,156.5036706242575,19.337325585665287,4.834331396416322
"Opaskwayak Cree Nation 21A Indian Reserve, Division No. 21, Manitoba, Canada",1225.4118469395144,1431.288917687391,407.01322357159404,133.10306366997398
"Bridge River 1 Indian Reserve, Squamish-Lillooet Regional district, British Columbia, Canada",459.2501379373673,116.4961570228346,8.540438392526251,3.4997645853864503
"Fort Ware 1 Indian Reserve, Peace River Regional district, British Columbia, Canada",591.8354128436735,154.0619849129547,19.257748114119337,4.814437028529834
"Skeetchestn Indian Reserve, Thompson-Nicola Regional district, British Columbia, Canada",419.3482837750885,104.83707094377212,6.552316933985757,4.214482082928257
"Glenburnie-Birchy Head-Shoal Brook Town, Division No. 9, Newfoundland and Labrador, Canada",568.9954314023943,142.24885785059857,17.65266060712825,4.794542660643346
"Mount Waddington D Regional District Electoral Area, Mount Waddington Regional district, British Columbia, Canada",297.5682328533747,202.4556539161667,14.601640536237973,3.969050217220653
"Notre-Dame-des-Anges Paroisse, Québec Territory, Quebec, Canada",6743.076628917422,7928.462645065858,5578.5399103140235,2956.3030679319554
"Lake Helen 53A Indian Reserve, Thunder Bay District, Ontario, Canada",492.0646427219826,260.0803976712359,32.524638912021246,29.820662743449567
"Saint-Gérard-Majella Paroisse, Pierre-De Saurel CRM, Quebec, Canada",209.06593324551375,52.26648331137844,6.635434835739604,10.584383968007728
"Albertville Municipalité, La Matapédia CRM, Quebec, Canada",314.4209118421309,78.60522796053273,4.9511171627123085,2.482633984160972
"Teslin Village, Yukon Territory, Yukon, Canada",182.43018815862314,97.83700518435674,20.303242928572374,5.132746914713625
"Little Burnt Bay Town, Division No. 8, Newfoundland and Labrador, Canada",1114.5446797980878,278.63616994952196,18.939438227935543,4.762444184725655
"Pangman Village, Division No. 2, Saskatchewan, Canada",555.3464313439822,276.6353649506524,19.337325585665283,4.933803235848755
"Paynton No. 470 Rural Municipality, Division No. 17, Saskatchewan, Canada",70.74504092259578,17.686260230648944,1.6928602455341721,1.0485502133113105
"Buchanan Village, Division No. 9, Saskatchewan, Canada",500.4637258622313,275.2722406442405,19.123440145265413,5.4070709410977535
"Hughes Brook Town, Division No. 5, Newfoundland and Labrador, Canada",616.5500642895524,300.4845325574984,19.178170642573388,6.90334565661096
"Kenosee Lake Village, Division No. 1, Saskatchewan, Canada",690.3116365591252,251.76693472292843,26.52492466817977,8.673944398508295
"Old Crow Settlement, Yukon Territory, Yukon, Canada",559.5779897454706,142.80784215737185,18.78028328484365,4.695070821210913
"West Point Fire District, Prince County, Prince Edward Island, Canada",146.5254904162457,36.766823619458776,7.772179263500386,5.659482050840099
"Heart's Hill No. 352 Rural Municipality, Division No. 13, Saskatchewan, Canada",41.9189634728192,10.4797408682048,0.7740099369169953,0.42730381622856084
"Rainy Lake 17A Indian Reserve, Rainy River District, Ontario, Canada",325.0352027534174,104.92799735330289,15.753618768779829,4.655282085437939
"Aupaluk Village Nordique, Nord-du-Québec CDR, Quebec, Canada",432.2456995216797,159.42817046201017,12.660331728483838,4.635387717551451
"Fort San Resort Village, Division No. 6, Saskatchewan, Canada",305.07475237542775,80.01190306443027,42.78979689947272,42.96133245777295
"La Trinité-des-Monts Paroisse, Rimouski-Neigette CRM, Quebec, Canada",169.7725586945581,45.88580453708653,2.867862783567908,2.261554172572442
"Norton No. 69 Rural Municipality, Division No. 2, Saskatchewan, Canada",48.066158950602976,12.83622184799527,1.259919710442064,0.5425270967842828
"Osnaburgh 63A Indian Reserve, Thunder Bay District, Ontario, Canada",425.7319590181419,106.43298975453547,12.475903253656318,4.635387717551451
"Parkers Cove Town, Division No. 2, Newfoundland and Labrador, Canada",890.8742339016485,296.66481392329285,18.541550870205803,6.0876765732649964
"Kennedy Village, Division No. 1, Saskatchewan, Canada",348.86763525743464,230.8844295129668,20.053522829578817,5.311796225692007
"Portage-du-Fort Village, Pontiac CRM, Quebec, Canada",295.65500324988227,139.79292104954337,18.41223747894364,7.046293550002225
"Saint-Jean-de-la-Lande Municipalité, Témiscouata CRM, Quebec, Canada",198.66927379057282,49.667318447643204,4.0519339283287925,2.306288897875283
"Upper Sumas 6 Indian Reserve, Fraser Valley Regional district, British Columbia, Canada",732.7713104010298,248.02925855500405,123.71930081629056,334.2169768375799
"Chippewas of Georgina Island First Nation Indian Reserve, York Regional municipality, Ontario, Canada",262.7834135705351,65.69585339263378,14.79624233926406,11.726739456829948
"St. Peters Bay Rural Municipality, Kings County, Prince Edward Island, Canada",219.7909094625946,56.876878191004955,16.95137940416211,9.488924499416632
"Grandview No. 349 Rural Municipality, Division No. 13, Saskatchewan, Canada",36.536439109791615,9.410900982825117,0.7784752651234017,0.4043746516057667
"Scotchfort 4 Indian Reserve, Queens County, Prince Edward Island, Canada",982.0551966783386,280.38949104711304,18.67475663779359,13.729276272967985
"Sutton No. 103 Rural Municipality, Division No. 3, Saskatchewan, Canada",35.42927428828278,9.687692188202323,0.8649725168037797,0.395724926437729
"T'Sou-ke Indian Reserve, Capital Regional district, British Columbia, Canada",601.5226475257513,321.5870940554568,304.0575610299114,242.633181196873
"Thompson-Nicola B (Thompson Headwaters) Regional District Electoral Area, Thompson-Nicola Regional district, British Columbia, Canada",205.5340774649006,104.7488637629511,11.071648215088372,2.767912053772093
"Alleyn-et-Cawood Municipalité, Pontiac CRM, Quebec, Canada",280.55749968269134,70.13937492067284,4.383710932542052,1.1298089710207966
"Division No. 18, Unorganized, East Part, Division No. 18, Manitoba, Canada",546.103004733134,136.5257511832835,8.532859448955218,2.4395360027093416
"Earl Grey Village, Division No. 6, Saskatchewan, Canada",551.4406028246001,275.3922615295954,19.04507819016248,5.394153696243926
"Finlay River 6 Indian Reserve, Peace River Regional district, British Columbia, Canada",438.1056033491348,109.5264008372837,18.22324098402202,4.555810246005505
"Rushoon Town, Division No. 2, Newfoundland and Labrador, Canada",434.1024047805352,108.5256011951338,26.537523011132688,8.693838766394784
"Seba Beach Summer Village, Division No. 11, Alberta, Canada",360.7549110069707,130.94351317929178,31.549513719024404,12.007250081637626
"Tyne Valley Rural Municipality, Prince County, Prince Edward Island, Canada",241.05927380584154,125.61703508384947,21.13077244439295,14.515504184775837
"Skweahm 10 Indian Reserve, Fraser Valley Regional district, British Columbia, Canada",1161.1944647984685,290.29861619961713,47.10986315520101,16.313381666919273
"Gainsborough Village, Division No. 1, Saskatchewan, Canada",394.8052205939146,243.64868979625874,19.138557187574747,5.108032325533056
"Nautley (Fort Fraser) 1 Indian Reserve, Bulkley-Nechako Regional district, British Columbia, Canada",241.43314080872398,96.27822372413686,15.550559737033888,7.730057428739732
"Rivière-Saint-Jean Municipalité, Minganie--Le Golfe-du-Saint-Laurent CDR, Quebec, Canada",292.0486194505307,79.29421781462993,7.86625059039436,2.0515738231487766
"Dakota Tipi 1 Indian Reserve, Division No. 9, Manitoba, Canada",634.8169553130892,225.04790643358768,38.318665225609536,81.09701392849873
"Donalda Village, Division No. 7, Alberta, Canada",484.4169425420718,247.13241535111788,18.01971983997973,4.993486339508217
"Fox Harbour Town, Division No. 1, Newfoundland and Labrador, Canada",604.529628797619,151.13240719940475,9.956338873598302,4.496127142346045
"Gull Lake Summer Village, Division No. 8, Alberta, Canada",373.36341198534825,137.7802933895714,20.838734163859623,10.21434945888721
"Lebret Village, Division No. 6, Saskatchewan, Canada",286.1070665479226,152.63663267924673,27.955284063926655,7.74832812272772
"Mount Stewart Rural Municipality, Queens County, Prince Edward Island, Canada",378.6817222961005,102.27606502266435,23.60352313102237,16.233099969961412
"South Lake Resort Village, Division No. 7, Saskatchewan, Canada",191.68452331889017,101.20564239655957,26.590143102937102,9.798768437683206
"Caledonia No. 99 Rural Municipality, Division No. 2, Saskatchewan, Canada",34.518938768375506,8.629734692093876,1.731252103188506,2.7268546916411402
"Lougheed Village, Division No. 7, Alberta, Canada",619.5074328863409,268.65354393911934,19.098593171027442,5.625685141234358
"Aguanish Municipalité, Minganie--Le Golfe-du-Saint-Laurent CDR, Quebec, Canada",185.4382451224998,49.03109068252462,3.820429147344292,2.3292396972812766
"Brunswick Parish, Queens County, New Brunswick, Canada",311.9891613009982,77.99729032524955,4.874830645328097,1.2187076613320242
"Coutts Village, Division No. 2, Alberta, Canada",516.2986353901085,264.6405657311594,17.82535362629228,4.659722792555459
"Fillmore No. 96 Rural Municipality, Division No. 2, Saskatchewan, Canada",49.70181508555474,12.425453771388685,0.7854722749468317,1.080512855834821
"Waiwakum 14 Indian Reserve, Squamish-Lillooet Regional district, British Columbia, Canada",1209.3729397144293,541.1268065124442,222.76327658667384,122.94719353848915
"Annandale - Little Pond - Howe Bay Rural Municipality, Kings County, Prince Edward Island, Canada",168.79844798453072,42.19961199613268,7.0931004570349865,4.879294452088022
"Chaplin Village, Division No. 7, Saskatchewan, Canada",481.26160665683324,213.22747655028772,17.66619868320038,4.416549670800095
"Reford No. 379 Rural Municipality, Division No. 13, Saskatchewan, Canada",46.61662621444778,11.654156553611944,1.5940586304722046,2.081022572342339
"Saint-Charles-Garnier Paroisse, La Mitis CRM, Quebec, Canada",309.2480912257657,77.31202280644142,4.832001425402589,2.7197930871841347
"West Cove Summer Village, Division No. 13, Alberta, Canada",468.3227399319569,155.0255175414029,21.307405692046043,11.130629989680154
"Becher Bay 1 Indian Reserve, Capital Regional district, British Columbia, Canada",1075.766428738138,268.9416071845345,22.600722077162676,48.80862612527294
"Daniel's Harbour Town, Division No. 9, Newfoundland and Labrador, Canada",421.65063759647734,229.65768915536688,17.507043740108486,4.3767609350271215
"Eyebrow No. 193 Rural Municipality, Division No. 7, Saskatchewan, Canada",40.512167332482456,10.128041833120614,0.8048176099533345,0.5064020916560306
"Hazelbrook Rural Municipality, Queens County, Prince Edward Island, Canada",264.83382530491383,68.66812362855775,35.29405549374681,36.64768637053237
"Kippase 2 Indian Reserve, Mount Waddington Regional district, British Columbia, Canada",1120.450799366943,514.157277973963,51.16831420404434,21.30686800642749
"Lac-Édouard Municipalité, La Tuque Territory, Quebec, Canada",726.9040309942566,181.72600774856414,11.357875484285259,2.8394688710713147
"Odessa Village, Division No. 6, Saskatchewan, Canada",516.935255162476,245.7931066586471,18.234092457414647,5.073063811054164
"Souris Valley No. 7 Rural Municipality, Division No. 2, Saskatchewan, Canada",35.882205351627306,9.259923961710271,0.7596031374840462,0.3820622923654875
"Amisk Village, Division No. 7, Alberta, Canada",400.71580996039427,230.30519673787217,19.396917847462248,5.670439898823743
"Belcourt Municipalité, La Vallée-de-l'Or CRM, Quebec, Canada",287.22888798217343,77.6211011952473,4.923992314699255,1.7725064210097385
"Buffalo Point 36 Indian Reserve, Division No. 1, Manitoba, Canada",542.2023741643894,141.8295830767776,17.42746626856254,4.356866567140635
"Cochin Resort Village, Division No. 17, Saskatchewan, Canada",353.08851155641963,199.19512914025637,34.65762401178513,16.353170402692246
"L'Anse-au-Clair Town, Division No. 10, Newfoundland and Labrador, Canada",580.0158444792638,145.00396111981595,13.42315696976645,3.3557892424416127
"Manitoulin, Unorganized, West Part Unorganized, Manitoulin District, Ontario, Canada",201.46254202814094,50.365635507035236,3.2205257091860013,1.2838680426471214
"Stone 1 Indian Reserve, Cariboo Regional district, British Columbia, Canada",535.179208091147,165.65486003716435,10.353428752322772,4.356866567140635
"Stony Rapids Northern Hamlet, Division No. 18, Saskatchewan, Canada",600.945809598198,150.2364523995495,17.42746626856254,4.356866567140635
"Grand-Métis Municipalité, La Mitis CRM, Quebec, Canada",165.63795178297806,41.409487945744516,44.71706349472539,22.768830270379418
"Lamaline Town, Division No. 2, Newfoundland and Labrador, Canada",523.4533071437809,130.86332678594522,11.30219116516345,3.678906663339207
"St. Nicholas Rural Municipality, Prince County, Prince Edward Island, Canada",357.5350090390262,89.38375225975655,9.079132441700965,8.875899610126623
"Wells District Municipality, Cariboo Regional district, British Columbia, Canada",261.79674015233456,133.52661684282242,12.261501234992577,3.2846696483409334
"Kitasoo 1 Indian Reserve, Kitimat-Stikine Regional district, British Columbia, Canada",766.455001150529,191.61375028763226,17.268311325470645,4.317077831367661
"Sainte-Jeanne-d'Arc Paroisse, La Mitis CRM, Quebec, Canada",180.7413407189952,45.1853351797488,3.058781982326035,2.7796190781124284
"Bittern Lake Village, Division No. 10, Alberta, Canada",369.47525307407403,137.2858749855645,16.949264610846612,6.109136701586994
"Cowley Village, Division No. 3, Alberta, Canada",516.5579990010731,218.51384223765035,17.697145477690473,5.066248147981941
"Morse Town, Division No. 7, Saskatchewan, Canada",453.6505340871209,220.67127591067384,17.207154564930704,4.681255287956407
"Oakdale No. 320 Rural Municipality, Division No. 13, Saskatchewan, Canada",37.86708720082724,9.46677180020681,2.3526932096871374,1.0537567730985964
"Saint-Médard Municipalité, Les Basques CRM, Quebec, Canada",264.69235424438773,66.17308856109693,4.135818035068558,3.2858864292514225
"Dodsland Village, Division No. 13, Saskatchewan, Canada",490.32158765531415,214.72740768628958,17.507043740108486,4.8500618268381945
"Hilliard Township, Timiskaming District, Ontario, Canada",143.7161733564322,36.22514555881391,4.72986283202635,3.129060206741589
"Scott No. 98 Rural Municipality, Division No. 2, Saskatchewan, Canada",33.755653046467096,8.438913261616774,1.2991484889594245,2.243436973990117
"Slosh 1 Indian Reserve, Squamish-Lillooet Regional district, British Columbia, Canada",556.3642267385072,139.0910566846268,10.830308813516162,2.8866265143574226
"Torquay Village, Division No. 2, Saskatchewan, Canada",554.9429360839192,238.21423575335777,17.603276961512883,4.881060027963651
"Ham-Sud Municipalité, Les Sources CRM, Quebec, Canada",143.4119905901699,36.447969397418724,2.2779980873386703,2.038707886685318
"Homalco 9 Indian Reserve, Strathcona Regional district, British Columbia, Canada",551.800599705224,272.4732625733248,411.8929927218251,307.78753189422156
"Silver Sands Summer Village, Division No. 13, Alberta, Canada",391.6818023785291,120.66027087490235,16.038950947288853,8.379526346655474
"Veteran Village, Division No. 4, Alberta, Canada",348.36785898753857,205.27715314230178,17.793745752080106,5.252113122032548
"Chance Cove Town, Division No. 1, Newfoundland and Labrador, Canada",860.0404353911562,215.01010884778904,13.438131802986815,4.274860675101501
"Dauphin River 48A Indian Reserve, Division No. 19, Manitoba, Canada",1084.8000921143587,271.20002302858967,17.34788879701659,4.336972199254148
"Grand Rapids Town, Division No. 21, Manitoba, Canada",198.38626296089478,63.53644657741806,16.742278086331233,17.891294582761102
"Gros-Mécatina Municipalité, Minganie--Le Golfe-du-Saint-Laurent CDR, Quebec, Canada",533.899827124722,133.4749567811805,8.342184798823782,2.0855461997059455
"Hughenden Village, Division No. 7, Alberta, Canada",522.4705594743293,266.77656169946283,18.879661723487885,5.409213247784054
"Jarvis Bay Summer Village, Division No. 8, Alberta, Canada",467.23706936469137,188.11068184634195,60.07463976359293,174.19144258333966
"Maple Bush No. 224 Rural Municipality, Division No. 7, Saskatchewan, Canada",96.38363577140728,35.89579092081995,3.222327192881686,0.9741702209204627
"Moose Point 79 Indian Reserve, Muskoka District municipality, Ontario, Canada",562.4969068524828,140.6242267131207,8.789014169570043,4.237500359821714
"Okanese 82 Indian Reserve, Division No. 6, Saskatchewan, Canada",417.4551964606799,104.36379911516997,6.522737444698123,2.6568788211220977
"Spalding Village, Division No. 14, Saskatchewan, Canada",472.25829573829486,235.09501434220286,17.93444574690926,5.084178504849902
"Union Road Rural Municipality, Queens County, Prince Edward Island, Canada",496.07325511024266,124.01831377756066,31.347919741811413,28.927158113257573
"Division No. 17, Unorganized, Division No. 17, Manitoba, Canada",248.8822959142696,81.4392840877774,18.293434319772455,12.285710583485224
"Punnichy Village, Division No. 10, Saskatchewan, Canada",473.21268966402334,252.69000285465677,16.8704239677409,4.702765812563233
"Birchcliff Summer Village, Division No. 8, Alberta, Canada",535.1468046696359,257.6107554705632,24.11197387842215,13.114442739655159
"Division No. 10, Subd. B, Division No. 10, Newfoundland and Labrador, Canada",323.17354055846624,80.79338513961656,5.049586571226035,1.2623966428065088
"Heart Lake 167 Indian Reserve, Division No. 12, Alberta, Canada",886.585056259095,221.64626406477376,13.85289150404836,3.7140239119270437
"Launay Canton, Abitibi CRM, Quebec, Canada",285.56771665898975,71.39192916474744,4.461995572796715,1.2663566591630608
"Surprise Valley No. 9 Rural Municipality, Division No. 2, Saskatchewan, Canada",59.30520495572123,16.757280643267997,1.511217670543186,0.6686770476349063
"Jean Baptiste Gambler 183 Indian Reserve, Division No. 17, Alberta, Canada",363.8312314307983,162.80489645346947,19.224401364138178,8.972359916805598
"Lytton Village, Thompson-Nicola Regional district, British Columbia, Canada",283.7020227487987,111.22050575534203,27.78352683941589,10.652012976936136
"Mattagami 71 Indian Reserve, Sudbury District, Ontario, Canada",338.46344926331295,128.54868965464246,16.71126902464901,4.177817256162252
"Passes-Dangereuses Unorganized, Maria-Chapdelaine CRM, Quebec, Canada",306.6445867358361,76.66114668395903,4.7913216677474395,1.9691634804215095
"Terrell No. 101 Rural Municipality, Division No. 3, Saskatchewan, Canada",49.71697269918256,12.42924317479564,0.9094568176679735,0.31025740394402224
"Beechy Village, Division No. 7, Saskatchewan, Canada",343.4700743165956,190.73615744551776,16.631691553103064,4.679079176211249
"Sik-e-dakh 2 Indian Reserve, Kitimat-Stikine Regional district, British Columbia, Canada",377.098219230175,266.107064849649,17.0295789108328,4.555810246005504
