"Strasbourg Town, Division No. 6, Saskatchewan, Canada",1188.0811475705411,691.3852306534363,63.35487686750531,16.23143100935641
"Gagetown Village, Queens County, New Brunswick, Canada",893.7009116516937,254.04769055936202,36.703010615200405,14.951413746985164
"Lacadena No. 228 Rural Municipality, Division No. 8, Saskatchewan, Canada",192.65877756701644,58.90714747566961,4.603359554765961,1.3628021183334125
"Notre-Dame-de-Lourdes Paroisse, L'Érable CRM, Quebec, Canada",658.0011368189408,164.5002842047352,11.818821806414348,9.638884437851344
"Saint-Sylvère Municipalité, Bécancour CRM, Quebec, Canada",658.0153803915788,164.5038450978947,10.6549779681515,11.03902026324268
"Carmanville Town, Division No. 8, Newfoundland and Labrador, Canada",1280.2553544714585,320.06383861786463,27.83831078581351,17.15158416695299
"Hepburn Town, Division No. 15, Saskatchewan, Canada",846.821227411155,652.015577066675,67.82193016257335,18.725015512832464
"Queen Charlotte Village, Skeena-Queen Charlotte Regional district, British Columbia, Canada",768.3091195659039,252.9134448733372,49.16040407378678,15.339166651743247
"Saint-Charles-de-Bourget Municipalité, Le Saguenay-et-son-Fjord CDR, Quebec, Canada",1159.882248532976,289.970562133244,21.423696666822114,20.6359913505819
"Saugeen 29 Indian Reserve, Bruce County, Ontario, Canada",317.53684788877297,116.04668993443343,31.263390122352362,28.263730527671868
"La Durantaye Paroisse, Bellechasse CRM, Quebec, Canada",945.4406047576168,236.71835157283354,18.897716024183833,16.59905156077779
"La Corne Municipalité, Abitibi CRM, Quebec, Canada",1061.8883265278648,265.4720816319662,22.619231436594948,8.819444338449312
"Normétal Municipalité, Abitibi-Ouest CRM, Quebec, Canada",705.5252708142772,367.4065267262777,40.00619297670994,15.36750420146792
"Radville Town, Division No. 2, Saskatchewan, Canada",820.8041828080367,542.6651679161088,62.78478392573236,16.301209791451445
"Blissville Parish, Sunbury County, New Brunswick, Canada",492.9550910728309,123.23877276820772,8.059856213965825,4.557756155863126
"Marston Canton, Le Granit CRM, Quebec, Canada",423.08258890100666,107.7993094599777,22.82531779730021,48.899946599751665
"Clive Village, Division No. 8, Alberta, Canada",937.7548892601963,481.000327985712,65.05196463329683,18.354133089639042
"Drift Pile River 150 Indian Reserve, Division No. 17, Alberta, Canada",1325.897446525939,331.4743616314847,26.99329443203613,7.306957458261586
"Fort Albany (Part) 67 Indian Reserve, Cochrane District, Ontario, Canada",1003.2733318976651,562.6650909401576,61.67254044810946,15.418135112027365
"Alix Village, Division No. 8, Alberta, Canada",865.8028904199107,482.2139798773015,62.58305477370496,16.74293551203421
"Cudworth Town, Division No. 15, Saskatchewan, Canada",895.3974634648946,574.7093241418448,61.53431066916759,16.072896898633395
"Sainte-Christine Paroisse, Acton CRM, Quebec, Canada",415.16845092887706,103.79211273221927,9.6698997483489,8.65861130408801
"Hatley Municipalité, Memphrémagog CRM, Quebec, Canada",443.3383763678362,118.37329515773858,30.122911346506324,16.52628494763445
"Lac-Delage Ville, La Jacques-Cartier CRM, Quebec, Canada",1472.406577229637,506.24565779143745,99.67207327782906,81.84088809882299
"Alexis 133 Indian Reserve, Division No. 13, Alberta, Canada",1682.7266107847936,420.6816526961984,26.45899255219938,11.053439981939185
"Herbert Town, Division No. 7, Saskatchewan, Canada",798.9859248047699,513.5586900321525,61.61621613383345,15.7754586287418
"Saint-Mathieu-d'Harricana Municipalité, Abitibi CRM, Quebec, Canada",456.4084236098969,114.10210590247422,11.84815538690081,11.03457908770914
"Notre-Dame-Auxiliatrice-de-Buckland Paroisse, Bellechasse CRM, Quebec, Canada",637.1377003179822,159.3259257165469,10.578408632794366,9.108170751556115
"Lepreau Parish, Charlotte County, New Brunswick, Canada",314.4469505415394,80.88894152087727,12.425305361333589,7.197190145211109
"Mannville Village, Division No. 10, Alberta, Canada",798.7555939230332,525.8346170522786,62.501602471928,16.534950313184464
"Saint-Samuel Municipalité, Arthabaska CRM, Quebec, Canada",426.43039246494834,121.81656930550498,20.55480888889897,15.730827764925552
"Carleton Parish, Kent County, New Brunswick, Canada",723.4000466783791,180.85001166959478,13.56931296550829,3.6770208121924672
"Cascapédia--Saint-Jules Municipalité, Bonaventure CRM, Quebec, Canada",824.5259309382346,206.13148273455866,19.294203762078865,12.229281465761556
"Mount Waddington C Regional District Electoral Area, Mount Waddington Regional district, British Columbia, Canada",1184.7260647613748,296.1815161903437,27.347152237345092,12.12887219538159
"Salmon Cove Town, Division No. 1, Newfoundland and Labrador, Canada",451.7267251802805,175.12043371828648,62.13000675050447,34.176024213124435
"Chapple Township, Rainy River District, Ontario, Canada",207.3828540779909,51.84571351949773,6.010028568591395,3.1696968892380983
"Cross Lake 19E Indian Reserve, Division No. 22, Manitoba, Canada",1316.8867970708022,329.22169926770056,117.35966606718823,71.46427193874577
"Gordon 86 Indian Reserve, Division No. 10, Saskatchewan, Canada",602.6845176077722,150.67112940194306,15.99569755377516,7.045083250098434
"Saint-Honoré-de-Témiscouata Municipalité, Témiscouata CRM, Quebec, Canada",510.53067669236657,127.63266917309164,10.799278232274117,8.753208983534403
"Pouce Coupe Village, Peace River Regional district, British Columbia, Canada",717.1246034244582,432.36006776573726,63.43901411110119,17.398486283846008
"Ogden Municipalité, Memphrémagog CRM, Quebec, Canada",360.7701662971796,90.1925415742949,12.935155916901682,16.82472704912648
"Sedgewick Town, Division No. 7, Alberta, Canada",738.9340228795979,507.661185784727,63.41738892408275,16.463726620552894
"Marktosis 15 Indian Reserve, Alberni-Clayoquot Regional district, British Columbia, Canada",1145.1918540993759,402.38055307050115,60.47887837492023,15.119719593730057
"Big Island Lake Cree Territory Indian Reserve, Division No. 17, Saskatchewan, Canada",2163.0712668267292,540.7678167066823,33.91856047075241,14.933383544579812
"Shoal River Indian Reserve 65A Indian Reserve, Division No. 19, Manitoba, Canada",849.5980234869177,319.6602917615401,65.31234479881975,16.373064770578733
"Plummer Additional Township, Algoma District, Ontario, Canada",210.82963071791704,52.70740767947926,9.10725792256694,6.879246402513325
"Val Rita-Harty Township, Cochrane District, Ontario, Canada",381.9045852411704,169.18275572823754,15.665618946092154,7.315319383148038
"Carrot River 29A Indian Reserve, Division No. 14, Saskatchewan, Canada",3334.9444668026185,834.8813586191995,60.160568488736445,15.066983729650005
"Havelock Canton, Le Haut-Saint-Laurent CRM, Quebec, Canada",591.2681923932051,147.98546602749903,11.00800637477793,8.813099712507956
"Aumond Canton, La Vallée-de-la-Gatineau CRM, Quebec, Canada",553.5383591036954,138.38458977592384,8.744445394519824,4.738870092685142
"Beiseker Village, Division No. 6, Alberta, Canada",887.7958238822855,523.0346467216051,61.13628960868643,16.067076727634984
"Saint-Télesphore Municipalité, Vaudreuil-Soulanges CRM, Quebec, Canada",299.3767803806466,75.82361012957331,13.703367248708021,13.517457810872227
"Billings Township, Manitoulin District, Ontario, Canada",438.36639900621554,111.65448453850861,8.404036214805306,4.523604091352613
"Acadieville Parish, Kent County, New Brunswick, Canada",574.2581248786379,143.56453121965947,10.100201262200162,5.138672896637259
"Rainy River Town, Rainy River District, Ontario, Canada",690.3802803787928,347.88900167118874,59.169765475325946,15.871948924161401
"Val-des-Lacs Municipalité, Les Laurentides CRM, Quebec, Canada",691.7731141400562,172.94327853501406,15.40513745834152,11.17782301487769
"Johnson Township, Algoma District, Ontario, Canada",453.35487405141527,117.63101470838959,12.451271295535104,6.155938957067762
"Le Goulet Village, Gloucester County, New Brunswick, Canada",1486.130636356595,374.03154043862895,62.21268980103281,56.40034702951858
"Cumberland House Cree Nation 20 Indian Reserve, Division No. 18, Saskatchewan, Canada",1312.989130094328,328.247282523582,38.50124037103659,25.188051726442698
"McCreary Municipality, Division No. 17, Manitoba, Canada",371.30933332934416,224.90380760384772,26.969634925475212,7.271817010487152
"Marsh Lake Unorganized, Yukon Territory, Yukon, Canada",301.4266615503855,77.04635325527443,8.650476511457212,4.586478507492717
"Larder Lake Township, Timiskaming District, Ontario, Canada",760.8606071918327,459.9573582739853,47.551544826130545,11.887886206532636
"Ryerson Township, Parry Sound District, Ontario, Canada",464.1017957182575,116.02544892956438,7.971312710146894,4.2040137325335865
"Rivière-Verte Village, Madawaska County, New Brunswick, Canada",625.5302666553719,336.34060102697583,57.91303971239908,24.278000935152246
"Saint-Nérée-de-Bellechasse Municipalité, Bellechasse CRM, Quebec, Canada",355.452884945796,100.15808816555125,14.72878456886388,10.349857714752337
"Sechelt (Part) Indian Government District, Sunshine Coast Regional district, British Columbia, Canada",801.1962515854459,328.88598885376825,263.044936579637,149.2982999143288
"Tignish Town, Prince County, Prince Edward Island, Canada",576.92811199075,171.92498809567732,72.25591632785196,36.347946019574
"Annapolis Valley First Nation Indian Reserve, Kings County, Nova Scotia, Canada",2337.146855517878,661.1009300204569,128.35578403054677,83.18488541168485
"Saltcoats No. 213 Rural Municipality, Division No. 5, Saskatchewan, Canada",65.71492605855188,16.42873151463797,2.4507290766007728,2.78007056381987
"Port au Choix Town, Division No. 9, Newfoundland and Labrador, Canada",1095.8233951269985,288.7439598282828,20.209245860151206,8.08998303386182
"Saint-Cyrille-de-Lessard Paroisse, L'Islet CRM, Quebec, Canada",519.4268236516343,133.42932684570994,9.402582325305017,5.670484707613062
"Constance Lake 92 Indian Reserve, Cochrane District, Ontario, Canada",621.828887075975,315.83385624591835,45.931665529923556,14.741726603886804
"Mistawasis 103 Indian Reserve, Division No. 16, Saskatchewan, Canada",273.2808504087169,83.26917891688358,19.36438836951087,10.056079430622122
"Saint-Louis Municipalité, Les Maskoutains CRM, Quebec, Canada",548.2913598425484,138.43210920434086,17.545326956149513,13.234029245181304
"Sainte-Rose-de-Watford Municipalité, Les Etchemins CRM, Quebec, Canada",321.0766013026206,102.24801781815107,13.743351947356294,8.951175103434586
"Tudor and Cashel Township, Hastings County, Ontario, Canada",275.9006857802335,68.97517144505838,5.469553186175664,2.6201957877740383
"Glenwood Town, Division No. 6, Newfoundland and Labrador, Canada",823.8669627895265,338.98839906053144,87.45650269012285,27.036445957735722
"Port Alice Village, Mount Waddington Regional district, British Columbia, Canada",1124.427303926143,311.047768888718,34.3986811880856,14.480973089206817
"Saint-Camille-de-Lellis Paroisse, Les Etchemins CRM, Quebec, Canada",625.6322506518208,156.4080626629552,10.618571620411307,5.074224540795166
"Sainte-Brigitte-des-Saults Paroisse, Drummond CRM, Quebec, Canada",394.8251907106839,101.173307270455,10.106230911475725,10.977480053815281
"Porcupine No. 395 Rural Municipality, Division No. 14, Saskatchewan, Canada",77.08635069755276,20.05006293951159,2.2292504189325384,2.1791631041313706
"Saint-Basile Parish, Madawaska County, New Brunswick, Canada",460.6774426695583,115.16936066738957,12.778347112306829,22.258013410217846
"Utikoomak Lake 155 Indian Reserve, Division No. 17, Alberta, Canada",770.7852210705738,196.91499542131635,29.291664996377456,12.875396380552042
"Bolton-Ouest Municipalité, Brome-Missisquoi CRM, Quebec, Canada",308.01264833565926,77.35104174094629,9.511464672811547,12.101075404134138
"Division No. 10, Subd. D, Division No. 10, Newfoundland and Labrador, Canada",727.1241439408874,420.37429876025215,42.2969481001707,11.254994028896121
"Dixville Municipalité, Coaticook CRM, Quebec, Canada",297.46493713446534,76.2099964658831,13.172137076317963,14.706123295237493
"Grande-Anse Village, Gloucester County, New Brunswick, Canada",810.100837559951,209.02204044588672,22.229003255535332,17.650005593060214
"Drummond Village, Victoria County, New Brunswick, Canada",665.9758907049046,271.00440872267694,64.7840305015329,59.51480658572143
"Waterhen 130 Indian Reserve, Division No. 17, Saskatchewan, Canada",2138.328861344288,541.6444973163475,37.808043761418105,13.675191727686512
"Fertile Belt No. 183 Rural Municipality, Division No. 5, Saskatchewan, Canada",67.73564323545695,16.933910808864237,3.381659430454616,5.173329236000639
"Sioux Narrows-Nestor Falls Township, Kenora District, Ontario, Canada",388.36082883897245,97.38793860259729,9.278820750314223,4.696302247008562
"Ituna Town, Division No. 10, Saskatchewan, Canada",775.6729638592641,393.4590796988068,58.96690641554723,15.685147123991456
"Clark's Harbour Town, Shelburne County, Nova Scotia, Canada",1852.8603341180208,471.7501789604196,88.70111098021286,32.53667614794705
"Parkdale No. 498 Rural Municipality, Division No. 17, Saskatchewan, Canada",152.57097750125791,55.46231456866369,4.451508877265455,2.8442360355893177
"Red Sucker Lake 1976 Indian Reserve, Division No. 22, Manitoba, Canada",3446.527733162423,861.6319332906057,58.48944158627154,17.546832475881462
"Three Lakes No. 400 Rural Municipality, Division No. 15, Saskatchewan, Canada",263.0144099002992,65.7536024750748,7.579068152065777,3.6552676731796727
"Peterview Town, Division No. 6, Newfoundland and Labrador, Canada",1171.6269282327853,316.786577461528,53.513593268637784,47.69645808549718
"St. Peter No. 369 Rural Municipality, Division No. 15, Saskatchewan, Canada",67.8708880416227,19.598731526082492,6.626392941842643,3.37274199250688
"Webequie Indian Reserve, Kenora District, Ontario, Canada",3682.2087633740903,920.5521908435226,57.53451192772016,14.38362798193004
"Robert's Arm Town, Division No. 8, Newfoundland and Labrador, Canada",752.8407958526591,222.78517751451878,37.76865835123681,14.166167661486611
"White Bear 70 Indian Reserve, Division No. 1, Saskatchewan, Canada",360.16102313068114,98.53322205336913,12.059403700454734,6.258679962605078
"Wollaston Township, Hastings County, Ontario, Canada",378.0444227166779,94.59940245758382,7.848038407414918,3.4245077725714355
"Fredericton Junction Village, Sunbury County, New Brunswick, Canada",574.1300963528186,143.53252408820464,31.67017350550527,16.7647541611227
"Paquetville Village, Gloucester County, New Brunswick, Canada",593.9893007026325,157.5589603756535,54.66362718474708,26.91940722521132
"Thompson-Nicola N (Beautiful Nicola Valley - South) Regional District Electoral Area, Thompson-Nicola Regional district, British Columbia, Canada",445.8860024639349,163.85900383666998,53.19359970023745,26.620689739589107
"Aberdeen Town, Division No. 15, Saskatchewan, Canada",896.2468303722376,592.8957305715644,57.123065280145994,14.649895757706862
"Duparquet Ville, Abitibi-Ouest CRM, Quebec, Canada",1205.978354036751,343.68576370246495,26.70179823870661,9.471358454338308
"Cambridge-Narrows Village, Queens County, New Brunswick, Canada",178.28202833665108,44.74858254496489,6.8665897685297725,5.323705022133147
"Moosomin 112B Indian Reserve, Division No. 17, Saskatchewan, Canada",749.9754876957793,234.50579357570467,26.893067387499265,10.10185917552455
"Saint-Magloire Municipalité, Les Etchemins CRM, Quebec, Canada",618.2937065607751,181.3972934534346,12.658629813615214,7.79850838691908
"South Saanich 1 Indian Reserve, Capital Regional district, British Columbia, Canada",1756.6127777409117,797.7131869011803,493.4487244452493,267.90331391418647
"Saint-Alphonse Municipalité, Bonaventure CRM, Quebec, Canada",569.4013201155714,142.35033002889284,15.135948473299905,10.907178131453698
"Saint-Jacques-de-Leeds Municipalité, Les Appalaches CRM, Quebec, Canada",424.29140901996004,117.1075949760281,12.594394009354225,10.365637208703951
"Saint-Romain Municipalité, Le Granit CRM, Quebec, Canada",599.3716956720941,150.1115398557314,21.462973039393322,13.154794009397206
"Spring Lake Village, Division No. 11, Alberta, Canada",1033.31178917452,287.3241423827323,87.91038562687439,54.25717364106975
"Petersville Parish, Queens County, New Brunswick, Canada",400.33520558687,100.0838013967175,7.802402963661409,2.914076571586976
"Saint Patrick Parish, Charlotte County, New Brunswick, Canada",178.62654165067616,44.65663541266904,5.799628542457833,4.724155826656227
"Audet Municipalité, Le Granit CRM, Quebec, Canada",606.3929217066935,151.59823042667338,11.56818153453676,6.33590658161136
"Béarn Municipalité, Témiscamingue CRM, Quebec, Canada",636.145005079714,251.28857071318328,27.95203647074884,10.230257194780846
"Norris Arm Town, Division No. 6, Newfoundland and Labrador, Canada",650.877177891113,162.71929447277824,38.97183031648238,16.149730821480148
"Saint-Zéphirin-de-Courval Paroisse, Nicolet-Yamaska CRM, Quebec, Canada",470.92214290224484,117.73053572556121,10.47991403210763,10.846904620474763
"Watson Town, Division No. 10, Saskatchewan, Canada",654.1533794503843,376.7690500616522,58.213678071013305,15.384086759633233
"Improvement District No. 24 Wood Buffalo Improvement District, Division No. 16, Alberta, Canada",1804.1624003352676,491.5245679311469,56.18169491143905,14.045423727859763
"Thunderchild First Nation 115B Indian Reserve, Division No. 17, Saskatchewan, Canada",1425.8263030934527,356.45657577336317,25.310370022156587,10.401203851723738
"Campbell's Bay Municipalité, Pontiac CRM, Quebec, Canada",763.9437268410976,330.3740566218487,63.500903404281445,22.500050357270506
"Chitek Lake 191 Indian Reserve, Division No. 16, Saskatchewan, Canada",447.3206573023886,112.91377244877602,20.746354773336297,12.191325078762265
"Linden Village, Division No. 5, Alberta, Canada",1389.3358414051052,481.29901654108164,62.01108381072324,19.865148033653643
"Mayo Municipalité, Papineau CRM, Quebec, Canada",922.6212051037174,230.65530127592936,15.798388825494078,12.05742815052103
"Sainte-Sophie-de-Lévrard Paroisse, Bécancour CRM, Quebec, Canada",299.5440715301372,74.8860178825343,12.616533361649077,10.11939456526086
"Assiniboine 76 Indian Reserve, Division No. 6, Saskatchewan, Canada",721.1788162716997,180.29470406792493,11.268419004245308,3.6178035348170328
"Saint-Thomas-Didyme Municipalité, Maria-Chapdelaine CRM, Quebec, Canada",684.1009215920152,171.0252303980038,11.712377529712178,4.003210926347709
"Sucker Creek 150A Indian Reserve, Division No. 17, Alberta, Canada",919.2173721458415,234.65822920984624,24.21294557773791,6.350859533925493
"Greenwood City, Kootenay Boundary Regional district, British Columbia, Canada",516.2025076182127,264.1699995593682,52.2109831260951,15.272611495079909
"John D'Or Prairie 215 Indian Reserve, Division No. 17, Alberta, Canada",1365.188479150966,341.2971197877415,21.331069986733844,10.45372515635324
"Saint-Théophile Municipalité, Beauce-Sartigan CRM, Quebec, Canada",810.8540795263259,204.04842629885368,12.753026643678355,6.0064837470616
"Francis No. 127 Rural Municipality, Division No. 6, Saskatchewan, Canada",50.00689179122466,13.428045583776116,2.6112989700020455,2.4753020928093994
"Eldon No. 471 Rural Municipality, Division No. 17, Saskatchewan, Canada",94.59806034655196,23.931446700115057,3.5596139843524472,5.66401179885948
"Mount Moriah Town, Division No. 5, Newfoundland and Labrador, Canada",1119.199386785832,279.799846696458,23.025286663411123,41.39281865566128
"Muskoday First Nation Indian Reserve, Division No. 15, Saskatchewan, Canada",668.079702604352,186.6132633309268,22.278054205594678,8.313486872930707
"Pine Creek 66A Indian Reserve, Division No. 19, Manitoba, Canada",1504.5034999863165,376.216820678346,27.800617048781238,13.742745130729643
"Brigus Town, Division No. 1, Newfoundland and Labrador, Canada",324.09137733542065,144.15293895678974,67.29225822768402,42.28916466610605
"Cupids Town, Division No. 1, Newfoundland and Labrador, Canada",522.8114651357458,155.7723882498736,68.32016236300356,55.96499145351671
"Denare Beach Northern Village, Division No. 18, Saskatchewan, Canada",432.84315670433074,194.73825425985154,53.775814072840326,14.502994189248959
"Addington Parish, Restigouche County, New Brunswick, Canada",278.4636904600157,69.61592261500392,10.603299056061408,11.653083236570126
"Newport Municipalité, Le Haut-Saint-François CRM, Quebec, Canada",271.95521095340393,68.03440587390739,5.130010726580239,4.375592354678489
"Skidegate 1 Indian Reserve, Skeena-Queen Charlotte Regional district, British Columbia, Canada",474.5219470567931,235.45797864941002,42.09648244780632,14.678018958086748
"Blue Sea Municipalité, La Vallée-de-la-Gatineau CRM, Quebec, Canada",456.63931350375344,114.15982837593836,8.790795225979501,8.522907272197667
"Bouchette Municipalité, La Vallée-de-la-Gatineau CRM, Quebec, Canada",601.6212568817963,150.40531422044907,11.409806420262072,6.472138810795077
"McLennan Town, Division No. 19, Alberta, Canada",538.2047675572604,364.0164378407656,55.60976761593977,14.471592575477052
"Mount Waddington A Regional District Electoral Area, Mount Waddington Regional district, British Columbia, Canada",331.13021759969956,140.93387760709544,26.011299199291464,8.727730754276221
"Bonne-Espérance Municipalité, Minganie--Le Golfe-du-Saint-Laurent CDR, Quebec, Canada",507.0290099184672,144.1115810720186,19.2887971275838,5.128664544424781
"L'Anse au Loup Town, Division No. 10, Newfoundland and Labrador, Canada",660.8481225483222,241.91919338275818,54.983662977095584,13.766902577448947
"Saint-Sébastien Municipalité, Le Haut-Richelieu CRM, Quebec, Canada",695.0563156346171,176.52399121660625,14.443886067320326,18.098383701173734
"Notre-Dame-de-Stanbridge Municipalité, Brome-Missisquoi CRM, Quebec, Canada",502.50766379449294,125.62691594862324,17.14186260802137,18.14421053561622
"Saint-Mathieu-de-Rioux Municipalité, Les Basques CRM, Quebec, Canada",685.7804540658941,173.21401360756724,13.601298519441603,6.855956178259069
"Wagmatcook 1 Indian Reserve, Victoria County, Nova Scotia, Canada",967.9789819317114,284.44834766917694,54.67018360313145,15.675034453056481
"Saint-Herménégilde Municipalité, Coaticook CRM, Quebec, Canada",281.2641512561049,70.31603781402623,7.622253147743809,5.06744148969494
"Mundare Town, Division No. 10, Alberta, Canada",705.0531639795299,410.4247941466552,55.810602870688506,15.761594482143124
"O'Connor Township, Thunder Bay District, Ontario, Canada",284.66605577530254,71.16651394382563,6.386987193745873,7.575654019265477
"Victoria Beach Rural Municipality, Division No. 1, Manitoba, Canada",406.17265453499226,138.167742062059,41.24642411605279,15.316901942491763
"Haines Junction Village, Yukon Territory, Yukon, Canada",590.9460049779537,219.58570485611335,34.81190518332407,13.699961499458807
"Saint-Didace Paroisse, D'Autray CRM, Quebec, Canada",380.313690990196,97.2806830066113,12.298073636806523,8.913804546209471
"Belcarra Village, Greater Vancouver Regional district, British Columbia, Canada",1062.826979971156,265.706744992789,96.37271970723542,194.68645788709887
"Eastern Kings Rural Municipality, Kings County, Prince Edward Island, Canada",263.98129227641584,65.99532306910396,5.796645427327308,4.996208421868231
"North Battleford No. 437 Rural Municipality, Division No. 16, Saskatchewan, Canada",166.05119395937635,41.51279848984409,17.392832114279805,21.82681469551317
"Charlton and Dack Municipality, Timiskaming District, Ontario, Canada",344.6433011410829,91.06075589474717,19.901676021628887,13.27241443337826
"St. Peters Fire District, Kings County, Prince Edward Island, Canada",198.44718968379536,49.704599137037405,5.093654191811314,5.1863109052184955
"Beauval Northern Village, Division No. 18, Saskatchewan, Canada",811.9364933302389,339.04045646471224,35.38374516555888,14.211461831811656
"Lac Baker Village, Madawaska County, New Brunswick, Canada",210.25367057264623,58.953779037029435,15.401319288660538,9.496206213985985
"Cambridge Parish, Queens County, New Brunswick, Canada",248.89971638249708,64.23530732415348,6.8178347770988665,5.664252293014301
"La Visitation-de-l'Île-Dupas Municipalité, D'Autray CRM, Quebec, Canada",1691.5918082467992,422.8979520616998,80.36894163209837,86.55620638612848
"Waterborough Parish, Queens County, New Brunswick, Canada",264.7742585425872,66.1935646356468,4.702051301171085,3.052709313248549
"Willow Creek No. 458 Rural Municipality, Division No. 14, Saskatchewan, Canada",75.63378449340419,21.835219308174185,2.130765446020924,1.2078182412607126
"Badger Town, Division No. 6, Newfoundland and Labrador, Canada",870.7913010702513,433.08813722531244,54.2718355943363,13.567958898584076
"Milestone Town, Division No. 2, Saskatchewan, Canada",1009.9888677204764,617.9543046721823,54.59796320866318,14.334854692918011
"Wentworth Canton, Argenteuil CRM, Quebec, Canada",549.9200004357617,147.1077073409041,16.477670640433487,9.923468223167633
"Saint-Philémon Paroisse, Bellechasse CRM, Quebec, Canada",552.5709831262991,138.14274578157477,9.034734611414407,6.5281905398338695
"West Isles Parish, Charlotte County, New Brunswick, Canada",307.914259783247,80.01936056441455,15.744168693978848,8.658555519819632
"Christian Island 30 Indian Reserve, Simcoe County, Ontario, Canada",595.3210570019742,165.34299978943002,37.121894292814716,13.508275794924618
"Embree Town, Division No. 8, Newfoundland and Labrador, Canada",1505.4679367501576,440.4977535983532,27.662605804719686,13.925852423964692
"Flying Dust First Nation 105 Indian Reserve, Division No. 17, Saskatchewan, Canada",827.211918651649,207.94683256760803,27.144004462170606,58.27924689522934
"Saint-François-d'Assise Municipalité, Avignon CRM, Quebec, Canada",1056.2075198343562,264.05187995858904,16.503242497411815,6.545422831719467
"Port Saunders Town, Division No. 9, Newfoundland and Labrador, Canada",571.7033349304057,181.58874781373345,28.166903800205922,13.194073890310303
