longname,PW Density (250m) [StatCan],PW Density (500m) [StatCan],PW Density (2km) [StatCan],PW Density (4km) [StatCan]
"Toronto City, Toronto CDR, Ontario, Canada",11247.064398492816,8641.979906392718,5843.8325836540225,4942.461128127719
"Montréal Ville, Montréal Territory, Quebec, Canada",9766.39217702403,8601.57520206763,6273.631826193341,5357.122868420545
"Calgary City, Division No. 6, Alberta, Canada",4818.60808295781,3605.380084805771,2518.5999583750463,1958.5305709467777
"Ottawa City, Ottawa CDR, Ontario, Canada",4779.316617090006,3579.629583345174,2345.1508807655578,1789.0625102196655
"Edmonton City, Division No. 11, Alberta, Canada",4462.072058416345,3319.760714493078,2379.3111926033766,1919.6814035074826
"Winnipeg City, Division No. 11, Manitoba, Canada",4253.2463253378855,3425.0572720350515,2490.4607811027945,2055.051099069036
"Mississauga City, Peel Regional municipality, Ontario, Canada",7520.235115303194,5611.326954484911,3788.78286107961,2992.5145866753273
"Vancouver City, Greater Vancouver Regional district, British Columbia, Canada",10979.001168117837,9212.765549175932,6307.122633629062,4939.320751784962
"Brampton City, Peel Regional municipality, Ontario, Canada",6041.319451314692,4712.244269906333,3594.4779855343168,2864.387563658552
"Hamilton City, Hamilton CDR, Ontario, Canada",4503.960333628364,3553.194480775918,2495.2330399402517,1944.9576222555322
"Surrey City, Greater Vancouver Regional district, British Columbia, Canada",5325.121489698933,4338.682411002776,3139.63089298668,2502.9017916647485
"Québec Ville, Québec Territory, Quebec, Canada",4650.7947090671805,3628.806961419813,2433.6239021285273,1888.952211479731
"Halifax Regional Municipality, Halifax County, Nova Scotia, Canada",3803.684570888805,2455.2635517340996,1439.9963465180663,1041.7166035578994
"Laval Ville, Laval Territory, Quebec, Canada",4627.195706211694,3619.2842738212435,2710.956054941209,2505.107264703011
"London City, Middlesex County, Ontario, Canada",4171.830792687308,2942.828203165928,2141.165631188529,1808.511706684886
"Markham City, York Regional municipality, Ontario, Canada",5526.181117107431,4025.12221907753,2809.773306051776,2338.5786636619573
"Vaughan City, York Regional municipality, Ontario, Canada",4978.145241434114,3753.767684344043,2485.673754630493,2026.5233029403664
"Gatineau Ville, Gatineau Territory, Quebec, Canada",3716.86266888139,2733.535408141953,1540.0157489904157,1253.7469080634207
"Saskatoon City, Division No. 11, Saskatchewan, Canada",3836.8115166464495,2820.9669802968087,1937.3547805562357,1470.7968381970759
"Kitchener City, Waterloo Regional municipality, Ontario, Canada",4493.871417718155,3269.113802485901,2309.7922091151236,1964.667138108434
"Longueuil Ville, Longueuil Territory, Quebec, Canada",4889.367154223563,4114.062460066372,3316.567646303259,2787.119861593318
"Burnaby City, Greater Vancouver Regional district, British Columbia, Canada",7640.457638621223,6201.861399655901,3933.3507727364804,3136.831209987202
"Windsor City, Essex County, Ontario, Canada",3506.790216981389,2850.6206458624097,1965.6056820804772,1487.3178268074225
"Regina City, Division No. 6, Saskatchewan, Canada",3445.1433520238666,2778.9219468524925,1856.6680953061634,1336.9018289935364
"Oakville Town, Halton Regional municipality, Ontario, Canada",4120.644633190584,3253.7238170191854,2154.973742284688,1612.281828309872
"Richmond City, Greater Vancouver Regional district, British Columbia, Canada",6980.146296979487,5490.312913613502,3651.0958404015723,2560.484406997078
"Richmond Hill Town, York Regional municipality, Ontario, Canada",5144.733452659994,3563.967085441217,2552.4918630424227,2146.047633215854
"Burlington City, Halton Regional municipality, Ontario, Canada",4237.816016955249,3138.310065308751,1908.679313811179,1355.6820344780895
"Oshawa City, Durham Regional municipality, Ontario, Canada",3985.937220743067,3062.748885439902,2250.0389453411412,1848.6066034790276
"Sherbrooke Ville, Sherbrooke Territory, Quebec, Canada",2987.5074176655744,2106.123844507773,1402.4492115138876,1030.8562835309656
"Greater Sudbury / Grand Sudbury City, Greater Sudbury / Grand Sudbury CDR, Ontario, Canada",2258.0778305971467,1321.9413945074587,698.708848656579,445.40990210516316
"Abbotsford City, Fraser Valley Regional district, British Columbia, Canada",3943.0600867289377,2982.1033983001025,1961.5559462253884,1263.1533767505523
"Lévis Ville, Lévis Territory, Quebec, Canada",2655.8818590159967,1795.0998448959717,875.9692041473621,706.8703961408012
"Coquitlam City, Greater Vancouver Regional district, British Columbia, Canada",5609.365873883492,4176.063254643954,2838.1593119280533,2201.3567200576354
"Barrie City, Simcoe County, Ontario, Canada",3504.4879879718846,2622.1304598844736,1545.6326640756724,1075.1315005127044
"Saguenay Ville, Le Saguenay-et-son-Fjord CDR, Quebec, Canada",2184.160738509956,1366.0594140072208,786.5638454091687,517.3545749855772
"Kelowna City, Central Okanagan Regional district, British Columbia, Canada",3337.968246329364,2206.5951395644493,1312.1933913209778,835.2034707257046
"Guelph City, Wellington County, Ontario, Canada",3806.8730697834303,2732.1890669271197,1827.8422258243609,1261.8630775152776
"Trois-Rivières Ville, Francheville CDR, Quebec, Canada",2817.0373920097954,1963.196629336536,1220.2322271461,947.5107926870745
"Whitby Town, Durham Regional municipality, Ontario, Canada",3746.340079978194,2911.5959294945874,1969.494302307559,1552.3444883554832
"Cambridge City, Waterloo Regional municipality, Ontario, Canada",3691.835730155476,2660.049603778934,1575.0299364807706,1037.0186768495475
"St. Catharines City, Niagara Regional municipality, Ontario, Canada",3196.174745210507,2511.361018387306,1874.996588703878,1445.4752296525949
"Milton Town, Halton Regional municipality, Ontario, Canada",5594.645715775015,4325.414531230326,2800.463492770967,1738.0908266875422
"Langley District Municipality, Greater Vancouver Regional district, British Columbia, Canada",3814.868450237155,2658.486241937794,1542.9408398125815,1056.3446223019341
"Kingston City, Frontenac County, Ontario, Canada",3113.94126808017,2270.0793746825134,1336.4626460746713,930.5771617126449
"Ajax Town, Durham Regional municipality, Ontario, Canada",4941.182910779086,3782.4784532484273,2494.060001816491,1722.0371295501675
"Waterloo City, Waterloo Regional municipality, Ontario, Canada",4330.613644993927,2939.528355015172,2010.5962349264607,1713.698873837217
"Terrebonne Ville, Les Moulins CRM, Quebec, Canada",3160.474168769812,2341.181643378567,1334.3329823333095,920.3516769320423
"Saanich District Municipality, Capital Regional district, British Columbia, Canada",2999.119765192715,2377.992842115701,1902.2078440247974,1688.0528343128235
"St. John's City, Division No. 1, Newfoundland and Labrador, Canada",2866.522332463328,2037.4637701935376,1278.449209819081,894.1800859140642
"Thunder Bay City, Thunder Bay District, Ontario, Canada",2600.8278873141353,1954.4766053039941,1187.5797846168002,737.0438324701485
"Delta City, Greater Vancouver Regional district, British Columbia, Canada",4198.487740476268,3141.9079923680456,2227.328949420043,1574.671970044285
"Brantford City, Brant CDR, Ontario, Canada",3398.7796179796987,2507.894949615401,1593.5751263560892,1080.829730957923
"Chatham-Kent Municipality, Chatham-Kent CDR, Ontario, Canada",1748.5311440874439,1202.112449491816,696.7173985260981,396.1578352673294
"Clarington Municipality, Durham Regional municipality, Ontario, Canada",3027.594595175389,2268.3108645612997,1236.3465205411546,740.9071982364532
"Red Deer City, Division No. 8, Alberta, Canada",3175.5804305569245,2409.205245968761,1544.1943653986054,1029.0286282855966
"Nanaimo City, Nanaimo Regional district, British Columbia, Canada",2745.6368184195317,1826.5687422995277,1177.4920439490677,796.0306382114234
"Strathcona County Specialized Municipality, Division No. 11, Alberta, Canada",2686.505233234593,1793.0985223166686,1278.5770321134669,837.7405487011953
"Pickering City, Durham Regional municipality, Ontario, Canada",3984.5077129885467,2945.970454830515,1974.6657028791446,1530.3935298710473
"Lethbridge City, Division No. 2, Alberta, Canada",2876.702200095062,2070.0268379517993,1249.1721355670174,733.479209544703
"Kamloops City, Thompson-Nicola Regional district, British Columbia, Canada",3083.941564021773,1813.9604575356177,918.0081925046316,553.6693070869001
"Saint-Jean-sur-Richelieu Ville, Le Haut-Richelieu CRM, Quebec, Canada",2931.136551284868,2078.644766080554,1209.2879873942572,843.0978127887729
"Niagara Falls City, Niagara Regional municipality, Ontario, Canada",2693.1882727821157,2036.908314407614,1296.0087053574034,941.4330922297063
"Cape Breton Regional Municipality, Cape Breton County, Nova Scotia, Canada",1433.9174994258422,882.7313068925823,439.5147115585194,250.31493158882907
"Chilliwack City, Fraser Valley Regional district, British Columbia, Canada",3562.0565779332583,2318.8795462817416,1240.0545856058297,681.7773731096611
"Victoria City, Capital Regional district, British Columbia, Canada",6268.665082593656,5451.464165620424,3934.669032042684,2617.2518853248216
"Brossard Ville, Longueuil Territory, Quebec, Canada",4759.8156676395,3675.807133351915,2707.0559404738738,2260.1184084666515
"Maple Ridge City, Greater Vancouver Regional district, British Columbia, Canada",3643.199132939634,2253.177592587754,1486.730664942487,962.3394661880682
"North Vancouver District Municipality, Greater Vancouver Regional district, British Columbia, Canada",3623.7347665035118,2653.8591720971967,1776.1638370562814,1603.766694509144
"Newmarket Town, York Regional municipality, Ontario, Canada",4037.712498467879,2862.856660689724,2061.7051261694874,1574.8417936536703
"Repentigny Ville, L'Assomption CRM, Quebec, Canada",3484.730603293788,2990.172224668609,1950.4830867395726,1233.9964028846762
"Peterborough City, Peterborough County, Ontario, Canada",2835.9309391955135,2186.660781334638,1523.265388729401,1058.110419037255
"Saint-Jérôme Ville, La Rivière-du-Nord CRM, Quebec, Canada",3287.782698767231,2304.7264829489113,1492.1767356925266,1027.6223648026246
"Moncton City, Westmorland County, New Brunswick, Canada",2922.1538084255053,2095.544922577865,1226.351212763867,872.4134514128474
"Drummondville Ville, Drummond CRM, Quebec, Canada",2351.7678019546506,1777.2920247362076,1105.535359875673,754.8808384890301
"Kawartha Lakes City, Kawartha Lakes CDR, Ontario, Canada",1105.4698661290697,683.4753635751368,347.1240434205665,163.4499326946503
"New Westminster City, Greater Vancouver Regional district, British Columbia, Canada",9124.08485146368,6876.039487635495,4104.204649341058,2951.29296043244
"Prince George City, Fraser-Fort George Regional district, British Columbia, Canada",2289.057102478858,1504.937173120599,834.8296450298624,531.5225682952653
"Caledon Town, Peel Regional municipality, Ontario, Canada",3315.2825442591934,1910.9941946583247,748.0508429209511,478.93915544127805
"Airdrie City, Division No. 6, Alberta, Canada",4224.055113465149,3062.7002651591147,1872.4377823633024,1156.4535343717596
"Wood Buffalo Specialized Municipality, Division No. 16, Alberta, Canada",3369.2466734032764,2210.3454692443192,1271.1417245437333,714.1785737422753
"Sault Ste. Marie City, Algoma District, Ontario, Canada",2308.6001045863145,1600.5674644123083,1049.757148398988,678.6492684677681
"Sarnia City, Lambton County, Ontario, Canada",2699.129000884826,2001.4314608296324,1318.258515265263,848.486498714618
"Granby Ville, La Haute-Yamaska CRM, Quebec, Canada",2743.6146067786112,2045.7976017556261,1283.6868141461346,858.5908588226158
"Saint John City, Saint John County, New Brunswick, Canada",2404.521233802757,1545.5259204543502,678.6771015013943,467.2011093079693
"St. Albert City, Division No. 11, Alberta, Canada",3488.477954713521,2245.535472622764,1472.9617455669777,1065.3758193472938
"Norfolk County City, Haldimand-Norfolk CDR, Ontario, Canada",1184.9771289656514,726.6926702975517,345.0541342253664,138.73016221662579
"Grande Prairie City, Division No. 19, Alberta, Canada",2802.0559287074275,2038.4166113457356,1233.353955235341,828.8723991165435
"Medicine Hat City, Division No. 1, Alberta, Canada",2441.5963970217726,1768.0789190157948,1077.6507447113272,705.1377780019352
"Fredericton City, York County, New Brunswick, Canada",2445.6339019431716,1481.6651221673092,751.6038779477265,569.3857966165274
"Halton Hills Town, Halton Regional municipality, Ontario, Canada",2798.1020962974176,1945.6916527823855,1073.6380936169269,566.7026179095991
"Aurora Town, York Regional municipality, Ontario, Canada",4024.48588571468,2589.458130792379,1758.5252223191023,1304.2985849463166
"Port Coquitlam City, Greater Vancouver Regional district, British Columbia, Canada",4891.451841001523,3642.773016277464,2368.726116957692,1898.9904922280416
"Mirabel Ville, Mirabel Territory, Quebec, Canada",2618.37207655444,1584.8531510314433,636.8405924283361,440.8341277659836
"Blainville Ville, Thérèse-De Blainville CRM, Quebec, Canada",3467.813946210961,2337.26541369605,1718.9721817699053,1246.940424911596
"North Vancouver City, Greater Vancouver Regional district, British Columbia, Canada",8647.377856698533,7884.619193401346,4175.403820144578,2417.5514158401247
"Saint-Hyacinthe Ville, Les Maskoutains CRM, Quebec, Canada",2925.8944638816783,2396.9565809083256,1336.1297015504706,738.1784680469874
"Welland City, Niagara Regional municipality, Ontario, Canada",2678.798527927681,2000.605874318882,1379.8164876193975,878.9292418124184
"Belleville City, Hastings County, Ontario, Canada",2666.186587919779,1901.8283894816814,1128.3803054853502,634.4758692923167
"North Bay City, Nipissing District, Ontario, Canada",2418.2360002405776,1779.4328476305661,925.7325751398495,546.5138958675342
"Brandon City, Division No. 7, Manitoba, Canada",2751.57216695899,2079.183253952605,1348.1052663394717,826.8622720247017
"Mascouche Ville, Les Moulins CRM, Quebec, Canada",3750.288707448784,2237.11770185582,1383.9790678084114,1073.313255198448
"Châteauguay Ville, Roussillon CRM, Quebec, Canada",3078.2668098304125,2700.4769551272575,1845.049842592241,1017.4693037250305
"Whitchurch-Stouffville Town, York Regional municipality, Ontario, Canada",3815.3517677900304,2517.7070777535123,1280.9695056863611,587.1266390262155
"Shawinigan Ville, Shawinigan Territory, Quebec, Canada",2133.5996825087022,1447.38458691373,548.1705706429802,298.7657746412305
"Haldimand County City, Haldimand-Norfolk CDR, Ontario, Canada",1313.996455831652,755.7405209576258,283.1969121828324,114.48916746511229
"Rimouski Ville, Rimouski-Neigette CRM, Quebec, Canada",2203.3835255735744,1543.0901969069744,877.9473209183993,437.82208076313395
"Dollard-Des Ormeaux Ville, Montréal Territory, Quebec, Canada",4975.269946037136,3911.634413265404,2767.26237901383,2286.695064517127
"Cornwall City, Stormont, Dundas and Glengarry United counties, Ontario, Canada",3115.0320719420374,2305.7606979339,1326.5357279255352,740.6394435062585
"Victoriaville Ville, Arthabaska CRM, Quebec, Canada",2258.2978471735773,1775.987403029172,1146.2997048517925,691.2177048102726
"Georgina Town, York Regional municipality, Ontario, Canada",2389.164172881413,1364.543396947754,568.9136336850415,292.68973656988305
"Woodstock City, Oxford County, Ontario, Canada",2801.103117508651,2203.1651012916614,1367.609709184365,778.317253655272
"Langford City, Capital Regional district, British Columbia, Canada",4260.7612251048395,2385.73470152086,1519.041605614205,998.1808923809958
"Quinte West City, Hastings County, Ontario, Canada",1642.4641363700377,967.9552874101977,460.3291863796354,254.13066905508884
"Saint-Eustache Ville, Deux-Montagnes CRM, Quebec, Canada",3241.5141112643387,2700.991331436701,1701.9264000089568,1326.16496056788
"Vernon City, North Okanagan Regional district, British Columbia, Canada",3005.702407779809,1823.6637254959214,1022.248956964062,611.1833512463519
"West Vancouver District Municipality, Greater Vancouver Regional district, British Columbia, Canada",3004.880415989886,2122.594813172504,1120.3836251017756,727.7375337755649
"New Tecumseth Town, Simcoe County, Ontario, Canada",2789.053530798472,1894.5342040496446,651.8613044497823,247.26115930335342
"Innisfil Town, Simcoe County, Ontario, Canada",2024.3282717947754,1375.6174551275212,621.1244557774447,334.963324890046
"Vaudreuil-Dorion Ville, Vaudreuil-Soulanges CRM, Quebec, Canada",3665.0749766183017,2683.834078446321,1529.1422042609363,802.3302678497648
"Bradford West Gwillimbury Town, Simcoe County, Ontario, Canada",4045.628386413333,2890.1990124974996,1614.4411896816746,705.8652287554359
"St. Thomas City, Elgin County, Ontario, Canada",3250.806198106249,2326.6932460550656,1312.4424554593777,757.1908804057525
"Salaberry-de-Valleyfield Ville, Beauharnois-Salaberry CRM, Quebec, Canada",2542.661874162629,1813.2317483090485,1069.907284912928,591.4592201357186
"Rouyn-Noranda Ville, Rouyn-Noranda Territory, Quebec, Canada",2064.482167751391,1148.8098307818468,507.93370652700855,240.91255252829004
"Boucherville Ville, Longueuil Territory, Quebec, Canada",2837.82452983628,2154.3706922188553,1304.9483809910673,780.9937591618966
"Mission District Municipality, Fraser Valley Regional district, British Columbia, Canada",2817.9391944994168,1925.3649698961071,1223.9298730753067,604.1290261547166
"Timmins City, Cochrane District, Ontario, Canada",2774.4662380992763,1997.8095184404208,858.8802054746284,430.6306712592645
"Rocky View County Municipal District, Division No. 6, Alberta, Canada",1635.0622713299006,535.4896461141303,145.29925969146998,145.42008592466658
"Lakeshore Town, Essex County, Ontario, Canada",1818.3955352738783,1050.2805231853567,383.3306216699814,226.68852875190223
"Brant City, Brant CDR, Ontario, Canada",1351.7246958377177,732.0405834661302,304.5281563199452,170.7513471511385
"Charlottetown City, Queens County, Prince Edward Island, Canada",2496.594503068042,1724.3785741076153,935.2794302220027,603.5905367800766
"Prince Albert City, Division No. 15, Saskatchewan, Canada",2519.5741984188676,1986.9924897642343,1084.8227243553122,626.3966602441673
"Spruce Grove City, Division No. 11, Alberta, Canada",3308.049710203922,2289.908282719152,1374.3498683468429,719.4514726052431
"Penticton City, Okanagan-Similkameen Regional district, British Columbia, Canada",3148.4497627900137,2305.9076143307852,1175.256292682622,643.304894310775
"West Kelowna City, Central Okanagan Regional district, British Columbia, Canada",2162.557028776035,1169.516788734394,669.5265655549335,482.6059666971284
"Campbell River City, Strathcona Regional district, British Columbia, Canada",2137.4952908449663,1605.0126692345748,818.2019698083922,425.8290979651489
"Sorel-Tracy Ville, Pierre-De Saurel CRM, Quebec, Canada",2249.1608373538347,1662.3030247412898,936.5826261148834,560.4872704388515
"East Gwillimbury Town, York Regional municipality, Ontario, Canada",2236.461636694123,1231.6235390999223,506.68380347024583,395.9905537864282
"Côte-Saint-Luc Ville, Montréal Territory, Quebec, Canada",8226.434795257142,6639.081770581732,4574.660124983063,4083.086708629955
"Leduc City, Division No. 11, Alberta, Canada",3545.935758082718,2142.2004008493864,1092.8657359011218,567.7717721095581
"Moose Jaw City, Division No. 7, Saskatchewan, Canada",2253.6667470535303,1753.6089789060259,956.07834688407,577.7597589550462
"Port Moody City, Greater Vancouver Regional district, British Columbia, Canada",4981.359748474785,3179.8726888665256,1978.293007271224,1942.6424269724114
"Pointe-Claire Ville, Montréal Territory, Quebec, Canada",3272.5602127450966,2603.675102483009,1697.4150687777615,1468.9670840950164
"Orillia City, Simcoe County, Ontario, Canada",2573.6804036530007,1954.692622921651,1035.4053830472146,590.5312683511785
"Stratford City, Perth County, Ontario, Canada",2791.0636857710533,2039.4888726861386,1285.353028504818,641.9545621770523
"Saint-Georges Ville, Beauce-Sartigan CRM, Quebec, Canada",1912.9702972953646,1363.313694323534,720.0637401353802,424.7842984722503
"Fort Erie Town, Niagara Regional municipality, Ontario, Canada",1376.6031750639581,935.3653602442894,392.9730612659643,201.1716545725866
"Val-d'Or Ville, La Vallée-de-l'Or CRM, Quebec, Canada",2056.5835360610135,1452.8951528538641,664.3264699785207,316.59069438646463
"LaSalle Town, Essex County, Ontario, Canada",2308.9024974178874,1474.2179223404235,867.3777393069249,621.5418849976126
"Parkland County Municipal District, Division No. 11, Alberta, Canada",783.637605459264,250.4349706105471,55.859288163034336,70.10118460340146
"Cochrane Town, Division No. 6, Alberta, Canada",3632.4420570942193,1798.0773946917568,684.5258921664678,452.3990774236014
"North Cowichan District Municipality, Cowichan Valley Regional district, British Columbia, Canada",2342.599328752416,1131.329216344983,471.0766065775475,275.8595613520336
"Chambly Ville, La Vallée-du-Richelieu CRM, Quebec, Canada",3932.7235433677374,2492.1189199468813,1532.8543011568804,781.6307012321685
"Centre Wellington Township, Wellington County, Ontario, Canada",1815.842454096128,1270.0044196667332,621.0374141849725,283.3335687621304
"Okotoks Town, Division No. 6, Alberta, Canada",3296.370740843918,2229.2992269377337,1108.9679809114486,595.1029053433637
"Alma Ville, Lac-Saint-Jean-Est CRM, Quebec, Canada",1998.23039441345,1247.310601334899,719.1873088342192,352.43126875546966
"Orangeville Town, Dufferin County, Ontario, Canada",2939.125112529607,2139.3139065228497,1199.562104201115,628.0024108830078
"Sainte-Julie Ville, Marguerite-D'Youville CRM, Quebec, Canada",3135.910726975628,2427.1276190144995,1192.9225258042093,583.8642637087403
"Saint-Constant Ville, Roussillon CRM, Quebec, Canada",3442.046557771224,2565.4141601559227,1737.9441341527593,1059.927414035329
"Leamington Municipality, Essex County, Ontario, Canada",2284.923427004041,1599.8662848198076,851.8849461550601,362.42572137486627
"Langley City, Greater Vancouver Regional district, British Columbia, Canada",5913.999025988038,4902.0042947264255,2228.6822709496428,1716.6465054799519
"Grimsby Town, Niagara Regional municipality, Ontario, Canada",2582.302248099117,1659.3440255292617,775.5519427570629,415.1600897197211
"Courtenay City, Comox Valley Regional district, British Columbia, Canada",2279.095559416292,1480.2839749990594,887.6326904963935,573.9758162560615
"Magog Ville, Memphrémagog CRM, Quebec, Canada",1912.4399747050004,1352.307576553689,701.9879853721999,358.83215509888805
"Boisbriand Ville, Thérèse-De Blainville CRM, Quebec, Canada",4285.324542385905,2581.900588417131,1432.5157009468687,1373.045006982348
"Whitehorse City, Yukon Territory, Yukon, Canada",1926.6355043682483,1179.7517246075097,351.06562817333,190.3102589854644
"Dieppe City, Westmorland County, New Brunswick, Canada",2532.1621416579173,1410.4133299628943,872.897066046125,644.2854797687875
"King Township, York Regional municipality, Ontario, Canada",2256.4532604061837,829.2698174022668,289.79815999388103,209.98855473593542
"Conception Bay South Town, Division No. 1, Newfoundland and Labrador, Canada",2046.4333793641597,1052.9247688151306,493.54327169734546,297.0906660195098
"Fort Saskatchewan City, Division No. 11, Alberta, Canada",3387.205628584932,1968.2976655339246,1065.3597018345758,494.17957658320245
"Woolwich Township, Waterloo Regional municipality, Ontario, Canada",1888.8231116803524,1279.4373856613759,465.4237165062653,263.17964829483327
"Sainte-Thérèse Ville, Thérèse-De Blainville CRM, Quebec, Canada",3517.415393671298,2956.2262227212373,2206.2889736442294,1612.7648394183357
"Clarence-Rockland City, Prescott and Russell United counties, Ontario, Canada",1898.849842217984,1142.7915537661645,506.8085242675862,192.3133435324468
"La Prairie Ville, Roussillon CRM, Quebec, Canada",3711.679490093098,2253.835978595876,1352.635726348678,1113.092887821356
"Saint-Bruno-de-Montarville Ville, Longueuil Territory, Quebec, Canada",2462.4761982111227,1962.5418143404283,1215.148290364638,676.4886747270939
"Thetford Mines Ville, Les Appalaches CRM, Quebec, Canada",1700.1236731399592,1191.649561619772,573.3744811095734,268.3542440401691
"Lincoln Town, Niagara Regional municipality, Ontario, Canada",1960.2997816363506,1412.367561985907,575.8155109659998,254.304707701767
"Prince Edward County City, Prince Edward CDR, Ontario, Canada",902.2801398113199,347.772287586961,106.91224428776026,60.81252838404729
"Lunenburg Municipal District, Lunenburg County, Nova Scotia, Canada",848.8912209495678,216.46105931570398,34.46256505892831,35.16470450292972
"Wasaga Beach Town, Simcoe County, Ontario, Canada",1864.6229013381576,874.6238460511486,362.30123875638816,222.99594963483736
"Collingwood Town, Simcoe County, Ontario, Canada",2343.439180223359,1534.3124099919303,855.0630493019091,416.5517700130032
"Sept-Îles Ville, Sept-Rivières--Caniapiscau CDR, Quebec, Canada",2035.221556514495,1535.5914306468756,683.7488144650104,291.6741607996178
"Beloeil Ville, La Vallée-du-Richelieu CRM, Quebec, Canada",2700.093137470762,2304.4756260933627,1452.199783352846,857.6234156491169
"Saint-Lin--Laurentides Ville, Montcalm CRM, Quebec, Canada",2067.557267227468,1219.732805300463,424.09826607041174,251.548775411497
"Strathroy-Caradoc Municipality, Middlesex County, Ontario, Canada",1610.870391634784,1009.1208265718129,528.8874073526201,266.9658321461622
"Squamish District Municipality, Squamish-Lillooet Regional district, British Columbia, Canada",2822.1184790109733,1302.5703461086384,494.7112842755821,254.07414782669775
"Thorold City, Niagara Regional municipality, Ontario, Canada",2503.9786785131037,1793.5029933229823,886.1103253942757,656.3288693587758
"Grande Prairie County No. 1 Municipal District, Division No. 19, Alberta, Canada",1004.5263804664833,377.9181631156215,84.31234616871582,90.05161560413173
"Amherstburg Town, Essex County, Ontario, Canada",1881.2659575491557,1112.9618763104604,435.4163252676406,202.93111263276356
