"Blaine County, Idaho, USA",0.36774776130634357,0.2868332711674748,0.08091449013886876
"Jerome County, Idaho, USA",-0.4916794674859191,-0.4910383646867131,-0.0006411027992060392
"Aguas Buenas Municipio, Puerto Rico, USA",,,
"Fairfax city-County, Virginia, USA",0.38320822331679905,0.304694987703606,0.07851323561319307
"Dawson County, Nebraska, USA",-0.4387666158204402,-0.4495852319196168,0.010818616099176614
"Bell County, Kentucky, USA",-0.6323178016726404,-0.6219386705083351,-0.010379131164305333
"Shelby County, Texas, USA",-0.5856052344601963,-0.5965008802816901,0.010895645821493827
"Hood River County, Oregon, USA",0.367379679144385,0.2967919340054995,0.0705877451388855
"Itawamba County, Mississippi, USA",-0.756909141325446,-0.7551607271233439,-0.0017484142021020332
"Anderson County, Kentucky, USA",-0.4765838878969864,-0.4910533378961334,0.01446944999914701
"Upshur County, West Virginia, USA",-0.539575384013306,-0.5683445432848774,0.02876915927157142
"Ohio County, Kentucky, USA",-0.5552260267817022,-0.5637622619734565,0.008536235191754282
"Saline County, Illinois, USA",-0.48020965118380626,-0.5010541110330288,0.020844459849222507
"Iowa County, Wisconsin, USA",0.13714979988564893,0.1515274949083503,-0.014377695022701364
"Page County, Virginia, USA",-0.5064727505194182,-0.49506517690875235,-0.011407573610665855
"Loíza Municipio, Puerto Rico, USA",,,
"Quebradillas Municipio, Puerto Rico, USA",,,
"Seminole County, Oklahoma, USA",-0.4631162288593019,-0.4407117083488864,-0.022404520510415527
"Winston County, Alabama, USA",-0.8171747607231479,-0.8102395035392224,-0.006935257183925514
"Grainger County, Tennessee, USA",-0.7004180622305147,-0.683271866252694,-0.017146195977820744
"Aransas County, Texas, USA",-0.5153329327590549,-0.5001298780400945,-0.01520305471896044
"Plaquemines Parish, Louisiana, USA",-0.362992554930089,-0.3360446420126738,-0.026947912917415162
"Washington County, Missouri, USA",-0.6260529482551144,-0.5519396551724138,-0.07411329308270054
"Juniata County, Pennsylvania, USA",-0.6141326911899029,-0.6171800267840061,0.0030473355941031954
"Mingo County, West Virginia, USA",-0.7137455911239371,-0.688085346151005,-0.025660244972932067
"Menominee County, Michigan, USA",-0.3015230842455973,-0.2937407132243685,-0.007782371021228807
"Roscommon County, Michigan, USA",-0.29990677853242775,-0.29552948393528106,-0.004377294597146697
"Antrim County, Michigan, USA",-0.23757243087549815,-0.2960959666258582,0.05852353575036004
"Curry County, Oregon, USA",-0.1625460636515913,-0.2309095234319245,0.0683634597803332
"Franklin County, Georgia, USA",-0.6945598773975233,-0.6858381014072384,-0.008721775990284897
"Meeker County, Minnesota, USA",-0.4059427895631606,-0.40001628399283506,-0.005926505570325535
"Fayette County, Indiana, USA",-0.5443962115232833,-0.4779120650135445,-0.06648414650973883
"Starke County, Indiana, USA",-0.46802721088435373,-0.41627307857449547,-0.05175413230985826
"Pacific County, Washington, USA",-0.011305460750853242,-0.06905561776782382,0.057750157016970574
"Naguabo Municipio, Puerto Rico, USA",,,
"Saline County, Missouri, USA",-0.37262317470322515,-0.34476046285281714,-0.027862711850408006
"Teton County, Wyoming, USA",0.37521291817128843,0.26870990734141126,0.10650301082987718
"Yankton County, South Dakota, USA",-0.2353211009174312,-0.2450379299594721,0.009716829042040909
"McDonald County, Missouri, USA",-0.66570923552806,-0.6401068869184987,-0.025602348609561343
"Lajas Municipio, Puerto Rico, USA",,,
"Ray County, Missouri, USA",-0.449480642115203,-0.3703293661776917,-0.07915127593751131
"Cataño Municipio, Puerto Rico, USA",,,
"Hampshire County, West Virginia, USA",-0.6042034050871979,-0.5938454502510238,-0.010357954836174188
"St. Francis County, Arkansas, USA",0.050928531232414184,0.11251682368775236,-0.06158829245533817
"Clarke County, Alabama, USA",-0.11945184621240959,-0.10674545315018034,-0.012706393062229246
"Crawford County, Missouri, USA",-0.6025699444090039,-0.594758064516129,-0.007811879892874907
"Hopewell city-County, Virginia, USA",0.14681338252960136,0.09319395843238096,0.0536194240972204
"Vilas County, Wisconsin, USA",-0.21849176914568286,-0.24950407758430682,0.03101230843862396
"Poinsett County, Arkansas, USA",-0.5975393836167666,-0.46906075733355856,-0.12847862628320805
"New Kent County, Virginia, USA",-0.34640116158473344,-0.37374315376440775,0.027341992179674313
"Osceola County, Michigan, USA",-0.4634601346419012,-0.4365161655198416,-0.026943969122059597
"Tattnall County, Georgia, USA",-0.487840645240132,-0.4959337786813825,0.00809313344125051
"Columbia County, Arkansas, USA",-0.3117455896007428,-0.2606053786429616,-0.05114021095778115
"Franklin County, Indiana, USA",-0.6296574143535884,-0.6037667838154456,-0.025890630538142778
"Emanuel County, Georgia, USA",-0.38595937269761077,-0.36966220522625876,-0.016297167471352014
"Allen Parish, Louisiana, USA",-0.5571865443425077,-0.5150888077035461,-0.04209773663896155
"Sabana Grande Municipio, Puerto Rico, USA",,,
"Caswell County, North Carolina, USA",-0.18496390341050536,-0.11125076236911824,-0.07371314104138713
"Klickitat County, Washington, USA",-0.09424778761061947,-0.1481103166496425,0.05386252903902303
"Johnson County, Kentucky, USA",-0.6713108320251178,-0.7096740493104889,0.038363217285371176
"Rockbridge County, Virginia, USA",-0.3233087971353563,-0.2937093428359285,-0.02959945429942784
"Ouachita County, Arkansas, USA",-0.13490497455602865,-0.10367388022143935,-0.0312310943345893
"Mercer County, Kentucky, USA",-0.46638261610566684,-0.5050075585789872,0.03862494247332032
"Barceloneta Municipio, Puerto Rico, USA",,,
"Washington County, Iowa, USA",-0.20484487887802805,-0.20404428584499953,-0.0008005930330285127
"Brooke County, West Virginia, USA",-0.431493993993994,-0.42203266410069695,-0.009461329893297066
"Overton County, Tennessee, USA",-0.5863305768655973,-0.49993923927573214,-0.08639133758986517
"Panola County, Texas, USA",-0.6344039099319253,-0.6346006144393241,0.00019670450739883716
"Beckham County, Oklahoma, USA",-0.7195520885757424,-0.708156779661017,-0.0113953089147254
"Sumner County, Kansas, USA",-0.5045754026354319,-0.506763035622096,0.002187632986664134
"Bibb County, Alabama, USA",-0.5772798332464826,-0.5515364553804286,-0.025743377866053962
"Nobles County, Minnesota, USA",-0.3060240963855422,-0.29726598702502316,-0.008758109360519017
"Asotin County, Washington, USA",-0.2567985942598946,-0.26776910435497125,0.010970510095076658
"Saunders County, Nebraska, USA",-0.4536317235963879,-0.4707202993451824,0.017088575748794466
"Leelanau County, Michigan, USA",0.05219593990115404,-0.03133583792217529,0.08353177782332932
"Meigs County, Ohio, USA",-0.5318235777554561,-0.5060132291040289,-0.025810348651427173
"Waynesboro city-County, Virginia, USA",-0.05094709340300457,-0.1126684050412864,0.06172131163828183
"Mahaska County, Iowa, USA",-0.4737811294282708,-0.45268999247554553,-0.021091136952725242
"Lee County, Virginia, USA",-0.6913331992760909,-0.6294286626236834,-0.06190453665240758
"Grant Parish, Louisiana, USA",-0.7410562180579217,-0.705929032989457,-0.035127185068464684
"Sabine Parish, Louisiana, USA",-0.664873537183843,-0.6310411770716257,-0.03383236011221735
"Limestone County, Texas, USA",-0.5031335898845519,-0.5166516651665166,0.013518075281964692
"Villalba Municipio, Puerto Rico, USA",,,
"Houston County, Texas, USA",-0.5023285351397121,-0.5060457320723093,0.0037171969325972
"Anson County, North Carolina, USA",0.0418081114882973,0.12875468957020045,-0.08694657808190315
"Putnam County, Georgia, USA",-0.40851961197806835,-0.3997043918918919,-0.008815220086176467
"Jo Daviess County, Illinois, USA",-0.16462585034013605,-0.14637374272101641,-0.018252107619119634
"Martin County, North Carolina, USA",-0.049521531100478466,-0.004262788365095286,-0.04525874273538318
"Randolph County, Alabama, USA",-0.5865091815077974,-0.5314616668302738,-0.05504751467752356
"Seward County, Kansas, USA",-0.2907064601435587,-0.30389043271139343,0.013183972567834712
"Henry County, Missouri, USA",-0.5012977382276603,-0.47854752003245765,-0.022750218195202676
"Wyandot County, Ohio, USA",-0.5030734106076572,-0.46867903103709313,-0.03439437957056407
"Prince Edward County, Virginia, USA",0.056258909561771,0.053526224183535025,0.002732685378235976
"Scott County, Tennessee, USA",-0.7752982766239505,-0.7173943563105433,-0.05790392031340719
"Colusa County, California, USA",-0.16588592290129417,-0.13493026076409945,-0.030955662137194723
"Tippah County, Mississippi, USA",-0.6055236586814492,-0.5845154304277206,-0.02100822825372861
"Boone County, West Virginia, USA",-0.5298490901020861,-0.5428999193827019,0.013050829280615739
"Taylor County, Florida, USA",-0.5377786545669757,-0.5110577411698031,-0.02672091339717264
"Mitchell County, Georgia, USA",-0.1048755996876046,-0.09993642720915448,-0.004939172478450118
"Gage County, Nebraska, USA",-0.3668232743043007,-0.34759358288770054,-0.019229691416600136
"Grenada County, Mississippi, USA",-0.12359278695602403,-0.14718295916623378,0.023590172210209745
"McDuffie County, Georgia, USA",-0.1913916786226686,-0.18698748381527838,-0.00440419480739021
"Lampasas County, Texas, USA",-0.5714010962592557,-0.5974405850091408,0.026039488749885042
"Minidoka County, Idaho, USA",-0.5898911547604153,-0.5414059088924466,-0.04848524586796876
"Gaines County, Texas, USA",-0.7970313542361575,-0.7164502164502164,-0.080581137785941
"Stutsman County, North Dakota, USA",-0.43357766844060647,-0.4155588380108321,-0.01801883042977437
"Dakota County, Nebraska, USA",-0.17397703856343832,-0.20969560315670802,0.03571856459326969
"Scott County, Virginia, USA",-0.6781672646977643,-0.66,-0.018167264697764307
"Hertford County, North Carolina, USA",0.3402294526988904,0.3741409778126841,-0.033911525113793695
"Letcher County, Kentucky, USA",-0.594088669950739,-0.6296255747755638,0.035536904824824855
"Hockley County, Texas, USA",-0.6237965934337201,-0.6177191072400653,-0.00607748619365478
"Logan County, Colorado, USA",-0.5572540827952905,-0.5586299115408352,0.0013758287455446494
"Sevier County, Utah, USA",-0.7688893177651259,-0.69852091518373,-0.07036840258139587
"Jersey County, Illinois, USA",-0.48177934154310126,-0.46119552361022653,-0.020583817932874726
"Fayette County, Illinois, USA",-0.6196160350144235,-0.5793427230046948,-0.04027331200972872
"Clark County, Arkansas, USA",-0.14032162001191184,-0.09195402298850575,-0.048367597023406095
"Orocovis Municipio, Puerto Rico, USA",,,
"Coahoma County, Mississippi, USA",0.42877308551935067,0.44344703770197486,-0.014673952182624184
"Wabasha County, Minnesota, USA",-0.2634306179989332,-0.26394523326572006,0.0005146152667868664
"Texas County, Oklahoma, USA",-0.6540481796775947,-0.6510380622837371,-0.003010117393857592
"Wyoming County, West Virginia, USA",-0.7211359404096834,-0.7004214021197803,-0.020714538289903106
"Moore County, Texas, USA",-0.5985838779956427,-0.543002640513014,-0.055581237482628776
"Hubbard County, Minnesota, USA",-0.2884114288532558,-0.3335131944368175,0.04510176558356166
"Owen County, Indiana, USA",-0.49131663974151857,-0.4882776230269266,-0.0030390167145919467
"Newton County, Mississippi, USA",-0.3851517234606697,-0.4017800381436745,0.016628314683004797
"Leake County, Mississippi, USA",-0.14467391304347826,-0.14179192803882115,-0.0028819850046571116
"Llano County, Texas, USA",-0.6014218009478673,-0.6196994352445678,0.018277634296700485
"Nodaway County, Missouri, USA",-0.4057443365695793,-0.40794491525423726,0.00220057868465795
"Fillmore County, Minnesota, USA",-0.22650523021167943,-0.21700587969244686,-0.009499350519232563
"Gray County, Texas, USA",-0.7724235415060395,-0.7831195138419986,0.010695972335959092
"Madison County, North Carolina, USA",-0.2354008785917108,-0.2534845297453229,0.018083651153612074
"Clinton County, Missouri, USA",-0.45031227038941957,-0.4403409090909091,-0.00997136129851045
"Jackson County, Wisconsin, USA",-0.15075244441075747,-0.11740584871047804,-0.033346595700279424
"Logan County, Arkansas, USA",-0.5953799392097264,-0.5089003913647266,-0.08647954784499978
"Union Parish, Louisiana, USA",-0.513614855816445,-0.48476225445199195,-0.028852601364453
"Assumption Parish, Louisiana, USA",-0.3060080106809079,-0.25522743947175347,-0.05078057120915441
"Morgan County, Tennessee, USA",-0.7004132231404959,-0.6542878448918718,-0.04612537824862417
"Morgan County, Missouri, USA",-0.5816380309897755,-0.5661147652528918,-0.015523265736883674
"Shelby County, Illinois, USA",-0.572255291005291,-0.5396003633060854,-0.03265492769920564
"Fairfield County, South Carolina, USA",0.2271753460777851,0.25898642052010296,-0.031811074442317844
"Perry County, Illinois, USA",-0.46762160549089826,-0.4458540546026591,-0.021767550888239173
"Dodge County, Minnesota, USA",-0.3039304176581603,-0.3214755021588136,0.017545084500653285
"Washington County, Nebraska, USA",-0.40513977281881897,-0.4505020174533171,0.04536224463449812
"Bandera County, Texas, USA",-0.5939441604404246,-0.6299667253865727,0.03602256494614808
"Buena Vista County, Iowa, USA",-0.256520142035019,-0.24728195216235807,-0.009238189872660924
"Sullivan County, Indiana, USA",-0.5045585946186346,-0.4673168466271915,-0.03724174799144314
"Worth County, Georgia, USA",-0.47765212708669896,-0.4990338164251208,0.021381689338421828
"Ogemaw County, Michigan, USA",-0.40127656000671874,-0.3655530952151728,-0.03572346479154592
"Carroll County, Iowa, USA",-0.3778561976179974,-0.31572458270106224,-0.06213161491693514
"Pointe Coupee Parish, Louisiana, USA",-0.2279524694850861,-0.17217923645948474,-0.05577323302560136
"Conway County, Arkansas, USA",-0.35451928612550376,-0.2766494260123628,-0.07786986011314095
"Adams County, Wisconsin, USA",-0.25664240988322895,-0.2192497532082922,-0.03739265667493674
"Jones County, Iowa, USA",-0.21466921466921468,-0.19076285404125135,-0.023906360627963336
"Hutchinson County, Texas, USA",-0.7644849174729653,-0.7587982832618025,-0.005686634211162778
"Adams County, Washington, USA",-0.35704537700443534,-0.384151593453919,0.02710621644948369
"Meriwether County, Georgia, USA",-0.20563699457395415,-0.1542866471800761,-0.05135034739387806
"Dukes County, Massachusetts, USA",0.5690732927019847,0.5073667980126777,0.061706494689307
"Allen County, Kentucky, USA",-0.6348830527477797,-0.6324371198735951,-0.0024459328741845976
"Barnwell County, South Carolina, USA",-0.07479895358976843,-0.05155508697944122,-0.023243866610327207
"Buchanan County, Iowa, USA",-0.20892890291442362,-0.15021459227467812,-0.0587143106397455
"Kewaunee County, Wisconsin, USA",-0.3266639107069037,-0.2777932571747005,-0.04887065353220321
"Colorado County, Texas, USA",-0.5064661654135338,-0.5076653013458162,0.0011991359322823802
"Greene County, Virginia, USA",-0.23897091327026787,-0.3144582075569897,0.07548729428672185
"Henry County, Iowa, USA",-0.32378280905630136,-0.30572096980008506,-0.018061839256216294
"Fulton County, Indiana, USA",-0.4827209098862642,-0.48002844613014106,-0.0026924637561231424
"Jay County, Indiana, USA",-0.5244796594134342,-0.47469458987783597,-0.04978506953559825
"Woodward County, Oklahoma, USA",-0.7201027617212589,-0.7207373271889401,0.0006345654676812584
"Lincoln County, West Virginia, USA",-0.5492975734355044,-0.5445796773280498,-0.0047178961074546555
"Greene County, North Carolina, USA",-0.11904489889180853,-0.09502338412672964,-0.024021514765078883
"Uinta County, Wyoming, USA",-0.6280578600297809,-0.5846517119244392,-0.04340614810534171
"Breckinridge County, Kentucky, USA",-0.5247621849563597,-0.515790673811424,-0.008971511144935773
"Carbon County, Utah, USA",-0.45658174097664544,-0.4474346076458752,-0.009147133330770219
"Peñuelas Municipio, Puerto Rico, USA",,,
"Clay County, Kentucky, USA",-0.7702270283032008,-0.7552025934479074,-0.015024434855293367
"Lavaca County, Texas, USA",-0.7320921117099461,-0.712867859203693,-0.019224252506253148
"Buchanan County, Virginia, USA",-0.6759217128889294,-0.6032817168867886,-0.07263999600214088
"Carroll County, Indiana, USA",-0.5120589784096893,-0.5035053442133088,-0.008553634196380444
"Bourbon County, Kentucky, USA",-0.30037819243044483,-0.3161636162788356,0.015785423848390767
"Lincoln County, New Mexico, USA",-0.36367164758393167,-0.40047180408896876,0.036800156505037096
"Santa Isabel Municipio, Puerto Rico, USA",,,
"Yell County, Arkansas, USA",-0.5847797062750334,-0.48578971890045036,-0.09898998737458303
"St. James Parish, Louisiana, USA",0.04416203335980937,0.07960281340504757,-0.0354407800452382
"Labette County, Kansas, USA",-0.3596870255751489,-0.37496908236458076,0.015282056789431842
"Willacy County, Texas, USA",0.11932021466905188,0.3678115799803729,-0.24849136531132102
"Crisp County, Georgia, USA",-0.24891155616370195,-0.22790202342917998,-0.02100953273452197
"Calhoun County, Texas, USA",-0.4438449604835271,-0.36211131099527616,-0.08173364948825096
"Morgan County, Georgia, USA",-0.416417527974716,-0.41271186440677965,-0.0037056635679363348
"DeKalb County, Tennessee, USA",-0.5781745565605545,-0.517900790797987,-0.06027376576256749
"Winneshiek County, Iowa, USA",-0.05122679045092838,-0.007921140644252773,-0.0433056498066756
"Hempstead County, Arkansas, USA",-0.3405373831775701,-0.2871329266562633,-0.05340445652130682
"Richland Parish, Louisiana, USA",-0.3402414486921529,-0.3261435865374596,-0.014097862154693275
"Martin County, Minnesota, USA",-0.3792351712235444,-0.4110720729275472,0.03183690170400283
"Washington County, Georgia, USA",0.007083201184057511,0.006037646501716586,0.0010455546823409257
"Montague County, Texas, USA",-0.764646053702197,-0.7672134935304991,0.0025674398283020983
"Davison County, South Dakota, USA",-0.35072155192808135,-0.352364185110664,0.0016426331825826201
"Dodge County, Georgia, USA",-0.4550185873605948,-0.454701343240926,-0.0003172441196688247
"Taylor County, Wisconsin, USA",-0.46453303387609957,-0.44198078344419806,-0.02255225043190151
"Smith County, Tennessee, USA",-0.5893271461716937,-0.5116998386229156,-0.07762730754877811
"Orange County, Indiana, USA",-0.4765571913929785,-0.45361198357091087,-0.022945207822067604
"DeWitt County, Texas, USA",-0.6249076127124907,-0.6364699006428989,0.011562287930408144
"Spencer County, Indiana, USA",-0.3848082458909834,-0.36932722929936307,-0.015481016591620322
"Union County, Tennessee, USA",-0.6837375353933276,-0.6468704978389627,-0.036867037554364934
"Tyler County, Texas, USA",-0.7020572728212551,-0.6694894146948941,-0.03256785812636098
"Plumas County, California, USA",-0.1673773987206823,-0.20631246712256707,0.038935068401884765
"Wayne County, Mississippi, USA",-0.2668058870326173,-0.25690176060006253,-0.009904126432554783
"Franklin Parish, Louisiana, USA",-0.44362139917695476,-0.43745907007203666,-0.006162329104918096
"Monroe County, Alabama, USA",-0.15860517435320584,-0.14243987927173596,-0.016165295081469883
"Douglas County, Illinois, USA",-0.4454108491645686,-0.45893010160362346,0.013519252439054885
"Pierce County, Georgia, USA",-0.7514367816091954,-0.7397917237599342,-0.011645057849261176
"Vernon County, Missouri, USA",-0.571801850843767,-0.5621432731508444,-0.009658577692922554
"Lincoln County, Montana, USA",-0.496892823699668,-0.5049547608789315,0.008061937179263567
"Jones County, Texas, USA",-0.6908255520972284,-0.6483553180831525,-0.0424702340140759
"Gonzales County, Texas, USA",-0.48110370079769843,-0.4750354386517562,-0.006068262145942249
"Holmes County, Florida, USA",-0.7882793566864948,-0.7748948106591865,-0.01338454602730832
"Elbert County, Georgia, USA",-0.3649547486642678,-0.3454203262233375,-0.019534422440930288
"Duchesne County, Utah, USA",-0.7757998836532868,-0.721405934889081,-0.05439394876420578
"Simpson County, Kentucky, USA",-0.36726981218506644,-0.3895603665825475,0.022290554397481066
"Lincoln County, Wyoming, USA",-0.6815055406954528,-0.6393239436619719,-0.0421815970334809
"Marion County, Kentucky, USA",-0.37980430303066076,-0.3012583355855172,-0.07854596744514358
"Wayne County, Kentucky, USA",-0.6201298701298701,-0.6180703291202603,-0.002059541009609811
"East Feliciana Parish, Louisiana, USA",-0.16975925397278524,-0.1328420633339972,-0.03691719063878804
"Macon County, Alabama, USA",0.6381978677060645,0.6712253829321663,-0.03302751522610181
"Fayette County, Iowa, USA",-0.2267818574514039,-0.19358395989974939,-0.033197897551654504
"Spencer County, Kentucky, USA",-0.5430740467482474,-0.5544911774066217,0.011417130658374242
"Adair County, Oklahoma, USA",-0.5906021384355655,-0.5228005527406725,-0.06780158569489303
"Langlade County, Wisconsin, USA",-0.3247648902821317,-0.3169055566463774,-0.007859333635754306
"Jackson County, Iowa, USA",-0.2614279299506062,-0.192725509214355,-0.06870242073625121
"Chaffee County, Colorado, USA",0.06837731447732906,-0.04471111111111111,0.11308842558844018
"Freestone County, Texas, USA",-0.6142906296593647,-0.592790213430505,-0.021500416228859676
"Los Alamos County, New Mexico, USA",0.26649312616936466,0.20238860817638954,0.06410451799297512
"Benton County, Missouri, USA",-0.5660143198090692,-0.5410366044425905,-0.024977715366478748
"Cherokee County, Kansas, USA",-0.5008764241893077,-0.4845707656612529,-0.016305658528054767
"Polk County, North Carolina, USA",-0.256594918271565,-0.27771435325575716,0.021119434984192165
"Marengo County, Alabama, USA",0.013302752293577982,0.03474622521375296,-0.021443472920174976
"Hart County, Kentucky, USA",-0.5301673550048723,-0.4942851330314181,-0.035882221973454254
"Polk County, Arkansas, USA",-0.6818610129564193,-0.6567853237759689,-0.025075689180450444
"Roosevelt County, New Mexico, USA",-0.42857142857142855,-0.4082093761745002,-0.020362052396928343
"Kent County, Maryland, USA",0.012453479345985414,-0.030027260269839633,0.04248073961582505
"Perry County, Indiana, USA",-0.24558587479935795,-0.1846267918932279,-0.06095908290613006
"Beadle County, South Dakota, USA",-0.38144329896907214,-0.37551683402244534,-0.005926464946626797
"Gem County, Idaho, USA",-0.6173930508134163,-0.5973095297963289,-0.020083521017087436
"Pickens County, Alabama, USA",-0.16259826230864707,-0.15552295116327813,-0.00707531114536894
"McDowell County, West Virginia, USA",-0.5843387467324317,-0.5140183201193486,-0.07032042661308313
"Ashley County, Arkansas, USA",-0.4318697956093868,-0.3624891748113324,-0.0693806207980544
"Butler County, Alabama, USA",-0.1573566610455312,-0.13456252863032525,-0.022794132415205948
"Green Lake County, Wisconsin, USA",-0.3583544185174773,-0.37415038232795245,0.015795963810475155
"Inyo County, California, USA",0.0016879417660090727,-0.13669334667333666,0.13838128843934572
"Humphreys County, Tennessee, USA",-0.49817872753763964,-0.4142317908569831,-0.08394693668065656
"Waseca County, Minnesota, USA",-0.301087688901723,-0.32414793328498914,0.02306024438326615
"Perry County, Missouri, USA",-0.6343812850640415,-0.6169701133631055,-0.01741117170093598
"McIntosh County, Oklahoma, USA",-0.49682063587282543,-0.4247143036544016,-0.07210633221842383
"Greene County, Georgia, USA",-0.26495954476749356,-0.25916289592760183,-0.005796648839891727
"Adair County, Kentucky, USA",-0.6714595458176423,-0.6456080670635402,-0.025851478754102097
"Pike County, Georgia, USA",-0.7110074626865671,-0.6955419882502016,-0.015465474436365478
"Comerío Municipio, Puerto Rico, USA",,,
"Saluda County, South Carolina, USA",-0.3501186111710157,-0.31679121905651564,-0.03332739211450009
"Tishomingo County, Mississippi, USA",-0.7522433792952506,-0.736710070481424,-0.01553330881382664
"Houston County, Minnesota, USA",-0.12945804195804195,-0.1387212372689551,0.009263195310913158
"Paulding County, Ohio, USA",-0.5150618327872318,-0.4881479840496234,-0.026913848737608437
"Harrison County, Kentucky, USA",-0.4443691404043827,-0.43753213367609256,-0.006837006728290129
"Otero County, Colorado, USA",-0.22462406015037595,-0.23485565546616186,0.010231595315785907
"Concordia Parish, Louisiana, USA",-0.2688038060715904,-0.24853471596032461,-0.020269090111265764
"Crawford County, Illinois, USA",-0.5136339522546419,-0.490948670944088,-0.022685281310553917
"Bethel Census Area, Alaska, USA",0.2822706065318818,0.32524271844660196,-0.04297211191472017
"Poweshiek County, Iowa, USA",-0.13323471400394477,-0.06529034882538391,-0.06794436517856085
"Warren County, North Carolina, USA",0.2572622170407073,0.3261461141003194,-0.06888389705961212
"Clay County, Mississippi, USA",0.1632152321130631,0.15715285414375688,0.006062377969306226
"Andrews County, Texas, USA",-0.698106771277503,-0.6241909385113269,-0.07391583276617608
"Deaf Smith County, Texas, USA",-0.4403470715835141,-0.409392789373814,-0.03095428220970009
"Randolph County, Arkansas, USA",-0.6077510275983559,-0.48346135757955794,-0.12428967001879793
"Hampton County, South Carolina, USA",0.1522837184309511,0.19100613218260276,-0.03872241375165167
"Cedar County, Iowa, USA",-0.17041950854900495,-0.17775914474373755,0.007339636194732602
"Lamar County, Georgia, USA",-0.41099679168049563,-0.3849195887160559,-0.026077202964439716
"Fentress County, Tennessee, USA",-0.713369229006759,-0.6733942451929633,-0.03997498381379572
"Ste. Genevieve County, Missouri, USA",-0.4130113876001687,-0.34900756143667294,-0.06400382616349576
"Westmoreland County, Virginia, USA",-0.08225108225108226,-0.07137858642407278,-0.01087249582700947
"Yancey County, North Carolina, USA",-0.33719079130199286,-0.32018072289156624,-0.017010068410426626
"Appling County, Georgia, USA",-0.569168848016087,-0.5796947491556612,0.01052590113957419
"Dickinson County, Kansas, USA",-0.5418761364851856,-0.53836784409257,-0.0035082923926156306
"Frio County, Texas, USA",-0.07599014591624029,0.13363636363636364,-0.20962650955260392
"Jefferson County, Kansas, USA",-0.32099775097117156,-0.3232577665827036,0.0022600156115320513
"Covington County, Mississippi, USA",-0.2604700854700855,-0.24503461582113267,-0.015435469648952815
"Stone County, Mississippi, USA",-0.5283066768215283,-0.5298793470546487,0.0015726702331203546
"Bosque County, Texas, USA",-0.6463894967177243,-0.6433201982966823,-0.003069298421041977
"Wright County, Missouri, USA",-0.7191898386543083,-0.6840869780084012,-0.035102860645907064
