"WV-02 in Grant County, USA",-0.7740061717190052,-0.7736077481840193,-0.00039842353498587
"GA-01 in McIntosh County, USA",-0.20967741935483872,-0.20057597831611046,-0.009101441038728258
"MO-08 in Wayne County, USA",-0.7046614494726098,-0.6439854191980559,-0.06067603027455393
"UT-04 in Juab County, USA",-0.7794928335170893,-0.5924468922108576,-0.18704594130623176
"OK-03 in Noble County, USA",-0.5706763872012961,-0.5768757687576875,0.006199381556391437
"OK-03 in Washita County, USA",-0.7301653757588444,-0.7052472468149428,-0.024918128943901663
"LA-05 in St. Helena Parish, USA",0.10263072426112374,0.14352783366867874,-0.040897109407555005
"VA-01 in Lancaster County, USA",-0.04600111856823266,-0.09841986455981941,0.052418745991586746
"NC-05 in Alleghany County, USA",-0.5004703071075555,-0.47174168077572437,-0.028728626331831097
"MN-08 in Lake County, USA",0.03517819963532046,0.022158150233843273,0.01302004940147719
"MS-03 in Jones County, USA",-0.529335778455156,-0.5650568318611412,0.03572105340598519
"WA-05 in Lincoln County, USA",-0.48869614673681216,-0.5013127953789602,0.012616648642148065
"AK-00 in North Slope Borough, USA",-0.03791546374948466,0.13326764453700393,-0.17118310828648858
"GA-02 in Early County, USA",-0.054945054945054944,-0.08025078369905957,0.025305728754004622
"ND-00 in Barnes County, USA",-0.3141060197663971,-0.29247754491017963,-0.021628474856217494
"NE-03 in Box Butte County, USA",-0.5695811619378498,-0.5470297029702971,-0.02255145896755273
"IA-01 in Louisa County, USA",-0.3327081770442611,-0.2837460063897764,-0.048962170654484716
"VA-04 in Sussex County, USA",0.11949685534591195,0.1633624107850912,-0.04386555543917925
"OK-02 in Pushmataha County, USA",-0.7064781599493564,-0.6319428953825563,-0.07453526456680004
"KY-04 in Carroll County, USA",-0.4444981862152358,-0.38443579766536967,-0.06006238854986612
"IA-04 in Hancock County, USA",-0.43859364873622814,-0.4070856753534321,-0.03150797338279604
"MT-02 in Roosevelt County, USA",-0.021409011700273838,-0.0649671052631579,0.04355809356288406
"GA-12 in Evans County, USA",-0.36825994819872854,-0.35369239311493617,-0.014567555083792372
"NE-03 in Red Willow County, USA",-0.6812179016874541,-0.7056640625,0.024446160812545914
"IA-04 in Winnebago County, USA",-0.2633165829145729,-0.26196647658545014,-0.0013501063291227466
"MO-08 in Ripley County, USA",-0.7007171593493091,-0.6688405797101449,-0.03187657963916424
"IA-03 in Guthrie County, USA",-0.35897033432742115,-0.3297391304347826,-0.029231203892638558
"VA-01 in Middlesex County, USA",-0.2510971859211138,-0.2593865389617452,0.008289353040631386
"MI-01 in Mackinac County, USA",-0.24035312934392897,-0.2747386221449372,0.03438549280100825
"SC-06 in Florence County, USA",0.2879225472507825,0.2790460510743189,0.008876496176463577
"AL-07 in Wilcox County, USA",0.37523293240725053,0.42413849420218847,-0.048905561794937935
"VA-01 in Essex County, USA",-0.006136222924080177,-0.02152867309029838,0.015392450166218204
"NE-01 in Colfax County, USA",-0.43341404358353514,-0.4133585381222432,-0.020055505461291923
"MO-08 in Bollinger County, USA",-0.7382583987965904,-0.7271123654965602,-0.011146033300030167
"IA-02 in Mitchell County, USA",-0.278941944349021,-0.24035443972678605,-0.038587504622234925
"ND-00 in Walsh County, USA",-0.4162659418774827,-0.3943054357204487,-0.021960506157034043
"AR-04 in Bradley County, USA",-0.3067870826491516,-0.2318642211880646,-0.07492286146108701
"NE-03 in Custer County, USA",-0.7181711997330219,-0.7266535221365836,0.008482322403561726
"IN-08 in Crawford County, USA",-0.43042071197411,-0.36449806118052563,-0.06592265079358439
"KY-05 in Leslie County, USA",-0.8054458532529619,-0.8047640249332146,-0.0006818283197472796
"ID-01 in Washington County, USA",-0.5765344311377245,-0.5627384960718294,-0.01379593506589516
"NC-01 in Gates County, USA",-0.13749790654831687,-0.09068991097922849,-0.04680799556908838
"MT-02 in Carbon County, USA",-0.2902722631877482,-0.32176973353443944,0.03149747034669126
"TN-07 in Benton County, USA",-0.5827806931649455,-0.5319458532296373,-0.05083483993530824
"IL-12 in Cumberland County, USA",-0.593208712056251,-0.5703251302317226,-0.02288358182452843
"IL-11 in Cook County, USA",-0.13608604723324527,-0.13377978986549138,-0.002306257367753889
"CO-03 in Eagle County, USA",0.4021891837009106,0.340005930066174,0.06218325363473659
"AL-03 in Coosa County, USA",-0.3349151304982661,-0.30445544554455445,-0.030459684953711652
"TX-01 in Franklin County, USA",-0.6701936514274306,-0.6666666666666666,-0.0035269847607639626
"AL-02 in Bullock County, USA",0.4985909386516367,0.5074309978768577,-0.008840059225221075
"MO-06 in Ralls County, USA",-0.5635817732250088,-0.5375996961640714,-0.02598207706093736
"NC-03 in Camden County, USA",-0.4661515202418948,-0.45385537355173794,-0.012296146690156884
"IA-03 in Montgomery County, USA",-0.38971278393091796,-0.42069785884218874,0.030985074911270782
"IL-02 in Ford County, USA",-0.49024756189047264,-0.4869387755102041,-0.003308786380268547
"AL-07 in Lowndes County, USA",0.458814923189466,0.46858168761220825,-0.009766764422742269
"IL-13 in Piatt County, USA",-0.2331890812250333,-0.29752510760401724,0.06433602637898395
"KY-01 in Metcalfe County, USA",-0.5953711093375897,-0.5444901493829833,-0.0508809599546064
"MS-03 in Noxubee County, USA",0.5244427795467316,0.5645855758880517,-0.04014279634132012
"SD-00 in Roberts County, USA",-0.13373577896447644,-0.15530984829004885,0.021574069325572404
"KS-02 in Nemaha County, USA",-0.6574595355383532,-0.6636079656384225,0.006148430100069269
"OK-02 in Johnston County, USA",-0.6358503881439661,-0.5741662518666003,-0.0616841362773658
"SD-00 in Butte County, USA",-0.5814244064972928,-0.6115835440128706,0.03015913751557786
"TX-13 in Clay County, USA",-0.7745132127955494,-0.7636182902584493,-0.010894922537100116
"AR-01 in Chicot County, USA",0.12381184499146966,0.1518199233716475,-0.028008078380177853
"AR-04 in Pike County, USA",-0.6771078662270372,-0.6191911580005024,-0.05791670822653483
"MI-01 in Alcona County, USA",-0.3831233187031007,-0.3983543078412391,0.015230989138138418
"MO-04 in Howard County, USA",-0.4203496366136319,-0.41071060762100925,-0.009639028992622645
"OK-04 in Love County, USA",-0.6364082433758587,-0.5771971496437055,-0.059211093732153164
"VA-02 in Southampton County, USA",-0.262342581159635,-0.24993249949566873,-0.01241008166396626
"NE-03 in Holt County, USA",-0.7374029257720788,-0.7534489554592038,0.016046029687124985
"AK-00 in Nome Census Area, USA",0.226267152058247,0.23132748714847293,-0.005060335090225937
"KS-01 in Marshall County, USA",-0.482987876417677,-0.4782794778514873,-0.004708398566189709
"IA-01 in Keokuk County, USA",-0.44936828210446916,-0.4108324974924774,-0.03853578461199175
"MO-06 in Lewis County, USA",-0.5573877196788891,-0.5410866636731029,-0.01630105600578624
"AR-02 in Perry County, USA",-0.5331748433110006,-0.45494658615884814,-0.07822825715215248
"IA-04 in Franklin County, USA",-0.3500974658869396,-0.3361513687600644,-0.013946097126875168
"LA-05 in Madison Parish, USA",0.1550321199143469,0.17265426880811496,-0.017622148893768064
"TX-13 in Ochiltree County, USA",-0.7945552389996834,-0.7818000664231153,-0.012755172576568108
"MS-02 in Carroll County, USA",-0.38502017189966675,-0.3833212735166425,-0.0016988983830242277
"MN-01 in Jackson County, USA",-0.3785873861488228,-0.3860320933625091,0.007444707213686286
"CO-04 in Yuma County, USA",-0.6669343505320217,-0.6520559382174911,-0.014878412314530576
"IA-04 in Calhoun County, USA",-0.4220235831114492,-0.4012405504942818,-0.020783032617167407
"MS-01 in Webster County, USA",-0.6020389249304912,-0.5833497731307951,-0.018689151799696102
"TX-11 in Runnels County, USA",-0.7382626445906101,-0.7395557905869911,0.0012931459963809733
"TX-01 in Sabine County, USA",-0.7494081223820798,-0.7280550774526678,-0.021353044929411924
"GA-08 in Lanier County, USA",-0.4166666666666667,-0.4114565141460007,-0.005210152520665978
"TX-19 in Parmer County, USA",-0.6215094339622641,-0.5765656565656566,-0.04494377739660749
"GA-08 in Pulaski County, USA",-0.39122936683912296,-0.3703806612948041,-0.020848705544318835
"MN-07 in Swift County, USA",-0.29493500304705256,-0.255756886172385,-0.039178116874667546
"AR-04 in Scott County, USA",-0.6981132075471698,-0.6065527065527065,-0.09156050099446322
"TX-28 in Duval County, USA",0.026123095190975658,0.35196737044145876,-0.3258442752504831
"UT-03 in Emery County, USA",-0.7421396488362597,-0.7101212686567164,-0.03201838017954328
"MS-02 in Montgomery County, USA",-0.1565619398718304,-0.1404424319647902,-0.016119507907040198
"IA-04 in Sac County, USA",-0.48274616079494126,-0.4668073676132003,-0.015938793181740962
"IN-08 in Martin County, USA",-0.5867029548989113,-0.5810978126289723,-0.005605142269939023
"ND-00 in Mountrail County, USA",-0.3764705882352941,-0.33170969313200194,-0.044760895103292175
"MO-06 in Grundy County, USA",-0.6279017354068064,-0.6077498300475866,-0.020151905359219735
"LA-06 in St. John the Baptist Parish, USA",-0.1482050676757297,-0.21918617628808673,0.07098110861235704
"IN-08 in Fountain County, USA",-0.5861062685312244,-0.5642315265570649,-0.021874741974159506
"MS-02 in Tunica County, USA",0.4643458731049972,0.5085506027474068,-0.044204729642409624
"ND-00 in McLean County, USA",-0.5361271676300579,-0.522859830667921,-0.013267336962136889
"LA-05 in West Carroll Parish, USA",-0.7139746634996041,-0.6839672200042025,-0.03000744349540163
"IA-03 in Clarke County, USA",-0.35931477516059956,-0.2801975752132914,-0.07911719994730815
"IN-09 in Switzerland County, USA",-0.5223812414898822,-0.4389684397822159,-0.0834128017076663
"TX-01 in Marion County, USA",-0.4381167763157895,-0.4289759320434167,-0.009140844272372772
"MN-01 in Rock County, USA",-0.38683206106870227,-0.3550320314114486,-0.03180002965725365
"AR-04 in Sebastian County, USA",-0.6855008171842166,-0.6460730365182591,-0.039427780665957535
"NE-03 in Wayne County, USA",-0.48404761904761906,-0.4934926958831341,0.009445076835515043
"MN-07 in Stevens County, USA",-0.22064896755162242,-0.12652834383104852,-0.09412062372057389
"TX-23 in Zavala County, USA",0.313555454130534,0.5725663716814159,-0.2590109175508819
"UT-03 in Grand County, USA",0.10744598765432099,-0.0035312293092032666,0.11097721696352426
"GA-08 in Irwin County, USA",-0.5100767754318618,-0.4979536152796726,-0.012123160152189227
"VA-05 in Cumberland County, USA",-0.14932452212748865,-0.13481292793377295,-0.014511594193715699
"MI-02 in Midland County, USA",-0.3878003696857671,-0.3362255965292842,-0.0515747731564829
"LA-05 in Caldwell Parish, USA",-0.6784964300713986,-0.6466325660699063,-0.031863864001492326
"IA-04 in Humboldt County, USA",-0.4462173831424817,-0.45527816001572635,0.009060776873244636
"KS-02 in Linn County, USA",-0.6246531906460563,-0.6207363903320533,-0.003916800314002988
"GA-02 in Chattahoochee County, USA",-0.13463969658659924,-0.11294964028776978,-0.02169005629882946
"AZ-06 in Greenlee County, USA",-0.3394843962008141,-0.24242424242424243,-0.09706015377657168
"NM-01 in Santa Fe County, USA",-0.2880373831775701,-0.3174069089277703,0.029369525750200187
"TX-23 in Brewster County, USA",-0.042098714226462046,-0.04797742238946378,0.0058787081630017335
"MO-08 in Iron County, USA",-0.577308362369338,-0.5258215962441315,-0.05148676612520653
"ID-01 in Benewah County, USA",-0.5833500904886386,-0.5574671445639188,-0.025882945924719847
"MN-07 in Yellow Medicine County, USA",-0.37011577424023157,-0.3521607278241092,-0.01795504641612239
"SC-03 in McCormick County, USA",-0.04756889591012814,-0.03316717791411043,-0.014401717996017707
"KS-02 in Brown County, USA",-0.4826660702303735,-0.5061942517343905,0.023528181504016976
"IA-02 in Howard County, USA",-0.27329568374344493,-0.20486948892300944,-0.06842619482043549
"NE-03 in Cheyenne County, USA",-0.6207764952780692,-0.6373247033441208,0.016548208066051617
"OK-02 in Latimer County, USA",-0.6295598964462227,-0.5678007889546351,-0.06175910749158753
"IL-11 in DeKalb County, USA",-0.17885788676066736,-0.20572061794090304,0.02686273118023569
"NE-03 in Hamilton County, USA",-0.5767214892463401,-0.5894886363636364,0.012767147117296207
"KS-01 in Rice County, USA",-0.5318360731650845,-0.5630914826498423,0.0312554094847578
"MN-07 in Pipestone County, USA",-0.4548582995951417,-0.4598585690515807,0.005000269456438999
"MT-01 in Deer Lodge County, USA",0.07687589450010222,0.07033857892226991,0.006537315577832312
"CO-02 in Clear Creek County, USA",0.12981062919975564,0.026252983293556086,0.10355764590619955
"IA-04 in Emmet County, USA",-0.35957139913455594,-0.3717652009257311,0.012193801791175185
"SD-00 in Charles Mix County, USA",-0.3634681469733016,-0.42149723274104284,0.05802908576774124
"MT-01 in Beaverhead County, USA",-0.4089383501148207,-0.45576407506702415,0.04682572495220344
"OK-02 in Nowata County, USA",-0.6599863356866318,-0.6086853906065612,-0.05130094508007055
"SD-00 in Todd County, USA",0.5636077195746357,0.47905882352941176,0.08454889604522398
"IL-12 in Jasper County, USA",-0.6253586800573888,-0.5940420560747663,-0.03131662398262247
"MO-04 in St. Clair County, USA",-0.5918777643747487,-0.5539956803455723,-0.037882084029176366
"KY-01 in Clinton County, USA",-0.7455393349553934,-0.7317182593091073,-0.013821075646286096
"NC-09 in Richmond County, USA",0.026158652953040852,0.07774137605322856,-0.05158272310018771
"GA-12 in Johnson County, USA",-0.39707317073170734,-0.37561108093427487,-0.02146208979743247
"GA-02 in Terrell County, USA",0.08423913043478261,0.09399665151877541,-0.009757521083992804
"TX-25 in Somervell County, USA",-0.6731425216717515,-0.6838134024727607,0.010670880801009197
"WI-07 in Forest County, USA",-0.3095190975658025,-0.2657865786578658,-0.04373251890793667
"NC-03 in Jones County, USA",-0.19601809954751132,-0.17733376521821637,-0.01868433432929495
"LA-06 in Iberville Parish, USA",-0.33639859696572716,-0.31568120857194365,-0.02071738839378351
"KS-04 in Pratt County, USA",-0.5257432922407542,-0.5380010411244144,0.012257748883660158
"MI-01 in Montmorency County, USA",-0.4340331114524663,-0.4414054701537233,0.007372358701256965
"KY-02 in McLean County, USA",-0.5351317440401505,-0.5240911081909768,-0.011040635849173697
"GA-02 in Seminole County, USA",-0.34938208032955714,-0.32272473478503627,-0.026657345544520872
"MS-02 in Claiborne County, USA",0.7122948977298269,0.7415730337078652,-0.0292781359780383
"IA-03 in Davis County, USA",-0.492198927352511,-0.44976816074188564,-0.04243076661062534
"TX-25 in Stephens County, USA",-0.7852825229960578,-0.7769742551345097,-0.008308267861548146
"KY-02 in Hancock County, USA",-0.39110529758011775,-0.35965525273701376,-0.031450044843103986
"NV-02 in White Pine County, USA",-0.5822842755779355,-0.5343228200371057,-0.047961455540829756
"OH-07 in Holmes County, USA",-0.6411527735349475,-0.5927545910335303,-0.04839818250141714
"IL-15 in Vermilion County, USA",-0.49250541622636906,-0.43533267673894543,-0.05717273948742363
"MN-07 in Marshall County, USA",-0.47447682378251516,-0.4116670126634835,-0.06280981111903167
"KS-01 in Cloud County, USA",-0.5446868402533427,-0.5491094147582697,0.0044225745049270015
"NE-01 in Cuming County, USA",-0.5924511345764997,-0.5971669980119284,0.004715863435428735
"GA-08 in Turner County, USA",-0.247626582278481,-0.2501473187978786,0.002520736519397604
"IA-04 in Palo Alto County, USA",-0.37333602258975396,-0.35785668722092284,-0.015479335368831115
"KY-01 in Crittenden County, USA",-0.6412069778406412,-0.662125340599455,0.02091836275881387
"TX-19 in Mitchell County, USA",-0.6872093023255814,-0.647005444646098,-0.040203857679483423
"MS-03 in Kemper County, USA",0.23250898330162756,0.2261263203276568,0.0063826629739707486
"MN-08 in Hubbard County, USA",-0.2856738362002602,-0.316404808705354,0.030730972505093768
"NE-03 in Phelps County, USA",-0.679776402475544,-0.7079282782458415,0.02815187577029743
"MT-02 in Stillwater County, USA",-0.5775681341719078,-0.5657624332100287,-0.011805700961879051
"MT-02 in Dawson County, USA",-0.5794818652849741,-0.5848533825906257,0.005371517305651552
"VA-01 in Richmond County, USA",-0.2519191826392432,-0.23641982006395418,-0.015499362575289
"LA-05 in Catahoula Parish, USA",-0.4676821737340469,-0.4441927512355848,-0.023489422498462087
"KY-01 in Livingston County, USA",-0.6138317009794123,-0.5778591427956062,-0.03597255818380607
"GA-08 in Wilkinson County, USA",-0.12348008385744234,-0.10261804581580178,-0.020862038041640565
"PA-15 in Indiana County, USA",-0.6446622919971139,-0.6495249768548311,0.004862684857717237
"MI-01 in Alger County, USA",-0.18750664663288158,-0.20430881171836157,0.016802165085479992
"MO-06 in Caldwell County, USA",-0.6040153780435711,-0.5553235908141962,-0.04869178722937484
"IA-03 in Greene County, USA",-0.287522246391141,-0.23418377929890064,-0.053338467092240355
"GA-08 in Wilcox County, USA",-0.46967387991466014,-0.41843255970400267,-0.05124132021065747
"IA-04 in Monona County, USA",-0.3893824027072758,-0.40966754155730534,0.020285138850029527
"NM-03 in Quay County, USA",-0.378001549186677,-0.3341962501968145,-0.04380529898986252
"GA-10 in Hancock County, USA",0.4391602237818199,0.5196386536626163,-0.0804784298807964
"OK-03 in Blaine County, USA",-0.6275314022045629,-0.5728974426575271,-0.05463395954703587
"ID-01 in Clearwater County, USA",-0.5829373161348721,-0.5651144435674822,-0.017822872567389902
"WY-00 in Sublette County, USA",-0.6187122736418511,-0.6298405466970387,0.011128273055187599
"IN-04 in Benton County, USA",-0.4863680623174294,-0.4661062906724512,-0.02026177164497822
"CA-01 in Modoc County, USA",-0.4515905947441217,-0.4840340606705695,0.032443465926447757
"KY-04 in Gallatin County, USA",-0.5541699142634451,-0.507641594246329,-0.04652832001711604
"KY-01 in Lyon County, USA",-0.4749290444654683,-0.4402928553395607,-0.0346361891259076
"WI-05 in Walworth County, USA",-0.35095879867888263,-0.3711505421410741,0.02019174346219149
"GA-12 in Jenkins County, USA",-0.2590448625180897,-0.2529488859764089,-0.006095976541680814
"SD-00 in Turner County, USA",-0.4729551451187335,-0.476144578313253,0.003189433194519531
"MO-06 in Monroe County, USA",-0.5668079411108633,-0.5560646250301423,-0.010743316080720988
"TX-01 in Red River County, USA",-0.5622182268016609,-0.5425804184300884,-0.019637808371572474
"TX-04 in Bowie County, USA",-0.572632777087411,-0.582218649525754,0.009585872438342968
"MO-08 in Oregon County, USA",-0.638109305760709,-0.6012427683736876,-0.03686653738702139
"IA-03 in Lucas County, USA",-0.4326133909287257,-0.3762057877813505,-0.056407603147375196
"KS-02 in Wilson County, USA",-0.6145675265553869,-0.6109718741297688,-0.003595652425618101
"OK-03 in Woods County, USA",-0.6530723219140837,-0.6611232279171211,0.008050906003037372
"MT-01 in Madison County, USA",-0.3975685887957943,-0.4463419776512756,0.04877338885548127
"TX-23 in Dimmit County, USA",0.24004364429896344,0.3717829457364341,-0.13173930143747067
"AR-01 in Pulaski County, USA",0.35413600235501913,0.33136829041265903,0.022767711942360103
"GA-12 in Montgomery County, USA",-0.4994957135653051,-0.5117911285794498,0.012295415014144662
"WY-00 in Platte County, USA",-0.6110095470241722,-0.6001324795760653,-0.010877067448106903
"AR-01 in Lee County, USA",0.04810393258426966,0.16721744877726372,-0.11911351619299405
"MS-02 in Wilkinson County, USA",0.3452152128409204,0.3647883315546069,-0.0195731187136865
"TX-13 in Archer County, USA",-0.8035863219349458,-0.7919682465561523,-0.011618075378793558
"MO-08 in Ozark County, USA",-0.680921052631579,-0.6476338591424128,-0.0332871934891662
"VA-01 in Mathews County, USA",-0.35633367662203913,-0.3679156467708529,0.011581970148813792
"MN-08 in Clearwater County, USA",-0.44826004986849655,-0.4296306207474692,-0.01862942912102733
"AL-07 in Perry County, USA",0.4820267686424474,0.4579386131110269,0.02408815553142052
"OK-03 in Kiowa County, USA",-0.576014006419609,-0.523618665903235,-0.052395340516373956
"MO-06 in Carroll County, USA",-0.6443071491615181,-0.6271497362990139,-0.017157412862504162
"AR-04 in Montgomery County, USA",-0.597727859540408,-0.5324529362180388,-0.06527492332236917
"KY-04 in Trimble County, USA",-0.5128501968048159,-0.49947201689545934,-0.01337817990935658
"TX-25 in Jack County, USA",-0.8162347964040191,-0.7937313432835821,-0.022503453120437
"WY-00 in Johnson County, USA",-0.6072446072446073,-0.6427439438532941,0.03549933660868687
"WV-02 in Ritchie County, USA",-0.7151528981593496,-0.7138660740033195,-0.0012868241560300975
"IN-04 in Warren County, USA",-0.5428315813017222,-0.5206276891926095,-0.022203892109112666
"MO-03 in Maries County, USA",-0.6451477677635716,-0.6148888888888889,-0.030258878874682704
"MO-06 in Daviess County, USA",-0.6027116909695575,-0.5511363636363636,-0.05157532733319381
"KY-05 in Bath County, USA",-0.4174299361153196,-0.3429838880885585,-0.07444604802676108
"KY-04 in Bracken County, USA",-0.6121583411875589,-0.5687553161326907,-0.04340302505486815
"NE-03 in Knox County, USA",-0.5995316159250585,-0.6057928325969563,0.006261216671897718
"MA-09 in Norfolk County, USA",0.38525313106367964,0.25575757575757574,0.1294955553061039
"NE-03 in Cedar County, USA",-0.6903522818254604,-0.6794401101422671,-0.01091217168319325
"WV-01 in Webster County, USA",-0.6316872427983539,-0.5873655913978495,-0.04432165140050437
"NE-01 in Butler County, USA",-0.5933748332592264,-0.60825267447784,0.014877841218613685
"AK-00 in Kusilvak Census Area, USA",0.3356531049250535,0.4054621848739496,-0.06980907994889607
"TN-07 in Perry County, USA",-0.6301050175029171,-0.5499124343257443,-0.08019258317717282
"KS-02 in Coffey County, USA",-0.5531215772179627,-0.5710422812192724,0.01792070400130963
"ND-00 in Mercer County, USA",-0.6742245989304813,-0.6702263989747971,-0.0039981999556841785
"NE-03 in Keith County, USA",-0.6372593950504125,-0.6668335419274093,0.029574146876996776
"MT-02 in Rosebud County, USA",-0.34110787172011664,-0.3680232558139535,0.02691538409383687
"AK-00 in Sitka City and Borough, USA",0.17621880988491082,0.08857553608473666,0.08764327380017416
"SD-00 in Custer County, USA",-0.4240990171095741,-0.4600720186401186,0.0359730015305445
"WV-02 in Tyler County, USA",-0.6616793208475152,-0.6811975381244821,0.019518217276966898
"AR-04 in Nevada County, USA",-0.3147706968433591,-0.25970425138632164,-0.05506644545703748
"GA-08 in Atkinson County, USA",-0.4675118858954041,-0.4524904214559387,-0.015021464439465393
"TN-07 in Houston County, USA",-0.5010851871947911,-0.4154040404040404,-0.08568114679075073
"AR-01 in Prairie County, USA",-0.6100143061516452,-0.4909988385598142,-0.11901546759183101
"MO-04 in Hickory County, USA",-0.5728346456692913,-0.5351694915254237,-0.03766515414386762
"MS-01 in Choctaw County, USA",-0.43002604783329385,-0.3862238622386224,-0.04380218559467147
"TX-31 in Hamilton County, USA",-0.6811095827602017,-0.713969571230982,0.03285998847078031
"MI-01 in Oscoda County, USA",-0.43578169881001233,-0.4416891726000491,0.005907473790036755
"NE-03 in Dawes County, USA",-0.44867750545983986,-0.49809575625680086,0.049418250796960994
"MN-07 in Murray County, USA",-0.3909313725490196,-0.3596829477292202,-0.031248424819799392
"OR-02 in Lake County, USA",-0.6137978455191382,-0.6063613231552163,-0.007436522363921894
"MI-01 in Baraga County, USA",-0.2561942517343905,-0.2871060171919771,0.030911765457586615
"MO-06 in Harrison County, USA",-0.68,-0.649375339489408,-0.030624660510592094
"IL-15 in Mercer County, USA",-0.25015690867546464,-0.21753537960577013,-0.03262152906969451
"IN-09 in Bartholomew County, USA",-0.540947251218798,-0.5402693179882564,-0.0006779332305416608
"KS-01 in Clay County, USA",-0.5459110473457676,-0.5795811518324607,0.033670104486693164
"CO-03 in San Miguel County, USA",0.5416747619972799,0.4486024486024486,0.09307231339483135
"CO-04 in El Paso County, USA",-0.6305922389361434,-0.637295601051407,0.006703362115263678
"WV-01 in Clay County, USA",-0.6056463595839524,-0.5827725437415882,-0.022873815842364253
"VA-02 in Franklin city-County, USA",0.26210605678012117,0.2780647904581247,-0.015958733678003545
"MI-01 in Schoolcraft County, USA",-0.31633298208640676,-0.2857486759749639,-0.03058430611144286
"SC-06 in Allendale County, USA",0.5240745894795436,0.5417594654788419,-0.017684875999298355
"NC-11 in Graham County, USA",-0.6012861736334405,-0.6034069097888676,0.002120736155427072
"GA-08 in Twiggs County, USA",-0.07335733573357335,-0.015779092702169626,-0.05757824303140373
"ND-00 in Traill County, USA",-0.24879110251450676,-0.2603610475464022,0.011569945031895457
"IL-12 in Hamilton County, USA",-0.6044032444959444,-0.5770523283725396,-0.02735091612340479
"VA-04 in Southampton County, USA",-0.0635346950082494,-0.027265505368349284,-0.03626918963990012
"FL-02 in Liberty County, USA",-0.6036465638148668,-0.571256038647343,-0.03239052516752383
"ID-02 in Lemhi County, USA",-0.5403123680878008,-0.55615234375,0.01583997566219919
"KS-01 in Thomas County, USA",-0.65748031496063,-0.6809284116331096,0.0234480966724796
"TX-01 in San Augustine County, USA",-0.506496751624188,-0.478345906677843,-0.028150844946344955
"ID-02 in Power County, USA",-0.4069616135328562,-0.35061638868745465,-0.056345224845401554
"NE-03 in Richardson County, USA",-0.5033931168201649,-0.517095149748211,0.01370203292804617
"IL-16 in Livingston County, USA",-0.5423666228418027,-0.49880841063062914,-0.043558212211173564
"WV-01 in Pocahontas County, USA",-0.46107784431137727,-0.43006034009873834,-0.031017504212638936
"KS-03 in Anderson County, USA",-0.5661919831223629,-0.5262686567164179,-0.03992332640594498
"AR-01 in Searcy County, USA",-0.6909491572951966,-0.6314368051287682,-0.05951235216642836
"GA-02 in Taylor County, USA",-0.26855952070851785,-0.22555066079295155,-0.0430088599155663
"WV-02 in Doddridge County, USA",-0.7042889390519187,-0.7028169014084507,-0.0014720376434680382
"TX-23 in Winkler County, USA",-0.6561618062088429,-0.5239872068230277,-0.13217459938581522
"MS-02 in Humphreys County, USA",0.45309142993554546,0.45144603809075945,0.001645391844786015
