"Mecklenburg County, Virginia, USA",387.86121048851476,178.15350471189672,72.6090818903432,39.3801030025158
"Ottawa County, Oklahoma, USA",761.4721664529224,539.4919223725691,237.92814482693998,120.51286455492672
"Iberville Parish, Louisiana, USA",1379.6692513521778,584.2695060122545,213.44778286525616,106.4368325649979
"Caledonia County, Vermont, USA",491.8108485822732,249.48872748314207,92.55586101019111,47.65564575985185
"McPherson County, Kansas, USA",967.760633905903,742.2332716678039,338.560313425725,149.76647604405062
"Knox County, Kentucky, USA",662.0047537864485,290.0334563871931,136.79603844939686,101.29745285075379
"Austin County, Texas, USA",717.8639945430701,303.7407117478976,122.0330748012189,59.8833728821136
"Randolph County, Illinois, USA",1392.933601844691,542.2544147728463,166.9686709316268,66.77743867750426
"Wayne County, Georgia, USA",719.9379184443368,286.8480516944811,135.01758141770327,91.85702951411682
"Madison County, Georgia, USA",517.1944684721811,164.0757264811379,77.10826344951533,63.69118602615642
"Cass County, Minnesota, USA",309.7245605873279,108.42448231424113,28.1586150863143,18.441204276754018
"Door County, Wisconsin, USA",499.55276009032553,284.95530979167864,142.03722922273397,77.36700963530222
"Meade County, Kentucky, USA",939.4098263058208,314.4316043868437,90.79900900713062,66.80857026837938
"Haralson County, Georgia, USA",476.9534311805263,217.57535582964147,123.61705769793025,81.80449971058675
"Meade County, South Dakota, USA",1081.0919504146643,626.6375180365696,226.79653764555158,100.15515418921535
"Smyth County, Virginia, USA",586.2934839463514,273.1048833850637,114.34526141096003,65.51359078490141
"Schoharie County, New York, USA",458.96239375428456,237.98813862995442,73.8693830730092,39.47074450726426
"Park County, Wyoming, USA",763.5990272344011,520.6384550144179,251.08431351030276,111.29615610839502
"Sumter County, Georgia, USA",895.532105170684,488.83327287956564,302.5583242604405,194.6223441922908
"Bladen County, North Carolina, USA",357.1753878175156,132.52709436270524,49.14049444256326,31.12057771513535
"Adams County, Mississippi, USA",1093.525065118652,505.61182355241476,231.6472369774502,166.53960772853566
"Franklin County, Maine, USA",555.9765419197125,267.1368172150152,78.95301694720759,41.68679597930197
"Decatur County, Georgia, USA",687.4102676837522,409.01542452610056,228.0525283129741,136.902888362829
"Marion County, Alabama, USA",309.3175803680683,136.65612641903536,66.74491062437448,44.23768083278183
"Orange County, Vermont, USA",358.71564506309505,118.99234817074158,38.54335242138728,27.237744064012915
"Grimes County, Texas, USA",1136.959236651216,405.23145458304725,114.80723496414846,56.918275249852115
"Naranjito Municipio, Puerto Rico, USA",1847.6266809040994,652.0162564256349,413.3556277918422,415.8161374400565
"Gallia County, Ohio, USA",475.16219168150445,189.3075823761004,65.45463544202036,47.422541069750416
"Marion County, South Carolina, USA",509.9015697989105,301.18046662795285,152.7575939089816,82.40094339009153
"Carroll County, Virginia, USA",455.0441947045084,131.32808536699696,47.59711751493859,41.546484732416054
"Morgan County, Colorado, USA",1310.3556299447673,909.1043629283366,408.8048914997511,160.49345251015262
"Hancock County, West Virginia, USA",1147.9879577433608,638.955452526411,335.1447621742955,243.03357013717408
"Neshoba County, Mississippi, USA",506.0497508648293,202.98026231890842,91.57588403265595,55.63662397655812
"Mason County, Michigan, USA",610.5515819805225,399.8444178932434,195.87775215986457,92.55562529994167
"Barranquitas Municipio, Puerto Rico, USA",1476.5169056612672,529.100694026443,350.1602537151,310.80016397765837
"Ripley County, Indiana, USA",506.9380742266769,290.6347215790068,116.74255496087383,60.476695792259534
"Fayette County, Ohio, USA",1018.4978723012256,692.2374845230969,379.76247605081113,176.9852780408642
"Ellis County, Kansas, USA",1567.815795194288,1119.645948628255,590.203776688841,313.41678272392534
"Van Wert County, Ohio, USA",763.111066643165,581.2394633859378,303.58458819775933,125.89139426232464
"Glenn County, California, USA",1195.3217052928196,841.8353679388989,363.4413312658415,142.89123233041815
"Pine County, Minnesota, USA",568.1667882056,215.1004519795993,53.94738570930904,29.552165802550967
"Alpena County, Michigan, USA",825.2811492242134,533.2052412178971,239.2737742705973,134.79926648270688
"Marion County, Tennessee, USA",517.288390713289,217.27572107546268,75.55266782902375,50.53697761194083
"Garrett County, Maryland, USA",442.51947356982384,173.94946857188165,62.9469043430119,40.61831074736314
"Jasper County, South Carolina, USA",1081.7946612692958,351.23704334773436,117.45769958334027,82.69535176242425
"Cherokee County, North Carolina, USA",531.4750577355484,167.66670655656196,58.242886957885624,43.2457718517947
"Morovis Municipio, Puerto Rico, USA",1686.9646115754617,859.8083774117342,429.57591743883324,334.3096214752773
"Stoddard County, Missouri, USA",544.393344106299,369.3925869229091,169.25405043652964,89.78053819705963
"Le Sueur County, Minnesota, USA",785.7453675132134,486.9327777811986,177.7300605910454,72.03329953426369
"Elmore County, Idaho, USA",1426.1920976608014,945.0333368991237,496.9316591041857,240.7686857083047
"Marion County, Missouri, USA",1046.5815698037716,683.0213974208958,379.213321877106,213.07864294053286
"Custer County, Oklahoma, USA",1121.1988549504806,882.3774658170432,414.02973142085585,164.55817679914045
"Perry County, Kentucky, USA",678.3922965581156,262.6048847258627,90.84653642453443,64.18663782579318
"Cass County, Texas, USA",336.2859487011587,159.91439419027327,72.556531395247,42.54549009470526
"Carroll County, Tennessee, USA",484.88991102580616,251.206132937182,106.51730530475447,54.7676446536913
"Sanpete County, Utah, USA",1274.2924511997687,713.6907256600708,207.01534518425504,67.07648655753181
"Lincoln County, Wisconsin, USA",674.6605763055846,388.3745802443112,177.52182960365042,92.12782390026626
"Palo Pinto County, Texas, USA",753.4854952495294,501.04362653168323,245.1587891653916,150.0394059115254
"Copiah County, Mississippi, USA",527.3290693478818,234.59016712009034,111.98998891992575,61.12427697192131
"Jones County, Georgia, USA",948.7967106585711,300.5347039538179,121.76715511046213,104.0739154707349
"Leflore County, Mississippi, USA",1149.7359828290596,738.1626815564938,396.64379090252413,231.8520571237498
"Codington County, South Dakota, USA",1175.0320276755415,905.3085579590598,530.3893234580498,277.71569856911765
"Bradford County, Florida, USA",1681.8739070544789,495.1412791499706,130.5095416250167,86.45330473202742
"Utuado Municipio, Puerto Rico, USA",1081.8136774699776,542.7227764453339,281.79153450240796,179.1589771083805
"Dillon County, South Carolina, USA",504.4858418393042,272.3909961415499,141.92663426891045,86.70376744581077
"Wythe County, Virginia, USA",599.7225595500981,247.36510476990762,113.92927418308709,66.515807784177
"Montgomery County, Illinois, USA",992.77432749685,586.7400010681849,188.66333458746786,78.00265453869795
"Dunklin County, Missouri, USA",670.5927547906504,482.7140893921623,220.77890366432993,99.35916048444095
"Baker County, Florida, USA",1359.403876118461,473.93567725119766,181.59983666633843,114.56927668645075
"Carroll County, Arkansas, USA",578.6950345122109,260.8613287414767,111.40004385804826,54.26029838198135
"Grant County, New Mexico, USA",746.8408920467548,453.7425040797419,206.89835133908383,116.15544692140492
"Washington County, Indiana, USA",482.27758620359947,235.99207170313608,98.78077028160484,54.88791366593288
"Wells County, Indiana, USA",765.5393878688432,487.4771097368173,215.34315838593906,106.67571288373449
"Montgomery County, Kentucky, USA",1442.7607428015408,592.3340065137461,241.7505927705202,139.1873996811581
"Lares Municipio, Puerto Rico, USA",1115.2429324518655,456.3151876622393,293.9718301599619,223.91233041991447
"Winchester city-County, Virginia, USA",2212.573344540982,1620.983640024848,1064.317780612235,693.2030646923995
"Currituck County, North Carolina, USA",1947.7453557577062,541.2994245766122,84.06689829238776,52.51189444833715
"Tate County, Mississippi, USA",870.727801304321,349.12288203902955,125.15671602523896,65.71581551962545
"Hocking County, Ohio, USA",728.5281490302859,385.78041567585933,160.5305382728482,83.45118512586433
"White County, Georgia, USA",740.6053819353303,219.53436028393844,88.45198368234982,70.0025672580282
"Scott County, Mississippi, USA",471.3910354031555,223.35746714930687,95.56237367267387,45.23299195536686
"Peach County, Georgia, USA",1179.5950235413688,480.94303693153194,232.08006442412406,164.07081950345878
"Logan County, Illinois, USA",2003.811811874011,951.7525421456793,349.98720188162906,165.43827498350632
"Fredericksburg city-County, Virginia, USA",3418.5954861911114,1664.5342863302967,952.9039509074557,773.5434006414399
"Monroe County, Georgia, USA",706.5559964519979,226.4863477836328,82.83848272137988,65.29706414365917
"Dinwiddie County, Virginia, USA",895.2043501012986,267.7472827653307,113.01198593779846,90.08932039320196
"Randolph County, West Virginia, USA",1010.973349284031,455.9573737338463,175.53681118436572,94.7183775161331
"Henderson County, Tennessee, USA",407.6018343036,170.44887327527007,81.00356088679425,57.37293324725771
"Jackson County, West Virginia, USA",732.8620636464635,299.45502299107704,97.19755010113496,46.817528578501424
"Union County, Mississippi, USA",462.88200335775036,178.23506358637283,72.48774537809602,55.16742306866207
"Del Norte County, California, USA",2533.044055612207,975.9092207142522,327.5453360826926,167.0819849536764
"Upson County, Georgia, USA",660.3801689547474,346.936677855457,205.02247263878328,136.04244214625993
"Henry County, Ohio, USA",601.9157786916041,383.907774851827,175.9466641290255,79.26822998760282
"Jennings County, Indiana, USA",557.5902968875956,295.034082393249,160.95505737245944,83.56366222751679
"Adams County, Ohio, USA",491.6121670201767,233.81153401647322,60.717303797820115,33.34371357635461
"Logan County, Kentucky, USA",586.7707175758941,249.07920327124387,97.90915685115671,60.344560207018205
"San Jacinto County, Texas, USA",767.2360653996611,219.74176013780382,47.283358422155914,31.276970185970224
"Orleans County, Vermont, USA",439.5295603882576,187.0643278834263,52.798079297292624,32.82159930107029
"Tillamook County, Oregon, USA",763.1475221341891,431.41795146803736,119.22549261722801,57.70224854136988
"White County, Tennessee, USA",597.9094915769846,212.2549581573697,79.16591831187516,55.4821254050812
"Fluvanna County, Virginia, USA",1185.353167698954,432.2638675525033,166.38504218728312,105.70507876386937
"Union County, South Carolina, USA",542.6797063653461,254.75147299163442,137.73034459184979,92.01981406129754
"McDonough County, Illinois, USA",1027.1366166522755,755.1839060860793,405.0506477927692,186.49579303706346
"San Miguel County, New Mexico, USA",829.6900890977836,591.4335536493656,299.09953173310447,158.43920735109333
"West Baton Rouge Parish, Louisiana, USA",1357.894549906575,654.4714811489781,265.1625333062443,174.10834331246446
"Cibola County, New Mexico, USA",901.8009129788979,487.9788958077091,192.7795467685592,81.98266709029978
"Pike County, Ohio, USA",572.8716841279454,245.63346885810557,81.15805733526113,44.22731261010779
"Iroquois County, Illinois, USA",564.2575208372904,380.4012979666893,101.34767179065862,34.43004006466078
"Toombs County, Georgia, USA",539.9950694313562,287.29036991602766,172.73463988833566,110.916465748797
"Caddo County, Oklahoma, USA",2497.158765277338,803.5434849466274,132.14103030222523,51.57243234932629
"Mineral County, West Virginia, USA",1065.4161095168292,471.18489119152105,166.60129465627534,105.29415388146003
"Woodford County, Kentucky, USA",1386.4891108922122,766.7151823496965,398.8927270256449,227.7072981521985
"Hardin County, Tennessee, USA",417.8289008710577,211.79467384008706,119.10468509803869,72.21471954949024
"Harlan County, Kentucky, USA",603.1832709648475,248.47238158565204,75.31126667775916,49.5724442304071
"De Soto Parish, Louisiana, USA",762.8982381861339,279.1171207333003,102.07082505066514,54.56164916548652
"Dawson County, Georgia, USA",1286.862704231499,369.4987911105643,133.12715004916572,107.41340487433357
"Stephens County, Georgia, USA",570.2019616896872,297.2311260012659,189.82810089107429,129.55268298306845
"Yazoo County, Mississippi, USA",3677.33424078694,1141.269549018219,273.8271835510891,143.55662941448838
"Gillespie County, Texas, USA",802.7609296260031,375.5638357877887,160.45878981455456,106.9327410330418
"King George County, Virginia, USA",1410.126589262299,440.5693270395386,94.35311081459268,72.50728954491065
"Carroll County, Ohio, USA",433.7225396238948,232.4066474277598,93.6978701113848,52.71242642640496
"Juneau County, Wisconsin, USA",555.5018749345862,272.89068613032356,80.77788595390481,38.57178231478176
"Boone County, Iowa, USA",881.1662186521573,647.766087380374,320.40816374477015,143.2539478784479
"Wasco County, Oregon, USA",1337.7660072241167,1003.6180618470556,384.1227258105514,195.35491392507956
"Marlboro County, South Carolina, USA",1025.2854180363654,405.7125026221508,141.41893097085728,89.03677758056794
"Geneva County, Alabama, USA",333.65724886747296,165.8511161340218,68.44107319944273,38.666540143739205
"Oceana County, Michigan, USA",337.95528604477926,180.1648522665522,61.55448316915516,32.68186593447511
"Carter County, Kentucky, USA",599.7874406734504,232.55427651794682,89.78444778222706,56.22292932851968
"Lewis County, New York, USA",339.4458636415464,180.79972818789028,59.94080687906587,30.511956057159708
"Cass County, Nebraska, USA",771.4447247996593,456.6649931472804,168.04964780670417,64.98066237508736
"Ashe County, North Carolina, USA",520.0123585209567,154.87133543666903,51.58960441076393,42.71067773363383
"Decatur County, Indiana, USA",841.0155060584519,545.3503044598127,283.60056611056007,131.01973612579246
"Clay County, Indiana, USA",672.0745818106684,444.5707871463868,242.45584110374733,121.65202478668256
"Mille Lacs County, Minnesota, USA",557.0380420930458,310.25574018124286,106.63520437957568,51.79785714846879
"Grayson County, Kentucky, USA",651.2740751973719,250.4878565632086,94.43229936317854,54.760453920097035
"Grady County, Georgia, USA",511.27934612521375,283.01112027815,165.77041339310054,99.68362087804432
"Union County, Oregon, USA",1095.1100467726737,807.3829895069722,418.36222559132074,184.6235729707819
"Wyoming County, Pennsylvania, USA",470.7091723426152,191.82526661288955,58.525327610111894,42.147502355169514
"Elbert County, Colorado, USA",643.5652838247186,223.99508949682297,61.45913285693112,43.77626571324539
"Charlevoix County, Michigan, USA",439.05037023017326,228.76636105388368,90.34115993134832,49.85231940709963
"Taylor County, Kentucky, USA",914.5476527916437,489.05900869999795,260.1362582351234,153.84762987811064
"Franklin County, Kansas, USA",846.2895491159082,638.4995590165634,301.751156972367,127.99158362374047
"Sunflower County, Mississippi, USA",2382.9622064448995,920.5766055096225,257.10738933989495,96.85567911487162
"Simpson County, Mississippi, USA",381.4203503571235,163.31150667097756,69.32757182198927,38.1278500731074
"Dickinson County, Michigan, USA",828.4162552321293,539.5843155944497,260.44493775322616,159.12781845117695
"Lamoille County, Vermont, USA",592.9347739102999,207.56371178843574,60.72133738920842,42.13972863992156
"Brown County, Minnesota, USA",959.6812124250944,782.4185741499427,390.6912596011997,161.1098073509852
"McNairy County, Tennessee, USA",293.3958184015322,123.10980034592322,54.93328294713287,37.022781026337796
"Montezuma County, Colorado, USA",698.8346827412025,420.7518072021086,171.93242700101575,84.27175810622484
"Hart County, Georgia, USA",410.4794542865713,172.71187797804362,97.38915453412436,70.4373397473191
"Russell County, Virginia, USA",464.643056844129,159.08575119136748,52.745647092990545,37.52026888849764
"Lawrence County, South Dakota, USA",982.4511602039943,580.843895384616,255.9443534405878,129.2829181676105
"Salinas Municipio, Puerto Rico, USA",1899.2681622622192,1154.3194951017665,363.0276284291716,188.69906315680953
"Montgomery County, North Carolina, USA",509.28494015340095,190.91171585237967,65.57405227546775,39.822659954103244
"Staunton city-County, Virginia, USA",1947.4135051131586,1155.4311150953522,761.7437079752212,461.36707165278386
"Johnson County, Arkansas, USA",561.9159318810484,241.42909238035358,122.83317236348367,77.44902760368923
"Plymouth County, Iowa, USA",889.81141792062,611.0252693891316,278.0419514627745,102.4486842209819
"Edgefield County, South Carolina, USA",1174.8446328669502,350.3095516237995,92.36861419244775,66.7171789704568
"Garvin County, Oklahoma, USA",535.7813443265027,358.9143964982502,118.58297281695829,48.89199250399234
"Añasco Municipio, Puerto Rico, USA",1839.3882222351574,954.2392318814374,474.92632686634647,321.79285002292244
"Morehouse Parish, Louisiana, USA",774.4402403207428,373.47252122881576,204.4355179943795,137.23786392404358
"Cheboygan County, Michigan, USA",368.5624045896604,165.20112607562425,71.50381300174195,39.50993073952308
"Benton County, Iowa, USA",710.6768605884956,455.51990474625615,121.35893922164126,41.92226690425889
"Churchill County, Nevada, USA",940.9282151301333,617.1512231695643,338.75161583842646,175.68224145229354
"Barton County, Kansas, USA",981.5436763681463,815.5155471785663,385.4449597821538,175.8903392954541
"Hardeman County, Tennessee, USA",1488.9519864258966,466.9191734910188,100.97420721420723,50.0779978323558
"Mason County, West Virginia, USA",613.3067778134402,284.12270658454037,92.69664920904455,54.48660456949622
"Butts County, Georgia, USA",1962.6307259476628,560.0961433925025,128.99784722031737,84.42620160258474
"Luna County, New Mexico, USA",847.3412925785947,621.2476093865134,374.7207493161741,200.4588086355762
"Gladwin County, Michigan, USA",404.03573148182414,165.9655659162526,65.86447952375151,37.73031601208816
"Payette County, Idaho, USA",914.2844979046046,644.3285241026599,287.7976560758885,152.90762256247766
"Pottawatomie County, Kansas, USA",950.4828639160434,491.2324225207908,168.02372797551314,72.60737207555063
"Salem city-County, Virginia, USA",1652.2988199219237,985.6778004639334,658.495632489364,565.7481192456844
"Hardee County, Florida, USA",1082.3456108282944,503.6590672345543,181.10716799131274,89.09704401193706
"Fannin County, Georgia, USA",518.1128973939468,164.95389321240307,62.99102339514739,51.62677020406493
"Washington County, Florida, USA",1160.8432401764433,344.3452662196016,69.26857753771063,40.490490387858465
"Adair County, Missouri, USA",1370.430867486386,979.4438202529216,526.5476566766384,233.84926054188443
"Lyon County, Minnesota, USA",1009.8103189612567,787.8947286803385,397.07185004357535,158.28622865927872
"Todd County, Minnesota, USA",390.5165093907032,248.09905663899602,75.54342106295799,29.243043372361555
"Barbour County, Alabama, USA",1232.0974966177141,439.23129783304006,129.22960192349322,74.41654613592767
"Posey County, Indiana, USA",631.1904067536191,334.26409965604466,141.9646285420209,72.51380514354335
"Macon County, Tennessee, USA",521.4348158505487,215.6226321650325,97.47513160577661,66.39880193953071
"Lauderdale County, Tennessee, USA",1206.395456115035,392.00803753073563,120.66913135260506,67.80235813974801
"Otsego County, Michigan, USA",635.6415604113806,276.8971022438115,106.44612532326151,71.28071163601133
"Iosco County, Michigan, USA",481.8541363515532,232.37831202918463,88.377633297545,51.78416376084529
"Prentiss County, Mississippi, USA",505.19220675740263,239.10214694645893,116.54324679270243,69.4938479419472
"Bremer County, Iowa, USA",1007.9927878922894,577.2721755827127,223.4390627844832,101.79144725232763
"Manistee County, Michigan, USA",737.5880097528084,408.8742666846048,149.65186839950564,77.61728101510545
"Cherokee County, Alabama, USA",317.8455828201145,100.55981780497592,39.57762968891274,30.52356750463178
"Chattooga County, Georgia, USA",714.3803593887376,295.8480841788752,138.32249499667046,95.40195699134885
"Audrain County, Missouri, USA",962.7894465462174,582.9592697695409,267.83164083023024,122.85062671351655
"Grant County, Kentucky, USA",1348.744012774558,411.85529225256624,99.88374322224409,67.51499247489633
"Hickman County, Tennessee, USA",684.4590472563541,199.66153310808994,48.94647927171256,36.42690766601602
"Routt County, Colorado, USA",1071.7654503471122,704.7665742393995,215.26740313522308,106.31520712343504
"Jackson County, Oklahoma, USA",1005.6409119943947,778.4560890822975,395.1238313675637,238.59587514018995
"Yates County, New York, USA",513.3874117681047,331.58592932244,121.51045624201068,55.78439376863452
"Milam County, Texas, USA",518.1225970729014,356.49184755593194,149.09188414009273,61.6032195784447
"Crook County, Oregon, USA",1122.7512567479555,624.9253003036532,293.73225960623745,144.89663080930558
"Goochland County, Virginia, USA",752.3949235875132,202.49529218910783,72.67907956843555,88.47004239179154
"Miller County, Missouri, USA",470.0926888779641,221.6105822550214,86.01953857648937,48.110105974553306
"Randolph County, Missouri, USA",1279.230508729924,626.4493104466405,282.44664822653107,140.2222533014238
"Cleburne County, Arkansas, USA",537.7929706392298,208.10971803289166,87.57664819232498,51.07840592724085
"Teller County, Colorado, USA",840.4584672943898,365.06091323257584,178.73302353866268,96.04007707429636
"White County, Indiana, USA",627.9294792597535,407.6222663179053,149.6240839309297,70.49002680454272
"Rowan County, Kentucky, USA",1424.6471244189556,584.4216457173364,148.82757358665907,96.09296241777274
"Cassia County, Idaho, USA",876.0712278004404,680.0377314443757,374.8590802195543,175.19871754399665
"Aibonito Municipio, Puerto Rico, USA",1707.7195031023366,915.1010387576713,535.8225450656112,362.59012212634644
"Union County, Georgia, USA",658.3245891042001,182.65581522137956,54.33804355968285,48.49504122435934
"Somerset County, Maryland, USA",2893.479168820389,898.1477775499077,191.22962882825485,81.91366506590916
"Nicholas County, West Virginia, USA",597.8612097216211,205.2052912723399,67.87533978686812,37.3811194360378
"Burke County, Georgia, USA",555.2802855498945,235.5158748609824,99.9722463600487,51.8633027058717
"Uvalde County, Texas, USA",928.4111950681092,641.3861272908887,369.90841568843064,199.8366577015522
"Waushara County, Wisconsin, USA",498.7946033911744,193.26483317437686,59.89694701907062,31.183194896805425
"Jefferson County, Oregon, USA",1052.4368808440663,543.4144493366167,207.7124166542032,95.74885474652966
"Randolph County, Indiana, USA",614.10595393498,435.3974145925657,152.92361330077267,57.679217431137424
"Texas County, Missouri, USA",747.629912952848,248.15083590444883,55.81143722100558,26.938224472866008
"Marion County, Mississippi, USA",447.1665624725026,216.66410132005623,93.67756347625382,53.66746307750487
"Fayette County, Texas, USA",386.76781053319155,234.9167343119951,100.74446020411497,42.16762832230572
"Scott County, Indiana, USA",789.3308200470474,411.03612506561194,171.6350038074584,95.97790249466159
"George County, Mississippi, USA",497.95493993190826,143.3852307888956,48.774035607585844,35.984139309413564
"Abbeville County, South Carolina, USA",469.8132858811243,193.89962995965251,87.5388118878767,52.61185920051559
"Lincoln County, Kentucky, USA",669.8287969307113,226.45248472839697,74.30647618967807,48.05460673348623
"Blaine County, Idaho, USA",1251.3540089746211,674.9246532047475,231.99381716618524,106.02801394371464
"Jerome County, Idaho, USA",1071.09026980026,809.9911649208882,393.48978720546097,160.92027705367863
"Aguas Buenas Municipio, Puerto Rico, USA",1178.9660987857928,566.985874326813,401.62497257131383,369.0672075341566
"Fairfax city-County, Virginia, USA",2539.6869327532263,1845.0978987575133,1716.7716060692835,1621.5270295613022
"Dawson County, Nebraska, USA",1171.8030516932856,926.1416443233468,390.79269493992115,127.99211677400649
"Bell County, Kentucky, USA",855.6789003078868,429.6103717035697,176.29359634010171,98.5119644585477
"Shelby County, Texas, USA",417.0819394452465,161.73465510096224,68.11346917589003,40.165092293291494
"Hood River County, Oregon, USA",1257.534575436404,768.8402587333479,365.7470335540348,174.48741800263676
"Itawamba County, Mississippi, USA",542.4605520138373,184.50010933507548,58.05383471378438,39.07333803871136
"Anderson County, Kentucky, USA",1160.541959567323,656.3042853341374,287.0393739286455,164.11663932448056
"Upshur County, West Virginia, USA",797.0851642216765,397.6147039810757,184.46703786331264,100.90068958859628
"Ohio County, Kentucky, USA",509.06914997578644,236.44152612163012,77.6654129019559,40.48982477931986
"Saline County, Illinois, USA",630.1440786143937,476.78926448695097,231.3580124017266,99.23652458360289
"Page County, Virginia, USA",656.4627399672888,292.2970045727533,122.00565937063497,71.78394669652951
"Iowa County, Wisconsin, USA",592.1759844242567,374.9960852813224,121.77359281531176,40.516092289675015
"Loíza Municipio, Puerto Rico, USA",3490.532284744902,2074.3780632351622,749.2787102261108,460.6630149732473
"Quebradillas Municipio, Puerto Rico, USA",1959.3649476016599,825.5482032685743,528.4332066815616,384.0136906189854
"Seminole County, Oklahoma, USA",550.391899772851,313.08542045635534,133.13560640475356,63.66500412648921
"Winston County, Alabama, USA",395.135451121538,139.3550945811274,54.575781645490416,37.38247817189018
"Grainger County, Tennessee, USA",440.15336067963733,134.84173672722295,49.10992244429993,39.910239496495706
"Aransas County, Texas, USA",858.8949761263773,434.3839695821185,246.0849509762031,162.77524630419327
"Plaquemines Parish, Louisiana, USA",1283.865341937672,684.0986394563299,291.6302723428565,268.4292963840428
"Washington County, Missouri, USA",661.838947264372,232.67280372637654,60.03117472131755,40.412416676238415
"Juniata County, Pennsylvania, USA",473.6390447590946,206.06609443929366,62.77647688268075,43.76835573814292
