"Greene County, Tennessee, USA",-0.6074200669372699,-0.6083195522198203,0.0008994852825503497,47059
"York County, Virginia, USA",-0.06580058047171718,-0.17107058732394131,0.10527000685222414,51199
"Ward County, North Dakota, USA",-0.4489485236847745,-0.4680431927622953,0.019094669077520776,38101
"Columbia County, Florida, USA",-0.4509246947902835,-0.44231568736141735,-0.008609007428866167,12023
"Troup County, Georgia, USA",-0.21847648840227543,-0.23197817399323728,0.013501685590961848,13285
"Klamath County, Oregon, USA",-0.40625170179164144,-0.4335070639525357,0.027255362160894248,41035
"Greenwood County, South Carolina, USA",-0.22764481659688707,-0.2172930500990866,-0.01035176649780048,45047
"Blue Earth County, Minnesota, USA",0.04432978251220555,-0.03685510999970167,0.08118489251190722,27013
"Harrison County, Texas, USA",-0.4562371706430644,-0.43686906734970776,-0.019368103293356642,48203
"Wise County, Texas, USA",-0.6815695967866511,-0.696561188246693,0.01499159146004192,48497
"Franklin County, North Carolina, USA",-0.13445423147974572,-0.1150553213909366,-0.019398910088809118,37069
"Lake County, California, USA",0.06312500000000065,0.03701716738197519,0.02610783261802546,06033
"Allegany County, Maryland, USA",-0.3827551320126632,-0.4369739675083196,0.054218835495656426,24001
"Shiawassee County, Michigan, USA",-0.1989303077828097,-0.19594949726812205,-0.002980810514687654,26155
"San Patricio County, Texas, USA",-0.2893067398953563,-0.23590849765005875,-0.05339824224529757,48409
"Madison County, New York, USA",-0.10589099456441989,-0.14199707291112476,0.03610607834670487,36053
"McCracken County, Kentucky, USA",-0.3169182127304182,-0.3719562855499462,0.055038072819527994,21145
"Catoosa County, Georgia, USA",-0.5594759610959407,-0.6070943908323289,0.04761842973638819,13047
"Otero County, New Mexico, USA",-0.2560773832251492,-0.28728813559322114,0.031210752368071915,35035
"Trujillo Alto Municipio, Puerto Rico, USA",,,,72139
"Walker County, Georgia, USA",-0.5929085143566756,-0.615055309998088,0.02214679564141242,13295
"Oldham County, Kentucky, USA",-0.21478650500790658,-0.3105043679420465,0.09571786293413992,21185
"Carteret County, North Carolina, USA",-0.4198643968794979,-0.4399476838046362,0.020083286925138333,37031
"Laurens County, South Carolina, USA",-0.322913933350827,-0.298186453160809,-0.024727480190018025,45059
"Butler County, Kansas, USA",-0.4136838868388688,-0.451965144448059,0.03828125760919021,20015
"Spalding County, Georgia, USA",-0.20829459423562144,-0.24566406250000028,0.03736946826437884,13255
"Jefferson County, Arkansas, USA",0.21702838063439067,0.2518830391285868,-0.03485465849419611,05069
"Jones County, Mississippi, USA",-0.4223521983317304,-0.4353132054176067,0.01296100708587633,28067
"Williamson County, Illinois, USA",-0.3742719600618067,-0.40779228933818745,0.03352032927638077,17199
"Aroostook County, Maine, USA",-0.1964211450650675,-0.1689125932650578,-0.02750855180000969,23003
"Rice County, Minnesota, USA",-0.0017373760017920933,-0.03057670375735875,0.028839327755566656,27131
"St. Francois County, Missouri, USA",-0.48094710903182175,-0.4538943961157172,-0.02705271291610456,29187
"Toa Alta Municipio, Puerto Rico, USA",,,,72135
"Ionia County, Michigan, USA",-0.30293432696786143,-0.30844566917405075,0.005511342206189318,26067
"Grant County, Indiana, USA",-0.38788593323999604,-0.3909745033630544,0.003088570123058354,18053
"Montcalm County, Michigan, USA",-0.3774855076980602,-0.33947160735089765,-0.038013900347162566,26117
"Wayne County, Indiana, USA",-0.29075988720988954,-0.301262754603385,0.01050286739349543,18177
"Belmont County, Ohio, USA",-0.4359602188567428,-0.3965056790759048,-0.039454539780838016,39013
"Muskogee County, Oklahoma, USA",-0.3388620868386417,-0.2917905517013571,-0.047071535137284626,40101
"Chippewa County, Wisconsin, USA",-0.2041071875782613,-0.19098454130765347,-0.01312264627060783,55017
"Crow Wing County, Minnesota, USA",-0.2974634704901306,-0.3154120863791101,0.017948615888979502,27035
"Apache County, Arizona, USA",0.33694416012737194,0.319691985105383,0.017252175021988947,04001
"Marquette County, Michigan, USA",0.1115649527470772,0.04233381853468936,0.06923113421238784,26103
"Wilkes County, North Carolina, USA",-0.5659651203880489,-0.5466801497138083,-0.01928497067424062,37193
"Harrison County, West Virginia, USA",-0.3764354705655646,-0.3954251998634634,0.018989729297898827,54033
"Starr County, Texas, USA",0.050560200193369556,0.600612088752864,-0.5500518885594944,48427
"Tehama County, California, USA",-0.3561853695901962,-0.3667032595845292,0.010517889994333007,06103
"Sauk County, Wisconsin, USA",0.016987542468857034,-0.0034760978409920404,0.020463640309849075,55111
"Adams County, Illinois, USA",-0.4649088794106241,-0.47303683765766236,0.00812795824703827,17001
"Warren County, New York, USA",-0.001576807103930148,-0.08469179826795747,0.08311499116402733,36113
"Mason County, Washington, USA",-0.03878460447425298,-0.060088948166247734,0.021304343691994757,53045
"Armstrong County, Pennsylvania, USA",-0.5232884245257069,-0.5157188943007155,-0.007569530224991405,42005
"Kershaw County, South Carolina, USA",-0.23117445703091152,-0.24879960540928142,0.017625148378369898,45055
"Marion County, Ohio, USA",-0.38658422604069453,-0.3438392143428119,-0.04274501169788264,39101
"Walker County, Alabama, USA",-0.679114533205002,-0.670772258414765,-0.00834227479023708,01127
"Clay County, Minnesota, USA",0.041151112122492825,-0.019084588365749878,0.0602357004882427,27027
"Liberty County, Georgia, USA",0.24031043994576665,0.21232239250480803,0.02798804744095862,13179
"Jefferson County, Ohio, USA",-0.3846500315286901,-0.3573056865378015,-0.027344344990888614,39081
"Lincoln County, South Dakota, USA",-0.23570811211260667,-0.2942015774245972,0.05849346531199051,46083
"Chaves County, New Mexico, USA",-0.41326917078822023,-0.3619949681811457,-0.05127420260707455,35005
"Pulaski County, Kentucky, USA",-0.6270133164235877,-0.6667855614210314,0.039772244997443695,21199
"Coos County, Oregon, USA",-0.20461227242076954,-0.23686647718200024,0.0322542047612307,41011
"Salem County, New Jersey, USA",-0.1281764046931189,-0.15179358513596053,0.02361718044284164,34033
"Effingham County, Georgia, USA",-0.49534368070953383,-0.5563103477740751,0.060966667064541236,13103
"Carbon County, Pennsylvania, USA",-0.3203187724880337,-0.34080483736446704,0.02048606487643334,42025
"Columbia County, Pennsylvania, USA",-0.3068878123897213,-0.3213121723111777,0.014424359921456409,42037
"Nacogdoches County, Texas, USA",-0.3127870076535384,-0.3503226947219508,0.03753568706841243,48347
"Hamblen County, Tennessee, USA",-0.5404165482522003,-0.5693988014691659,0.02898225321696557,47063
"Rutherford County, North Carolina, USA",-0.45763745679514384,-0.47370437181116587,0.016066915016022032,37161
"Isabella County, Michigan, USA",-0.025546081462103604,-0.03685131264487546,0.011305231182771859,26073
"Lamar County, Mississippi, USA",-0.4691592065999637,-0.5514394925178914,0.08228028591792769,28073
"San Benito County, California, USA",0.24359599053320316,0.2152033271719039,0.028392663361299253,06069
"Warrick County, Indiana, USA",-0.2781458912619053,-0.33535832304148927,0.05721243177958396,18173
"Belknap County, New Hampshire, USA",-0.10433239903046067,-0.16545797599621173,0.06112557696575106,33001
"Georgetown County, South Carolina, USA",-0.12723833423443076,-0.12885322955388145,0.0016148953194506932,45043
"Pope County, Arkansas, USA",-0.5038064833005916,-0.4987372059018991,-0.005069277398692507,05115
"Lee County, North Carolina, USA",-0.14913127413127453,-0.1292856003827144,-0.01984567374856014,37105
"Darlington County, South Carolina, USA",-0.04973253683086779,-0.03708776613265771,-0.01264477069821008,45031
"Hall County, Nebraska, USA",-0.3490604742758735,-0.37314597970335456,0.024085505427481058,31079
"Garfield County, Oklahoma, USA",-0.5372715113686981,-0.5348687240902763,-0.002402787278421803,40047
"Union County, Ohio, USA",-0.31478546867992413,-0.3806903635229819,0.06590489484305778,39159
"Knox County, Ohio, USA",-0.4380834050144982,-0.3830828381684716,-0.05500056684602661,39083
"Laurel County, Kentucky, USA",-0.6676709848819089,-0.6909508641609856,0.02327987927907671,21125
"Walla Walla County, Washington, USA",-0.08668948530117257,-0.15567095479759357,0.068981469496421,53071
"Stanly County, North Carolina, USA",-0.5105925336633346,-0.49704506824461914,-0.013547465418715432,37167
"Athens County, Ohio, USA",0.15012149201799577,0.17059418870901677,-0.020472696691021003,39009
"Barry County, Michigan, USA",-0.3251357749617041,-0.3326189455636513,0.007483170601947198,26015
"Eddy County, New Mexico, USA",-0.5180432348634914,-0.4125692784868077,-0.10547395637668366,35015
"Haywood County, North Carolina, USA",-0.26517151555988777,-0.2751937268728665,0.010022211312978702,37087
"Reno County, Kansas, USA",-0.34204216026627515,-0.35836431226765775,0.016322152001382595,20155
"Livingston County, New York, USA",-0.1816821120346476,-0.2195398088641729,0.037857696829525306,36051
"Garfield County, Colorado, USA",0.02297437224954746,-0.07030600680015046,0.09328037904969792,08045
"Hood County, Texas, USA",-0.6388144267089078,-0.6595300459325053,0.020715619223597548,48221
"Columbia County, New York, USA",0.16630160067396987,0.04944663775807462,0.11685496291589526,36021
"Washington County, New York, USA",-0.15551922666856136,-0.1839530332681034,0.028433806599542033,36115
"Cumberland County, Tennessee, USA",-0.5712692462591765,-0.5770485584218517,0.005779312162675132,47035
"Granville County, North Carolina, USA",-0.06589024621811439,-0.024933279713377905,-0.040956966504736486,37077
"Tipton County, Tennessee, USA",-0.4846542631116316,-0.4737873174055624,-0.01086694570606922,47167
"St. Joseph County, Michigan, USA",-0.3173438339001249,-0.30971924064486384,-0.007624593255261047,26149
"Rutland County, Vermont, USA",0.10473947600824153,0.03903427317237866,0.06570520283586287,50021
"Pittsylvania County, Virginia, USA",-0.3983188313740984,-0.3909119229042599,-0.007406908469838491,51143
"Pender County, North Carolina, USA",-0.2994819865960366,-0.29700322737342744,-0.0024787592226091504,37141
"Crawford County, Arkansas, USA",-0.5665186169108773,-0.543340757238308,-0.023177859672569356,05033
"Herkimer County, New York, USA",-0.30459514405063504,-0.3281443413812366,0.023549197330601568,36043
"Otter Tail County, Minnesota, USA",-0.32533860820351934,-0.3568923076923067,0.031553699488787335,27111
"Bradford County, Pennsylvania, USA",-0.4494180841539872,-0.4579119340283179,0.008493849874330717,42015
"Washington County, Vermont, USA",0.46061687484068314,0.3410216817860109,0.11959519305467226,50023
"Washington County, Ohio, USA",-0.40785489057475793,-0.4187231759656658,0.01086828539090784,39167
"Mercer County, West Virginia, USA",-0.5443224317657347,-0.5526063876076927,0.008283955841957957,54055
"Lincoln County, Missouri, USA",-0.5252438225867583,-0.5049759229534501,-0.020267899633308217,29113
"Van Zandt County, Texas, USA",-0.7214741863506954,-0.715740444769169,-0.005733741581526397,48467
"Lyon County, Nevada, USA",-0.4114359415305235,-0.41490615268075043,0.003470211150226943,32019
"Russell County, Alabama, USA",0.06395048994326877,0.01916285832986995,0.04478763161339882,01113
"Blount County, Alabama, USA",-0.800001838763178,-0.8090638719672918,0.009062033204113806,01009
"Sampson County, North Carolina, USA",-0.22524238470311247,-0.16557982791728373,-0.05966255678582874,37163
"Sandusky County, Ohio, USA",-0.276004256451182,-0.22803384626370146,-0.04797041018748052,39143
"Lowndes County, Mississippi, USA",-0.026173782166588087,-0.05677419354838911,0.030600411381801026,28087
"Autauga County, Alabama, USA",-0.444184371624056,-0.4899691667000366,0.0457847950759806,01001
"Kenai Peninsula Borough, Alaska, USA",-0.3158708450031942,-0.36729794295400287,0.05142709795080869,02122
"Pike County, Kentucky, USA",-0.6075412804551691,-0.627349459227214,0.019808178772044882,21195
"Newton County, Missouri, USA",-0.5742162733356851,-0.5869507825759026,0.012734509240217462,29145
"Carson City-County, Nevada, USA",-0.11358821749218212,-0.1405100735529265,0.026921856060744376,32510
"Huron County, Ohio, USA",-0.41188155232665064,-0.3646123420914554,-0.04726921023519526,39077
"Pickaway County, Ohio, USA",-0.47029054747496213,-0.4277834110728052,-0.04250713640215692,39129
"Pike County, Pennsylvania, USA",-0.18975349521706963,-0.26052641661238674,0.0707729213953171,42103
"Otsego County, New York, USA",-0.050143910507140996,-0.11133318826711856,0.06118927775997757,36077
"Columbia County, Wisconsin, USA",-0.015264696329975305,-0.02138191123981419,0.006117214909838884,55021
"Genesee County, New York, USA",-0.3166307286853541,-0.35052209443099364,0.03389136574563956,36037
"Lawrence County, Ohio, USA",-0.45574796429968295,-0.4411764705882358,-0.01457149371144717,39087
"Anderson County, Texas, USA",-0.5801737140479537,-0.5792945056239321,-0.0008792084240215603,48001
"Maverick County, Texas, USA",0.09419817470664964,0.5579187518398575,-0.46372057713320786,48323
"Coffee County, Tennessee, USA",-0.5015510885383663,-0.48441208129511615,-0.017139007243250126,47031
"Oxford County, Maine, USA",-0.08380707452540061,-0.12641250135177534,0.042605426826374734,23017
"Windsor County, Vermont, USA",0.38915984439412465,0.29908446939321043,0.09007537500091423,50027
"Jefferson County, West Virginia, USA",-0.10486314251730434,-0.1526537667947364,0.04779062427743207,54037
"Box Elder County, Utah, USA",-0.6250000000000011,-0.5040790473777556,-0.12092095262224556,49003
"Acadia Parish, Louisiana, USA",-0.6034476693051893,-0.5667806091070476,-0.0366670601981417,22001
"Gordon County, Georgia, USA",-0.6249392502179677,-0.6362058902921381,0.011266640074170442,13129
"Putnam County, West Virginia, USA",-0.42651135047893074,-0.47820672478206594,0.0516953743031352,54079
"Iron County, Utah, USA",-0.5567975353503449,-0.5160870057777285,-0.04071052957261645,49021
"Colbert County, Alabama, USA",-0.38944273111955924,-0.37864740116395573,-0.010795329955603505,01033
"Scott County, Kentucky, USA",-0.24865312888520485,-0.3034864965465912,0.054833367661386356,21209
"Vermilion Parish, Louisiana, USA",-0.6185262708559154,-0.5923975664977161,-0.02612870435819925,22113
"Waller County, Texas, USA",-0.267046115981826,-0.2851356205236248,0.018089504541798807,48473
"Hawkins County, Tennessee, USA",-0.6575088623912347,-0.6325695581014729,-0.024939304289761877,47073
"Chisago County, Minnesota, USA",-0.29245010124385357,-0.3031295487627342,0.010679447518880614,27025
"Carter County, Tennessee, USA",-0.6147895959929014,-0.6376812501019157,0.02289165410901428,47019
"Hardin County, Texas, USA",-0.7376153428623154,-0.738630377524149,0.0010150346618335027,48199
"Cherokee County, South Carolina, USA",-0.43771071789725724,-0.41711923329489997,-0.02059148460235727,45021
"Marion County, West Virginia, USA",-0.28684965495851744,-0.33453471709583504,0.0476850621373176,54049
"Pearl River County, Mississippi, USA",-0.6427412308076396,-0.647900196499568,0.005158965691928419,28109
"Taney County, Missouri, USA",-0.5774487037953473,-0.5930049050970362,0.015556201301688888,29213
"Lafayette County, Mississippi, USA",-0.12291337574179367,-0.14778801608715644,0.02487464034536277,28071
"Eagle County, Colorado, USA",0.29842141386410403,0.2025532252309399,0.09586818863316413,08037
"Campbell County, Virginia, USA",-0.4407533788304574,-0.46802251679680495,0.027269137966347556,51031
"Whiteside County, Illinois, USA",-0.08306849315068708,-0.06176217653037447,-0.021306316620312613,17195
"La Plata County, Colorado, USA",0.17705442005214894,0.09431781701444612,0.08273660303770282,08067
"Tuolumne County, California, USA",-0.1878142673158328,-0.2152140377955522,0.027399770479719393,06109
"Hancock County, Maine, USA",0.12805558738276107,0.07810285646025936,0.049952730922501715,23009
"Lenoir County, North Carolina, USA",-0.03467211095075453,-0.03639799217305314,0.0017258812222986086,37107
"Seneca County, Ohio, USA",-0.34182071852110124,-0.3097245409015023,-0.03209617761959893,39147
"Aguadilla Municipio, Puerto Rico, USA",,,,72005
"Loudon County, Tennessee, USA",-0.5032379004771614,-0.5425591039288604,0.03932120345169898,47105
"Grady County, Oklahoma, USA",-0.6230899095277246,-0.602799964103028,-0.02028994542469653,40051
"Camden County, Georgia, USA",-0.30749746707193537,-0.33812072711855473,0.03062326004661936,13039
"Jefferson County, Tennessee, USA",-0.5927718150887222,-0.5915527444172245,-0.001219070671497735,47089
"Franklin County, Virginia, USA",-0.4212942003026642,-0.41938104949134947,-0.0019131508113147122,51067
"Vega Baja Municipio, Puerto Rico, USA",,,,72145
"Dickson County, Tennessee, USA",-0.4743247132343873,-0.455158029841171,-0.01916668339321631,47043
"Saline County, Kansas, USA",-0.306061717826423,-0.34156397882209705,0.03550226099567405,20169
"Watauga County, North Carolina, USA",0.0828988206083172,0.014737947353774414,0.06816087325454279,37189
"Johnson County, Missouri, USA",-0.36826399100423685,-0.3688148113073538,0.0005508203031169279,29101
"Pulaski County, Missouri, USA",-0.45712501734424676,-0.5166035212837101,0.059478503939463356,29169
"Washington County, Virginia, USA",-0.5250827958863512,-0.5326549562795044,0.007572160393153227,51191
"Elko County, Nevada, USA",-0.5546501570537604,-0.5469044668354932,-0.007745690218267209,32007
"Coffee County, Alabama, USA",-0.5307598064191085,-0.5611548632396409,0.03039505682053245,01031
"Boone County, Illinois, USA",-0.13375235197566127,-0.14329811747315388,0.009545765497492614,17007
"Roane County, Tennessee, USA",-0.5088755113066289,-0.5096220407033081,0.0007465293966791853,47145
"Fulton County, New York, USA",-0.31399418138887675,-0.3283680588290757,0.014373877440198968,36035
"Tuscola County, Michigan, USA",-0.39346166391789933,-0.3749563496797173,-0.018505314238182025,26157
"McMinn County, Tennessee, USA",-0.6057435538239295,-0.5961610237270043,-0.009582530096925224,47107
"Gila County, Arizona, USA",-0.34104547755043135,-0.31885409726848735,-0.022191380281944006,04007
"Jessamine County, Kentucky, USA",-0.3249019084987244,-0.40032609628421895,0.07542418778549453,21113
"Jackson County, Illinois, USA",0.012851653932781683,0.032132266320025124,-0.01928061238724344,17077
"Madison County, Idaho, USA",-0.636570827489481,-0.4933707292197866,-0.14320009826969443,16065
"Navarro County, Texas, USA",-0.4542321549788528,-0.4861905341282383,0.03195837914938554,48349
"Kerr County, Texas, USA",-0.5173905208145616,-0.5599862643258796,0.04259574351131801,48265
"Columbia County, Oregon, USA",-0.10288321281152138,-0.11458411601172169,0.011700903200200313,41009
"Jackson County, Alabama, USA",-0.6749449991538335,-0.6194719786503964,-0.055473020503437165,01071
"Culpeper County, Virginia, USA",-0.19896002360230175,-0.2515978035826807,0.05263777998037894,51047
"St. Charles Parish, Louisiana, USA",-0.29571834344426057,-0.30780390959071435,0.012085566146453786,22089
"Grundy County, Illinois, USA",-0.25841139003371966,-0.23191461892671172,-0.026496771107007933,17063
"Worcester County, Maryland, USA",-0.18958654938526426,-0.26366643996170885,0.0740798905764446,24047
"Washington County, Oklahoma, USA",-0.4802348836219714,-0.4849262059035267,0.004691322281555277,40147
"Ashland County, Ohio, USA",-0.4873854079854528,-0.47957726363895964,-0.007808144346493184,39005
"Calumet County, Wisconsin, USA",-0.1962695782153766,-0.21526602744876944,0.01899644923339283,55015
"Warren County, Iowa, USA",-0.16778891072521646,-0.1612820512820521,-0.006506859443164342,19181
"Rusk County, Texas, USA",-0.5564124135352406,-0.5613044841643144,0.004892070629073819,48401
"Hoke County, North Carolina, USA",0.10864642543555642,0.10849607187144007,0.00015035356411634282,37093
"Grant County, Wisconsin, USA",-0.1228851639120083,-0.09434504267892106,-0.02854012123308723,55043
"Darke County, Ohio, USA",-0.6367222058389872,-0.6118175018698607,-0.024904703969126474,39037
"Harrisonburg city-County, Virginia, USA",0.3178625775488705,0.21960304664480002,0.09825953090407047,51660
"Waupaca County, Wisconsin, USA",-0.3175077239958789,-0.29729833301398834,-0.020209390981890563,55135
"Ogle County, Illinois, USA",-0.2595919610231443,-0.2604885710742781,0.0008966100511337838,17141
"Oktibbeha County, Mississippi, USA",0.06554638862175435,0.015614654601634182,0.049931734020120175,28105
"St. Martin Parish, Louisiana, USA",-0.3610550931927508,-0.3341872778081227,-0.026867815384628124,22099
"Nye County, Nevada, USA",-0.4035308953341757,-0.4199162923642271,0.01638539703005143,32023
"Cass County, Michigan, USA",-0.28874985694121524,-0.30860809913697734,0.0198582421957621,26027
"Franklin County, Kentucky, USA",-0.009516135221212415,-0.04618608549874336,0.03666995027753095,21073
"Wayne County, Pennsylvania, USA",-0.3362882267079633,-0.38454492463985185,0.048256697931888526,42127
"Henry County, Virginia, USA",-0.2910553533805789,-0.290980034037606,-7.531934297294596e-05,51089
"Humacao Municipio, Puerto Rico, USA",,,,72069
"Bristol County, Rhode Island, USA",0.2942161003900499,0.22254575694037027,0.07167034344967965,44001
"Medina County, Texas, USA",-0.3914463521207543,-0.43204221268699927,0.04059586056624498,48325
"Dearborn County, Indiana, USA",-0.555262016482001,-0.5482574282043835,-0.007004588277617518,18029
"Columbus County, North Carolina, USA",-0.2792860924147317,-0.21802708693269318,-0.0612590054820385,37047
"Somerset County, Maine, USA",-0.23003678857390308,-0.2238777459407871,-0.00615904263311598,23025
"Venango County, Pennsylvania, USA",-0.4140411163683266,-0.41595953842511524,0.00191842205678866,42121
"Cherokee County, Texas, USA",-0.5583404357005862,-0.5628922536989572,0.0045518179983710105,48073
"Gibson County, Tennessee, USA",-0.46970307671637695,-0.43628178237069365,-0.033421294345683306,47053
"Lincoln County, Oregon, USA",0.16028770422443422,0.09748178650617587,0.06280591771825836,41041
"Bedford County, Tennessee, USA",-0.518757204233471,-0.5269293389775318,0.008172134744060755,47003
"Polk County, Texas, USA",-0.5451914330604469,-0.5513245033112575,0.006133070250810557,48373
"Carroll County, New Hampshire, USA",0.015035274003111028,-0.05563814763978675,0.07067342164289778,33003
"Lamar County, Texas, USA",-0.5737337934894121,-0.5866196430479864,0.012885849558574303,48277
"Buffalo County, Nebraska, USA",-0.43622027216075754,-0.47296580330873383,0.036745531147976296,31019
"Newaygo County, Michigan, USA",-0.4044778317867113,-0.3958038869257966,-0.008673944860914717,26123
"Knox County, Illinois, USA",-0.056431750421293725,-0.02906279162778255,-0.027368958793511176,17095
"Franklin County, Vermont, USA",0.09047619047618956,0.02797627387791408,0.06249991659827547,50011
"Queen Anne's County, Maryland, USA",-0.26517562544701945,-0.3400821928137855,0.07490656736676604,24035
"Wilson County, Texas, USA",-0.48390060722275446,-0.474761536478474,-0.009139070744280442,48493
"Winona County, Minnesota, USA",0.003900931071283591,-0.028994400552274292,0.032895331623557886,27169
"Laurens County, Georgia, USA",-0.2824585331514804,-0.29056274388991404,0.008104210738433648,13175
"Logan County, Oklahoma, USA",-0.47061277463613177,-0.49449391432636053,0.02388113969022876,40083
"Montgomery County, New York, USA",-0.22533014806159454,-0.24702382558380406,0.02169367752220952,36057
"Douglas County, Nevada, USA",-0.2947692307692313,-0.321355567509415,0.026586336740183736,32005
"St. Mary Parish, Louisiana, USA",-0.2913827309583368,-0.2757791668488,-0.015603564109536783,22101
"Dale County, Alabama, USA",-0.46273767910152275,-0.5011281435265931,0.038390464425070325,01045
"Henry County, Illinois, USA",-0.21466744685000985,-0.20752343464675393,-0.007144012203255917,17073
"Burnet County, Texas, USA",-0.5311324189828828,-0.5645178087898322,0.033385389806949384,48053
"Atascosa County, Texas, USA",-0.33989631590558056,-0.290133840415419,-0.04976247549016155,48013
"Fremont County, Colorado, USA",-0.3970732089055841,-0.4471396714149192,0.05006646250933511,08043
"Henry County, Indiana, USA",-0.4518814518814519,-0.43228191227205254,-0.019599539609399363,18065
"Edgecombe County, North Carolina, USA",0.270165247085606,0.31997910471751184,-0.04981385763190582,37065
"Vernon Parish, Louisiana, USA",-0.6491197590919644,-0.649646128956532,0.0005263698645675552,22115
"Duplin County, North Carolina, USA",-0.2212818852323952,-0.18823958386330364,-0.03304230136909156,37061
"Halifax County, North Carolina, USA",0.21215885709848986,0.2663978185166978,-0.05423896141820794,37083
"Tioga County, New York, USA",-0.20598559051998488,-0.2571432051774009,0.05115761465741603,36107
"Curry County, New Mexico, USA",-0.4063969273558017,-0.44248625747202863,0.03608933011622695,35009
"Lincoln Parish, Louisiana, USA",-0.19465629053177563,-0.19555782214658737,0.0009015316148117403,22061
"Boyd County, Kentucky, USA",-0.3317232913700495,-0.3700921541014124,0.03836886273136286,21019
"Shelby County, Ohio, USA",-0.6320104562737651,-0.605767606823171,-0.026242849450594075,39149
"Crittenden County, Arkansas, USA",0.07215738986986055,0.0906469408224667,-0.018489550952606154,05035
"Le Flore County, Oklahoma, USA",-0.6335549056102088,-0.5871900586493254,-0.04636484696088339,40079
"Shelby County, Kentucky, USA",-0.2963406500941641,-0.33633781929590767,0.039997169201743565,21211
"Carter County, Oklahoma, USA",-0.5251296267775547,-0.5260602136613793,0.0009305868838246356,40019
"Bingham County, Idaho, USA",-0.5586617323464709,-0.48018045112781904,-0.07848128121865183,16011
"Whitman County, Washington, USA",0.1002082741645389,0.04293556775498267,0.05727270640955623,53075
"Greene County, New York, USA",-0.15579106136381707,-0.2570521541950111,0.10126109283119403,36039
"Santa Cruz County, Arizona, USA",0.35508283902638715,0.4742286861802467,-0.11914584715385956,04023
"Val Verde County, Texas, USA",-0.0991421648876961,0.07814318975552988,-0.17728535464322598,48465
"Goodhue County, Minnesota, USA",-0.1482748987288734,-0.17867558424388535,0.03040068551501196,27049
"Bedford County, Pennsylvania, USA",-0.676651918473927,-0.6729703431061507,-0.0036815753677763574,42009
