"VA-02 in Suffolk city-County, USA",0.1737040015312247,0.12261179275593323,0.05109220877529147
"IA-04 in Pottawattamie County, USA",-0.1677159846100035,-0.2130201199450685,0.045304135335065
"NY-23 in Steuben County, USA",-0.2963315864697475,-0.34057902004666446,0.04424743357691696
"GA-04 in Rockdale County, USA",0.40800250637783647,0.2596398980242193,0.1483626083536172
"WI-07 in St. Croix County, USA",-0.158869275398099,-0.1839690157447167,0.02509974034661769
"LA-05 in Tangipahoa Parish, USA",-0.22702730498277368,-0.22725998165143352,0.00023267666865983694
"MA-04 in Middlesex County, USA",0.6428705546584551,0.6016286382326856,0.041241916425769465
"VA-01 in Hanover County, USA",-0.25321801584929915,-0.32043913345835867,0.06722111760905952
"IL-12 in St. Clair County, USA",-0.225129940867435,-0.2904564309888518,0.06532649012141681
"KY-04 in Campbell County, USA",-0.18650939918908957,-0.24458095036362354,0.05807155117453397
"MD-05 in Calvert County, USA",-0.056223547037235,-0.1677789248460915,0.11155537780885649
"KY-06 in Madison County, USA",-0.26815604290496686,-0.31170987786586674,0.04355383496089987
"NY-21 in Rensselaer County, USA",-0.04000933315695383,-0.10712261125018022,0.06711327809322638
"GA-07 in Fulton County, USA",0.10406809597229998,-0.04647718546001458,0.15054528143231455
"OH-15 in Miami County, USA",-0.4259653858809003,-0.4361747453302812,0.010209359449380895
"PA-09 in Northumberland County, USA",-0.38436282036140307,-0.4270383922232538,0.042675571861850725
"TX-36 in Liberty County, USA",-0.5971568827981182,-0.5781513990192443,-0.0190054837788739
"CA-02 in Mendocino County, USA",0.35833537617884004,0.3046910105776352,0.053644365601204835
"CT-02 in Lower Connecticut River Valley Planning Region, USA",0.13611490500325385,0.032400493175560575,0.10371441182769328
"VA-06 in Frederick County, USA",-0.27404852823175324,-0.3498313906424462,0.07578286241069299
"WI-06 in Ozaukee County, USA",-0.12038169817352225,-0.18876971759830255,0.0683880194247803
"TX-27 in Victoria County, USA",-0.37918541459708993,-0.39614991699655216,0.016964502399462233
"NY-24 in Wayne County, USA",-0.19558655845462472,-0.24962834177438456,0.05404178331975984
"NC-06 in Forsyth County, USA",0.007635951188383531,-0.010988739365708135,0.018624690554091668
"NH-02 in Grafton County, USA",0.24598821480191232,0.18557949639585083,0.06040871840606149
"AL-03 in St. Clair County, USA",-0.6395359734921262,-0.6786909479617087,0.03915497446958249
"NC-06 in Rockingham County, USA",-0.32021167562592817,-0.2980239506597454,-0.022187724966182765
"CA-22 in Kings County, USA",0.009429617696824417,0.03411072783799692,-0.024681110141172503
"FL-04 in Nassau County, USA",-0.4583213103623865,-0.4978932584269663,0.03957194806457981
"ID-02 in Twin Falls County, USA",-0.45220678885509985,-0.45507799424248513,0.0028712053873852783
"UT-01 in Salt Lake County, USA",0.512539122873285,0.43500146647320775,0.0775376564000772
"MI-10 in Oakland County, USA",0.031568379564215064,-0.06088987954905911,0.09245825911327418
"TX-09 in Brazoria County, USA",0.312138324650854,0.244188756016911,0.067949568633943
"MO-07 in Christian County, USA",-0.5080405766150561,-0.5419414052121827,0.03390082859712662
"MI-09 in Lapeer County, USA",-0.3631510960829756,-0.3829537657968705,0.019802669713894938
"OR-04 in Douglas County, USA",-0.3516493232998319,-0.3603267576078214,0.008677434307989507
"OR-02 in Josephine County, USA",-0.25716393569930884,-0.3018354401907418,0.04467150449143298
"AL-02 in Elmore County, USA",-0.4825006093102608,-0.5150563607085347,0.03255575139827388
"AL-04 in Cullman County, USA",-0.7742228381639626,-0.7707601721543051,-0.0034626660096575
"MI-04 in Calhoun County, USA",-0.03388483225347667,-0.05424295581624822,0.02035812356277155
"IL-09 in McHenry County, USA",0.06573742701073648,0.00015686739790607632,0.06558055961283041
"NC-10 in Burke County, USA",-0.40135062815525424,-0.3846667554749576,-0.01668387268029664
"IL-14 in DeKalb County, USA",0.10236932150167011,0.07351210882326241,0.028857212678407698
"OR-06 in Polk County, USA",-0.01687685075894059,-0.06253877652314183,0.045661925764201236
"ID-02 in Bannock County, USA",-0.2186686218491644,-0.20463251137179794,-0.01403611047736647
"IL-14 in LaSalle County, USA",-0.10432903287332397,-0.1064826117654429,0.0021535788921189236
"TX-17 in Williamson County, USA",0.16797594948617875,0.05366018612836451,0.11431576335781424
"NC-10 in Lincoln County, USA",-0.45935004139197705,-0.47225519629756324,0.012905154905586191
"WA-02 in Island County, USA",0.11992582290217896,0.05819106259912305,0.061734760303055906
"TN-07 in Williamson County, USA",-0.23272160177177467,-0.311828653169886,0.07910705139811133
"OH-12 in Muskingum County, USA",-0.39288185862580327,-0.3502599935001625,-0.04262186512564076
"TX-17 in Angelina County, USA",-0.4600259852750108,-0.46979419489975727,0.009768209624746449
"TX-03 in Hunt County, USA",-0.5047708431548739,-0.5413047960595497,0.03653395290467587
"IL-16 in McLean County, USA",-0.11575199216981655,-0.17293553746015772,0.05718354529034117
"PA-16 in Lawrence County, USA",-0.2955768729924473,-0.2802002306578657,-0.01537664233458158
"GA-02 in Dougherty County, USA",0.40004396606171,0.3845816626577446,0.015462303403965372
"RI-01 in Newport County, USA",0.3002099401795302,0.19048355648220647,0.10972638369732371
"MA-02 in Hampshire County, USA",0.6981578049612555,0.6345828870641438,0.06357491789711167
"NJ-05 in Sussex County, USA",-0.2317761093234815,-0.3324653805184045,0.10068927119492302
"WI-05 in Jefferson County, USA",-0.15223326872173243,-0.15885313971560464,0.006619870993872207
"IL-17 in McLean County, USA",0.24039245359205172,0.17401360098107163,0.06637885261098009
"TX-14 in Orange County, USA",-0.6342445963216091,-0.6153319644079398,-0.01891263191366932
"MO-06 in Buchanan County, USA",-0.24605169681403355,-0.2616457226392286,0.015594025825195035
"GA-01 in Glynn County, USA",-0.23178642756337658,-0.2853455587867656,0.05355913122338901
"MT-02 in Cascade County, USA",-0.1970414942961013,-0.21687412750116333,0.01983263320506204
"WV-02 in Wood County, USA",-0.419895774211857,-0.4782816229116945,0.05838584869983754
"OK-05 in Canadian County, USA",-0.405199860624989,-0.5024574676567494,0.0972576070317604
"TX-01 in Bowie County, USA",-0.41055818195084304,-0.4510951504296075,0.04053696847876448
"NY-23 in Chemung County, USA",-0.134128393808678,-0.17553088402225975,0.04140249021358175
"MS-03 in Madison County, USA",-0.29917793068403103,-0.3912993001814556,0.09212136949742455
"PA-16 in Crawford County, USA",-0.37225634433176213,-0.3738397524805292,0.0015834081487670626
"IL-15 in Madison County, USA",-0.2849943956408504,-0.3206167786752902,0.03562238303443982
"VA-06 in Rockingham County, USA",-0.4041222524023647,-0.44346039960519645,0.03933814720283174
"AZ-06 in Pinal County, USA",-0.10094467590302518,-0.11419540069773856,0.013250724794713384
"GA-10 in Barrow County, USA",-0.4311858864481422,-0.5039020498768686,0.07271616342872639
"WA-04 in Franklin County, USA",-0.09582012796744244,-0.12831072473385896,0.032490596766416524
"MS-01 in Lee County, USA",-0.3252151323266764,-0.37040075350165585,0.04518562117497943
"TX-31 in Coryell County, USA",-0.3345230507754408,-0.39231907083767054,0.057796020062229725
"MN-03 in Anoka County, USA",0.05916137411711179,-0.04047080074470813,0.09963217486181991
"LA-04 in St. Landry Parish, USA",-0.14090975360839772,-0.11911849313355179,-0.021791260474845933
"FL-28 in Monroe County, USA",-0.07857791989478406,-0.06751489605073596,-0.0110630238440481
"IN-05 in Howard County, USA",-0.3197371418482516,-0.3294349102312063,0.009697768382954719
"OK-04 in Oklahoma County, USA",0.030130394510924814,-0.11643668324529556,0.14656707775622038
"KY-02 in Bullitt County, USA",-0.4803050160848326,-0.4980029955067399,0.01769797942190726
"AL-03 in Talladega County, USA",-0.25512092124754354,-0.2542732852329435,-0.0008476360146000284
"TX-05 in Henderson County, USA",-0.6008304003519578,-0.5985088040475318,-0.0023215963044259658
"WA-03 in Lewis County, USA",-0.3282129378269218,-0.361299013148262,0.033086075321340225
"IN-01 in LaPorte County, USA",0.018015659615946557,0.02606829500980177,-0.008052635393855211
"KS-02 in Leavenworth County, USA",-0.21167443135105507,-0.24517342661958352,0.03349899526852845
"OR-03 in Clackamas County, USA",-0.08720820577324709,-0.10827310943103667,0.021064903657789583
"TX-22 in Harris County, USA",-0.13903699480453557,-0.24297601770662275,0.10393902290208717
"MO-08 in Cape Girardeau County, USA",-0.45019722642586024,-0.5009193661781407,0.05072213975228046
"OK-03 in Payne County, USA",-0.2330735755490335,-0.2832492795389049,0.050175703989871395
"NJ-02 in Gloucester County, USA",-0.06349536639363733,-0.09336413051280583,0.0298687641191685
"WI-06 in Manitowoc County, USA",-0.2319926833076803,-0.21345559750894916,-0.018537085798731145
"OH-10 in Clark County, USA",-0.0732557694156472,-0.036092970911341254,-0.03716279850430594
"MA-05 in Suffolk County, USA",0.2784883577363587,0.21798059257210545,0.06050776516425327
"GA-12 in Bulloch County, USA",-0.23743518149182288,-0.2311470215462611,-0.006288159945561783
"PA-15 in Clearfield County, USA",-0.49540865506569937,-0.4882261970762452,-0.007182457989454161
"IN-09 in Floyd County, USA",-0.14101673810493043,-0.19784895090111515,0.05683221279618472
"NJ-11 in Passaic County, USA",-0.05044826567729711,-0.09491499160698816,0.044466725929691045
"IL-11 in Will County, USA",0.36665048062732897,0.3299364999737167,0.036713980653612255
"OR-02 in Umatilla County, USA",-0.31972274350747626,-0.3401094321846578,0.02038668867718152
"MO-04 in Boone County, USA",0.08443098770419627,0.031977894166479545,0.052453093537716725
"WY-00 in Natrona County, USA",-0.4755695699108005,-0.5090260285474392,0.03345645863663865
"TN-06 in Putnam County, USA",-0.43404711558507314,-0.4465309422313685,0.012483826646295382
"NY-21 in Clinton County, USA",0.052205322120947036,0.019000155738981468,0.033205166381965565
"IN-06 in Hancock County, USA",-0.3752534551471788,-0.4430622533976326,0.06780879825045383
"MI-07 in Clinton County, USA",-0.06530611144779624,-0.12652236663973346,0.06121625519193721
"WA-08 in Chelan County, USA",-0.0784417863575486,-0.15169588529429484,0.07325409893674624
"VA-05 in Lynchburg city-County, USA",0.026152957676759344,-0.0894634994531228,0.11561645712988215
"AZ-09 in Yuma County, USA",-0.3267813125440971,-0.3587375689148705,0.03195625637077343
"NC-01 in Wilson County, USA",0.028795875782496625,0.05590664743673791,-0.02711077165424128
"NY-19 in Sullivan County, USA",-0.09166738822986117,-0.11223071966747826,0.020563331437617086
"SC-03 in Oconee County, USA",-0.4741839604915754,-0.48104902943812283,0.006865068946547426
"VA-01 in James City County, USA",0.04835621132410151,-0.05098566100674095,0.09934187233084246
"MS-04 in Forrest County, USA",-0.11167624944714728,-0.13344498289623719,0.021768733449089903
"FL-24 in Broward County, USA",0.6826718730924591,0.7658132390466124,-0.08314136595415322
"GA-14 in Cobb County, USA",0.28093817465896676,0.16026113877348686,0.1206770358854799
"OK-02 in Rogers County, USA",-0.559794800800399,-0.568420051661727,0.008625250861328038
"MO-04 in Jackson County, USA",-0.21726845623940533,-0.30785380358882053,0.0905853473494152
"NY-24 in Jefferson County, USA",-0.17770731250397742,-0.1979911468836852,0.020283834379707766
"VA-06 in Augusta County, USA",-0.4700790008988126,-0.4948958533968027,0.024816852497990094
"MO-03 in Cole County, USA",-0.3389178519005922,-0.3676190476190476,0.02870119571845542
"MA-01 in Hampshire County, USA",0.26550751879699247,0.16394802977855755,0.10155948901843492
"WA-06 in Clallam County, USA",0.03370269285283614,-0.028294992749992653,0.0619976856028288
"TN-03 in Anderson County, USA",-0.3218213010096465,-0.3413205716006827,0.019499270591036177
"OH-02 in Ross County, USA",-0.35202426717924074,-0.2736689318466715,-0.07835533533256922
"NY-23 in Cattaraugus County, USA",-0.2956271576524741,-0.32717178524437596,0.03154462759190185
"AR-02 in White County, USA",-0.5894123360854784,-0.5681274331226115,-0.021284902962866892
"SC-05 in Sumter County, USA",0.043976447881567945,-0.011967971713077997,0.05594441959464594
"TX-32 in Collin County, USA",0.20596055083077552,0.06165004732089939,0.14431050350987612
"NH-02 in Cheshire County, USA",0.17241853865599355,0.12383984603902805,0.0485786926169655
"NC-09 in Chatham County, USA",0.11524928496471121,0.09942516421944603,0.01582412074526518
"NY-24 in Cayuga County, USA",-0.08891847102610774,-0.11643401971720582,0.027515548691098082
"GA-10 in Jackson County, USA",-0.5801607049343236,-0.6379570514487484,0.05779634651442478
"WA-06 in Grays Harbor County, USA",-0.06563304804765745,-0.07216131420312334,0.006528266155465895
"MI-04 in Van Buren County, USA",-0.12274243849819734,-0.1392189203433112,0.01647648184511387
"OH-09 in Erie County, USA",-0.11592214450741906,-0.0959870817663532,-0.01993506274106585
"NC-13 in Harnett County, USA",-0.2837029989396396,-0.27167938815217485,-0.012023610787464722
"OH-05 in Hancock County, USA",-0.3754934592460717,-0.4063798343696846,0.03088637512361292
"WV-01 in Raleigh County, USA",-0.504168069715238,-0.5268752501889606,0.022707180473722666
"PA-14 in Indiana County, USA",-0.34674392973726925,-0.3248635582509419,-0.021880371486327377
"CO-07 in Broomfield County, USA",0.2741036198318751,0.14231891748474396,0.13178470234713113
"PA-05 in Philadelphia County, USA",0.5126256582096697,0.5941351602266542,-0.08150950201698459
"IN-06 in Bartholomew County, USA",-0.22520572665144703,-0.3025262495085965,0.07732052285714949
"AR-01 in Lonoke County, USA",-0.5282760420063923,-0.5274538745387454,-0.0008221674676469615
"OH-02 in Scioto County, USA",-0.42222707696148803,-0.3711601599323863,-0.05106691702910171
"PA-09 in Lycoming County, USA",-0.33644169323165096,-0.36819999628993016,0.0317583030582792
"MI-08 in Midland County, USA",-0.11670511281028978,-0.17577052987122652,0.05906541706093674
"FL-06 in Putnam County, USA",-0.41148207127560266,-0.3616708206960752,-0.049811250579527455
"HI-02 in Kauai County, USA",0.28785020194746075,0.33722941745141427,-0.04937921550395352
"ND-00 in Grand Forks County, USA",-0.13261220536002583,-0.18076733080849663,0.04815512544847081
"MS-03 in Lauderdale County, USA",-0.16023938298076615,-0.21934521792177863,0.059105834941012486
"VA-10 in Fauquier County, USA",-0.17271707015414214,-0.24442071542979177,0.07170364527564962
"TN-07 in Robertson County, USA",-0.4699297035098036,-0.47109359308977633,0.00116388957997271
"KY-01 in Christian County, USA",-0.2842894858148598,-0.31336322057691435,0.02907373476205455
"CA-28 in San Bernardino County, USA",-0.09445999168932069,-0.1395900630981224,0.04513007140880172
"UT-02 in Tooele County, USA",-0.3829192349240643,-0.3021029000778852,-0.08081633484617912
"PA-14 in Somerset County, USA",-0.5638420967391549,-0.5610678252039129,-0.002774271535242012
"OK-05 in Pottawatomie County, USA",-0.4599964520134823,-0.4649143485777149,0.004917896564232582
"KS-01 in Riley County, USA",0.04588613881053594,-0.03557495820174624,0.08146109701228219
"IN-04 in Morgan County, USA",-0.5457336467985064,-0.5607708452585385,0.015037198460032042
"AL-04 in DeKalb County, USA",-0.6978471181359859,-0.6886749372098333,-0.009172180926152573
"TX-36 in Jefferson County, USA",0.12592949190824773,0.10009208603154358,0.025837405876704148
"NC-05 in Surry County, USA",-0.5135859350889566,-0.5028440721472738,-0.010741862941682778
"NY-16 in Bronx County, USA",0.8465664840230389,0.9090045068423229,-0.06243802281928401
"MT-02 in Lewis and Clark County, USA",-0.03941795812137702,-0.07057964666374653,0.031161688542369503
"IN-04 in Boone County, USA",-0.1845974025974026,-0.2911454651627378,0.10654806256533522
"NC-13 in Wayne County, USA",-0.0942003319496806,-0.075881540609218,-0.01831879134046259
"IL-02 in Kankakee County, USA",-0.13377347466046058,-0.08262640559734138,-0.051147069063119194
"WI-03 in Portage County, USA",0.027738089372813718,0.031671979887515224,-0.003933890514701506
"LA-03 in Iberia Parish, USA",-0.31483417599764646,-0.316485813720445,0.0016516377227985268
"TN-01 in Greene County, USA",-0.6074200669372641,-0.6083195522198194,0.0008994852825552346
"OK-03 in Canadian County, USA",-0.4697093360460163,-0.5247344061718882,0.05502507012587188
"GA-04 in Newton County, USA",0.38647644736443487,0.3124349082836338,0.07404153908080108
"ME-02 in Kennebec County, USA",0.03551704437250048,-0.0021205616902428303,0.03763760606274331
"VA-01 in York County, USA",-0.06580058047171672,-0.17107058732394242,0.1052700068522257
"ND-00 in Ward County, USA",-0.4489485236847695,-0.4680431927622939,0.019094669077524384
"OH-05 in Wood County, USA",-0.10348214212915506,-0.0737985850216142,-0.029683557107540864
"TX-17 in Travis County, USA",0.30198248242978065,0.19524815015152042,0.10673433227826024
"FL-03 in Columbia County, USA",-0.45092469479028163,-0.4423156873614191,-0.008609007428862558
"GA-03 in Troup County, USA",-0.2184764884022763,-0.231978173993237,0.01350168559096071
"OR-02 in Klamath County, USA",-0.40625170179164627,-0.43350706395253547,0.027255362160889196
"SC-03 in Greenwood County, USA",-0.2276448165968881,-0.21729305009908564,-0.01035176649780245
"MN-01 in Blue Earth County, USA",0.04432978251220595,-0.036855109999702304,0.08118489251190825
"CA-01 in Yuba County, USA",-0.17453885957807153,-0.18816822976100958,0.013629370182938055
"MA-02 in Franklin County, USA",0.4483076997837549,0.36882958079693773,0.07947811898681717
"TX-15 in Guadalupe County, USA",-0.31755250200289237,-0.34164905729168726,0.024096555288794896
"TX-01 in Harrison County, USA",-0.45623717064306624,-0.4368690673497062,-0.01936810329336003
"CT-05 in Northwest Hills Planning Region, USA",0.0751809528292118,-0.0042265693810477805,0.07940752221025958
"NC-01 in Franklin County, USA",-0.1344542314797462,-0.11505532139093783,-0.01939891008880837
"NY-20 in Rensselaer County, USA",0.2668079807525214,0.1865244044498403,0.08028357630268107
"NC-05 in Caldwell County, USA",-0.5092366778293365,-0.4956166158253589,-0.013620062003977584
"MO-03 in Jefferson County, USA",-0.40220940540075245,-0.3941053466442332,-0.008104058756519261
"CA-04 in Lake County, USA",0.063125,0.03701716738197425,0.026107832618025753
"MD-06 in Allegany County, USA",-0.38275513201266276,-0.43697396750831863,0.05421883549565587
"MI-07 in Shiawassee County, USA",-0.1989303077828112,-0.19594949726812377,-0.002980810514687432
"TX-27 in San Patricio County, USA",-0.2893067398953575,-0.2359084976500593,-0.05339824224529818
"NY-22 in Madison County, USA",-0.10589099456441899,-0.14199707291112293,0.03610607834670394
"KY-01 in McCracken County, USA",-0.3169182127304182,-0.3719562855499457,0.055038072819527495
"GA-14 in Catoosa County, USA",-0.5594759610959409,-0.6070943908323281,0.04761842973638719
"LA-01 in Terrebonne Parish, USA",-0.5036626649573416,-0.47379771050435376,-0.029864954452987813
"GA-14 in Walker County, USA",-0.5929345234039654,-0.6150859909834697,0.02215146757950437
"KY-04 in Oldham County, USA",-0.21478650500790722,-0.3105043679420449,0.09571786293413767
"NC-03 in Carteret County, USA",-0.4198643968794984,-0.439947683804637,0.02008328692513861
"SC-03 in Laurens County, USA",-0.3229139333508266,-0.29818645316080955,-0.024727480190017026
"KS-04 in Butler County, USA",-0.41368388683886836,-0.4519651444480602,0.03828125760919182
"GA-03 in Spalding County, USA",-0.20829459423562227,-0.2456640625,0.03736946826437773
"CA-18 in Santa Cruz County, USA",0.6089096404322565,0.6366708971468998,-0.027761256714643356
"AR-04 in Jefferson County, USA",0.21702838063439064,0.25188303912858745,-0.034854658494196805
"IL-12 in Williamson County, USA",-0.37427196006180913,-0.4077922893381891,0.03352032927637999
"ME-02 in Aroostook County, USA",-0.1964211450650682,-0.16891259326505717,-0.027508551800011022
"MO-08 in St. Francois County, USA",-0.4809471090318203,-0.4538943961157192,-0.027052712916101118
"MI-02 in Ionia County, USA",-0.30293432696786216,-0.3084456691740523,0.005511342206190151
"IN-05 in Grant County, USA",-0.38788593323999704,-0.39097450336305334,0.0030885701230563
"MI-02 in Montcalm County, USA",-0.37748550769806144,-0.3394716073508963,-0.03801390034716512
"IN-06 in Wayne County, USA",-0.2907598872098908,-0.3012627546033856,0.010502867393494764
"OH-06 in Belmont County, USA",-0.4359602188567456,-0.39650567907590334,-0.039454539780842235
"MI-02 in Muskegon County, USA",-0.1641928498885655,-0.1435840294819568,-0.02060882040660869
"OK-02 in Muskogee County, USA",-0.3388620868386428,-0.2917905517013545,-0.04707153513728829
"NM-03 in McKinley County, USA",0.3517016472949243,0.3666371969731179,-0.014935549678193605
"MN-08 in Crow Wing County, USA",-0.29746347049013017,-0.31541208637910834,0.01794861588897817
"AZ-02 in Apache County, USA",0.33694416012737405,0.31969198510538305,0.017252175021991
"MI-01 in Marquette County, USA",0.11156495274707673,0.0423338185346919,0.06923113421238483
"NC-05 in Wilkes County, USA",-0.5659651203880491,-0.546680149713808,-0.019284970674241175
"WV-02 in Harrison County, USA",-0.37643547056556503,-0.3954251998634623,0.018989729297897273
"TX-28 in Starr County, USA",0.05056020019336859,0.6006120887528692,-0.5500518885595006
"NM-02 in Otero County, USA",-0.26329320022280306,-0.2984377761028879,0.03514457588008485
"CA-01 in Tehama County, USA",-0.3561853695901953,-0.36670325958452965,0.01051788999433434
"IL-15 in Adams County, USA",-0.46490887941062425,-0.4730368376576633,0.008127958247039047
"NY-21 in Warren County, USA",-0.0015768071039309526,-0.08469179826795721,0.08311499116402626
"WA-06 in Mason County, USA",-0.038784604474252755,-0.060088948166247526,0.02130434369199477
"PA-15 in Armstrong County, USA",-0.523288424525708,-0.5157188943007148,-0.007569530224993182
"SC-05 in Kershaw County, USA",-0.23117445703091155,-0.24879960540928098,0.017625148378369426
"IL-14 in Kane County, USA",0.20232785373169343,0.1766486841962541,0.025679169535439333
"OH-04 in Marion County, USA",-0.3865842260406931,-0.34383921434281145,-0.04274501169788164
"AL-04 in Walker County, USA",-0.6791145332050048,-0.6707722584147665,-0.008342274790238302
"GA-01 in Liberty County, USA",0.2403104399457665,0.21232239250480858,0.027988047440957925
"OH-06 in Jefferson County, USA",-0.3846500315286911,-0.357305686537801,-0.027344344990890113
"MN-07 in Clay County, USA",0.04106452860899898,-0.019140068752639676,0.060204597361638655
"SD-00 in Lincoln County, USA",-0.2357081121126065,-0.29420157742459674,0.058493465311990234
"IL-02 in Vermilion County, USA",-0.3039558680574667,-0.27263007031240893,-0.03132579774505778
"KY-05 in Pulaski County, USA",-0.627013316423589,-0.6667855614210301,0.03977224499744103
"OR-04 in Coos County, USA",-0.2046122724207687,-0.23686647718200107,0.03225420476123236
"OK-01 in Wagoner County, USA",-0.5061758719910169,-0.5401586215226056,0.03398274953158875
"NJ-02 in Salem County, USA",-0.1281764046931195,-0.15179358513595986,0.023617180442840363
"PA-07 in Carbon County, USA",-0.32031877248803114,-0.34080483736447037,0.020486064876439225
"PA-09 in Columbia County, USA",-0.30688781238972124,-0.32131217231118037,0.014424359921459129
"TX-17 in Nacogdoches County, USA",-0.31278700765353745,-0.3503226947219521,0.03753568706841465
"OH-06 in Tuscarawas County, USA",-0.3287727687519281,-0.2922968998113858,-0.03647586894054233
"SC-03 in Greenville County, USA",-0.28244987774110447,-0.34668851492222436,0.06423863718111988
"TN-01 in Hamblen County, USA",-0.5404165482522025,-0.5693988014691669,0.02898225321696435
"MI-02 in Isabella County, USA",-0.025546081462105512,-0.036851312644875844,0.011305231182770333
"MS-04 in Lamar County, USA",-0.4691592065999649,-0.551439492517892,0.08228028591792713
"CA-18 in San Benito County, USA",0.2435959905332034,0.21520332717190388,0.02839266336129953
"CA-03 in El Dorado County, USA",0.021306269344255283,-0.03831740693153539,0.05962367627579067
"IN-08 in Warrick County, USA",-0.2781458912619062,-0.33535832304149005,0.05721243177958385
"SC-07 in Georgetown County, USA",-0.12723833423442993,-0.128853229553881,0.0016148953194510818
"AR-04 in Pope County, USA",-0.5038064833005894,-0.49873720590190085,-0.005069277398688565
"NC-09 in Lee County, USA",-0.14913127413127414,-0.12928560038271408,-0.019845673748560055
"CA-38 in Orange County, USA",0.14869263119400256,0.13241479332849893,0.01627783786550363
"SC-07 in Darlington County, USA",-0.04973253683086686,-0.03708776613265797,-0.012644770698208893
"NE-03 in Hall County, USA",-0.3490604742758677,-0.3731459797033568,0.02408550542748905
"OK-03 in Garfield County, USA",-0.5372715113687027,-0.534868724090281,-0.002402787278421692
"OH-04 in Union County, USA",-0.31478546867992224,-0.3806903635229815,0.06590489484305928
"OH-12 in Knox County, USA",-0.4380834050144955,-0.38308283816847255,-0.05500056684602295
"KY-05 in Laurel County, USA",-0.6676709848819081,-0.6909508641609864,0.023279879279078264
"WA-05 in Walla Walla County, USA",-0.08668948530117399,-0.15567095479759235,0.06898146949641837
"MI-06 in Oakland County, USA",0.148439628672678,0.04085624815807908,0.1075833805145989
"AL-07 in Montgomery County, USA",0.7981170005407155,0.7989902849318633,-0.000873284391147755
"NC-08 in Stanly County, USA",-0.5105925336633371,-0.49704506824462025,-0.013547465418716875
"NH-02 in Rockingham County, USA",-0.10495619331466303,-0.18017530878251464,0.07521911546785161
"OH-12 in Athens County, USA",0.15012149201799516,0.17059418870901585,-0.020472696691020698
"MI-02 in Barry County, USA",-0.3251357749617045,-0.33261894556365196,0.007483170601947475
"OH-09 in Wood County, USA",-0.04971491099978277,-0.08819967246140274,0.03848476146161997
"WI-02 in Sauk County, USA",0.033077493486686746,0.009521294603837882,0.023556198882848864
"NC-11 in Haywood County, USA",-0.26517151555988644,-0.2751937268728664,0.010022211312979978
"IN-02 in Kosciusko County, USA",-0.5081077986790862,-0.5445141164192209,0.0364063177401347
"KS-01 in Reno County, USA",-0.3420421602662754,-0.35836431226765797,0.016322152001382595
