"Jackson County, Tennessee, USA",-0.5605035700864339,-0.4717868338557984,-0.08871673623063553,47087
"Trousdale County, Tennessee, USA",-0.4812454475216338,-0.36615939229330763,-0.11508605522832616,47169
"Ramsey County, North Dakota, USA",-0.3607594936708867,-0.32271442035815345,-0.03804507331273327,38071
"Conecuh County, Alabama, USA",-0.07390156807949048,-0.051632498101746166,-0.02226906997774432,01035
"Red River County, Texas, USA",-0.5628011011699936,-0.5380740166634368,-0.024727084506556807,48387
"Douglas County, Missouri, USA",-0.6974285714285744,-0.6755702280912369,-0.021858343337337494,29067
"Sierra County, New Mexico, USA",-0.21480235492010102,-0.2697710635255152,0.054968708605414196,35051
"Haskell County, Oklahoma, USA",-0.6745113681691267,-0.5949767834529326,-0.07953458471619412,40061
"Rio Grande County, Colorado, USA",-0.1847739888977011,-0.19588001445609068,0.011106025558389576,08105
"Charlotte County, Virginia, USA",-0.24196414149572043,-0.22800068882383326,-0.013963452671887172,51037
"Big Horn County, Wyoming, USA",-0.6985396383866453,-0.6513071280797449,-0.047232510306900455,56003
"Cottonwood County, Minnesota, USA",-0.3816931390207958,-0.34976402726796,-0.031929111752835804,27033
"Perry County, Mississippi, USA",-0.5304259634888433,-0.5366347569955826,0.006208793506739307,28111
"Richland County, Montana, USA",-0.6769575715764061,-0.6678357747060026,-0.009121796870403487,30083
"Fergus County, Montana, USA",-0.5183648378669142,-0.5251712328767107,0.006806395009796518,30027
"Decatur County, Tennessee, USA",-0.6344209120396883,-0.5866724738675947,-0.04774843817209362,47039
"Greensville County, Virginia, USA",0.1557660216184468,0.1877980479507764,-0.0320320263323296,51081
"Heard County, Georgia, USA",-0.6848451122240791,-0.6245839277223018,-0.06026118450177731,13149
"Desha County, Arkansas, USA",0.022814601344861258,0.07258632840028137,-0.049771727055420115,05041
"Blanco County, Texas, USA",-0.4735219198283967,-0.516623150565709,0.04310123073731226,48031
"Wabash County, Illinois, USA",-0.5335240479170399,-0.5300146412884328,-0.0035094066286071035,17185
"Live Oak County, Texas, USA",-0.6684460260972712,-0.6327289632728983,-0.035717062824372925,48297
"Monroe County, Kentucky, USA",-0.7450317081313731,-0.7367309406484799,-0.008300767482893212,21171
"Montgomery County, Missouri, USA",-0.5642758142758102,-0.5540615214588301,-0.010214292816980053,29139
"Jefferson Davis County, Mississippi, USA",0.17141477547078834,0.20105820105820044,-0.029643425587412092,28065
"Okfuskee County, Oklahoma, USA",-0.535413571074792,-0.4709611970580789,-0.06445237401671317,40107
"Pope County, Minnesota, USA",-0.27627456565081066,-0.26697262225035767,-0.009301943400452983,27121
"Ceiba Municipio, Puerto Rico, USA",,,,72037
"Martin County, Kentucky, USA",-0.7870229007633593,-0.7943334176574753,0.007310516894115993,21159
"Owen County, Kentucky, USA",-0.5854105571847517,-0.536707341468295,-0.04870321571645664,21187
"Watonwan County, Minnesota, USA",-0.2145741203614702,-0.1908763505402157,-0.02369776982125449,27165
"Dooly County, Georgia, USA",-0.060414129110840896,-0.020471624773256,-0.039942504337584894,13093
"Bacon County, Georgia, USA",-0.7268637532133648,-0.6857427220701652,-0.04112103114319965,13005
"Green County, Kentucky, USA",-0.6741225051617354,-0.6637914869679357,-0.01033101819379978,21087
"Clay County, North Carolina, USA",-0.49513999709850653,-0.5107468698792335,0.015606872780726921,37043
"Lake County, South Dakota, USA",-0.2746466882342936,-0.25405246094901124,-0.020594227285282374,46079
"DeKalb County, Missouri, USA",-0.5983894280404726,-0.5917211328976019,-0.006668295142870706,29063
"Washington County, North Carolina, USA",0.09911361804995984,0.15344687753446873,-0.054333259484508886,37187
"Candler County, Georgia, USA",-0.4206725344166092,-0.43529099123039955,0.01461845681379037,13043
"Grant County, West Virginia, USA",-0.7740061717190061,-0.7736077481840192,-0.0003984235349868692,54023
"McIntosh County, Georgia, USA",-0.20967741935483944,-0.20057597831611007,-0.009101441038729369,13191
"Wayne County, Missouri, USA",-0.7046614494726099,-0.6439854191980564,-0.06067603027455348,29223
"Noble County, Oklahoma, USA",-0.5706763872012957,-0.5768757687576866,0.006199381556390993,40103
"Washita County, Oklahoma, USA",-0.7301653757588448,-0.7052472468149406,-0.024918128943904216,40149
"St. Helena Parish, Louisiana, USA",0.10263072426112355,0.14352783366867958,-0.04089710940755603,22091
"Lancaster County, Virginia, USA",-0.04600111856823227,-0.09841986455981871,0.05241874599158645,51103
"Alleghany County, North Carolina, USA",-0.5004703071075549,-0.47174168077572587,-0.028728626331829044,37005
"Lake County, Minnesota, USA",0.03517819963531998,0.022158150233842204,0.013020049401477773,27075
"Lincoln County, Washington, USA",-0.488696146736811,-0.5013127953789599,0.012616648642148898,53043
"North Slope Borough, Alaska, USA",-0.03791546374948464,0.133267644537004,-0.17118310828648864,02185
"Early County, Georgia, USA",-0.05494505494505533,-0.08025078369905883,0.025305728754003498,13099
"Barnes County, North Dakota, USA",-0.3141060197663966,-0.2924775449101783,-0.021628474856218327,38003
"Box Butte County, Nebraska, USA",-0.5695811619378511,-0.547029702970298,-0.022551458967553173,31013
"Louisa County, Iowa, USA",-0.33270817704426053,-0.28374600638977593,-0.048962170654484605,19115
"Sussex County, Virginia, USA",0.11949685534591191,0.1633624107850905,-0.0438655554391786,51183
"Pushmataha County, Oklahoma, USA",-0.7064781599493571,-0.6319428953825558,-0.07453526456680137,40127
"Carroll County, Kentucky, USA",-0.4444981862152356,-0.3844357976653699,-0.06006238854986573,21041
"Hancock County, Iowa, USA",-0.43859364873622864,-0.40708567535343143,-0.031507973382797205,19081
"Roosevelt County, Montana, USA",-0.021409011700273067,-0.06496710526315792,0.043558093562884856,30085
"Evans County, Georgia, USA",-0.3682599481987285,-0.3536923931149371,-0.014567555083791373,13109
"Red Willow County, Nebraska, USA",-0.6812179016874544,-0.7056640624999989,0.02444616081254447,31145
"Ripley County, Missouri, USA",-0.7007171593493097,-0.6688405797101453,-0.03187657963916435,29181
"Winnebago County, Iowa, USA",-0.2633165829145728,-0.2619664765854504,-0.0013501063291224136,19189
"Guthrie County, Iowa, USA",-0.35897033432742065,-0.3297391304347808,-0.029231203892639834,19077
"Middlesex County, Virginia, USA",-0.25109718592111413,-0.2593865389617449,0.008289353040630776,51119
"Mackinac County, Michigan, USA",-0.24035312934392974,-0.2747386221449355,0.03438549280100575,26097
"Wilcox County, Alabama, USA",0.3752329324072512,0.4241384942021876,-0.04890556179493638,01131
"Essex County, Virginia, USA",-0.006136222924080393,-0.021528673090298465,0.015392450166218073,51057
"Colfax County, Nebraska, USA",-0.4334140435835367,-0.4133585381222424,-0.02005550546129431,31037
"Maunabo Municipio, Puerto Rico, USA",,,,72095
"Bollinger County, Missouri, USA",-0.7382583987965889,-0.7271123654965613,-0.011146033300027613,29017
"Mitchell County, Iowa, USA",-0.2789419443490204,-0.24035443972678552,-0.0385875046222349,19131
"Walsh County, North Dakota, USA",-0.4162659418774837,-0.3943054357204499,-0.02196050615703382,38099
"Bradley County, Arkansas, USA",-0.3067870826491521,-0.23186422118806457,-0.07492286146108754,05011
"Custer County, Nebraska, USA",-0.7181711997330235,-0.7266535221365824,0.00848232240355895,31041
"Crawford County, Indiana, USA",-0.4304207119741098,-0.3644980611805244,-0.06592265079358539,18025
"Leslie County, Kentucky, USA",-0.8054458532529597,-0.8047640249332135,-0.0006818283197461694,21131
"Washington County, Idaho, USA",-0.576534431137726,-0.5627384960718292,-0.013795935065896714,16087
"Gates County, North Carolina, USA",-0.13749790654831656,-0.09068991097922839,-0.04680799556908817,37073
"Carbon County, Montana, USA",-0.29027226318774824,-0.3217697335344412,0.03149747034669298,30009
"Cumberland County, Illinois, USA",-0.5932087120562529,-0.5703251302317252,-0.022883581824527766,17035
"Coosa County, Alabama, USA",-0.33491513049826604,-0.3044554455445534,-0.03045968495371265,01037
"Franklin County, Texas, USA",-0.6701936514274287,-0.6666666666666672,-0.00352698476076152,48159
"Bullock County, Alabama, USA",0.4985909386516368,0.5074309978768582,-0.008840059225221408,01011
"Camden County, North Carolina, USA",-0.46615152024189543,-0.45385537355173783,-0.012296146690157606,37029
"Ralls County, Missouri, USA",-0.5635817732250102,-0.5375996961640697,-0.025982077060940578,29173
"Montgomery County, Iowa, USA",-0.3897127839309185,-0.42069785884218797,0.03098507491126945,19137
"Lowndes County, Alabama, USA",0.45881492318946626,0.4685816876122081,-0.009766764422741825,01085
"Metcalfe County, Kentucky, USA",-0.5953711093375889,-0.5444901493829838,-0.050880959954605065,21169
"Noxubee County, Mississippi, USA",0.5244427795467325,0.5645855758880518,-0.04014279634131934,28103
"Roberts County, South Dakota, USA",-0.13373577896447836,-0.15530984829004676,0.021574069325568407,46109
"Nemaha County, Kansas, USA",-0.6574595355383533,-0.6636079656384236,0.006148430100070268,20131
"Johnston County, Oklahoma, USA",-0.6358503881439649,-0.5741662518665985,-0.06168413627736635,40069
"Butte County, South Dakota, USA",-0.5814244064972931,-0.6115835440128714,0.030159137515578305,46019
"Clay County, Texas, USA",-0.77451321279555,-0.7636182902584517,-0.010894922537098228,48077
"Chicot County, Arkansas, USA",0.12381184499146958,0.15181992337164735,-0.02800807838017777,05017
"Pike County, Arkansas, USA",-0.6771078662270379,-0.6191911580005025,-0.057916708226535385,05109
"Alcona County, Michigan, USA",-0.38312331870309857,-0.39835430784123993,0.01523098913814136,26001
"Howard County, Missouri, USA",-0.420349636613635,-0.410710607621011,-0.009639028992623977,29089
"Love County, Oklahoma, USA",-0.6364082433758601,-0.577197149643706,-0.05921109373215405,40085
"Holt County, Nebraska, USA",-0.7374029257720813,-0.7534489554592056,0.01604602968712432,31089
"Nome Census Area, Alaska, USA",0.2262671520582468,0.2313274871484726,-0.005060335090225798,02180
"Marshall County, Kansas, USA",-0.4829878764176778,-0.47827947785149144,-0.004708398566186378,20117
"Keokuk County, Iowa, USA",-0.4493682821044695,-0.41083249749247636,-0.03853578461199314,19107
"Lewis County, Missouri, USA",-0.5573877196788862,-0.5410866636731028,-0.016301056005783465,29111
"Franklin County, Iowa, USA",-0.35009746588694035,-0.3361513687600683,-0.013946097126872059,19069
"Perry County, Arkansas, USA",-0.533174843311,-0.4549465861588466,-0.07822825715215337,05105
"Madison Parish, Louisiana, USA",0.1550321199143467,0.17265426880811519,-0.01762214889376848,22065
"Ochiltree County, Texas, USA",-0.7945552389996826,-0.7818000664231168,-0.012755172576565776,48357
"Carroll County, Mississippi, USA",-0.38502017189966664,-0.3833212735166431,-0.0016988983830235616,28015
"Jackson County, Minnesota, USA",-0.378587386148822,-0.3860320933625096,0.007444707213687618,27063
"Yuma County, Colorado, USA",-0.6669343505320214,-0.652055938217493,-0.014878412314528466,08125
"Calhoun County, Iowa, USA",-0.4220235831114506,-0.40124055049427937,-0.020783032617171238,19025
"Webster County, Mississippi, USA",-0.6020389249304908,-0.5833497731307947,-0.018689151799696102,28155
"Runnels County, Texas, USA",-0.7382626445906129,-0.7395557905869904,0.0012931459963775316,48399
"Sabine County, Texas, USA",-0.7494081223820782,-0.7280550774526662,-0.021353044929412035,48403
"Lanier County, Georgia, USA",-0.4166666666666671,-0.4114565141460008,-0.005210152520666256,13173
"Parmer County, Texas, USA",-0.6215094339622642,-0.5765656565656584,-0.04494377739660582,48369
"Pulaski County, Georgia, USA",-0.39122936683912324,-0.3703806612948045,-0.020848705544318724,13235
"Swift County, Minnesota, USA",-0.2949350030470533,-0.2557568861723843,-0.03917811687466899,27151
"Scott County, Arkansas, USA",-0.6981132075471687,-0.6065527065527071,-0.09156050099446156,05127
"Duval County, Texas, USA",0.026123095190975297,0.35196737044145915,-0.3258442752504839,48131
"Emery County, Utah, USA",-0.7421396488362597,-0.7101212686567162,-0.032018380179543504,49015
"Montgomery County, Mississippi, USA",-0.15656193987183004,-0.14044243196479034,-0.0161195079070397,28097
"Sac County, Iowa, USA",-0.4827461607949423,-0.4668073676131987,-0.015938793181743627,19161
"Martin County, Indiana, USA",-0.5867029548989118,-0.5810978126289733,-0.005605142269938468,18101
"Mountrail County, North Dakota, USA",-0.3764705882352947,-0.3317096931320015,-0.04476089510329323,38061
"Grundy County, Missouri, USA",-0.6279017354068048,-0.6077498300475871,-0.020151905359217737,29079
"Tunica County, Mississippi, USA",0.4643458731049973,0.5085506027474072,-0.044204729642409846,28143
"McLean County, North Dakota, USA",-0.5361271676300579,-0.5228598306679232,-0.013267336962134668,38055
"West Carroll Parish, Louisiana, USA",-0.7139746634996033,-0.6839672200042025,-0.030007443495400743,22123
"Clarke County, Iowa, USA",-0.3593147751606003,-0.28019757521329347,-0.07911719994730682,19039
"Switzerland County, Indiana, USA",-0.5223812414898815,-0.4389684397822151,-0.0834128017076664,18155
"Marion County, Texas, USA",-0.4381167763157889,-0.42897593204341916,-0.00914084427236972,48315
"Rock County, Minnesota, USA",-0.3868320610687032,-0.3550320314114489,-0.031800029657254314,27133
"Wayne County, Nebraska, USA",-0.48404761904761884,-0.4934926958831335,0.009445076835514654,31179
"Stevens County, Minnesota, USA",-0.2206489675516226,-0.12652834383104825,-0.09412062372057436,27149
"Zavala County, Texas, USA",0.3135554541305341,0.5725663716814134,-0.25901091755087935,48507
"Grand County, Utah, USA",0.10744598765432097,-0.003531229309203415,0.11097721696352437,49019
"Irwin County, Georgia, USA",-0.5100767754318595,-0.4979536152796714,-0.012123160152188062,13155
"Cumberland County, Virginia, USA",-0.14932452212748917,-0.13481292793377278,-0.014511594193716393,51049
"Caldwell Parish, Louisiana, USA",-0.6784964300713971,-0.646632566069906,-0.031863864001491105,22021
"Humboldt County, Iowa, USA",-0.4462173831424808,-0.4552781600157256,0.009060776873244802,19091
"Linn County, Kansas, USA",-0.6246531906460584,-0.6207363903320551,-0.003916800314003321,20107
"Chattahoochee County, Georgia, USA",-0.13463969658659822,-0.11294964028776885,-0.021690056298829363,13053
"Wilkes County, Georgia, USA",-0.13183535494134072,-0.16171543444270747,0.029880079501366757,13317
"Greenlee County, Arizona, USA",-0.3394843962008147,-0.2424242424242426,-0.09706015377657212,04011
"Brewster County, Texas, USA",-0.04209871422646157,-0.0479774223894649,0.0058787081630033294,48043
"Iron County, Missouri, USA",-0.5773083623693365,-0.5258215962441316,-0.051486766125204864,29093
"Benewah County, Idaho, USA",-0.5833500904886385,-0.5574671445639201,-0.025882945924718403,16009
"Yellow Medicine County, Minnesota, USA",-0.37011577424023184,-0.3521607278241077,-0.017955046416124165,27173
"McCormick County, South Carolina, USA",-0.04756889591012853,-0.033167177914110425,-0.014401717996018103,45065
"Brown County, Kansas, USA",-0.48266607023037383,-0.5061942517343879,0.02352818150401409,20013
"Howard County, Iowa, USA",-0.2732956837434444,-0.2048694889230099,-0.06842619482043447,19089
"Cheyenne County, Nebraska, USA",-0.6207764952780666,-0.6373247033441205,0.01654820806605395,31033
"Latimer County, Oklahoma, USA",-0.6295598964462215,-0.5678007889546342,-0.061759107491587306,40077
"Hamilton County, Nebraska, USA",-0.5767214892463416,-0.5894886363636355,0.012767147117293876,31081
"Rice County, Kansas, USA",-0.5318360731650863,-0.5630914826498441,0.0312554094847578,20159
"Pipestone County, Minnesota, USA",-0.4548582995951422,-0.45985856905158223,0.005000269456440054,27117
"Deer Lodge County, Montana, USA",0.07687589450010174,0.0703385789222702,0.0065373155778315345,30023
"Clear Creek County, Colorado, USA",0.12981062919975503,0.02625298329355672,0.10355764590619831,08019
"Emmet County, Iowa, USA",-0.35957139913455827,-0.3717652009257309,0.012193801791172632,19063
"Charles Mix County, South Dakota, USA",-0.36346814697330326,-0.4214972327410401,0.058029085767736854,46023
"Beaverhead County, Montana, USA",-0.40893835011482005,-0.4557640750670234,0.04682572495220333,30001
"Nowata County, Oklahoma, USA",-0.659986335686631,-0.6086853906065617,-0.05130094508006933,40105
"Todd County, South Dakota, USA",0.5636077195746357,0.479058823529412,0.08454889604522375,46121
"Jasper County, Illinois, USA",-0.6253586800573923,-0.5940420560747678,-0.03131662398262447,17079
"St. Clair County, Missouri, USA",-0.5918777643747483,-0.5539956803455718,-0.03788208402917648,29185
"Clinton County, Kentucky, USA",-0.7455393349553935,-0.7317182593091068,-0.013821075646286651,21053
"Johnson County, Georgia, USA",-0.39707317073170595,-0.37561108093427525,-0.021462089797430695,13167
"Terrell County, Georgia, USA",0.08423913043478216,0.09399665151877484,-0.009757521083992679,13273
"Somervell County, Texas, USA",-0.6731425216717511,-0.6838134024727603,0.010670880801009197,48425
"Forest County, Wisconsin, USA",-0.3095190975658023,-0.26578657865786676,-0.04373251890793556,55041
"Jones County, North Carolina, USA",-0.19601809954751098,-0.17733376521821606,-0.01868433432929492,37103
"Pratt County, Kansas, USA",-0.5257432922407528,-0.5380010411244128,0.012257748883660047,20151
"Montmorency County, Michigan, USA",-0.4340331114524646,-0.4414054701537258,0.0073723587012611835,26119
"McLean County, Kentucky, USA",-0.5351317440401488,-0.5240911081909766,-0.011040635849172253,21149
"Seminole County, Georgia, USA",-0.34938208032955764,-0.3227247347850367,-0.026657345544520927,13253
"Claiborne County, Mississippi, USA",0.712294897729827,0.7415730337078658,-0.029278135978038744,28021
"Davis County, Iowa, USA",-0.4921989273525124,-0.4497681607418873,-0.042430766610625115,19051
"Stephens County, Texas, USA",-0.7852825229960567,-0.7769742551345102,-0.008308267861546481,48429
"Hancock County, Kentucky, USA",-0.39110529758011703,-0.3596552527370148,-0.03145004484310221,21091
"White Pine County, Nevada, USA",-0.5822842755779363,-0.5343228200371072,-0.04796145554082909,32033
"Marshall County, Minnesota, USA",-0.4744768237825158,-0.4116670126634853,-0.0628098111190305,27089
"Cloud County, Kansas, USA",-0.5446868402533425,-0.5491094147582687,0.004422574504926224,20029
"Cuming County, Nebraska, USA",-0.5924511345765022,-0.5971669980119291,0.004715863435426848,31039
"Turner County, Georgia, USA",-0.24762658227848272,-0.25014731879787927,0.002520736519396549,13287
"Palo Alto County, Iowa, USA",-0.37333602258975346,-0.35785668722092384,-0.015479335368829616,19147
"Crittenden County, Kentucky, USA",-0.6412069778406402,-0.6621253405994562,0.020918362758815978,21055
"Mitchell County, Texas, USA",-0.6872093023255816,-0.6470054446460975,-0.04020385767948409,48335
"Kemper County, Mississippi, USA",0.23250898330162825,0.2261263203276562,0.006382662973972053,28069
"Phelps County, Nebraska, USA",-0.6797764024755469,-0.70792827824584,0.0281518757702931,31137
"Stillwater County, Montana, USA",-0.5775681341719073,-0.565762433210029,-0.011805700961878385,30095
"Dawson County, Montana, USA",-0.5794818652849744,-0.5848533825906252,0.005371517305650886,30021
"Richmond County, Virginia, USA",-0.25191918263924307,-0.23641982006395507,-0.015499362575288,51159
"Catahoula Parish, Louisiana, USA",-0.46768217373404664,-0.44419275123558494,-0.0234894224984617,22025
"Livingston County, Kentucky, USA",-0.6138317009794131,-0.5778591427956037,-0.0359725581838094,21139
"Wilkinson County, Georgia, USA",-0.12348008385744251,-0.10261804581580151,-0.020862038041640996,13319
"Las Marías Municipio, Puerto Rico, USA",,,,72083
"Alger County, Michigan, USA",-0.18750664663288094,-0.20430881171836063,0.016802165085479687,26003
"Caldwell County, Missouri, USA",-0.6040153780435705,-0.5553235908141941,-0.04869178722937639,29025
"Greene County, Iowa, USA",-0.28752224639113716,-0.23418377929890155,-0.05333846709223561,19073
"Wilcox County, Georgia, USA",-0.4696738799146604,-0.418432559704003,-0.051241320210657415,13315
"Monona County, Iowa, USA",-0.3893824027072762,-0.40966754155730484,0.02028513885002864,19133
"Hancock County, Georgia, USA",0.4384153661464586,0.5189944134078225,-0.08057904726136389,13141
"Quay County, New Mexico, USA",-0.3780015491866763,-0.33419625019681265,-0.04380529898986363,35037
"Blaine County, Oklahoma, USA",-0.627531402204562,-0.5728974426575238,-0.0546339595470382,40011
"Clearwater County, Idaho, USA",-0.5829373161348731,-0.5651144435674826,-0.017822872567390458,16035
"Sublette County, Wyoming, USA",-0.618712273641852,-0.6298405466970401,0.011128273055188154,56035
"Benton County, Indiana, USA",-0.48636806231743196,-0.4661062906724515,-0.020261771644980442,18007
"Modoc County, California, USA",-0.4515905947441211,-0.4840340606705703,0.0324434659264492,06049
"Gallatin County, Kentucky, USA",-0.5541699142634442,-0.5076415942463293,-0.04652832001711493,21077
"Lyon County, Kentucky, USA",-0.4749290444654677,-0.4402928553395613,-0.03463618912590638,21143
"Jenkins County, Georgia, USA",-0.25904486251808934,-0.2529488859764088,-0.006095976541680537,13165
"Turner County, South Dakota, USA",-0.47295514511873543,-0.4761445783132525,0.0031894331945170884,46125
"Monroe County, Missouri, USA",-0.5668079411108629,-0.5560646250301426,-0.010743316080720211,29137
"Oregon County, Missouri, USA",-0.6381093057607075,-0.6012427683736882,-0.03686653738701928,29149
"Lucas County, Iowa, USA",-0.4326133909287258,-0.3762057877813503,-0.05640760314737553,19117
"Wilson County, Kansas, USA",-0.6145675265553899,-0.6109718741297682,-0.003595652425621765,20205
"Woods County, Oklahoma, USA",-0.6530723219140797,-0.6611232279171214,0.008050906003041702,40151
"Madison County, Montana, USA",-0.3975685887957944,-0.4463419776512767,0.048773388855482325,30057
"Dimmit County, Texas, USA",0.24004364429896435,0.3717829457364333,-0.13173930143746893,48127
"Montgomery County, Georgia, USA",-0.49949571356530537,-0.5117911285794482,0.01229541501414283,13209
"Platte County, Wyoming, USA",-0.6110095470241733,-0.6001324795760653,-0.010877067448108013,56031
"Lee County, Arkansas, USA",0.04810393258426783,0.16721744877726522,-0.11911351619299738,05077
"Wilkinson County, Mississippi, USA",0.3452152128409208,0.3647883315546075,-0.019573118713686666,28157
"Archer County, Texas, USA",-0.8035863219349464,-0.7919682465561515,-0.01161807537879489,48009
"Ozark County, Missouri, USA",-0.6809210526315806,-0.6476338591424146,-0.03328719348916609,29153
"Mathews County, Virginia, USA",-0.35633367662203913,-0.36791564677085326,0.011581970148814125,51115
"Clearwater County, Minnesota, USA",-0.4482600498684969,-0.4296306207474696,-0.018629429121027274,27029
"Perry County, Alabama, USA",0.48202676864244726,0.45793861311102746,0.024088155531419797,01105
"Kiowa County, Oklahoma, USA",-0.5760140064196069,-0.5236186659032326,-0.05239534051637429,40075
"Carroll County, Missouri, USA",-0.644307149161519,-0.6271497362990137,-0.017157412862505272,29033
"Montgomery County, Arkansas, USA",-0.5977278595404083,-0.5324529362180386,-0.06527492332236973,05097
"Trimble County, Kentucky, USA",-0.5128501968048158,-0.49947201689545956,-0.013378179909356247,21223
"Jack County, Texas, USA",-0.8162347964040166,-0.7937313432835846,-0.022503453120432004,48237
"Johnson County, Wyoming, USA",-0.6072446072446083,-0.642743943853293,0.03549933660868476,56019
"Ritchie County, West Virginia, USA",-0.7151528981593486,-0.7138660740033184,-0.0012868241560302085,54085
"Warren County, Indiana, USA",-0.5428315813017213,-0.5206276891926096,-0.022203892109111667,18171
"Maries County, Missouri, USA",-0.6451477677635702,-0.6148888888888889,-0.03025887887468126,29125
"Daviess County, Missouri, USA",-0.6027116909695549,-0.5511363636363674,-0.05157532733318748,29061
"Bracken County, Kentucky, USA",-0.6121583411875591,-0.5687553161326919,-0.04340302505486715,21023
"Knox County, Nebraska, USA",-0.5995316159250573,-0.6057928325969553,0.00626121667189794,31107
"Cedar County, Nebraska, USA",-0.6903522818254577,-0.6794401101422664,-0.010912171683191363,31027
"Webster County, West Virginia, USA",-0.6316872427983539,-0.5873655913978483,-0.04432165140050559,54101
"Butler County, Nebraska, USA",-0.5933748332592272,-0.6082526744778398,0.014877841218612575,31023
"Kusilvak Census Area, Alaska, USA",0.3356531049250533,0.40546218487394964,-0.06980907994889635,02158
"Perry County, Tennessee, USA",-0.6301050175029177,-0.549912434325745,-0.0801925831771727,47135
"Coffey County, Kansas, USA",-0.55312157721796,-0.5710422812192716,0.017920704001311627,20031
"Mercer County, North Dakota, USA",-0.674224598930482,-0.6702263989747995,-0.003998199955682513,38057
"Keith County, Nebraska, USA",-0.6372593950504126,-0.6668335419274096,0.029574146876997,31101
"Rosebud County, Montana, USA",-0.3411078717201168,-0.36802325581395295,0.026915384093836148,30087
"Sitka City and Borough, Alaska, USA",0.17621880988491082,0.08857553608473674,0.08764327380017407,02220
"Custer County, South Dakota, USA",-0.42409901710957437,-0.46007201864011915,0.03597300153054478,46033
"Tyler County, West Virginia, USA",-0.6616793208475161,-0.6811975381244835,0.019518217276967342,54095
"Nevada County, Arkansas, USA",-0.3147706968433592,-0.25970425138632125,-0.05506644545703793,05099
"Atkinson County, Georgia, USA",-0.46751188589540366,-0.4524904214559378,-0.015021464439465837,13003
"Houston County, Tennessee, USA",-0.5010851871947919,-0.415404040404041,-0.0856811467907509,47083
"Prairie County, Arkansas, USA",-0.6100143061516458,-0.49099883855981435,-0.1190154675918314,05117
"Hickory County, Missouri, USA",-0.5728346456692924,-0.5351694915254253,-0.037665154143867174,29085
"Choctaw County, Mississippi, USA",-0.430026047833294,-0.38622386223862115,-0.04380218559467286,28019
"Lafayette County, Florida, USA",-0.7156916347730988,-0.6716505423629434,-0.044041092410155414,12067
"Hamilton County, Texas, USA",-0.6811095827602011,-0.7139695712309827,0.03285998847078164,48193
