"Izard County, Arkansas, USA",-0.621342512908778,-0.5376284875183553,-0.08371402539042261
"Ford County, Illinois, USA",-0.47375233712066733,-0.4793621013133208,0.005609764192653466
"Greene County, Mississippi, USA",-0.6586373021335169,-0.6260011175265413,-0.03263618460697559
"Grundy County, Tennessee, USA",-0.6515203279808678,-0.5536426621876969,-0.09787766579317092
"Martinsville city-County, Virginia, USA",0.26625644437053053,0.23429829016421194,0.03195815420631859
"Madison County, Texas, USA",-0.5815402038505096,-0.5758918162741898,-0.005648387576319802
"Ketchikan Gateway Borough, Alaska, USA",-0.16489399110266653,-0.22168897615212763,0.056794985049461094
"Pend Oreille County, Washington, USA",-0.36653805682216767,-0.3585710085269039,-0.00796704829526379
"Fremont County, Idaho, USA",-0.6771841047774967,-0.6017497812773404,-0.07543432350015633
"Monroe County, Ohio, USA",-0.5397313933967544,-0.4720259128386337,-0.06770548055812065
"Hughes County, Oklahoma, USA",-0.6086061354745728,-0.5362350861688024,-0.07237104930577032
"Archuleta County, Colorado, USA",-0.1586832895888014,-0.2403597220329745,0.08167643244417311
"Bamberg County, South Carolina, USA",0.24575748225856217,0.2726102349533312,-0.026852752694769028
"Johnson County, Illinois, USA",-0.5869193723784372,-0.5759566431269503,-0.010962729251486891
"Buffalo County, Wisconsin, USA",-0.25277903525979584,-0.21830743827734483,-0.034471596982451
"Moffat County, Colorado, USA",-0.6357813834329633,-0.679080459770115,0.04329907633715169
"Clay County, Illinois, USA",-0.65349985477781,-0.6300787401574803,-0.023421114620329697
"Osage County, Missouri, USA",-0.714683645045762,-0.6852870644660742,-0.029396580579687748
"Calhoun County, Mississippi, USA",-0.4132018209408194,-0.3877423389618512,-0.025459481978968246
"Amelia County, Virginia, USA",-0.3774230330672748,-0.3664772727272727,-0.010945760340002109
"Jackson County, Kansas, USA",-0.4003645200486027,-0.4171536610519079,0.016789141003305197
"Mono County, California, USA",0.22265103161644648,0.1255928666287232,0.09705816498772327
"Crenshaw County, Alabama, USA",-0.47816230920356656,-0.4546034785383756,-0.023558830665190933
"Shoshone County, Idaho, USA",-0.4170937345015705,-0.3736328125,-0.04346092200157048
"Powell County, Kentucky, USA",-0.4858151929893779,-0.4521724199457462,-0.033642773043631724
"Cass County, Iowa, USA",-0.3804288070368334,-0.39438596491228073,0.013957157875447324
"Big Horn County, Montana, USA",0.05936454849498328,0.05705492424242424,0.0023096242525590394
"Mason County, Illinois, USA",-0.3944723618090452,-0.31514030218933087,-0.07933205961971435
"Lewis County, Kentucky, USA",-0.7075926148702445,-0.6753182941831839,-0.0322743206870606
"Lamb County, Texas, USA",-0.6068356722498869,-0.5831049090456017,-0.023730763204285132
"Cass County, Illinois, USA",-0.3780327252209893,-0.31128024980484,-0.06675247541614932
"Webster County, Kentucky, USA",-0.5164413286596562,-0.5438415159345392,0.027400187274883026
"Perquimans County, North Carolina, USA",-0.3221539283805452,-0.27698270721526536,-0.04517122116527983
"Crawford County, Michigan, USA",-0.3072128227960819,-0.3278784336645237,0.020665610868441764
"Presque Isle County, Michigan, USA",-0.2914169263965476,-0.2892768079800499,-0.002140118416497694
"Bienville Parish, Louisiana, USA",-0.11687943262411347,-0.08954629984848032,-0.02733313277563315
"Millard County, Utah, USA",-0.7684887459807074,-0.6541396413582602,-0.11434910462244718
"Jackson County, Kentucky, USA",-0.7930639620480943,-0.8012727272727272,0.008208765224632986
"Wright County, Iowa, USA",-0.3421810041573393,-0.3159641553269167,-0.026216848830422634
"Lincoln County, Arkansas, USA",-0.43793548387096776,-0.314427600627287,-0.12350788324368078
"Kodiak Island Borough, Alaska, USA",-0.2178273881657922,-0.20039291056063302,-0.017434477605159177
"Wilbarger County, Texas, USA",-0.5676392572944297,-0.5741778319123021,0.006538574617872439
"Vinton County, Ohio, USA",-0.5477020076323212,-0.460196292257361,-0.08750571537496027
"Howard County, Arkansas, USA",-0.4193214729002896,-0.386392811296534,-0.03292866160375557
"Meigs County, Tennessee, USA",-0.6252711496746204,-0.575462962962963,-0.04980818671165743
"Bath County, Kentucky, USA",-0.4288253065576684,-0.37551821950687325,-0.05330708705079512
"Amite County, Mississippi, USA",-0.2616731517509728,-0.22581560283687943,-0.035857548914093346
"Tallahatchie County, Mississippi, USA",0.10853122251539138,0.14906303236797275,-0.04053180985258137
"Choctaw County, Alabama, USA",-0.15661843515541266,-0.13672517827756445,-0.01989325687784821
"Caldwell County, Kentucky, USA",-0.540292470441817,-0.5434309623430962,0.003138491901279128
"Madison County, Missouri, USA",-0.6280831571529246,-0.5823617901466717,-0.045721367006252955
"Chippewa County, Minnesota, USA",-0.30615640599001664,-0.28704596592735454,-0.019110440062662104
"Bleckley County, Georgia, USA",-0.5287416754293726,-0.5296378717378111,0.0008961963084385127
"Lewis County, Tennessee, USA",-0.6065252273132465,-0.5830809173517958,-0.02344430996145075
"Mississippi County, Missouri, USA",-0.49600504625735914,-0.41471442400774444,-0.0812906222496147
"Allen County, Kansas, USA",-0.44942294636795654,-0.40667400073340665,-0.042748945634549895
"Charlton County, Georgia, USA",-0.507227332457293,-0.4856572711399351,-0.02157006131735789
"Pulaski County, Indiana, USA",-0.4793317258008956,-0.46071103008204195,-0.018620695718853664
"Goshen County, Wyoming, USA",-0.5888479410350905,-0.6028295376121463,0.013981596577055777
"Towns County, Georgia, USA",-0.6058194630788932,-0.6192508287851819,0.013431365706288667
"Yalobusha County, Mississippi, USA",-0.13557765876052028,-0.13065657396741814,-0.004921084793102132
"Telfair County, Georgia, USA",-0.3087929840756981,-0.29960474308300394,-0.009188240992694163
"Camp County, Texas, USA",-0.4412811387900356,-0.4273447820343461,-0.013936356755689494
"Poquoson city-County, Virginia, USA",-0.45195367188494334,-0.4864149366030375,0.03446126471809413
"Dawson County, Texas, USA",-0.5655845869622592,-0.5054729160819534,-0.06011167088030578
"Braxton County, West Virginia, USA",-0.4701624293785311,-0.4353634577603143,-0.03479897161821677
"Franklin County, Florida, USA",-0.3724264293238105,-0.3929171573096763,0.02049072798586582
"Sanders County, Montana, USA",-0.5038047756494358,-0.5191201353637902,0.015315359714354382
"Colfax County, New Mexico, USA",-0.10970744680851063,-0.08552138034508627,-0.02418606646342436
"Butler County, Kentucky, USA",-0.6339431558314277,-0.6242826398852224,-0.009660515946205317
"Monroe County, West Virginia, USA",-0.5736469804294972,-0.5739365262416869,0.00028954581218965103
"Stone County, Arkansas, USA",-0.5786460087571573,-0.5179779280882877,-0.06066808066886964
"Sumter County, Alabama, USA",0.48481958353202986,0.49368273280299485,-0.008863149270964987
"Grundy County, Iowa, USA",-0.3742440901594283,-0.3886786961583236,0.014434605998895345
"Appanoose County, Iowa, USA",-0.40224063842848373,-0.3616362451108214,-0.04060439331766236
"Menard County, Illinois, USA",-0.3957852193995381,-0.37052954719877207,-0.02525567220076602
"Morgan County, Utah, USA",-0.6198910081743869,-0.5028890600924499,-0.11700194808193698
"Northampton County, Virginia, USA",0.10576351752822341,0.09225032425421531,0.0135131932740081
"Pamlico County, North Carolina, USA",-0.2800238298419643,-0.26355252494996495,-0.016471304891999328
"Pike County, Indiana, USA",-0.5268488745980707,-0.5149402390438247,-0.011908635554246039
"Todd County, Kentucky, USA",-0.5332213512504665,-0.5383326351068286,0.005111283856362059
"Newton County, Texas, USA",-0.6086314407614046,-0.5659559089266354,-0.04267553183476924
"Rolette County, North Dakota, USA",0.32202944269190326,0.23488681757656457,0.08714262511533868
"Morrow County, Oregon, USA",-0.43278624462680737,-0.4089272858171346,-0.02385895880967276
"Rains County, Texas, USA",-0.7125392367421114,-0.7104871303977877,-0.002052106344323734
"Union County, Iowa, USA",-0.3151172190784155,-0.2748628257887517,-0.04025439328966379
"Crawford County, Georgia, USA",-0.4609963946247132,-0.4289035257652073,-0.03209286885950591
"Edmonson County, Kentucky, USA",-0.5873442376135064,-0.6021702929458329,0.014826055332326504
"Glades County, Florida, USA",-0.4606957524505093,-0.39365586490187127,-0.06703988754863804
"Blackford County, Indiana, USA",-0.4608338007104132,-0.4316738373284163,-0.02915996338199689
"Lake County, Michigan, USA",-0.26221730191364856,-0.22897897897897898,-0.03323832293466958
"Jefferson County, Montana, USA",-0.33370138633296526,-0.3267846430713857,-0.006916743261579539
"Macon County, Georgia, USA",0.23037323037323038,0.27175180779099606,-0.04137857741776568
"Fulton County, Arkansas, USA",-0.5715960148466498,-0.5037720033528919,-0.06782401149375794
"Koochiching County, Minnesota, USA",-0.2126553019358567,-0.1984912776991985,-0.01416402423665819
"Boundary County, Idaho, USA",-0.5887850467289719,-0.5531667635095875,-0.03561828321938443
"Skamania County, Washington, USA",-0.09477571115973742,-0.12342613938641603,0.028650428226678612
"Washington County, Kentucky, USA",-0.4560893040144893,-0.4606149467139814,0.004525642699492072
"Little River County, Arkansas, USA",-0.48078037473440216,-0.42242203941075185,-0.05835833532365031
"Lawrence County, Mississippi, USA",-0.30621503099954633,-0.29792583280955376,-0.008289198189992575
"Chickasaw County, Iowa, USA",-0.31292414417131653,-0.22937062937062938,-0.08355351480068715
"Prowers County, Colorado, USA",-0.45855062039201583,-0.46750398724082937,0.008953366848813538
"Greene County, Illinois, USA",-0.5493817247470693,-0.5264100268576545,-0.022971697889414777
"Morris County, Texas, USA",-0.3921815889029004,-0.4040849018822587,0.011903312979358316
"Summers County, West Virginia, USA",-0.4701921361901139,-0.46586243699508434,-0.004329699195029568
"Lunenburg County, Virginia, USA",-0.1865,-0.1749015395631937,-0.01159846043680629
"Lyon County, Iowa, USA",-0.6760891738306863,-0.6699074800062725,-0.006181693824413803
"Owyhee County, Idaho, USA",-0.6332770982707718,-0.6270063694267516,-0.006270728844020246
"Linn County, Missouri, USA",-0.5397657752141234,-0.5106688183611261,-0.02909695685299729
"Custer County, Montana, USA",-0.4592150170648464,-0.4784956605593057,0.019280643494459293
"Northumberland County, Virginia, USA",-0.15775530358427248,-0.1960146238358502,0.038259320251577716
"Terry County, Texas, USA",-0.5689368770764119,-0.50849478390462,-0.060442093171791944
"Marion County, Kansas, USA",-0.48257241040746196,-0.49768847795163584,0.015116067544173883
"Juab County, Utah, USA",-0.7524987294595968,-0.5709839597797463,-0.18151476967985058
"Shelby County, Iowa, USA",-0.4029433406916851,-0.423861852433281,0.020918511741595924
"Valley County, Idaho, USA",-0.13747699277927225,-0.1856421761076837,0.04816518332841144
"Marshall County, Illinois, USA",-0.34606883485948847,-0.3335561497326203,-0.01251268512686815
"Florida Municipio, Puerto Rico, USA",,,
"Cherokee County, Iowa, USA",-0.39260509358698986,-0.4015659955257271,0.00896090193873722
"Ward County, Texas, USA",-0.6123609394313968,-0.5129398080837453,-0.09942113134765151
"Barton County, Missouri, USA",-0.7115352970215567,-0.7018371818641497,-0.009698115157407039
"Magoffin County, Kentucky, USA",-0.5434183954470351,-0.5183737294761532,-0.02504466597088184
"Iron County, Michigan, USA",-0.2537929002798645,-0.28274111675126906,0.028948216471404553
"Teton County, Idaho, USA",0.07247518512683157,-0.001607717041800643,0.07408290216863221
"Jackson County, Tennessee, USA",-0.5605035700864337,-0.4717868338557994,-0.08871673623063431
"Trousdale County, Tennessee, USA",-0.48124544752163323,-0.36615939229330763,-0.1150860552283256
"Ramsey County, North Dakota, USA",-0.36075949367088606,-0.3227144203581527,-0.03804507331273338
"Conecuh County, Alabama, USA",-0.07390156807949076,-0.051632498101746395,-0.022269069977744367
"Red River County, Texas, USA",-0.5628011011699932,-0.5380740166634373,-0.024727084506555808
"Douglas County, Missouri, USA",-0.6974285714285714,-0.6755702280912365,-0.02185834333733494
"Sierra County, New Mexico, USA",-0.2148023549201009,-0.269771063525514,0.054968708605413086
"Haskell County, Oklahoma, USA",-0.6745113681691265,-0.5949767834529337,-0.07953458471619279
"Rio Grande County, Colorado, USA",-0.18477398889770025,-0.19588001445608963,0.011106025558389382
"Charlotte County, Virginia, USA",-0.2419641414957196,-0.22800068882383331,-0.013963452671886284
"Big Horn County, Wyoming, USA",-0.6985396383866481,-0.6513071280797442,-0.047232510306903897
"Cottonwood County, Minnesota, USA",-0.3816931390207958,-0.34976402726796013,-0.03192911175283569
"Perry County, Mississippi, USA",-0.5304259634888439,-0.5366347569955817,0.006208793506737864
"Richland County, Montana, USA",-0.6769575715764057,-0.6678357747060037,-0.009121796870401933
"Fergus County, Montana, USA",-0.5183648378669126,-0.5251712328767123,0.006806395009799737
"Decatur County, Tennessee, USA",-0.6344209120396871,-0.5866724738675958,-0.04774843817209129
"Greensville County, Virginia, USA",0.15576602161844705,0.1877980479507765,-0.03203202633232946
"Heard County, Georgia, USA",-0.6848451122240772,-0.6245839277223014,-0.060261184501775755
"Desha County, Arkansas, USA",0.02281460134486071,0.07258632840028188,-0.04977172705542117
"Blanco County, Texas, USA",-0.47352191982839525,-0.5166231505657093,0.043101230737314034
"Wabash County, Illinois, USA",-0.5335240479170391,-0.5300146412884333,-0.0035094066286057712
"Live Oak County, Texas, USA",-0.6684460260972717,-0.6327289632728963,-0.03571706282437537
"Monroe County, Kentucky, USA",-0.7450317081313732,-0.7367309406484807,-0.008300767482892546
"Montgomery County, Missouri, USA",-0.5642758142758143,-0.5540615214588323,-0.010214292816982051
"Jefferson Davis County, Mississippi, USA",0.17141477547078707,0.20105820105820105,-0.02964342558741398
"Okfuskee County, Oklahoma, USA",-0.5354135710747895,-0.4709611970580776,-0.06445237401671189
"Pope County, Minnesota, USA",-0.2762745656508117,-0.26697262225035606,-0.009301943400455648
"Ceiba Municipio, Puerto Rico, USA",,,
"Martin County, Kentucky, USA",-0.7870229007633588,-0.7943334176574753,0.007310516894116548
"Owen County, Kentucky, USA",-0.5854105571847508,-0.5367073414682937,-0.04870321571645708
"Watonwan County, Minnesota, USA",-0.21457412036146895,-0.1908763505402161,-0.02369776982125285
"Dooly County, Georgia, USA",-0.06041412911084044,-0.02047162477325732,-0.03994250433758312
"Bacon County, Georgia, USA",-0.7268637532133676,-0.6857427220701667,-0.04112103114320087
"Green County, Kentucky, USA",-0.6741225051617343,-0.6637914869679356,-0.01033101819379878
"Clay County, North Carolina, USA",-0.49513999709850576,-0.5107468698792332,0.015606872780727477
"Lake County, South Dakota, USA",-0.2746466882342925,-0.2540524609490127,-0.02059422728527982
"DeKalb County, Missouri, USA",-0.5983894280404708,-0.5917211328976035,-0.006668295142867264
"Washington County, North Carolina, USA",0.0991136180499597,0.15344687753446878,-0.05433325948450908
"Candler County, Georgia, USA",-0.42067253441661023,-0.43529099123040127,0.014618456813791036
"Grant County, West Virginia, USA",-0.7740061717190052,-0.7736077481840193,-0.00039842353498587
"McIntosh County, Georgia, USA",-0.20967741935483872,-0.20057597831611046,-0.009101441038728258
"Wayne County, Missouri, USA",-0.7046614494726098,-0.6439854191980559,-0.06067603027455393
"Noble County, Oklahoma, USA",-0.5706763872012961,-0.5768757687576875,0.006199381556391437
"Washita County, Oklahoma, USA",-0.7301653757588444,-0.7052472468149428,-0.024918128943901663
"St. Helena Parish, Louisiana, USA",0.10263072426112374,0.14352783366867874,-0.040897109407555005
"Lancaster County, Virginia, USA",-0.04600111856823266,-0.09841986455981941,0.052418745991586746
"Alleghany County, North Carolina, USA",-0.5004703071075555,-0.47174168077572437,-0.028728626331831097
"Lake County, Minnesota, USA",0.03517819963532046,0.022158150233843273,0.01302004940147719
"Lincoln County, Washington, USA",-0.48869614673681216,-0.5013127953789602,0.012616648642148065
"North Slope Borough, Alaska, USA",-0.03791546374948466,0.13326764453700393,-0.17118310828648858
"Early County, Georgia, USA",-0.054945054945054944,-0.08025078369905957,0.025305728754004622
"Barnes County, North Dakota, USA",-0.3141060197663971,-0.29247754491017963,-0.021628474856217494
"Box Butte County, Nebraska, USA",-0.5695811619378498,-0.5470297029702971,-0.02255145896755273
"Louisa County, Iowa, USA",-0.3327081770442611,-0.2837460063897764,-0.048962170654484716
"Sussex County, Virginia, USA",0.11949685534591195,0.1633624107850912,-0.04386555543917925
"Pushmataha County, Oklahoma, USA",-0.7064781599493564,-0.6319428953825563,-0.07453526456680004
"Carroll County, Kentucky, USA",-0.4444981862152358,-0.38443579766536967,-0.06006238854986612
"Hancock County, Iowa, USA",-0.43859364873622814,-0.4070856753534321,-0.03150797338279604
"Roosevelt County, Montana, USA",-0.021409011700273838,-0.0649671052631579,0.04355809356288406
"Evans County, Georgia, USA",-0.36825994819872854,-0.35369239311493617,-0.014567555083792372
"Red Willow County, Nebraska, USA",-0.6812179016874541,-0.7056640625,0.024446160812545914
"Ripley County, Missouri, USA",-0.7007171593493091,-0.6688405797101449,-0.03187657963916424
"Winnebago County, Iowa, USA",-0.2633165829145729,-0.26196647658545014,-0.0013501063291227466
"Guthrie County, Iowa, USA",-0.35897033432742115,-0.3297391304347826,-0.029231203892638558
"Middlesex County, Virginia, USA",-0.2510971859211138,-0.2593865389617452,0.008289353040631386
"Mackinac County, Michigan, USA",-0.24035312934392897,-0.2747386221449372,0.03438549280100825
"Wilcox County, Alabama, USA",0.37523293240725053,0.42413849420218847,-0.048905561794937935
"Essex County, Virginia, USA",-0.006136222924080177,-0.02152867309029838,0.015392450166218204
"Colfax County, Nebraska, USA",-0.43341404358353514,-0.4133585381222432,-0.020055505461291923
"Maunabo Municipio, Puerto Rico, USA",,,
"Bollinger County, Missouri, USA",-0.7382583987965904,-0.7271123654965602,-0.011146033300030167
"Mitchell County, Iowa, USA",-0.278941944349021,-0.24035443972678605,-0.038587504622234925
"Walsh County, North Dakota, USA",-0.4162659418774827,-0.3943054357204487,-0.021960506157034043
"Bradley County, Arkansas, USA",-0.3067870826491516,-0.2318642211880646,-0.07492286146108701
"Custer County, Nebraska, USA",-0.7181711997330219,-0.7266535221365836,0.008482322403561726
"Crawford County, Indiana, USA",-0.43042071197411,-0.36449806118052563,-0.06592265079358439
"Leslie County, Kentucky, USA",-0.8054458532529619,-0.8047640249332146,-0.0006818283197472796
"Washington County, Idaho, USA",-0.5765344311377245,-0.5627384960718294,-0.01379593506589516
"Gates County, North Carolina, USA",-0.13749790654831687,-0.09068991097922849,-0.04680799556908838
"Carbon County, Montana, USA",-0.2902722631877482,-0.32176973353443944,0.03149747034669126
"Cumberland County, Illinois, USA",-0.593208712056251,-0.5703251302317226,-0.02288358182452843
"Coosa County, Alabama, USA",-0.3349151304982661,-0.30445544554455445,-0.030459684953711652
"Franklin County, Texas, USA",-0.6701936514274306,-0.6666666666666666,-0.0035269847607639626
"Bullock County, Alabama, USA",0.4985909386516367,0.5074309978768577,-0.008840059225221075
"Camden County, North Carolina, USA",-0.4661515202418948,-0.45385537355173794,-0.012296146690156884
"Ralls County, Missouri, USA",-0.5635817732250088,-0.5375996961640714,-0.02598207706093736
"Montgomery County, Iowa, USA",-0.38971278393091796,-0.42069785884218874,0.030985074911270782
"Lowndes County, Alabama, USA",0.458814923189466,0.46858168761220825,-0.009766764422742269
"Metcalfe County, Kentucky, USA",-0.5953711093375897,-0.5444901493829833,-0.0508809599546064
"Noxubee County, Mississippi, USA",0.5244427795467316,0.5645855758880517,-0.04014279634132012
"Roberts County, South Dakota, USA",-0.13373577896447644,-0.15530984829004885,0.021574069325572404
"Nemaha County, Kansas, USA",-0.6574595355383532,-0.6636079656384225,0.006148430100069269
"Johnston County, Oklahoma, USA",-0.6358503881439661,-0.5741662518666003,-0.0616841362773658
"Butte County, South Dakota, USA",-0.5814244064972928,-0.6115835440128706,0.03015913751557786
"Clay County, Texas, USA",-0.7745132127955494,-0.7636182902584493,-0.010894922537100116
"Chicot County, Arkansas, USA",0.12381184499146966,0.1518199233716475,-0.028008078380177853
"Pike County, Arkansas, USA",-0.6771078662270372,-0.6191911580005024,-0.05791670822653483
"Alcona County, Michigan, USA",-0.3831233187031007,-0.3983543078412391,0.015230989138138418
"Howard County, Missouri, USA",-0.4203496366136319,-0.41071060762100925,-0.009639028992622645
"Love County, Oklahoma, USA",-0.6364082433758587,-0.5771971496437055,-0.059211093732153164
"Holt County, Nebraska, USA",-0.7374029257720788,-0.7534489554592038,0.016046029687124985
"Nome Census Area, Alaska, USA",0.226267152058247,0.23132748714847293,-0.005060335090225937
"Marshall County, Kansas, USA",-0.482987876417677,-0.4782794778514873,-0.004708398566189709
"Keokuk County, Iowa, USA",-0.44936828210446916,-0.4108324974924774,-0.03853578461199175
"Lewis County, Missouri, USA",-0.5573877196788891,-0.5410866636731029,-0.01630105600578624
"Franklin County, Iowa, USA",-0.3500974658869396,-0.3361513687600644,-0.013946097126875168
"Perry County, Arkansas, USA",-0.5331748433110006,-0.45494658615884814,-0.07822825715215248
"Madison Parish, Louisiana, USA",0.1550321199143469,0.17265426880811496,-0.017622148893768064
"Ochiltree County, Texas, USA",-0.7945552389996834,-0.7818000664231153,-0.012755172576568108
"Carroll County, Mississippi, USA",-0.38502017189966675,-0.3833212735166425,-0.0016988983830242277
"Jackson County, Minnesota, USA",-0.3785873861488228,-0.3860320933625091,0.007444707213686286
"Yuma County, Colorado, USA",-0.6669343505320217,-0.6520559382174911,-0.014878412314530576
"Calhoun County, Iowa, USA",-0.4220235831114492,-0.4012405504942818,-0.020783032617167407
"Webster County, Mississippi, USA",-0.6020389249304912,-0.5833497731307951,-0.018689151799696102
"Runnels County, Texas, USA",-0.7382626445906101,-0.7395557905869911,0.0012931459963809733
"Sabine County, Texas, USA",-0.7494081223820798,-0.7280550774526678,-0.021353044929411924
"Lanier County, Georgia, USA",-0.4166666666666667,-0.4114565141460007,-0.005210152520665978
"Parmer County, Texas, USA",-0.6215094339622641,-0.5765656565656566,-0.04494377739660749
"Pulaski County, Georgia, USA",-0.39122936683912296,-0.3703806612948041,-0.020848705544318835
"Swift County, Minnesota, USA",-0.29493500304705256,-0.255756886172385,-0.039178116874667546
"Scott County, Arkansas, USA",-0.6981132075471698,-0.6065527065527065,-0.09156050099446322
"Duval County, Texas, USA",0.026123095190975658,0.35196737044145876,-0.3258442752504831
"Emery County, Utah, USA",-0.7421396488362597,-0.7101212686567164,-0.03201838017954328
"Montgomery County, Mississippi, USA",-0.1565619398718304,-0.1404424319647902,-0.016119507907040198
"Sac County, Iowa, USA",-0.48274616079494126,-0.4668073676132003,-0.015938793181740962
"Martin County, Indiana, USA",-0.5867029548989113,-0.5810978126289723,-0.005605142269939023
"Mountrail County, North Dakota, USA",-0.3764705882352941,-0.33170969313200194,-0.044760895103292175
"Grundy County, Missouri, USA",-0.6279017354068064,-0.6077498300475866,-0.020151905359219735
"Tunica County, Mississippi, USA",0.4643458731049972,0.5085506027474068,-0.044204729642409624
"McLean County, North Dakota, USA",-0.5361271676300579,-0.522859830667921,-0.013267336962136889
"West Carroll Parish, Louisiana, USA",-0.7139746634996041,-0.6839672200042025,-0.03000744349540163
"Clarke County, Iowa, USA",-0.35931477516059956,-0.2801975752132914,-0.07911719994730815
"Switzerland County, Indiana, USA",-0.5223812414898822,-0.4389684397822159,-0.0834128017076663
"Marion County, Texas, USA",-0.4381167763157895,-0.4289759320434167,-0.009140844272372772
"Rock County, Minnesota, USA",-0.38683206106870227,-0.3550320314114486,-0.03180002965725365
"Wayne County, Nebraska, USA",-0.48404761904761906,-0.4934926958831341,0.009445076835515043
"Stevens County, Minnesota, USA",-0.22064896755162242,-0.12652834383104852,-0.09412062372057389
"Zavala County, Texas, USA",0.313555454130534,0.5725663716814159,-0.2590109175508819
"Grand County, Utah, USA",0.10744598765432099,-0.0035312293092032666,0.11097721696352426
"Irwin County, Georgia, USA",-0.5100767754318618,-0.4979536152796726,-0.012123160152189227
"Cumberland County, Virginia, USA",-0.14932452212748865,-0.13481292793377295,-0.014511594193715699
"Caldwell Parish, Louisiana, USA",-0.6784964300713986,-0.6466325660699063,-0.031863864001492326
"Humboldt County, Iowa, USA",-0.4462173831424817,-0.45527816001572635,0.009060776873244636
"Linn County, Kansas, USA",-0.6246531906460563,-0.6207363903320533,-0.003916800314002988
"Chattahoochee County, Georgia, USA",-0.13463969658659924,-0.11294964028776978,-0.02169005629882946
"Wilkes County, Georgia, USA",-0.13183535494134022,-0.16171543444270717,0.029880079501366952
"Greenlee County, Arizona, USA",-0.3394843962008141,-0.24242424242424243,-0.09706015377657168
"Brewster County, Texas, USA",-0.042098714226462046,-0.04797742238946378,0.0058787081630017335
"Iron County, Missouri, USA",-0.577308362369338,-0.5258215962441315,-0.05148676612520653
"Benewah County, Idaho, USA",-0.5833500904886386,-0.5574671445639188,-0.025882945924719847
"Yellow Medicine County, Minnesota, USA",-0.37011577424023157,-0.3521607278241092,-0.01795504641612239
"McCormick County, South Carolina, USA",-0.04756889591012814,-0.03316717791411043,-0.014401717996017707
"Brown County, Kansas, USA",-0.4826660702303735,-0.5061942517343905,0.023528181504016976
"Howard County, Iowa, USA",-0.27329568374344493,-0.20486948892300944,-0.06842619482043549
"Cheyenne County, Nebraska, USA",-0.6207764952780692,-0.6373247033441208,0.016548208066051617
"Latimer County, Oklahoma, USA",-0.6295598964462227,-0.5678007889546351,-0.06175910749158753
