"IL-15 in Christian County, USA",-0.44606270056776104,-0.4237660909502555,-0.022296609617505514
"KS-04 in Harvey County, USA",-0.19845167254029694,-0.2413515687851971,0.04289989624490015
"VA-05 in Halifax County, USA",-0.15081104778605875,-0.1651759444509827,0.014364896664923937
"MN-07 in Morrison County, USA",-0.534512731363125,-0.5273078233223573,-0.007204908040767788
"SC-06 in Dorchester County, USA",0.03426552327949597,0.014866978571578444,0.019398544707917523
"FL-18 in DeSoto County, USA",-0.3198169769643421,-0.27487847381454644,-0.04493850314979564
"NM-01 in Valencia County, USA",-0.12310906209479902,-0.09780546008031832,-0.025303602014480703
"NY-24 in Seneca County, USA",-0.09051944728761514,-0.11007009011586326,0.019550642828248116
"AZ-06 in Graham County, USA",-0.5544878794496615,-0.5004023964946794,-0.054085482954982056
"VA-09 in Pulaski County, USA",-0.41447974217311234,-0.4055390702274975,-0.00894067194561482
"FL-02 in Wakulla County, USA",-0.407794882914137,-0.39911939911939914,-0.00867548379473787
"MS-01 in Marshall County, USA",0.031042549155971422,0.09677201967787587,-0.06572947052190445
"NC-08 in Richmond County, USA",-0.19355374135001358,-0.14233368206066546,-0.05122005928934811
"ND-00 in Stark County, USA",-0.6386046511627907,-0.6494075637071904,0.01080291254439969
"VA-06 in Botetourt County, USA",-0.44502840909090907,-0.47393137307220234,0.028902963981293273
"IA-01 in Lee County, USA",-0.1931397155491813,-0.16023775617608818,-0.03290195937309312
"GA-09 in Lumpkin County, USA",-0.5818685210224712,-0.5998864926220204,0.01801797159954921
"OK-05 in Lincoln County, USA",-0.6316496507254165,-0.6006417112299465,-0.031007939495469983
"VA-04 in Petersburg city-County, USA",0.7648298665023493,0.766309179984113,-0.0014793134817636666
"IA-01 in Marion County, USA",-0.33719841930116473,-0.3075886843286933,-0.029609734972471435
"VA-02 in Accomack County, USA",-0.09410036037540538,-0.11660373932821562,0.022503378952810238
"IN-08 in Daviess County, USA",-0.6198845091639468,-0.6234402440151585,0.003555734851211745
"WA-03 in Thurston County, USA",-0.2705813125697886,-0.2543720016691258,-0.0162093109006628
"ND-00 in Morton County, USA",-0.5037005836692942,-0.5214754926730673,0.0177749090037731
"MD-01 in Caroline County, USA",-0.3285699435198524,-0.37987205238752386,0.05130210886767145
"GA-11 in Pickens County, USA",-0.6582729609721898,-0.6916475972540046,0.03337463628181481
"MS-02 in Panola County, USA",-0.042042618544826264,-0.0011949017525225705,-0.040847716792303694
"IN-04 in Clinton County, USA",-0.46155629394946296,-0.4763572679509632,0.014800974001500267
"GA-02 in Lee County, USA",-0.44542843296905593,-0.5294080217241747,0.08397958875511874
"IN-09 in Jefferson County, USA",-0.33573859768550035,-0.3090895773822603,-0.026649020303240067
"IL-17 in Stephenson County, USA",-0.06022095919279648,-0.06739941932807963,0.007178460135283157
"AL-04 in Lawrence County, USA",-0.5464412700392989,-0.48593971272506575,-0.06050155731423312
"AR-04 in Hot Spring County, USA",-0.487377558333997,-0.42054588077695915,-0.06683167755703784
"IN-08 in Gibson County, USA",-0.48227213662520885,-0.4753293722552312,-0.00694276436997765
"AL-02 in Pike County, USA",-0.17383137056571057,-0.20025820170109357,0.026426831135382994
"NC-11 in Transylvania County, USA",-0.15643991374240346,-0.22172477474956628,0.06528486100716283
"MO-04 in Lafayette County, USA",-0.4575098234707642,-0.4380092212467631,-0.019500602224001073
"TX-36 in Jasper County, USA",-0.6135534651564599,-0.5953370953370953,-0.018216369819364586
"WV-01 in Greenbrier County, USA",-0.39558359621451106,-0.41170197639698564,0.01611838018247458
"WA-06 in Jefferson County, USA",0.4136677340931618,0.3256852357246433,0.08798249836851851
"IN-04 in Jasper County, USA",-0.4903355097291357,-0.44910224068852944,-0.04123326904060626
"IL-15 in Morgan County, USA",-0.3183748122019727,-0.2959459459459459,-0.022428866256026803
"TN-08 in Weakley County, USA",-0.5370222060429559,-0.5118187787261983,-0.02520342731675762
"TN-04 in Rhea County, USA",-0.6367170309520317,-0.6073042849394323,-0.029412746012599356
"AR-04 in Pulaski County, USA",0.4865992282824069,0.4839042509286009,0.0026949773538060273
"CA-01 in Lassen County, USA",-0.5148936170212766,-0.5133371713682594,-0.0015564456530171578
"LA-02 in St. John the Baptist Parish, USA",0.3971447465799902,0.37905549737149785,0.018089249208492364
"OH-02 in Jackson County, USA",-0.5406245775314317,-0.4911960254255863,-0.04942855210584535
"AL-06 in Chilton County, USA",-0.6385251081206917,-0.6341825592188121,-0.004342548901879684
"WV-01 in Logan County, USA",-0.6295869798863811,-0.6315235860506514,0.0019366061642702714
"MD-01 in Dorchester County, USA",-0.11936374353058153,-0.14242092958574296,0.023057186055161424
"TX-19 in Hale County, USA",-0.5109534738159817,-0.48078006989065497,-0.03017340392532669
"LA-04 in Evangeline Parish, USA",-0.44737866597456527,-0.4133969225927146,-0.03398174338185067
"SC-05 in Chester County, USA",-0.10909437075585454,-0.04833709131905299,-0.06075727943680155
"LA-03 in Jefferson Davis Parish, USA",-0.5535341284280035,-0.538978777054003,-0.014555351374000547
"AK-00 in Juneau City and Borough, USA",0.2584112071569872,0.19001215141844544,0.06839905573854174
"TN-08 in Henry County, USA",-0.511153502535169,-0.49774320248801035,-0.013410300047158652
"KS-02 in Lyon County, USA",-0.10708154506437768,-0.15478615071283094,0.04770460564845326
"AL-04 in Franklin County, USA",-0.6590872952774686,-0.6037375415282392,-0.05534975374922935
"TN-02 in Claiborne County, USA",-0.6491539828478714,-0.6303538175046555,-0.018800165343215935
"KY-02 in Jefferson County, USA",-0.20068198760522096,-0.30078187715656585,0.10009988955134488
"OH-15 in Shelby County, USA",-0.5866907755084368,-0.5489566330284333,-0.03773414248000351
"GA-03 in Muscogee County, USA",-0.2218483858660302,-0.3516634843002919,0.12981509843426167
"KY-01 in Marshall County, USA",-0.5241747627975684,-0.5183365292425696,-0.005838233554998795
"OR-02 in Malheur County, USA",-0.41740088105726875,-0.4741438587017592,0.05674297764449043
"MO-04 in Polk County, USA",-0.5952064798831497,-0.5693137898344637,-0.025892690048685996
"KS-02 in Montgomery County, USA",-0.499142111152555,-0.5033322225924691,0.0041901114399141015
"OK-03 in Creek County, USA",-0.6222293394237571,-0.5894403774056545,-0.03278896201810266
"GA-09 in Gilmer County, USA",-0.6352904175081421,-0.6684803612471605,0.0331899437390184
"TX-25 in Parker County, USA",-0.6469888339273724,-0.7036902257472158,0.05670139181984346
"VA-05 in Amherst County, USA",-0.3157306674507498,-0.30280592361652375,-0.012924743834226038
"MI-09 in Huron County, USA",-0.3929400741896636,-0.38430041642971513,-0.00863965775994846
"NH-02 in Coos County, USA",-0.05928662266093381,-0.08916341291685335,0.029876790255919543
"TX-01 in Titus County, USA",-0.44720614742434306,-0.415543051279329,-0.03166309614501406
"NE-03 in Adams County, USA",-0.4021366936036159,-0.4502030991424703,0.048066405538854384
"CO-03 in Delta County, USA",-0.37139907072792977,-0.45074449076831447,0.0793454200403847
"MN-07 in Polk County, USA",-0.2838271129921765,-0.2883887537172209,0.004561640725044391
"MN-07 in Becker County, USA",-0.32199533587395485,-0.3498559077809798,0.027860571907024956
"WI-07 in Chippewa County, USA",-0.3376677354233464,-0.30872210953346857,-0.028945625889877813
"MS-01 in Pontotoc County, USA",-0.6222407910312653,-0.6122920517560074,-0.009948739275257856
"SC-06 in Clarendon County, USA",-0.0066335982788501766,0.022474829490094186,-0.029108427768944362
"MT-01 in Lake County, USA",-0.14471309996391193,-0.21006864988558352,0.06535554992167159
"ME-02 in Washington County, USA",-0.1941968910196348,-0.18171784805488303,-0.012479042964751774
"MO-07 in Stone County, USA",-0.6110479900449062,-0.6206417306181642,0.009593740573258014
"CO-02 in Summit County, USA",0.39553006115049516,0.27556572276493135,0.1199643383855638
"TX-27 in Bee County, USA",-0.28853503184713375,-0.15321154979375368,-0.13532348205338007
"TX-34 in Kleberg County, USA",-0.017482202397044247,0.03640346302284343,-0.05388566541988768
"SC-06 in Williamsburg County, USA",0.2975914920237723,0.33804968779062045,-0.04045819576684817
"PA-15 in Elk County, USA",-0.45060925115343664,-0.427838624705393,-0.022770626448043618
"MS-02 in Bolivar County, USA",0.30798894062863796,0.32233796296296297,-0.014349022334325001
"IN-02 in Wabash County, USA",-0.4987305290605915,-0.5019188191881919,0.0031882901276004127
"KY-02 in Muhlenberg County, USA",-0.4885109971189656,-0.4688984219396354,-0.01961257517933024
"WY-00 in Sheridan County, USA",-0.4747991234477721,-0.50578911095796,0.03098998751018789
"MN-01 in Freeborn County, USA",-0.15988821500772982,-0.17238801320789982,0.012499798200169998
"ID-02 in Jefferson County, USA",-0.7364707542510407,-0.6501089324618736,-0.08636182178916707
"VA-07 in Caroline County, USA",-0.04168713163064833,-0.05018248175182482,0.008495350121176491
"PA-15 in Venango County, USA",-0.4192250166596721,-0.4171773718434008,-0.002047644816271288
"MI-02 in Clare County, USA",-0.3477110509475757,-0.3183307093135745,-0.029380341634001217
"MO-04 in Camden County, USA",-0.5526906747424457,-0.5578512086882861,0.005160533945840373
"MN-01 in Rice County, USA",-0.14630794226016258,-0.1723612691010416,0.02605332684087902
"OK-02 in McCurtain County, USA",-0.6651260137786692,-0.6390080179004288,-0.026117995878240374
"IN-08 in Greene County, USA",-0.5218508997429306,-0.5301204819277109,0.008269582184780244
"TN-08 in Obion County, USA",-0.60653797796021,-0.5796391542166708,-0.026898823743539246
"WI-03 in Trempealeau County, USA",-0.1656688884620016,-0.1264486822876722,-0.03922020617432939
"WI-03 in Vernon County, USA",-0.0477925014130503,-0.044270103670495935,-0.0035223977425543687
"OH-04 in Hardin County, USA",-0.5198912961425228,-0.4727999347524672,-0.04709136139005565
"KY-01 in Boyle County, USA",-0.24704499896315754,-0.29053949605812335,0.043494497094965806
"TN-09 in Tipton County, USA",-0.5381929637651907,-0.517422231726007,-0.02077073203918367
"WV-02 in Marshall County, USA",-0.49573863636363635,-0.510593220338983,0.014854583975346669
"CA-05 in Madera County, USA",-0.29613147707112536,-0.3504134221573182,0.05428194508619283
"WI-07 in Wood County, USA",-0.2006515794985165,-0.20568816658202133,0.005036587083504823
"IN-02 in LaPorte County, USA",-0.28033349762286514,-0.27446886663302317,-0.005864630989841968
"TN-08 in Tipton County, USA",-0.4331311640119355,-0.4323613079700941,-0.0007698560418414324
"TN-04 in Giles County, USA",-0.4912519881845035,-0.4537128490616863,-0.0375391391228172
"VA-05 in Powhatan County, USA",-0.44272681196148,-0.4633467550923733,0.02061994313089327
"VA-05 in Mecklenburg County, USA",-0.15199950629474204,-0.1340247574439612,-0.017974748850780847
"NC-10 in Gaston County, USA",-0.5792660470960334,-0.5550243153289859,-0.02424173176704747
"MD-02 in Baltimore city-County, USA",0.7015480011654178,0.5990940834683576,0.10245391769706025
"OK-02 in Ottawa County, USA",-0.5122399020807834,-0.47212347988774556,-0.04011642219303785
"VT-00 in Caledonia County, USA",0.15217529258719628,0.06474123558990798,0.0874340569972883
"KS-01 in McPherson County, USA",-0.4037955395484139,-0.417752315178151,0.013956775629737073
"KY-05 in Knox County, USA",-0.6703777536050647,-0.6763180424858302,0.005940288880765476
"TX-10 in Austin County, USA",-0.5837570427373918,-0.5924696356275304,0.008712592890138593
"IL-12 in Randolph County, USA",-0.5025854543012558,-0.4638579681555587,-0.0387274861456971
"GA-01 in Wayne County, USA",-0.5712606762366684,-0.5884129596642383,0.017152283427569914
"GA-10 in Madison County, USA",-0.529892213965321,-0.5668395516145224,0.03694733764920133
"MN-08 in Cass County, USA",-0.2885887692055334,-0.31458216138508655,0.025993392179553154
"WI-08 in Door County, USA",0.014573828138345537,-0.03208758528096452,0.04666141341931006
"KY-02 in Meade County, USA",-0.4643894833817589,-0.4607081527516559,-0.003681330630103008
"GA-03 in Haralson County, USA",-0.7396827624929815,-0.71617802896503,-0.02350473352795146
"SD-00 in Meade County, USA",-0.4820775420629115,-0.5350658291024869,0.05298828703957542
"VA-09 in Smyth County, USA",-0.5627475947934352,-0.5496508921644686,-0.013096702628966561
"NY-21 in Schoharie County, USA",-0.29008321708912344,-0.32672055922804893,0.0366373421389255
"WY-00 in Park County, USA",-0.5624813064545073,-0.5684001324942034,0.005918826039696068
"GA-02 in Sumter County, USA",0.04823045267489712,0.022234372152360123,0.025996080522536994
"NC-07 in Bladen County, USA",-0.13722627737226278,-0.09586058002813212,-0.04136569734413066
"MI-02 in Wexford County, USA",-0.32545066130076494,-0.3522739665435022,0.02682330524273724
"MS-02 in Adams County, USA",0.16146121698524069,0.1361423667570009,0.025318850228239792
"AZ-07 in Cochise County, USA",0.3177703481899446,0.3560614076293047,-0.03829105943936012
"ME-02 in Franklin County, USA",-0.03529847732058617,-0.05172356142032364,0.016425084099737468
"GA-02 in Decatur County, USA",-0.17012126945901782,-0.18461538461538463,0.01449411515636681
"AL-04 in Marion County, USA",-0.7780111537625842,-0.7580098582871226,-0.02000129547546159
"VT-00 in Orange County, USA",0.24043527982904425,0.17296708453641985,0.0674681952926244
"TX-10 in Grimes County, USA",-0.5315772514902529,-0.5109619217455156,-0.020615329744737343
"OH-02 in Gallia County, USA",-0.5547503442278426,-0.5569835862496129,0.002233242021770221
"SC-07 in Marion County, USA",0.21497551686615887,0.2188988512188288,-0.003923334352669922
"VA-09 in Carroll County, USA",-0.6272557230021713,-0.5934787638209992,-0.03377695918117207
"CO-04 in Morgan County, USA",-0.41596332945285214,-0.41755852842809366,0.0015951989752415185
"WV-02 in Hancock County, USA",-0.43594202898550727,-0.44457565737679106,0.008633628391283787
"MS-03 in Neshoba County, USA",-0.43236776894813295,-0.4703875675163461,0.03801979856821314
"MI-02 in Mason County, USA",-0.19740274798539045,-0.21950759622228963,0.022104848236899177
"IN-09 in Ripley County, USA",-0.5949943914750421,-0.5670660997294164,-0.027928291745625722
"KS-01 in Ellis County, USA",-0.43630434782608696,-0.47911609609106887,0.04281174826498191
"OH-05 in Van Wert County, USA",-0.5737299465240642,-0.5644563875372213,-0.0092735589868429
"CA-01 in Glenn County, USA",-0.2715589825401046,-0.2903294594306429,0.018770476890538346
"SC-06 in Sumter County, USA",0.35997084428490406,0.41796956279472636,-0.0579987185098223
"MN-08 in Pine County, USA",-0.3021627703462933,-0.26173232908458866,-0.04043044126170464
"MI-01 in Alpena County, USA",-0.27619945773900745,-0.28716428899155994,0.010964831252552487
"TN-04 in Marion County, USA",-0.5080576878856016,-0.4478589953144063,-0.060198692571195256
"MD-06 in Garrett County, USA",-0.5586445455127794,-0.5858967953750625,0.02725224986228303
"NC-11 in Cherokee County, USA",-0.5507531005929404,-0.5630155665946275,0.012262466001687122
"OH-12 in Tuscarawas County, USA",-0.5638944503720555,-0.5104574054267162,-0.053437044945339296
"MO-08 in Stoddard County, USA",-0.719789398310272,-0.6927750363913084,-0.02701436191896356
"MN-02 in Le Sueur County, USA",-0.30342490189083127,-0.30452207601362635,0.001097174122795086
"ID-02 in Elmore County, USA",-0.4551690347868692,-0.4696080732222483,0.014439038435379081
"MO-06 in Marion County, USA",-0.5030348445110528,-0.4978690430065866,-0.005165801504466272
"OK-03 in Custer County, USA",-0.5323169020671593,-0.5428327483160991,0.010515846248939753
"KY-05 in Perry County, USA",-0.5432900432900433,-0.5696178584941355,0.02632781520409222
"TX-01 in Cass County, USA",-0.5915128886335894,-0.5942158133506157,0.002702924717026267
"TN-08 in Carroll County, USA",-0.5582528349433011,-0.5228235747303543,-0.03542926021294679
"UT-04 in Sanpete County, USA",-0.6809430255402751,-0.5522534934068097,-0.12868953213346535
"WI-07 in Lincoln County, USA",-0.2276777595926532,-0.20595432300163133,-0.021723436591021883
"TX-25 in Palo Pinto County, USA",-0.6404386456415593,-0.6384466019417476,-0.001992043699811652
"MS-02 in Copiah County, USA",0.017076767833579136,0.04914496995840394,-0.03206820212482481
"GA-08 in Jones County, USA",-0.33923560069490843,-0.3467986587897174,0.00756305809480895
"MS-02 in Leflore County, USA",0.4148535756908106,0.4106822262118492,0.004171349478961417
"SD-00 in Codington County, USA",-0.38910417141554593,-0.39334990144828175,0.004245730032735817
"FL-03 in Bradford County, USA",-0.5255677655677655,-0.4925974666886001,-0.032970298879165416
"SC-07 in Dillon County, USA",-0.011144187466605603,0.016840485553085996,-0.027984673019691597
"VA-09 in Wythe County, USA",-0.5699309978768577,-0.5459183673469388,-0.024012630529918977
"IL-15 in Montgomery County, USA",-0.41079624098492024,-0.3949761134227154,-0.015820127562204855
"MO-08 in Dunklin County, USA",-0.5696324023418754,-0.535842632873085,-0.03378976946879042
"FL-03 in Baker County, USA",-0.7011788098281494,-0.6439984258166076,-0.057180384011541796
"AR-03 in Carroll County, USA",-0.2882123706861672,-0.32003494808041766,0.031822577394250484
"NM-02 in Grant County, USA",0.07183927952892276,0.07712122394816955,-0.005281944419246787
"IN-09 in Washington County, USA",-0.521803643557827,-0.48963275347039187,-0.03217089008743518
"IN-03 in Wells County, USA",-0.5644403303902022,-0.5583653194852111,-0.006075010904991185
"KY-06 in Montgomery County, USA",-0.41777673911350005,-0.4105207969241524,-0.007255942189347664
"VA-06 in Winchester city-County, USA",0.11490907551349262,0.03519942904883801,0.07970964646465462
"NC-03 in Currituck County, USA",-0.46209093909101256,-0.4932627025131987,0.03117176342218614
"MS-01 in Tate County, USA",-0.34552814481020394,-0.30695794271953214,-0.0385702020906718
"OH-02 in Hocking County, USA",-0.4238367465084304,-0.36858949340410585,-0.055247253104324545
"NY-02 in Nassau County, USA",-0.2390090401770381,-0.2732544458760452,0.03424540569900708
"GA-09 in White County, USA",-0.662189524838013,-0.6863277603326827,0.024138235494669757
"MS-03 in Scott County, USA",-0.182148513929004,-0.17620224291959705,-0.00594627100940695
"IL-15 in Logan County, USA",-0.3983752068602377,-0.39254898798483995,-0.005826218875397748
"VA-07 in Fredericksburg city-County, USA",0.3483128595863785,0.2632140001776672,0.08509885940871126
"GA-02 in Peach County, USA",-0.04639298525308888,-0.02918687057068258,-0.0172061146824063
"VA-05 in Bedford County, USA",-0.44091462375476903,-0.48903747017189936,0.04812284641713033
"GA-08 in Monroe County, USA",-0.4276107038881244,-0.41380325093739473,-0.01380745295072966
"VA-04 in Dinwiddie County, USA",-0.1637291280148423,-0.12390423572744015,-0.039824892287402144
"IL-02 in Livingston County, USA",-0.41033281000395583,-0.3751556198046443,-0.03517719019931154
"WV-02 in Randolph County, USA",-0.435327868852459,-0.4499816108863553,0.0146537420338963
"TN-08 in Henderson County, USA",-0.6410149750415973,-0.6203386512674953,-0.020676323774102
"WV-01 in Jackson County, USA",-0.5097955434977183,-0.5216061344911038,0.01181059099338555
"MS-01 in Union County, USA",-0.6475597256169676,-0.6283054975643703,-0.019254228052597355
"CA-02 in Del Norte County, USA",-0.15578064966818023,-0.1761563935476979,0.020375743879517683
"GA-03 in Upson County, USA",-0.3414955443626501,-0.34909456740442657,0.007599023041776454
"OH-05 in Henry County, USA",-0.4347560975609756,-0.3981760735315238,-0.03658002402945182
"FL-02 in Walton County, USA",-0.4768138985505011,-0.5101411481781402,0.033327249627639055
"IN-09 in Jennings County, USA",-0.5686882703452779,-0.5217701006143709,-0.04691816973090701
"TX-21 in Travis County, USA",0.19994045379929118,0.10274346763104104,0.09719698616825014
"OH-02 in Adams County, USA",-0.6351585014409222,-0.559452296819788,-0.0757062046211342
"NJ-01 in Burlington County, USA",0.22942884801548888,0.18795540338864014,0.04147344462684874
"TX-08 in San Jacinto County, USA",-0.6189873417721519,-0.5805052063247204,-0.03848213544743151
"VT-00 in Orleans County, USA",0.045048240635641314,0.002158392827494604,0.04288984780814671
"OR-01 in Tillamook County, USA",-0.016851831016760934,-0.055784974280953414,0.03893314326419248
"TN-06 in White County, USA",-0.6274064733081126,-0.5929770992366412,-0.0344293740714714
"OH-15 in Fayette County, USA",-0.5038561060285799,-0.4597955807747926,-0.044060525253787286
"VA-05 in Fluvanna County, USA",-0.04678030303030303,-0.09306945261918775,0.04628914958888472
"SC-05 in Union County, USA",-0.24507723147980653,-0.19294411683738588,-0.05213311464242065
"NM-03 in San Miguel County, USA",0.38739051253143697,0.4624686075713887,-0.07507809503995172
"NM-02 in Cibola County, USA",0.08648770077501966,0.06778373642199079,0.018703964353028874
"OH-02 in Pike County, USA",-0.48718981630679986,-0.36772018541930046,-0.1194696308874994
"IL-02 in Iroquois County, USA",-0.5682401597261837,-0.5546540110226577,-0.013586148703526035
"GA-12 in Toombs County, USA",-0.45198827194429175,-0.46943255405553724,0.01744428211124549
"IL-16 in Boone County, USA",-0.19237648949571143,-0.22037992117161592,0.028003431675904494
"OK-03 in Caddo County, USA",-0.4405112080332691,-0.4345314505776637,-0.005979757455605417
"WV-02 in Mineral County, USA",-0.5733059614374538,-0.6070371045663122,0.03373114312885839
"IL-16 in Henry County, USA",-0.27975524567524257,-0.29677880873115414,0.017023563055911572
"KY-06 in Woodford County, USA",-0.12043915587403853,-0.20199115044247787,0.08155199456843934
"KY-05 in Harlan County, USA",-0.7176191778324674,-0.7211118341545041,0.003492656322036658
"TN-08 in Hardin County, USA",-0.6746403189460912,-0.6422756055885014,-0.032364713357589836
"LA-04 in De Soto Parish, USA",-0.24803203040173724,-0.21503703703703703,-0.032994993364700215
"GA-06 in Dawson County, USA",-0.6785647658727691,-0.7221462747778538,0.04358150890508461
"GA-09 in Stephens County, USA",-0.5875473285654186,-0.5989146016792956,0.011367273113876974
"TX-01 in Upshur County, USA",-0.673750110558968,-0.6719097790799745,-0.0018403314789935399
"MS-02 in Yazoo County, USA",0.06362591031046377,0.07656405163853029,-0.012938141328066519
"TX-21 in Gillespie County, USA",-0.5890480095893004,-0.6173755108218556,0.02832750123255523
"VA-07 in King George County, USA",-0.2138638920134983,-0.2766804979253112,0.06281660591181287
"OH-06 in Carroll County, USA",-0.5274493243243243,-0.46797084771768316,-0.059478476606641184
"IA-04 in Boone County, USA",-0.15593220338983052,-0.13686954071569457,-0.01906266267413595
"OR-02 in Wasco County, USA",-0.030502476999292285,-0.08793045804078903,0.05742798104149674
"SC-07 in Marlboro County, USA",0.10901988114080392,0.16250079059156003,-0.053480909450756106
"AL-02 in Geneva County, USA",-0.7375846950976485,-0.7202755570675284,-0.01730913803012002
"MI-02 in Oceana County, USA",-0.28075664912530224,-0.27284157585917856,-0.007915073266123673
"NY-21 in Lewis County, USA",-0.3908997247582235,-0.3757170758478201,-0.015182648910403385
"NE-01 in Cass County, USA",-0.3522638052865742,-0.39096560950657117,0.03870180421999697
"NC-05 in Ashe County, USA",-0.4616303476248284,-0.44022930178065817,-0.02140104584417024
"IN-09 in Decatur County, USA",-0.5807764303735655,-0.5697799248523886,-0.010996505521176925
"IN-08 in Clay County, USA",-0.5666857003018191,-0.549113052687318,-0.017572647614501058
"MN-08 in Mille Lacs County, USA",-0.37769759684117366,-0.35568871475762465,-0.02200888208354901
"IL-11 in Boone County, USA",-0.05325556116756318,-0.0424217799712296,-0.010833781196333575
"KY-02 in Grayson County, USA",-0.5885838270883752,-0.5921301551267499,0.0035463280383747353
"GA-02 in Grady County, USA",-0.3189502194825815,-0.33039886968807736,0.011448650205495847
"OR-02 in Union County, USA",-0.40444325481798715,-0.3995990129549661,-0.00484424186302107
"IL-17 in Fulton County, USA",-0.14315937940761636,-0.1030524827414123,-0.04010689666620407
"PA-09 in Wyoming County, USA",-0.3521335307578409,-0.3823797930614729,0.030246262303632032
"CO-04 in Elbert County, USA",-0.5023968814202181,-0.5363579474342929,0.03396106601407478
"MI-01 in Charlevoix County, USA",-0.17070588235294118,-0.24244293645897594,0.07173705410603476
"KY-01 in Taylor County, USA",-0.5125342696510917,-0.510146739725772,-0.0023875299253197646
"KS-03 in Franklin County, USA",-0.3838262402821191,-0.3915184678522572,0.007692227570138099
"MS-02 in Sunflower County, USA",0.4113211445098647,0.40956449260262556,0.0017566519072391151
"MS-03 in Simpson County, USA",-0.30452814219212865,-0.3081705928715299,0.0036424506794012768
"MI-01 in Dickinson County, USA",-0.33401878127356227,-0.3537409798708697,0.01972219859730745
"VT-00 in Lamoille County, USA",0.40744217230975527,0.2876508384265789,0.11979133388317637
"TN-08 in McNairy County, USA",-0.6341463414634146,-0.5970312811316996,-0.03711506033171508
"CO-03 in Montezuma County, USA",-0.2238709677419355,-0.30175766060040443,0.07788669285846894
"GA-09 in Hart County, USA",-0.49556061915612476,-0.4663690476190476,-0.029191571537077132
"VA-09 in Russell County, USA",-0.6354774178741882,-0.5873088997195128,-0.04816851815467538
"SD-00 in Lawrence County, USA",-0.30488863176164305,-0.34242526600236445,0.0375366342407214
"UT-01 in Summit County, USA",0.23498025565755593,0.1815454204516692,0.05343483520588674
"NC-08 in Montgomery County, USA",-0.3178457467507199,-0.25822877214491724,-0.059616974605802675
"VA-06 in Staunton city-County, USA",0.09899923017705928,0.01776988005330964,0.08122935012374964
"AR-04 in Johnson County, USA",-0.4901031796167614,-0.40210711150131695,-0.08799606811544447
"IA-04 in Plymouth County, USA",-0.4932337186354666,-0.5151630022744503,0.02192928363898372
"CT-04 in Naugatuck Valley Planning Region, USA",-0.1905377914526389,-0.2961944678696742,0.10565667641703527
"SC-03 in Edgefield County, USA",-0.24289275371663813,-0.20196952733795262,-0.04092322637868551
"OK-04 in Garvin County, USA",-0.642098516755173,-0.6066755167836146,-0.0354229999715584
"IN-04 in Cass County, USA",-0.33169395724724554,-0.3518212043761021,0.02012724712885655
