"Yazoo County, Mississippi, USA",0.06362591031046423,0.07656405163853076,-0.012938141328066532,28163
"Gillespie County, Texas, USA",-0.5890480095892989,-0.6173755108218572,0.028327501232558228,48171
"King George County, Virginia, USA",-0.21386389201349787,-0.27668049792531113,0.06281660591181326,51099
"Carroll County, Ohio, USA",-0.5274493243243256,-0.46797084771768493,-0.05947847660664063,39019
"Juneau County, Wisconsin, USA",-0.2919823955423216,-0.2605027694929689,-0.03147962604935267,55057
"Boone County, Iowa, USA",-0.1559322033898297,-0.1368695407156911,-0.019062662674138586,19015
"Wasco County, Oregon, USA",-0.030502476999293242,-0.08793045804078851,0.05742798104149527,41065
"Marlboro County, South Carolina, USA",0.10901988114080342,0.16250079059155942,-0.053480909450755995,45069
"Geneva County, Alabama, USA",-0.7375846950976508,-0.7202755570675309,-0.017309138030119908,01061
"Oceana County, Michigan, USA",-0.280756649125301,-0.27284157585917745,-0.007915073266123562,26127
"Carter County, Kentucky, USA",-0.5293911530371642,-0.5169166441918344,-0.012474508845329857,21043
"Lewis County, New York, USA",-0.39089972475822016,-0.37571707584782005,-0.01518264891040011,36049
"Cass County, Nebraska, USA",-0.35226380528657375,-0.39096560950657105,0.038701804219997304,31025
"Ashe County, North Carolina, USA",-0.46163034762482813,-0.44022930178065656,-0.021401045844171573,37009
"Decatur County, Indiana, USA",-0.5807764303735652,-0.5697799248523888,-0.01099650552117637,18031
"Clay County, Indiana, USA",-0.5666857003018191,-0.5491130526873204,-0.017572647614498726,18021
"Mille Lacs County, Minnesota, USA",-0.3776975968411738,-0.3556887147576242,-0.02200888208354962,27095
"Grayson County, Kentucky, USA",-0.5885838270883749,-0.5921301551267502,0.0035463280383752904,21085
"Grady County, Georgia, USA",-0.3189502194825822,-0.33039886968807713,0.011448650205494959,13131
"Union County, Oregon, USA",-0.40444325481798765,-0.3995990129549647,-0.004844241863022958,41061
"Wyoming County, Pennsylvania, USA",-0.35213353075784126,-0.382379793061472,0.030246262303630755,42131
"Elbert County, Colorado, USA",-0.5023968814202173,-0.5363579474342921,0.03396106601407478,08039
"Charlevoix County, Michigan, USA",-0.17070588235294257,-0.24244293645897663,0.07173705410603406,26029
"Taylor County, Kentucky, USA",-0.5125937079952477,-0.5101836780303024,-0.002410029964945326,21217
"Franklin County, Kansas, USA",-0.38382624028212137,-0.39151846785225836,0.007692227570136989,20059
"Sunflower County, Mississippi, USA",0.4113211445098666,0.4095644926026261,0.001756651907240503,28133
"Simpson County, Mississippi, USA",-0.3045281421921279,-0.30817059287153004,0.0036424506794021094,28127
"Dickinson County, Michigan, USA",-0.33401878127356105,-0.3537409798708691,0.01972219859730806,26043
"Lamoille County, Vermont, USA",0.4074421723097535,0.28765083842657957,0.11979133388317392,50015
"Brown County, Minnesota, USA",-0.32791253843525864,-0.35887945424196216,0.03096691580670352,27015
"McNairy County, Tennessee, USA",-0.6341463414634155,-0.597031281131703,-0.037115060331712524,47109
"Montezuma County, Colorado, USA",-0.2238709677419376,-0.3017576606004025,0.07788669285846489,08083
"Hart County, Georgia, USA",-0.49556061915612515,-0.466369047619048,-0.029191571537077132,13147
"Russell County, Virginia, USA",-0.6354774178741901,-0.587308899719514,-0.04816851815467604,51167
"Lawrence County, South Dakota, USA",-0.304888631761644,-0.34242526600236456,0.03753663424072057,46081
"Salinas Municipio, Puerto Rico, USA",,,,72123
"Montgomery County, North Carolina, USA",-0.3178457467507189,-0.2582287721449181,-0.05961697460580084,37123
"Staunton city-County, Virginia, USA",0.09899923017705996,0.01776988005330941,0.08122935012375054,51790
"Johnson County, Arkansas, USA",-0.4901031796167634,-0.40210711150131534,-0.08799606811544808,05071
"Plymouth County, Iowa, USA",-0.4932337186354688,-0.5151630022744496,0.02192928363898078,19149
"Edgefield County, South Carolina, USA",-0.24289275371663854,-0.20196952733795143,-0.040923226378687116,45037
"Garvin County, Oklahoma, USA",-0.6420985167551714,-0.6066755167836158,-0.035422999971555624,40049
"Añasco Municipio, Puerto Rico, USA",,,,72011
"Morehouse Parish, Louisiana, USA",-0.13513046483497476,-0.1136517043536966,-0.021478760481278156,22067
"Cheboygan County, Michigan, USA",-0.29928157297706076,-0.3204359274429501,0.021154354465889313,26031
"Benton County, Iowa, USA",-0.27509984441447327,-0.25671849309159395,-0.018381351322879325,19011
"Churchill County, Nevada, USA",-0.4903801396431347,-0.5138050831961976,0.02342494355306285,32001
"Barton County, Kansas, USA",-0.5631626235399817,-0.5891118036618633,0.025949180121881632,20009
"Hardeman County, Tennessee, USA",-0.15705765407554678,-0.0791545346705481,-0.07790311940499868,47069
"Mason County, West Virginia, USA",-0.5324466660715874,-0.5471235028470443,0.014676836775456836,54053
"Butts County, Georgia, USA",-0.4359867470903068,-0.4380078083781779,0.002021061287871051,13035
"Luna County, New Mexico, USA",-0.10428236455633766,-0.038793694311172154,-0.0654886702451655,35029
"Gladwin County, Michigan, USA",-0.3676641785934403,-0.34717767799871685,-0.020486500594723456,26051
"Payette County, Idaho, USA",-0.5933764278756747,-0.5723805147058824,-0.020995913169792324,16075
"Pottawatomie County, Kansas, USA",-0.46923488496522187,-0.5038346427235323,0.03459975775831042,20149
"Salem city-County, Virginia, USA",-0.19417547521727335,-0.24728941235846627,0.05311393714119292,51775
"Hardee County, Florida, USA",-0.44977652317101935,-0.40457815565729094,-0.04519836751372841,12049
"Fannin County, Georgia, USA",-0.6462367270638207,-0.6544982595203916,0.008261532456570908,13111
"Washington County, Florida, USA",-0.610376976084312,-0.5684595486575665,-0.041917427426745424,12133
"Adair County, Missouri, USA",-0.2615384615384599,-0.2491874322860225,-0.01235102925243739,29001
"Lyon County, Minnesota, USA",-0.2594431086636168,-0.2808841588211218,0.02144105015750497,27083
"Todd County, Minnesota, USA",-0.48781775665686017,-0.47544400900525396,-0.012373747651606204,27153
"Barbour County, Alabama, USA",-0.0766305381251185,-0.05568822237080962,-0.020942315754308875,01005
"Posey County, Indiana, USA",-0.4077545159096058,-0.38778589580686135,-0.019968620102744472,18129
"Macon County, Tennessee, USA",-0.715610835880677,-0.6917643923240938,-0.023846443556583163,47111
"Lauderdale County, Tennessee, USA",-0.27674288901282906,-0.22604179547421874,-0.050701093538610326,47097
"Otsego County, Michigan, USA",-0.34129490151496894,-0.3756752466029457,0.03438034508797677,26137
"Iosco County, Michigan, USA",-0.2852478051288774,-0.2991962507631986,0.013948445634321238,26069
"Prentiss County, Mississippi, USA",-0.5840849304772637,-0.5653363047001616,-0.018748625777102124,28117
"Bremer County, Iowa, USA",-0.1605939777258345,-0.13680011818584453,-0.02379385953998997,19017
"Manistee County, Michigan, USA",-0.15161485851046166,-0.1541438727273142,0.002529014216852532,26101
"Cherokee County, Alabama, USA",-0.7283147711568158,-0.6900214292369298,-0.03829334191988598,01019
"Chattooga County, Georgia, USA",-0.617910447761193,-0.5876151236063973,-0.030295324154795633,13055
"Audrain County, Missouri, USA",-0.4721126760563398,-0.43908023093768705,-0.03303244511865272,29007
"Grant County, Kentucky, USA",-0.5870700522240236,-0.560694851402261,-0.02637520082176259,21081
"Hickman County, Tennessee, USA",-0.5540073230268514,-0.49545629079738707,-0.05855103222946434,47081
"Routt County, Colorado, USA",0.2759540175397005,0.16945516945517036,0.10649884808453014,08107
"Jackson County, Oklahoma, USA",-0.5773020313830447,-0.5759672047143223,-0.001334826668722422,40065
"Yates County, New York, USA",-0.18548913550312565,-0.19878799920524545,0.0132988637021198,36123
"Milam County, Texas, USA",-0.5188126299867667,-0.49780701754385986,-0.02100561244290683,48331
"Crook County, Oregon, USA",-0.4845934748834782,-0.48258297732500655,-0.002010497558471658,41013
"Goochland County, Virginia, USA",-0.19356932153392326,-0.24996354139839388,0.05639421986447063,51075
"Miller County, Missouri, USA",-0.6573505654281097,-0.6601541966006668,0.0028036311725571084,29131
"Randolph County, Missouri, USA",-0.5150809905045637,-0.5088757396449716,-0.006205250859592115,29175
"Cleburne County, Arkansas, USA",-0.6577287066246066,-0.6087712039718648,-0.04895750265274179,05023
"Teller County, Colorado, USA",-0.3520278646909505,-0.4252284685682649,0.07320060387731442,08119
"White County, Indiana, USA",-0.4413477910206989,-0.4258249925676377,-0.015522798453061204,18181
"Rowan County, Kentucky, USA",-0.2103363923114218,-0.21262035027417084,0.0022839579627490503,21205
"Cassia County, Idaho, USA",-0.6691245196801306,-0.6007581315725108,-0.06836638810761986,16031
"Aibonito Municipio, Puerto Rico, USA",,,,72009
"Union County, Georgia, USA",-0.6330431675670032,-0.6549967007522658,0.021953533185262608,13291
"Somerset County, Maryland, USA",-0.14762984133241325,-0.11565656565656551,-0.031973275675847734,24039
"Nicholas County, West Virginia, USA",-0.5694261523988707,-0.5701190601622584,0.0006929077633877068,54067
"Burke County, Georgia, USA",-0.01787719955072911,0.025665704202758665,-0.04354290375348778,13033
"Uvalde County, Texas, USA",-0.203112915699923,-0.1079875055778664,-0.09512541012205661,48463
"Waushara County, Wisconsin, USA",-0.3410966981132074,-0.3210203743581247,-0.020076323755082726,55137
"Jefferson County, Oregon, USA",-0.23470158650213999,-0.26461570990590877,0.029914123403768783,41031
"Randolph County, Indiana, USA",-0.5239428984459713,-0.48185100722158947,-0.04209189122438184,18135
"Texas County, Missouri, USA",-0.6859920459566952,-0.6535893918609946,-0.032402654095700534,29215
"Marion County, Mississippi, USA",-0.36839944157017485,-0.35568288719746793,-0.012716554372706912,28091
"Fayette County, Texas, USA",-0.5785824345146378,-0.5877794602298022,0.009197025715164453,48149
"Scott County, Indiana, USA",-0.4554397009639991,-0.37520498524106194,-0.08023471572293717,18143
"George County, Mississippi, USA",-0.768847859534798,-0.775351329491457,0.006503469956659069,28039
"Abbeville County, South Carolina, USA",-0.3308935896404741,-0.2804640371229706,-0.05042955251750353,45001
"Lincoln County, Kentucky, USA",-0.5713369375973616,-0.57242966216923,0.0010927245718683753,21137
"Blaine County, Idaho, USA",0.3677477613063422,0.28683327116747404,0.08091449013886814,16013
"Jerome County, Idaho, USA",-0.4916794674859167,-0.49103836468671314,-0.0006411027992035412,16053
"Aguas Buenas Municipio, Puerto Rico, USA",,,,72007
"Fairfax city-County, Virginia, USA",0.3832082233167994,0.3046949877036061,0.07851323561319329,51600
"Dawson County, Nebraska, USA",-0.4387666158204377,-0.449585231919619,0.010818616099181333,31047
"Bell County, Kentucky, USA",-0.6323178016726404,-0.621938670508336,-0.010379131164304445,21013
"Shelby County, Texas, USA",-0.5856052344601966,-0.5965008802816898,0.01089564582149316,48419
"Hood River County, Oregon, USA",0.3673796791443847,0.2967919340055009,0.07058774513888377,41027
"Itawamba County, Mississippi, USA",-0.7569091413254452,-0.7551607271233431,-0.0017484142021020332,28057
"Anderson County, Kentucky, USA",-0.4765838878969866,-0.49105333789613403,0.014469449999147455,21005
"Upshur County, West Virginia, USA",-0.539575384013306,-0.5683445432848776,0.028769159271571643,54097
"Ohio County, Kentucky, USA",-0.5552260267817016,-0.5637622619734557,0.00853623519175406,21183
"Saline County, Illinois, USA",-0.4802096511838088,-0.5010541110330299,0.020844459849221064,17165
"Iowa County, Wisconsin, USA",0.13714979988564716,0.15152749490835116,-0.014377695022704001,55049
"Page County, Virginia, USA",-0.5064727505194195,-0.49506517690875324,-0.0114075736106663,51139
"Loíza Municipio, Puerto Rico, USA",,,,72087
"Quebradillas Municipio, Puerto Rico, USA",,,,72115
"Seminole County, Oklahoma, USA",-0.46311622885930115,-0.44071170834888435,-0.022404520510416803,40133
"Winston County, Alabama, USA",-0.8171747607231513,-0.8102395035392205,-0.006935257183930843,01133
"Grainger County, Tennessee, USA",-0.7004180622305147,-0.6832718662526941,-0.017146195977820633,47057
"Aransas County, Texas, USA",-0.5153329327590548,-0.5001298780400926,-0.015203054718962217,48007
"Plaquemines Parish, Louisiana, USA",-0.36299255493008864,-0.33604464201267376,-0.026947912917414885,22075
"Washington County, Missouri, USA",-0.6260529482551117,-0.5519396551724154,-0.07411329308269632,29221
"Juniata County, Pennsylvania, USA",-0.614132691189904,-0.6171800267840066,0.0030473355941026403,42067
"Mingo County, West Virginia, USA",-0.7137455911239358,-0.6880853461510061,-0.025660244972929624,54059
"Menominee County, Michigan, USA",-0.3015230842455998,-0.29374071322436707,-0.007782371021232748,26109
"Roscommon County, Michigan, USA",-0.29990677853242576,-0.2955294839352801,-0.004377294597145642,26143
"Antrim County, Michigan, USA",-0.23757243087549923,-0.29609596662585835,0.058523535750359124,26009
"Curry County, Oregon, USA",-0.1625460636515919,-0.23090952343192445,0.06836345978033254,41015
"Franklin County, Georgia, USA",-0.6945598773975229,-0.6858381014072383,-0.008721775990284564,13119
"Meeker County, Minnesota, USA",-0.4059427895631593,-0.4000162839928347,-0.005926505570324647,27093
"Fayette County, Indiana, USA",-0.5443962115232845,-0.4779120650135442,-0.06648414650974033,18041
"Starke County, Indiana, USA",-0.46802721088435284,-0.41627307857449564,-0.051754132309857204,18149
"Pacific County, Washington, USA",-0.011305460750852472,-0.06905561776782382,0.057750157016971344,53049
"Naguabo Municipio, Puerto Rico, USA",,,,72103
"Saline County, Missouri, USA",-0.3726231747032255,-0.34476046285281353,-0.027862711850411948,29195
"Teton County, Wyoming, USA",0.37521291817128927,0.2687099073414116,0.10650301082987768,56039
"Yankton County, South Dakota, USA",-0.2353211009174324,-0.24503792995947055,0.009716829042038133,46135
"McDonald County, Missouri, USA",-0.6657092355280633,-0.6401068869184994,-0.025602348609563896,29119
"Lajas Municipio, Puerto Rico, USA",,,,72079
"Ray County, Missouri, USA",-0.4494806421152026,-0.37032936617769097,-0.07915127593751164,29177
"Cataño Municipio, Puerto Rico, USA",,,,72033
"Hampshire County, West Virginia, USA",-0.6042034050871963,-0.5938454502510229,-0.01035795483617341,54027
"St. Francis County, Arkansas, USA",0.05092853123241371,0.11251682368775283,-0.061588292455339116,05123
"Clarke County, Alabama, USA",-0.11945184621240959,-0.10674545315018,-0.012706393062229593,01025
"Crawford County, Missouri, USA",-0.6025699444090039,-0.5947580645161296,-0.007811879892874352,29055
"Hopewell city-County, Virginia, USA",0.14681338252960235,0.09319395843238017,0.05361942409722219,51670
"Vilas County, Wisconsin, USA",-0.21849176914568255,-0.24950407758430523,0.031012308438622682,55125
"Poinsett County, Arkansas, USA",-0.5975393836167635,-0.46906075733355895,-0.12847862628320456,05111
"New Kent County, Virginia, USA",-0.34640116158473294,-0.3737431537644079,0.02734199217967498,51127
"Osceola County, Michigan, USA",-0.463460134641902,-0.43651616551984207,-0.02694396912205993,26133
"Tattnall County, Georgia, USA",-0.48784064524013443,-0.4959337786813839,0.008093133441249456,13267
"Columbia County, Arkansas, USA",-0.3117455896007435,-0.2606053786429607,-0.05114021095778282,05027
"Franklin County, Indiana, USA",-0.629657414353586,-0.6037667838154464,-0.02589063053813967,18047
"Emanuel County, Georgia, USA",-0.38595937269760944,-0.3696622052262584,-0.016297167471351015,13107
"Allen Parish, Louisiana, USA",-0.5571865443425075,-0.5150888077035455,-0.04209773663896199,22003
"Sabana Grande Municipio, Puerto Rico, USA",,,,72121
"Caswell County, North Carolina, USA",-0.18496390341050523,-0.11125076236911736,-0.07371314104138786,37033
"Klickitat County, Washington, USA",-0.09424778761061993,-0.14811031664964183,0.0538625290390219,53039
"Johnson County, Kentucky, USA",-0.6713108320251179,-0.7096740493104889,0.038363217285371065,21115
"Rockbridge County, Virginia, USA",-0.32330879713535576,-0.2937093428359285,-0.029599454299427286,51163
"Ouachita County, Arkansas, USA",-0.1349049745560287,-0.10367388022143892,-0.031231094334589787,05103
"Mercer County, Kentucky, USA",-0.4663826161056666,-0.5050075585789872,0.038624942473320545,21167
"Barceloneta Municipio, Puerto Rico, USA",,,,72017
"Washington County, Iowa, USA",-0.20484487887802763,-0.20404428584499731,-0.0008005930330303168,19183
"Brooke County, West Virginia, USA",-0.43149399399399524,-0.4220326641006974,-0.009461329893297843,54009
"Overton County, Tennessee, USA",-0.5863305768655969,-0.4999392392757313,-0.08639133758986556,47133
"Panola County, Texas, USA",-0.6344039099319242,-0.6346006144393246,0.00019670450740039147,48365
"Beckham County, Oklahoma, USA",-0.7195520885757412,-0.7081567796610154,-0.011395308914725732,40009
"Sumner County, Kansas, USA",-0.5045754026354298,-0.5067630356220976,0.002187632986667798,20191
"Bibb County, Alabama, USA",-0.5772798332464845,-0.5515364553804293,-0.025743377866055184,01007
"Nobles County, Minnesota, USA",-0.3060240963855414,-0.2972659870250228,-0.008758109360518573,27105
"Asotin County, Washington, USA",-0.25679859425989443,-0.26776910435497076,0.010970510095076325,53003
"Saunders County, Nebraska, USA",-0.4536317235963898,-0.4707202993451811,0.0170885757487913,31155
"Leelanau County, Michigan, USA",0.052195939901153794,-0.031335837922174495,0.0835317778233283,26089
"Meigs County, Ohio, USA",-0.5318235777554564,-0.5060132291040293,-0.025810348651427062,39105
"Waynesboro city-County, Virginia, USA",-0.050947093403004844,-0.11266840504128718,0.06172131163828234,51820
"Mahaska County, Iowa, USA",-0.47378112942826955,-0.4526899924755438,-0.021091136952725742,19123
"Lee County, Virginia, USA",-0.6913331992760918,-0.6294286626236851,-0.061904536652406694,51105
"Grant Parish, Louisiana, USA",-0.7410562180579215,-0.7059290329894568,-0.035127185068464795,22043
"Sabine Parish, Louisiana, USA",-0.6648735371838419,-0.631041177071625,-0.03383236011221691,22085
"Limestone County, Texas, USA",-0.5031335898845521,-0.5166516651665148,0.013518075281962694,48293
"Villalba Municipio, Puerto Rico, USA",,,,72149
"Houston County, Texas, USA",-0.502328535139712,-0.506045732072311,0.003717196932598976,48225
"Anson County, North Carolina, USA",0.041808111488297106,0.1287546895702002,-0.08694657808190309,37007
"Putnam County, Georgia, USA",-0.40851961197806885,-0.39970439189189055,-0.0088152200861783,13237
"Jo Daviess County, Illinois, USA",-0.164625850340137,-0.146373742721015,-0.018252107619121993,17085
"Martin County, North Carolina, USA",-0.04952153110047996,-0.004262788365094374,-0.04525874273538558,37117
"Randolph County, Alabama, USA",-0.5865091815077954,-0.5314616668302732,-0.055047514677522225,01111
"Seward County, Kansas, USA",-0.29070646014355744,-0.30389043271139315,0.013183972567835711,20175
"Henry County, Missouri, USA",-0.5012977382276621,-0.47854752003245704,-0.022750218195205063,29083
"Wyandot County, Ohio, USA",-0.503073410607657,-0.46867903103709396,-0.034394379570563016,39175
"Prince Edward County, Virginia, USA",0.05625890956177194,0.053526224183535524,0.002732685378236413,51147
"Scott County, Tennessee, USA",-0.7752982766239493,-0.7173943563105455,-0.057903920313403856,47151
"Colusa County, California, USA",-0.16588592290129328,-0.13493026076410106,-0.030955662137192225,06011
"Tippah County, Mississippi, USA",-0.6055236586814494,-0.5845154304277216,-0.021008228253727834,28139
"Boone County, West Virginia, USA",-0.5298490901020853,-0.5428999193827039,0.013050829280618625,54005
"Taylor County, Florida, USA",-0.5377786545669749,-0.5110577411698038,-0.026720913397171087,12123
"Mitchell County, Georgia, USA",-0.10487559968760556,-0.09993642720915302,-0.004939172478452533,13205
"Gage County, Nebraska, USA",-0.36682327430430073,-0.34759358288769826,-0.019229691416602468,31067
"Grenada County, Mississippi, USA",-0.12359278695602254,-0.1471829591662331,0.023590172210210578,28043
"McDuffie County, Georgia, USA",-0.19139167862266773,-0.18698748381527924,-0.0044041948073884896,13189
"Lampasas County, Texas, USA",-0.5714010962592557,-0.5974405850091418,0.02603948874988604,48281
"Minidoka County, Idaho, USA",-0.5898911547604134,-0.5414059088924484,-0.04848524586796499,16067
"Gaines County, Texas, USA",-0.7970313542361577,-0.716450216450219,-0.08058113778593867,48165
"Stutsman County, North Dakota, USA",-0.4335776684406039,-0.4155588380108347,-0.018018830429769206,38093
"Dakota County, Nebraska, USA",-0.17397703856343907,-0.2096956031567081,0.035718564593269025,31043
"Scott County, Virginia, USA",-0.6781672646977658,-0.6600000000000018,-0.018167264697763974,51169
"Hertford County, North Carolina, USA",0.340229452698891,0.3741409778126842,-0.033911525113793195,37091
"Letcher County, Kentucky, USA",-0.5940886699507403,-0.6296255747755632,0.03553690482482297,21133
"Hockley County, Texas, USA",-0.6237965934337198,-0.6177191072400651,-0.00607748619365478,48219
"Logan County, Colorado, USA",-0.5572540827952907,-0.5586299115408376,0.0013758287455469809,08075
"Sevier County, Utah, USA",-0.7688893177651258,-0.6985209151837332,-0.07036840258139265,49041
"Jersey County, Illinois, USA",-0.4817793415431025,-0.4611955236102275,-0.020583817932875004,17083
"Fayette County, Illinois, USA",-0.619616035014424,-0.5793427230046962,-0.040273312009727724,17051
"Clark County, Arkansas, USA",-0.1403216200119122,-0.09195402298850619,-0.04836759702340601,05019
"Orocovis Municipio, Puerto Rico, USA",,,,72107
"Coahoma County, Mississippi, USA",0.42877308551935184,0.44344703770197563,-0.014673952182623795,28027
"Wabasha County, Minnesota, USA",-0.26343061799893147,-0.2639452332657202,0.0005146152667887538,27157
"Texas County, Oklahoma, USA",-0.6540481796775955,-0.651038062283739,-0.003010117393856593,40139
"Wyoming County, West Virginia, USA",-0.7211359404096832,-0.7004214021197793,-0.020714538289903883,54109
"Moore County, Texas, USA",-0.5985838779956437,-0.5430026405130145,-0.05558123748262922,48341
"Hubbard County, Minnesota, USA",-0.2884114288532558,-0.3335131944368177,0.04510176558356188,27057
"Owen County, Indiana, USA",-0.4913166397415184,-0.48827762302692823,-0.0030390167145901703,18119
"Newton County, Mississippi, USA",-0.3851517234606715,-0.4017800381436768,0.016628314683005296,28101
"Leake County, Mississippi, USA",-0.14467391304347776,-0.14179192803882065,-0.0028819850046571116,28079
"Llano County, Texas, USA",-0.601421800947868,-0.6196994352445687,0.018277634296700707,48299
"Nodaway County, Missouri, USA",-0.40574433656957765,-0.40794491525424026,0.002200578684662613,29147
"Fillmore County, Minnesota, USA",-0.226505230211678,-0.21700587969244636,-0.009499350519231647,27045
"Gray County, Texas, USA",-0.7724235415060435,-0.7831195138419988,0.010695972335955317,48179
"Madison County, North Carolina, USA",-0.2354008785917118,-0.25348452974532365,0.01808365115361185,37115
"Clinton County, Missouri, USA",-0.4503122703894203,-0.4403409090909115,-0.009971361298508785,29049
"Jackson County, Wisconsin, USA",-0.15075244441075727,-0.11740584871047667,-0.033346595700280604,55053
"Logan County, Arkansas, USA",-0.595379939209727,-0.5089003913647274,-0.08647954784499956,05083
"Union Parish, Louisiana, USA",-0.5136148558164464,-0.48476225445199184,-0.028852601364454555,22111
"Assumption Parish, Louisiana, USA",-0.30600801068090744,-0.2552274394717534,-0.050780571209154024,22007
"Morgan County, Tennessee, USA",-0.7004132231404957,-0.6542878448918713,-0.046125378248624394,47129
"Morgan County, Missouri, USA",-0.5816380309897754,-0.5661147652528936,-0.015523265736881786,29141
"Shelby County, Illinois, USA",-0.5722552910052942,-0.5396003633060843,-0.03265492769920986,17173
"Fairfield County, South Carolina, USA",0.22717534607778497,0.2589864205201022,-0.031811074442317205,45039
"Perry County, Illinois, USA",-0.4676216054908981,-0.445854054602657,-0.021767550888241116,17145
"Dodge County, Minnesota, USA",-0.30393041765816103,-0.3214755021588133,0.017545084500652286,27039
"Washington County, Nebraska, USA",-0.40513977281881886,-0.45050201745331664,0.045362244634497784,31177
"Bandera County, Texas, USA",-0.593944160440425,-0.6299667253865718,0.03602256494614686,48019
"Buena Vista County, Iowa, USA",-0.2565201420350183,-0.2472819521623618,-0.009238189872656483,19021
"Sullivan County, Indiana, USA",-0.5045585946186336,-0.46731684662719014,-0.037241747991443475,18153
"Worth County, Georgia, USA",-0.4776521270867,-0.4990338164251217,0.02138168933842166,13321
"Ogemaw County, Michigan, USA",-0.4012765600067184,-0.36555309521517304,-0.03572346479154537,26129
"Carroll County, Iowa, USA",-0.3778561976179986,-0.31572458270106313,-0.062131614916935474,19027
"Pointe Coupee Parish, Louisiana, USA",-0.22795246948508643,-0.17217923645948452,-0.055773233025601915,22077
"Conway County, Arkansas, USA",-0.3545192861255034,-0.2766494260123621,-0.07786986011314129,05029
"Adams County, Wisconsin, USA",-0.2566424098832292,-0.21924975320829274,-0.037392656674936436,55001
"Jones County, Iowa, USA",-0.21466921466921385,-0.190762854041251,-0.023906360627962836,19105
"Hutchinson County, Texas, USA",-0.7644849174729691,-0.7587982832618002,-0.005686634211168884,48233
"Adams County, Washington, USA",-0.3570453770044361,-0.3841515934539199,0.0271062164494838,53001
"Meriwether County, Georgia, USA",-0.2056369945739535,-0.15428664718007667,-0.05135034739387684,13199
"Dukes County, Massachusetts, USA",0.5690732927019863,0.5073667980126769,0.06170649468930933,25007
"Allen County, Kentucky, USA",-0.6348830527477797,-0.6324371198735946,-0.0024459328741850417,21003
"Barnwell County, South Carolina, USA",-0.07479895358976858,-0.051555086979440716,-0.023243866610327867,45011
"Buchanan County, Iowa, USA",-0.20892890291442248,-0.15021459227467962,-0.05871431063974286,19019
"Kewaunee County, Wisconsin, USA",-0.3266639107069024,-0.2777932571747016,-0.048870653532200825,55061
"Colorado County, Texas, USA",-0.5064661654135341,-0.5076653013458158,0.0011991359322817141,48089
