longname,2020 Presidential Election,2016 Presidential Election,2016-2020 Swing
"New York-Newark CSA, NY-NJ-CT-PA, USA",0.24864029528331927,0.24769752694122762,0.0009427683420916433
"Los Angeles-Long Beach CSA, CA, USA",0.28343327310867783,0.3100424822819881,-0.026609209173310278
"Chicago-Naperville CSA, IL-IN-WI, USA",0.2999763563186976,0.31151522302477036,-0.011538866706072737
"Washington-Baltimore-Arlington CSA, DC-MD-VA-WV-PA, USA",0.3572404979591555,0.3004280547899188,0.056812443169236726
"San Jose-San Francisco-Oakland CSA, CA, USA",0.5149238031377696,0.5321810589781341,-0.017257255840364416
"Boston-Worcester-Providence CSA, MA-RI-NH-CT, USA",0.27634367322733655,0.21131027348446893,0.06503339974286762
"Dallas-Fort Worth CSA, TX-OK, USA",-0.028130784435964742,-0.10196993780768866,0.07383915337172392
"Philadelphia-Reading-Camden CSA, PA-NJ-DE-MD, USA",0.25266107360851237,0.23385983582872488,0.018801237779787483
"Houston-The Woodlands CSA, TX, USA",-0.002217717005720904,-0.02314538321568235,0.020927666209961445
"Miami-Fort Lauderdale-Port St. Lucie CSA, FL, USA",0.1263241597226278,0.22463664090381755,-0.09831248118118974
"Atlanta--Athens-Clarke County--Sandy Springs CSA, GA, USA",0.11075167557089093,0.04161648708055783,0.0691351884903331
"Detroit-Warren-Ann Arbor CSA, MI, USA",0.13939819027612466,0.11294178438656269,0.026456405889561968
"Seattle-Tacoma CSA, WA, USA",0.3154139983461698,0.2896533291767213,0.02576066916944847
"Minneapolis-St. Paul CSA, MN-WI, USA",0.15893290225133389,0.09408411024975284,0.06484879200158104
"Denver-Aurora CSA, CO, USA",0.24800432866669758,0.16357550583674857,0.08442882282994901
"Cleveland-Akron-Canton CSA, OH, USA",0.04686908877170536,0.06271644520700664,-0.01584735643530128
"Orlando-Deltona-Daytona Beach CSA, FL, USA",0.026494106922456052,0.03420019038903639,-0.007706083466580339
"Portland-Vancouver-Salem CSA, OR-WA, USA",0.23461075244647625,0.19203760704805994,0.04257314539841631
"St. Louis-St. Charles-Farmington CSA, MO-IL, USA",0.017534340709451014,-0.020814877922315476,0.03834921863176649
"Charlotte-Concord CSA, NC-SC, USA",-0.020156293081515265,-0.06567187452097205,0.04551558143945678
"Salt Lake City-Provo-Orem CSA, UT, USA",-0.13452925885305803,-0.11622673896424787,-0.018302519888810154
"Sacramento-Roseville CSA, CA, USA",0.147418474196227,0.12634132015074606,0.02107715404548094
"Pittsburgh-New Castle-Weirton CSA, PA-OH-WV, USA",-0.055507769335868935,-0.07815053515675269,0.022642765820883752
"Columbus-Marion-Zanesville CSA, OH, USA",0.005430826091310085,-0.017633474802956167,0.02306430089426625
"Las Vegas-Henderson CSA, NV-AZ, USA",0.024451348103127456,0.03821936791045325,-0.013768019807325796
"Kansas City-Overland Park-Kansas City CSA, MO-KS, USA",0.031761119958580705,-0.028899990401712733,0.06066111036029344
"Indianapolis-Carmel-Muncie CSA, IN, USA",-0.07135527065425956,-0.12936817173222298,0.05801290107796342
"San Juan-Carolina CSA, PR, USA",,,
"Raleigh-Durham-Chapel Hill CSA, NC, USA",0.21984911822089478,0.19063903958775075,0.029210078633144038
"Cincinnati-Wilmington-Maysville CSA, OH-KY-IN, USA",-0.14261493343820789,-0.18383418212097935,0.041219248682771464
"Nashville-Davidson--Murfreesboro CSA, TN, USA",-0.13223502984193458,-0.1838688929143372,0.051633863072402614
"Milwaukee-Racine-Waukesha CSA, WI, USA",0.04286956952557262,0.02363736608505415,0.019232203440518472
"Virginia Beach-Norfolk CSA, VA-NC, USA",0.11923296684572686,0.0653752483411384,0.05385771850458845
"Jacksonville-St. Marys-Palatka CSA, FL-GA, USA",-0.14382614526559073,-0.18736827715147647,0.04354213188588574
"Greensboro--Winston-Salem--High Point CSA, NC, USA",-0.07810182783747668,-0.09459444594635709,0.016492618108880405
"Louisville/Jefferson County--Elizabethtown--Madison CSA, KY-IN, USA",-0.05530138342671771,-0.09823920321408136,0.04293781978736365
"Greenville-Spartanburg-Anderson CSA, SC, USA",-0.2968486218390083,-0.3260577499099095,0.029209128070901202
"New Orleans-Metairie-Hammond CSA, LA-MS, USA",-0.02096872582509725,-0.0448856451783293,0.023916919353232046
"Oklahoma City-Shawnee CSA, OK, USA",-0.1810171362363397,-0.25011281630522336,0.06909568006888367
"Grand Rapids-Wyoming-Muskegon CSA, MI, USA",-0.08627268018932467,-0.14558082401758787,0.0593081438282632
"Hartford-West Hartford CSA, CT, USA",0.22396052029367808,0.1597510034134578,0.06420951688022028
"Birmingham-Hoover-Talladega CSA, AL, USA",-0.21604556549969164,-0.2553648111336382,0.03931924563394654
"Memphis-Forrest City CSA, TN-MS-AR, USA",0.13098670081314473,0.10583434813789179,0.02515235267525294
"Harrisburg-York-Lebanon CSA, PA, USA",-0.16970740573133597,-0.21717280421721138,0.047465398485875415
"Buffalo-Cheektowaga CSA, NY, USA",0.08068931436584843,0.0010193392560582282,0.07966997510979021
"Albany-Schenectady CSA, NY, USA",0.09378172739995094,0.025158753258764103,0.06862297414118684
"Albuquerque-Santa Fe-Las Vegas CSA, NM, USA",0.2420041323776055,0.1982262327995221,0.043777899578083423
"Rochester-Batavia-Seneca Falls CSA, NY, USA",0.07862208281232394,0.02317031613477541,0.05545176667754853
"Tulsa-Muskogee-Bartlesville CSA, OK, USA",-0.29433183438589827,-0.3303528000799568,0.03602096569405855
"Fresno-Madera CSA, CA, USA",0.053475110845807625,0.034172776229219555,0.01930233461658807
"Knoxville-Morristown-Sevierville CSA, TN, USA",-0.36560894254210813,-0.41181962098989366,0.046210678447785536
"Cape Coral-Fort Myers-Naples CSA, FL, USA",-0.21069619268473558,-0.2225342541765339,0.011838061491798335
"Tucson-Nogales CSA, AZ, USA",0.19291864291892044,0.1484364478066422,0.044482195112278244
"Dayton-Springfield-Sidney CSA, OH, USA",-0.17165907182788906,-0.183095586383741,0.011436514555851929
"El Paso-Las Cruces CSA, TX-NM, USA",0.30971607932657846,0.36433120734682384,-0.054615128020245374
"North Port-Sarasota CSA, FL, USA",-0.1587764412931752,-0.16735200404636735,0.008575562753192156
"Omaha-Council Bluffs-Fremont CSA, NE-IA, USA",-0.030789697591712715,-0.11025550279919989,0.07946580520748718
"Chattanooga-Cleveland-Dalton CSA, TN-GA-AL, USA",-0.3815339784385622,-0.412351055557263,0.030817077118700797
"Columbia-Orangeburg-Newberry CSA, SC, USA",0.06777861532986162,0.0349891827138762,0.03278943261598542
"McAllen-Edinburg CSA, TX, USA",0.16170371581812765,0.41484441722932075,-0.2531407014111931
"Little Rock-North Little Rock CSA, AR, USA",-0.10855337151172365,-0.11671339245255906,0.008160020940835414
"Madison-Janesville-Beloit CSA, WI, USA",0.3613773372078276,0.3261607703579539,0.03521656684987373
"Boise City-Mountain Home-Ontario CSA, ID-OR, USA",-0.18315736138949426,-0.2291539410432423,0.04599657965374804
"Des Moines-Ames-West Des Moines CSA, IA, USA",0.06592015123514217,0.03679910973975139,0.029121041495390777
"Modesto-Merced CSA, CA, USA",0.03700576395273667,0.04888802006430477,-0.011882256111568096
"Huntsville-Decatur-Albertville CSA, AL, USA",-0.3119009463901501,-0.3693041612000406,0.057403214809890524
"Spokane-Spokane Valley-Coeur d'Alene CSA, WA-ID, USA",-0.1574855409121091,-0.18476635658675242,0.027280815674643327
"Lexington-Fayette--Richmond--Frankfort CSA, KY, USA",-0.07606045982408757,-0.14382359725634689,0.06776313743225931
"Syracuse-Auburn CSA, NY, USA",0.0813535873384761,0.031151810362882313,0.05020177697559379
"South Bend-Elkhart-Mishawaka CSA, IN-MI, USA",-0.11300320313138437,-0.15298610060904286,0.039982897477658486
"Springfield-Greenfield Town CSA, MA, USA",0.2827534510547548,0.24791473493988156,0.03483871611487324
"Wichita-Arkansas City-Winfield CSA, KS, USA",-0.18739033457249213,-0.23992831072531445,0.052537976152822324
"Charleston-Huntington-Ashland CSA, WV-OH-KY, USA",-0.3368268211118012,-0.36459975430984665,0.02777293319804547
"Jackson-Vicksburg-Brookhaven CSA, MS, USA",0.012113086142248828,-0.01492500080184287,0.027038086944091697
"Portland-Lewiston-South Portland CSA, ME, USA",0.2195910996760299,0.1318896630390103,0.0877014366370196
"Reno-Carson City-Fernley CSA, NV, USA",-0.04443858829999592,-0.07112565463136397,0.026687066331368053
"Toledo-Port Clinton CSA, OH, USA",0.04388823804727686,0.058947360523441995,-0.015059122476165136
"Mobile-Daphne-Fairhope CSA, AL, USA",-0.27562906364589324,-0.28863351727104136,0.013004453625148127
"Fort Wayne-Huntington-Auburn CSA, IN, USA",-0.26914941685797383,-0.31924344755237194,0.050094030694398106
"Youngstown-Warren CSA, OH-PA, USA",-0.15372128786584618,-0.11093681776282774,-0.042784470103018446
"Visalia-Porterville-Hanford CSA, CA, USA",-0.08821828251726951,-0.10430291023501868,0.01608462771774917
"Lafayette-Opelousas-Morgan City CSA, LA, USA",-0.33785110961144676,-0.3435401634713756,0.00568905385992885
"Savannah-Hinesville-Statesboro CSA, GA, USA",-0.006670527686384077,-0.03383916420232173,0.02716863651593765
"Springfield-Branson CSA, MO, USA",-0.3789938496379159,-0.41954160293305276,0.04054775329513688
"Myrtle Beach-Conway CSA, SC-NC, USA",-0.28324735965653147,-0.31510465593764436,0.03185729628111289
"Pensacola-Ferry Pass CSA, FL-AL, USA",-0.2771393776108656,-0.3242207053911272,0.047081327780261584
"Lansing-East Lansing-Owosso CSA, MI, USA",0.11875781434798982,0.07913400095374236,0.03962381339424746
"Fayetteville-Lumberton-Laurinburg CSA, NC, USA",0.07673909904289283,0.10784922741716647,-0.03111012837427364
"Kalamazoo-Battle Creek-Portage CSA, MI, USA",0.021163890136441474,-0.013264338771102557,0.03442822890754403
"Columbus-Auburn-Opelika CSA, GA-AL, USA",-0.027801423747212,-0.05999043845718194,0.03218901470996994
"Corpus Christi-Kingsville-Alice CSA, TX, USA",-0.09965010711837516,-0.06450634993660807,-0.035143757181767085
"Johnson City-Kingsport-Bristol CSA, TN-VA, USA",-0.5103082620535213,-0.539629506635103,0.029321244581581696
"Asheville-Brevard CSA, NC, USA",0.01774292473779781,-0.04482670382842198,0.06256962856621978
"Davenport-Moline CSA, IA-IL, USA",-0.0012957536897664874,-0.011758299650700216,0.010462545960933729
"Cedar Rapids-Iowa City CSA, IA, USA",0.18079652600470633,0.1397022852749996,0.041094240729706744
"Brownsville-Harlingen-Raymondville CSA, TX, USA",0.1309235528744608,0.3253533149846444,-0.19442976211018362
"Macon-Bibb County--Warner Robins CSA, GA, USA",-0.04662794529171238,-0.07999999999999995,0.033372054708287566
"Rockford-Freeport-Rochelle CSA, IL, USA",-0.05189869009537386,-0.06836112414175091,0.016462434046377053
"Appleton-Oshkosh-Neenah CSA, WI, USA",-0.08801368538234496,-0.11526142138092182,0.02724773599857687
"Tallahassee-Bainbridge CSA, FL-GA, USA",0.19786247906346124,0.1815601275214644,0.016302351541996857
"Hickory-Lenoir CSA, NC, USA",-0.43657701352789885,-0.43253911906196574,-0.004037894465933112
"Peoria-Canton CSA, IL, USA",-0.13852105118670402,-0.1548352759593436,0.01631422477263958
"Saginaw-Midland-Bay City CSA, MI, USA",-0.0651343918123784,-0.08413858261144297,0.01900419079906457
"Green Bay-Shawano CSA, WI, USA",-0.15157365294980965,-0.16669496845121434,0.015121315501404692
"Gainesville-Lake City CSA, FL, USA",0.09478532724210613,0.06532048066126939,0.029464846580836743
"Ponce-Coamo-Santa Isabel CSA, PR, USA",,,
"Lincoln-Beatrice CSA, NE, USA",0.02319328875049227,-0.04469147307461743,0.0678847618251097
"Erie-Meadville CSA, PA, USA",-0.0794018616442112,-0.09910591855854994,0.01970405691433874
"Lubbock-Levelland CSA, TX, USA",-0.34717054875344683,-0.3998492266051516,0.05267867785170477
"Midland-Odessa CSA, TX, USA",-0.5321048794114053,-0.4922900413033503,-0.03981483810805497
"Medford-Grants Pass CSA, OR, USA",-0.0987110531529715,-0.14853204148649157,0.04982098833352007
"Wausau-Stevens Point-Wisconsin Rapids CSA, WI, USA",-0.13925123982427073,-0.13455851305211322,-0.004692726772157513
"Springfield-Jacksonville-Lincoln CSA, IL, USA",-0.1648631165095477,-0.1910080183276015,0.02614490181805379
"Amarillo-Borger CSA, TX, USA",-0.552389878163079,-0.5960625494523811,0.04367267128930208
"Rocky Mount-Wilson-Roanoke Rapids CSA, NC, USA",0.10185161190007537,0.1322829735156652,-0.030431361615589833
"Longview-Marshall CSA, TX, USA",-0.47540830769492065,-0.48580874676153907,0.010400439066618417
"Tyler-Jacksonville CSA, TX, USA",-0.4210966441718358,-0.45373087299867587,0.032634228826840084
"Fargo-Wahpeton CSA, ND-MN, USA",-0.03723858711966409,-0.10705704589928568,0.06981845877962159
"Idaho Falls-Rexburg-Blackfoot CSA, ID, USA",-0.5433118772595125,-0.4754407397266059,-0.06787113753290658
"Rochester-Austin CSA, MN, USA",-0.008354647356949447,-0.07407999391102461,0.06572534655407516
"Harrisonburg-Staunton-Waynesboro CSA, VA, USA",-0.2475370816979536,-0.28053190352345936,0.032994821825505755
"Bloomsburg-Berwick-Sunbury CSA, PA, USA",-0.3416658505533306,-0.3665246137060874,0.024858763152756813
"Monroe-Ruston-Bastrop CSA, LA, USA",-0.24645408154381052,-0.2521017618246937,0.005647680280883166
"Lake Charles-Jennings CSA, LA, USA",-0.40021505020563525,-0.37855377391996536,-0.021661276285669884
"Dothan-Enterprise-Ozark CSA, AL, USA",-0.4899708258731754,-0.5189194489385734,0.028948623065398027
"Lafayette-West Lafayette-Frankfort CSA, IN, USA",-0.12653357013084834,-0.17439182873167658,0.047858258600828235
"Redding-Red Bluff CSA, CA, USA",-0.3372379095744679,-0.37131959444995843,0.034081684875490514
"State College-DuBois CSA, PA, USA",-0.13554291579352415,-0.1351035600757095,-0.00043935571781464344
"Bowling Green-Glasgow CSA, KY, USA",-0.3454639315602001,-0.38900971339701307,0.04354578183681296
"Columbia-Moberly-Mexico CSA, MO, USA",0.0076162883702721815,-0.04559601468476951,0.05321230305504169
"Bend-Redmond-Prineville CSA, OR, USA",0.020116290641305528,-0.08238130932276022,0.10249759996406575
"Bloomington-Pontiac CSA, IL, USA",-0.06776413126793904,-0.10012813472450689,0.032364003456567855
"Lima-Van Wert-Celina CSA, OH, USA",-0.5256003342846236,-0.5127850527901991,-0.012815281494424458
"Mansfield-Ashland-Bucyrus CSA, OH, USA",-0.4411206920712644,-0.41766498901254406,-0.023455703058720356
"Eau Claire-Menomonie CSA, WI, USA",-0.03684510105429371,-0.04116028961240636,0.004315188558112651
"Pueblo-Cañon City CSA, CO, USA",-0.07577860141579579,-0.10152158141106359,0.025742979995267798
"Greenville-Washington CSA, NC, USA",0.012868965575238067,0.0033665246677710885,0.009502440907466977
"Mayagüez-San Germán CSA, PR, USA",,,
"Joplin-Miami CSA, MO-OK, USA",-0.5027448087313153,-0.5281596140786372,0.025414805347321878
"Johnstown-Somerset CSA, PA, USA",-0.4424708931362752,-0.43900422964718055,-0.0034666634890946346
"Bloomington-Bedford CSA, IN, USA",0.02430666411254962,-0.004586837167280636,0.028893501279830258
"Morgantown-Fairmont CSA, WV, USA",-0.1934610765662127,-0.25797519659583135,0.06451412002961865
"Sioux City-Vermillion CSA, IA-SD-NE, USA",-0.23205525125028806,-0.2621309957248173,0.030075744474529237
"New Bern-Morehead City CSA, NC, USA",-0.2847749735490883,-0.30408444182592465,0.019309468276836328
"Jonesboro-Paragould CSA, AR, USA",-0.4465170926414742,-0.4080663269712398,-0.03845076567023442
"Elmira-Corning CSA, NY, USA",-0.2217641479005212,-0.2643573012094908,0.042593153308969595
"Rapid City-Spearfish CSA, SD, USA",-0.30486134128825415,-0.3710801164276183,0.06621877513936414
"Ithaca-Cortland CSA, NY, USA",0.32804334916864913,0.27654254133087003,0.051500807837779106
"Williamsport-Lock Haven CSA, PA, USA",-0.40181323898594223,-0.4227626252672098,0.02094938628126758
"Parkersburg-Marietta-Vienna CSA, WV-OH, USA",-0.4221905266355351,-0.45751059688810125,0.03532007025256617
"Jackson-Brownsville CSA, TN, USA",-0.19842074873987753,-0.2058813183720825,0.007460569632204983
"Cape Girardeau-Sikeston CSA, MO-IL, USA",-0.4945579831828784,-0.5175642454884329,0.023006262305554526
"Paducah-Mayfield CSA, KY-IL, USA",-0.43770462259333653,-0.46308025208093095,0.02537562948759442
"Edwards-Glenwood Springs CSA, CO, USA",0.2168719878890578,0.12908255111225506,0.08778943677680273
"Manhattan-Junction City CSA, KS, USA",-0.13214367804083363,-0.19581234017773613,0.0636686621369025
"Hot Springs-Malvern CSA, AR, USA",-0.3725433996323443,-0.35638748225986344,-0.016155917372480844
"Findlay-Tiffin CSA, OH, USA",-0.3620353159851295,-0.36766795379703604,0.005632637811906538
"Mankato-New Ulm-North Mankato CSA, MN, USA",-0.03720203988081586,-0.10286098339621536,0.0656589435153995
"Rome-Summerville CSA, GA, USA",-0.451177995280282,-0.46478443521321927,0.013606439932937253
"Moses Lake-Othello CSA, WA, USA",-0.3453756945376556,-0.37866760645307646,0.03329191191542086
"Kokomo-Peru CSA, IN, USA",-0.3783136030212811,-0.38599348534201905,0.007679882320737963
"Victoria-Port Lavaca CSA, TX, USA",-0.4052692461663605,-0.3945839937067028,-0.010685252459657735
"Quincy-Hannibal CSA, IL-MO, USA",-0.49104877237806915,-0.4906918792143062,-0.0003568931637629724
"Mount Pleasant-Alma CSA, MI, USA",-0.12686613265243027,-0.12297403395960442,-0.003892098692825849
"Richmond-Connersville CSA, IN, USA",-0.3587755965924117,-0.34946129573300727,-0.009314300859404434
"Dixon-Sterling CSA, IL, USA",-0.12558256419628716,-0.11355944583769396,-0.012023118358593196
"Pullman-Moscow CSA, WA-ID, USA",0.06909535686876317,0.04428096285021394,0.024814394018549228
"DeRidder-Fort Polk South CSA, LA, USA",-0.6614721189591091,-0.6512251269275644,-0.010246992031544666
"Columbus-West Point CSA, MS, USA",0.025380710659898907,0.003372870875257945,0.02200783978464096
"Martin-Union City CSA, TN-KY, USA",-0.5521714227957295,-0.5262353160544474,-0.025936106741282106
"Clovis-Portales CSA, NM, USA",-0.41314662121700335,-0.4319368078680412,0.01879018665103782
"Cleveland-Indianola CSA, MS, USA",0.35069370330843036,0.35808214499188734,-0.007388441683456981
"Oskaloosa-Pella CSA, IA, USA",-0.38804021412717005,-0.3618180539932506,-0.026222160133919425
"Steamboat Springs-Craig CSA, CO, USA",0.007949125596184192,-0.10048266783677039,0.10843179343295457
