"Ames IA HSA, Des Moines IA HRR, USA",6.559617310589432,0.6537144774068684,0.25070168776110263,0.07993606078968787,0.0006682000693160675,0.011921685722983239,0.00305788825004168
"Manahawkin NJ HSA, Camden NJ HRR, USA",6.007495062050771,0.8230877384373005,0.10833418908563536,0.01266101689946306,0.03558233148712647,0.0181281745590247,0.0022065495314498276
"Watsonville CA HSA, Santa Cruz CA HRR, USA",7.583451597362008,0.5025084360995397,0.2938667219344791,0.07398511951444149,0.0018804649254959358,0.05528014495448988,0.07247911257155408
"Hawthorne CA HSA, Los Angeles CA HRR, USA",11.443617265665674,0.6307278176553672,0.28583952943167473,0.014408508662399046,0.001142098487756869,0.0038214341578036094,0.06406061160499842
"Texarkana TX HSA, Texarkana AR HRR, USA",7.243091836939764,0.3564176460308399,0.6069435369515217,0.023789840446122968,0.0004841222158792014,0.008349487741579167,0.0040153666140569045
"Yuba City CA HSA, Sacramento CA HRR, USA",9.549558925243918,0.64665733095181,0.27168503621634504,0.02170536444099937,0.0027708541326216377,0.048101175440674146,0.009080238817549841
"Monroeville PA HSA, Pittsburgh PA HRR, USA",8.163136597384646,0.8077802553117278,0.13409056379264653,0.014040461452450314,0.034140048197602475,0.008896414670852025,0.00105225657472087
"Taylor TX HSA, Temple TX HRR, USA",7.299900807557115,0.4196863851805861,0.5110586329230024,0.05567448527932163,0.0010302272145531748,0.006581011718213726,0.005969257684322806
"Beckley WV HSA, Charleston WV HRR, USA",5.27923809374789,0.3344325371792393,0.5815781098928524,0.029490852709323223,0.00824634585550429,0.0432996901817885,0.0029524641812921763
"Dover NH HSA, Portland ME HRR, USA",5.496210270951574,0.21219449396598525,0.10927406345863247,0.14176331568967404,0.46528690483987223,0.06121453455683486,0.0102666874890012
"Anniston AL HSA, Birmingham AL HRR, USA",7.115088060607581,0.31942803824507143,0.5886165685994494,0.06503954967693597,0.0009863963244373301,0.020120668799086142,0.005808778355019822
"Grand Forks ND HSA, Grand Forks ND HRR, USA",5.122614698489439,0.38722135153828724,0.46417930260266493,0.09437354156359302,0.023166385899743836,0.022217643069061203,0.008841775326649905
"Menomonee Falls WI HSA, Milwaukee WI HRR, USA",7.251146406002039,0.7835381976740576,0.16698160699034512,0.02335099195851277,0.014035365589103727,0.010225468459160081,0.0018683693288206369
"Monroe MI HSA, Toledo OH HRR, USA",7.884776257956891,0.8151127778229215,0.09771070547186807,0.06084089514746713,0.004203058110996261,0.01868437675439179,0.003448186692355315
"Pittsfield MA HSA, Albany NY HRR, USA",5.541323681356342,0.40378834744095693,0.0957318427878269,0.10071259345286677,0.32606388609480774,0.07054863445707038,0.003154695766471319
"Texas City TX HSA, Houston TX HRR, USA",7.690377994673285,0.41811428184715344,0.5500536081547742,0.026644116617912793,0.0,0.002375802065964782,0.002812191314194856
"Columbus IN HSA, Indianapolis IN HRR, USA",7.617881879734809,0.44665455128008424,0.42731868962762226,0.08912607233522085,0.004183100501867962,0.027731859104002426,0.004985727151202256
"Minot ND HSA, Minot ND HRR, USA",4.7781904923236125,0.4367496048746549,0.36680968230725747,0.156635261732326,0.014801271958443428,0.0153313154675651,0.009672863659753169
"Mooresville NC HSA, Charlotte NC HRR, USA",7.199314262779834,0.4054266385606952,0.5491959524832363,0.023839886380890563,0.00949928429975216,0.00799985276191042,0.0040383855135152314
"Weatherford TX HSA, Fort Worth TX HRR, USA",7.00339816669866,0.1366183781007682,0.739341684523138,0.10302898116797476,0.0006057093641626465,0.01133031364185694,0.009074933202099532
"Port Chester NY HSA, White Plains NY HRR, USA",7.356899018525588,0.647485840563677,0.09152050944728732,0.017415093165936608,0.22881637268640087,0.009207402057895019,0.005554782078803205
"Jupiter FL HSA, Fort Lauderdale FL HRR, USA",6.43301306231915,0.03865358723296693,0.9299198008647109,0.0067139499878775466,0.0010865222129549518,0.00107705865284317,0.02254908104864663
"Loma Linda CA HSA, San Bernardino CA HRR, USA",11.733476873439162,0.6256491562359688,0.3433300114410902,0.00930340149408325,0.00022650439496535283,0.00768916096765763,0.01380176546623468
"Saratoga Springs NY HSA, Albany NY HRR, USA",6.5164535926571165,0.5308261126485461,0.1357589534763394,0.1358563877243777,0.14674004115243788,0.04581072169510416,0.005007783303194839
"Darby PA HSA, Philadelphia PA HRR, USA",7.431256797098861,0.7140040314636669,0.204944328867587,0.017453976900632103,0.05454117666282888,0.004068813904280905,0.004987672201004412
"Gulf Breeze FL HSA, Pensacola FL HRR, USA",7.361442281524219,0.07685648519995733,0.8912102304274155,0.01172869893307828,0.0,0.012516387022673372,0.00768819841687554
"Mankato MN HSA, Minneapolis MN HRR, USA",5.971101145473054,0.6735647066905104,0.16205969806041234,0.13183141384978392,0.007029895224159398,0.020116407625692376,0.005397878549441521
"Safety Harbor FL HSA, Clearwater FL HRR, USA",7.492528517544487,0.0191833007266198,0.9611946488014317,0.0027019138212267713,0.0008806959402622133,0.003180290895391326,0.01285914981506822
"Kenmore NY HSA, Buffalo NY HRR, USA",6.543849656862629,0.874734893586637,0.08744054309080995,0.01316672642534508,0.011563431052295776,0.006401463541538965,0.0066929423033732826
"St Cloud FL HSA, Orlando FL HRR, USA",7.004654591690191,0.014547346990107086,0.9355450660720209,0.014067454915204069,0.0015694397578475017,0.012614088251520713,0.021656604013299722
"Venice FL HSA, Sarasota FL HRR, USA",6.851550856654873,0.037830117145484544,0.9409099754585238,0.0036678824577781968,0.000778035672862042,0.002623091697077741,0.014190897568273483
"Cullman AL HSA, Birmingham AL HRR, USA",6.90984273947798,0.10930516420559083,0.7411211819461861,0.11406428756745893,0.005597340994283756,0.022748588884469623,0.007163436402010821
"Livermore CA HSA, Alameda Co. CA HRR, USA",7.820116191167384,0.6982467589634735,0.25414045852227446,0.02001007641327743,0.0013021015902187202,0.0227893607385203,0.003511243772235638
"Delray Beach FL HSA, Fort Lauderdale FL HRR, USA",6.8891237092742985,0.03774033509179681,0.9259485404684955,0.002729927477358466,0.004213886467714871,0.0009160622755901894,0.028451248219044337
"Havre De Grace MD HSA, Baltimore MD HRR, USA",6.996880751676558,0.2937660896480822,0.4071931220129536,0.09017211530897595,0.15570308333663402,0.0458791961337808,0.007286393559573417
"Lexington NC HSA, Winston-Salem NC HRR, USA",6.812143884345059,0.1525033526202765,0.7106780096766254,0.04683263233511936,0.05169446497968409,0.025234582280503737,0.013056958107791106
"Poplar Bluff MO HSA, St Louis MO HRR, USA",6.916098855554983,0.22459817089044404,0.5454068960954733,0.1607664361861251,0.00025713374043081957,0.06232350167456132,0.0066478614129652095
"Porterville CA HSA, Bakersfield CA HRR, USA",13.24459421748575,0.6755925933909561,0.18937423257311742,0.09005438269824302,3.896568268643435e-05,0.03157486127719589,0.01336496437780132
"Crystal River FL HSA, Ocala FL HRR, USA",6.888869700585454,0.01048574534558352,0.9603489352139637,0.014741170730243692,0.00029729407793301245,0.006794834541408415,0.007332020090867578
"Shelby NC HSA, Charlotte NC HRR, USA",6.763426860055937,0.19694808476424114,0.7143468053040576,0.03732991019104181,0.026335123597716774,0.018342683745715124,0.0066973923972277315
"Milford DE HSA, Salisbury MD HRR, USA",6.132750899305026,0.1276496793508705,0.49231805082293584,0.19870753572645766,0.1446482653903908,0.029732114567447312,0.0069443541418978145
"Rogers AR HSA, Springdale AR HRR, USA",6.6700647282050225,0.5454008114043861,0.34237373406122534,0.06954415443957582,0.0001769696827134487,0.040753789753556695,0.0017505406585425765
"Newton MA HSA, Boston MA HRR, USA",6.259992004189331,0.7144201513412487,0.09813998935542068,0.023025527401197243,0.15535721779687287,0.00688670473847285,0.002170409366787775
"Benton AR HSA, Little Rock AR HRR, USA",7.199665482004847,0.40474033879275495,0.542298232690668,0.03262214262565046,0.0002615640091948462,0.018332399552075343,0.0017453223296562367
"San Marcos TX HSA, Austin TX HRR, USA",7.41317449016338,0.16654538110388062,0.7887820565552793,0.0396853704807453,0.00029599892151108896,0.004276794448468249,0.0004143984901155244
"Downers Grove IL HSA, Hinsdale IL HRR, USA",8.693103617814055,0.8360563784537418,0.14408060604386094,0.008647860986101702,0.00030363331342216337,0.005147720705515077,0.005763800497358355
"Blacksburg VA HSA, Roanoke VA HRR, USA",5.674844095100825,0.16763843396208186,0.7463523051419823,0.01771040092112776,0.03122983358698748,0.031207556540573396,0.0058614698472472925
"Sewickley PA HSA, Pittsburgh PA HRR, USA",8.104011053778823,0.8152515632167165,0.1362705480843495,0.013211580549581632,0.027005081898451282,0.005309148335707047,0.0029520779151939345
"West Allis WI HSA, Milwaukee WI HRR, USA",7.576362573912627,0.7883587900138626,0.17030553585603378,0.012155727604784217,0.009263781486072344,0.016163565571391963,0.003752599467855131
"Ridley Park PA HSA, Philadelphia PA HRR, USA",7.358633645020456,0.6649217539559621,0.20419958625973386,0.012879597217263195,0.10295363616534088,0.010144827942670584,0.004900598459029637
"Portsmouth OH HSA, Columbus OH HRR, USA",6.8935693947746435,0.34173790685705646,0.41352524552323205,0.17074410990237462,0.01715507989724277,0.05428856520728985,0.0025490926128040833
"Conyers GA HSA, Atlanta GA HRR, USA",7.741091261144222,0.5117959894761862,0.4528085271717893,0.024422284091392087,0.0002864434921914804,0.006057107873553536,0.004629647894887338
"Newburgh NY HSA, White Plains NY HRR, USA",6.666460056423776,0.3691996646853269,0.1700674908985733,0.06971194779915486,0.36418298171654945,0.024651942480006392,0.002185972420389112
"Willingboro NJ HSA, Camden NJ HRR, USA",7.066490617790997,0.7379839146734338,0.2017454486094761,0.010227210779196643,0.03641009688771839,0.007812848809957064,0.005820480240218013
"Wylie TX HSA, Dallas TX HRR, USA",7.9530833502962865,0.39103832061990623,0.5627494340385341,0.03685415693057163,0.0003628402046553607,0.006350617928767968,0.0026446302775646542
"Griffin GA HSA, Atlanta GA HRR, USA",7.3419661974989685,0.32816239596004865,0.5104258789973317,0.14625991831862117,0.0003594817813508085,0.010688241272225755,0.004104083670421733
"San Pedro CA HSA, Los Angeles CA HRR, USA",9.765679189873895,0.7178993973316186,0.21982201445933536,0.007816361330414997,0.0,0.0037027946196645754,0.050759432258966466
"Glenwood Springs CO HSA, Grand Junction CO HRR, USA",4.63355401892071,0.6500072448126442,0.2159711024729731,0.07751234011953888,0.0003995360855973189,0.05504890656061341,0.0010608699486331094
"Lapeer MI HSA, Flint MI HRR, USA",7.005528810861008,0.6098680973490619,0.08263530049578895,0.21463585821476638,0.02174878453152207,0.06733283993259419,0.003779119476266552
"Orangeburg SC HSA, Columbia SC HRR, USA",6.51253660744596,0.07735920741152055,0.813747552386241,0.0835841833006983,0.003974632492620627,0.012479177017272152,0.00885524739164744
"Quincy IL HSA, Springfield IL HRR, USA",7.1699590861682125,0.5429545638253125,0.30650848779552736,0.11351034132883729,0.0020383957639088838,0.026720808321134642,0.00826740296527932
"Willimantic CT HSA, Hartford CT HRR, USA",5.978757391122017,0.09711833707422879,0.17816705641256772,0.09617899669740725,0.5531566234462131,0.07225843338693475,0.00312055298264842
"Hanover PA HSA, York PA HRR, USA",7.481957193042937,0.5407438511016199,0.2283033946558773,0.07629401719108828,0.10573634746164988,0.04303931972652127,0.005883069863243339
"Tulare CA HSA, Bakersfield CA HRR, USA",12.786597044738155,0.7415777674654579,0.16500126957681574,0.05747627730912358,0.0038628057871786564,0.01859642780937257,0.013485452052051431
"Camarillo CA HSA, Ventura CA HRR, USA",9.010783155570046,0.7287202653570327,0.22579696998510973,0.01820599058986999,0.00044543543062816013,0.010202905516724542,0.01662843312063474
"Elmira NY HSA, Elmira NY HRR, USA",5.929141029344043,0.6817154658089246,0.14046666894423923,0.06864186582712711,0.055967914106578795,0.04989509674703561,0.003312988566094831
"Smyrna GA HSA, Atlanta GA HRR, USA",8.128109909428321,0.6031323074925872,0.37770750168603345,0.015446444755690238,0.0015952423874298707,0.0005731126154365033,0.0015453910628226877
"Plattsburgh NY HSA, Burlington VT HRR, USA",5.415906314228771,0.11146686014966654,0.29830888401000855,0.08064998494734586,0.4152972126956804,0.0894565644734729,0.004820493723825748
"Rahway NJ HSA, Newark NJ HRR, USA",7.339735080002014,0.742509567564218,0.13326473289795884,0.025470651962256053,0.07641695783896074,0.008812912598612636,0.01352517713799373
"Richland WA HSA, Spokane WA HRR, USA",6.284779139752836,0.19382386958645353,0.779828198642978,0.004017464297266577,0.001978969507843769,0.01818040396656116,0.0021710939988969545
"Pittsburg CA HSA, Contra Costa Co. CA HRR, USA",8.733892967940223,0.6063173447958803,0.3315955305458148,0.010713088436127956,0.001282807001372701,0.03234313190287813,0.01774809731792597
"Janesville WI HSA, Madison WI HRR, USA",6.752021871129045,0.7119827282687028,0.19449845125558993,0.059531361679140464,0.008139309039194305,0.02151907610092082,0.004329073656451681
"Phenix City AL HSA, Columbus GA HRR, USA",7.494595604237819,0.1262723507119903,0.8284496298765042,0.033686399616222606,0.0011581823140370804,0.0044901335013185694,0.005943303979927127
"New Albany IN HSA, Louisville KY HRR, USA",7.812676294698747,0.4117429744201824,0.44360425494345646,0.11165333268976335,0.01093038026630247,0.020807003973433446,0.001262053706862017
"Marshfield WI HSA, Marshfield WI HRR, USA",5.610066490971946,0.42355863013374867,0.11060631334772153,0.267842660573837,0.054591369173400336,0.13670693593676955,0.006694090834523039
"Corvallis OR HSA, Eugene OR HRR, USA",5.892104534882268,0.34968442378477205,0.5591504957775566,0.017242541586614427,0.003491144231680089,0.06081123476832563,0.009620159851051328
"Coatesville PA HSA, Lancaster PA HRR, USA",7.406599144709905,0.24317981719888385,0.29280290638130674,0.1640915389427288,0.2556690667182484,0.04112779146057999,0.0031288792982522126
"Oak Ridge TN HSA, Knoxville TN HRR, USA",6.801905069994494,0.43326367686779504,0.5197646327014849,0.01961599074533279,0.0006646878544572738,0.024277258476283956,0.002413753354646097
"Lancaster OH HSA, Columbus OH HRR, USA",7.499252532786693,0.5574300681123645,0.28904524965934525,0.08983590620589268,0.023539520010303218,0.03482017368920744,0.005329082322886972
"Wheeling WV HSA, Pittsburgh PA HRR, USA",7.095173325880623,0.5726189340100658,0.27255159607429846,0.05638830673012978,0.05615089541684404,0.039643609462484665,0.0026466583061771675
"Greer SC HSA, Greenville SC HRR, USA",7.119279493009557,0.43699864310277226,0.5286851353638711,0.020902761318795992,0.00745119258899261,0.0035775655133559927,0.002384702112212007
"Grand Prairie TX HSA, Dallas TX HRR, USA",8.340276142238679,0.27783262491728955,0.7009420098924029,0.008664403373164027,0.0,0.002689614715347999,0.009871347101795625
"Williamsport PA HSA, Danville PA HRR, USA",6.64400236686793,0.3934169911993943,0.239980981311892,0.05308636746723743,0.21061244666350512,0.09731066759870989,0.005592545759261176
"Mason City IA HSA, Mason City IA HRR, USA",6.134347828168294,0.6248582022189926,0.16332962566117445,0.18761795974962456,0.004545337770510154,0.014502025373185413,0.005146849226512941
"Natrona Heights PA HSA, Pittsburgh PA HRR, USA",7.758485040867442,0.7924352500959092,0.09591140248977308,0.024619555167278033,0.06358691152276057,0.020301639589565736,0.003145241134713467
"Smithfield NC HSA, Raleigh NC HRR, USA",6.637184523208991,0.08175387799167509,0.7657403197130476,0.12623281924215538,0.007917902666006138,0.014954419493384571,0.003400660893731158
"Melrose MA HSA, Boston MA HRR, USA",6.173119868133495,0.5413451087225384,0.14083665121996308,0.02488378430798117,0.2820529802067145,0.006337562678775263,0.004543912864027546
"Fort Walton Beach FL HSA, Pensacola FL HRR, USA",7.2951007442403535,0.2608783975578221,0.7096344707246708,0.013650443100663734,0.00025846557131937775,0.0042606653677748725,0.0113175576777491
"Hazleton PA HSA, Allentown PA HRR, USA",6.177587216849229,0.26068026105222825,0.2710195040786178,0.03637366790619763,0.3579272873557129,0.07013606892912051,0.0038632106781228614
"Hammond IN HSA, Munster IN HRR, USA",8.755243233423018,0.8634564248359319,0.11179133681452309,0.006421996600750507,0.007206764887777491,0.0037796257646821006,0.007343851096334819
"Falmouth MA HSA, Boston MA HRR, USA",5.193259007198628,0.6011599467830395,0.09358936473286525,0.03224273239108576,0.25485969638983974,0.013134034526452733,0.005014225176716852
"San Clemente CA HSA, Orange Co. CA HRR, USA",8.785426332266137,0.7263821475347635,0.21288002465294556,0.021569438051576392,0.0005889316151451517,0.011256005200591272,0.027323452944978146
"Grass Valley CA HSA, Sacramento CA HRR, USA",7.714273831168381,0.2892201196754581,0.15034220923203565,0.39800362129088007,0.009334202169484268,0.1496210074202511,0.0034788402118909245
"Easley SC HSA, Greenville SC HRR, USA",6.913063129948977,0.37265676212040216,0.5652850225092505,0.027398429852560025,0.01429422804392089,0.012596977683456361,0.00776857979041
"Banning CA HSA, San Bernardino CA HRR, USA",8.4417005490883,0.7799487321645879,0.16448662638623607,0.02401399066702159,0.0,0.02588897619026886,0.0056616745918855686
"Carmel NY HSA, New Haven CT HRR, USA",6.529812961582709,0.1081161619439458,0.23569838013453362,0.045391254399158185,0.574917400211498,0.031203280136904727,0.00467352317395974
"Lees Summit MO HSA, Kansas City MO HRR, USA",7.392316490865508,0.717120774203473,0.23469643842335342,0.04022954486749227,0.0,0.007149995851071096,0.0008032466546102565
"Casper WY HSA, Casper WY HRR, USA",5.2428498477468395,0.7259595328519545,0.19035618230547413,0.04023767890250652,0.0009920322390957594,0.038747367399565094,0.0037072063014038955
"Morristown TN HSA, Knoxville TN HRR, USA",6.608555847228591,0.11000155142011352,0.8208794545436459,0.029958771306574115,0.006908909351216304,0.03029880485491786,0.0019525085235322214
"Statesboro GA HSA, Savannah GA HRR, USA",6.6251029790504035,0.05426631403452366,0.9041918259598567,0.028763780304777706,0.0023783338832462633,0.00466311183434129,0.005736633983254395
"Springfield OR HSA, Eugene OR HRR, USA",6.746485422533106,0.1313354852859158,0.7943292184174559,0.011078800545212404,0.0029102565409690404,0.05578181329482834,0.004564425915618697
"Chillicothe OH HSA, Columbus OH HRR, USA",7.092886552836778,0.30193948575701096,0.4679462513011894,0.13170960481479208,0.04654822384428302,0.049517580600966817,0.002338853681757618
"Kalispell MT HSA, Missoula MT HRR, USA",7.262771854608445,0.3785502979486465,0.3763580435169902,0.1026476410466401,0.004808697410535129,0.13350005829059966,0.0041352617865884475
"Somerset KY HSA, Lexington KY HRR, USA",6.59772164581536,0.08674678005535356,0.7976841585578784,0.040611638372482314,0.014938502295357823,0.055167992685590674,0.004850928033337227
"Winder GA HSA, Atlanta GA HRR, USA",7.252262818691393,0.2762891649219047,0.6686403265287602,0.03735335333163692,0.003392473403407842,0.007525724142652717,0.006798957671637661
"Cottonwood AZ HSA, Phoenix AZ HRR, USA",5.77867277484949,0.43032423443123236,0.38631459787734357,0.12858260900954313,0.003150874800728388,0.050388878403943085,0.0012388054772094514
"Woodland CA HSA, Sacramento CA HRR, USA",8.0403823151052,0.5592217809626236,0.3147150452229155,0.04687224100222785,0.003093722466448691,0.07117286278700503,0.004924347558779202
"Petaluma CA HSA, Santa Rosa CA HRR, USA",7.854121457427553,0.6926991639871487,0.20915516528439487,0.06029919440103081,0.0012050390627759294,0.03132938572556987,0.005312051539079784
"Newton NJ HSA, Morristown NJ HRR, USA",6.375475202402248,0.15852481506335367,0.13050224766068577,0.1260490618337887,0.5202566194259386,0.06170316981754411,0.0029640861986891076
"Huntsville TX HSA, Houston TX HRR, USA",7.239351191051671,0.10141608990142131,0.8049708732457126,0.06821397389210417,0.001258605493012882,0.011927260560875945,0.012213196906873138
"Wooster OH HSA, Canton OH HRR, USA",7.457764118476488,0.6292841896776427,0.19294204416572952,0.07860129822590842,0.027910000654793772,0.06998742875935693,0.0012750385165687702
"Marysville CA HSA, Sacramento CA HRR, USA",9.610751943401318,0.5326650611319858,0.2766146855027721,0.10249589667022814,0.0007927061007016776,0.0812359709084308,0.006195679685881577
"Methuen MA HSA, Boston MA HRR, USA",6.1338039849697825,0.4409025219847596,0.09809156990888027,0.10416376214121668,0.3312615571332976,0.02217727060401815,0.0034033182278275995
"Delano CA HSA, Bakersfield CA HRR, USA",12.47254961496881,0.5620770675604861,0.3542530257708844,0.03135044824758116,0.0,0.017113322087647646,0.03520613633340064
"Oregon OH HSA, Toledo OH HRR, USA",7.855225174276118,0.6966410160499782,0.1835824799564125,0.08988972007937593,0.006446746907782831,0.019540562182882824,0.003899474823567635
"Laurel MS HSA, Hattiesburg MS HRR, USA",7.12733442929191,0.26049680877077896,0.6083959445406308,0.11159998077409361,0.0002305275054685727,0.01260881991409613,0.0066679184949319835
"Midland MI HSA, Saginaw MI HRR, USA",6.143745124800228,0.6862777860594458,0.10523632329174439,0.1419371227818298,0.00629978064386576,0.057421179077668826,0.0028278081454452806
"Cartersville GA HSA, Atlanta GA HRR, USA",7.662308572722241,0.2753998647914355,0.6361298832904616,0.07055291620426021,0.0027299057355644122,0.010287009067582288,0.00490042091069599
"Howell MI HSA, Ann Arbor MI HRR, USA",7.255724780399981,0.7127868803712553,0.10361210564221437,0.12535916089963947,0.021618697696092,0.033671370584455025,0.002951784806343754
"Oxford MS HSA, Oxford MS HRR, USA",6.8909498381412835,0.23222485126346487,0.5432727749146435,0.1972899064845708,0.0,0.02450644936081529,0.00270601797650555
"Somerville MA HSA, Boston MA HRR, USA",6.091309659383026,0.7017481681136963,0.1732772043979072,0.03133400027289622,0.07264984041687791,0.006556047169556364,0.014434739629065836
"Manhattan KS HSA, Topeka KS HRR, USA",6.5958334863767085,0.4912660822442688,0.3948596165348076,0.0927466034590722,0.002216013034915846,0.017292247013418548,0.0016194377135169522
"Enid OK HSA, Oklahoma City OK HRR, USA",6.759877149874413,0.586013402272667,0.3129262971061243,0.07909130938692431,0.0045674084276767345,0.013814489864604165,0.003587092942003545
"Jeannette PA HSA, Pittsburgh PA HRR, USA",7.968639101709325,0.7887937645765741,0.10680374883618829,0.006518319343806355,0.07862834498573737,0.016556891860973328,0.00269893039672058
"Long Branch NJ HSA, Camden NJ HRR, USA",6.559243995813419,0.779813677367712,0.16133255047260928,0.014265883045755864,0.035352318386225406,0.006656272026218525,0.0025792987014789273
"Danville IL HSA, Urbana IL HRR, USA",7.570929661758956,0.5701354760066728,0.29169090024547106,0.11104000156554035,0.00140242063795961,0.020663064835802936,0.005068136708553297
"Paris TX HSA, Dallas TX HRR, USA",6.864569037443816,0.23311831806821917,0.590734838013921,0.14434519771613485,0.003445303232669028,0.02580664455893339,0.0025496984101223714
"Arlington MA HSA, Boston MA HRR, USA",6.180256768156912,0.5567087879691446,0.12268669637615134,0.035905302253843016,0.2696412580450001,0.009785783903115077,0.005272171452745816
"Kinston NC HSA, Greenville NC HRR, USA",6.1473547651754386,0.1180691474930988,0.7102289696441724,0.14844780515852476,0.012216051220696866,0.00483921580470155,0.00619881067880569
"Oak Park IL HSA, Melrose Park IL HRR, USA",8.491181214364335,0.775330111870886,0.17721062879935368,0.0156552140542151,0.0018144187482275495,0.01456741262055318,0.015422213906764449
"Muskogee OK HSA, Tulsa OK HRR, USA",7.083251594031861,0.33196079806775924,0.5363928324375187,0.10366686262651481,0.001006556072760332,0.024856982376695074,0.0021159684187519166
"Kearny NJ HSA, Newark NJ HRR, USA",7.6433677563989395,0.7276590713792372,0.17110687649705184,0.03942355575695054,0.04598853728778344,0.005791436130735338,0.01003052294824154
"Suffolk VA HSA, Norfolk VA HRR, USA",5.970247622586731,0.21937773767042226,0.6214855672815884,0.08350733885640986,0.05251797840783213,0.019345509813925573,0.0037658679698217355
"Beaufort SC HSA, Savannah GA HRR, USA",6.9039133916053235,0.08197205487093025,0.8641278099160796,0.042157352200705545,0.003591279457222888,0.0035574028397884006,0.0045941007152732515
"Medina OH HSA, Cleveland OH HRR, USA",7.849707093564132,0.7096804110946606,0.17851330211781358,0.05361433188697679,0.025414780657832727,0.02867335406054976,0.0041038201821665
"Fort Oglethorpe GA HSA, Chattanooga TN HRR, USA",7.169558526749551,0.12797481879254555,0.7821774487123181,0.05908372114461097,0.0014228024676107244,0.02333382068633599,0.006007388196578612
"Quincy MA HSA, Boston MA HRR, USA",5.994511779518869,0.521070754694161,0.2783075279863902,0.025146378599297158,0.1631617657080098,0.005389203063050362,0.006924369949091369
"Washington PA HSA, Pittsburgh PA HRR, USA",7.301594663487,0.5842804351315619,0.2417325885960563,0.027012325796654364,0.0996389917164134,0.043737201834583773,0.003598456924730225
"Athens AL HSA, Huntsville AL HRR, USA",7.014509518765964,0.1281210337825108,0.7890677019502169,0.06505469813076288,0.003458824405817189,0.009864464354516012,0.004433277376176198
"Richmond IN HSA, Indianapolis IN HRR, USA",7.39069764962242,0.4747057232659572,0.2807824989588182,0.13602449727664126,0.05033405639246272,0.05144503088347928,0.006708193222641326
"Pine Bluff AR HSA, Little Rock AR HRR, USA",7.227501672014993,0.3824017624531302,0.5379386628769954,0.06116844562428175,0.00020766005536794195,0.011825533747232842,0.006457935242991763
"La Grange GA HSA, Atlanta GA HRR, USA",7.18861965448636,0.1623006033932365,0.718370823856586,0.09917717349008645,0.0002669359347522356,0.013424856551392307,0.0064596067739464405
"Ormond Beach FL HSA, Ormond Beach FL HRR, USA",7.547315892974066,0.011532525372495992,0.9698869350230802,0.005493084002565199,0.005664290602764911,0.000897313362814243,0.0065258516362795265
"De Kalb IL HSA, Rockford IL HRR, USA",7.054135281639277,0.7070448360285018,0.22850245277405837,0.05376929008168939,0.002593224701089243,0.005082276878961602,0.0030079195356997527
