"Three Rivers MI HSA, Kalamazoo MI HRR, USA",6.926772639481948,0.5649788019168962,0.09718342482322359,0.22954770111291672,0.020891043311376284,0.07969486952699092,0.007704159308596322
"Greencastle IN HSA, Indianapolis IN HRR, USA",7.610464658154656,0.2653703504867761,0.37125608702594765,0.23783961555942396,0.035273865052691006,0.07786781032914607,0.012392271546015146
"Villa Rica GA HSA, Atlanta GA HRR, USA",7.539076063323969,0.36019583290961643,0.5331534548559532,0.07189954902585681,0.006860446396856716,0.01681163664318901,0.01107908016852787
"Columbia City IN HSA, Fort Wayne IN HRR, USA",7.456194250854814,0.47254656704186265,0.25523060268305,0.18481592271370814,0.01577339494806245,0.06191857596174782,0.009714936651568869
"Cortez CO HSA, Albuquerque NM HRR, USA",4.193663237307341,0.38124618801697446,0.1266444178803881,0.2978137978070964,0.006141819544151654,0.18813751496608588,1.6261785303634535e-05
"Centralia IL HSA, St Louis MO HRR, USA",7.472085150010006,0.508222379341333,0.2828984856683667,0.179415720666518,0.0019861944970372683,0.02468711229971378,0.002790107527031417
"Newark NY HSA, Rochester NY HRR, USA",5.874470765605844,0.48929815282358696,0.15657410996648718,0.14446500418232153,0.11588503467764034,0.08851045924734041,0.005267239102623521
"Wareham MA HSA, Boston MA HRR, USA",5.5353795875973715,0.3768350262498565,0.10437569017142748,0.09316057035496587,0.4021681187943872,0.02102806340507261,0.002432531024290448
"Georgetown OH HSA, Cincinnati OH HRR, USA",7.40230379243461,0.16948675772319172,0.5973244006419636,0.09919365446323448,0.024266144766624278,0.10593918478740229,0.0037898576175837604
"Delta CO HSA, Grand Junction CO HRR, USA",5.062376317071378,0.4655978786705073,0.18569129483891558,0.18294000475386477,0.0006420124943201374,0.15838767805203072,0.006741131190361444
"Guntersville AL HSA, Huntsville AL HRR, USA",6.82560867848425,0.2868670342684925,0.6472962247044814,0.04869740934772448,0.0007524584639693383,0.010701631487563932,0.005685241727768343
"Brooksville FL HSA, Hudson FL HRR, USA",6.961065844517723,0.01264589490324304,0.953572814007726,0.020419058250503608,0.0,0.0035231871685721767,0.009839045669955132
"Mishawaka IN HSA, South Bend IN HRR, USA",7.316804253489199,0.8171098322981515,0.1530651918101814,0.014323710214947778,0.0018189511280977536,0.006699735478709579,0.0069825790699119955
"Astoria OR HSA, Portland OR HRR, USA",4.245044389956624,0.46376557678864433,0.379257285327433,0.025547912743930867,0.03811578609753639,0.08802267684391889,0.00529076219853651
"River Falls WI HSA, St Paul MN HRR, USA",6.531088128769355,0.5516568011921902,0.17639748532945124,0.22011636541334514,0.008273282053096517,0.03597998046087906,0.007576085551038024
"Medina NY HSA, Buffalo NY HRR, USA",5.702496405055334,0.4857756628007749,0.11178648522352279,0.1823423598040504,0.14018350709741215,0.0775215091083069,0.0023904759659328554
"Needham MA HSA, Boston MA HRR, USA",6.227438548577978,0.5286564790084851,0.12016141594988573,0.01574838924567853,0.3258973935984589,0.005487883528745253,0.004048438668746498
"Farmville VA HSA, Richmond VA HRR, USA",6.274250806712126,0.014714874630032054,0.6843349041328968,0.11025308572111107,0.09049754897806232,0.08958826760926365,0.010611318928634261
"Jesup GA HSA, Savannah GA HRR, USA",6.708478647324626,0.06974547814634423,0.8879345705749441,0.03332979050573401,0.0,0.0010466832869734848,0.00794347748600417
"Bolivar MO HSA, Springfield MO HRR, USA",6.519062611918901,0.050202021335599256,0.6439672367755982,0.20757536093970114,0.010122555274080347,0.08682319158803385,0.0013096340869872486
"Austin MN HSA, Rochester MN HRR, USA",5.9147552465293,0.6973731269244163,0.17283144431226297,0.09960557008159193,0.005993815915811383,0.01644494069797623,0.007751102067941103
"Mitchell SD HSA, Sioux Falls SD HRR, USA",5.256815198328317,0.3734226040985452,0.36275493709960577,0.19332466871551612,0.027351942911918153,0.03613664391270639,0.007009203261708221
"Valley AL HSA, Birmingham AL HRR, USA",7.2982294181723475,0.18330178279348291,0.7449559823399916,0.056112006086729144,2.9206730337045782e-05,0.008823413064998552,0.006777608984460744
"Portage WI HSA, Madison WI HRR, USA",6.53777735521673,0.463937929074284,0.17915483148047479,0.24051094034712545,0.013399961720658951,0.0926671296911692,0.01032920768628757
"Beeville TX HSA, Corpus Christi TX HRR, USA",7.137395165133776,0.1594308884468267,0.7816536272547291,0.053865363100862866,0.0004941572021379529,0.0024532113821618406,0.0021027526132815807
"Taos NM HSA, Albuquerque NM HRR, USA",4.452286772094417,0.508707446238171,0.07689635520414426,0.1509642773726076,0.0036149796991899277,0.2596447995954496,0.00017214189043761565
"Safford AZ HSA, Tucson AZ HRR, USA",6.191841892061881,0.5504015506734987,0.36358025522709997,0.03425172337344001,0.0033990912274231306,0.04386858228577229,0.00449879721276591
"Kenansville NC HSA, Greenville NC HRR, USA",5.996950403541461,0.019350932713508524,0.7408582146624754,0.22227557124423206,0.005349488374127932,0.005914879671251978,0.006250913334404192
"Bardstown KY HSA, Louisville KY HRR, USA",7.309970221113647,0.1905318237991329,0.7286712062120461,0.04921438951717085,0.008245002703567442,0.018473717007193517,0.004863860760889281
"Marion VA HSA, Kingsport TN HRR, USA",5.246698031931712,0.08497979687121097,0.669869041616858,0.040028207526349155,0.11472610085204424,0.08709321689289018,0.0033036362406473853
"Whitefish MT HSA, Missoula MT HRR, USA",7.375172652784111,0.4779680463226751,0.33458113325867156,0.08235841885079521,0.010620801981271594,0.09058136561109761,0.0038902339754888016
"Port Townsend WA HSA, Seattle WA HRR, USA",5.1251411550686905,0.02242014370870846,0.6457552373439556,0.17727912218923322,0.018887300514777057,0.13369554270578077,0.0019626535375448363
"Angola IN HSA, Fort Wayne IN HRR, USA",7.147421589235459,0.5790396616053577,0.14216513864931374,0.23380033737179143,0.0031552430524709315,0.03781681353076364,0.004022805790302541
"Brattleboro VT HSA, Lebanon NH HRR, USA",5.554491655523852,0.022370453597324255,0.06894547047866494,0.13934260619081745,0.577004918352941,0.19179329224432998,0.000543259135922411
"Sheridan WY HSA, Billings MT HRR, USA",5.302368388605988,0.5386491696397661,0.22328628341728685,0.17631003534013784,0.0005341480537660443,0.05778655463197584,0.003433808917067426
"Shawano WI HSA, Appleton WI HRR, USA",5.583459433728803,0.47984173229517746,0.09858844848184208,0.27291562316002876,0.02854307444193938,0.11441597357850572,0.0056951480425065665
"New Castle IN HSA, Indianapolis IN HRR, USA",7.576957033612526,0.5992530988888278,0.24049504167717084,0.11733753265225175,0.013819144134759589,0.025230316159197182,0.003864866487792828
"Sylacauga AL HSA, Birmingham AL HRR, USA",7.210882944193926,0.2323793571624802,0.6327060566267969,0.1067827353655561,0.008517433674225753,0.017339010734558714,0.002275406436382563
"Marshall TX HSA, Shreveport LA HRR, USA",7.183473335772367,0.39981293098615917,0.5667367842016352,0.025957799152976923,0.0,0.006857510314722299,0.0006349753445065669
"Skowhegan ME HSA, Bangor ME HRR, USA",4.706458275788333,0.007387716996306386,0.05384704570397361,0.09853437568140927,0.623472231407417,0.21202657654547688,0.004732053665416761
"Hibbing MN HSA, Minneapolis MN HRR, USA",4.77582040749108,0.4886330972755547,0.17539916102428396,0.15542581484617415,0.06291751547906795,0.10058862091656279,0.017035790458356504
"Dinuba CA HSA, Fresno CA HRR, USA",13.40648892239911,0.6361434171700506,0.27708721727029695,0.04915812725695077,0.0,0.03266174929170023,0.004949489011001519
"Smithville MO HSA, Kansas City MO HRR, USA",7.194492795842331,0.3848993253298343,0.4446790918831033,0.14323280647088682,0.0018896512764296901,0.021537128330959422,0.003761996708786523
"Hartsville SC HSA, Columbia SC HRR, USA",6.507439336128909,0.06081601085068107,0.8816007040751014,0.041490139900637046,0.004693834008960951,0.009806760340150565,0.001592550824468891
"Waynesburg PA HSA, Morgantown WV HRR, USA",6.927335610873752,0.5485185059208052,0.2125625243098589,0.04558873404502467,0.13052672681244018,0.05526273383295883,0.007540775078912106
"Russellville AL HSA, Birmingham AL HRR, USA",6.641119545231148,0.30258836679473966,0.6129865696123833,0.07083008493262538,0.002915860848251589,0.009608269074406827,0.001070848737593192
"Franklin NC HSA, Asheville NC HRR, USA",5.300764501763482,0.042092215580895154,0.6548867299068454,0.1877366832776528,0.03652129822457078,0.0698009808097094,0.008962092200326436
"Emporia VA HSA, Richmond VA HRR, USA",6.174515401910566,0.04258768888753449,0.6760425355310529,0.13286059121033209,0.0949682324600496,0.04562847849774045,0.00791247341329076
"Hartselle AL HSA, Birmingham AL HRR, USA",6.978418401747006,0.14652680185020037,0.7710347728537307,0.06506214257529223,0.0007132791191012704,0.011150064133692832,0.005512939467982543
"Lake Forest IL HSA, Evanston IL HRR, USA",7.833588747393738,0.8303112781086331,0.1578462229489354,0.0053737377247511445,0.0002560560311116988,0.004932425031010009,0.001280280155558494
"Cheraw SC HSA, Florence SC HRR, USA",6.646540439118897,0.10835789976894271,0.7544418771412635,0.09218388972990205,0.021671579953788555,0.015456935702334484,0.007887817703768639
"Bay City TX HSA, Houston TX HRR, USA",6.892623355869552,0.22867012206305118,0.6788776349370695,0.06565049675093801,0.006973463149783051,0.0020389114372440496,0.017789371661914063
"Vernal UT HSA, Salt Lake City UT HRR, USA",4.996750147426854,0.6022053106851525,0.19531410294579185,0.12120779269968976,1.6952041729747902e-05,0.07453385849232853,0.00672198313530768
"Jackson KY HSA, Lexington KY HRR, USA",6.23195243050334,0.11861455826465235,0.5581642646076403,0.10380263139699893,0.08269672807440584,0.133814528569145,0.002907289087157459
"Price UT HSA, Salt Lake City UT HRR, USA",5.273667394963451,0.7596752827105533,0.11321839195880462,0.06469975840160117,0.002533214953184919,0.059555271428350445,0.00031808054750548923
"Mountain Home ID HSA, Boise ID HRR, USA",6.608525554192898,0.5075351527736989,0.37153938811990844,0.05035713104483657,0.0017119055476221287,0.06689706742070536,0.001959355093228757
"Luling LA HSA, New Orleans LA HRR, USA",8.28498017244939,0.3156775565435917,0.6749468393582061,0.004252851343514405,0.0,0.0022230813841098026,0.0028996713705780035
"Lebanon KY HSA, Louisville KY HRR, USA",6.924725176272099,0.20030585531945444,0.6074845183169094,0.1115574229134187,0.0037641047991255603,0.07611832557075193,0.0007697730803399118
"Fulton NY HSA, Syracuse NY HRR, USA",5.7439946270980835,0.41479590314181064,0.1479287434713939,0.20185120715294105,0.11056756894652577,0.12326688572106725,0.00158969156626144
"Clearlake CA HSA, Napa CA HRR, USA",6.7165859071353236,0.054361637630936294,0.3986389375598902,0.2735395407272973,0.10061576977645188,0.17143455296623614,0.0014095613391880812
"Murphy NC HSA, Atlanta GA HRR, USA",5.812650182002579,0.02646983916708372,0.6087978433454161,0.24044169958980655,0.036795687091683654,0.0871217071782824,0.0003732236277277225
"Mount Sterling KY HSA, Lexington KY HRR, USA",6.688302778532968,0.26763629984113113,0.6387351583397297,0.05455153379547771,0.004008294777857057,0.031757513211922654,0.0033112000338819175
"Cleveland MS HSA, Memphis TN HRR, USA",6.916365462208522,0.4652952462959747,0.426250387423563,0.09875481103148487,0.007988894108209828,0.001081678680305281,0.0006289824604623267
"Springfield VT HSA, Lebanon NH HRR, USA",5.037956713586595,0.022015951921721417,0.04576748771106734,0.14068418570965702,0.6076254850545276,0.18270709171292968,0.001199797890096942
"Grenada MS HSA, Oxford MS HRR, USA",6.709754892546,0.3145709848535415,0.4343230040364755,0.2291537568622788,0.0008766164182050141,0.019906144973064796,0.0011694928564342445
"De Funiak Springs FL HSA, Pensacola FL HRR, USA",6.910924881626199,0.034820982214593364,0.8935840466696899,0.04244770459816442,0.0,0.024836968603805694,0.0043102979137466255
"Bedford OH HSA, Cleveland OH HRR, USA",7.837561647281271,0.7279453627513367,0.22630264896498667,0.013693799944233694,0.00777936296834791,0.01419163431433633,0.010087191056758671
"Henderson TX HSA, Tyler TX HRR, USA",7.092616328792479,0.3379971039748539,0.5710179036203011,0.06587075043819075,0.0,0.020688173425294713,0.004426068541359372
"Healdsburg CA HSA, Santa Rosa CA HRR, USA",7.363863723165875,0.6054733641134618,0.209824074997174,0.104769425450012,0.0021287271316827163,0.07305359188745873,0.004750816420210995
"Berwick PA HSA, Danville PA HRR, USA",6.716379321850475,0.2882517829729781,0.2674285295944969,0.06082873889819036,0.2943575908884342,0.08145030966111012,0.007683047984790261
"Tuba City AZ HSA, Phoenix AZ HRR, USA",4.456922373261406,0.047249074846642904,0.17140742681656862,0.09384309943694152,0.0018312320986119124,0.679378576261977,0.00629059053925819
"Urbana OH HSA, Dayton OH HRR, USA",7.485086411184152,0.4055260288613657,0.2599906965399619,0.2014232041765597,0.05105042340774247,0.07221534751848531,0.009794299495884931
"Southport NC HSA, Wilmington NC HRR, USA",6.049268818879482,0.04009944958362499,0.8712510670624193,0.06911101154419237,0.012644367628055599,0.001963224229704366,0.004930879952003486
"Oakland MD HSA, Morgantown WV HRR, USA",5.217786911967473,0.17542726495159086,0.2406231337339796,0.1851718051124648,0.22107233296663784,0.1719527401552792,0.005752723080047772
"Watertown WI HSA, Madison WI HRR, USA",6.714259722859253,0.6635965698507519,0.18726395850048763,0.09547157606498571,0.007672871034608046,0.041238552031513984,0.004756472517652757
"Norway ME HSA, Portland ME HRR, USA",4.698939683010835,0.005638028402426067,0.05827889339579222,0.12599771114654,0.5875175680585087,0.2213443889521194,0.001223410044613625
"Webster MA HSA, Worcester MA HRR, USA",5.968642589273867,0.2524756738138294,0.2345647119607336,0.02213037113579609,0.4459657280633773,0.04486351502626366,0.0
"Lebanon IN HSA, Indianapolis IN HRR, USA",7.97107784418904,0.4944449218715635,0.29743280616350176,0.1604141949524033,0.016138376770557662,0.0253689526679973,0.006200747573976527
"Van Wert OH HSA, Fort Wayne IN HRR, USA",7.661603781180675,0.41746812296553376,0.3186044414762622,0.18547079063519192,0.01148668371547905,0.06012005297246391,0.006849908235069322
"Newport OR HSA, Portland OR HRR, USA",4.4374375452310435,0.13583080010189647,0.7175802134490122,0.02270300120017975,0.003331528697096406,0.11317312979575907,0.00738132675605619
"Fayetteville TN HSA, Huntsville AL HRR, USA",6.727602063091451,0.22021332768292376,0.613348099974508,0.13335267543625778,0.0,0.029878891494699553,0.0032070054116110384
"Zeeland MI HSA, Grand Rapids MI HRR, USA",6.5001519676420045,0.8460617192877304,0.06388787089110239,0.06278551099356433,0.0031970321008962643,0.022992298890751276,0.0010755678359553355
"Woodstock VA HSA, Winchester VA HRR, USA",6.380643757696601,0.03988421325050024,0.5429282688346934,0.16338346325553027,0.13797271128135558,0.11150561540594038,0.004325727971979957
"Martin TN HSA, Jackson TN HRR, USA",6.865634419559463,0.24649668655931317,0.664956503906057,0.06249324826758901,0.0010140237427329168,0.023010934104772708,0.0020286034195353166
"Eden NC HSA, Greensboro NC HRR, USA",6.699518568086585,0.26172664923230493,0.6106556248986138,0.057730430741547656,0.03705143908741582,0.023789658925723385,0.009046197114394357
"Ashland WI HSA, Duluth MN HRR, USA",4.548893513448788,0.3684998699334062,0.11187948336013522,0.37039778424858943,0.014377331549297637,0.12294474937972208,0.0119007815288495
"Bremen GA HSA, Rome GA HRR, USA",6.977679696243201,0.21235666200073414,0.5373739139107487,0.21696844921984296,0.0014653362668109403,0.02295071510107483,0.008884923500788405
"Ludington MI HSA, Muskegon MI HRR, USA",5.462488355356485,0.516428430171451,0.10663921195447529,0.2514747834215047,0.013797975440320033,0.10299264905466902,0.008666949957579962
"Bainbridge GA HSA, Tallahassee FL HRR, USA",7.213004795063588,0.06483108767818778,0.9035344659246243,0.021187268111696897,0.0012692833430970488,0.0045889474711970244,0.004588947471197018
"Muncy PA HSA, Danville PA HRR, USA",6.723693331255617,0.1828729338939233,0.2513703979464612,0.05011977363012156,0.33460172237498714,0.1710743551639206,0.009960816990585947
"Maysville KY HSA, Lexington KY HRR, USA",7.028972992289068,0.31284988738974745,0.565230010236032,0.05770689837656275,0.008028911851472413,0.053214748606540095,0.0029695435396452905
"New Albany MS HSA, Tupelo MS HRR, USA",6.828967468974899,0.47399714329448306,0.4312666899103379,0.08425850029451723,0.002240980859686595,0.008236685640975233,0.0
"Stoughton MA HSA, Boston MA HRR, USA",5.972019157410912,0.6204477728182545,0.1034652000978106,0.015979387897597962,0.25089361761428475,0.004603141234772436,0.004610880337279855
"Roxboro NC HSA, Durham NC HRR, USA",6.4529958376721455,0.2320750977986916,0.5494675648329239,0.15964532544451132,0.028092393757740346,0.030466330821845564,0.00025328734428721786
"Hutchinson MN HSA, Minneapolis MN HRR, USA",5.816761080393236,0.49560598132515227,0.21510899760658655,0.22864831884130749,0.01873352622986645,0.03437243083017283,0.007530745166914493
"Elkin NC HSA, Winston-Salem NC HRR, USA",6.285735333598279,0.026912196432479205,0.6699374537624512,0.11568477505253058,0.13565233561268172,0.04562363950186486,0.006189599637992531
"Stoughton WI HSA, Madison WI HRR, USA",6.9319079983213925,0.6827709796440042,0.13510148066014313,0.138087075359233,0.016285101019025472,0.027114337526798704,0.0006410257907954928
"Jackson GA HSA, Atlanta GA HRR, USA",7.3679676681018975,0.14573349970181315,0.6806606825649766,0.14577969329886376,0.009530162231916545,0.013114778462524764,0.005181183739905174
"Malvern AR HSA, Little Rock AR HRR, USA",6.996590447094301,0.3679451767698819,0.5243558907391078,0.04553016794930762,0.0006610477850637826,0.061065132426546966,0.00044258433009207866
"Poteau OK HSA, Fort Smith AR HRR, USA",6.679034269978718,0.27553085648616094,0.49990780452589917,0.15170210765659975,0.0010104006838574325,0.06834968860484236,0.003499142042640256
"Warsaw NY HSA, Rochester NY HRR, USA",5.462135760473036,0.4816898725493386,0.11743935072394132,0.16476016515761827,0.09827605441645282,0.13715607489261544,0.0006784822600335848
"Newberry SC HSA, Columbia SC HRR, USA",6.755747195202709,0.3078330245858621,0.6361433684542762,0.03254224668770955,0.009462007543456125,0.012954501176384588,0.0010648515523115035
"Peru IL HSA, Peoria IL HRR, USA",7.411442406764727,0.799514395451298,0.1350613291109641,0.05644176379100736,0.0010769639278169142,0.00668132389048401,0.0012242238284295218
"South Hill VA HSA, Richmond VA HRR, USA",6.262588122940994,0.07514451266118978,0.6085143733845796,0.1438626401592316,0.11344024903648574,0.054869458582575144,0.004168766175938178
"Virginia MN HSA, Duluth MN HRR, USA",4.780198735284533,0.37842200432564743,0.20169658309160574,0.19113443577398276,0.10034431698344821,0.11898827347178444,0.009414386353531368
"Elizabethtown NC HSA, Wilmington NC HRR, USA",6.266780226837276,0.04076565266168606,0.7125558558772089,0.22357535623238722,0.004904774538915019,0.014557452184797025,0.0036409085050057898
"Wolfeboro NH HSA, Manchester NH HRR, USA",4.957730876879986,0.009030545496363354,0.10275881235346047,0.18070294801601536,0.5701020246666565,0.12279015829527695,0.014615511172227529
"Peru IN HSA, Indianapolis IN HRR, USA",7.557825543201468,0.6772312532370568,0.17944992905870702,0.09112570798932068,0.00873038050749391,0.03342785338397717,0.010034875823444485
"Milton MA HSA, Boston MA HRR, USA",6.093382269980501,0.5995780551645127,0.09965703681790553,0.01595249908018099,0.27621773211717804,0.007462142539373539,0.001132534280849272
"Carbondale PA HSA, Scranton PA HRR, USA",5.552499644848431,0.36907698563697466,0.17190779584828653,0.1375951503561767,0.22773313234669898,0.08978973644981694,0.0038971993620462515
"New London NH HSA, Lebanon NH HRR, USA",4.816863950663341,0.024053716596968085,0.0353949238030954,0.32511495292673626,0.42120719263019196,0.18938557086202829,0.004843643180979982
"St Marys OH HSA, Dayton OH HRR, USA",7.9013038526756985,0.5399932383557227,0.22446545887558106,0.14987718721468782,0.01358746777596563,0.05820008926028253,0.013876558517760193
"Wabash IN HSA, Fort Wayne IN HRR, USA",7.521056294329916,0.5661191749991039,0.2693798365805202,0.11049010282671218,0.008016616092204998,0.03283666629354327,0.013157603207915427
"Fremont MI HSA, Grand Rapids MI HRR, USA",5.637926795344381,0.3501938789051347,0.07125129676765166,0.32801603644835,0.045269329682955814,0.19781925002161813,0.007450208174289601
"Clarion PA HSA, Pittsburgh PA HRR, USA",6.316809245225425,0.6987288569619845,0.14350899010440005,0.044077374364391006,0.04279077003631134,0.07089400853291308,0.0
"Ogdensburg NY HSA, Syracuse NY HRR, USA",5.541181843911684,0.4191472349797897,0.056454435572530985,0.12304985246666511,0.24216867520878343,0.1437650305990463,0.015414771173184452
"Miami OK HSA, Joplin MO HRR, USA",7.083033601242171,0.46383254657914286,0.3850361924977895,0.06598148882682674,0.00046027489241074366,0.081559627935437,0.0031298692683930504
"Hamilton MT HSA, Missoula MT HRR, USA",6.405526552240388,0.39331181236555823,0.2099999484547784,0.20602854444683535,0.00791599295539124,0.1807034974074905,0.0020402043699461964
"Sapulpa OK HSA, Tulsa OK HRR, USA",7.270462760386594,0.6348875098083231,0.3127046936112132,0.039853092365739716,0.0004506229131089858,0.011821132030592992,0.0002829492710219214
"Ennis TX HSA, Dallas TX HRR, USA",7.258975915048003,0.23976142527952096,0.6857795314109346,0.0653238859420209,0.0014379085322544227,0.005437187447057467,0.002260061388211466
"Salem IN HSA, Louisville KY HRR, USA",7.197701309182241,0.20934068763885744,0.49553418393464144,0.1534608882786894,0.013677002509215323,0.12358231500395038,0.004404922634645928
"Carthage MO HSA, Joplin MO HRR, USA",6.859560259053509,0.34763301228134574,0.4743165486118784,0.1304029029001937,4.2352249182839534e-05,0.04507423105118089,0.002530952906218492
"Morrisville VT HSA, Burlington VT HRR, USA",4.62982742644502,0.028907812558904317,0.043138355112095406,0.29500556405488976,0.410239197792228,0.21924833124360685,0.0034607392382756813
"Big Rapids MI HSA, Grand Rapids MI HRR, USA",5.583286079056304,0.4848891145900337,0.12081111135838475,0.26896588884977574,0.020719143651065575,0.1001550529908392,0.004459688559900913
"Prairie Du Sac WI HSA, Madison WI HRR, USA",6.641015251386905,0.6373576661388256,0.12530734763213094,0.17430470827709008,0.013168966972866215,0.049536467159978906,0.0003248438191082345
"Clarksdale MS HSA, Memphis TN HRR, USA",6.834262055561348,0.5558677616867855,0.3235727703985328,0.10443817216655638,8.635398001394757e-06,0.01273710997879484,0.003375550371328711
"Payson AZ HSA, Phoenix AZ HRR, USA",5.075614472964268,0.287320746088263,0.4224920785287297,0.14844332324651155,0.0014848118594892844,0.13785958431207176,0.002399455964934684
"Sparta TN HSA, Nashville TN HRR, USA",6.510250535011127,0.4184642530535649,0.5110711766125569,0.03943292029910731,0.0,0.030211404279634625,0.0008202457551364054
"Allegan MI HSA, Kalamazoo MI HRR, USA",6.518891491777675,0.42059430139539306,0.04908568262617673,0.28348922181757913,0.04190449924534012,0.19601931091446498,0.008906984001045962
"Huntingburg IN HSA, Evansville IN HRR, USA",7.487180199514692,0.41448082487217286,0.31833747291186776,0.20999296305261886,0.011398530936283437,0.04175390842529604,0.004036299801761164
"Las Vegas NM HSA, Albuquerque NM HRR, USA",4.764129303719011,0.2732724541711027,0.11142650519434306,0.20407338075567819,0.007752200967493996,0.39147143504711407,0.012004023864268024
"Rocky Mount VA HSA, Roanoke VA HRR, USA",6.080480969572605,0.018484246775336124,0.7396319812694928,0.07804184073179733,0.08616763633598289,0.0713951545421925,0.006279140345198468
"Warwick NY HSA, Ridgewood NJ HRR, USA",6.277294796048231,0.43644122248114403,0.10104803017622792,0.10151858337988065,0.3218154703984499,0.03904491409816931,0.00013177946612818344
"Connellsville PA HSA, Pittsburgh PA HRR, USA",7.036099812748976,0.4279077103712001,0.19380889652327102,0.04147895578938289,0.2660298709342398,0.06679197383890878,0.003982592542997287
"Chestertown MD HSA, Baltimore MD HRR, USA",6.704076525464141,0.024879699641175593,0.5363450010363197,0.1832258894698741,0.1996550450177817,0.04830280576804556,0.007591559066803494
"St Clair MI HSA, Detroit MI HRR, USA",7.471212274497655,0.8575346736910413,0.06825226578500611,0.03857351055503348,0.004613950361952538,0.028371969980804122,0.002653629626162535
"Norton VA HSA, Kingsport TN HRR, USA",5.368571809678813,0.014132673025731233,0.8682244548873685,0.04136653405209245,0.03318288066944497,0.03605274468436473,0.007040712680998193
"Commerce GA HSA, Atlanta GA HRR, USA",6.918898310578831,0.15933729676492758,0.6952736060923107,0.0974777032381669,0.0034443944486183403,0.03774093826954001,0.006726061186436475
"Grants/San Fidel NM HSA, Albuquerque NM HRR, USA",4.743861535791659,0.4595486550148681,0.10883911558504189,0.14116961108705067,0.0011262558124158866,0.28870417097132844,0.0006121915292950286
"Charlotte MI HSA, Lansing MI HRR, USA",6.782923640962243,0.47343693128405534,0.11485792790476004,0.23225016857369896,0.05910984714640017,0.11485576417798325,0.005489360913102088
"Liberal KS HSA, Wichita KS HRR, USA",5.318463854963687,0.7007025531327115,0.21308887690975611,0.080423093569454,0.002313865181681348,0.003139519974990735,0.00033209123140648367
"Kilmarnock VA HSA, Richmond VA HRR, USA",6.179435491598669,0.04081472787219662,0.6715817869864703,0.11794158202962578,0.1315992326644958,0.030180832591248163,0.007881837855963266
"Sturgis MI HSA, Kalamazoo MI HRR, USA",7.0428834428340785,0.6276761003582431,0.09766429111992496,0.18288691652749098,0.021076807287198483,0.05290995580949672,0.01778592889764588
"Susanville CA HSA, Reno NV HRR, USA",9.128393076188466,0.18933299220247174,0.15993685500884036,0.10246851066240192,0.1586406340792207,0.3857996979877882,0.003821310059277061
"Kilgore TX HSA, Longview TX HRR, USA",7.179912369836742,0.2640523966997398,0.6533905710320922,0.07054237821985197,0.0,0.006269724341426308,0.005744929706889852
