"Elyria OH HRR, USA",1799.6268563944543,1206.1089215703596,739.9604103600236,566.9990096289267
"San Luis Obispo CA HRR, USA",2504.853953909664,1619.7218723317396,783.190956738265,443.0765036870094
"Cape Girardeau MO HRR, USA",894.3127107940461,554.6716904291101,287.53928118356396,173.06925566305122
"Lafayette IN HRR, USA",2302.936480011216,1534.1011865363928,788.6492513055773,580.7418729477233
"Texarkana AR HRR, USA",921.8444832625638,457.40263094333733,249.37801179959575,182.28923913523042
"Jonesboro AR HRR, USA",1104.8133640865194,617.5890483189715,336.08026920600963,229.51738175278496
"Bismarck ND HRR, USA",1199.7809978589617,836.64274308907,462.9277824940312,328.76592572039027
"Wilkes-Barre PA HRR, USA",2000.0582508160005,1474.8053571587893,882.3100019102488,640.870998030911
"Neenah WI HRR, USA",1602.116465227633,1079.457659124246,641.9997691781249,431.4669361318324
"Traverse City MI HRR, USA",750.0885256934738,347.2243285607393,145.3440225235728,104.26969418314974
"Rapid City SD HRR, USA",1225.026417726613,738.9294013256745,361.6366921284192,234.04570432420567
"Gulfport MS HRR, USA",1626.4937557532182,822.1544983515533,456.3357707227848,335.65987294074966
"Panama City FL HRR, USA",1369.2058112160594,675.3870313066207,387.73811517757804,274.10043144207316
"Longview TX HRR, USA",992.6044664974494,537.4414218428512,332.3092373655678,256.98686101085815
"Waterloo IA HRR, USA",1255.9271929508727,906.4446641284763,523.633331926025,362.4228878035896
"Albany GA HRR, USA",1147.612957178209,544.9771966153359,297.52730773399816,229.5958649649523
"Johnstown PA HRR, USA",1085.7579024262432,586.8316490764133,261.7179915439609,182.91701323418954
"Bloomington IL HRR, USA",2014.5450613393323,1419.1307311370933,883.8373767010281,658.5181663500599
"Slidell LA HRR, USA",1473.1399387053007,712.0642492727287,383.34547199566487,293.500225569141
"Wichita Falls TX HRR, USA",1641.923167277012,922.8787014084519,485.9886031343932,337.47036399501195
"Marquette MI HRR, USA",993.8815870867488,585.1756700833918,242.74900478857958,124.46605837646054
"Wausau WI HRR, USA",873.2862287514729,564.7736126987435,306.75059195708604,212.01409772603913
"Casper WY HRR, USA",1115.3253355224217,785.3421748763941,417.136477700279,252.36904461549094
"Lawton OK HRR, USA",1295.7735628918615,814.7348514397321,469.0191584701748,326.97922975493606
"Sayre PA HRR, USA",636.5924562731925,375.9107655632539,148.08072036103073,82.81283136067412
"Pueblo CO HRR, USA",1588.4186209851225,1227.479716167165,808.187376537934,581.2302808115505
"Meridian MS HRR, USA",634.4545466608203,283.70277564140616,144.62574437714179,100.63398307174992
"Terre Haute IN HRR, USA",1298.9090723543422,737.7659863798477,383.46875113743147,271.9432002383875
"Petoskey MI HRR, USA",748.8289769803202,334.11598233690273,123.21238317215862,62.35890763150015
"Grand Forks ND HRR, USA",1212.125943896612,891.2837319348482,524.2888906927664,353.69334413139455
"San Angelo TX HRR, USA",1280.7773113027463,892.1014585542308,566.9400297569654,422.5583272146999
"Dubuque IA HRR, USA",1427.5472513158584,927.101507780037,535.5423766737588,345.97749546669525
"Muncie IN HRR, USA",1653.9938687780855,939.474701405379,538.1107932875046,390.0928637783343
"Great Falls MT HRR, USA",1102.923646556423,840.3816085000111,473.76630709556537,308.7550874173605
"Minot ND HRR, USA",1227.1393741635964,842.3254097623548,447.1305089219647,287.9185409157592
"Oxford MS HRR, USA",903.7372946905484,422.6967139656325,181.08422583230973,120.80777269892283
"Victoria TX HRR, USA",1275.959793472924,792.5533243379796,496.25726226673015,325.8082226052537
"Owensboro KY HRR, USA",1246.2362381950793,780.5494441956896,494.99427688495933,361.89833708007046
"St Joseph MI HRR, USA",933.5110099226755,546.4412008563703,304.41396683477706,218.96858975563188
"Mason City IA HRR, USA",864.3849154468662,585.9022195652153,257.3064476965436,130.10492262801213
