"Osceola AR HSA, Memphis TN HRR, USA",-0.11826619007946111,0.005468962873479352,-0.12373515295294046
"Lancaster KY HSA, Lexington KY HRR, USA",-0.556163993057873,-0.5749159920764082,0.018751999018535193
"Jena LA HSA, Alexandria LA HRR, USA",-0.7890547485473574,-0.779107153952768,-0.009947594594589382
"Crossnore NC HSA, Asheville NC HRR, USA",-0.5547092642961229,-0.5849839989568024,0.030274734660679536
"Tipton IN HSA, Indianapolis IN HRR, USA",-0.5125594905841949,-0.5217510023824676,0.009191511798272711
"Mccook NE HSA, Denver CO HRR, USA",-0.6865952741957702,-0.6959774945116646,0.009382220315894418
"Forsyth GA HSA, Macon GA HRR, USA",-0.25648265371415147,-0.2153993122395178,-0.04108334147463366
"Roseau MN HSA, Grand Forks ND HRR, USA",-0.43926312234594533,-0.44273283172908034,0.003469709383135011
"Hamlet NC HSA, Charlotte NC HRR, USA",-0.08597235907777834,-0.04419051913489071,-0.04178183994288763
"Pomeroy OH HSA, Columbus OH HRR, USA",-0.49380057960325235,-0.4653848941798535,-0.02841568542339884
"Paoli IN HSA, Louisville KY HRR, USA",-0.4353128398349155,-0.4011497157372468,-0.034163124097668696
"Polson MT HSA, Missoula MT HRR, USA",-0.17251459880799247,-0.23286515481353187,0.0603505560055394
"Park Falls WI HSA, Marshfield WI HRR, USA",-0.2594282922600044,-0.21533307062104196,-0.044095221638962456
"Harlan IA HSA, Omaha NE HRR, USA",-0.3834525333093804,-0.4000978199678387,0.016645286658458325
"Upper Sandusky OH HSA, Columbus OH HRR, USA",-0.4846348200797401,-0.4606037054864913,-0.024031114593248804
"Hamilton AL HSA, Tupelo MS HRR, USA",-0.7775361840712524,-0.7552085706019924,-0.022327613469259933
"Lewistown MT HSA, Billings MT HRR, USA",-0.5345280618016771,-0.5423839015513174,0.007855839749640325
"Watervliet MI HSA, St Joseph MI HRR, USA",-0.2281577521902637,-0.22698092636579778,-0.0011768258244659324
"Watford City ND HSA, Bismarck ND HRR, USA",-0.6494431140800515,-0.6073782057828092,-0.0420649082972423
"Gilmer TX HSA, Tyler TX HRR, USA",-0.6672108059385194,-0.6534667490319701,-0.01374405690654934
"Camden TN HSA, Nashville TN HRR, USA",-0.564570217042699,-0.5121474814978009,-0.05242273554489818
"Powell WY HSA, Billings MT HRR, USA",-0.6175135931516539,-0.575989983613894,-0.04152360953775991
"Lamar CO HSA, Colorado Springs CO HRR, USA",-0.4760746751513404,-0.48204490137238076,0.005970226221040376
"Blountstown FL HSA, Tallahassee FL HRR, USA",-0.6095748982412762,-0.5464461115745649,-0.06312878666671129
"Fayette AL HSA, Tuscaloosa AL HRR, USA",-0.6051166968740146,-0.5794390165687929,-0.025677680305221662
"Rawlins WY HSA, Casper WY HRR, USA",-0.5051633235383839,-0.45475627151164827,-0.05040705202673562
"Lake City IA HSA, Des Moines IA HRR, USA",-0.4604731899164566,-0.4232717856934685,-0.037201404222988066
"Rogersville TN HSA, Knoxville TN HRR, USA",-0.6830498844630833,-0.6659507767671067,-0.017099107695976667
"Laurium MI HSA, Marquette MI HRR, USA",-0.2084553615760125,-0.24405545329742678,0.03560009172141429
"Owenton KY HSA, Lexington KY HRR, USA",-0.5881536184231096,-0.5404245784682692,-0.04772903995484046
"Erwin TN HSA, Johnson City TN HRR, USA",-0.601925872052289,-0.6142893657097435,0.012363493657454483
"Weimar TX HSA, Houston TX HRR, USA",-0.5716331659252274,-0.5783189420295972,0.006685776104369823
"York NE HSA, Lincoln NE HRR, USA",-0.499107093385713,-0.5434575511646805,0.04435045777896751
"Milan TN HSA, Jackson TN HRR, USA",-0.47397244822856327,-0.4758871543975094,0.0019147061689461231
"Jasper FL HSA, Tallahassee FL HRR, USA",-0.3316606888610768,-0.29944864967225887,-0.03221203918881793
"Perryton TX HSA, Amarillo TX HRR, USA",-0.8061229641103326,-0.7924867103529217,-0.013636253757410843
"Lincoln ME HSA, Bangor ME HRR, USA",-0.3949248407679001,-0.3819069943574225,-0.013017846410477596
"Edgerton WI HSA, Madison WI HRR, USA",0.130263739478932,0.13056929774916667,-0.0003055582702346793
"Cameron MO HSA, Kansas City MO HRR, USA",-0.5041261281537748,-0.4965668230517118,-0.007559305102062985
"Carthage IL HSA, Springfield IL HRR, USA",-0.46908597973094135,-0.4468290689430672,-0.022256910787874173
"Hiawassee GA HSA, Atlanta GA HRR, USA",-0.6058164836257789,-0.6192446649963954,0.013428181370616521
"Driggs ID HSA, Idaho Falls ID HRR, USA",0.015033202378055182,-0.04024370899502544,0.05527691137308062
"Waseca MN HSA, Minneapolis MN HRR, USA",-0.25903614457831325,-0.28601729482786753,0.026981150249554275
"Sylvania GA HSA, Savannah GA HRR, USA",-0.18458411790246176,-0.1821352647042851,-0.0024488531981766704
"Friendship WI HSA, Madison WI HRR, USA",-0.2500838805106619,-0.2049808180685832,-0.04510306244207868
"Stilwell OK HSA, Tulsa OK HRR, USA",-0.5507434387113453,-0.48323517674178146,-0.06750826196956389
"Oakdale LA HSA, Alexandria LA HRR, USA",-0.4355916473313442,-0.3737187745992255,-0.06187287273211872
"Fort Kent ME HSA, Bangor ME HRR, USA",-0.024939484884965904,0.030372890395937224,-0.05531237528090313
"Crosby MN HSA, Minneapolis MN HRR, USA",-0.2819783090873276,-0.27563638531104206,-0.006341923776285563
"Aitkin MN HSA, Minneapolis MN HRR, USA",-0.261177886665386,-0.24762040442376138,-0.013557482241624619
"Hazlehurst MS HSA, Jackson MS HRR, USA",0.1877945065359281,0.2290316911577145,-0.04123718462178638
"De Quincy LA HSA, Lake Charles LA HRR, USA",-0.6977954381834076,-0.6977718832932819,-2.3554890125732086e-05
"Tazewell VA HSA, Roanoke VA HRR, USA",-0.6995812918849272,-0.6530873539632813,-0.04649393792164591
"Springhill LA HSA, Shreveport LA HRR, USA",-0.3764401094502934,-0.38704731634396344,0.010607206893670063
"Quitman TX HSA, Tyler TX HRR, USA",-0.7119434375025949,-0.7219789745795292,0.010035537076934276
"Red Oak IA HSA, Omaha NE HRR, USA",-0.4060751192395665,-0.42530400355353565,0.01922888431396913
"Raton NM HSA, Albuquerque NM HRR, USA",-0.12608061269927912,-0.10272204126408883,-0.02335857143519028
"Westfield NY HSA, Erie PA HRR, USA",-0.2310919763462479,-0.27059903968814614,0.03950706334189824
"Holdrege NE HSA, Lincoln NE HRR, USA",-0.6845780932015214,-0.7055723362258567,0.02099424302433528
"Fredericktown MO HSA, St Louis MO HRR, USA",-0.6280672489619646,-0.5906819426666979,-0.03738530629526671
"Sturgis SD HSA, Rapid City SD HRR, USA",-0.47626388916826456,-0.5023784637879072,0.026114574619642617
"Paris IL HSA, Urbana IL HRR, USA",-0.49497568877728587,-0.4520316145728921,-0.04294407420439378
"San Carlos AZ HSA, Phoenix AZ HRR, USA",0.6830985915492958,0.7690832374376678,-0.08598464588837207
"Wellington KS HSA, Wichita KS HRR, USA",-0.4582743988684583,-0.46652267818574517,0.008248279317286888
"Centerville IA HSA, Des Moines IA HRR, USA",-0.4020019406877319,-0.35974202207428363,-0.042259918613448244
"Heber Springs AR HSA, Little Rock AR HRR, USA",-0.6397213878725628,-0.5845579378246197,-0.0551634500479431
"Madison FL HSA, Tallahassee FL HRR, USA",-0.1011741584722625,-0.06419851788245189,-0.03697564058981061
"Abilene KS HSA, Topeka KS HRR, USA",-0.5324827933523586,-0.5306626162901082,-0.00182017706225035
"Linden TN HSA, Nashville TN HRR, USA",-0.6325592297437084,-0.5617746928883398,-0.07078453685536856
"Calais ME HSA, Bangor ME HRR, USA",-0.13568432548720116,-0.1308002859544931,-0.004884039532708051
"Kingwood WV HSA, Morgantown WV HRR, USA",-0.5430142650977928,-0.5519676918902333,0.008953426792440489
"Maquoketa IA HSA, Davenport IA HRR, USA",-0.2183915879543732,-0.17811230872367428,-0.040279279230698906
"Windom MN HSA, Sioux Falls SD HRR, USA",-0.3839376976230616,-0.349305581266405,-0.03463211635665664
"Brookfield MO HSA, Columbia MO HRR, USA",-0.5252691880562844,-0.49341441017065846,-0.03185477788562596
"Clintwood VA HSA, Kingsport TN HRR, USA",-0.5429207951186599,-0.522401981669594,-0.02051881344906592
"New Hampton IA HSA, Rochester MN HRR, USA",-0.3118956860733218,-0.23647378170542593,-0.07542190436789586
"Cumberland WI HSA, Minneapolis MN HRR, USA",-0.2892711681977803,-0.24168242030538994,-0.04758874789239037
"Potosi MO HSA, St Louis MO HRR, USA",-0.6215548001890162,-0.536753650145576,-0.08480115004344024
"Grantsburg WI HSA, Minneapolis MN HRR, USA",-0.2836141388273073,-0.2784670201845588,-0.005147118642748472
"Bowie TX HSA, Wichita Falls TX HRR, USA",-0.7678358457216398,-0.7881354079185823,0.02029956219694251
"Webster City IA HSA, Des Moines IA HRR, USA",-0.24801483459253104,-0.20429970703891626,-0.043715127553614785
"Elwood IN HSA, Indianapolis IN HRR, USA",-0.44039533552550203,-0.3867063899645425,-0.053688945560959545
"Lancaster WI HSA, Madison WI HRR, USA",-0.23266481004846895,-0.18440307384284135,-0.0482617362056276
"Moose Lake MN HSA, Duluth MN HRR, USA",-0.15840167189918586,-0.131214410454513,-0.027187261444672872
"Mount Carmel IL HSA, Evansville IN HRR, USA",-0.5400931195033627,-0.5361243596537714,-0.00396875984959133
"Ville Platte LA HSA, Lafayette LA HRR, USA",-0.0737103366988773,-0.03538800425013982,-0.038322332448737485
"Creston IA HSA, Des Moines IA HRR, USA",-0.30633843791115367,-0.25851785886542983,-0.04782057904572384
"Hartford City IN HSA, Muncie IN HRR, USA",-0.4692236149873918,-0.43962331507509755,-0.029600299912294237
"Woodbury TN HSA, Nashville TN HRR, USA",-0.6100777222212393,-0.5413317035404254,-0.06874601868081398
"Bishopville SC HSA, Columbia SC HRR, USA",0.1623127698616779,0.16192480951203803,0.00038796034963986537
"Perham MN HSA, Fargo Moorhead -Mn ND HRR, USA",-0.42208524547136,-0.4798061147715135,0.05772086930015352
"Pittsfield IL HSA, Springfield IL HRR, USA",-0.6096258423825658,-0.572188627937681,-0.03743721444488479
"Mount Vernon KY HSA, Lexington KY HRR, USA",-0.7182414722432787,-0.7240295850406533,0.005788112797374567
"Washington GA HSA, Augusta GA HRR, USA",-0.09180149780215187,-0.10801524143734957,0.016213743635197703
"Sparta NC HSA, Winston-Salem NC HRR, USA",-0.5093472756804566,-0.4762200954453451,-0.033127180235111464
"Centreville AL HSA, Tuscaloosa AL HRR, USA",-0.41968338043943954,-0.3848431124363959,-0.03484026800304363
"Shell Lake WI HSA, Minneapolis MN HRR, USA",-0.2629840545099438,-0.259798641657737,-0.0031854128522068037
"Torrington WY HSA, Casper WY HRR, USA",-0.5651959088517126,-0.5813803797113843,0.016184470859671785
"Dardanelle AR HSA, Little Rock AR HRR, USA",-0.5308846345168866,-0.4264866213399876,-0.10439801317689901
"Wayne NE HSA, Sioux City IA HRR, USA",-0.4513309105239845,-0.47505591546293247,0.02372500493894797
"Warren AR HSA, Little Rock AR HRR, USA",-0.332353073323734,-0.25119448324700805,-0.08115859007672593
"Afton WY HSA, Salt Lake City UT HRR, USA",-0.7240924535977672,-0.6536824757067747,-0.07040997789099246
"Clinton IL HSA, Springfield IL HRR, USA",-0.408846487424111,-0.40410578879230624,-0.004740698631804763
"Princeton KY HSA, Paducah KY HRR, USA",-0.5233148190412479,-0.5262925009243454,0.0029776818830975493
"Kaplan LA HSA, Lafayette LA HRR, USA",-0.6880383936257629,-0.6568917341783095,-0.03114665944745343
"Ozark AR HSA, Fort Smith AR HRR, USA",-0.6161239920815967,-0.5511808064874714,-0.06494318559412537
"Ashland AL HSA, Birmingham AL HRR, USA",-0.5846940134221035,-0.5577028943285386,-0.026991119093564886
"Montour Falls NY HSA, Elmira NY HRR, USA",-0.12779111978152358,-0.1782593215443237,0.05046820176280012
"Mamou LA HSA, Lafayette LA HRR, USA",-0.4070100088066119,-0.428013155675953,0.02100314686934107
"Gouverneur NY HSA, Syracuse NY HRR, USA",-0.30890592222963287,-0.26220994793290164,-0.046695974296731224
"Atoka OK HSA, Oklahoma City OK HRR, USA",-0.6795288360830763,-0.6350216628346766,-0.0445071732483997
"Ferriday LA HSA, Alexandria LA HRR, USA",0.1185199693175488,0.13029415079420523,-0.011774181476656431
"Monahans TX HSA, Odessa TX HRR, USA",-0.6318141536909386,-0.5346579422293299,-0.09715621146160869
"Nashville GA HSA, Tallahassee FL HRR, USA",-0.6310164911762315,-0.6283501591306866,-0.0026663320455448947
"Winnsboro TX HSA, Tyler TX HRR, USA",-0.6923219391557477,-0.7069335170240579,0.014611577868310244
"Orange City IA HSA, Sioux City IA HRR, USA",-0.59805708908579,-0.6199784063828433,0.021921317297053267
"Stanley WI HSA, Marshfield WI HRR, USA",-0.3807900789107113,-0.3235237350045301,-0.05726634390618124
"Ellenville NY HSA, Albany NY HRR, USA",-0.01741415340319564,-0.04452648199338767,0.02711232859019203
"Oconto Falls WI HSA, Green Bay WI HRR, USA",-0.44427122925987966,-0.42068069021114346,-0.023590539048736203
"Fairfield IL HSA, Evansville IN HRR, USA",-0.6771278935980105,-0.6955599201112326,0.018432026513222066
"Redwood Falls MN HSA, Minneapolis MN HRR, USA",-0.3473612760902766,-0.3834710743801653,0.036109798289888695
"Ripon WI HSA, Neenah WI HRR, USA",-0.16645776739589566,-0.17629996648982357,0.009842199093927917
"Damariscotta ME HSA, Portland ME HRR, USA",0.25787122165334686,0.1593694486721594,0.09850177298118745
"Estherville IA HSA, Sioux Falls SD HRR, USA",-0.3718301906752273,-0.37194482862486533,0.00011463794963800789
"Washington IA HSA, Iowa City IA HRR, USA",-0.21086612910820438,-0.22502111657388124,0.014154987465676866
"Mckenzie TN HSA, Jackson TN HRR, USA",-0.5848875730791961,-0.5440492505514626,-0.04083832252773356
"Cushing OK HSA, Tulsa OK HRR, USA",-0.552083788143137,-0.5675902195254995,0.015506431382362518
"Alliance NE HSA, Denver CO HRR, USA",-0.5825392262930666,-0.5583874757586761,-0.02415175053439056
"Preston ID HSA, Salt Lake City UT HRR, USA",-0.7803431748165871,-0.6388436633704071,-0.14149951144618
"Osage IA HSA, Mason City IA HRR, USA",-0.2838182137657513,-0.2447387567028644,-0.039079457062886874
"Morris MN HSA, Minneapolis MN HRR, USA",-0.2470469119136011,-0.15789473684210525,-0.08915217507149584
"Susquehanna PA HSA, Scranton PA HRR, USA",-0.4156977189191077,-0.4076043553202842,-0.008093363598823455
"Braddock PA HSA, Pittsburgh PA HRR, USA",0.5861024803819096,0.5833253136638596,0.0027771667180499504
"Chelan WA HSA, Spokane WA HRR, USA",-0.10694077409276921,-0.14581908951268724,0.03887831541991803
"Plymouth NC HSA, Greenville NC HRR, USA",0.09656824552696305,0.14979512705026507,-0.053226881523302016
"Hartsville TN HSA, Nashville TN HRR, USA",-0.4795528601838226,-0.36397598209622084,-0.11557687808760175
"Man WV HSA, Charleston WV HRR, USA",-0.7469840433811651,-0.710406468979229,-0.0365775744019361
"Kane PA HSA, Erie PA HRR, USA",-0.4207554760327579,-0.4182088080657903,-0.0025466679669676195
"Pikeville TN HSA, Chattanooga TN HRR, USA",-0.6172933305456846,-0.5413765391980738,-0.07591679134761076
"Centerville TN HSA, Nashville TN HRR, USA",-0.5604270137376471,-0.4834848018521195,-0.07694221188552763
"Nephi UT HSA, Provo UT HRR, USA",-0.7794928335170893,-0.5924468922108576,-0.18704594130623176
"Aransas Pass TX HSA, Corpus Christi TX HRR, USA",-0.4724082739618045,-0.4711245467668837,-0.001283727194920814
"Caro MI HSA, Saginaw MI HRR, USA",-0.3266278744954219,-0.29966573970013005,-0.02696213479529186
"Chewelah WA HSA, Spokane WA HRR, USA",-0.44225590551001936,-0.44118193333770506,-0.001073972172314308
"Valley City ND HSA, Fargo Moorhead -Mn ND HRR, USA",-0.28890961460647024,-0.27872555470266,-0.010184059903810216
"Benton IL HSA, St Louis MO HRR, USA",-0.46150720476677115,-0.4334100168129923,-0.028097187953778857
"Ilwaco WA HSA, Portland OR HRR, USA",0.10134115583471083,0.015500659140000969,0.08584049669470986
"Lutcher LA HSA, Metairie LA HRR, USA",-0.23777055570012012,-0.181454083556427,-0.05631647214369312
"Truth Or Consequence NM HSA, El Paso TX HRR, USA",-0.2196748284174434,-0.2747714078050586,0.0550965793876152
"Standish MI HSA, Saginaw MI HRR, USA",-0.3687746812654081,-0.3269415893754122,-0.0418330918899959
"Donalsonville GA HSA, Dothan AL HRR, USA",-0.3742685119628367,-0.339507949685662,-0.03476056227717472
"Rupert ID HSA, Salt Lake City UT HRR, USA",-0.541255798021496,-0.5042857676199444,-0.03697003040155167
"Bar Harbor ME HSA, Bangor ME HRR, USA",0.41481760072627044,0.35574356050167244,0.059074040224598
"Erin TN HSA, Nashville TN HRR, USA",-0.5229177457633192,-0.427320615027568,-0.09559713073575116
"Montevideo MN HSA, Minneapolis MN HRR, USA",-0.2901383967815161,-0.2782479176143238,-0.01189047916719227
"Claxton GA HSA, Savannah GA HRR, USA",-0.36825994819872854,-0.35369239311493617,-0.014567555083792372
"Roanoke AL HSA, Birmingham AL HRR, USA",-0.42321406404686107,-0.3856676914967363,-0.037546372550124774
"Gassaway WV HSA, Charleston WV HRR, USA",-0.4809545564687844,-0.4336766373704733,-0.04727791909831108
"Albion MI HSA, Kalamazoo MI HRR, USA",0.11784224606156425,0.16062677933200276,-0.042784533270438505
"Bisbee AZ HSA, Tucson AZ HRR, USA",0.23796517192121452,0.17865146806018456,0.059313703861029965
"Ticonderoga NY HSA, Burlington VT HRR, USA",-0.19645479139915095,-0.19665049940253204,0.00019570800338108985
"International Falls MN HSA, Minneapolis MN HRR, USA",-0.18785099452843257,-0.17613276391402333,-0.011718230614409242
"Eldorado IL HSA, Evansville IN HRR, USA",-0.4992850704086876,-0.48157783045977093,-0.017707239948916653
"Sidney NE HSA, Denver CO HRR, USA",-0.6332022685595162,-0.6447683454826395,0.01156607692312328
"Mountain View AR HSA, Little Rock AR HRR, USA",-0.5692945058475852,-0.5100796251635527,-0.05921488068403258
"South Williamson KY HSA, Lexington KY HRR, USA",-0.6487488528992269,-0.664086383774491,0.015337530875264127
"Montezuma GA HSA, Macon GA HRR, USA",0.2098928704688981,0.24776730108834602,-0.037874430619447924
"Lamar MO HSA, Joplin MO HRR, USA",-0.7001620717950856,-0.7031580703633158,0.002995998568230185
"Ishpeming MI HSA, Marquette MI HRR, USA",0.054878048780487805,0.014336213668499607,0.040541835111988195
"Blue Hill ME HSA, Bangor ME HRR, USA",0.2821238479944416,0.22954853187534424,0.05257531611909738
"Hayti MO HSA, Cape Girardeau MO HRR, USA",-0.2985359800097905,-0.17904435702981636,-0.11949162297997412
"Mendenhall MS HSA, Jackson MS HRR, USA",-0.32082068151262555,-0.32804488714570473,0.007224205633079184
"Flora IL HSA, Springfield IL HRR, USA",-0.6439946796222817,-0.6252327741559189,-0.018761905466362805
"Oelwein IA HSA, Waterloo IA HRR, USA",-0.13053652225679457,-0.07690996100660552,-0.05362656125018905
"Seaside OR HSA, Portland OR HRR, USA",0.20708420148885084,0.13475517612296828,0.07232902536588257
"Seward NE HSA, Lincoln NE HRR, USA",-0.3721275995106803,-0.388929328018795,0.016801728508114677
"Salmon ID HSA, Missoula MT HRR, USA",-0.5666940242517368,-0.5864707147320015,0.019776690480264758
"Worland WY HSA, Billings MT HRR, USA",-0.6567595464104916,-0.6327253231309742,-0.02403422327951743
"Quitman MS HSA, Meridian MS HRR, USA",-0.21966137648789805,-0.23761593758424923,0.017954561096351185
"Cherokee Village AR HSA, Little Rock AR HRR, USA",-0.5488253818757121,-0.5086366132799507,-0.04018876859576137
"Carlinville IL HSA, Springfield IL HRR, USA",-0.37495735782794215,-0.3779802665357049,0.003022908707762728
"Pilot Knob MO HSA, St Louis MO HRR, USA",-0.571410537364854,-0.5202834407353829,-0.051127096629471125
"Bloomer WI HSA, Minneapolis MN HRR, USA",-0.36893629403861683,-0.3369905819448696,-0.03194571209374725
"Sioux Center IA HSA, Sioux City IA HRR, USA",-0.6766316893591362,-0.7207920269480087,0.0441603375888725
"Bloomfield IA HSA, Des Moines IA HRR, USA",-0.49795902616335735,-0.46134091456973,-0.03661811159362738
"Spooner WI HSA, Minneapolis MN HRR, USA",-0.21406462716558966,-0.2270412001648943,0.01297657299930463
"Macon MS HSA, Meridian MS HRR, USA",0.5264103586591917,0.5663584407181755,-0.039948082058983814
"Tonasket WA HSA, Spokane WA HRR, USA",-0.3955615667926181,-0.4021674725842316,0.0066059057916134645
"Cherokee IA HSA, Sioux City IA HRR, USA",-0.38030009281963667,-0.3888491335791776,0.008549040759540938
"Union Springs AL HSA, Montgomery AL HRR, USA",0.5868098893413553,0.5837020741001981,0.003107815241157108
"Lake Isabella CA HSA, Bakersfield CA HRR, USA",-0.4102399299226505,-0.45002086565586435,0.03978093573321384
"Delhi LA HSA, Monroe LA HRR, USA",-0.27003616901885436,-0.27120829094260285,0.0011721219237484926
"Philippi WV HSA, Morgantown WV HRR, USA",-0.5214952122687425,-0.5201394061118526,-0.001355806156889905
"Pinckneyville IL HSA, St Louis MO HRR, USA",-0.5478327288178377,-0.5406132840041941,-0.007219444813643672
"Estes Park CO HSA, Fort Collins CO HRR, USA",0.15737756704277892,0.0322900394999203,0.12508752754285862
"Kellogg ID HSA, Spokane WA HRR, USA",-0.3774605572633198,-0.3374542390461581,-0.04000631821716166
"Hettinger ND HSA, Bismarck ND HRR, USA",-0.6873997081132217,-0.6821696706199292,-0.005230037493292539
"Dillon MT HSA, Missoula MT HRR, USA",-0.42501606159979954,-0.45900445632101544,0.0339883947212159
"Woodville TX HSA, Beaumont TX HRR, USA",-0.6431023868720024,-0.6141031958300098,-0.028999191041992556
"Plains MT HSA, Missoula MT HRR, USA",-0.5262322512882007,-0.536169029187552,0.009936777899351323
"Ronan MT HSA, Missoula MT HRR, USA",-0.13575678676121106,-0.21760078468689448,0.08184399792568342
"Algona IA HSA, Mason City IA HRR, USA",-0.3404245757658353,-0.3163388791621088,-0.024085696603726503
"Grafton WV HSA, Morgantown WV HRR, USA",-0.4770989048469012,-0.4639053528599642,-0.013193551986937002
"Eagle River WI HSA, Wausau WI HRR, USA",-0.29076724472901117,-0.2956195902710312,0.00485234554202002
"Mccall ID HSA, Boise ID HRR, USA",-0.154595775772418,-0.17691884835874738,0.022323072586329373
"Hallettsville TX HSA, Houston TX HRR, USA",-0.7376104182528865,-0.7221758186352082,-0.015434599617678346
"Nashville IL HSA, St Louis MO HRR, USA",-0.5499667682016077,-0.5386238135952239,-0.011342954606383793
"Staunton IL HSA, St Louis MO HRR, USA",-0.34735287716843494,-0.2914923422115602,-0.05586053495687476
"Mobridge SD HSA, Bismarck ND HRR, USA",-0.3581985065829906,-0.40141418384462274,0.04321567726163217
"Tallulah LA HSA, Jackson MS HRR, USA",0.16427673897896714,0.1792157799153566,-0.014939040936389453
"Gainesboro TN HSA, Nashville TN HRR, USA",-0.55761870746484,-0.46313969662883525,-0.09447901083600474
"Antlers OK HSA, Oklahoma City OK HRR, USA",-0.7069638667415094,-0.6358555693334569,-0.07110829740805247
"Aledo IL HSA, Davenport IA HRR, USA",-0.2429736123764818,-0.20193193293884518,-0.04104167943763662
"Ruleville MS HSA, Jackson MS HRR, USA",0.366531012619617,0.36675467743922013,-0.0002236648196031199
"Bryson City NC HSA, Asheville NC HRR, USA",-0.2909333570250473,-0.2918787355619583,0.0009453785369110124
"Caldwell TX HSA, Bryan TX HRR, USA",-0.6193427963793581,-0.5907689867178401,-0.028573809661518013
"Douglas WY HSA, Casper WY HRR, USA",-0.7338100275257294,-0.7395007777314608,0.0056907502057313986
"Bellville TX HSA, Houston TX HRR, USA",-0.6184262554369316,-0.6304151624548736,0.011988907017941974
"Anahuac TX HSA, Houston TX HRR, USA",-0.5773850600899353,-0.5260743313985652,-0.0513107286913701
"Nebraska City NE HSA, Omaha NE HRR, USA",-0.4256182016662699,-0.44322114878795066,0.017602947121680756
"Rolla ND HSA, Grand Forks ND HRR, USA",0.25194475703932373,0.17428604234721173,0.077658714692112
"Marion KY HSA, Paducah KY HRR, USA",-0.6446712248836894,-0.662547352737996,0.01787612785430659
"Glendive MT HSA, Billings MT HRR, USA",-0.5934667149728523,-0.6061080030759434,0.012641288103091064
"Bonners Ferry ID HSA, Spokane WA HRR, USA",-0.5976725510713976,-0.5559967920971647,-0.041675758974232924
"Meyersdale PA HSA, Johnstown PA HRR, USA",-0.6348943224202238,-0.6281562648880419,-0.006738057532181929
"Banner Elk NC HSA, Johnson City TN HRR, USA",-0.32219012373611006,-0.39045354114123515,0.06826341740512509
"Ashland PA HSA, Reading PA HRR, USA",-0.3943036822262863,-0.4362619043991034,0.04195822217281708
"Kodiak AK HSA, Anchorage AK HRR, USA",-0.19111182388112188,-0.17996928568396262,-0.011142538197159269
"Dadeville AL HSA, Birmingham AL HRR, USA",-0.4946608089639245,-0.46457693579073234,-0.030083873173192166
"Tompkinsville KY HSA, Louisville KY HRR, USA",-0.7381351402130748,-0.730095473957929,-0.00803966625514585
"Hamilton TX HSA, Waco TX HRR, USA",-0.6960642229679237,-0.7116697271375828,0.015605504169659112
"Page AZ HSA, Phoenix AZ HRR, USA",0.014290870685671322,-0.10401377681081075,0.11830464749648208
"Marietta OK HSA, Oklahoma City OK HRR, USA",-0.6354395383491113,-0.575591364930098,-0.05984817341901327
"Mcrae GA HSA, Macon GA HRR, USA",-0.26265741554517524,-0.24707911749213443,-0.015578298053040812
"Browning MT HSA, Great Falls MT HRR, USA",0.6811306382938787,0.6905714569308644,-0.00944081863698576
"Calico Rock AR HSA, Little Rock AR HRR, USA",-0.6038329192065554,-0.5326857376417415,-0.07114718156481381
"West Union IA HSA, La Crosse WI HRR, USA",-0.2990854251799961,-0.28520143597925807,-0.013883989200738023
"Perry IA HSA, Des Moines IA HRR, USA",0.02321921993141661,0.060840222569119196,-0.037621002637702586
"Mansfield LA HSA, Shreveport LA HRR, USA",0.23694422833435236,0.3696938249440604,-0.13274959660970803
"Granite Falls MN HSA, Minneapolis MN HRR, USA",-0.33194034767808134,-0.2915136167856792,-0.04042673089240212
"Trinity TX HSA, Houston TX HRR, USA",-0.5806117443542808,-0.5424398716744093,-0.03817187267987143
"Columbia LA HSA, Monroe LA HRR, USA",-0.6783554025537548,-0.6465139222420039,-0.031841480311750936
"Lodi OH HSA, Cleveland OH HRR, USA",-0.4250147918300305,-0.37502055202395557,-0.049994239806074925
"Fairfax SC HSA, Augusta GA HRR, USA",0.4301647388853078,0.46606570603375375,-0.03590096714844593
"Louisville GA HSA, Augusta GA HRR, USA",0.20530927134239702,0.24896863844117098,-0.043659367098773966
"Independence IA HSA, Waterloo IA HRR, USA",-0.14054624691996606,-0.10384733399461832,-0.03669891292534774
"Pratt KS HSA, Wichita KS HRR, USA",-0.5330436771095358,-0.5413385826771654,0.008294905567629574
"Moab UT HSA, Salt Lake City UT HRR, USA",0.11101146997989494,0.0007671552670504252,0.11024431471284452
"Eupora MS HSA, Tupelo MS HRR, USA",-0.52074472153529,-0.49527731993310986,-0.025467401602180084
"Danville AR HSA, Little Rock AR HRR, USA",-0.6460263265702448,-0.545606484256944,-0.10041984231330081
"Manistique MI HSA, Marquette MI HRR, USA",-0.31854832361716845,-0.288668949821689,-0.029879373795479447
"Windsor NC HSA, Greenville NC HRR, USA",0.17708145957457708,0.20801010972238906,-0.030928650147811987
"Folkston GA HSA, Jacksonville FL HRR, USA",-0.37514690343959906,-0.35133093881904337,-0.023815964620555685
