"Jena LA HSA, Alexandria LA HRR, USA",-0.7890547485473581,-0.7791071539527673,-0.009947594594590825
"Crossnore NC HSA, Asheville NC HRR, USA",-0.5547092642961238,-0.5849839989568033,0.030274734660679536
"Tipton IN HSA, Indianapolis IN HRR, USA",-0.5125594905841941,-0.5217510023824685,0.009191511798274377
"Mccook NE HSA, Denver CO HRR, USA",-0.686595274195769,-0.6959774945116667,0.009382220315897638
"Forsyth GA HSA, Macon GA HRR, USA",-0.2564826537141511,-0.2153993122395181,-0.04108334147463297
"Roseau MN HSA, Grand Forks ND HRR, USA",-0.4392631223459435,-0.44273283172908207,0.003469709383138564
"Hamlet NC HSA, Charlotte NC HRR, USA",-0.08597235907777918,-0.044190519134890804,-0.04178183994288838
"Pomeroy OH HSA, Columbus OH HRR, USA",-0.4938005796032529,-0.46538489417985446,-0.02841568542339845
"Paoli IN HSA, Louisville KY HRR, USA",-0.43531283983491487,-0.4011497157372464,-0.034163124097668474
"Polson MT HSA, Missoula MT HRR, USA",-0.1725145988079922,-0.23286515481353257,0.06035055600554037
"Park Falls WI HSA, Marshfield WI HRR, USA",-0.2594282922600056,-0.21533307062104093,-0.04409522163896465
"Harlan IA HSA, Omaha NE HRR, USA",-0.3834525333093823,-0.4000978199678391,0.016645286658456826
"Upper Sandusky OH HSA, Columbus OH HRR, USA",-0.4846348200797408,-0.4606037054864911,-0.02403111459324969
"Hamilton AL HSA, Tupelo MS HRR, USA",-0.7775361840712527,-0.7552085706019889,-0.02232761346926382
"Lewistown MT HSA, Billings MT HRR, USA",-0.5345280618016778,-0.5423839015513167,0.007855839749638882
"Watervliet MI HSA, St Joseph MI HRR, USA",-0.22815775219026363,-0.22698092636579603,-0.0011768258244675978
"Watford City ND HSA, Bismarck ND HRR, USA",-0.6494431140800534,-0.6073782057828059,-0.042064908297247516
"Gilmer TX HSA, Tyler TX HRR, USA",-0.6672108059385206,-0.6534667490319693,-0.013744056906551227
"Camden TN HSA, Nashville TN HRR, USA",-0.5645702170426989,-0.5121474814978023,-0.052422735544896626
"Powell WY HSA, Billings MT HRR, USA",-0.617513593151653,-0.575989983613896,-0.04152360953775702
"Lamar CO HSA, Colorado Springs CO HRR, USA",-0.4760746751513399,-0.4820449013723798,0.0059702262210399315
"Blountstown FL HSA, Tallahassee FL HRR, USA",-0.6095748982412755,-0.5464461115745642,-0.06312878666671129
"Fayette AL HSA, Tuscaloosa AL HRR, USA",-0.6051166968740141,-0.5794390165687926,-0.02567768030522155
"Rawlins WY HSA, Casper WY HRR, USA",-0.5051633235383822,-0.4547562715116485,-0.050407052026733734
"Lake City IA HSA, Des Moines IA HRR, USA",-0.4604731899164572,-0.423271785693469,-0.03720140422298818
"Rogersville TN HSA, Knoxville TN HRR, USA",-0.6830498844630835,-0.665950776767107,-0.017099107695976445
"Laurium MI HSA, Marquette MI HRR, USA",-0.20845536157601346,-0.24405545329742673,0.03560009172141326
"Owenton KY HSA, Lexington KY HRR, USA",-0.5881536184231104,-0.54042457846827,-0.04772903995484046
"Erwin TN HSA, Johnson City TN HRR, USA",-0.6019258720522888,-0.6142893657097442,0.012363493657455482
"Weimar TX HSA, Houston TX HRR, USA",-0.5716331659252302,-0.5783189420295968,0.006685776104366603
"York NE HSA, Lincoln NE HRR, USA",-0.49910709338571535,-0.5434575511646822,0.044350457778966845
"Milan TN HSA, Jackson TN HRR, USA",-0.4739724482285638,-0.47588715439751034,0.0019147061689465117
"Jasper FL HSA, Tallahassee FL HRR, USA",-0.33166068886107536,-0.2994486496722595,-0.03221203918881588
"Perryton TX HSA, Amarillo TX HRR, USA",-0.8061229641103318,-0.7924867103529233,-0.013636253757408512
"Lincoln ME HSA, Bangor ME HRR, USA",-0.3949248407678988,-0.3819069943574222,-0.013017846410476597
"Edgerton WI HSA, Madison WI HRR, USA",0.13026373947893186,0.13056929774916723,-0.0003055582702353732
"Cameron MO HSA, Kansas City MO HRR, USA",-0.5041261281537746,-0.49656682305171296,-0.0075593051020615976
"Carthage IL HSA, Springfield IL HRR, USA",-0.4690859797309394,-0.4468290689430681,-0.022256910787871287
"Hiawassee GA HSA, Atlanta GA HRR, USA",-0.6058164836257779,-0.6192446649963974,0.013428181370619519
"Driggs ID HSA, Idaho Falls ID HRR, USA",0.015033202378053391,-0.040243708995025676,0.055276911373079066
"Waseca MN HSA, Minneapolis MN HRR, USA",-0.25903614457831386,-0.2860172948278676,0.02698115024955372
"Sylvania GA HSA, Savannah GA HRR, USA",-0.1845841179024614,-0.18213526470428493,-0.002448853198176476
"Friendship WI HSA, Madison WI HRR, USA",-0.25008388051066144,-0.2049808180685837,-0.045103062442077735
"Stilwell OK HSA, Tulsa OK HRR, USA",-0.5507434387113451,-0.48323517674178357,-0.06750826196956156
"Oakdale LA HSA, Alexandria LA HRR, USA",-0.43559164733134426,-0.3737187745992259,-0.061872872732118334
"Fort Kent ME HSA, Bangor ME HRR, USA",-0.02493948488496596,0.030372890395937335,-0.0553123752809033
"Crosby MN HSA, Minneapolis MN HRR, USA",-0.281978309087327,-0.2756363853110418,-0.00634192377628523
"Aitkin MN HSA, Minneapolis MN HRR, USA",-0.26117788666538816,-0.2476204044237625,-0.013557482241625646
"Hazlehurst MS HSA, Jackson MS HRR, USA",0.18779450653592777,0.2290316911577127,-0.04123718462178494
"De Quincy LA HSA, Lake Charles LA HRR, USA",-0.6977954381834076,-0.6977718832932822,-2.355489012539902e-05
"Tazewell VA HSA, Roanoke VA HRR, USA",-0.6995812918849288,-0.6530873539632815,-0.046493937921647244
"Springhill LA HSA, Shreveport LA HRR, USA",-0.37644010945029427,-0.38704731634396344,0.010607206893669174
"Quitman TX HSA, Tyler TX HRR, USA",-0.711943437502596,-0.7219789745795268,0.010035537076930723
"Red Oak IA HSA, Omaha NE HRR, USA",-0.40607511923956746,-0.425304003553533,0.019228884313965522
"Raton NM HSA, Albuquerque NM HRR, USA",-0.1260806126992797,-0.10272204126408897,-0.023358571435190725
"Westfield NY HSA, Erie PA HRR, USA",-0.23109197634624729,-0.2705990396881471,0.039507063341899795
"Holdrege NE HSA, Lincoln NE HRR, USA",-0.6845780932015221,-0.7055723362258592,0.020994243024337167
"Fredericktown MO HSA, St Louis MO HRR, USA",-0.6280672489619651,-0.5906819426666978,-0.03738530629526726
"Sturgis SD HSA, Rapid City SD HRR, USA",-0.4762638891682646,-0.5023784637879068,0.026114574619642228
"Paris IL HSA, Urbana IL HRR, USA",-0.4949756887772852,-0.4520316145728917,-0.0429440742043935
"San Carlos AZ HSA, Phoenix AZ HRR, USA",0.6830985915492968,0.7690832374376682,-0.0859846458883714
"Wellington KS HSA, Wichita KS HRR, USA",-0.4582743988684554,-0.4665226781857461,0.008248279317290719
"Centerville IA HSA, Des Moines IA HRR, USA",-0.4020019406877327,-0.3597420220742825,-0.04225991861345019
"Heber Springs AR HSA, Little Rock AR HRR, USA",-0.6397213878725629,-0.5845579378246195,-0.05516345004794343
"Madison FL HSA, Tallahassee FL HRR, USA",-0.10117415847226281,-0.06419851788245187,-0.03697564058981094
"Abilene KS HSA, Topeka KS HRR, USA",-0.5324827933523596,-0.5306626162901097,-0.0018201770622499058
"Linden TN HSA, Nashville TN HRR, USA",-0.6325592297437092,-0.5617746928883417,-0.07078453685536745
"Calais ME HSA, Bangor ME HRR, USA",-0.13568432548720188,-0.13080028595449358,-0.004884039532708301
"Kingwood WV HSA, Morgantown WV HRR, USA",-0.5430142650977925,-0.5519676918902323,0.008953426792439823
"Maquoketa IA HSA, Davenport IA HRR, USA",-0.21839158795437372,-0.17811230872367484,-0.04027927923069888
"Windom MN HSA, Sioux Falls SD HRR, USA",-0.38393769762306185,-0.3493055812664052,-0.03463211635665664
"Brookfield MO HSA, Columbia MO HRR, USA",-0.5252691880562829,-0.4934144101706614,-0.031854777885621466
"Clintwood VA HSA, Kingsport TN HRR, USA",-0.5429207951186602,-0.5224019816695934,-0.02051881344906681
"New Hampton IA HSA, Rochester MN HRR, USA",-0.31189568607332174,-0.23647378170542488,-0.07542190436789686
"Cumberland WI HSA, Minneapolis MN HRR, USA",-0.2892711681977799,-0.2416824203053895,-0.047588747892390426
"Potosi MO HSA, St Louis MO HRR, USA",-0.6215548001890173,-0.5367536501455754,-0.08480115004344191
"Grantsburg WI HSA, Minneapolis MN HRR, USA",-0.2836141388273068,-0.2784670201845574,-0.005147118642749415
"Bowie TX HSA, Wichita Falls TX HRR, USA",-0.767835845721641,-0.7881354079185826,0.020299562196941623
"Webster City IA HSA, Des Moines IA HRR, USA",-0.24801483459253099,-0.2042997070389156,-0.043715127553615396
"Elwood IN HSA, Indianapolis IN HRR, USA",-0.44039533552550014,-0.386706389964542,-0.05368894556095816
"Lancaster WI HSA, Madison WI HRR, USA",-0.23266481004846928,-0.18440307384284085,-0.04826173620562843
"Moose Lake MN HSA, Duluth MN HRR, USA",-0.15840167189918572,-0.13121441045451332,-0.0271872614446724
"Mount Carmel IL HSA, Evansville IN HRR, USA",-0.5400931195033636,-0.5361243596537707,-0.003968759849592884
"Ville Platte LA HSA, Lafayette LA HRR, USA",-0.07371033669887707,-0.03538800425013974,-0.038322332448737326
"Creston IA HSA, Des Moines IA HRR, USA",-0.30633843791115245,-0.258517858865429,-0.047820579045723455
"Hartford City IN HSA, Muncie IN HRR, USA",-0.4692236149873938,-0.439623315075098,-0.02960029991229579
"Woodbury TN HSA, Nashville TN HRR, USA",-0.6100777222212396,-0.541331703540426,-0.06874601868081354
"Bishopville SC HSA, Columbia SC HRR, USA",0.16231276986167764,0.16192480951203805,0.0003879603496395878
"Perham MN HSA, Fargo Moorhead -Mn ND HRR, USA",-0.4220852454713615,-0.4798061147715136,0.05772086930015208
"Pittsfield IL HSA, Springfield IL HRR, USA",-0.6096258423825661,-0.572188627937681,-0.037437214444885125
"Mount Vernon KY HSA, Lexington KY HRR, USA",-0.7182414722432785,-0.7240295850406543,0.005788112797375788
"Washington GA HSA, Augusta GA HRR, USA",-0.0918014978021519,-0.10801524143735014,0.016213743635198244
"Sparta NC HSA, Winston-Salem NC HRR, USA",-0.509347275680456,-0.47622009544534655,-0.033127180235109466
"Centreville AL HSA, Tuscaloosa AL HRR, USA",-0.41968338043944037,-0.3848431124363966,-0.034840268003043795
"Shell Lake WI HSA, Minneapolis MN HRR, USA",-0.2629840545099427,-0.25979864165773575,-0.0031854128522069702
"Torrington WY HSA, Casper WY HRR, USA",-0.5651959088517136,-0.5813803797113865,0.016184470859672895
"Dardanelle AR HSA, Little Rock AR HRR, USA",-0.5308846345168866,-0.42648662133998727,-0.10439801317689934
"Wayne NE HSA, Sioux City IA HRR, USA",-0.45133091052398433,-0.4750559154629301,0.02372500493894575
"Warren AR HSA, Little Rock AR HRR, USA",-0.3323530733237344,-0.2511944832470079,-0.08115859007672654
"Afton WY HSA, Salt Lake City UT HRR, USA",-0.7240924535977665,-0.653682475706775,-0.07040997789099157
"Clinton IL HSA, Springfield IL HRR, USA",-0.4088464874241123,-0.4041057887923053,-0.004740698631806983
"Princeton KY HSA, Paducah KY HRR, USA",-0.5233148190412478,-0.5262925009243462,0.0029776818830984375
"Kaplan LA HSA, Lafayette LA HRR, USA",-0.688038393625762,-0.6568917341783111,-0.031146659447450875
"Ozark AR HSA, Fort Smith AR HRR, USA",-0.6161239920815964,-0.5511808064874728,-0.0649431855941236
"Ashland AL HSA, Birmingham AL HRR, USA",-0.5846940134221034,-0.5577028943285387,-0.026991119093564664
"Montour Falls NY HSA, Elmira NY HRR, USA",-0.1277911197815234,-0.17825932154432494,0.050468201762801534
"Mamou LA HSA, Lafayette LA HRR, USA",-0.4070100088066115,-0.42801315567595366,0.021003146869342182
"Gouverneur NY HSA, Syracuse NY HRR, USA",-0.3089059222296328,-0.2622099479329022,-0.046695974296730614
"Atoka OK HSA, Oklahoma City OK HRR, USA",-0.6795288360830762,-0.6350216628346775,-0.0445071732483987
"Ferriday LA HSA, Alexandria LA HRR, USA",0.11851996931754709,0.13029415079420525,-0.011774181476658166
"Monahans TX HSA, Odessa TX HRR, USA",-0.6318141536909371,-0.5346579422293285,-0.09715621146160858
"Nashville GA HSA, Tallahassee FL HRR, USA",-0.6310164911762325,-0.6283501591306853,-0.002666332045547226
"Winnsboro TX HSA, Tyler TX HRR, USA",-0.6923219391557479,-0.7069335170240582,0.014611577868310244
"Orange City IA HSA, Sioux City IA HRR, USA",-0.5980570890857878,-0.6199784063828426,0.02192131729705482
"Stanley WI HSA, Marshfield WI HRR, USA",-0.3807900789107113,-0.3235237350045312,-0.05726634390618013
"Ellenville NY HSA, Albany NY HRR, USA",-0.017414153403195548,-0.04452648199338769,0.027112328590192143
"Oconto Falls WI HSA, Green Bay WI HRR, USA",-0.44427122925987994,-0.4206806902111432,-0.02359053904873676
"Fairfield IL HSA, Evansville IN HRR, USA",-0.6771278935980084,-0.69555992011123,0.018432026513221622
"Redwood Falls MN HSA, Minneapolis MN HRR, USA",-0.3473612760902764,-0.38347107438016564,0.03610979828988925
"Ripon WI HSA, Neenah WI HRR, USA",-0.16645776739589604,-0.17629996648982352,0.009842199093927473
"Damariscotta ME HSA, Portland ME HRR, USA",0.2578712216533474,0.15936944867215916,0.09850177298118826
"Estherville IA HSA, Sioux Falls SD HRR, USA",-0.37183019067523065,-0.3719448286248647,0.0001146379496340666
"Washington IA HSA, Iowa City IA HRR, USA",-0.2108661291082038,-0.22502111657387963,0.014154987465675839
"Mckenzie TN HSA, Jackson TN HRR, USA",-0.5848875730791958,-0.5440492505514617,-0.04083832252773412
"Cushing OK HSA, Tulsa OK HRR, USA",-0.5520837881431336,-0.5675902195254997,0.01550643138236607
"Alliance NE HSA, Denver CO HRR, USA",-0.5825392262930671,-0.5583874757586774,-0.02415175053438967
"Preston ID HSA, Salt Lake City UT HRR, USA",-0.7803431748165867,-0.6388436633704068,-0.1414995114461799
"Osage IA HSA, Mason City IA HRR, USA",-0.28381821376575084,-0.24473875670286419,-0.03907945706288665
"Morris MN HSA, Minneapolis MN HRR, USA",-0.24704691191360226,-0.1578947368421053,-0.08915217507149695
"Susquehanna PA HSA, Scranton PA HRR, USA",-0.4156977189191072,-0.40760435532028466,-0.008093363598822512
"Braddock PA HSA, Pittsburgh PA HRR, USA",0.5861024803819092,0.5833253136638596,0.0027771667180495063
"Chelan WA HSA, Spokane WA HRR, USA",-0.10694077409276936,-0.14581908951268716,0.03887831541991779
"Plymouth NC HSA, Greenville NC HRR, USA",0.09656824552696294,0.14979512705026504,-0.0532268815233021
"Hartsville TN HSA, Nashville TN HRR, USA",-0.47955286018382304,-0.36397598209622073,-0.11557687808760231
"Man WV HSA, Charleston WV HRR, USA",-0.7469840433811653,-0.7104064689792284,-0.036577574401936874
"Kane PA HSA, Erie PA HRR, USA",-0.42075547603275737,-0.41820880806579064,-0.0025466679669667314
"Pikeville TN HSA, Chattanooga TN HRR, USA",-0.6172933305456858,-0.5413765391980734,-0.07591679134761242
"Centerville TN HSA, Nashville TN HRR, USA",-0.5604270137376466,-0.48348480185211795,-0.07694221188552863
"Nephi UT HSA, Provo UT HRR, USA",-0.7794928335170886,-0.5924468922108576,-0.1870459413062311
"Aransas Pass TX HSA, Corpus Christi TX HRR, USA",-0.47240827396180407,-0.4711245467668834,-0.0012837271949206475
"Caro MI HSA, Saginaw MI HRR, USA",-0.32662787449542197,-0.2996657397001294,-0.02696213479529258
"Chewelah WA HSA, Spokane WA HRR, USA",-0.44225590551001875,-0.4411819333377053,-0.0010739721723134754
"Valley City ND HSA, Fargo Moorhead -Mn ND HRR, USA",-0.2889096146064713,-0.27872555470265625,-0.010184059903815046
"Benton IL HSA, St Louis MO HRR, USA",-0.4615072047667699,-0.43341001681299196,-0.028097187953777913
"Ilwaco WA HSA, Portland OR HRR, USA",0.10134115583471175,0.015500659139999855,0.08584049669471189
"Lutcher LA HSA, Metairie LA HRR, USA",-0.23777055570012015,-0.18145408355642687,-0.056316472143693286
"Truth Or Consequence NM HSA, El Paso TX HRR, USA",-0.21967482841744404,-0.2747714078050599,0.055096579387615835
"Standish MI HSA, Saginaw MI HRR, USA",-0.3687746812654099,-0.3269415893754132,-0.04183309188999673
"Donalsonville GA HSA, Dothan AL HRR, USA",-0.37426851196283645,-0.3395079496856629,-0.03476056227717356
"Rupert ID HSA, Salt Lake City UT HRR, USA",-0.5412557980214966,-0.5042857676199441,-0.036970030401552445
"Bar Harbor ME HSA, Bangor ME HRR, USA",0.4148176007262693,0.35574356050167133,0.059074040224597946
"Erin TN HSA, Nashville TN HRR, USA",-0.5229177457633204,-0.42732061502756924,-0.09559713073575116
"Montevideo MN HSA, Minneapolis MN HRR, USA",-0.29013839678151643,-0.2782479176143221,-0.011890479167194323
"Claxton GA HSA, Savannah GA HRR, USA",-0.3682599481987285,-0.3536923931149371,-0.014567555083791373
"Roanoke AL HSA, Birmingham AL HRR, USA",-0.42321406404686046,-0.38566769149673635,-0.03754637255012411
"Gassaway WV HSA, Charleston WV HRR, USA",-0.4809545564687846,-0.4336766373704738,-0.047277919098310806
"Albion MI HSA, Kalamazoo MI HRR, USA",0.11784224606156418,0.16062677933200223,-0.04278453327043805
"Bisbee AZ HSA, Tucson AZ HRR, USA",0.23796517192121458,0.17865146806018425,0.059313703861030326
"Ticonderoga NY HSA, Burlington VT HRR, USA",-0.1964547913991521,-0.1966504994025321,0.00019570800338000738
"International Falls MN HSA, Minneapolis MN HRR, USA",-0.1878509945284327,-0.17613276391402516,-0.011718230614407549
"Eldorado IL HSA, Evansville IN HRR, USA",-0.4992850704086855,-0.48157783045976904,-0.017707239948916487
"Sidney NE HSA, Denver CO HRR, USA",-0.633202268559513,-0.6447683454826393,0.011566076923126278
"Mountain View AR HSA, Little Rock AR HRR, USA",-0.5692945058475861,-0.5100796251635522,-0.05921488068403391
"South Williamson KY HSA, Lexington KY HRR, USA",-0.6487488528992266,-0.6640863837744907,0.015337530875264127
"Montezuma GA HSA, Macon GA HRR, USA",0.20989287046889793,0.24776730108834633,-0.037874430619448396
"Lamar MO HSA, Joplin MO HRR, USA",-0.7001620717950879,-0.7031580703633179,0.002995998568229963
"Ishpeming MI HSA, Marquette MI HRR, USA",0.05487804878048722,0.014336213668500151,0.04054183511198707
"Blue Hill ME HSA, Bangor ME HRR, USA",0.2821238479944419,0.2295485318753437,0.052575316119098214
"Hayti MO HSA, Cape Girardeau MO HRR, USA",-0.29853598000979004,-0.17904435702981636,-0.11949162297997368
"Mendenhall MS HSA, Jackson MS HRR, USA",-0.3208206815126259,-0.328044887145705,0.007224205633079128
"Flora IL HSA, Springfield IL HRR, USA",-0.6439946796222833,-0.6252327741559185,-0.018761905466364803
"Oelwein IA HSA, Waterloo IA HRR, USA",-0.13053652225679618,-0.07690996100660552,-0.05362656125019066
"Seaside OR HSA, Portland OR HRR, USA",0.20708420148885123,0.13475517612296825,0.07232902536588298
"Seward NE HSA, Lincoln NE HRR, USA",-0.3721275995106811,-0.38892932801879515,0.016801728508114067
"Salmon ID HSA, Missoula MT HRR, USA",-0.5666940242517361,-0.5864707147320017,0.019776690480265646
"Worland WY HSA, Billings MT HRR, USA",-0.6567595464104922,-0.6327253231309753,-0.024034223279516875
"Quitman MS HSA, Meridian MS HRR, USA",-0.21966137648789813,-0.23761593758424895,0.017954561096350824
"Cherokee Village AR HSA, Little Rock AR HRR, USA",-0.5488253818757135,-0.5086366132799484,-0.040188768595765145
"Carlinville IL HSA, Springfield IL HRR, USA",-0.37495735782794165,-0.37798026653570355,0.0030229087077618955
"Pilot Knob MO HSA, St Louis MO HRR, USA",-0.5714105373648521,-0.5202834407353842,-0.051127096629467905
"Bloomer WI HSA, Minneapolis MN HRR, USA",-0.3689362940386173,-0.33699058194486986,-0.031945712093747414
"Sioux Center IA HSA, Sioux City IA HRR, USA",-0.6766316893591362,-0.7207920269480078,0.04416033758887161
"Bloomfield IA HSA, Des Moines IA HRR, USA",-0.4979590261633579,-0.46134091456973114,-0.03661811159362677
"Spooner WI HSA, Minneapolis MN HRR, USA",-0.21406462716559024,-0.2270412001648936,0.012976572999303354
"Macon MS HSA, Meridian MS HRR, USA",0.5264103586591926,0.5663584407181756,-0.03994808205898304
"Tonasket WA HSA, Spokane WA HRR, USA",-0.39556156679261806,-0.4021674725842313,0.006605905791613242
"Cherokee IA HSA, Sioux City IA HRR, USA",-0.38030009281963756,-0.3888491335791772,0.008549040759539661
"Union Springs AL HSA, Montgomery AL HRR, USA",0.5868098893413546,0.5837020741001985,0.003107815241156109
"Lake Isabella CA HSA, Bakersfield CA HRR, USA",-0.41023992992264996,-0.45002086565586397,0.03978093573321401
"Delhi LA HSA, Monroe LA HRR, USA",-0.2700361690188532,-0.2712082909426034,0.0011721219237502134
"Philippi WV HSA, Morgantown WV HRR, USA",-0.5214952122687427,-0.5201394061118514,-0.0013558061568913482
"Pinckneyville IL HSA, St Louis MO HRR, USA",-0.5478327288178376,-0.540613284004195,-0.0072194448136426725
"Estes Park CO HSA, Fort Collins CO HRR, USA",0.15737756704277897,0.03229003949992031,0.12508752754285865
"Kellogg ID HSA, Spokane WA HRR, USA",-0.3774605572633215,-0.33745423904615873,-0.04000631821716277
"Hettinger ND HSA, Bismarck ND HRR, USA",-0.6873997081132168,-0.6821696706199211,-0.005230037493295758
"Dillon MT HSA, Missoula MT HRR, USA",-0.42501606159979866,-0.4590044563210142,0.033988394721215565
"Woodville TX HSA, Beaumont TX HRR, USA",-0.6431023868720032,-0.6141031958300109,-0.028999191041992223
"Plains MT HSA, Missoula MT HRR, USA",-0.5262322512882007,-0.5361690291875497,0.009936777899348992
"Ronan MT HSA, Missoula MT HRR, USA",-0.13575678676121186,-0.21760078468689445,0.08184399792568259
"Algona IA HSA, Mason City IA HRR, USA",-0.3404245757658359,-0.31633887916210685,-0.024085696603729057
"Grafton WV HSA, Morgantown WV HRR, USA",-0.4770989048469003,-0.46390535285996415,-0.01319355198693617
"Eagle River WI HSA, Wausau WI HRR, USA",-0.2907672447290114,-0.29561959027103096,0.004852345542019576
"Mccall ID HSA, Boise ID HRR, USA",-0.15459577577241582,-0.17691884835874921,0.022323072586333398
"Hallettsville TX HSA, Houston TX HRR, USA",-0.7376104182528881,-0.7221758186352092,-0.015434599617678901
"Nashville IL HSA, St Louis MO HRR, USA",-0.5499667682016092,-0.5386238135952227,-0.011342954606386457
"Staunton IL HSA, St Louis MO HRR, USA",-0.3473528771684343,-0.29149234221155956,-0.05586053495687476
"Mobridge SD HSA, Bismarck ND HRR, USA",-0.35819850658299074,-0.4014141838446237,0.043215677261632945
"Tallulah LA HSA, Jackson MS HRR, USA",0.16427673897896683,0.1792157799153568,-0.01493904093638998
"Gainesboro TN HSA, Nashville TN HRR, USA",-0.55761870746484,-0.4631396966288344,-0.09447901083600557
"Antlers OK HSA, Oklahoma City OK HRR, USA",-0.7069638667415101,-0.6358555693334579,-0.07110829740805225
"Aledo IL HSA, Davenport IA HRR, USA",-0.24297361237648132,-0.20193193293884462,-0.0410416794376367
"Ruleville MS HSA, Jackson MS HRR, USA",0.366531012619617,0.3667546774392191,-0.0002236648196020652
"Bryson City NC HSA, Asheville NC HRR, USA",-0.2909333570250474,-0.2918787355619581,0.0009453785369106793
"Caldwell TX HSA, Bryan TX HRR, USA",-0.6193427963793574,-0.5907689867178404,-0.028573809661517013
"Douglas WY HSA, Casper WY HRR, USA",-0.7338100275257284,-0.7395007777314607,0.005690750205732287
"Bellville TX HSA, Houston TX HRR, USA",-0.6184262554369313,-0.6304151624548735,0.011988907017942196
"Anahuac TX HSA, Houston TX HRR, USA",-0.5773850600899342,-0.5260743313985647,-0.051310728691369434
"Nebraska City NE HSA, Omaha NE HRR, USA",-0.4256182016662713,-0.44322114878794977,0.01760294712167848
"Rolla ND HSA, Grand Forks ND HRR, USA",0.25194475703932284,0.174286042347211,0.07765871469211183
"Marion KY HSA, Paducah KY HRR, USA",-0.6446712248836891,-0.662547352737998,0.01787612785430892
"Glendive MT HSA, Billings MT HRR, USA",-0.5934667149728532,-0.6061080030759433,0.012641288103090065
"Bonners Ferry ID HSA, Spokane WA HRR, USA",-0.597672551071398,-0.5559967920971637,-0.04167575897423437
"Meyersdale PA HSA, Johnstown PA HRR, USA",-0.6348943224202237,-0.6281562648880433,-0.006738057532180375
"Banner Elk NC HSA, Johnson City TN HRR, USA",-0.32219012373611083,-0.3904535411412357,0.06826341740512487
"Ashland PA HSA, Reading PA HRR, USA",-0.3943036822262848,-0.43626190439910356,0.04195822217281875
"Kodiak AK HSA, Anchorage AK HRR, USA",-0.19111182388112224,-0.17996928568396267,-0.011142538197159574
"Dadeville AL HSA, Birmingham AL HRR, USA",-0.4946608089639242,-0.46457693579073156,-0.030083873173192666
"Tompkinsville KY HSA, Louisville KY HRR, USA",-0.7381351402130747,-0.7300954739579282,-0.008039666255146516
"Hamilton TX HSA, Waco TX HRR, USA",-0.696064222967922,-0.7116697271375826,0.015605504169660556
"Page AZ HSA, Phoenix AZ HRR, USA",0.01429087068567224,-0.10401377681081103,0.11830464749648327
"Marietta OK HSA, Oklahoma City OK HRR, USA",-0.6354395383491128,-0.575591364930099,-0.05984817341901383
"Mcrae GA HSA, Macon GA HRR, USA",-0.2626574155451745,-0.24707911749213504,-0.01557829805303948
"Browning MT HSA, Great Falls MT HRR, USA",0.6811306382938788,0.6905714569308642,-0.009440818636985426
"Calico Rock AR HSA, Little Rock AR HRR, USA",-0.6038329192065549,-0.5326857376417421,-0.07114718156481281
"West Union IA HSA, La Crosse WI HRR, USA",-0.2990854251799968,-0.2852014359792592,-0.013883989200737634
"Perry IA HSA, Des Moines IA HRR, USA",0.023219219931416547,0.06084022256911939,-0.03762100263770284
"Mansfield LA HSA, Shreveport LA HRR, USA",0.23694422833435289,0.36969382494406094,-0.13274959660970806
"Granite Falls MN HSA, Minneapolis MN HRR, USA",-0.33194034767808167,-0.29151361678567933,-0.04042673089240234
"Trinity TX HSA, Houston TX HRR, USA",-0.5806117443542802,-0.5424398716744105,-0.038171872679869656
"Columbia LA HSA, Monroe LA HRR, USA",-0.6783554025537532,-0.6465139222420037,-0.03184148031174949
"Lodi OH HSA, Cleveland OH HRR, USA",-0.4250147918300314,-0.37502055202395596,-0.049994239806075425
"Fairfax SC HSA, Augusta GA HRR, USA",0.4301647388853086,0.4660657060337529,-0.03590096714844432
"Louisville GA HSA, Augusta GA HRR, USA",0.20530927134239824,0.2489686384411705,-0.04365936709877227
"Independence IA HSA, Waterloo IA HRR, USA",-0.14054624691996645,-0.10384733399462073,-0.03669891292534572
"Pratt KS HSA, Wichita KS HRR, USA",-0.533043677109536,-0.5413385826771631,0.00829490556762702
"Moab UT HSA, Salt Lake City UT HRR, USA",0.11101146997989503,0.0007671552670503233,0.11024431471284471
"Eupora MS HSA, Tupelo MS HRR, USA",-0.5207447215352892,-0.49527731993310986,-0.025467401602179307
"Danville AR HSA, Little Rock AR HRR, USA",-0.6460263265702447,-0.5456064842569439,-0.10041984231330081
"Manistique MI HSA, Marquette MI HRR, USA",-0.31854832361716795,-0.28866894982168934,-0.029879373795478614
"Windsor NC HSA, Greenville NC HRR, USA",0.177081459574577,0.2080101097223885,-0.030928650147811515
"Folkston GA HSA, Jacksonville FL HRR, USA",-0.37514690343959983,-0.35133093881904326,-0.023815964620556573
"Cadiz OH HSA, Pittsburgh PA HRR, USA",-0.5155910149520067,-0.4818001669256079,-0.033790848026398757
"Greensburg KY HSA, Louisville KY HRR, USA",-0.6709265110704374,-0.6607688950602539,-0.010157616010183501
