"Corinth MS HSA, Memphis TN HRR, USA",-0.638367266152614,-0.6153581597353027,-0.023009106417311243
"Bryan OH HSA, Fort Wayne IN HRR, USA",-0.47014029015879194,-0.4471238563721786,-0.023016433786613333
"Millersburg OH HSA, Canton OH HRR, USA",-0.6768457800483604,-0.6249009696466397,-0.05194481040172072
"Key West FL HSA, Miami FL HRR, USA",0.10137338953844613,0.12832905709863232,-0.02695566756018619
"Mccomb MS HSA, Jackson MS HRR, USA",-0.10049293396515517,-0.10837088715301904,0.00787795318786387
"Radford VA HSA, Roanoke VA HRR, USA",-0.2668625639223081,-0.266928964991006,6.640106869787443e-05
"Berlin WI HSA, Neenah WI HRR, USA",-0.33508075198810217,-0.3255126786326157,-0.009568073355486484
"Thomasville NC HSA, Winston-Salem NC HRR, USA",-0.4130214379121065,-0.41422260948640405,0.0012011715742975548
"Reidsville NC HSA, Greensboro NC HRR, USA",-0.20656312152824602,-0.17513266206399447,-0.03143045946425155
"Stillwater MN HSA, St Paul MN HRR, USA",0.08961274077927905,0.0124022882317933,0.07721045254748575
"Coldwater OH HSA, Dayton OH HRR, USA",-0.6566286178931118,-0.6559861571313718,-0.0006424607617400158
"De Ridder LA HSA, Lake Charles LA HRR, USA",-0.6044940620103639,-0.5892985510095496,-0.015195511000814288
"Menomonie WI HSA, Minneapolis MN HRR, USA",-0.1397571743192502,-0.0947888741130794,-0.04496830020617079
"Morris IL HSA, Joliet IL HRR, USA",-0.2978749837037287,-0.2672968818380603,-0.03057810186566845
"Sylva NC HSA, Asheville NC HRR, USA",-0.06843629648888103,-0.09740360944957717,0.028967312960696143
"Front Royal VA HSA, Winchester VA HRR, USA",-0.3329903182687833,-0.3552472630926777,0.022256944823894398
"New Prague MN HSA, Minneapolis MN HRR, USA",-0.34446799572319325,-0.362980295870429,0.01851230014723576
"Williston ND HSA, Minot ND HRR, USA",-0.6587443105815974,-0.6423352258238957,-0.016409084757701753
"Athens TN HSA, Knoxville TN HRR, USA",-0.5874760724865254,-0.5781607444400104,-0.009315328046515026
"Watertown SD HSA, Sioux Falls SD HRR, USA",-0.43094130500268873,-0.42090385058769997,-0.010037454414988767
"Clinton SC HSA, Greenville SC HRR, USA",-0.2127025357215698,-0.18447146403954812,-0.028231071682021686
"Brookfield WI HSA, Milwaukee WI HRR, USA",-0.08486402991390424,-0.19631804054999125,0.11145401063608701
"Hannibal MO HSA, Columbia MO HRR, USA",-0.49784966048400037,-0.4900341968682432,-0.00781546361575719
"Buffalo MN HSA, Minneapolis MN HRR, USA",-0.28658785477023674,-0.30300943649291756,0.016421581722680823
"Anacortes WA HSA, Everett WA HRR, USA",0.34186419717556465,0.25988607732592944,0.08197811984963521
"Crawfordsville IN HSA, Indianapolis IN HRR, USA",-0.5011216100371731,-0.5145265872303344,0.01340497719316125
"Brockport NY HSA, Rochester NY HRR, USA",-0.23257780696501623,-0.2864202011336342,0.05384239416861797
"Hastings NE HSA, Lincoln NE HRR, USA",-0.4589609635988466,-0.4933965629366206,0.034435599337774014
"Fremont OH HSA, Toledo OH HRR, USA",-0.23710332798269787,-0.1956710086682523,-0.041432319314445576
"Kittanning PA HSA, Pittsburgh PA HRR, USA",-0.5512634999988096,-0.5394523029559017,-0.011811197042907895
"Kirksville MO HSA, Columbia MO HRR, USA",-0.401652727177077,-0.386563242022434,-0.015089485154643034
"Laramie WY HSA, Fort Collins CO HRR, USA",-0.021310384560474394,-0.08433336458821183,0.06302298002773744
"Brookhaven MS HSA, Jackson MS HRR, USA",-0.3574314698317371,-0.3611834753417315,0.0037520055099943828
"Mocksville NC HSA, Winston-Salem NC HRR, USA",-0.47027610178135076,-0.4857181635719284,0.01544206179057761
"Talladega AL HSA, Birmingham AL HRR, USA",-0.19982425486747513,-0.16999901009420113,-0.029825244773274
"East Liverpool OH HSA, Pittsburgh PA HRR, USA",-0.4259533395401193,-0.3740072394882949,-0.05194610005182443
"Butte MT HSA, Missoula MT HRR, USA",0.057929522966428414,0.057093601480150434,0.0008359214862779796
"Emporia KS HSA, Topeka KS HRR, USA",-0.19947521687682526,-0.23680561034286718,0.03733039346604192
"Brenham TX HSA, Houston TX HRR, USA",-0.5183674676342493,-0.5337185682477852,0.01535110061353584
"Hopewell VA HSA, Richmond VA HRR, USA",0.04453241925197497,-0.0067638222736401046,0.05129624152561508
"Dodge City KS HSA, Wichita KS HRR, USA",-0.3831569259088831,-0.4369034994697739,0.0537465735608908
"York ME HSA, Portland ME HRR, USA",0.28437174272702975,0.1951021673466042,0.08926957538042554
"Dickinson ND HSA, Bismarck ND HRR, USA",-0.6509987189504474,-0.6544434531348569,0.0034447341844094925
"Ponca City OK HSA, Oklahoma City OK HRR, USA",-0.4968197639122606,-0.4821248081244424,-0.014694955787818209
"Chisago City MN HSA, St Paul MN HRR, USA",-0.2892355181315675,-0.30542695649976476,0.016191438368197253
"Wellsboro PA HSA, Sayre PA HRR, USA",-0.5014177567336653,-0.5267704577161665,0.025352700982501197
"Lehighton PA HSA, Allentown PA HRR, USA",-0.28668477522349084,-0.30385859508430013,0.017173819860809292
"Escanaba MI HSA, Marquette MI HRR, USA",-0.2714799918919278,-0.26237973178795837,-0.009100260103969415
"San Andreas CA HSA, Stockton CA HRR, USA",-0.22693687123978004,-0.22967690225253373,0.002740031012753691
"Mount Pleasant PA HSA, Pittsburgh PA HRR, USA",-0.4415897987251805,-0.43134443847235887,-0.010245360252821634
"Hartford WI HSA, Milwaukee WI HRR, USA",-0.4419623954941924,-0.44525528889435845,0.0032928934001660304
"Peterborough NH HSA, Manchester NH HRR, USA",0.021088323312925723,-0.02957054493648585,0.05065886824941157
"Clinton MO HSA, Kansas City MO HRR, USA",-0.506817181422699,-0.48041482183366035,-0.026402359589038693
"Soldotna AK HSA, Anchorage AK HRR, USA",-0.48598504611370935,-0.522697626809536,0.03671258069582667
"Berea KY HSA, Lexington KY HRR, USA",-0.44724244973631966,-0.4740724844590172,0.026830034722697516
"Bartow FL HSA, Lakeland FL HRR, USA",-0.23347239351241586,-0.16531199372543662,-0.06816039978697924
"Oneida NY HSA, Syracuse NY HRR, USA",-0.22527719186870834,-0.24593700019508632,0.020659808326377982
"Sidney OH HSA, Dayton OH HRR, USA",-0.595443869710845,-0.5694518665293966,-0.025992003181448342
"Sweetwater TN HSA, Knoxville TN HRR, USA",-0.6312757646700476,-0.5902439278453517,-0.04103183682469591
"Albert Lea MN HSA, Rochester MN HRR, USA",-0.19353760784560195,-0.19987884505657014,0.006341237210968187
"Florence AZ HSA, Mesa AZ HRR, USA",-0.2735420305231676,-0.2825131153334768,0.008971084810309171
"Wickenburg AZ HSA, Sun City AZ HRR, USA",-0.3221545788999192,-0.34963766984346795,0.027483090943548727
"Brookings SD HSA, Sioux Falls SD HRR, USA",-0.15950876682333745,-0.1734220686601368,0.013913301836799341
"Brawley CA HSA, San Diego CA HRR, USA",0.17236183135866356,0.275982776096025,-0.10362094473736144
"Dyersburg TN HSA, Memphis TN HRR, USA",-0.56541471539725,-0.5451500467287277,-0.02026466866852228
"North Platte NE HSA, Lincoln NE HRR, USA",-0.579681983610049,-0.6112197401131763,0.03153775650312729
"Moscow ID HSA, Spokane WA HRR, USA",0.05871293942841256,0.06465831044311948,-0.005945371014706921
"Garden City KS HSA, Wichita KS HRR, USA",-0.24018178700051546,-0.3050273768043801,0.06484558980386462
"Redmond OR HSA, Bend OR HRR, USA",-0.19816264242719497,-0.2863711765899517,0.08820853416275673
"Faribault MN HSA, Minneapolis MN HRR, USA",-0.20116141719489633,-0.21757919028559644,0.01641777309070011
"Newberg OR HSA, Portland OR HRR, USA",-0.007456058023656882,-0.07000985660044678,0.0625537985767899
"La Grange KY HSA, Louisville KY HRR, USA",-0.3392261779085521,-0.3968039059801974,0.057577728071645295
"Monticello MN HSA, Minneapolis MN HRR, USA",-0.30590717505870013,-0.3506273532128947,0.044720178154194545
"Iron Mountain MI HSA, Green Bay WI HRR, USA",-0.3611839028889745,-0.37183852805638673,0.010654625167412224
"Mineral Wells TX HSA, Fort Worth TX HRR, USA",-0.6786916540696951,-0.6656760771021688,-0.01301557696752631
"Lawrenceburg TN HSA, Nashville TN HRR, USA",-0.6456188294746497,-0.6108598584204104,-0.03475897105423931
"Sharon CT HSA, Hartford CT HRR, USA",0.18732443830355458,0.09204471069301028,0.0952797276105443
"New Kensington PA HSA, Pittsburgh PA HRR, USA",-0.13108458123011754,-0.14872999034479334,0.017645409114675797
"South Miami FL HSA, Miami FL HRR, USA",0.08326228286125356,0.18268456136396374,-0.09942227850271018
"Red Bluff CA HSA, Chico CA HRR, USA",-0.3561805518249706,-0.36739254297902324,0.011211991154052636
"Ottumwa IA HSA, Iowa City IA HRR, USA",-0.2572099531365014,-0.22548018168141137,-0.03172977145509004
"Walterboro SC HSA, Charleston SC HRR, USA",-0.07843817728834908,-0.06730080566199725,-0.011137371626351825
"Moulton AL HSA, Birmingham AL HRR, USA",-0.6572933576378234,-0.5988325952412489,-0.058460762396574495
"Sonoma CA HSA, Santa Rosa CA HRR, USA",0.5583327720121285,0.5003658671268604,0.05796690488526812
"Ridgecrest CA HSA, San Bernardino CA HRR, USA",-0.29430682083291776,-0.3456771811552356,0.05137036032231784
"Alice TX HSA, Corpus Christi TX HRR, USA",0.042823324025197874,0.287949870845094,-0.24512654681989612
"Marianna FL HSA, Dothan AL HRR, USA",-0.3930060569313879,-0.37122115524219057,-0.021784901689197333
"Grove City PA HSA, Pittsburgh PA HRR, USA",-0.3836386037347221,-0.380614447410747,-0.003024156323975069
"Ware MA HSA, Springfield MA HRR, USA",0.10089981499239306,0.014913136780301189,0.08598667821209187
"Jasper GA HSA, Atlanta GA HRR, USA",-0.6618697247419688,-0.695784802981159,0.033915078239190155
"Whiteville NC HSA, Wilmington NC HRR, USA",-0.3131270577859068,-0.2512159575440759,-0.06191110024183094
"Guthrie OK HSA, Oklahoma City OK HRR, USA",-0.46614018660397527,-0.5078816761696311,0.04174148956565582
"Hastings MN HSA, St Paul MN HRR, USA",-0.1333715138072182,-0.15585300933910287,0.022481495531884665
"Gloucester MA HSA, Boston MA HRR, USA",0.38816120594230696,0.29061801807658655,0.09754318786572042
"Junction City KS HSA, Topeka KS HRR, USA",-0.13953972716859336,-0.21737934827444,0.07783962110584663
"Juneau AK HSA, Anchorage AK HRR, USA",0.2626565527275918,0.17162293173051243,0.09103362099707937
"Jacksonville AL HSA, Birmingham AL HRR, USA",-0.5120639928687151,-0.5341123828217297,0.022048389953014613
"Farmington ME HSA, Portland ME HRR, USA",-0.045082299566792425,-0.06164326869301286,0.01656096912622044
"Hudson WI HSA, St Paul MN HRR, USA",-0.050677590900596925,-0.11656077978476509,0.06588318888416816
"Alamosa CO HSA, Colorado Springs CO HRR, USA",-0.022463556212848484,-0.01985934223248472,-0.0026042139803637634
"Greenwood MS HSA, Jackson MS HRR, USA",0.15800319281932576,0.16355808789786025,-0.005554895078534489
"Dunkirk NY HSA, Buffalo NY HRR, USA",-0.06862782642155384,-0.07786203725902555,0.00923421083747171
"Sulphur Springs TX HSA, Dallas TX HRR, USA",-0.6051578992109035,-0.6040316032003819,-0.0011262960105216102
"Sault Ste Marie MI HSA, Petoskey MI HRR, USA",-0.22552626512072224,-0.2381535483041341,0.012627283183411858
"Pittsburg KS HSA, Joplin MO HRR, USA",-0.21223325513448518,-0.21043182271563027,-0.0018014324188549147
"Union City TN HSA, Memphis TN HRR, USA",-0.5771777038190145,-0.5429527505127285,-0.03422495330628594
"Little Falls MN HSA, Minneapolis MN HRR, USA",-0.5288821494574238,-0.5217093115273012,-0.0071728379301226886
"Baraboo WI HSA, Madison WI HRR, USA",-0.0131003718746539,-0.03436845030598824,0.021268078431334346
"Niagara Falls NY HSA, Buffalo NY HRR, USA",0.27022641037913403,0.2147942942043499,0.055432116174784135
"Bay St Louis MS HSA, Slidell LA HRR, USA",-0.4843337840928535,-0.5322982723790042,0.047964488286150686
"Kaufman TX HSA, Dallas TX HRR, USA",-0.6061648995078528,-0.6339293385439807,0.027764439036127908
"Newport TN HSA, Knoxville TN HRR, USA",-0.6477663354910109,-0.6438915083684633,-0.0038748271225476083
"Big Spring TX HSA, Lubbock TX HRR, USA",-0.6019462039842064,-0.5757964507162721,-0.02614975326793434
"Manchester TN HSA, Nashville TN HRR, USA",-0.5601319372096586,-0.5270886967679269,-0.03304324044173168
"Aliquippa PA HSA, Pittsburgh PA HRR, USA",-0.08033342482669535,-0.07978975854692597,-0.0005436662797693864
"Hillsdale MI HSA, Kalamazoo MI HRR, USA",-0.4943245456249146,-0.4802505730599234,-0.01407397256499121
"Shelbyville IN HSA, Indianapolis IN HRR, USA",-0.45123146420967747,-0.44539368432685766,-0.005837779882819805
"Pullman WA HSA, Spokane WA HRR, USA",0.38761609769805216,0.32584653873117775,0.061769558966874416
"Ahoskie NC HSA, Greenville NC HRR, USA",0.2763081754298514,0.3158869635538905,-0.03957878812403909
"Sandpoint ID HSA, Spokane WA HRR, USA",-0.2937731312305501,-0.2996493631230522,0.005876231892502082
"The Dalles OR HSA, Portland OR HRR, USA",-0.12277465641719337,-0.16415373319558357,0.0413790767783902
"Americus GA HSA, Albany GA HRR, USA",-0.06118505691452263,-0.06982053818461248,0.008635481270089847
"Woodstock IL HSA, Rockford IL HRR, USA",0.06148371203685645,-0.009140332854657787,0.07062404489151423
"Mexico MO HSA, Columbia MO HRR, USA",-0.5182721616051583,-0.4883039160131413,-0.029968245592016995
"Detroit Lakes MN HSA, Fargo Moorhead -Mn ND HRR, USA",-0.2862846480957768,-0.31254897097993944,0.02626432288416264
"Vidalia GA HSA, Savannah GA HRR, USA",-0.46463284445555725,-0.481324231306979,0.01669138685142174
"Cooperstown NY HSA, Albany NY HRR, USA",-0.11704041051390604,-0.18922235187111416,0.07218194135720812
"Jasper IN HSA, Evansville IN HRR, USA",-0.43806227656096663,-0.4396024252762444,0.0015401487152777449
"Angleton TX HSA, Houston TX HRR, USA",-0.4685896108346079,-0.4653006672451409,-0.003288943589466964
"Burley ID HSA, Salt Lake City UT HRR, USA",-0.6577883887559359,-0.5917288698296459,-0.06605951892629003
"Wauseon OH HSA, Toledo OH HRR, USA",-0.4254853872682162,-0.3887857570921643,-0.036699630176051934
"Grayling MI HSA, Traverse City MI HRR, USA",-0.29997327583754174,-0.31300220370484694,0.013028927867305196
"Lagrange IN HSA, Fort Wayne IN HRR, USA",-0.5269369736004345,-0.4979248944224887,-0.029012079177945738
"Dahlonega GA HSA, Atlanta GA HRR, USA",-0.5864298308603791,-0.6026025867718098,0.016172755911430636
"Brigham City UT HSA, Ogden UT HRR, USA",-0.5636972993715152,-0.4572017497744083,-0.10649554959710694
"San Dimas CA HSA, Los Angeles CA HRR, USA",0.02587044848881928,0.011219696429215336,0.014650752059603945
"Lucedale MS HSA, Mobile AL HRR, USA",-0.7648374555231076,-0.7675521869594397,0.002714731436332163
"Natchitoches LA HSA, Shreveport LA HRR, USA",-0.07479694980861963,-0.04415688129378133,-0.030640068514838303
"Jackson WY HSA, Salt Lake City UT HRR, USA",0.08535716717075924,0.0036557401113183467,0.08170142705944089
"Columbus NE HSA, Omaha NE HRR, USA",-0.5625104724434856,-0.5778903774359027,0.015379904992417037
"Defiance OH HSA, Fort Wayne IN HRR, USA",-0.33946019583101195,-0.3211322289136003,-0.01832796691741162
"Fergus Falls MN HSA, Fargo Moorhead -Mn ND HRR, USA",-0.2781317321354915,-0.31852191174225253,0.040390179606761
"South Lake Tahoe CA HSA, Sacramento CA HRR, USA",0.27399078300084206,0.18096559302660123,0.09302518997424084
"Kingsville TX HSA, Corpus Christi TX HRR, USA",-0.029418001057529373,0.05165212539873657,-0.08107012645626595
"Neosho MO HSA, Joplin MO HRR, USA",-0.6119065143771367,-0.5880717827205527,-0.023834731656584007
"Tiffin OH HSA, Toledo OH HRR, USA",-0.34172903885274136,-0.3273733097211697,-0.014355729131571682
"Arcadia FL HSA, Sarasota FL HRR, USA",-0.33040227565363195,-0.28361830738553784,-0.04678396826809411
"Muscatine IA HSA, Iowa City IA HRR, USA",-0.10314731999004859,-0.08976264826192325,-0.013384671728125339
"Decatur IN HSA, Fort Wayne IN HRR, USA",-0.5166298338625982,-0.5111274488962527,-0.005502384966345475
"Stony Brook NY HSA, East Long Island NY HRR, USA",0.0605123066984665,0.03580617432031243,0.02470613237815407
"Clare MI HSA, Lansing MI HRR, USA",-0.33152755648208776,-0.30761046862343877,-0.02391708785864899
"Lakeport CA HSA, Napa CA HRR, USA",0.06282412313985988,0.024776836191747482,0.0380472869481124
"Grand Rapids MN HSA, Minneapolis MN HRR, USA",-0.174576810846395,-0.1786656454582738,0.004088834611878783
"Wytheville VA HSA, Roanoke VA HRR, USA",-0.5873833487390354,-0.5648933867607455,-0.022489961978289896
"Yankton SD HSA, Sioux Falls SD HRR, USA",-0.37012352559997597,-0.3610256712381238,-0.009097854361852176
"Lackawanna NY HSA, Buffalo NY HRR, USA",0.08047114647876108,0.02572720143002667,0.05474394504873441
"Oakdale CA HSA, Modesto CA HRR, USA",-0.3339268880337227,-0.31761212958978324,-0.01631475844393948
"Jacksonville TX HSA, Tyler TX HRR, USA",-0.5150778616947741,-0.5203342345705264,0.005256372875752313
"Dunedin FL HSA, Clearwater FL HRR, USA",-0.014927763278914987,-0.05254931645850778,0.037621553179592794
"Lakewood CA HSA, Los Angeles CA HRR, USA",0.2786552322482341,0.2741562439901724,0.004498988258061665
"Ottawa IL HSA, Peoria IL HRR, USA",-0.08079289255873547,-0.08484407354841632,0.004051180989680853
"Royston GA HSA, Atlanta GA HRR, USA",-0.6753308491572115,-0.6630475770316566,-0.012283272125554912
"Marion IL HSA, Paducah KY HRR, USA",-0.42276549178214967,-0.45411078949463407,0.0313452977124844
"Lewisburg TN HSA, Nashville TN HRR, USA",-0.501498988136415,-0.4691207829199408,-0.03237820521647422
"Owatonna MN HSA, Rochester MN HRR, USA",-0.21723199329983417,-0.25879905218748184,0.04156705888764767
"Silver City NM HSA, Albuquerque NM HRR, USA",0.020194325455915672,0.030631818351720894,-0.010437492895805221
"Lock Haven PA HSA, Danville PA HRR, USA",-0.3622283607725089,-0.3318511198542941,-0.03037724091821481
"Carbondale IL HSA, St Louis MO HRR, USA",0.2659609388382407,0.25650925854787954,0.009451680290361142
"Tazewell TN HSA, Knoxville TN HRR, USA",-0.6577458981436224,-0.6350207887964241,-0.02272510934719829
"Malone NY HSA, Burlington VT HRR, USA",-0.11021009232805987,-0.13443951027727014,0.02422941794921027
"Lexington VA HSA, Roanoke VA HRR, USA",-0.20938041761308207,-0.1771295702134986,-0.03225084739958348
"North Adams MA HSA, Springfield MA HRR, USA",0.41334266633367217,0.36845726309625576,0.04488540323741641
"Mount Pleasant TX HSA, Tyler TX HRR, USA",-0.4431826440773208,-0.41690573882526266,-0.026276905252058114
"Tullahoma TN HSA, Nashville TN HRR, USA",-0.4913883525198414,-0.4933054597814515,0.001917107261610096
"Streator IL HSA, Peoria IL HRR, USA",-0.3512141059187268,-0.3157225993003765,-0.03549150661835032
"Nassawadox VA HSA, Norfolk VA HRR, USA",0.04707267715520866,0.027126756062011603,0.019945921093197056
"Gainesville TX HSA, Dallas TX HRR, USA",-0.6187632241332157,-0.6467261386052303,0.0279629144720146
"Abbeville LA HSA, Lafayette LA HRR, USA",-0.5303461015901091,-0.5010589407278371,-0.02928716086227201
"New Richmond WI HSA, St Paul MN HRR, USA",-0.2515134531929843,-0.2698666940494706,0.01835324085648632
"Coshocton OH HSA, Columbus OH HRR, USA",-0.47672093998744314,-0.4236690760907074,-0.05305186389673572
"Dansville NY HSA, Rochester NY HRR, USA",-0.377652325916777,-0.41053385501868306,0.03288152910190606
"Portsmouth NH HSA, Manchester NH HRR, USA",0.3754018204351756,0.29812790453735,0.07727391589782562
"Logansport IN HSA, Indianapolis IN HRR, USA",-0.39309941354019723,-0.40851756840173686,0.015418154861539635
"Washington IN HSA, Evansville IN HRR, USA",-0.6168999979594582,-0.618945103967963,0.0020451060085048267
"Everett PA HSA, Altoona PA HRR, USA",-0.6485846408150484,-0.6491551816436436,0.0005705408285952007
"Spruce Pine NC HSA, Asheville NC HRR, USA",-0.4445039582690494,-0.4366797623568812,-0.007824195912168208
"Brevard NC HSA, Asheville NC HRR, USA",-0.15643991374240418,-0.22172477474956506,0.06528486100716088
"Troy AL HSA, Montgomery AL HRR, USA",-0.17402309521708312,-0.20035588866015458,0.02633279344307146
"Scottsboro AL HSA, Huntsville AL HRR, USA",-0.6641050145246067,-0.6115476955563092,-0.05255731896829752
"Hays KS HSA, Wichita KS HRR, USA",-0.47418161628688665,-0.5155043021390253,0.04132268585213866
"Bluffton IN HSA, Fort Wayne IN HRR, USA",-0.5679895050495588,-0.5630035184044594,-0.004985986645099416
"Logan WV HSA, Charleston WV HRR, USA",-0.6430188967308472,-0.6505435196981372,0.007524622967289951
"Leitchfield KY HSA, Louisville KY HRR, USA",-0.599870658605124,-0.5993555829309215,-0.0005150756742025031
"Grove OK HSA, Joplin MO HRR, USA",-0.5771904352788723,-0.5451047559168726,-0.032085679361999686
"Paris TN HSA, Jackson TN HRR, USA",-0.5118689733215408,-0.49399641796994553,-0.017872555351595265
"La Follette TN HSA, Knoxville TN HRR, USA",-0.6658208069305368,-0.616857964025551,-0.04896284290498576
"Blackfoot ID HSA, Idaho Falls ID HRR, USA",-0.5107696460781815,-0.4331994733114176,-0.07757017276676392
"Warren PA HSA, Erie PA HRR, USA",-0.3737061359985795,-0.3821879428702667,0.008481806871687203
"Paw Paw MI HSA, Kalamazoo MI HRR, USA",-0.15768195222383655,-0.16667401825824416,0.008992066034407609
"Truckee CA HSA, Reno NV HRR, USA",0.5051447031537968,0.385148779002159,0.11999592415163779
"Kingston PA HSA, Wilkes-Barre PA HRR, USA",0.016766121357270448,-0.057698994828580014,0.07446511618585046
"Newton KS HSA, Wichita KS HRR, USA",-0.19686011642264642,-0.24186015027414864,0.045000033851502225
"Tawas City MI HSA, Saginaw MI HRR, USA",-0.30133843682221834,-0.30928794453935265,0.007949507717134319
"West Branch MI HSA, Saginaw MI HRR, USA",-0.40029730865343,-0.37374858359837815,-0.026548725055051847
"Cambridge MD HSA, Salisbury MD HRR, USA",-0.11909351666811549,-0.14205540007868245,0.022961883410566958
"Macomb IL HSA, Springfield IL HRR, USA",-0.22541793653267642,-0.1715277564108794,-0.05389018012179703
"Middlebury VT HSA, Burlington VT HRR, USA",0.4130592528298835,0.3298336600313346,0.08322559279854891
"Sebastopol CA HSA, Santa Rosa CA HRR, USA",0.6342050766003088,0.5933667549294821,0.04083832167082668
"Three Rivers MI HSA, Kalamazoo MI HRR, USA",-0.27689368505375495,-0.26285563769865,-0.014038047355104943
"Greencastle IN HSA, Indianapolis IN HRR, USA",-0.48171131876397666,-0.4731985574030447,-0.008512761360931986
"Villa Rica GA HSA, Atlanta GA HRR, USA",-0.1808098002223255,-0.27762597822648866,0.09681617800416314
"Columbia City IN HSA, Fort Wayne IN HRR, USA",-0.4879910526862098,-0.5062332088973077,0.018242156211097926
"Cortez CO HSA, Albuquerque NM HRR, USA",-0.18628297020269607,-0.24703951734202795,0.06075654713933187
"Centralia IL HSA, St Louis MO HRR, USA",-0.43677621213329965,-0.4049292934566297,-0.031846918676669944
"Newark NY HSA, Rochester NY HRR, USA",-0.1950824400524422,-0.22312970793198422,0.02804726787954201
"Wareham MA HSA, Boston MA HRR, USA",0.10694100170177133,0.03170698741414689,0.07523401428762444
"Georgetown OH HSA, Cincinnati OH HRR, USA",-0.563323239329871,-0.5081751076201075,-0.055148131709763515
"Delta CO HSA, Grand Junction CO HRR, USA",-0.372796857926437,-0.45199328150961565,0.07919642358317863
"Guntersville AL HSA, Huntsville AL HRR, USA",-0.6955331115887852,-0.6874139543637601,-0.008119157225025098
"Brooksville FL HSA, Hudson FL HRR, USA",-0.38625729278881515,-0.35405634419978216,-0.032200948589032996
"Mishawaka IN HSA, South Bend IN HRR, USA",-0.1033678137849571,-0.1810451737702028,0.07767735998524569
"Astoria OR HSA, Portland OR HRR, USA",0.07122880154392663,0.015051042144026139,0.056177759399900495
"River Falls WI HSA, St Paul MN HRR, USA",-0.027872273030769678,-0.05420155325959635,0.026329280228826673
"Medina NY HSA, Buffalo NY HRR, USA",-0.32157457688462254,-0.3687215532313376,0.04714697634671505
"Needham MA HSA, Boston MA HRR, USA",0.571365292337059,0.4826431726724016,0.08872211966465743
"Farmville VA HSA, Richmond VA HRR, USA",-0.04402596769346954,-0.05513235016512925,0.01110638247165971
"Jesup GA HSA, Savannah GA HRR, USA",-0.5825841132778135,-0.5909076908577535,0.008323577579940067
"Bolivar MO HSA, Springfield MO HRR, USA",-0.5871717455914752,-0.5641111009865775,-0.023060644604897762
"Austin MN HSA, Rochester MN HRR, USA",0.03781276076807628,0.01857429074966621,0.019238470018410066
"Mitchell SD HSA, Sioux Falls SD HRR, USA",-0.4359409474530156,-0.42403818222634143,-0.011902765226674161
"Valley AL HSA, Birmingham AL HRR, USA",-0.2447679906676484,-0.23510681732204722,-0.009661173345601182
"Portage WI HSA, Madison WI HRR, USA",-0.08589938052866779,-0.09192504231429098,0.006025661785623193
"Beeville TX HSA, Corpus Christi TX HRR, USA",-0.3047594384047565,-0.17187183042435214,-0.13288760798040436
"Taos NM HSA, Albuquerque NM HRR, USA",0.5395886737357276,0.5123317734443558,0.027256900291371844
"Safford AZ HSA, Tucson AZ HRR, USA",-0.544415229566764,-0.4891472961882641,-0.055267933378499945
"Kenansville NC HSA, Greenville NC HRR, USA",-0.20537212306213357,-0.16745057948884834,-0.03792154357328523
"Bardstown KY HSA, Louisville KY HRR, USA",-0.31855362591729053,-0.28796400798563276,-0.030589617931657764
"Marion VA HSA, Kingsport TN HRR, USA",-0.5591324178014978,-0.5540614533654152,-0.00507096443608257
"Whitefish MT HSA, Missoula MT HRR, USA",-0.12075987341472587,-0.20694928690418024,0.08618941348945437
"Port Townsend WA HSA, Seattle WA HRR, USA",0.4186131044225586,0.33108156969046176,0.08753153473209685
"Angola IN HSA, Fort Wayne IN HRR, USA",-0.4057313926254355,-0.42036836586404897,0.01463697323861346
"Brattleboro VT HSA, Lebanon NH HRR, USA",0.4975055333213759,0.43269038232533996,0.06481515099603596
"Sheridan WY HSA, Billings MT HRR, USA",-0.4750443108771275,-0.5060245267575985,0.03098021588047095
"Shawano WI HSA, Appleton WI HRR, USA",-0.24065125157658135,-0.2560374084365046,0.015386156859923228
"New Castle IN HSA, Indianapolis IN HRR, USA",-0.41405643831072386,-0.3936179811377707,-0.020438457172953173
"Sylacauga AL HSA, Birmingham AL HRR, USA",-0.37170968107324587,-0.3849365502770788,0.013226869203832925
"Marshall TX HSA, Shreveport LA HRR, USA",-0.1687442645401811,-0.15333567046492527,-0.015408594075255827
"Skowhegan ME HSA, Bangor ME HRR, USA",-0.20299185677995749,-0.18297695338847314,-0.020014903391484345
"Hibbing MN HSA, Minneapolis MN HRR, USA",-0.03261194790897208,-0.004230146128242535,-0.028381801780729545
"Dinuba CA HSA, Fresno CA HRR, USA",0.08633104228178355,0.13044562026929726,-0.04411457798751371
"Smithville MO HSA, Kansas City MO HRR, USA",-0.3667424095005927,-0.366190507023064,-0.0005519024775287318
"Hartsville SC HSA, Columbia SC HRR, USA",-0.19011640043568423,-0.1752426946279008,-0.014873705807783438
