"Fernandina Beach FL HSA, Jacksonville FL HRR, USA",-0.27632353197770265,-0.32628547832604804,0.04996194634834539
"Fredericksburg TX HSA, San Antonio TX HRR, USA",-0.5587230739671376,-0.5921579731632686,0.03343489919613096
"Corinth MS HSA, Memphis TN HRR, USA",-0.6383672661526127,-0.615358159735303,-0.0230091064173098
"Bryan OH HSA, Fort Wayne IN HRR, USA",-0.47014029015879183,-0.447123856372179,-0.023016433786612833
"Millersburg OH HSA, Canton OH HRR, USA",-0.6768457800483593,-0.6249009696466383,-0.05194481040172094
"Key West FL HSA, Miami FL HRR, USA",0.10137338953844607,0.12832905709863243,-0.026955667560186358
"Mccomb MS HSA, Jackson MS HRR, USA",-0.10049293396515303,-0.10837088715301907,0.007877953187866035
"Radford VA HSA, Roanoke VA HRR, USA",-0.2668625639223078,-0.2669289649910045,6.64010686967087e-05
"Berlin WI HSA, Neenah WI HRR, USA",-0.33508075198810033,-0.3255126786326174,-0.009568073355482931
"Thomasville NC HSA, Winston-Salem NC HRR, USA",-0.4130214379121069,-0.4142226094864034,0.0012011715742965001
"Reidsville NC HSA, Greensboro NC HRR, USA",-0.2065631215282459,-0.17513266206399505,-0.031430459464250854
"Stillwater MN HSA, St Paul MN HRR, USA",0.08961274077927815,0.012402288231792766,0.07721045254748539
"Coldwater OH HSA, Dayton OH HRR, USA",-0.6566286178931122,-0.6559861571313728,-0.0006424607617394607
"De Ridder LA HSA, Lake Charles LA HRR, USA",-0.604494062010364,-0.5892985510095492,-0.015195511000814843
"Menomonie WI HSA, Minneapolis MN HRR, USA",-0.13975717431925055,-0.09478887411307957,-0.044968300206170986
"Morris IL HSA, Joliet IL HRR, USA",-0.29787498370373056,-0.26729688183806294,-0.030578101865667617
"Sylva NC HSA, Asheville NC HRR, USA",-0.06843629648888146,-0.09740360944957738,0.02896731296069592
"Front Royal VA HSA, Winchester VA HRR, USA",-0.3329903182687827,-0.35524726309267735,0.02225694482389462
"New Prague MN HSA, Minneapolis MN HRR, USA",-0.344467995723193,-0.3629802958704286,0.01851230014723565
"Williston ND HSA, Minot ND HRR, USA",-0.6587443105815953,-0.642335225823904,-0.016409084757691317
"Athens TN HSA, Knoxville TN HRR, USA",-0.5874760724865251,-0.5781607444400102,-0.009315328046514915
"Watertown SD HSA, Sioux Falls SD HRR, USA",-0.43094130500269134,-0.42090385058770297,-0.010037454414988378
"Clinton SC HSA, Greenville SC HRR, USA",-0.21270253572157072,-0.18447146403954856,-0.028231071682022157
"Brookfield WI HSA, Milwaukee WI HRR, USA",-0.0848640299139049,-0.19631804054999108,0.11145401063608618
"Hannibal MO HSA, Columbia MO HRR, USA",-0.4978496604839993,-0.4900341968682439,-0.007815463615755414
"Buffalo MN HSA, Minneapolis MN HRR, USA",-0.28658785477023613,-0.3030094364929189,0.016421581722682765
"Anacortes WA HSA, Everett WA HRR, USA",0.3418641971755662,0.2598860773259293,0.08197811984963693
"Crawfordsville IN HSA, Indianapolis IN HRR, USA",-0.5011216100371718,-0.5145265872303333,0.013404977193161471
"Brockport NY HSA, Rochester NY HRR, USA",-0.23257780696501668,-0.2864202011336334,0.05384239416861675
"Hastings NE HSA, Lincoln NE HRR, USA",-0.4589609635988456,-0.4933965629366217,0.034435599337776124
"Fremont OH HSA, Toledo OH HRR, USA",-0.23710332798269781,-0.19567100866825196,-0.041432319314445853
"Kittanning PA HSA, Pittsburgh PA HRR, USA",-0.5512634999988091,-0.5394523029559022,-0.011811197042906896
"Kirksville MO HSA, Columbia MO HRR, USA",-0.4016527271770727,-0.3865632420224344,-0.01508948515463826
"Laramie WY HSA, Fort Collins CO HRR, USA",-0.021310384560471463,-0.08433336458821093,0.06302298002773947
"Brookhaven MS HSA, Jackson MS HRR, USA",-0.35743146983173735,-0.36118347534173056,0.003752005509993217
"Mocksville NC HSA, Winston-Salem NC HRR, USA",-0.47027610178135065,-0.4857181635719274,0.015442061790576722
"Talladega AL HSA, Birmingham AL HRR, USA",-0.1998242548674741,-0.1699990100942019,-0.029825244773272197
"East Liverpool OH HSA, Pittsburgh PA HRR, USA",-0.42595333954012,-0.3740072394882954,-0.051946100051824595
"Butte MT HSA, Missoula MT HRR, USA",0.057929522966429524,0.057093601480151863,0.0008359214862776604
"Emporia KS HSA, Topeka KS HRR, USA",-0.1994752168768255,-0.23680561034286546,0.037330393466039946
"Brenham TX HSA, Houston TX HRR, USA",-0.5183674676342496,-0.533718568247782,0.015351100613532398
"Hopewell VA HSA, Richmond VA HRR, USA",0.04453241925197383,-0.006763822273640062,0.05129624152561389
"Dodge City KS HSA, Wichita KS HRR, USA",-0.38315692590888173,-0.4369034994697773,0.05374657356089557
"York ME HSA, Portland ME HRR, USA",0.2843717427270297,0.1951021673466047,0.08926957538042499
"Dickinson ND HSA, Bismarck ND HRR, USA",-0.6509987189504469,-0.6544434531348551,0.0034447341844081603
"Ponca City OK HSA, Oklahoma City OK HRR, USA",-0.4968197639122599,-0.482124808124441,-0.01469495578781893
"Chisago City MN HSA, St Paul MN HRR, USA",-0.289235518131568,-0.3054269564997646,0.016191438368196587
"Wellsboro PA HSA, Sayre PA HRR, USA",-0.5014177567336674,-0.5267704577161678,0.02535270098250042
"Lehighton PA HSA, Allentown PA HRR, USA",-0.28668477522349045,-0.30385859508430063,0.01717381986081018
"Escanaba MI HSA, Marquette MI HRR, USA",-0.2714799918919291,-0.26237973178795654,-0.00910026010397258
"San Andreas CA HSA, Stockton CA HRR, USA",-0.2269368712397802,-0.2296769022525336,0.0027400310127533856
"Mount Pleasant PA HSA, Pittsburgh PA HRR, USA",-0.44158979872518217,-0.431344438472357,-0.010245360252825186
"Hartford WI HSA, Milwaukee WI HRR, USA",-0.44196239549419225,-0.4452552888943591,0.003292893400166863
"Peterborough NH HSA, Manchester NH HRR, USA",0.021088323312926205,-0.02957054493648302,0.050658868249409225
"Clinton MO HSA, Kansas City MO HRR, USA",-0.5068171814227003,-0.48041482183366274,-0.026402359589037527
"Soldotna AK HSA, Anchorage AK HRR, USA",-0.485985046113708,-0.5226976268095358,0.03671258069582778
"Berea KY HSA, Lexington KY HRR, USA",-0.44724244973631877,-0.4740724844590163,0.026830034722697516
"Bartow FL HSA, Lakeland FL HRR, USA",-0.23347239351241703,-0.16531199372543723,-0.0681603997869798
"Oneida NY HSA, Syracuse NY HRR, USA",-0.22527719186870945,-0.24593700019508583,0.020659808326376372
"Sidney OH HSA, Dayton OH HRR, USA",-0.5954438697108436,-0.569451866529396,-0.025992003181447676
"Sweetwater TN HSA, Knoxville TN HRR, USA",-0.6312757646700541,-0.5902439278453516,-0.04103183682470246
"Albert Lea MN HSA, Rochester MN HRR, USA",-0.19353760784560123,-0.19987884505656828,0.006341237210967049
"Florence AZ HSA, Mesa AZ HRR, USA",-0.2735420305231673,-0.2825131153334758,0.008971084810308505
"Wickenburg AZ HSA, Sun City AZ HRR, USA",-0.32215457889992105,-0.3496376698434711,0.02748309094355006
"Brookings SD HSA, Sioux Falls SD HRR, USA",-0.1595087668233383,-0.17342206866013876,0.013913301836800451
"Brawley CA HSA, San Diego CA HRR, USA",0.17236183135866376,0.2759827760960253,-0.10362094473736153
"Dyersburg TN HSA, Memphis TN HRR, USA",-0.5654147153972501,-0.5451500467287281,-0.020264668668521946
"North Platte NE HSA, Lincoln NE HRR, USA",-0.5796819836100489,-0.6112197401131784,0.03153775650312951
"Moscow ID HSA, Spokane WA HRR, USA",0.05871293942841221,0.06465831044311902,-0.005945371014706817
"Garden City KS HSA, Wichita KS HRR, USA",-0.24018178700051449,-0.3050273768043803,0.06484558980386582
"Redmond OR HSA, Bend OR HRR, USA",-0.1981626424271944,-0.28637117658995226,0.08820853416275787
"Faribault MN HSA, Minneapolis MN HRR, USA",-0.20116141719489603,-0.21757919028559666,0.016417773090700638
"Newberg OR HSA, Portland OR HRR, USA",-0.0074560580236573085,-0.07000985660044697,0.06255379857678965
"La Grange KY HSA, Louisville KY HRR, USA",-0.33922617790855264,-0.39680390598019805,0.057577728071645407
"Monticello MN HSA, Minneapolis MN HRR, USA",-0.30590717505869985,-0.3506273532128941,0.04472017815419427
"Iron Mountain MI HSA, Green Bay WI HRR, USA",-0.3611839028889754,-0.3718385280563853,0.010654625167409892
"Mineral Wells TX HSA, Fort Worth TX HRR, USA",-0.678691654069694,-0.6656760771021697,-0.013015576967524312
"Lawrenceburg TN HSA, Nashville TN HRR, USA",-0.6456188294746512,-0.6108598584204087,-0.03475897105424253
"Sharon CT HSA, Hartford CT HRR, USA",0.18732443830355489,0.09204471069300892,0.09527972761054597
"New Kensington PA HSA, Pittsburgh PA HRR, USA",-0.1310845812301181,-0.14872999034479323,0.01764540911467513
"South Miami FL HSA, Miami FL HRR, USA",0.08326228286125305,0.18268456136396374,-0.0994222785027107
"Red Bluff CA HSA, Chico CA HRR, USA",-0.35618055182496966,-0.36739254297902396,0.011211991154054302
"Ottumwa IA HSA, Iowa City IA HRR, USA",-0.2572099531365013,-0.22548018168141132,-0.03172977145508998
"Walterboro SC HSA, Charleston SC HRR, USA",-0.07843817728834845,-0.06730080566199674,-0.011137371626351714
"Moulton AL HSA, Birmingham AL HRR, USA",-0.6572933576378245,-0.59883259524125,-0.058460762396574495
"Sonoma CA HSA, Santa Rosa CA HRR, USA",0.558332772012128,0.5003658671268607,0.057966904885267345
"Ridgecrest CA HSA, San Bernardino CA HRR, USA",-0.2943068208329179,-0.3456771811552329,0.051370360322314956
"Alice TX HSA, Corpus Christi TX HRR, USA",0.0428233240251986,0.2879498708450945,-0.24512654681989587
"Marianna FL HSA, Dothan AL HRR, USA",-0.393006056931391,-0.37122115524218907,-0.02178490168920194
"Grove City PA HSA, Pittsburgh PA HRR, USA",-0.38363860373472247,-0.38061444741074746,-0.0030241563239750135
"Ware MA HSA, Springfield MA HRR, USA",0.1008998149923933,0.014913136780301586,0.08598667821209172
"Jasper GA HSA, Atlanta GA HRR, USA",-0.6618697247419681,-0.6957848029811594,0.033915078239191265
"Whiteville NC HSA, Wilmington NC HRR, USA",-0.3131270577859075,-0.2512159575440765,-0.061911100241830996
"Guthrie OK HSA, Oklahoma City OK HRR, USA",-0.4661401866039775,-0.5078816761696313,0.04174148956565382
"Hastings MN HSA, St Paul MN HRR, USA",-0.13337151380721812,-0.155853009339102,0.02248149553188389
"Gloucester MA HSA, Boston MA HRR, USA",0.38816120594230596,0.29061801807658627,0.0975431878657197
"Junction City KS HSA, Topeka KS HRR, USA",-0.13953972716859314,-0.21737934827443972,0.07783962110584658
"Juneau AK HSA, Anchorage AK HRR, USA",0.2626565527275907,0.17162293173051132,0.09103362099707937
"Jacksonville AL HSA, Birmingham AL HRR, USA",-0.5120639928687151,-0.5341123828217292,0.02204838995301417
"Farmington ME HSA, Portland ME HRR, USA",-0.04508229956679359,-0.061643268693013044,0.016560969126219453
"Hudson WI HSA, St Paul MN HRR, USA",-0.05067759090059624,-0.11656077978476527,0.06588318888416902
"Alamosa CO HSA, Colorado Springs CO HRR, USA",-0.022463556212847912,-0.019859342232486844,-0.0026042139803610677
"Greenwood MS HSA, Jackson MS HRR, USA",0.15800319281932473,0.16355808789786,-0.005554895078535266
"Dunkirk NY HSA, Buffalo NY HRR, USA",-0.06862782642155478,-0.07786203725902531,0.00923421083747053
"Sulphur Springs TX HSA, Dallas TX HRR, USA",-0.6051578992109046,-0.604031603200384,-0.001126296010520611
"Sault Ste Marie MI HSA, Petoskey MI HRR, USA",-0.22552626512072274,-0.23815354830413507,0.01262728318341233
"Pittsburg KS HSA, Joplin MO HRR, USA",-0.21223325513448693,-0.21043182271562968,-0.0018014324188572461
"Union City TN HSA, Memphis TN HRR, USA",-0.577177703819016,-0.5429527505127278,-0.034224953306288164
"Little Falls MN HSA, Minneapolis MN HRR, USA",-0.5288821494574231,-0.5217093115273015,-0.007172837930121578
"Baraboo WI HSA, Madison WI HRR, USA",-0.013100371874654623,-0.034368450305988216,0.021268078431333593
"Niagara Falls NY HSA, Buffalo NY HRR, USA",0.2702264103791341,0.21479429420434984,0.055432116174784246
"Bay St Louis MS HSA, Slidell LA HRR, USA",-0.4843337840928542,-0.5322982723790028,0.04796448828614863
"Kaufman TX HSA, Dallas TX HRR, USA",-0.6061648995078526,-0.6339293385439814,0.027764439036128796
"Newport TN HSA, Knoxville TN HRR, USA",-0.6477663354910128,-0.6438915083684629,-0.0038748271225499398
"Big Spring TX HSA, Lubbock TX HRR, USA",-0.6019462039842101,-0.5757964507162712,-0.02614975326793889
"Manchester TN HSA, Nashville TN HRR, USA",-0.5601319372096593,-0.5270886967679266,-0.03304324044173268
"Aliquippa PA HSA, Pittsburgh PA HRR, USA",-0.08033342482669648,-0.07978975854692698,-0.0005436662797694974
"Hillsdale MI HSA, Kalamazoo MI HRR, USA",-0.4943245456249139,-0.4802505730599251,-0.014073972564988824
"Shelbyville IN HSA, Indianapolis IN HRR, USA",-0.45123146420967714,-0.4453936843268589,-0.00583777988281825
"Pullman WA HSA, Spokane WA HRR, USA",0.3876160976980514,0.3258465387311778,0.06176955896687358
"Ahoskie NC HSA, Greenville NC HRR, USA",0.27630817542985026,0.3158869635538925,-0.03957878812404225
"Sandpoint ID HSA, Spokane WA HRR, USA",-0.2937731312305497,-0.29964936312305174,0.005876231892502026
"The Dalles OR HSA, Portland OR HRR, USA",-0.12277465641719393,-0.16415373319558343,0.041379076778389506
"Americus GA HSA, Albany GA HRR, USA",-0.06118505691452287,-0.06982053818461213,0.008635481270089264
"Woodstock IL HSA, Rockford IL HRR, USA",0.06148371203685569,-0.009140332854657788,0.07062404489151347
"Mexico MO HSA, Columbia MO HRR, USA",-0.5182721616051593,-0.4883039160131437,-0.029968245592015608
"Detroit Lakes MN HSA, Fargo Moorhead -Mn ND HRR, USA",-0.28628464809577875,-0.31254897097993944,0.026264322884160696
"Vidalia GA HSA, Savannah GA HRR, USA",-0.4646328444555548,-0.4813242313069784,0.016691386851423573
"Cooperstown NY HSA, Albany NY HRR, USA",-0.11704041051390718,-0.18922235187111253,0.07218194135720535
"Jasper IN HSA, Evansville IN HRR, USA",-0.43806227656096824,-0.43960242527624527,0.0015401487152770232
"Angleton TX HSA, Houston TX HRR, USA",-0.46858961083460654,-0.4653006672451388,-0.003288943589467741
"Burley ID HSA, Salt Lake City UT HRR, USA",-0.6577883887559386,-0.5917288698296445,-0.06605951892629414
"Wauseon OH HSA, Toledo OH HRR, USA",-0.4254853872682173,-0.3887857570921639,-0.03669963017605338
"Grayling MI HSA, Traverse City MI HRR, USA",-0.2999732758375431,-0.3130022037048477,0.01302892786730464
"Lagrange IN HSA, Fort Wayne IN HRR, USA",-0.5269369736004366,-0.4979248944224886,-0.029012079177947958
"Dahlonega GA HSA, Atlanta GA HRR, USA",-0.5864298308603815,-0.6026025867718088,0.016172755911427306
"Brigham City UT HSA, Ogden UT HRR, USA",-0.5636972993715136,-0.457201749774408,-0.10649554959710561
"San Dimas CA HSA, Los Angeles CA HRR, USA",0.0258704484888193,0.011219696429215161,0.014650752059604137
"Lucedale MS HSA, Mobile AL HRR, USA",-0.7648374555231061,-0.7675521869594422,0.0027147314363360486
"Natchitoches LA HSA, Shreveport LA HRR, USA",-0.07479694980862098,-0.04415688129378108,-0.0306400685148399
"Jackson WY HSA, Salt Lake City UT HRR, USA",0.08535716717075921,0.003655740111319145,0.08170142705944007
"Columbus NE HSA, Omaha NE HRR, USA",-0.5625104724434847,-0.5778903774359029,0.015379904992418147
"Defiance OH HSA, Fort Wayne IN HRR, USA",-0.33946019583101184,-0.32113222891360044,-0.018327966917411398
"Fergus Falls MN HSA, Fargo Moorhead -Mn ND HRR, USA",-0.2781317321354907,-0.31852191174225075,0.04039017960676006
"South Lake Tahoe CA HSA, Sacramento CA HRR, USA",0.27399078300084195,0.1809655930266002,0.09302518997424175
"Kingsville TX HSA, Corpus Christi TX HRR, USA",-0.029418001057529328,0.05165212539873526,-0.08107012645626459
"Neosho MO HSA, Joplin MO HRR, USA",-0.6119065143771363,-0.5880717827205509,-0.02383473165658534
"Tiffin OH HSA, Toledo OH HRR, USA",-0.3417290388527428,-0.3273733097211699,-0.014355729131572903
"Arcadia FL HSA, Sarasota FL HRR, USA",-0.3304022756536341,-0.28361830738553856,-0.046783968268095555
"Muscatine IA HSA, Iowa City IA HRR, USA",-0.10314731999004867,-0.08976264826192272,-0.01338467172812595
"Decatur IN HSA, Fort Wayne IN HRR, USA",-0.5166298338625958,-0.5111274488962521,-0.0055023849663436986
"Stony Brook NY HSA, East Long Island NY HRR, USA",0.060512306698466654,0.035806174320312356,0.024706132378154298
"Clare MI HSA, Lansing MI HRR, USA",-0.33152755648208887,-0.3076104686234393,-0.023917087858649544
"Lakeport CA HSA, Napa CA HRR, USA",0.06282412313985987,0.024776836191746674,0.0380472869481132
"Grand Rapids MN HSA, Minneapolis MN HRR, USA",-0.1745768108463957,-0.17866564545827374,0.004088834611878034
"Wytheville VA HSA, Roanoke VA HRR, USA",-0.5873833487390347,-0.5648933867607445,-0.02248996197829023
"Yankton SD HSA, Sioux Falls SD HRR, USA",-0.3701235255999766,-0.3610256712381222,-0.009097854361854396
"Lackawanna NY HSA, Buffalo NY HRR, USA",0.08047114647876091,0.02572720143002589,0.05474394504873502
"Oakdale CA HSA, Modesto CA HRR, USA",-0.33392688803372333,-0.317612129589783,-0.016314758443940314
"Jacksonville TX HSA, Tyler TX HRR, USA",-0.5150778616947737,-0.520334234570525,0.005256372875751314
"Dunedin FL HSA, Clearwater FL HRR, USA",-0.01492776327891548,-0.052549316458508265,0.03762155317959279
"Lakewood CA HSA, Los Angeles CA HRR, USA",0.278655232248234,0.27415624399017197,0.004498988258062053
"Ottawa IL HSA, Peoria IL HRR, USA",-0.08079289255873631,-0.0848440735484159,0.00405118098967959
"Royston GA HSA, Atlanta GA HRR, USA",-0.6753308491572143,-0.6630475770316568,-0.012283272125557465
"Marion IL HSA, Paducah KY HRR, USA",-0.4227654917821475,-0.4541107894946339,0.0313452977124864
"Lewisburg TN HSA, Nashville TN HRR, USA",-0.5014989881364136,-0.4691207829199419,-0.03237820521647167
"Owatonna MN HSA, Rochester MN HRR, USA",-0.2172319932998325,-0.25879905218748195,0.041567058887649444
"Silver City NM HSA, Albuquerque NM HRR, USA",0.020194325455914628,0.03063181835172052,-0.010437492895805891
"Lock Haven PA HSA, Danville PA HRR, USA",-0.36222836077250953,-0.33185111985429433,-0.030377240918215198
"Carbondale IL HSA, St Louis MO HRR, USA",0.2659609388382407,0.2565092585478788,0.009451680290361864
"Tazewell TN HSA, Knoxville TN HRR, USA",-0.657745898143625,-0.6350207887964245,-0.02272510934720051
"Malone NY HSA, Burlington VT HRR, USA",-0.11021009232805846,-0.13443951027726952,0.02422941794921106
"Lexington VA HSA, Roanoke VA HRR, USA",-0.20938041761308057,-0.17712957021349954,-0.032250847399581034
"North Adams MA HSA, Springfield MA HRR, USA",0.41334266633367245,0.368457263096255,0.044885403237417465
"Mount Pleasant TX HSA, Tyler TX HRR, USA",-0.4431826440773212,-0.41690573882526255,-0.02627690525205867
"Tullahoma TN HSA, Nashville TN HRR, USA",-0.49138835251984186,-0.49330545978145157,0.0019171072616097073
"Streator IL HSA, Peoria IL HRR, USA",-0.35121410591872615,-0.3157225993003775,-0.035491506618348656
"Nassawadox VA HSA, Norfolk VA HRR, USA",0.04707267715520807,0.027126756062011374,0.019945921093196695
"Gainesville TX HSA, Dallas TX HRR, USA",-0.6187632241332174,-0.6467261386052294,0.027962914472012046
"Abbeville LA HSA, Lafayette LA HRR, USA",-0.5303461015901116,-0.5010589407278357,-0.029287160862275896
"New Richmond WI HSA, St Paul MN HRR, USA",-0.251513453192984,-0.269866694049472,0.018353240856487985
"Coshocton OH HSA, Columbus OH HRR, USA",-0.47672093998744414,-0.42366907609070814,-0.053051863896735996
"Dansville NY HSA, Rochester NY HRR, USA",-0.3776523259167774,-0.4105338550186862,0.032881529101908835
"Portsmouth NH HSA, Manchester NH HRR, USA",0.37540182043517656,0.29812790453735005,0.0772739158978265
"Logansport IN HSA, Indianapolis IN HRR, USA",-0.39309941354019634,-0.4085175684017346,0.015418154861538247
"Washington IN HSA, Evansville IN HRR, USA",-0.6168999979594582,-0.6189451039679621,0.0020451060085039385
"Everett PA HSA, Altoona PA HRR, USA",-0.6485846408150497,-0.6491551816436443,0.0005705408285945346
"Spruce Pine NC HSA, Asheville NC HRR, USA",-0.44450395826904976,-0.43667976235688166,-0.007824195912168097
"Brevard NC HSA, Asheville NC HRR, USA",-0.15643991374240346,-0.22172477474956628,0.06528486100716283
"Troy AL HSA, Montgomery AL HRR, USA",-0.17402309521708473,-0.20035588866015414,0.026332793443069408
"Scottsboro AL HSA, Huntsville AL HRR, USA",-0.66410501452461,-0.6115476955563114,-0.05255731896829863
"Hays KS HSA, Wichita KS HRR, USA",-0.47418161628688826,-0.5155043021390264,0.041322685852138163
"Bluffton IN HSA, Fort Wayne IN HRR, USA",-0.5679895050495594,-0.5630035184044597,-0.004985986645099638
"Logan WV HSA, Charleston WV HRR, USA",-0.643018896730847,-0.6505435196981368,0.00752462296728984
"Leitchfield KY HSA, Louisville KY HRR, USA",-0.5998706586051247,-0.5993555829309218,-0.0005150756742028362
"Grove OK HSA, Joplin MO HRR, USA",-0.5771904352788712,-0.5451047559168737,-0.032085679361997466
"Paris TN HSA, Jackson TN HRR, USA",-0.5118689733215415,-0.49399641796994204,-0.01787255535159943
"La Follette TN HSA, Knoxville TN HRR, USA",-0.6658208069305371,-0.6168579640255496,-0.048962842904987536
"Blackfoot ID HSA, Idaho Falls ID HRR, USA",-0.5107696460781812,-0.43319947331141717,-0.07757017276676403
"Warren PA HSA, Erie PA HRR, USA",-0.3737061359985794,-0.38218794287026825,0.008481806871688868
"Paw Paw MI HSA, Kalamazoo MI HRR, USA",-0.15768195222383724,-0.16667401825824407,0.008992066034406831
"Truckee CA HSA, Reno NV HRR, USA",0.5051447031537958,0.38514877900215905,0.11999592415163673
"Kingston PA HSA, Wilkes-Barre PA HRR, USA",0.0167661213572707,-0.05769899482858047,0.07446511618585117
"Newton KS HSA, Wichita KS HRR, USA",-0.1968601164226495,-0.24186015027414878,0.04500003385149928
"Tawas City MI HSA, Saginaw MI HRR, USA",-0.30133843682221706,-0.3092879445393525,0.007949507717135429
"West Branch MI HSA, Saginaw MI HRR, USA",-0.40029730865343155,-0.37374858359837815,-0.0265487250550534
"Cambridge MD HSA, Salisbury MD HRR, USA",-0.11909351666811617,-0.14205540007868364,0.02296188341056747
"Macomb IL HSA, Springfield IL HRR, USA",-0.22541793653267714,-0.1715277564108801,-0.05389018012179703
"Middlebury VT HSA, Burlington VT HRR, USA",0.4130592528298836,0.32983366003133524,0.08322559279854835
"Sebastopol CA HSA, Santa Rosa CA HRR, USA",0.6342050766003074,0.5933667549294824,0.04083832167082502
"Three Rivers MI HSA, Kalamazoo MI HRR, USA",-0.27689368505375395,-0.2628556376986486,-0.014038047355105332
"Greencastle IN HSA, Indianapolis IN HRR, USA",-0.48171131876397744,-0.47319855740304523,-0.008512761360932208
"Villa Rica GA HSA, Atlanta GA HRR, USA",-0.18080980022232632,-0.27762597822648816,0.09681617800416184
"Columbia City IN HSA, Fort Wayne IN HRR, USA",-0.48799105268621035,-0.5062332088973067,0.018242156211096372
"Cortez CO HSA, Albuquerque NM HRR, USA",-0.18628297020269347,-0.24703951734202784,0.06075654713933437
"Centralia IL HSA, St Louis MO HRR, USA",-0.436776212133298,-0.404929293456628,-0.03184691867667
"Newark NY HSA, Rochester NY HRR, USA",-0.19508244005244263,-0.2231297079319833,0.028047267879540677
"Wareham MA HSA, Boston MA HRR, USA",0.10694100170177095,0.03170698741414716,0.0752340142876238
"Georgetown OH HSA, Cincinnati OH HRR, USA",-0.56332323932987,-0.5081751076201053,-0.055148131709764736
"Delta CO HSA, Grand Junction CO HRR, USA",-0.3727968579264373,-0.4519932815096147,0.07919642358317741
"Guntersville AL HSA, Huntsville AL HRR, USA",-0.6955331115887827,-0.6874139543637594,-0.008119157225023321
"Brooksville FL HSA, Hudson FL HRR, USA",-0.386257292788815,-0.3540563441997824,-0.03220094858903261
"Mishawaka IN HSA, South Bend IN HRR, USA",-0.10336781378495628,-0.1810451737702031,0.07767735998524682
"Astoria OR HSA, Portland OR HRR, USA",0.07122880154392691,0.015051042144026538,0.05617775939990037
"River Falls WI HSA, St Paul MN HRR, USA",-0.027872273030769574,-0.05420155325959654,0.026329280228826964
"Medina NY HSA, Buffalo NY HRR, USA",-0.321574576884622,-0.3687215532313385,0.047146976346716496
"Needham MA HSA, Boston MA HRR, USA",0.5713652923370598,0.4826431726724012,0.0887221196646586
"Farmville VA HSA, Richmond VA HRR, USA",-0.04402596769347077,-0.055132350165129185,0.011106382471658412
"Jesup GA HSA, Savannah GA HRR, USA",-0.5825841132778119,-0.5909076908577552,0.008323577579943287
"Bolivar MO HSA, Springfield MO HRR, USA",-0.5871717455914781,-0.5641111009865771,-0.02306064460490098
"Austin MN HSA, Rochester MN HRR, USA",0.03781276076807568,0.018574290749667113,0.019238470018408567
"Mitchell SD HSA, Sioux Falls SD HRR, USA",-0.435940947453016,-0.42403818222634176,-0.011902765226674217
"Valley AL HSA, Birmingham AL HRR, USA",-0.24476799066764873,-0.23510681732204736,-0.009661173345601376
"Portage WI HSA, Madison WI HRR, USA",-0.08589938052866704,-0.0919250423142916,0.006025661785624567
"Beeville TX HSA, Corpus Christi TX HRR, USA",-0.304759438404755,-0.17187183042435175,-0.13288760798040325
"Taos NM HSA, Albuquerque NM HRR, USA",0.539588673735727,0.5123317734443568,0.02725690029137029
"Safford AZ HSA, Tucson AZ HRR, USA",-0.5444152295667665,-0.4891472961882638,-0.055267933378502665
"Kenansville NC HSA, Greenville NC HRR, USA",-0.20537212306213332,-0.16745057948884823,-0.03792154357328509
"Bardstown KY HSA, Louisville KY HRR, USA",-0.31855362591729003,-0.287964007985633,-0.030589617931657043
"Marion VA HSA, Kingsport TN HRR, USA",-0.5591324178015,-0.5540614533654171,-0.005070964436082903
"Whitefish MT HSA, Missoula MT HRR, USA",-0.12075987341472798,-0.20694928690418019,0.08618941348945221
"Port Townsend WA HSA, Seattle WA HRR, USA",0.4186131044225581,0.331081569690462,0.08753153473209613
"Angola IN HSA, Fort Wayne IN HRR, USA",-0.4057313926254339,-0.4203683658640512,0.01463697323861729
"Brattleboro VT HSA, Lebanon NH HRR, USA",0.4975055333213758,0.4326903823253383,0.06481515099603752
"Sheridan WY HSA, Billings MT HRR, USA",-0.4750443108771257,-0.506024526757598,0.03098021588047234
"Shawano WI HSA, Appleton WI HRR, USA",-0.24065125157657824,-0.2560374084365055,0.01538615685992728
"New Castle IN HSA, Indianapolis IN HRR, USA",-0.4140564383107215,-0.3936179811377699,-0.020438457172951563
"Sylacauga AL HSA, Birmingham AL HRR, USA",-0.3717096810732444,-0.3849365502770826,0.013226869203838199
"Marshall TX HSA, Shreveport LA HRR, USA",-0.16874426454018301,-0.15333567046492474,-0.01540859407525827
"Skowhegan ME HSA, Bangor ME HRR, USA",-0.20299185677995807,-0.18297695338847125,-0.020014903391486816
"Hibbing MN HSA, Minneapolis MN HRR, USA",-0.032611947908972365,-0.004230146128241971,-0.028381801780730395
"Dinuba CA HSA, Fresno CA HRR, USA",0.08633104228178312,0.13044562026929726,-0.04411457798751414
