"Rushville IN HSA, Indianapolis IN HRR, USA",7.619278407229174,0.3916518768195673,0.2957063452048572,0.22683577173557234,0.020194173809823204,0.06000927311851451,0.0056025593116654495
"Irvine KY HSA, Lexington KY HRR, USA",6.6038352331722265,0.24426411821785549,0.5126169356083271,0.13003413654164298,0.014956093780739463,0.09812871585143502,0.0
"Paradise CA HSA, Chico CA HRR, USA",9.395831549319427,0.3453634058515798,0.23694572036179343,0.21277159425267642,0.002184041687613941,0.1985970535961206,0.00413818425021589
"Fort Stockton TX HSA, Odessa TX HRR, USA",6.599087882672689,0.33601122223764934,0.5564830285997892,0.0865446455786906,0.014503369703469314,0.0027808232513529137,0.003676910629048557
"Gladwin MI HSA, Saginaw MI HRR, USA",5.643687433015146,0.4478563522592265,0.0492764502068803,0.3245666467225064,0.009980236404664776,0.16035780788519685,0.007962506521525059
"Chanute KS HSA, Wichita KS HRR, USA",6.569519776658446,0.6142629100356517,0.23313251330218757,0.10009602890036436,0.0009810731537978885,0.05152747460799865,0.0
"Winamac IN HSA, Indianapolis IN HRR, USA",7.137587366663143,0.4713254186167898,0.12713284549530549,0.32584948736522706,0.006717532528559633,0.06861758501380075,0.000357130980317311
"Aurora MO HSA, Springfield MO HRR, USA",6.195598116153616,0.4670174935897239,0.2802174806982061,0.16352910605708684,0.0,0.08257930397009326,0.006656615684889742
"Bremen IN HSA, South Bend IN HRR, USA",7.313265690860872,0.7373766278267506,0.11154960403794342,0.08816974578326665,0.0044580333906519545,0.05844310263667069,2.886324716720798e-06
"Berkeley Springs WV HSA, Winchester VA HRR, USA",6.613371070329027,0.05072421779005041,0.559850760624902,0.06736925790111532,0.09833327764922488,0.21655560669396673,0.007166879340740682
"Nantucket MA HSA, Boston MA HRR, USA",4.506625190779667,0.06921359464152832,0.22847928553708796,0.36293723641776177,0.3185313817911188,0.016869263210121593,0.0039692384023815525
"Magee MS HSA, Jackson MS HRR, USA",7.065326403307613,0.1502208317981949,0.6889968546884598,0.14764233506005403,0.0014095945442842482,0.009287661480771627,0.0024427224282354294
"Atlantic IA HSA, Omaha NE HRR, USA",6.428316949562026,0.5600016021491745,0.2706844744284898,0.14943714110400164,0.0009621958562993495,0.011706716251642092,0.007207870210392615
"Iuka MS HSA, Birmingham AL HRR, USA",6.688126371177476,0.25271606228766735,0.5158545387316131,0.16485790368964284,0.0057489000856793485,0.06082259520539744,0.0
"Nelsonville OH HSA, Columbus OH HRR, USA",6.954857703237826,0.439266999411438,0.3789119753827671,0.0883472362964891,0.017322851632257066,0.07352546604858819,0.0026254712284604883
"Tallassee AL HSA, Montgomery AL HRR, USA",7.207918311196118,0.14503950834064944,0.7294117647058828,0.09692712906057935,0.0035118525021949057,0.02054433713784019,0.004565408252853376
"Trenton MO HSA, Kansas City MO HRR, USA",6.7070769007571425,0.35618438455786167,0.28765536898873917,0.2301119147533154,0.0013504370088107717,0.11794778984364124,0.00675010484763154
"Trinidad CO HSA, Colorado Springs CO HRR, USA",4.437248540663303,0.5390570910195092,0.13469307498291153,0.2130407568921885,0.0019452105112159365,0.10429352892898447,0.006970337665190432
"West Liberty KY HSA, Lexington KY HRR, USA",6.159022396667028,0.07432235514595599,0.5630926276608963,0.2601496218702638,0.013413274846327218,0.08877770728010238,0.00024441319645429567
"Toppenish WA HSA, Yakima WA HRR, USA",7.573921806515096,0.2026082089680461,0.7226156110705435,0.006673304604186876,0.00887408115805504,0.0592287941991683,0.0
"Linton IN HSA, Indianapolis IN HRR, USA",7.808430554545248,0.494480315984052,0.3577100296899661,0.07496929967790897,0.002520532652535065,0.06326233056843987,0.0070574914270981875
"Carthage NY HSA, Syracuse NY HRR, USA",4.87174290218473,0.3521203953762731,0.1739482607964802,0.14272880446946432,0.1923161691408576,0.1264407851205211,0.012445585096403734
"Vernon TX HSA, Wichita Falls TX HRR, USA",6.296522438591228,0.47300771208226305,0.4836859798299378,0.04152659679651981,0.0,0.0017797112912794212,0.0
"Machias ME HSA, Bangor ME HRR, USA",3.8999680482493395,0.002677323702541972,0.059286470477529246,0.141439535506569,0.6421790878718319,0.15203311101295006,0.0023844714285778026
"Mount Pleasant IA HSA, Iowa City IA HRR, USA",7.235674694869725,0.4843221874809502,0.2370691388826933,0.24735863378547907,0.0021883909002762946,0.024681596623763985,0.004380052326837327
"Vermillion SD HSA, Sioux Falls SD HRR, USA",5.497724434803991,0.5385259190608159,0.3248748896690971,0.11628235494787888,0.0036384014740890053,0.01360486857878854,0.003073566269330471
"Pineville KY HSA, Knoxville TN HRR, USA",5.84682011930994,0.0867671664518419,0.7528512541288354,0.04051181277275492,0.008096049555921884,0.10743670771201433,0.0043370093786316045
"Harvard IL HSA, Rockford IL HRR, USA",7.021125956450869,0.6580883056953999,0.1765463487392129,0.13258693891454063,0.0,0.02840974068843346,0.004368665962413097
"Selmer TN HSA, Memphis TN HRR, USA",6.736224174753758,0.28315462895747956,0.5627153083306159,0.12445947642011534,0.0001870016224420235,0.02146433889231404,0.008019245777033213
"Mcconnellsburg PA HSA, Harrisburg PA HRR, USA",6.608490336535171,0.003494995353174897,0.3520016968197578,0.05467418793897934,0.37394766412035807,0.20943807417433855,0.006443381593391478
"West Frankfort IL HSA, St Louis MO HRR, USA",7.4629836497103055,0.38971962700542934,0.49249352601081453,0.08431630374598274,0.0011568534776994668,0.026894762250492307,0.005418927509581586
"Winfield AL HSA, Birmingham AL HRR, USA",6.723596548093692,0.3219168073842808,0.598892974773536,0.04642360742171525,0.0005465526580575177,0.021119225857591094,0.01110083190481947
"Spring Valley IL HSA, Peoria IL HRR, USA",7.377474079030255,0.7187729352868335,0.16714313528706656,0.0733392663457164,0.0017816084565692725,0.03178704736518526,0.007176007258629112
"Aspen CO HSA, Denver CO HRR, USA",3.4857676281244836,0.562020040257461,0.3795625751377677,0.04209281302876747,0.0,0.01632457157600396,0.0
"Craig CO HSA, Denver CO HRR, USA",4.927851305825677,0.6255836643401643,0.16455692062737184,0.13566109224039125,0.0,0.0699284418692428,0.004269880922829797
"Princeton IN HSA, Evansville IN HRR, USA",7.667599954277118,0.5008951180048227,0.36574657781755965,0.10082715694025343,0.0019401777908022763,0.024783751482909913,0.005807217963652028
"Linden TX HSA, Longview TX HRR, USA",7.131587582317257,0.2217541884289538,0.6611845859675587,0.08843528817330766,0.0,0.026565809204968684,0.002060128225211093
"Woodruff SC HSA, Spartanburg SC HRR, USA",6.891153736192209,0.25923234498718256,0.5794688446656019,0.03616149670258083,0.050898829779078905,0.055561318003116644,0.018677165862439202
"Homer AK HSA, Anchorage AK HRR, USA",3.21605289347894,0.2952008584569325,0.05992424964050711,0.05796543460890044,0.4414481666799079,0.1429950467559121,0.0024662438578400654
"Sidney MT HSA, Billings MT HRR, USA",4.618201326636485,0.4749900622940265,0.3099614991569192,0.18930593649292546,0.005044145558627027,0.013240894415579449,0.007457462081922416
"Amery WI HSA, St Paul MN HRR, USA",5.961345758638646,0.3518009408986809,0.12636476184902928,0.4112976659792354,0.02178910712264494,0.08808401903549606,0.0006635051149135892
"Chilton WI HSA, Appleton WI HRR, USA",6.420696215435437,0.6235400849816684,0.10153291232755522,0.15013616167042612,0.060811932144891896,0.05460981422495024,0.00936909465050816
"Missouri Valley IA HSA, Omaha NE HRR, USA",6.500320210254879,0.3740559422546321,0.36239693021788694,0.2317640982673583,0.003109420870878091,0.022542220746736626,0.006131387642507894
"Waverly TN HSA, Nashville TN HRR, USA",6.830996314294431,0.5388166177087702,0.4288711707931182,0.018464120856063804,0.0,0.013848090642047842,0.0
"Iola KS HSA, Wichita KS HRR, USA",6.58219989679417,0.5903912399128683,0.23255015412814697,0.1425576692895272,0.0005851296834747462,0.03368423892581378,0.0002315680601689329
"Hardinsburg KY HSA, Louisville KY HRR, USA",7.0083037120785425,0.2875174309515052,0.5166705636732741,0.11022436772158448,0.007764324469316204,0.07241700879145202,0.005406304392867759
"Prosser WA HSA, Yakima WA HRR, USA",6.073922486100492,0.07378140404344627,0.873132328117868,0.008402464565189316,0.01941818432395642,0.020720937512018242,0.004544681437521709
"Knoxville IA HSA, Des Moines IA HRR, USA",6.8261567777368715,0.6042772769088562,0.1905567039873043,0.1760307901020928,0.0,0.027613719168125772,0.0015215098336209285
"Stuart VA HSA, Winston-Salem NC HRR, USA",5.8196580324351315,0.0072850604415842565,0.6393506637317726,0.1305630919441394,0.05682000895585125,0.16298429362822456,0.0029968812984280295
"Stigler OK HSA, Fort Smith AR HRR, USA",6.773114319767899,0.23301680058436788,0.5239225712198688,0.14645726807888965,0.0,0.09349890430971507,0.0031044558071585027
"Charles City IA HSA, Rochester MN HRR, USA",6.183911663127686,0.5537399495777222,0.23731279837652328,0.17169177585168055,0.00599682639593048,0.020994468927274055,0.01026418087086932
"Winnfield LA HSA, Shreveport LA HRR, USA",7.191488875857713,0.21292181487852566,0.7162601395331478,0.05224032517044721,0.006015632934294649,0.012503061787297473,5.902569628730241e-05
"Windber PA HSA, Johnstown PA HRR, USA",5.966705363235332,0.14521884947597363,0.18131536126342404,0.051086522918511956,0.49486055015171837,0.12666829453246267,0.0008504216579092421
"Lancaster NH HSA, Lebanon NH HRR, USA",4.16104190766138,0.013169194496910482,0.015003581325969373,0.13509157166881194,0.61717840639524,0.1927447709015991,0.02681247521146904
"Lawrenceville IL HSA, Evansville IN HRR, USA",7.61723621857723,0.5823628307874631,0.2386690024519558,0.15834429397666816,0.0017321540063072716,0.011074141600765487,0.007817577176840035
"Opp AL HSA, Dothan AL HRR, USA",6.850614998968992,0.10877649683897363,0.7915582000743768,0.0838601710673114,0.0,0.005020453700260314,0.010784678319077725
"Cochran GA HSA, Macon GA HRR, USA",6.870775611711136,0.1325782322805134,0.7739006298731573,0.08248466774511287,0.000134521454691995,0.010249011963137291,0.000652936683387089
"Carrollton AL HSA, Tuscaloosa AL HRR, USA",7.159368095510047,0.21193793172547787,0.5939894233964622,0.11507237270791297,0.019772911939019994,0.052807369887327926,0.006419990343799166
"Homer LA HSA, Shreveport LA HRR, USA",7.090928224694199,0.40916562909095666,0.45323609370655304,0.12146378680740746,0.001521155483890384,0.011883802249341838,0.002729532661850538
"Morganfield KY HSA, Evansville IN HRR, USA",7.316142282850638,0.2986016476589361,0.5310620411176781,0.1323813632473558,0.006135494533892514,0.03181626062246881,3.1928196686286652e-06
"Cadiz KY HSA, Paducah KY HRR, USA",6.972847460119004,0.17615923860205707,0.5374272117893873,0.25467533132067766,0.010558256153098302,0.02099472957069029,0.00018523256408944385
"Erwin NC HSA, Raleigh NC HRR, USA",6.736523735649973,0.13071128317163988,0.7033141356893463,0.1266715951973321,0.019607008070747493,0.011643495291168034,0.008052482579766354
"Parsons TN HSA, Jackson TN HRR, USA",6.666648792662825,0.4722191171831478,0.40584649460798167,0.07203321229552763,0.0037351381845575965,0.046166037728785435,0.0
"Springerville AZ HSA, Phoenix AZ HRR, USA",4.834951744188023,0.008013470351277223,0.19851654625845086,0.28921091964505935,0.0,0.49375979210648346,0.010499271638729149
"Paulding OH HSA, Fort Wayne IN HRR, USA",7.647834345378585,0.3894349905083969,0.37852414019165703,0.19550920041548142,0.008876968897135256,0.02726227621046663,0.00039242377686286856
"Bamberg SC HSA, Columbia SC HRR, USA",6.448392332524534,0.1481808767168851,0.7029186100129261,0.12084073505733652,0.01650250587728385,0.011557272335568336,0.0
"Libby MT HSA, Missoula MT HRR, USA",7.00259016284172,0.0440128985212772,0.48135931693480377,0.1355224805522471,0.035399960011501766,0.29861269111642996,0.005092652863740214
"Thomasville AL HSA, Mobile AL HRR, USA",7.137188936782198,0.13478717108474028,0.6956542981374028,0.14908530071157286,0.0,0.014963519170168912,0.005509710896115107
"Osceola AR HSA, Memphis TN HRR, USA",7.661743477149378,0.40403278360684947,0.494897249922837,0.07898183658306968,0.0,0.01248632025934398,0.009601809627899848
"Lancaster KY HSA, Lexington KY HRR, USA",6.844556841272973,0.16768880024154798,0.7011113020854661,0.05578081696148152,0.022845815630721522,0.051838184020919977,0.0007350810598626317
"Jena LA HSA, Alexandria LA HRR, USA",7.142277364270565,0.21834674257120756,0.6441433710982283,0.10936956473225587,3.926960961171417e-05,0.015977322082794728,0.01212372990590195
"Crossnore NC HSA, Asheville NC HRR, USA",4.7131963778723085,0.025005310878060145,0.40395403176683775,0.18153885904326098,0.24369568361192154,0.1409215413757933,0.00488457332412648
"Tipton IN HSA, Indianapolis IN HRR, USA",7.828372696638536,0.5616982167865331,0.23359366764714265,0.14582164483274618,0.004375185859328032,0.04694548293939313,0.007565801934856944
"Mccook NE HSA, Denver CO HRR, USA",5.401009483454618,0.4520254519935908,0.3144243084952802,0.17634866544648248,0.004135193975690385,0.0457161253214179,0.007350254767538196
"Forsyth GA HSA, Macon GA HRR, USA",7.395818033080144,0.3113008791783316,0.5224011394728568,0.13953175431856857,0.006309713880559799,0.012223235615580749,0.008233277534102416
"Roseau MN HSA, Grand Forks ND HRR, USA",4.813305434794147,0.2980807051979234,0.2582694385331385,0.33873492307038244,0.03296428947648896,0.059477453692472836,0.012473190029593973
"Hamlet NC HSA, Charlotte NC HRR, USA",6.518957400327125,0.10534694980589433,0.7769451188360093,0.10476827146444456,0.006219723230388109,0.005325237951439958,0.0013946987118238605
"Pomeroy OH HSA, Columbus OH HRR, USA",6.99287093057693,0.26931793552559674,0.49402461107039164,0.13532174060895985,0.006913283902295694,0.09335127035190914,0.0010711585408471071
"Paoli IN HSA, Louisville KY HRR, USA",7.077939063314472,0.3916114672123064,0.3262172903916062,0.18013156192127439,0.012455871669344757,0.08862645434545885,0.0009573544600095925
"Polson MT HSA, Missoula MT HRR, USA",6.644388346367146,0.016183496501313187,0.6498098082332874,0.19494877824020265,0.019199509735442887,0.11985840728975394,0.0
"Park Falls WI HSA, Marshfield WI HRR, USA",4.514921491692378,0.36427698158540095,0.11013729580231364,0.31555072339905527,0.024813918224284675,0.18265076478169365,0.002570316207251922
"Harlan IA HSA, Omaha NE HRR, USA",6.424494336438615,0.5038745937089042,0.2894415111553365,0.1788339758334132,0.007456649010875654,0.019819934683411703,0.0005733356080586523
"Upper Sandusky OH HSA, Columbus OH HRR, USA",7.495120087239579,0.3997803661565345,0.31559840999609967,0.18493125001757763,0.034368412563086884,0.062134437508395216,0.003187123758305931
"Hamilton AL HSA, Tupelo MS HRR, USA",6.691931873162184,0.40025079024545923,0.5103234350937997,0.07910654606417852,0.0,0.008964212580136662,0.0013550160164258447
"Lewistown MT HSA, Billings MT HRR, USA",5.180553446580352,0.44345896206088975,0.17170929683203587,0.2278278840279802,0.02218820886780653,0.13427757769151427,0.0005380705197733413
"Watervliet MI HSA, St Joseph MI HRR, USA",6.383533908037958,0.564941028031357,0.1728311312656642,0.17634627312909051,0.025050267193469106,0.05034209734514125,0.010489203035277676
"Watford City ND HSA, Bismarck ND HRR, USA",4.516633806259571,0.2695601769994519,0.5019427603418394,0.2227141913534007,0.0007912256688670478,0.0012941523235090288,0.0036974933129320254
"Gilmer TX HSA, Tyler TX HRR, USA",7.118595567998347,0.25847926547851885,0.7064745917668681,0.018264767133601437,0.003908077228459882,0.003968818631503927,0.008904479761047827
"Camden TN HSA, Nashville TN HRR, USA",6.825826888841977,0.4429529824167026,0.45087612076252825,0.06550334501806555,0.0,0.03952951975515928,0.0011380320475444503
"Powell WY HSA, Billings MT HRR, USA",5.625015172886602,0.6902383477415761,0.19418785616746423,0.046885607504496385,0.002990331134783164,0.06491366177248363,0.0007841956791962739
"Lamar CO HSA, Colorado Springs CO HRR, USA",5.280790247337498,0.7734809156152014,0.10763983147234837,0.09694796862130435,0.004698816729361936,0.017232467561784103,0.0
"Blountstown FL HSA, Tallahassee FL HRR, USA",6.890978909839655,0.06254141926430677,0.8243091368356001,0.07054154472002754,0.0,0.031395294132679885,0.011212605047385676
"Fayette AL HSA, Tuscaloosa AL HRR, USA",6.935175126263902,0.24997164104682557,0.5984897552314106,0.10846094935954625,0.010546108839668604,0.031674082746366856,0.0008574627761822199
"Rawlins WY HSA, Casper WY HRR, USA",4.960797293787992,0.6411120618706305,0.23236822638634314,0.06860476086635772,0.00029346110945750666,0.05762148976721096,0.0
"Lake City IA HSA, Des Moines IA HRR, USA",6.056877725985789,0.4478836912634413,0.2177059700741443,0.2954064645438921,0.005850376597583003,0.02063538127420523,0.012518116246734016
"Rogersville TN HSA, Knoxville TN HRR, USA",6.450991127283604,0.3590537727936383,0.5719580006834205,0.007739740921375544,0.0018763008294243736,0.051632443850765763,0.007739740921375541
"Laurium MI HSA, Marquette MI HRR, USA",3.8152451879668368,0.6341723038653297,0.055500631786929384,0.17307777353549966,0.04653873011072579,0.08460445515288202,0.006106105548633376
"Owenton KY HSA, Lexington KY HRR, USA",7.038807501734842,0.07572708783286326,0.6045747623391465,0.24180966182959548,0.017780129320784783,0.05706251131308135,0.0030458473645288806
"Erwin TN HSA, Johnson City TN HRR, USA",5.6687164858581465,0.3286527514231498,0.5694497153700191,0.0377609108159393,0.02106261859582542,0.03965844402277039,0.0034155597722960156
"Weimar TX HSA, Houston TX HRR, USA",6.899766180349658,0.20278023218139943,0.628166016424922,0.1342679391838698,0.0,0.031613581190126874,0.003172231019681919
"York NE HSA, Lincoln NE HRR, USA",5.6286824101664035,0.5149488212611771,0.36549586758036917,0.08993357046621094,0.0022343864530725214,0.019867246379902014,0.007520107859267915
"Milan TN HSA, Jackson TN HRR, USA",7.019199633265219,0.36077485098336026,0.6211252577265417,0.012800357694524044,0.0,0.004767221350241073,0.0005323122453331863
"Jasper FL HSA, Tallahassee FL HRR, USA",6.715790320636264,0.030687454323090273,0.8508186323718004,0.06497984412043571,0.01272963819708653,0.01367962505699457,0.027104805930592484
"Perryton TX HSA, Amarillo TX HRR, USA",5.607461527363292,0.6318115522244464,0.26579325328106207,0.0753344955413799,0.0011611151107739288,0.023893770878969444,0.0020058129633684033
"Lincoln ME HSA, Bangor ME HRR, USA",4.092910364341674,0.00905783747558965,0.05705157029812346,0.0628353996689272,0.6548943157252615,0.21095947668983617,0.005201400142262053
"Edgerton WI HSA, Madison WI HRR, USA",6.828492152310571,0.6288974864663545,0.1610585755935366,0.15408929462608953,0.021854623791255995,0.030477783249824114,0.0036222362729392416
"Cameron MO HSA, Kansas City MO HRR, USA",6.793941395480341,0.5152395358382639,0.25524622010762305,0.16839398784367524,0.0,0.05906955681853765,0.0020506993919002982
"Carthage IL HSA, Springfield IL HRR, USA",7.156070166254145,0.44346766494204864,0.36376291482148976,0.1371761323943728,0.003971641667422053,0.04120373966631974,0.010417906508347253
"Hiawassee GA HSA, Atlanta GA HRR, USA",5.310529868517548,0.03537972725857514,0.5037827010676432,0.4067648425239578,0.007867400404588259,0.0462053287452358,0.0
"Driggs ID HSA, Idaho Falls ID HRR, USA",4.614510806450338,0.023791346787686362,0.3656553278832981,0.42238424174339123,0.034692792439444564,0.15347629114617978,0.0
"Waseca MN HSA, Minneapolis MN HRR, USA",6.023125239901298,0.6465229544247887,0.134002828858283,0.18330767982822682,0.005435473682236146,0.02104188291638609,0.009689180290079296
"Sylvania GA HSA, Savannah GA HRR, USA",6.54140896505853,0.07771114442778618,0.8453273363318341,0.05947026486756621,0.004497751124437777,0.010244877561219373,0.002748625687156418
"Friendship WI HSA, Madison WI HRR, USA",6.2197441569835465,0.24973898485323115,0.0912472267905773,0.5354746260819028,0.01775668763696804,0.10271539150644254,0.0030670831308782227
"Stilwell OK HSA, Tulsa OK HRR, USA",6.343286336627745,0.30611062384533616,0.3155597439677526,0.1598783286991247,0.005172896411443067,0.2022122902942881,0.01106611678205535
"Oakdale LA HSA, Alexandria LA HRR, USA",7.192032976893128,0.36787344506472913,0.5676788866912197,0.036612615309228276,0.0,0.0226398317837214,0.005195221151101617
"Fort Kent ME HSA, Bangor ME HRR, USA",3.9032005942650194,0.009965227390865194,0.06336063826736613,0.03633381633359054,0.7622465569426397,0.12790573790722032,0.00018802315831821132
"Crosby MN HSA, Minneapolis MN HRR, USA",4.972495032986981,0.3904005470606329,0.1957581963410351,0.3040894890705629,0.0181368885003257,0.08459332264568839,0.007021556381754976
"Aitkin MN HSA, Minneapolis MN HRR, USA",4.890032613152849,0.1469317547227831,0.16790883699084402,0.5150812208813271,0.023087721094757985,0.14510564252886715,0.0018848237814207804
"Hazlehurst MS HSA, Jackson MS HRR, USA",6.9700723606861095,0.16605042191144437,0.5568995926528564,0.21751703413221485,0.0,0.05042537474310354,0.00910757656038091
"De Quincy LA HSA, Lake Charles LA HRR, USA",7.181843812959627,0.1551807783593657,0.8024968556874298,0.030694378772647586,0.0,0.011627987180556885,0.0
"Tazewell VA HSA, Roanoke VA HRR, USA",4.884348114636695,0.02226573741411821,0.7688664258807045,0.09184066196838327,0.03835160164974379,0.05923477806019522,0.019440795026855
"Springhill LA HSA, Shreveport LA HRR, USA",7.254893491864702,0.5088405745690756,0.41986769851400985,0.03138056832469523,0.0070970983107903765,0.03281406028142899,0.0
"Quitman TX HSA, Tyler TX HRR, USA",7.137611033136816,0.11307648483565488,0.7336254023797216,0.11081319618696586,0.004805986040459014,0.03171950786702948,0.0059594226901691786
"Red Oak IA HSA, Omaha NE HRR, USA",6.666811435816075,0.5107828145557353,0.24675714155857395,0.20227869779366042,0.009423467662137313,0.017871103951889584,0.01288677447800346
"Raton NM HSA, Albuquerque NM HRR, USA",4.44673474799204,0.5641109092195926,0.12949040785890514,0.16523864299897528,0.0007455946309072832,0.1403870337243069,2.7411567312767787e-05
"Westfield NY HSA, Erie PA HRR, USA",5.837802715357818,0.45128181191292893,0.3221049560501477,0.09726288297661725,0.04420546177483938,0.08463424237197147,0.0005106449134951567
"Holdrege NE HSA, Lincoln NE HRR, USA",5.610982536075506,0.5609522085338798,0.3509309906290582,0.05421758217397859,0.0003220816217524651,0.031223917529882517,0.0023532195114483864
"Fredericktown MO HSA, St Louis MO HRR, USA",6.554618794793573,0.19879787164059345,0.5751450449801568,0.09774703729335249,0.0034859583236454975,0.12196872369058502,0.0028553640716666396
"Sturgis SD HSA, Rapid City SD HRR, USA",5.055186096224619,0.5252938014697519,0.29564097690991753,0.13522461179616563,0.0014060890557375443,0.03855371619680097,0.0038808045716264682
"Paris IL HSA, Urbana IL HRR, USA",7.468030584802422,0.6265412344225582,0.23263579407376894,0.10608212844810673,0.0,0.0211887079270427,0.01355213512852357
"San Carlos AZ HSA, Phoenix AZ HRR, USA",5.7665010476726986,0.27507547802750754,0.3287487420328749,0.0432740691043274,0.06742703790674275,0.26970815162697076,0.015766521301576655
"Wellington KS HSA, Wichita KS HRR, USA",6.762770945139491,0.6317758091521175,0.2022292457992593,0.12309078708643606,0.0010483338853426694,0.03895462588871101,0.002901198188133542
"Centerville IA HSA, Des Moines IA HRR, USA",6.629466145325781,0.3917521000769492,0.30640904693598536,0.23515324233584925,0.0005021972837189583,0.059199100873925825,0.006984312493571301
"Heber Springs AR HSA, Little Rock AR HRR, USA",6.593669241582647,0.32380277533678653,0.5303526022016318,0.12462074094767933,0.0,0.01967187332761273,0.0015520081862897394
"Madison FL HSA, Tallahassee FL HRR, USA",6.725839838946,0.0838562263927898,0.797750473937621,0.0935549122427974,3.070679638314372e-05,0.023709035896344727,0.001098644734064038
"Abilene KS HSA, Topeka KS HRR, USA",6.463977931823386,0.6337856927932797,0.190487372247152,0.12673238581168259,0.00022872402574420332,0.04632652065635918,0.0024393044657822407
"Linden TN HSA, Nashville TN HRR, USA",6.5721370162979085,0.2845487661431522,0.5634417416943238,0.09046605977158888,0.0,0.06151292872563521,3.0503665299897532e-05
"Calais ME HSA, Bangor ME HRR, USA",3.906057034819242,0.002827679961969864,0.055185613901440625,0.18200649806425392,0.6298426526506485,0.1299131156845733,0.00022443973711382503
"Kingwood WV HSA, Morgantown WV HRR, USA",5.881705139879506,0.25932257568713823,0.2931075202555855,0.13179484076406278,0.14384502171369792,0.1654596160561643,0.006470425523351196
"Maquoketa IA HSA, Davenport IA HRR, USA",6.81253719438587,0.5134894151197112,0.11673430545933139,0.29328917226591006,0.02991034603084586,0.04326575114757698,0.0033110099766244265
"Windom MN HSA, Sioux Falls SD HRR, USA",5.407410651196673,0.6214779008734111,0.12043679644702159,0.19925876761870204,0.02637106939784905,0.0213658007122248,0.011089664950791524
"Brookfield MO HSA, Columbia MO HRR, USA",6.745518190409158,0.4003480310961865,0.2927499071285165,0.24047333669176585,0.0006980880883068141,0.06210872948177847,0.0036219075134459235
"Clintwood VA HSA, Kingsport TN HRR, USA",5.765980014191274,0.027301867433465157,0.8566059934428454,0.04293640555647578,0.025150501125327653,0.04476711255229474,0.003238119889591229
"New Hampton IA HSA, Rochester MN HRR, USA",6.286994047006625,0.40248211590000643,0.12515503353195256,0.4074501015258729,0.02188253418993378,0.04185453186979329,0.0011756829824409963
"Cumberland WI HSA, Minneapolis MN HRR, USA",5.595860280175782,0.28578704292922286,0.1120632774836719,0.4541185160421739,0.01852457949652281,0.11545254433872337,0.014054039709685256
"Potosi MO HSA, St Louis MO HRR, USA",6.386742354514227,0.1368931748372637,0.6033017318779578,0.14363362623982703,0.0,0.1161714670449516,0.0
"Grantsburg WI HSA, Minneapolis MN HRR, USA",5.264313589252444,0.18761303684646963,0.10273171978902645,0.549812991076274,0.01254678740180836,0.1407336074966176,0.0065618573898038055
"Bowie TX HSA, Wichita Falls TX HRR, USA",6.690594413878847,0.3449964577175316,0.45695079596635113,0.16902970599966124,0.0,0.026197713391406124,0.002825326925049918
