"San Leandro CA HSA, Alameda Co. CA HRR, USA",0.5636762129688836,0.6223609825015465,-0.058684769532662884
"Westwood NJ HSA, Hackensack NJ HRR, USA",0.06929346570173125,-0.017451169115197902,0.08674463481692915
"Leonardtown MD HSA, Washington DC HRR, USA",-0.13498221384981493,-0.22029590230254664,0.08531368845273171
"Bountiful UT HSA, Salt Lake City UT HRR, USA",-0.20816679258311835,-0.2066519365367996,-0.0015148560463187355
"Rock Island IL HSA, Davenport IA HRR, USA",0.10982674202551494,0.06865174738395227,0.04117499464156267
"Danville IN HSA, Indianapolis IN HRR, USA",-0.3316872764926341,-0.4140829301286046,0.08239565363597051
"Elizabeth City NC HSA, Norfolk VA HRR, USA",-0.17590631342444024,-0.17943056532176943,0.003524251897329189
"Alton IL HSA, St Louis MO HRR, USA",-0.2132158287563604,-0.2137700084154816,0.0005541796591212178
"Exeter NH HSA, Manchester NH HRR, USA",0.07396060731777483,-0.003141190579063115,0.07710179789683795
"Sheboygan WI HSA, Milwaukee WI HRR, USA",-0.15666541258793878,-0.15439562292717635,-0.002269789660762439
"Houma LA HSA, Houma LA HRR, USA",-0.5239686612602522,-0.5074020168558899,-0.016566644404362285
"Farmington NM HSA, Albuquerque NM HRR, USA",-0.3849362767676097,-0.4330510516603164,0.04811477489270666
"Fairbanks AK HSA, Anchorage AK HRR, USA",-0.16030756348028805,-0.20656399506133002,0.04625643158104198
"Maumee OH HSA, Toledo OH HRR, USA",-0.09338885450485356,-0.13082550575718307,0.03743665125232952
"Hendersonville NC HSA, Asheville NC HRR, USA",-0.19146980093634428,-0.27990042019183403,0.08843061925548976
"New Rochelle NY HSA, Bronx NY HRR, USA",0.4621000722318407,0.4291725339359449,0.032927538295895786
"Fort Thomas KY HSA, Covington KY HRR, USA",-0.2375607011329805,-0.28414313686907056,0.046582435736090055
"Bentonville AR HSA, Springdale AR HRR, USA",-0.21155250329510797,-0.3155880716403738,0.10403556834526581
"Sherman TX HSA, Dallas TX HRR, USA",-0.5355677576838708,-0.5538991284670668,0.01833137078319602
"Lewes DE HSA, Salisbury MD HRR, USA",-0.03489202961203648,-0.1540199103682903,0.11912788075625382
"Lake Saint Louis MO HSA, St Louis MO HRR, USA",-0.3471419263012243,-0.3899156257118902,0.04277369941066589
"Wayne NJ HSA, Paterson NJ HRR, USA",0.05124333124992617,0.03173392734234026,0.01950940390758591
"Harvey IL HSA, Blue Island IL HRR, USA",0.8239332269693442,0.8431447505845888,-0.019211523615244586
"Davis CA HSA, Sacramento CA HRR, USA",0.5387661057891816,0.5396902985469527,-0.000924192757771114
"Asheboro NC HSA, Greensboro NC HRR, USA",-0.5485814039989032,-0.5452201034364034,-0.003361300562499836
"Pottstown PA HSA, Reading PA HRR, USA",-0.032507137167291617,-0.09100064873936761,0.058493511572075996
"Ithaca NY HSA, Rochester NY HRR, USA",0.4861164058821669,0.4299589327559021,0.056157473126264845
"Federal Way WA HSA, Seattle WA HRR, USA",0.2796001070332904,0.2559025698229043,0.023697537210386088
"Dallas GA HSA, Atlanta GA HRR, USA",-0.34899893166621176,-0.4598938632537249,0.11089493158751312
"Greenville TX HSA, Dallas TX HRR, USA",-0.5336717453036695,-0.5617598334431905,0.028088088139521017
"Palmer AK HSA, Anchorage AK HRR, USA",-0.4830308924402477,-0.5153880587381878,0.03235716629794011
"Plymouth MA HSA, Boston MA HRR, USA",0.14459727244863457,0.027161076033991576,0.117436196414643
"Hoffman Estates IL HSA, Elgin IL HRR, USA",0.2581553247982791,0.26490861084141276,-0.006753286043133688
"Maryville IL HSA, St Louis MO HRR, USA",-0.04741663656481764,-0.10784327581732471,0.06042663925250707
"Meriden CT HSA, New Haven CT HRR, USA",0.1311459372737748,0.08516160518201339,0.04598433209176141
"Kennewick WA HSA, Spokane WA HRR, USA",-0.25035715364272226,-0.3032069320208816,0.05284977837815935
"Carrollton GA HSA, Atlanta GA HRR, USA",-0.459752172441764,-0.4571041960723984,-0.00264797636936559
"Trenton MI HSA, Dearborn MI HRR, USA",-0.11612596878748524,-0.1474246045827455,0.031298635795260266
"Madera CA HSA, Fresno CA HRR, USA",0.0054009895722608135,-0.008270380747567967,0.01367137031982878
"Goshen NY HSA, Ridgewood NJ HRR, USA",-0.16389057353037917,-0.11062696650705693,-0.05326360702332224
"Katy TX HSA, Houston TX HRR, USA",-0.13660686520282364,-0.24517163681508114,0.1085647716122575
"San Luis Obispo CA HSA, San Luis Obispo CA HRR, USA",0.40599080537387033,0.35033479213534313,0.0556560132385272
"Kokomo IN HSA, Indianapolis IN HRR, USA",-0.372121172904471,-0.37709072982887115,0.004969556924400154
"Mount Pleasant SC HSA, Charleston SC HRR, USA",-0.0652890195190844,-0.12674979254872817,0.06146077302964377
"Folsom CA HSA, Sacramento CA HRR, USA",0.07383622268838212,0.013995642277216482,0.05984058041116564
"Norwalk CA HSA, Los Angeles CA HRR, USA",0.4082844954860863,0.52612078125387,-0.11783628576778366
"Great Falls MT HSA, Great Falls MT HRR, USA",-0.24337216599534933,-0.26095070109645574,0.017578535101106407
"Caldwell ID HSA, Boise ID HRR, USA",-0.45516536434593274,-0.45070542591755686,-0.004459938428375887
"Columbia TN HSA, Nashville TN HRR, USA",-0.43182918339628673,-0.43137201403170955,-0.00045716936457718127
"Union NJ HSA, Newark NJ HRR, USA",0.2736859427765899,0.23207376951230765,0.041612173264282265
"Liberty MO HSA, Kansas City MO HRR, USA",-0.22987661474676216,-0.2670540332636796,0.03717741851691744
"Carlisle PA HSA, Harrisburg PA HRR, USA",-0.25102591926334583,-0.2964069187322156,0.045380999468869754
"Lancaster SC HSA, Charlotte NC HRR, USA",-0.2416230965825709,-0.261667992538355,0.020044895955784098
"Blue Springs MO HSA, Kansas City MO HRR, USA",-0.21117438313262013,-0.295065517501713,0.08389113436909287
"Aiken SC HSA, Augusta GA HRR, USA",-0.16390087985880994,-0.2041942550536148,0.04029337519480486
"Bunnell FL HSA, Ormond Beach FL HRR, USA",-0.1902394541306749,-0.18217285475197706,-0.00806659937869783
"Lumberton NC HSA, Durham NC HRR, USA",-0.17690895046162847,-0.044063404201649524,-0.13284554625997894
"Watertown NY HSA, Syracuse NY HRR, USA",-0.19579840384960018,-0.21460049694905753,0.01880209309945735
"Danville VA HSA, Durham NC HRR, USA",-0.14111907438110793,-0.135221853939339,-0.0058972204417689356
"Palm Springs CA HSA, Palm Spr/Rancho Mir. CA HRR, USA",0.41888860259074395,0.3517105080120193,0.06717809457872465
"Derby CT HSA, New Haven CT HRR, USA",-0.07205816091930256,-0.1740096318587409,0.10195147093943835
"Jeffersonville IN HSA, Louisville KY HRR, USA",-0.13267666053706634,-0.1756746796324916,0.04299801909542525
"Beaver PA HSA, Pittsburgh PA HRR, USA",-0.2084040509711511,-0.21822325019663572,0.009819199225484604
"Council Bluffs IA HSA, Omaha NE HRR, USA",-0.1959503862302575,-0.2378096066921192,0.04185922046186169
"Cheyenne WY HSA, Fort Collins CO HRR, USA",-0.2857109442868618,-0.3276094439449411,0.04189849965807935
"Nacogdoches TX HSA, Houston TX HRR, USA",-0.3959293582133276,-0.4192208219165552,0.0232914637032276
"St Joseph MI HSA, St Joseph MI HRR, USA",-0.031411879440995494,-0.09088077390906903,0.05946889446807353
"Sun City Center FL HSA, Tampa FL HRR, USA",-0.10153826730460158,-0.15706159869534653,0.055523331390744946
"Phoenixville PA HSA, Philadelphia PA HRR, USA",0.18787054575218773,0.08981339552828273,0.098057150223905
"Roseburg OR HSA, Eugene OR HRR, USA",-0.3817943570323731,-0.38612931717915727,0.004334960146784195
"Haverhill MA HSA, Boston MA HRR, USA",0.11795637935294508,0.025683722420698028,0.09227265693224705
"Tualatin OR HSA, Portland OR HRR, USA",0.1265578521274026,0.05698638149349618,0.06957147063390641
"Pasco WA HSA, Spokane WA HRR, USA",-0.16061867830620483,-0.20080592625491014,0.04018724794870532
"Fond Du Lac WI HSA, Milwaukee WI HRR, USA",-0.2841434020513843,-0.2811879950639927,-0.002955406987391551
"Manchester CT HSA, Hartford CT HRR, USA",0.29464100249029757,0.19075205578804438,0.10388894670225318
"Waconia MN HSA, Minneapolis MN HRR, USA",-0.21655236779730108,-0.281774581494382,0.06522221369708092
"North Tarrytown NY HSA, White Plains NY HRR, USA",0.4772324494034241,0.4350782386751451,0.04215421072827896
"South Laguna CA HSA, Orange Co. CA HRR, USA",0.08154339973064008,0.0252638297119501,0.05627957001868998
"Pocatello ID HSA, Salt Lake City UT HRR, USA",-0.24440370150567842,-0.22830071195808446,-0.016102989547593954
"Bridgeton NJ HSA, Camden NJ HRR, USA",-0.013287896296230839,-0.023171144346260383,0.009883248050029544
"Florence AL HSA, Birmingham AL HRR, USA",-0.46132314951913395,-0.46729018661125443,0.005967037092120486
"Wilson NC HSA, Raleigh NC HRR, USA",-0.06632089687685849,-0.03646672517314495,-0.029854171703713545
"Grants Pass OR HSA, Medford OR HRR, USA",-0.2685102686809098,-0.3121635900629987,0.04365332138208888
"Ashland KY HSA, Huntington WV HRR, USA",-0.4046242338501638,-0.4207717080651197,0.016147474214955937
"Los Alamitos CA HSA, Orange Co. CA HRR, USA",0.05485567632685009,0.02480636671859896,0.030049309608251126
"Jacksonville AR HSA, Little Rock AR HRR, USA",-0.37359173686709823,-0.39110785499275713,0.017516118125658897
"Pawtucket RI HSA, Providence RI HRR, USA",0.4266148628828274,0.4450399649149468,-0.01842510203211939
"Greenwood SC HSA, Columbia SC HRR, USA",-0.2324879973174491,-0.21203756542542865,-0.02045043189202045
"Searcy AR HSA, Little Rock AR HRR, USA",-0.5877066521034628,-0.5456490778614548,-0.04205757424200807
"Gadsden AL HSA, Birmingham AL HRR, USA",-0.4760302730566389,-0.46847707504299313,-0.00755319801364579
"Templeton CA HSA, San Luis Obispo CA HRR, USA",-0.08313012557430187,-0.13950313675416778,0.056373011179865914
"Oshkosh WI HSA, Neenah WI HRR, USA",-0.04476862703257793,-0.07049652267008072,0.025727895637502787
"Napa CA HSA, Napa CA HRR, USA",0.38868187109622393,0.33011055655820043,0.0585713145380235
"Prince Frederick MD HSA, Washington DC HRR, USA",-0.059559075137288364,-0.16976968362016906,0.1102106084828807
"Apple Valley CA HSA, San Bernardino CA HRR, USA",-0.281787314003019,-0.3365414979215919,0.054754183918572896
"Easton MD HSA, Baltimore MD HRR, USA",-0.16539082226921042,-0.24165030623801867,0.07625948396880824
"Fort Pierce FL HSA, Orlando FL HRR, USA",0.01800421529149752,0.030654122705529172,-0.012649907414031651
"Midwest City OK HSA, Oklahoma City OK HRR, USA",-0.2016892944368886,-0.29245385028264714,0.09076455584575854
"Ames IA HSA, Des Moines IA HRR, USA",0.16386754609092524,0.11286162637195382,0.05100591971897142
"Manahawkin NJ HSA, Camden NJ HRR, USA",-0.24235820756149803,-0.3217459389227228,0.07938773136122476
"Watsonville CA HSA, Santa Cruz CA HRR, USA",0.5361476286053186,0.5421901933930303,-0.006042564787711702
"Hawthorne CA HSA, Los Angeles CA HRR, USA",0.5634603330880575,0.6516385921451507,-0.0881782590570932
"Texarkana TX HSA, Texarkana AR HRR, USA",-0.4283393576428197,-0.4624243803178566,0.03408502267503688
"Yuba City CA HSA, Sacramento CA HRR, USA",-0.14784922870878814,-0.13661488119602674,-0.011234347512761395
"Monroeville PA HSA, Pittsburgh PA HRR, USA",-0.02975530590889322,-0.09138409554269783,0.06162878963380461
"Taylor TX HSA, Temple TX HRR, USA",-0.05855075094475164,-0.1798625560647817,0.12131180512003005
"Beckley WV HSA, Charleston WV HRR, USA",-0.5318608871475763,-0.547989200006122,0.016128312858545657
"Dover NH HSA, Portland ME HRR, USA",0.25072463157127733,0.17488705227405735,0.07583757929721999
"Anniston AL HSA, Birmingham AL HRR, USA",-0.40014616788155566,-0.41027334119290054,0.010127173311344884
"Grand Forks ND HSA, Grand Forks ND HRR, USA",-0.17388692678000858,-0.21466667129926664,0.04077974451925806
"Menomonee Falls WI HSA, Milwaukee WI HRR, USA",-0.2304094511836942,-0.2973043955217878,0.06689494433809356
"Monroe MI HSA, Toledo OH HRR, USA",-0.20918559179400437,-0.20991130968795127,0.0007257178939469033
"Pittsfield MA HSA, Albany NY HRR, USA",0.4166432786627112,0.34798689448156256,0.06865638418114867
"Texas City TX HSA, Houston TX HRR, USA",-0.11304200463817521,-0.09135888187076123,-0.02168312276741398
"Columbus IN HSA, Indianapolis IN HRR, USA",-0.30457605092003237,-0.35611936413730827,0.0515433132172759
"Minot ND HSA, Minot ND HRR, USA",-0.4356088960784114,-0.44090110724580733,0.005292211167395922
"Mooresville NC HSA, Charlotte NC HRR, USA",-0.30704570702570144,-0.38438897765527574,0.0773432706295743
"Weatherford TX HSA, Fort Worth TX HRR, USA",-0.6421124754206372,-0.6743702985556385,0.03225782313500125
"Port Chester NY HSA, White Plains NY HRR, USA",0.30283992163765866,0.25908581673490894,0.043754104902749724
"Jupiter FL HSA, Fort Lauderdale FL HRR, USA",-0.19205342311720125,-0.20036531071089422,0.008311887593692974
"Loma Linda CA HSA, San Bernardino CA HRR, USA",0.2403735756672082,0.2694107238182909,-0.029037148151082687
"Saratoga Springs NY HSA, Albany NY HRR, USA",0.09960595025455624,0.01877040581709992,0.08083554443745632
"Darby PA HSA, Philadelphia PA HRR, USA",0.7668995713230512,0.769435662104307,-0.0025360907812558287
"Gulf Breeze FL HSA, Pensacola FL HRR, USA",-0.394752653106167,-0.467427493325604,0.07267484021943704
"Mankato MN HSA, Minneapolis MN HRR, USA",0.009033405811424684,-0.06635414447048703,0.07538755028191171
"Safety Harbor FL HSA, Clearwater FL HRR, USA",-0.08639535350112924,-0.11715104310385623,0.030755689602726982
"Kenmore NY HSA, Buffalo NY HRR, USA",0.10795540810516611,-0.019054516771436276,0.1270099248766024
"St Cloud FL HSA, Orlando FL HRR, USA",-0.16146398068717807,-0.1688322697573183,0.007368289070140227
"Venice FL HSA, Sarasota FL HRR, USA",-0.17737214681520264,-0.2031817830975169,0.025809636282314252
"Cullman AL HSA, Birmingham AL HRR, USA",-0.7782937287681532,-0.771075872463279,-0.007217856304874148
"Livermore CA HSA, Alameda Co. CA HRR, USA",0.2581779980076582,0.2071244353055086,0.05105356270214964
"Delray Beach FL HSA, Fort Lauderdale FL HRR, USA",0.20483546186064708,0.2312163126446487,-0.026380850784001625
"Havre De Grace MD HSA, Baltimore MD HRR, USA",-0.10470259651604488,-0.1967529118396428,0.09205031532359792
"Lexington NC HSA, Winston-Salem NC HRR, USA",-0.477678883431034,-0.48040789581373783,0.0027290123827038437
"Poplar Bluff MO HSA, St Louis MO HRR, USA",-0.6500362874213778,-0.6206995919439781,-0.0293366954773997
"Porterville CA HSA, Bakersfield CA HRR, USA",-0.08121108618526612,-0.07753675725983107,-0.0036743289254350525
"Crystal River FL HSA, Ocala FL HRR, USA",-0.41592495818692365,-0.40529553647856725,-0.010629421708356401
"Shelby NC HSA, Charlotte NC HRR, USA",-0.3626906204248321,-0.3325100803202855,-0.03018054010454657
"Milford DE HSA, Salisbury MD HRR, USA",-0.1657714619464275,-0.25554970826358814,0.08977824631716064
"Rogers AR HSA, Springdale AR HRR, USA",-0.22378430670960306,-0.2834794077102618,0.05969510100065875
"Newton MA HSA, Boston MA HRR, USA",0.6292820727984682,0.5782208871440759,0.051061185654392216
"Benton AR HSA, Little Rock AR HRR, USA",-0.46084508139876085,-0.46516027850967795,0.004315197110917102
"San Marcos TX HSA, Austin TX HRR, USA",0.27539782322189316,0.16650170237354586,0.1088961208483473
"Downers Grove IL HSA, Hinsdale IL HRR, USA",0.22397039159537752,0.1772864285112543,0.0466839630841232
"Blacksburg VA HSA, Roanoke VA HRR, USA",0.12519486129144522,0.0686822414992777,0.056512619792167526
"Sewickley PA HSA, Pittsburgh PA HRR, USA",-0.016372743309058923,-0.07849535953429199,0.06212261622523306
"West Allis WI HSA, Milwaukee WI HRR, USA",0.008769192036924658,-0.05811342497157199,0.06688261700849665
"Ridley Park PA HSA, Philadelphia PA HRR, USA",0.1648286761431493,0.12753602576607492,0.03729265037707438
"Portsmouth OH HSA, Columbus OH HRR, USA",-0.45642528129366844,-0.40657606398353063,-0.049849217310137806
"Conyers GA HSA, Atlanta GA HRR, USA",0.42083835960266536,0.27513575209734803,0.14570260750531733
"Newburgh NY HSA, White Plains NY HRR, USA",0.10504677112103254,0.023796597153408306,0.08125017396762424
"Willingboro NJ HSA, Camden NJ HRR, USA",0.48711078420949316,0.45973220454764546,0.027378579661847702
"Wylie TX HSA, Dallas TX HRR, USA",-0.17599971168311127,-0.29390611922813026,0.11790640754501899
"Griffin GA HSA, Atlanta GA HRR, USA",-0.3567408657758709,-0.3750094401161146,0.018268574340243704
"San Pedro CA HSA, Los Angeles CA HRR, USA",0.30842570589850415,0.32246220903126055,-0.014036503132756395
"Glenwood Springs CO HSA, Grand Junction CO HRR, USA",0.153713641966834,0.059546268919162204,0.09416737304767181
"Lapeer MI HSA, Flint MI HRR, USA",-0.37087905138913946,-0.38942318168429596,0.018544130295156502
"Orangeburg SC HSA, Columbia SC HRR, USA",0.2550540510556615,0.29710759733710396,-0.04205354628144248
"Quincy IL HSA, Springfield IL HRR, USA",-0.49973326400251566,-0.4996068792616092,-0.00012638474090648222
"Willimantic CT HSA, Hartford CT HRR, USA",0.18196988804399095,0.18405537786988063,-0.002085489825889686
"Hanover PA HSA, York PA HRR, USA",-0.3694017814407976,-0.41824850684168174,0.04884672540088414
"Tulare CA HSA, Bakersfield CA HRR, USA",-0.13385900666890613,-0.13093630500054335,-0.0029227016683627816
"Camarillo CA HSA, Ventura CA HRR, USA",0.07994986777247791,0.020243341270474568,0.05970652650200334
"Elmira NY HSA, Elmira NY HRR, USA",-0.15650050058195314,-0.19648830369270595,0.03998780311075281
"Smyrna GA HSA, Atlanta GA HRR, USA",0.3658999825915315,0.26141620993413484,0.10448377265739667
"Plattsburgh NY HSA, Burlington VT HRR, USA",0.05735207230486893,0.01753119543777388,0.039820876867095054
"Rahway NJ HSA, Newark NJ HRR, USA",0.23424515822989375,0.2272240692706512,0.007021088959242555
"Richland WA HSA, Spokane WA HRR, USA",-0.1700860551349849,-0.21833538934407676,0.04824933420909186
"Pittsburg CA HSA, Contra Costa Co. CA HRR, USA",0.5593288261709282,0.6010728974149053,-0.041744071243977166
"Janesville WI HSA, Madison WI HRR, USA",0.1239321088111489,0.10048916203583214,0.02344294677531676
"Phenix City AL HSA, Columbus GA HRR, USA",-0.14689157544912188,-0.17266470802436204,0.025773132575240165
"New Albany IN HSA, Louisville KY HRR, USA",-0.1775078428963129,-0.22607123286153616,0.04856338996522325
"Marshfield WI HSA, Marshfield WI HRR, USA",-0.31923330016819745,-0.29818767478206565,-0.021045625386131805
"Corvallis OR HSA, Eugene OR HRR, USA",0.4233603125197854,0.3528698160862178,0.07049049643356758
"Coatesville PA HSA, Lancaster PA HRR, USA",0.09229493579623109,0.04545651392313085,0.04683842187310024
"Oak Ridge TN HSA, Knoxville TN HRR, USA",-0.3438932040138036,-0.3523554303095868,0.008462226295783248
"Lancaster OH HSA, Columbus OH HRR, USA",-0.4009055993285051,-0.38388708579954217,-0.017018513528962942
"Wheeling WV HSA, Pittsburgh PA HRR, USA",-0.36254058049565796,-0.37993736873946604,0.01739678824380808
"Greer SC HSA, Greenville SC HRR, USA",-0.32939511654784187,-0.3809397871403983,0.05154467059255641
"Grand Prairie TX HSA, Dallas TX HRR, USA",0.24453548695702448,0.18362131191288586,0.060914175044138624
"Williamsport PA HSA, Danville PA HRR, USA",-0.3657507606210046,-0.4055091964365843,0.039758435815579696
"Mason City IA HSA, Mason City IA HRR, USA",-0.19998003007549617,-0.18904331803837476,-0.010936712037121404
"Natrona Heights PA HSA, Pittsburgh PA HRR, USA",-0.3275059604729296,-0.33466729309805765,0.007161332625128025
"Smithfield NC HSA, Raleigh NC HRR, USA",-0.36843687286627524,-0.37044932678169645,0.0020124539154212084
"Melrose MA HSA, Boston MA HRR, USA",0.2608892705465104,0.1540190271361737,0.10687024341033671
"Fort Walton Beach FL HSA, Pensacola FL HRR, USA",-0.2952700596842816,-0.38492181969491995,0.08965176001063835
"Hazleton PA HSA, Allentown PA HRR, USA",-0.3387385918353824,-0.3671694658230828,0.02843087398770039
"Hammond IN HSA, Munster IN HRR, USA",0.6038072917729534,0.6263660864870125,-0.022558794714059083
"Falmouth MA HSA, Boston MA HRR, USA",0.20258314777093112,0.0972937178213002,0.10528942994963092
"San Clemente CA HSA, Orange Co. CA HRR, USA",-0.08387347106183272,-0.12487801730434352,0.04100454624251079
"Grass Valley CA HSA, Sacramento CA HRR, USA",0.08074333068701449,-0.008014869727317873,0.08875820041433236
"Easley SC HSA, Greenville SC HRR, USA",-0.5177426012984119,-0.5418192099249038,0.02407660862649197
"Banning CA HSA, San Bernardino CA HRR, USA",-0.027242246237051,-0.08135581014501858,0.05411356390796758
"Carmel NY HSA, New Haven CT HRR, USA",-0.12805979368054554,-0.20725768842376666,0.07919789474322111
"Lees Summit MO HSA, Kansas City MO HRR, USA",-0.0529297501104207,-0.14851409523670397,0.09558434512628328
"Casper WY HSA, Casper WY HRR, USA",-0.4890230195616667,-0.5210558411075628,0.03203282154589604
"Morristown TN HSA, Knoxville TN HRR, USA",-0.5830758483632807,-0.5954899656208541,0.012414117257573354
"Statesboro GA HSA, Savannah GA HRR, USA",-0.23906491836721558,-0.23101675996816834,-0.00804815839904724
"Springfield OR HSA, Eugene OR HRR, USA",0.08591881129261894,0.022435572534218524,0.06348323875840042
"Chillicothe OH HSA, Columbus OH HRR, USA",-0.37072089882916537,-0.2943773279483142,-0.07634357088085114
"Kalispell MT HSA, Missoula MT HRR, USA",-0.3938796261983522,-0.44084132827811995,0.04696170207976774
"Somerset KY HSA, Lexington KY HRR, USA",-0.6525995493494688,-0.6827861727358503,0.03018662338638145
"Winder GA HSA, Atlanta GA HRR, USA",-0.42442971554052916,-0.5216492071264593,0.09721949158593018
"Cottonwood AZ HSA, Phoenix AZ HRR, USA",-0.14852741901681188,-0.16028261534582508,0.011755196329013201
"Woodland CA HSA, Sacramento CA HRR, USA",0.19403087274199515,0.17700249064308468,0.01702838209891047
"Petaluma CA HSA, Santa Rosa CA HRR, USA",0.4962482393461895,0.4696738102653661,0.026574429080823414
"Newton NJ HSA, Morristown NJ HRR, USA",-0.18944937221719702,-0.2947884098542818,0.10533903763708477
"Huntsville TX HSA, Houston TX HRR, USA",-0.3460921151510386,-0.3611670012457754,0.015074886094736784
"Wooster OH HSA, Canton OH HRR, USA",-0.34716141832942615,-0.3225778507951365,-0.02458356753428964
"Marysville CA HSA, Sacramento CA HRR, USA",-0.22474059260427715,-0.2383350124972494,0.013594419892972248
"Methuen MA HSA, Boston MA HRR, USA",0.017338796193911897,-0.04979186211024223,0.06713065830415413
"Delano CA HSA, Bakersfield CA HRR, USA",0.3827936380722054,0.5316858925154918,-0.1488922544432864
"Oregon OH HSA, Toledo OH HRR, USA",-0.08129069312114325,-0.015955822746560107,-0.06533487037458313
"Laurel MS HSA, Hattiesburg MS HRR, USA",-0.3215587378602931,-0.3242168873619799,0.0026581495016868018
"Midland MI HSA, Saginaw MI HRR, USA",-0.14284162492533645,-0.19244801441798712,0.04960638949265067
"Cartersville GA HSA, Atlanta GA HRR, USA",-0.47451810151389556,-0.5199783028067358,0.045460201292840285
"Howell MI HSA, Ann Arbor MI HRR, USA",-0.28664072555094444,-0.352025126973219,0.06538440142227459
"Oxford MS HSA, Oxford MS HRR, USA",-0.17202618532835873,-0.18306927631214276,0.011043090983784032
"Somerville MA HSA, Boston MA HRR, USA",0.7775260059658831,0.7342465292547934,0.04327947671108967
"Manhattan KS HSA, Topeka KS HRR, USA",-0.015240568910066182,-0.08792914222675056,0.07268857331668438
"Enid OK HSA, Oklahoma City OK HRR, USA",-0.5915013603520803,-0.5862615701878722,-0.005239790164208169
"Jeannette PA HSA, Pittsburgh PA HRR, USA",-0.2994238871329964,-0.3402498817344944,0.040825994601497995
"Long Branch NJ HSA, Camden NJ HRR, USA",0.02457766487814753,-0.0125743748272807,0.03715203970542823
"Danville IL HSA, Urbana IL HRR, USA",-0.35973462151144514,-0.32826398675698587,-0.03147063475445927
"Paris TX HSA, Dallas TX HRR, USA",-0.6110903380898963,-0.6062813780413985,-0.004808960048497846
"Arlington MA HSA, Boston MA HRR, USA",0.6635336224724934,0.5901344980447077,0.07339912442778562
"Kinston NC HSA, Greenville NC HRR, USA",-0.08623021947504245,-0.07980998118325695,-0.006420238291785493
"Oak Park IL HSA, Melrose Park IL HRR, USA",0.7432869701465648,0.6938781154397398,0.04940885470682499
"Muskogee OK HSA, Tulsa OK HRR, USA",-0.3782206226558467,-0.32672258610517957,-0.05149803655066715
"Kearny NJ HSA, Newark NJ HRR, USA",0.18990522956089714,0.2323011130845671,-0.042395883523669964
"Suffolk VA HSA, Norfolk VA HRR, USA",0.048828102898131,0.031155047919266873,0.017673054978864126
"Beaufort SC HSA, Savannah GA HRR, USA",0.03351170998123641,-0.006371304676068053,0.03988301465730446
"Medina OH HSA, Cleveland OH HRR, USA",-0.24599388310149467,-0.26702940045169893,0.021035517350204258
"Fort Oglethorpe GA HSA, Chattanooga TN HRR, USA",-0.5853023039726806,-0.6109239769500234,0.025621672977342858
"Quincy MA HSA, Boston MA HRR, USA",0.36259274488576937,0.30569745238704676,0.056895292498722605
"Washington PA HSA, Pittsburgh PA HRR, USA",-0.2738748786582901,-0.2727663867937193,-0.001108491864570793
"Athens AL HSA, Huntsville AL HRR, USA",-0.4712456659741149,-0.5179892223881408,0.046743556414025944
"Richmond IN HSA, Indianapolis IN HRR, USA",-0.34354172567162183,-0.34435394152815196,0.0008122158565301296
"Pine Bluff AR HSA, Little Rock AR HRR, USA",0.10152501041903264,0.15997574042714566,-0.05845073000811302
"La Grange GA HSA, Atlanta GA HRR, USA",-0.2364397143164095,-0.2409404918795427,0.00450077756313319
"Ormond Beach FL HSA, Ormond Beach FL HRR, USA",-0.2140048043028382,-0.22878817893746076,0.014783374634622565
"De Kalb IL HSA, Rockford IL HRR, USA",0.13457737303612743,0.10201764946053626,0.03255972357559117
"Pinole CA HSA, San Francisco CA HRR, USA",0.5707349000153785,0.5916242019169937,-0.020889301901615198
"Avon Park FL HSA, Orlando FL HRR, USA",-0.3766898046233661,-0.3394527148300449,-0.03723708979332119
"Bristol CT HSA, Hartford CT HRR, USA",0.013523964398787384,-0.05813130976835951,0.0716552741671469
"Hampton VA HSA, Newport News VA HRR, USA",0.38661799977620187,0.3362022246423183,0.05041577513388357
"Warrenton VA HSA, Arlington VA HRR, USA",-0.1547117033588147,-0.23193263454469606,0.07722093118588136
"Cookeville TN HSA, Nashville TN HRR, USA",-0.43692888400780533,-0.4480646944291441,0.011135810421338765
"Findlay OH HSA, Toledo OH HRR, USA",-0.3914830043982575,-0.41465779150550847,0.02317478710725096
"Seneca SC HSA, Greenville SC HRR, USA",-0.4742824743993219,-0.4811597667136575,0.006877292314335592
"Albany OR HSA, Eugene OR HRR, USA",-0.06699311122447778,-0.13667443584377303,0.06968132461929526
"Sanford NC HSA, Durham NC HRR, USA",-0.16232746854735539,-0.14182542155969616,-0.020502046987659228
