"Auburn WA HSA, Seattle WA HRR, USA",0.15692778050080194,0.1357413112743264,0.021186469226475546
"San Leandro CA HSA, Alameda Co. CA HRR, USA",0.5636762129688848,0.6223609825015448,-0.05868476953266
"Westwood NJ HSA, Hackensack NJ HRR, USA",0.06929346570173044,-0.017451169115197843,0.08674463481692828
"Leonardtown MD HSA, Washington DC HRR, USA",-0.1349822138498162,-0.22029590230254603,0.08531368845272982
"Bountiful UT HSA, Salt Lake City UT HRR, USA",-0.20816679258311788,-0.2066519365367999,-0.001514856046317986
"Rock Island IL HSA, Davenport IA HRR, USA",0.10982674202551636,0.06865174738395076,0.0411749946415656
"Danville IN HSA, Indianapolis IN HRR, USA",-0.3316872764926343,-0.4140829301286055,0.08239565363597118
"Elizabeth City NC HSA, Norfolk VA HRR, USA",-0.17590631342444008,-0.17943056532176915,0.003524251897329078
"Alton IL HSA, St Louis MO HRR, USA",-0.21321582875636114,-0.21377000841548147,0.0005541796591203296
"Exeter NH HSA, Manchester NH HRR, USA",0.07396060731777346,-0.003141190579063279,0.07710179789683674
"Sheboygan WI HSA, Milwaukee WI HRR, USA",-0.1566654125879362,-0.15439562292717698,-0.0022697896607592194
"Houma LA HSA, Houma LA HRR, USA",-0.5239686612602528,-0.5074020168558893,-0.016566644404363506
"Farmington NM HSA, Albuquerque NM HRR, USA",-0.38493627676760767,-0.4330510516603176,0.04811477489270993
"Fairbanks AK HSA, Anchorage AK HRR, USA",-0.16030756348028796,-0.20656399506132994,0.04625643158104198
"Maumee OH HSA, Toledo OH HRR, USA",-0.0933888545048531,-0.13082550575718338,0.03743665125233028
"Hendersonville NC HSA, Asheville NC HRR, USA",-0.19146980093634355,-0.2799004201918338,0.08843061925549026
"New Rochelle NY HSA, Bronx NY HRR, USA",0.4621000722318405,0.42917253393594423,0.032927538295896286
"Fort Thomas KY HSA, Covington KY HRR, USA",-0.2375607011329787,-0.28414313686906933,0.04658243573609064
"Bentonville AR HSA, Springdale AR HRR, USA",-0.21155250329510805,-0.3155880716403743,0.10403556834526623
"Sherman TX HSA, Dallas TX HRR, USA",-0.5355677576838719,-0.5538991284670703,0.018331370783198464
"Lewes DE HSA, Salisbury MD HRR, USA",-0.034892029612036746,-0.15401991036829146,0.11912788075625472
"Lake Saint Louis MO HSA, St Louis MO HRR, USA",-0.3471419263012227,-0.38991562571188987,0.042773699410667165
"Wayne NJ HSA, Paterson NJ HRR, USA",0.05124333124992544,0.031733927342341206,0.01950940390758423
"Harvey IL HSA, Blue Island IL HRR, USA",0.8239332269693465,0.8431447505845879,-0.019211523615241477
"Davis CA HSA, Sacramento CA HRR, USA",0.5387661057891825,0.5396902985469533,-0.0009241927577707809
"Asheboro NC HSA, Greensboro NC HRR, USA",-0.5485814039989009,-0.5452201034364033,-0.0033613005624976156
"Pottstown PA HSA, Reading PA HRR, USA",-0.03250713716729447,-0.09100064873936695,0.05849351157207248
"Ithaca NY HSA, Rochester NY HRR, USA",0.4861164058821671,0.42995893275590125,0.056157473126265844
"Federal Way WA HSA, Seattle WA HRR, USA",0.2796001070332911,0.2559025698229042,0.023697537210386865
"Dallas GA HSA, Atlanta GA HRR, USA",-0.3489989316662123,-0.4598938632537246,0.11089493158751229
"Greenville TX HSA, Dallas TX HRR, USA",-0.5336717453036736,-0.5617598334431857,0.028088088139512135
"Palmer AK HSA, Anchorage AK HRR, USA",-0.4830308924402469,-0.5153880587381886,0.03235716629794172
"Plymouth MA HSA, Boston MA HRR, USA",0.14459727244863452,0.027161076033990653,0.11743619641464387
"Hoffman Estates IL HSA, Elgin IL HRR, USA",0.2581553247982798,0.2649086108414127,-0.006753286043132911
"Maryville IL HSA, St Louis MO HRR, USA",-0.0474166365648178,-0.10784327581732399,0.06042663925250619
"Meriden CT HSA, New Haven CT HRR, USA",0.13114593727377669,0.0851616051820138,0.04598433209176289
"Kennewick WA HSA, Spokane WA HRR, USA",-0.25035715364272254,-0.303206932020883,0.05284977837816046
"Carrollton GA HSA, Atlanta GA HRR, USA",-0.45975217244176364,-0.45710419607239966,-0.00264797636936398
"Trenton MI HSA, Dearborn MI HRR, USA",-0.1161259687874838,-0.147424604582745,0.03129863579526121
"Madera CA HSA, Fresno CA HRR, USA",0.0054009895722604605,-0.00827038074756757,0.01367137031982803
"Goshen NY HSA, Ridgewood NJ HRR, USA",-0.1638905735303806,-0.11062696650705679,-0.05326360702332382
"Katy TX HSA, Houston TX HRR, USA",-0.13660686520282267,-0.24517163681508183,0.10856477161225916
"San Luis Obispo CA HSA, San Luis Obispo CA HRR, USA",0.40599080537387017,0.350334792135345,0.05565601323852515
"Kokomo IN HSA, Indianapolis IN HRR, USA",-0.3721211729044704,-0.37709072982887176,0.004969556924401375
"Mount Pleasant SC HSA, Charleston SC HRR, USA",-0.06528901951908402,-0.1267497925487256,0.06146077302964158
"Folsom CA HSA, Sacramento CA HRR, USA",0.07383622268838187,0.013995642277216846,0.05984058041116502
"Norwalk CA HSA, Los Angeles CA HRR, USA",0.4082844954860855,0.5261207812538702,-0.11783628576778471
"Great Falls MT HSA, Great Falls MT HRR, USA",-0.24337216599534747,-0.26095070109645674,0.017578535101109266
"Caldwell ID HSA, Boise ID HRR, USA",-0.4551653643459324,-0.4507054259175606,-0.004459938428371835
"Columbia TN HSA, Nashville TN HRR, USA",-0.4318291833962855,-0.4313720140317082,-0.0004571693645772923
"Union NJ HSA, Newark NJ HRR, USA",0.27368594277658975,0.2320737695123067,0.04161217326428304
"Liberty MO HSA, Kansas City MO HRR, USA",-0.2298766147467618,-0.2670540332636811,0.0371774185169193
"Carlisle PA HSA, Harrisburg PA HRR, USA",-0.2510259192633454,-0.29640691873221453,0.04538099946886914
"Lancaster SC HSA, Charlotte NC HRR, USA",-0.24162309658256934,-0.2616679925383539,0.020044895955784542
"Blue Springs MO HSA, Kansas City MO HRR, USA",-0.21117438313262027,-0.2950655175017125,0.08389113436909224
"Aiken SC HSA, Augusta GA HRR, USA",-0.1639008798588125,-0.2041942550536173,0.040293375194804804
"Bunnell FL HSA, Ormond Beach FL HRR, USA",-0.19023945413067433,-0.18217285475197548,-0.008066599378698858
"Lumberton NC HSA, Durham NC HRR, USA",-0.17690895046162944,-0.04406340420165022,-0.1328455462599792
"Watertown NY HSA, Syracuse NY HRR, USA",-0.19579840384959807,-0.21460049694905622,0.018802093099458156
"Danville VA HSA, Durham NC HRR, USA",-0.1411190743811075,-0.13522185393934077,-0.005897220441766715
"Palm Springs CA HSA, Palm Spr/Rancho Mir. CA HRR, USA",0.41888860259074473,0.3517105080120196,0.06717809457872514
"Derby CT HSA, New Haven CT HRR, USA",-0.0720581609193024,-0.17400963185874052,0.10195147093943813
"Jeffersonville IN HSA, Louisville KY HRR, USA",-0.13267666053706545,-0.17567467963249256,0.04299801909542711
"Beaver PA HSA, Pittsburgh PA HRR, USA",-0.20840405097114872,-0.21822325019663844,0.009819199225489711
"Council Bluffs IA HSA, Omaha NE HRR, USA",-0.19595038623025565,-0.2378096066921174,0.041859220461861746
"Cheyenne WY HSA, Fort Collins CO HRR, USA",-0.28571094428686095,-0.32760944394494346,0.04189849965808251
"Nacogdoches TX HSA, Houston TX HRR, USA",-0.3959293582133239,-0.41922082191655946,0.023291463703235538
"St Joseph MI HSA, St Joseph MI HRR, USA",-0.031411879440995084,-0.09088077390906918,0.059468894468074095
"Sun City Center FL HSA, Tampa FL HRR, USA",-0.10153826730460115,-0.15706159869534597,0.05552333139074482
"Phoenixville PA HSA, Philadelphia PA HRR, USA",0.1878705457521881,0.08981339552828212,0.09805715022390597
"Roseburg OR HSA, Eugene OR HRR, USA",-0.38179435703236814,-0.3861293171791537,0.0043349601467855825
"Haverhill MA HSA, Boston MA HRR, USA",0.11795637935294384,0.02568372242069892,0.09227265693224493
"Tualatin OR HSA, Portland OR HRR, USA",0.12655785212740245,0.05698638149349711,0.06957147063390534
"Pasco WA HSA, Spokane WA HRR, USA",-0.1606186783062052,-0.20080592625490928,0.0401872479487041
"Fond Du Lac WI HSA, Milwaukee WI HRR, USA",-0.2841434020513833,-0.28118799506399195,-0.002955406987391329
"Manchester CT HSA, Hartford CT HRR, USA",0.29464100249029623,0.1907520557880455,0.10388894670225074
"Waconia MN HSA, Minneapolis MN HRR, USA",-0.21655236779730075,-0.2817745814943833,0.06522221369708253
"North Tarrytown NY HSA, White Plains NY HRR, USA",0.47723244940342296,0.43507823867514456,0.04215421072827841
"South Laguna CA HSA, Orange Co. CA HRR, USA",0.08154339973063886,0.025263829711949678,0.056279570018689176
"Pocatello ID HSA, Salt Lake City UT HRR, USA",-0.24440370150567728,-0.22830071195808532,-0.016102989547591956
"Bridgeton NJ HSA, Camden NJ HRR, USA",-0.01328789629623172,-0.02317114434625935,0.009883248050027629
"Florence AL HSA, Birmingham AL HRR, USA",-0.4613231495191362,-0.46729018661125743,0.005967037092121208
"Wilson NC HSA, Raleigh NC HRR, USA",-0.0663208968768595,-0.0364667251731445,-0.02985417170371501
"Grants Pass OR HSA, Medford OR HRR, USA",-0.26851026868090916,-0.3121635900629995,0.043653321382090327
"Ashland KY HSA, Huntington WV HRR, USA",-0.4046242338501646,-0.42077170806511965,0.01614747421495505
"Los Alamitos CA HSA, Orange Co. CA HRR, USA",0.05485567632684967,0.024806366718599284,0.030049309608250387
"Jacksonville AR HSA, Little Rock AR HRR, USA",-0.373591736867099,-0.3911078549927577,0.017516118125658675
"Pawtucket RI HSA, Providence RI HRR, USA",0.42661486288282735,0.4450399649149454,-0.018425102032118057
"Greenwood SC HSA, Columbia SC HRR, USA",-0.2324879973174491,-0.21203756542542745,-0.020450431892021642
"Searcy AR HSA, Little Rock AR HRR, USA",-0.587706652103461,-0.5456490778614546,-0.0420575742420064
"Gadsden AL HSA, Birmingham AL HRR, USA",-0.47603027305664153,-0.4684770750429923,-0.007553198013649232
"Templeton CA HSA, San Luis Obispo CA HRR, USA",-0.08313012557430186,-0.13950313675416717,0.05637301117986532
"Oshkosh WI HSA, Neenah WI HRR, USA",-0.04476862703257731,-0.07049652267008083,0.025727895637503523
"Napa CA HSA, Napa CA HRR, USA",0.38868187109622243,0.3301105565582005,0.058571314538021946
"Prince Frederick MD HSA, Washington DC HRR, USA",-0.05955907513728881,-0.16976968362016853,0.11021060848287972
"Apple Valley CA HSA, San Bernardino CA HRR, USA",-0.2817873140030192,-0.3365414979215896,0.0547541839185704
"Easton MD HSA, Baltimore MD HRR, USA",-0.16539082226920704,-0.24165030623801864,0.0762594839688116
"Fort Pierce FL HSA, Orlando FL HRR, USA",0.018004215291498142,0.03065412270552941,-0.01264990741403127
"Midwest City OK HSA, Oklahoma City OK HRR, USA",-0.20168929443688827,-0.2924538502826463,0.09076455584575804
"Ames IA HSA, Des Moines IA HRR, USA",0.1638675460909248,0.1128616263719543,0.051005919718970505
"Manahawkin NJ HSA, Camden NJ HRR, USA",-0.24235820756149784,-0.3217459389227242,0.07938773136122634
"Watsonville CA HSA, Santa Cruz CA HRR, USA",0.5361476286053183,0.54219019339303,-0.006042564787711702
"Hawthorne CA HSA, Los Angeles CA HRR, USA",0.5634603330880574,0.6516385921451497,-0.08817825905709231
"Texarkana TX HSA, Texarkana AR HRR, USA",-0.4283393576428235,-0.4624243803178555,0.034085022675031995
"Yuba City CA HSA, Sacramento CA HRR, USA",-0.1478492287087881,-0.1366148811960273,-0.011234347512760812
"Monroeville PA HSA, Pittsburgh PA HRR, USA",-0.029755305908892818,-0.091384095542698,0.06162878963380518
"Taylor TX HSA, Temple TX HRR, USA",-0.0585507509447509,-0.17986255606478116,0.12131180512003026
"Beckley WV HSA, Charleston WV HRR, USA",-0.5318608871475775,-0.5479892000061227,0.016128312858545213
"Dover NH HSA, Portland ME HRR, USA",0.2507246315712771,0.17488705227405732,0.07583757929721979
"Anniston AL HSA, Birmingham AL HRR, USA",-0.40014616788155527,-0.4102733411928932,0.010127173311337945
"Grand Forks ND HSA, Grand Forks ND HRR, USA",-0.17388692678000897,-0.21466667129926617,0.0407797445192572
"Menomonee Falls WI HSA, Milwaukee WI HRR, USA",-0.23040945118369377,-0.2973043955217878,0.06689494433809401
"Monroe MI HSA, Toledo OH HRR, USA",-0.20918559179400634,-0.2099113096879495,0.0007257178939431563
"Pittsfield MA HSA, Albany NY HRR, USA",0.4166432786627095,0.34798689448156217,0.06865638418114733
"Texas City TX HSA, Houston TX HRR, USA",-0.11304200463817674,-0.09135888187076101,-0.021683122767415727
"Columbus IN HSA, Indianapolis IN HRR, USA",-0.30457605092003376,-0.3561193641373087,0.051543313217274955
"Minot ND HSA, Minot ND HRR, USA",-0.4356088960784146,-0.44090110724580844,0.005292211167393868
"Mooresville NC HSA, Charlotte NC HRR, USA",-0.3070457070257013,-0.38438897765527685,0.07734327062957558
"Weatherford TX HSA, Fort Worth TX HRR, USA",-0.6421124754206358,-0.6743702985556391,0.03225782313500336
"Port Chester NY HSA, White Plains NY HRR, USA",0.3028399216376587,0.25908581673490877,0.043754104902749946
"Jupiter FL HSA, Fort Lauderdale FL HRR, USA",-0.1920534231172014,-0.20036531071089442,0.00831188759369303
"Loma Linda CA HSA, San Bernardino CA HRR, USA",0.24037357566720832,0.2694107238182909,-0.029037148151082576
"Saratoga Springs NY HSA, Albany NY HRR, USA",0.09960595025455489,0.01877040581709939,0.0808355444374555
"Darby PA HSA, Philadelphia PA HRR, USA",0.7668995713230515,0.7694356621043065,-0.0025360907812549405
"Gulf Breeze FL HSA, Pensacola FL HRR, USA",-0.39475265310616725,-0.46742749332560485,0.0726748402194376
"Mankato MN HSA, Minneapolis MN HRR, USA",0.009033405811425184,-0.06635414447048796,0.07538755028191314
"Safety Harbor FL HSA, Clearwater FL HRR, USA",-0.0863953535011304,-0.11715104310385584,0.03075568960272544
"Kenmore NY HSA, Buffalo NY HRR, USA",0.10795540810516668,-0.0190545167714378,0.12700992487660448
"St Cloud FL HSA, Orlando FL HRR, USA",-0.16146398068717888,-0.16883226975731738,0.007368289070138506
"Venice FL HSA, Sarasota FL HRR, USA",-0.17737214681520092,-0.20318178309751725,0.025809636282316334
"Cullman AL HSA, Birmingham AL HRR, USA",-0.7782937287681542,-0.7710758724632729,-0.007217856304881254
"Livermore CA HSA, Alameda Co. CA HRR, USA",0.258177998007659,0.2071244353055083,0.051053562702150695
"Delray Beach FL HSA, Fort Lauderdale FL HRR, USA",0.2048354618606475,0.23121631264464934,-0.026380850784001847
"Havre De Grace MD HSA, Baltimore MD HRR, USA",-0.10470259651604567,-0.19675291183964314,0.09205031532359746
"Lexington NC HSA, Winston-Salem NC HRR, USA",-0.4776788834310331,-0.48040789581373844,0.0027290123827053425
"Poplar Bluff MO HSA, St Louis MO HRR, USA",-0.650036287421374,-0.6206995919439737,-0.029336695477400254
"Porterville CA HSA, Bakersfield CA HRR, USA",-0.0812110861852651,-0.0775367572598309,-0.003674328925434192
"Crystal River FL HSA, Ocala FL HRR, USA",-0.4159249581869235,-0.4052955364785674,-0.010629421708356068
"Shelby NC HSA, Charlotte NC HRR, USA",-0.3626906204248323,-0.3325100803202852,-0.030180540104547127
"Milford DE HSA, Salisbury MD HRR, USA",-0.16577146194642653,-0.25554970826358786,0.08977824631716133
"Rogers AR HSA, Springdale AR HRR, USA",-0.22378430670960514,-0.2834794077102632,0.05969510100065806
"Newton MA HSA, Boston MA HRR, USA",0.6292820727984684,0.5782208871440763,0.051061185654392105
"Benton AR HSA, Little Rock AR HRR, USA",-0.46084508139876157,-0.46516027850967756,0.0043151971109159915
"San Marcos TX HSA, Austin TX HRR, USA",0.2753978232218926,0.1665017023735464,0.10889612084834621
"Downers Grove IL HSA, Hinsdale IL HRR, USA",0.22397039159537913,0.17728642851125623,0.0466839630841229
"Blacksburg VA HSA, Roanoke VA HRR, USA",0.12519486129144541,0.06868224149927914,0.05651261979216628
"Sewickley PA HSA, Pittsburgh PA HRR, USA",-0.016372743309058645,-0.07849535953429178,0.06212261622523313
"West Allis WI HSA, Milwaukee WI HRR, USA",0.008769192036925303,-0.05811342497157158,0.06688261700849688
"Ridley Park PA HSA, Philadelphia PA HRR, USA",0.16482867614314894,0.12753602576607506,0.03729265037707388
"Portsmouth OH HSA, Columbus OH HRR, USA",-0.4564252812936671,-0.4065760639835327,-0.04984921731013442
"Conyers GA HSA, Atlanta GA HRR, USA",0.42083835960266436,0.2751357520973473,0.14570260750531705
"Newburgh NY HSA, White Plains NY HRR, USA",0.1050467711210322,0.023796597153408126,0.08125017396762407
"Willingboro NJ HSA, Camden NJ HRR, USA",0.4871107842094927,0.45973220454764446,0.027378579661848257
"Wylie TX HSA, Dallas TX HRR, USA",-0.17599971168311235,-0.29390611922813137,0.11790640754501902
"Griffin GA HSA, Atlanta GA HRR, USA",-0.35674086577587016,-0.3750094401161148,0.018268574340244648
"San Pedro CA HSA, Los Angeles CA HRR, USA",0.3084257058985036,0.3224622090312601,-0.014036503132756506
"Glenwood Springs CO HSA, Grand Junction CO HRR, USA",0.15371364196683202,0.0595462689191616,0.09416737304767042
"Lapeer MI HSA, Flint MI HRR, USA",-0.37087905138914024,-0.3894231816842951,0.018544130295154893
"Orangeburg SC HSA, Columbia SC HRR, USA",0.2550540510556585,0.2971075973371051,-0.04205354628144664
"Quincy IL HSA, Springfield IL HRR, USA",-0.49973326400251605,-0.49960687926161224,-0.00012638474090381768
"Willimantic CT HSA, Hartford CT HRR, USA",0.18196988804399203,0.18405537786988116,-0.002085489825889131
"Hanover PA HSA, York PA HRR, USA",-0.3694017814407973,-0.41824850684168374,0.048846725400886415
"Tulare CA HSA, Bakersfield CA HRR, USA",-0.1338590066689067,-0.13093630500054237,-0.002922701668364336
"Camarillo CA HSA, Ventura CA HRR, USA",0.07994986777247848,0.02024334127047404,0.059706526502004434
"Elmira NY HSA, Elmira NY HRR, USA",-0.1565005005819531,-0.1964883036927076,0.03998780311075448
"Smyrna GA HSA, Atlanta GA HRR, USA",0.36589998259152956,0.2614162099341357,0.10448377265739384
"Plattsburgh NY HSA, Burlington VT HRR, USA",0.05735207230486697,0.017531195437774313,0.03982087686709265
"Rahway NJ HSA, Newark NJ HRR, USA",0.23424515822989522,0.227224069270651,0.0070210889592442205
"Richland WA HSA, Spokane WA HRR, USA",-0.1700860551349848,-0.218335389344077,0.04824933420909222
"Pittsburg CA HSA, Contra Costa Co. CA HRR, USA",0.5593288261709276,0.6010728974149062,-0.04174407124397861
"Janesville WI HSA, Madison WI HRR, USA",0.12393210881114843,0.10048916203583315,0.023442946775315276
"Phenix City AL HSA, Columbus GA HRR, USA",-0.14689157544912146,-0.17266470802436124,0.025773132575239777
"New Albany IN HSA, Louisville KY HRR, USA",-0.17750784289631344,-0.22607123286153608,0.048563389965222636
"Marshfield WI HSA, Marshfield WI HRR, USA",-0.31923330016819673,-0.2981876747820679,-0.021045625386128808
"Corvallis OR HSA, Eugene OR HRR, USA",0.42336031251978545,0.3528698160862207,0.07049049643356475
"Coatesville PA HSA, Lancaster PA HRR, USA",0.09229493579623155,0.04545651392313084,0.04683842187310071
"Oak Ridge TN HSA, Knoxville TN HRR, USA",-0.3438932040138035,-0.35235543030958477,0.00846222629578125
"Lancaster OH HSA, Columbus OH HRR, USA",-0.4009055993285036,-0.3838870857995435,-0.01701851352896011
"Wheeling WV HSA, Pittsburgh PA HRR, USA",-0.3625405804956576,-0.37993736873946343,0.017396788243805805
"Greer SC HSA, Greenville SC HRR, USA",-0.32939511654784276,-0.3809397871403987,0.05154467059255596
"Grand Prairie TX HSA, Dallas TX HRR, USA",0.24453548695702412,0.18362131191288544,0.06091417504413868
"Williamsport PA HSA, Danville PA HRR, USA",-0.36575076062100625,-0.4055091964365895,0.03975843581558325
"Mason City IA HSA, Mason City IA HRR, USA",-0.1999800300754981,-0.1890433180383748,-0.01093671203712332
"Natrona Heights PA HSA, Pittsburgh PA HRR, USA",-0.32750596047293096,-0.334667293098057,0.007161332625126027
"Smithfield NC HSA, Raleigh NC HRR, USA",-0.36843687286627536,-0.3704493267816958,0.0020124539154204313
"Melrose MA HSA, Boston MA HRR, USA",0.26088927054650946,0.15401902713617438,0.10687024341033508
"Fort Walton Beach FL HSA, Pensacola FL HRR, USA",-0.2952700596842827,-0.38492181969491973,0.08965176001063702
"Hazleton PA HSA, Allentown PA HRR, USA",-0.3387385918353825,-0.3671694658230826,0.028430873987700056
"Hammond IN HSA, Munster IN HRR, USA",0.603807291772953,0.6263660864870108,-0.02255879471405775
"Falmouth MA HSA, Boston MA HRR, USA",0.20258314777092987,0.09729371782129913,0.10528942994963074
"San Clemente CA HSA, Orange Co. CA HRR, USA",-0.08387347106183284,-0.12487801730434314,0.041004546242510306
"Grass Valley CA HSA, Sacramento CA HRR, USA",0.08074333068701323,-0.008014869727316533,0.08875820041432976
"Easley SC HSA, Greenville SC HRR, USA",-0.5177426012984103,-0.5418192099249044,0.024076608626494078
"Banning CA HSA, San Bernardino CA HRR, USA",-0.027242246237050908,-0.08135581014501957,0.05411356390796866
"Carmel NY HSA, New Haven CT HRR, USA",-0.12805979368054737,-0.20725768842376643,0.07919789474321906
"Lees Summit MO HSA, Kansas City MO HRR, USA",-0.052929750110418936,-0.14851409523670348,0.09558434512628454
"Casper WY HSA, Casper WY HRR, USA",-0.48902301956166494,-0.5210558411075608,0.03203282154589582
"Morristown TN HSA, Knoxville TN HRR, USA",-0.5830758483632823,-0.5954899656208548,0.012414117257572466
"Statesboro GA HSA, Savannah GA HRR, USA",-0.2390649183672153,-0.2310167599681684,-0.008048158399046906
"Springfield OR HSA, Eugene OR HRR, USA",0.0859188112926196,0.0224355725342187,0.06348323875840091
"Chillicothe OH HSA, Columbus OH HRR, USA",-0.3707208988291652,-0.2943773279483135,-0.0763435708808517
"Kalispell MT HSA, Missoula MT HRR, USA",-0.3938796261983512,-0.44084132827812383,0.04696170207977263
"Somerset KY HSA, Lexington KY HRR, USA",-0.6525995493494703,-0.6827861727358491,0.030186623386378786
"Winder GA HSA, Atlanta GA HRR, USA",-0.424429715540528,-0.5216492071264597,0.09721949158593168
"Cottonwood AZ HSA, Phoenix AZ HRR, USA",-0.14852741901680788,-0.1602826153458252,0.011755196329017309
"Woodland CA HSA, Sacramento CA HRR, USA",0.1940308727419952,0.17700249064308163,0.01702838209891358
"Petaluma CA HSA, Santa Rosa CA HRR, USA",0.4962482393461897,0.4696738102653669,0.026574429080822803
"Newton NJ HSA, Morristown NJ HRR, USA",-0.18944937221719663,-0.29478840985428345,0.10533903763708682
"Huntsville TX HSA, Houston TX HRR, USA",-0.34609211515103927,-0.36116700124577444,0.015074886094735174
"Wooster OH HSA, Canton OH HRR, USA",-0.34716141832942415,-0.3225778507951372,-0.024583567534286976
"Marysville CA HSA, Sacramento CA HRR, USA",-0.22474059260427845,-0.23833501249724848,0.013594419892970028
"Methuen MA HSA, Boston MA HRR, USA",0.017338796193912324,-0.04979186211024211,0.06713065830415443
"Delano CA HSA, Bakersfield CA HRR, USA",0.38279363807220373,0.5316858925154909,-0.1488922544432872
"Oregon OH HSA, Toledo OH HRR, USA",-0.08129069312114388,-0.015955822746559156,-0.06533487037458473
"Laurel MS HSA, Hattiesburg MS HRR, USA",-0.3215587378602923,-0.3242168873619795,0.0026581495016871903
"Midland MI HSA, Saginaw MI HRR, USA",-0.142841624925335,-0.1924480144179856,0.04960638949265059
"Cartersville GA HSA, Atlanta GA HRR, USA",-0.4745181015138943,-0.5199783028067332,0.0454602012928389
"Howell MI HSA, Ann Arbor MI HRR, USA",-0.2866407255509446,-0.3520251269732194,0.06538440142227481
"Oxford MS HSA, Oxford MS HRR, USA",-0.17202618532836156,-0.18306927631214143,0.011043090983779869
"Somerville MA HSA, Boston MA HRR, USA",0.7775260059658825,0.7342465292547935,0.043279476711089004
"Manhattan KS HSA, Topeka KS HRR, USA",-0.01524056891006693,-0.08792914222675094,0.072688573316684
"Enid OK HSA, Oklahoma City OK HRR, USA",-0.5915013603520829,-0.5862615701878802,-0.005239790164202729
"Jeannette PA HSA, Pittsburgh PA HRR, USA",-0.299423887132998,-0.3402498817344962,0.04082599460149822
"Long Branch NJ HSA, Camden NJ HRR, USA",0.02457766487814876,-0.012574374827280872,0.03715203970542963
"Danville IL HSA, Urbana IL HRR, USA",-0.35973462151144625,-0.3282639867569851,-0.03147063475446116
"Paris TX HSA, Dallas TX HRR, USA",-0.6110903380898954,-0.6062813780413947,-0.004808960048500732
"Arlington MA HSA, Boston MA HRR, USA",0.6635336224724939,0.5901344980447086,0.07339912442778529
"Kinston NC HSA, Greenville NC HRR, USA",-0.08623021947504406,-0.07980998118325763,-0.006420238291786423
"Oak Park IL HSA, Melrose Park IL HRR, USA",0.7432869701465653,0.6938781154397394,0.04940885470682588
"Muskogee OK HSA, Tulsa OK HRR, USA",-0.37822062265584466,-0.3267225861051783,-0.05149803655066637
"Kearny NJ HSA, Newark NJ HRR, USA",0.18990522956089684,0.23230111308456763,-0.042395883523670796
"Suffolk VA HSA, Norfolk VA HRR, USA",0.04882810289813217,0.031155047919264975,0.017673054978867196
"Beaufort SC HSA, Savannah GA HRR, USA",0.033511709981235864,-0.006371304676068225,0.03988301465730409
"Medina OH HSA, Cleveland OH HRR, USA",-0.24599388310149523,-0.26702940045169965,0.021035517350204425
"Fort Oglethorpe GA HSA, Chattanooga TN HRR, USA",-0.585302303972679,-0.6109239769500254,0.02562167297734641
"Quincy MA HSA, Boston MA HRR, USA",0.36259274488576937,0.3056974523870472,0.05689529249872216
"Washington PA HSA, Pittsburgh PA HRR, USA",-0.27387487865829124,-0.2727663867937203,-0.0011084918645709596
"Athens AL HSA, Huntsville AL HRR, USA",-0.47124566597411083,-0.5179892223881427,0.046743556414031884
"Richmond IN HSA, Indianapolis IN HRR, USA",-0.3435417256716244,-0.3443539415281532,0.0008122158565287974
"Pine Bluff AR HSA, Little Rock AR HRR, USA",0.10152501041903314,0.15997574042714796,-0.05845073000811482
"La Grange GA HSA, Atlanta GA HRR, USA",-0.23643971431641145,-0.24094049187954325,0.0045007775631318025
"Ormond Beach FL HSA, Ormond Beach FL HRR, USA",-0.21400480430283755,-0.22878817893746115,0.014783374634623592
"De Kalb IL HSA, Rockford IL HRR, USA",0.1345773730361271,0.10201764946053692,0.032559723575590185
"Pinole CA HSA, San Francisco CA HRR, USA",0.5707349000153777,0.591624201916993,-0.02088930190161531
"Avon Park FL HSA, Orlando FL HRR, USA",-0.37668980462336255,-0.339452714830047,-0.037237089793315525
"Bristol CT HSA, Hartford CT HRR, USA",0.013523964398787449,-0.058131309768358376,0.07165527416714583
"Hampton VA HSA, Newport News VA HRR, USA",0.38661799977620226,0.3362022246423184,0.050415775133883844
"Warrenton VA HSA, Arlington VA HRR, USA",-0.15471170335881307,-0.23193263454469676,0.07722093118588369
"Cookeville TN HSA, Nashville TN HRR, USA",-0.4369288840078047,-0.4480646944291423,0.0111358104213376
"Findlay OH HSA, Toledo OH HRR, USA",-0.39148300439825423,-0.41465779150550836,0.023174787107254124
"Seneca SC HSA, Greenville SC HRR, USA",-0.47428247439932175,-0.4811597667136599,0.006877292314338146
"Albany OR HSA, Eugene OR HRR, USA",-0.06699311122447822,-0.13667443584377248,0.06968132461929426
