longname,Within 10km of Hospital %,Mean distance to nearest Hospital
"New York NY Media Market, USA",0.9453797741371313,1.0
"Los Angeles CA Media Market, USA",0.9625831252709018,1.0
"Chicago IL Media Market, USA",0.9257276082447934,1.0
"Philadelphia PA Media Market, USA",0.9190861416439496,1.0
"Dallas-Ft.Worth TX Media Market, USA",0.8635879968330059,1.0
"San Francisco-Oakland-San Jose CA Media Market, USA",0.9635525145032577,1.0
"Houston TX Media Market, USA",0.8771440445928689,1.0
"Atlanta GA Media Market, USA",0.7546496369908634,1.0
"Washington DC (Hagerstown MD) Media Market, USA",0.853770608243074,1.0
"Boston MA (Manchester NH) Media Market, USA",0.895069952535059,1.0
"Phoenix (Prescott) AZ Media Market, USA",0.8606015864566057,1.0
"Seattle-Tacoma WA Media Market, USA",0.8200859415451315,1.0
"Tampa-St.Petersburg (Sarasota) FL Media Market, USA",0.8885369867320518,1.0
"Detroit MI Media Market, USA",0.8579347271316788,1.0
"Minneapolis-St. Paul MN Media Market, USA",0.7316595189077377,1.0
"Miami-Ft. Lauderdale FL Media Market, USA",0.9921933533720712,1.0
"Denver CO Media Market, USA",0.8549410928788531,1.0
"Sacramento-Stockton-Modesto CA Media Market, USA",0.847612160929584,1.0
"Orlando-Daytona Beach-Melbourne FL Media Market, USA",0.8663574272580491,1.0
"Cleveland-Akron (Canton) OH Media Market, USA",0.8213066423606445,1.0
"Portland OR Media Market, USA",0.8291108537202097,1.0
"Salt Lake City UT Media Market, USA",0.8440487468842005,1.0
"Charlotte NC Media Market, USA",0.7255097964965511,1.0
"Raleigh-Durham (Fayetteville) NC Media Market, USA",0.6169500615457346,1.0
"San Diego CA Media Market, USA",0.9472477286786914,1.0
"St. Louis MO Media Market, USA",0.8081299284290434,1.0
"Indianapolis IN Media Market, USA",0.8381310067366111,1.0
"Nashville TN Media Market, USA",0.7010711643908764,1.0
"Baltimore MD Media Market, USA",0.8318137476167476,1.0
"San Antonio TX Media Market, USA",0.8354909960025153,1.0
"Pittsburgh PA Media Market, USA",0.8214453362012288,1.0
"Hartford & New Haven CT Media Market, USA",0.7765701176228939,1.0
"Columbus OH Media Market, USA",0.8148445103617841,1.0
"Kansas City MO Media Market, USA",0.858868847569469,1.0
"Cincinnati OH Media Market, USA",0.8048646778025345,1.0
"Austin TX Media Market, USA",0.7946805791831593,1.0
"Greenville-Spartanburg SC-Asheville NC-Anderson SC Media Market, USA",0.6711323692729776,1.0
"Milwaukee WI Media Market, USA",0.8637136031741353,1.0
"Las Vegas NV Media Market, USA",0.98320648566411,1.0
"West Palm Beach-Fort Pierce FL Media Market, USA",0.9426176657258246,1.0
"Grand Rapids-Kalamazoo-Battle Creek MI Media Market, USA",0.6463644851403266,1.0
"Fresno-Visalia CA Media Market, USA",0.7499563154460445,1.0
"Harrisburg-Lancaster-Lebanon-York PA Media Market, USA",0.7049279298219896,1.0
"Jacksonville FL Media Market, USA",0.7676279899416567,1.0
"Norfolk-Portsmouth-Newport News VA Media Market, USA",0.8595535798292463,1.0
"Oklahoma City OK Media Market, USA",0.7952080739556091,1.0
"Birmingham (Anniston & Tuscaloosa) AL Media Market, USA",0.621565055380462,1.0
"Albuquerque-Santa Fe NM Media Market, USA",0.7094522362266033,1.0
"Greensboro-High Point-Winston Salem NC Media Market, USA",0.6887746996866295,1.0
"Louisville KY Media Market, USA",0.7032943330462974,1.0
"Memphis TN Media Market, USA",0.772648579827746,1.0
"New Orleans LA Media Market, USA",0.9032144040398415,1.0
"ProvidenceRi-New Bedford MA Media Market, USA",0.9241802789747701,1.0
"Richmond-Petersburg VA Media Market, USA",0.6710082348520598,1.0
"Buffalo NY Media Market, USA",0.7869604862256196,1.0
"Mobile AL-Pensacola (Ft. Walton Beach) FL Media Market, USA",0.7087599236403902,1.0
"Wilkes Barre-Scranton PA Media Market, USA",0.6798543423683957,1.0
"Little Rock-Pine Bluff AR Media Market, USA",0.6471353643581763,1.0
"Honolulu HI Media Market, USA",0.7782334732063012,1.0
"Tulsa OK Media Market, USA",0.7458879272697846,1.0
"Knoxville TN Media Market, USA",0.6562323721083171,1.0
"Albany-Schenectady-Troy NY Media Market, USA",0.6752695644774119,1.0
"Ft. Myers-Naples FL Media Market, USA",0.7787706537094818,1.0
"Harlingen-Weslaco-Brownsville-Mcallen TX Media Market, USA",0.7548189732442564,1.0
"Lexington KY Media Market, USA",0.688132537577298,1.0
"Spokane WA Media Market, USA",0.7339549140044211,1.0
"Dayton OH Media Market, USA",0.7360019366247749,1.0
"Tucson (Sierra Vista) AZ Media Market, USA",0.7954541905011635,1.0
"Wichita-Hutchinson KS Media Market, USA",0.7724258904545968,1.0
"Des Moines-Ames IA Media Market, USA",0.6758040629046687,1.0
"Omaha NE Media Market, USA",0.853081211135397,1.0
"Green Bay-Appleton WI Media Market, USA",0.6833770594575098,1.0
"Roanoke-Lynchburg VA Media Market, USA",0.6005224624780523,1.0
"Flint-Saginaw-Bay City MI Media Market, USA",0.599880394962413,1.0
"Waco-Temple-Bryan TX Media Market, USA",0.7771933373185651,1.0
"Columbia SC Media Market, USA",0.6107771692391255,1.0
"Springfield MO Media Market, USA",0.525015168815998,1.0
"Charleston-Huntington WV Media Market, USA",0.541697221580291,1.0
"El Paso TX (Las Cruces NM) Media Market, USA",0.8023223615321278,1.0
"Rochester NY Media Market, USA",0.6483242901108578,1.0
"Huntsville-Decatur (Florence) AL Media Market, USA",0.603642197889444,1.0
"Toledo OH Media Market, USA",0.790019997376465,1.0
"Madison WI Media Market, USA",0.719947265429388,1.0
"Colorado Springs-Pueblo CO Media Market, USA",0.7928638537628,1.0
"Portland-Auburn ME Media Market, USA",0.613278856768904,1.0
"Syracuse NY Media Market, USA",0.5860296778863554,1.0
"Chattanooga TN Media Market, USA",0.6855129362884251,1.0
"Savannah GA Media Market, USA",0.632953931748474,1.0
"Shreveport LA Media Market, USA",0.6350469784653906,1.0
"Paducah KY-Cape Girardeau MO-Harrisburg IL Media Market, USA",0.5710818180770588,1.0
"Baton Rouge LA Media Market, USA",0.8133248059561322,1.0
"Champaign & Springfield-Decatur IL Media Market, USA",0.6678104034898728,1.0
"Charleston SC Media Market, USA",0.7697292370382285,1.0
"Cedar Rapids-Waterloo-Iowa City & Dubuque IA Media Market, USA",0.6878635848663643,1.0
"South Bend-Elkhart IN Media Market, USA",0.7603729624243437,1.0
"Jackson MS Media Market, USA",0.6796306556275076,1.0
"Ft. Smith-Fayetteville-Springdale-Rogers AR Media Market, USA",0.6943921060856365,1.0
"Boise ID Media Market, USA",0.8487340597214488,1.0
"Burlington VT-Plattsburgh NY Media Market, USA",0.5107588547021883,1.0
"Bakersfield CA Media Market, USA",0.8194764258532129,1.0
"Reno NV Media Market, USA",0.7963631618962546,1.0
"Greenville-New Bern-Washington NC Media Market, USA",0.5296049474997349,1.0
"Tri-Cities TN-VA Media Market, USA",0.6402818010875642,1.0
"Myrtle Beach-Florence SC Media Market, USA",0.62648532897675,1.0
"Monterey-Salinas CA Media Market, USA",0.7661594993100526,1.0
"Davenport IA-Rock Island-Moline IL Media Market, USA",0.7351825708426205,1.0
"Tallahassee FL-Thomasville GA Media Market, USA",0.6384700576342752,1.0
"Tyler-Longview (Lufkin & Nacogdoches) TX Media Market, USA",0.6535675978021255,1.0
"Yakima-Pasco-Richland-Kennewick WA Media Market, USA",0.802045206785231,1.0
"Lincoln & Hastings-Kearney NE Media Market, USA",0.7733803919252182,1.0
"Ft. Wayne IN Media Market, USA",0.7448617373190377,1.0
"Johnstown-Altoona PA Media Market, USA",0.639060954029024,1.0
"Evansville IN Media Market, USA",0.6375109085094505,1.0
"Santa Barbara-Santa Maria-San Luis Obispo CA Media Market, USA",0.8253964995264451,1.0
"Augusta GA Media Market, USA",0.6521440263213137,1.0
"Sioux Falls (Mitchell) SD Media Market, USA",0.6967770545898258,1.0
"Springfield-Holyoke MA Media Market, USA",0.8417577042230556,1.0
"Lansing MI Media Market, USA",0.6465515718567282,1.0
"Macon GA Media Market, USA",0.6986663462693741,1.0
"Fargo-Valley City ND Media Market, USA",0.6808079237384386,1.0
"Eugene OR Media Market, USA",0.7770859030264681,1.0
"Youngstown OH Media Market, USA",0.7860057221047394,1.0
"Montgomery (Selma) AL Media Market, USA",0.7153515010503113,1.0
"Peoria-Bloomington IL Media Market, USA",0.6659696153582754,1.0
"Lafayette LA Media Market, USA",0.8090992511878041,1.0
"Traverse City-Cadillac MI Media Market, USA",0.37117290149395366,1.0
"Columbus GA Media Market, USA",0.7206326557995084,1.0
"Corpus Christi TX Media Market, USA",0.7256508528357706,1.0
"La Crosse-Eau Claire WI Media Market, USA",0.5965605754835931,1.0
"Amarillo TX Media Market, USA",0.7189918390642176,1.0
"Chico-Redding CA Media Market, USA",0.6869493225803309,1.0
"Wilmington NC Media Market, USA",0.5907931954902195,1.0
"Columbus-Tupelo-West Point MS Media Market, USA",0.5493023198430682,1.0
"Columbia-Jefferson City MO Media Market, USA",0.5874526601286653,1.0
"Odessa-Midland TX Media Market, USA",0.8237826618793488,1.0
"Rockford IL Media Market, USA",0.7203133622094721,1.0
"Lubbock TX Media Market, USA",0.7933591893870318,1.0
"Monroe LA-El Dorado AR Media Market, USA",0.7211016424987974,1.0
"Topeka KS Media Market, USA",0.758348528094738,1.0
"Beaumont-Port Arthur TX Media Market, USA",0.7076011760636458,1.0
"Anchorage AK Media Market, USA",0.6892704557436652,1.0
"Medford-Klamath Falls OR Media Market, USA",0.6876703385300278,1.0
"Wausau-Rhinelander WI Media Market, USA",0.6291259789760433,1.0
"Salisbury MD Media Market, USA",0.5401716163989003,1.0
"Palm Springs CA Media Market, USA",0.8236663920848005,1.0
"Minot-Bismarck-Dickinson ND Media Market, USA",0.6984954597128461,1.0
"Duluth MN-Superior WI Media Market, USA",0.6180828993606842,1.0
"Idaho Falls-Pocatello ID Media Market, USA",0.7235684047006368,1.0
"Sioux City IA Media Market, USA",0.6728256165127129,1.0
"Wichita Falls TX & Lawton OK Media Market, USA",0.7314222648474888,1.0
"Albany GA Media Market, USA",0.6476368089282354,1.0
"Joplin MO-Pittsburg KS Media Market, USA",0.6422751810269712,1.0
"Erie PA Media Market, USA",0.6511447606894746,1.0
"Panama City FL Media Market, USA",0.5150135160041777,1.0
"Yuma AZ-El Centro CA Media Market, USA",0.5334412630382472,1.0
"Rochester MN-Mason CityIa-Austin MN Media Market, USA",0.6200573036022015,1.0
"Biloxi-Gulfport MS Media Market, USA",0.7451662047616733,1.0
"Terre Haute IN Media Market, USA",0.5989757262257891,1.0
"Gainesville FL Media Market, USA",0.6680817468701535,1.0
"Sherman TX-Ada OK Media Market, USA",0.6083867833126817,1.0
"Bangor ME Media Market, USA",0.415837426439924,1.0
"Binghamton NY Media Market, USA",0.6078023775637353,1.0
"Wheeling WV-Steubenville OH Media Market, USA",0.6544617224135462,1.0
"Missoula MT Media Market, USA",0.6415610812035327,1.0
"Abilene-Sweetwater TX Media Market, USA",0.7173709068507432,1.0
"Bluefield-Beckley-Oak Hill WV Media Market, USA",0.586382065118419,1.0
"Hattiesburg-Laurel MS Media Market, USA",0.5716813746400767,1.0
"Billings MT Media Market, USA",0.7293118444614991,1.0
"Lake Charles LA Media Market, USA",0.7249142443202398,1.0
"Laredo TX Media Market, USA",0.8515282754988381,1.0
"Harrisonburg VA Media Market, USA",0.6018005877178205,1.0
"Utica NY Media Market, USA",0.6375531456612538,1.0
"Rapid City SD Media Market, USA",0.6458846657434694,1.0
"Dothan AL Media Market, USA",0.6243859861251757,1.0
"Clarksburg-Weston WV Media Market, USA",0.645666344622693,1.0
"QuincyIl-Hannibal MO-Keokuk IA Media Market, USA",0.5389018568261528,1.0
"Watertown NY Media Market, USA",0.4686749045729515,1.0
"Jackson TN Media Market, USA",0.6610974506019078,1.0
"Alexandria LA Media Market, USA",0.5856840181130821,1.0
"Elmira (Corning) NY Media Market, USA",0.6367043413964297,1.0
"Bowling Green KY Media Market, USA",0.6323495345545022,1.0
"Jonesboro AR Media Market, USA",0.6949266254880825,1.0
"Charlottesville VA Media Market, USA",0.525794928055271,1.0
"Marquette MI Media Market, USA",0.6570172991071429,1.0
"Twin Falls ID Media Market, USA",0.666053671161967,1.0
"Butte-Bozeman MT Media Market, USA",0.657061783436314,1.0
"Grand Junction-Montrose CO Media Market, USA",0.87843151092337,1.0
"Bend OR Media Market, USA",0.7810928460098965,1.0
"Lafayette IN Media Market, USA",0.8921680258501308,1.0
"Lima OH Media Market, USA",0.5683393507720711,1.0
"Greenwood-Greenville MS Media Market, USA",0.6618965507364273,1.0
"Great Falls MT Media Market, USA",0.708107702865579,1.0
"Meridian MS Media Market, USA",0.5650585344702992,1.0
"Eureka CA Media Market, USA",0.8280612431332903,1.0
"San Angelo TX Media Market, USA",0.8000065670661632,1.0
"Parkersburg WV Media Market, USA",0.7081287362988644,1.0
"Cheyenne WY-Scottsbluff NE Media Market, USA",0.8310998430520343,1.0
"Casper-Riverton WY Media Market, USA",0.8106247332112416,1.0
"Mankato MN Media Market, USA",0.7646578448706463,1.0
"OttumwaIa-Kirksville MO Media Market, USA",0.6838886941208123,1.0
"St. Joseph MO Media Market, USA",0.7065889462461201,1.0
"Fairbanks AK Media Market, USA",0.612328352673648,1.0
"Victoria TX Media Market, USA",0.8386316100701935,1.0
"Zanesville OH Media Market, USA",0.6385069444444444,1.0
"Helena MT Media Market, USA",0.7503953509301997,1.0
"Presque Isle ME Media Market, USA",0.5389464272408911,1.0
"Juneau AK Media Market, USA",0.7466650323793181,1.0
"Alpena MI Media Market, USA",0.46911365150971446,1.0
"North Platte NE Media Market, USA",0.731815688425672,1.0
"Glendive MT Media Market, USA",0.836158755484643,1.0
