"Huiguo Urban Center, China",,,,,,,,,,,,,,,,,,,,
"Tabanan Urban Center, Indonesia",,,,,,,,,,,,,,,,,,,,
"Guna Urban Center, India",,,,,,,,,,,,,,,,,,,,
"Salem Urban Center, USA",0.8364098340708045,0.013177169413931522,0.02826568201892573,0.02279571179303985,0.09192891876439634,0.30959126149814603,,0.40733339083844544,,0.20060445439971056,,0.08247089326369798,,0.0732812973177813,0.9267187026822188,0.5854329206900745,6.107558808744146e-05,3.194723069189245e-05,130.0,68.0
"Kolea القليعة Urban Center, Algeria",,,,,,,,,,,,,,,,,,,,
"Yunfu Urban Center, China",,,,,,,,,,,,,,,,,,,,
"Ratnagiri Urban Center, India",,,,,,,,,,,,,,,,,,,,
"Lin'an Urban Center, China",,,,,,,,,,,,,,,,,,,,
"Xinji Urban Center, China",,,,,,,,,,,,,,,,,,,,
"Vrindavan Urban Center, India",,,,,,,,,,,,,,,,,,,,
"Centurion Urban Center, South Africa",,,,,,,,,,,,,,,,,,,,
"嘉祥县 Urban Center, China",,,,,,,,,,,,,,,,,,,,
"Tarsus Urban Center, Turkey",,,,,,,,,,,,,,,,,,,,
"Concordia Urban Center, Argentina-Uruguay",,,,,,,,,,,,,,,,,,,,
"Mubi Urban Center, Nigeria",,,,,,,,,,,,,,,,,,,,
"Corpus Christi Urban Center, USA",0.9239891362428309,0.0036321081630174643,0.010087953931894971,0.01719798588126162,0.03984888582310227,0.3047312890734356,,0.5415460415886092,,0.12318893181818248,,0.03053373751977302,,0.07810406735260035,0.9218959326473997,0.5310583421881815,8.870183914770742e-05,3.161182565370424e-05,188.0,67.0
"Beni Mellal Urban Center, Morocco",,,,,,,,,,,,,,,,,,,,
"Kilwa Urban Center, Democratic Republic of the Congo",,,,,,,,,,,,,,,,,,,,
"兰陵县 Urban Center, China",,,,,,,,,,,,,,,,,,,,
"Košice Urban Center, Slovakia",,,,,,,,,,,,,,,,,,,,
"Khairpur Urban Center, Pakistan",,,,,,,,,,,,,,,,,,,,
"Aden Urban Center, Yemen",,,,,,,,,,,,,,,,,,,,
"Xiangyin Urban Center, China",,,,,,,,,,,,,,,,,,,,
"Bétou Urban Center, Congo",,,,,,,,,,,,,,,,,,,,
"Obuasi Urban Center, Ghana",,,,,,,,,,,,,,,,,,,,
"Paraná Urban Center, Argentina",,,,,,,,,,,,,,,,,,,,
"Siyang Urban Center, China",,,,,,,,,,,,,,,,,,,,
"Hasilpur Urban Center, Pakistan",,,,,,,,,,,,,,,,,,,,
"Divinópolis Urban Center, Brazil",,,,,,,,,,,,,,,,,,,,
"Kabinda Urban Center, Democratic Republic of the Congo",,,,,,,,,,,,,,,,,,,,
"Tsuchiura Urban Center, Japan",,,,,,,,,,,,,,,,,,,,
"Cabanatuan Urban Center, Philippines",,,,,,,,,,,,,,,,,,,,
"Trenton Urban Center, USA",0.8475862394767653,0.002569992842367954,0.032736097608271085,0.04906503470738242,0.06216137219176154,0.26480933451844046,,0.43866701999165275,,0.20979646648793387,,0.08672717900197288,,0.16037712927549583,0.8396228707245041,0.4783382812072197,5.8426197737053605e-05,2.8500584261977373e-05,123.0,60.0
"Ulan Hot Urban Center, China",,,,,,,,,,,,,,,,,,,,
"Fomboni Urban Center, Comoros",,,,,,,,,,,,,,,,,,,,
"Matara Urban Center, Sri Lanka",,,,,,,,,,,,,,,,,,,,
"Chirala Urban Center, India",,,,,,,,,,,,,,,,,,,,
"Zouping Urban Center, China",,,,,,,,,,,,,,,,,,,,
"Quiha Urban Center, Ethiopia",,,,,,,,,,,,,,,,,,,,
"Bardhaman Urban Center, India",,,,,,,,,,,,,,,,,,,,
"Santa Clarita Urban Center, USA",0.835876438633378,0.005320781348853176,0.007332167417861715,0.0226922079863164,0.11803058420602065,0.19804837004065828,,0.27575159390014253,,0.30522052741170613,,0.22097950864749316,,0.03820550161599895,0.9617944983840012,0.7205125709532136,3.5695927808555593e-05,1.0470805490509643e-05,75.0,22.0
"Córdoba Urban Center, Mexico",,,,,,,,,,,,,,,,,,,,
"Dausa Urban Center, India",,,,,,,,,,,,,,,,,,,,
"锡北镇 Urban Center, China",,,,,,,,,,,,,,,,,,,,
"Itabuna Urban Center, Brazil",,,,,,,,,,,,,,,,,,,,
"Tonk Urban Center, India",,,,,,,,,,,,,,,,,,,,
"Biratnagar Urban Center, India-Nepal",,,,,,,,,,,,,,,,,,,,
"Ternopil Urban Center, Ukraine",,,,,,,,,,,,,,,,,,,,
"Heshan (Guangdong Sheng) Urban Center, China",,,,,,,,,,,,,,,,,,,,
"Verona Urban Center, Italy",,,,,,,,,,,,,,,,,,,,
"Xinchang Urban Center, China",,,,,,,,,,,,,,,,,,,,
"Bern Urban Center, Switzerland",,,,,,,,,,,,,,,,,,,,
"Dunhua Urban Center, China",,,,,,,,,,,,,,,,,,,,
"Fengshun Urban Center, China",,,,,,,,,,,,,,,,,,,,
"Chemnitz Urban Center, Germany",,,,,,,,,,,,,,,,,,,,
"Zhangye Urban Center, China",,,,,,,,,,,,,,,,,,,,
"Otukpo Urban Center, Nigeria",,,,,,,,,,,,,,,,,,,,
"Netrokona Urban Center, Bangladesh",,,,,,,,,,,,,,,,,,,,
"Kankan Urban Center, Guinea",,,,,,,,,,,,,,,,,,,,
"Kafr al Dabbusi Urban Center, Egypt",,,,,,,,,,,,,,,,,,,,
"Yamoussoukro Urban Center, Ivory Coast",,,,,,,,,,,,,,,,,,,,
"Halle (Saale) Urban Center, Germany",,,,,,,,,,,,,,,,,,,,
"Bukhara Urban Center, Uzbekistan",,,,,,,,,,,,,,,,,,,,
"Dosso Urban Center, Niger",,,,,,,,,,,,,,,,,,,,
"Wuwei (Gansu Sheng) Urban Center, China",,,,,,,,,,,,,,,,,,,,
"Moundou Urban Center, Chad",,,,,,,,,,,,,,,,,,,,
"Xiang'an Urban Center, China",,,,,,,,,,,,,,,,,,,,
"Jaffna Urban Center, Sri Lanka",,,,,,,,,,,,,,,,,,,,
"Pyatigorsk Urban Center, Russia",,,,,,,,,,,,,,,,,,,,
"Haarlem Urban Center, Netherlands",,,,,,,,,,,,,,,,,,,,
"Pensacola Urban Center, USA",0.7919893186124177,0.01192674802569693,0.06321906146405372,0.009916278891375235,0.11074359045673854,0.33493341043430214,,0.44082386324732625,,0.17357253148858817,,0.05067019482978349,,0.08872387185469338,0.9112761281453066,0.5007354464803113,0.00015595893081488541,6.883372563743398e-05,324.0,143.0
"San Luis Río Colorado Urban Center, Mexico-USA",,,,,,,,,,,,,,,,,,,,
"Agbor Urban Center, Nigeria",,,,,,,,,,,,,,,,,,,,
"Chamchamal Urban Center, Iraq",,,,,,,,,,,,,,,,,,,,
"Funtua Urban Center, Nigeria",,,,,,,,,,,,,,,,,,,,
"Wuxue Urban Center, China",,,,,,,,,,,,,,,,,,,,
"Kodungallur Urban Center, India",,,,,,,,,,,,,,,,,,,,
"Buxi Urban Center, China",,,,,,,,,,,,,,,,,,,,
"Imperatriz Urban Center, Brazil",,,,,,,,,,,,,,,,,,,,
"Panjgur Urban Center, Pakistan",,,,,,,,,,,,,,,,,,,,
"Qidong (Hunan Sheng) Urban Center, China",,,,,,,,,,,,,,,,,,,,
"Blumenau Urban Center, Brazil",,,,,,,,,,,,,,,,,,,,
"Gushi Urban Center, China",,,,,,,,,,,,,,,,,,,,
"Pingtan Urban Center, China",,,,,,,,,,,,,,,,,,,,
"营城镇 Urban Center, China",,,,,,,,,,,,,,,,,,,,
"Ci Urban Center, China",,,,,,,,,,,,,,,,,,,,
"Ciudad del Carmen Urban Center, Mexico",,,,,,,,,,,,,,,,,,,,
"Shangcai Urban Center, China",,,,,,,,,,,,,,,,,,,,
"Northampton Urban Center, United Kingdom",,,,,,,,,,,,,,,,,,,,
"Arar Urban Center, Saudi Arabia",,,,,,,,,,,,,,,,,,,,
"Playa del Carmen Urban Center, Mexico",,,,,,,,,,,,,,,,,,,,
"Bayamo Urban Center, Cuba",,,,,,,,,,,,,,,,,,,,
"Kishanganj Urban Center, India",,,,,,,,,,,,,,,,,,,,
"Morbi Urban Center, India",,,,,,,,,,,,,,,,,,,,
"Yingtan Urban Center, China",,,,,,,,,,,,,,,,,,,,
"Pleiku Urban Center, Vietnam",,,,,,,,,,,,,,,,,,,,
"İnegöl Urban Center, Turkey",,,,,,,,,,,,,,,,,,,,
"Beni Mazar Urban Center, Egypt",,,,,,,,,,,,,,,,,,,,
"Temecula Urban Center, USA",0.8611171336989139,0.0054067619010740526,0.012160011368117887,0.001798725847072407,0.1123961743450186,0.2537850759407804,,0.27971774280926986,,0.20420174753723194,,0.2622954337127177,,0.030203333095637643,0.9697966669043623,0.7419979461025454,5.150806878756809e-05,9.718503544824169e-06,106.0,20.0
"Ar Raqqah Urban Center, Syria",,,,,,,,,,,,,,,,,,,,
"Khamgaon Urban Center, India",,,,,,,,,,,,,,,,,,,,
"Banjarnegara Urban Center, Indonesia",,,,,,,,,,,,,,,,,,,,
"Tal Afar Urban Center, Iraq",,,,,,,,,,,,,,,,,,,,
"Malé Urban Center, Maldives",,,,,,,,,,,,,,,,,,,,
"Mary Urban Center, Turkmenistan",,,,,,,,,,,,,,,,,,,,
"Rio Verde Urban Center, Brazil",,,,,,,,,,,,,,,,,,,,
"Aberdeen Urban Center, United Kingdom",,,,,,,,,,,,,,,,,,,,
"Mwene-Ditu Urban Center, Democratic Republic of the Congo",,,,,,,,,,,,,,,,,,,,
"Kamituga Urban Center, Democratic Republic of the Congo",,,,,,,,,,,,,,,,,,,,
"Qingyang (Gansu Sheng) Urban Center, China",,,,,,,,,,,,,,,,,,,,
"Castellón de la Plana Urban Center, Spain",,,,,,,,,,,,,,,,,,,,
"Minya Al-Qamh Urban Center, Egypt",,,,,,,,,,,,,,,,,,,,
"Lopburi Urban Center, Thailand",,,,,,,,,,,,,,,,,,,,
"尖锋村 Urban Center, China",,,,,,,,,,,,,,,,,,,,
"Fort Wayne Urban Center, USA",0.905757041170998,0.006362869051816505,0.0182212731914266,0.012092383147673419,0.05132101198851119,0.3073676322711706,,0.48056745153797326,,0.168377834314165,,0.04368708187669097,,0.07756197983960125,0.9224380201603988,0.5262661197987952,8.073750036698864e-05,1.957272736169422e-05,165.0,40.0
"Puerto Vallarta Urban Center, Mexico",,,,,,,,,,,,,,,,,,,,
"Dodoma Urban Center, Tanzania",,,,,,,,,,,,,,,,,,,,
"Chhatarpur Urban Center, India",,,,,,,,,,,,,,,,,,,,
"大港区 Urban Center, China",,,,,,,,,,,,,,,,,,,,
"Safadasht Urban Center, Iran",,,,,,,,,,,,,,,,,,,,
"Shakar Garh Urban Center, Pakistan",,,,,,,,,,,,,,,,,,,,
"Nakhon Ratchasima Urban Center, Thailand",,,,,,,,,,,,,,,,,,,,
"Jurong Urban Center, China",,,,,,,,,,,,,,,,,,,,
"Achalpur Urban Center, India",,,,,,,,,,,,,,,,,,,,
"Marília Urban Center, Brazil",,,,,,,,,,,,,,,,,,,,
"Sarh Urban Center, Chad",,,,,,,,,,,,,,,,,,,,
"Jega Urban Center, Nigeria",,,,,,,,,,,,,,,,,,,,
"Zonguldak Urban Center, Turkey",,,,,,,,,,,,,,,,,,,,
"Yola Urban Center, Nigeria",,,,,,,,,,,,,,,,,,,,
"Bitung Urban Center, Indonesia",,,,,,,,,,,,,,,,,,,,
"Haining Urban Center, China",,,,,,,,,,,,,,,,,,,,
"Gölcük Urban Center, Turkey",,,,,,,,,,,,,,,,,,,,
"San Luis Urban Center, Mexico",,,,,,,,,,,,,,,,,,,,
"Lauiyah Nandangarh Urban Center, India",,,,,,,,,,,,,,,,,,,,
"Taiping Urban Center, Malaysia",,,,,,,,,,,,,,,,,,,,
"Chilpancingo Urban Center, Mexico",,,,,,,,,,,,,,,,,,,,
"Santa Ana Urban Center, El Salvador",,,,,,,,,,,,,,,,,,,,
"Jinghai Urban Center, China",,,,,,,,,,,,,,,,,,,,
"Gaizhou Urban Center, China",,,,,,,,,,,,,,,,,,,,
"Tuban Urban Center, Indonesia",,,,,,,,,,,,,,,,,,,,
"Yintai Urban Center, China",,,,,,,,,,,,,,,,,,,,
"Al-Wasitah Urban Center, Egypt",,,,,,,,,,,,,,,,,,,,
"Komsomolsk-on-Amur Urban Center, Russia",,,,,,,,,,,,,,,,,,,,
"Tilburg Urban Center, Netherlands",,,,,,,,,,,,,,,,,,,,
"Jhusi Urban Center, India",,,,,,,,,,,,,,,,,,,,
"Jishou Urban Center, China",,,,,,,,,,,,,,,,,,,,
"Unaizah Urban Center, Saudi Arabia",,,,,,,,,,,,,,,,,,,,
"Guantanamo Urban Center, Cuba",,,,,,,,,,,,,,,,,,,,
"La Rioja Urban Center, Argentina",,,,,,,,,,,,,,,,,,,,
"Ganyu Urban Center, China",,,,,,,,,,,,,,,,,,,,
"Sumenep Urban Center, Indonesia",,,,,,,,,,,,,,,,,,,,
"Magdeburg Urban Center, Germany",,,,,,,,,,,,,,,,,,,,
"Cuautla Urban Center, Mexico",,,,,,,,,,,,,,,,,,,,
"Kaechon Urban Center, North Korea",,,,,,,,,,,,,,,,,,,,
"Heidelberg Urban Center, Germany",,,,,,,,,,,,,,,,,,,,
"Quangang Urban Center, China",,,,,,,,,,,,,,,,,,,,
"Cabo San Lucas Urban Center, Mexico",,,,,,,,,,,,,,,,,,,,
"Omuo-Obadore Urban Center, Nigeria",,,,,,,,,,,,,,,,,,,,
"Gangapur (Eastern Rājasthān) Urban Center, India",,,,,,,,,,,,,,,,,,,,
"增城区 Urban Center, China",,,,,,,,,,,,,,,,,,,,
"Jiuquan Urban Center, China",,,,,,,,,,,,,,,,,,,,
"Xiaoyi Urban Center, China",,,,,,,,,,,,,,,,,,,,
"Yan'an Urban Center, China",,,,,,,,,,,,,,,,,,,,
"Jiayuguan Urban Center, China",,,,,,,,,,,,,,,,,,,,
"Puerto Montt Urban Center, Chile",,,,,,,,,,,,,,,,,,,,
"Quetzaltenango Urban Center, Guatemala",,,,,,,,,,,,,,,,,,,,
"Longjiang (Guangdong Sheng) Urban Center, China",,,,,,,,,,,,,,,,,,,,
"Sapucaia do Sul Urban Center, Brazil",,,,,,,,,,,,,,,,,,,,
"Rajnandgaon Urban Center, India",,,,,,,,,,,,,,,,,,,,
"Ruzhou Urban Center, China",,,,,,,,,,,,,,,,,,,,
"Yushu Urban Center, China",,,,,,,,,,,,,,,,,,,,
"Kecamatan Wanasaba Urban Center, Indonesia",,,,,,,,,,,,,,,,,,,,
"Hammamet Urban Center, Tunisia",,,,,,,,,,,,,,,,,,,,
"Bordj Bou Arreridjj Urban Center, Algeria",,,,,,,,,,,,,,,,,,,,
"Ongole Urban Center, India",,,,,,,,,,,,,,,,,,,,
"Bixi Urban Center, China",,,,,,,,,,,,,,,,,,,,
"Beledweyne Urban Center, Somalia",,,,,,,,,,,,,,,,,,,,
"Osmanabad Urban Center, India",,,,,,,,,,,,,,,,,,,,
"Nacala Urban Center, Mozambique",,,,,,,,,,,,,,,,,,,,
"Muse Urban Center, China-Myanmar",,,,,,,,,,,,,,,,,,,,
"Ijebu-Igbo Urban Center, Nigeria",,,,,,,,,,,,,,,,,,,,
"Kimberley Urban Center, South Africa",,,,,,,,,,,,,,,,,,,,
"Beer Sheva Urban Center, Israel",,,,,,,,,,,,,,,,,,,,
"Lubbock Urban Center, USA",0.9031183417303308,0.004659166087923875,0.02363463861069402,0.008568693871492008,0.05220985669768366,0.5208303701009775,,0.39007244498995763,,0.05892189055156007,,0.03017529435750484,,0.06406152293728191,0.9359384770627182,0.5665057465217158,0.00010394018669063485,3.163396986236712e-05,207.0,63.0
"Awka Urban Center, Nigeria",,,,,,,,,,,,,,,,,,,,
"Ho Urban Center, Ghana",,,,,,,,,,,,,,,,,,,,
"Xuwen County Urban Center, China",,,,,,,,,,,,,,,,,,,,
"Diourbel Urban Center, Senegal",,,,,,,,,,,,,,,,,,,,
"Lafia Urban Center, Nigeria",,,,,,,,,,,,,,,,,,,,
"Jerez Urban Center, Spain",,,,,,,,,,,,,,,,,,,,
"Potosí Urban Center, Bolivia",,,,,,,,,,,,,,,,,,,,
"Ha Long Urban Center, Vietnam",,,,,,,,,,,,,,,,,,,,
"Caoxian Urban Center, China",,,,,,,,,,,,,,,,,,,,
"Dharmapuri Urban Center, India",,,,,,,,,,,,,,,,,,,,
"Sanhe Urban Center, China",,,,,,,,,,,,,,,,,,,,
"Cobán Urban Center, Guatemala",,,,,,,,,,,,,,,,,,,,
"Fuji Urban Center, Japan",,,,,,,,,,,,,,,,,,,,
"Nijmegen Urban Center, Netherlands",,,,,,,,,,,,,,,,,,,,
"Palmira Urban Center, Colombia",,,,,,,,,,,,,,,,,,,,
"Bhuj Urban Center, India",,,,,,,,,,,,,,,,,,,,
"Mawlamyinegyunn Urban Center, Myanmar",,,,,,,,,,,,,,,,,,,,
"Khagaria Urban Center, India",,,,,,,,,,,,,,,,,,,,
"Bishan Urban Center, China",,,,,,,,,,,,,,,,,,,,
"Lingshan Urban Center, China",,,,,,,,,,,,,,,,,,,,
"Apartadó Urban Center, Colombia",,,,,,,,,,,,,,,,,,,,
"Abu Kabir‎ Urban Center, Egypt",,,,,,,,,,,,,,,,,,,,
"Udhampur Urban Center, India",,,,,,,,,,,,,,,,,,,,
"Clermont-Ferrand Urban Center, France",,,,,,,,,,,,,,,,,,,,
"Brescia Urban Center, Italy",,,,,,,,,,,,,,,,,,,,
"Lala Musa Urban Center, Pakistan",,,,,,,,,,,,,,,,,,,,
"Tambacounda Urban Center, Senegal",,,,,,,,,,,,,,,,,,,,
"Bagalkot Urban Center, India",,,,,,,,,,,,,,,,,,,,
"Kharian Urban Center, Pakistan",,,,,,,,,,,,,,,,,,,,
"Kipushi Urban Center, Democratic Republic of the Congo",,,,,,,,,,,,,,,,,,,,
"Jalingo Urban Center, Nigeria",,,,,,,,,,,,,,,,,,,,
"Maghagheh Urban Center, Egypt",,,,,,,,,,,,,,,,,,,,
"Orléans Urban Center, France",,,,,,,,,,,,,,,,,,,,
"Brunswick Urban Center, Germany",,,,,,,,,,,,,,,,,,,,
"Bogra Urban Center, Bangladesh",,,,,,,,,,,,,,,,,,,,
"Sumedang Urban Center, Indonesia",,,,,,,,,,,,,,,,,,,,
"Appleton Urban Center, USA",0.8824203059204522,0.007058465020644637,0.02269665619966475,0.00603968862424012,0.07640626308820422,0.38676019116260013,,0.4379137309775556,,0.14588941437589506,,0.029436663483949296,,0.055659941047587876,0.9443400589524122,0.6044091114800817,3.049353791109101e-05,6.606933214069718e-06,60.0,13.0
"Jaigaon Urban Center, Bhutan-India",,,,,,,,,,,,,,,,,,,,
"Regina Urban Center, Canada",,,,,,,0.4406169582426664,,0.47701282309769405,,0.06949336543071168,,0.012876853228927766,,,,,,,
"Messina Urban Center, Italy",,,,,,,,,,,,,,,,,,,,
"Putuo Urban Center, China",,,,,,,,,,,,,,,,,,,,
"Machilipatnam Urban Center, India",,,,,,,,,,,,,,,,,,,,
"Santa Cruz Urban Center, Philippines",,,,,,,,,,,,,,,,,,,,
"Longchang Urban Center, China",,,,,,,,,,,,,,,,,,,,
"Nakhon Pathom Urban Center, Thailand",,,,,,,,,,,,,,,,,,,,
"Kisarazu Urban Center, Japan",,,,,,,,,,,,,,,,,,,,
"Reims Urban Center, France",,,,,,,,,,,,,,,,,,,,
"Angarsk Urban Center, Russia",,,,,,,,,,,,,,,,,,,,
"Nandurbar Urban Center, India",,,,,,,,,,,,,,,,,,,,
"El esfuerzo Urban Center, Colombia",,,,,,,,,,,,,,,,,,,,
"Petrópolis Urban Center, Brazil",,,,,,,,,,,,,,,,,,,,
"Dundo Urban Center, Angola",,,,,,,,,,,,,,,,,,,,
"Baranovichi Urban Center, Belarus",,,,,,,,,,,,,,,,,,,,
"Fukui Urban Center, Japan",,,,,,,,,,,,,,,,,,,,
"Mannargudi Urban Center, India",,,,,,,,,,,,,,,,,,,,
"Karad Urban Center, India",,,,,,,,,,,,,,,,,,,,
"Jongju Urban Center, North Korea",,,,,,,,,,,,,,,,,,,,
"Bizerte Urban Center, Tunisia",,,,,,,,,,,,,,,,,,,,
"Udgir Urban Center, India",,,,,,,,,,,,,,,,,,,,
"Harar Urban Center, Ethiopia",,,,,,,,,,,,,,,,,,,,
"Bejaia Urban Center, Algeria",,,,,,,,,,,,,,,,,,,,
"Souk Ahras Urban Center, Algeria",,,,,,,,,,,,,,,,,,,,
"Bongaigaon Urban Center, India",,,,,,,,,,,,,,,,,,,,
"Greater Noida Urban Center, India",,,,,,,,,,,,,,,,,,,,
"Kulim Urban Center, Malaysia",,,,,,,,,,,,,,,,,,,,
"De Rust Caravan Park Urban Center, South Africa",,,,,,,,,,,,,,,,,,,,
"Shulan Urban Center, China",,,,,,,,,,,,,,,,,,,,
"Las Tunas Urban Center, Cuba",,,,,,,,,,,,,,,,,,,,
"Babruysk Urban Center, Belarus",,,,,,,,,,,,,,,,,,,,
"Hancheng Urban Center, China",,,,,,,,,,,,,,,,,,,,
"Vaniyambadi Urban Center, India",,,,,,,,,,,,,,,,,,,,
"Portoviejo Urban Center, Ecuador",,,,,,,,,,,,,,,,,,,,
"Muvattupuzha Urban Center, India",,,,,,,,,,,,,,,,,,,,
"Gongzhuling Urban Center, China",,,,,,,,,,,,,,,,,,,,
"San Pablo Urban Center, Philippines",,,,,,,,,,,,,,,,,,,,
"Ikire Urban Center, Nigeria",,,,,,,,,,,,,,,,,,,,
"Tinsukia Urban Center, India",,,,,,,,,,,,,,,,,,,,
"Butuan Urban Center, Philippines",,,,,,,,,,,,,,,,,,,,
"Qian'an Urban Center, China",,,,,,,,,,,,,,,,,,,,
"Coro Urban Center, Venezuela",,,,,,,,,,,,,,,,,,,,
"Pokhara Urban Center, Nepal",,,,,,,,,,,,,,,,,,,,
"Milton Keynes Urban Center, United Kingdom",,,,,,,,,,,,,,,,,,,,
"Dingshu Urban Center, China",,,,,,,,,,,,,,,,,,,,
"Shayuan Urban Center, China",,,,,,,,,,,,,,,,,,,,
"Bondowoso Urban Center, Indonesia",,,,,,,,,,,,,,,,,,,,
"Koforidua Urban Center, Ghana",,,,,,,,,,,,,,,,,,,,
"Mandya Urban Center, India",,,,,,,,,,,,,,,,,,,,
"Hotan Urban Center, China",,,,,,,,,,,,,,,,,,,,
"Rantau Prapat Urban Center, Indonesia",,,,,,,,,,,,,,,,,,,,
"Chandausi Urban Center, India",,,,,,,,,,,,,,,,,,,,
"Qijiang Urban Center, China",,,,,,,,,,,,,,,,,,,,
"Nalgonda Urban Center, India",,,,,,,,,,,,,,,,,,,,
"Himatnagar Urban Center, India",,,,,,,,,,,,,,,,,,,,
"Goth Dabhūn Urban Center, Pakistan",,,,,,,,,,,,,,,,,,,,
"Swindon Urban Center, United Kingdom",,,,,,,,,,,,,,,,,,,,
"大岗镇 Urban Center, China",,,,,,,,,,,,,,,,,,,,
"Yizhen Urban Center, China",,,,,,,,,,,,,,,,,,,,
"牟平区 Urban Center, China",,,,,,,,,,,,,,,,,,,,
"Tiruchengodu Urban Center, India",,,,,,,,,,,,,,,,,,,,
"Ash Shalif Urban Center, Algeria",,,,,,,,,,,,,,,,,,,,
"Patan Urban Center, India",,,,,,,,,,,,,,,,,,,,
"Bashar Urban Center, Algeria",,,,,,,,,,,,,,,,,,,,
"Hail Urban Center, Saudi Arabia",,,,,,,,,,,,,,,,,,,,
"Araraquara Urban Center, Brazil",,,,,,,,,,,,,,,,,,,,
"Longkou Urban Center, China",,,,,,,,,,,,,,,,,,,,
"Xinyi (Jiangsu Sheng-Shandong Sheng) Urban Center, China",,,,,,,,,,,,,,,,,,,,
"Águas Lindas de Goiás Urban Center, Brazil",,,,,,,,,,,,,,,,,,,,
"Gokul Urban Center, India",,,,,,,,,,,,,,,,,,,,
"Donghai Urban Center, China",,,,,,,,,,,,,,,,,,,,
"Tenali Urban Center, India",,,,,,,,,,,,,,,,,,,,
"Reading Urban Center, USA",0.8394283596105211,0.0016652892403654928,0.03917219220307574,0.029049527161912978,0.05992449323131972,0.3118445126986362,,0.4168615440319344,,0.19379314093471917,,0.07750080233471009,,0.14333087569848244,0.8566691243015175,0.49853913335747035,5.096415867534791e-05,1.6121315499344746e-05,98.0,31.0
"Dalat Urban Center, Vietnam",,,,,,,,,,,,,,,,,,,,
"Okrika Urban Center, Nigeria",,,,,,,,,,,,,,,,,,,,
"Fujieda Urban Center, Japan",,,,,,,,,,,,,,,,,,,,
"Qarchak Urban Center, Iran",,,,,,,,,,,,,,,,,,,,
"Shivpuri Urban Center, India",,,,,,,,,,,,,,,,,,,,
"Raniganj (West Bengal) Urban Center, India",,,,,,,,,,,,,,,,,,,,
"Mulhouse Urban Center, France",,,,,,,,,,,,,,,,,,,,
"Duqiao Urban Center, China",,,,,,,,,,,,,,,,,,,,
"Santa Teresa del Tuy Urban Center, Venezuela",,,,,,,,,,,,,,,,,,,,
"Kisaran Urban Center, Indonesia",,,,,,,,,,,,,,,,,,,,
"Oral Urban Center, Kazakhstan",,,,,,,,,,,,,,,,,,,,
"Pusad Urban Center, India",,,,,,,,,,,,,,,,,,,,
"Kannauj Urban Center, India",,,,,,,,,,,,,,,,,,,,
"Newcastle Urban Center, Australia",,,,,,,,,,,,,,,,,,,,
"Eldoret Urban Center, Kenya",,,,,,,,,,,,,,,,,,,,
"Huanggang Urban Center, China",,,,,,,,,,,,,,,,,,,,
"ቡሌ ሆራ / Bule Hora Urban Center, Ethiopia",,,,,,,,,,,,,,,,,,,,
"Wu'an Urban Center, China",,,,,,,,,,,,,,,,,,,,
"Linquan Urban Center, China",,,,,,,,,,,,,,,,,,,,
"Depalpur Urban Center, Pakistan",,,,,,,,,,,,,,,,,,,,
"Ramgarh (Jhārkhand) Urban Center, India",,,,,,,,,,,,,,,,,,,,
"Yei Urban Center, South Sudan",,,,,,,,,,,,,,,,,,,,
"Fula'erji Urban Center, China",,,,,,,,,,,,,,,,,,,,
"Sahagún Urban Center, Colombia",,,,,,,,,,,,,,,,,,,,
"Al Manshiyah al Qibliyah Urban Center, Egypt",,,,,,,,,,,,,,,,,,,,
"Poyang Urban Center, China",,,,,,,,,,,,,,,,,,,,
"Timergara Urban Center, Pakistan",,,,,,,,,,,,,,,,,,,,
"San Salvador de Jujuy Urban Center, Argentina",,,,,,,,,,,,,,,,,,,,
"Kurume Urban Center, Japan",,,,,,,,,,,,,,,,,,,,
"Tieling Urban Center, China",,,,,,,,,,,,,,,,,,,,
"Nida Urban Center, Egypt",,,,,,,,,,,,,,,,,,,,
"Rockford Urban Center, USA",0.9067522092084576,0.003121890198452299,0.016385656055808558,0.012181751549564156,0.054605868122375494,0.36089446181746565,,0.41532102121197967,,0.16166563568213688,,0.062118881288417784,,0.10932948500616868,0.8906705149938314,0.5162514357813341,9.515401734974918e-05,3.1718005783249724e-05,180.0,60.0
"Badarpur Urban Center, India",,,,,,,,,,,,,,,,,,,,
"Moga Urban Center, India",,,,,,,,,,,,,,,,,,,,
"Kasama Urban Center, Zambia",,,,,,,,,,,,,,,,,,,,
"Habiganj Urban Center, Bangladesh",,,,,,,,,,,,,,,,,,,,
"Shuantaizi Urban Center, China",,,,,,,,,,,,,,,,,,,,
"Sakaide Urban Center, Japan",,,,,,,,,,,,,,,,,,,,
"Ploiești Urban Center, Romania",,,,,,,,,,,,,,,,,,,,
"Duyun Urban Center, China",,,,,,,,,,,,,,,,,,,,
"Bắc Giang Urban Center, Vietnam",,,,,,,,,,,,,,,,,,,,
"Nablus Urban Center, State of Palestine",,,,,,,,,,,,,,,,,,,,
"Al Managil Urban Center, Sudan",,,,,,,,,,,,,,,,,,,,
"Matala Urban Center, Angola",,,,,,,,,,,,,,,,,,,,
"Takht-e-Bhai Urban Center, Pakistan",,,,,,,,,,,,,,,,,,,,
"Boma Urban Center, Democratic Republic of the Congo",,,,,,,,,,,,,,,,,,,,
"Bahawalnagar Urban Center, Pakistan",,,,,,,,,,,,,,,,,,,,
"Middelburg Urban Center, South Africa",,,,,,,,,,,,,,,,,,,,
"Nanxun Urban Center, China",,,,,,,,,,,,,,,,,,,,
"Ambajogai Urban Center, India",,,,,,,,,,,,,,,,,,,,
"Saint-Marc Urban Center, Haiti",,,,,,,,,,,,,,,,,,,,
"Częstochowa Urban Center, Poland",,,,,,,,,,,,,,,,,,,,
"Cabo Frio Urban Center, Brazil",,,,,,,,,,,,,,,,,,,,
"Jhumri Tilaiya Urban Center, India",,,,,,,,,,,,,,,,,,,,
"Villa del Rosario Urban Center, Colombia-Venezuela",,,,,,,,,,,,,,,,,,,,
"Shancheng Urban Center, China",,,,,,,,,,,,,,,,,,,,
"金峰镇 Urban Center, China",,,,,,,,,,,,,,,,,,,,
"Khasavyurt Urban Center, Russia",,,,,,,,,,,,,,,,,,,,
"Attock Urban Center, Pakistan",,,,,,,,,,,,,,,,,,,,
"Borujerd Urban Center, Iran",,,,,,,,,,,,,,,,,,,,
"Abadan Urban Center, Iran",,,,,,,,,,,,,,,,,,,,
"Wanning Urban Center, China",,,,,,,,,,,,,,,,,,,,
"Okitipupa Urban Center, Nigeria",,,,,,,,,,,,,,,,,,,,
"Shamli Urban Center, India",,,,,,,,,,,,,,,,,,,,
"Situbondo Urban Center, Indonesia",,,,,,,,,,,,,,,,,,,,
"Banswara Urban Center, India",,,,,,,,,,,,,,,,,,,,
"Ore Urban Center, Nigeria",,,,,,,,,,,,,,,,,,,,
"Man Urban Center, Ivory Coast",,,,,,,,,,,,,,,,,,,,
"Dale City Urban Center, USA",0.8226784264423166,0.0026565038857400795,0.010534761334476546,0.045144432868239485,0.0981597438286208,0.09259612576537922,,0.20672338084787048,,0.4768522459833096,,0.22382824740344065,,0.025053949057094925,0.9749460509429052,0.7069343377202116,3.919000171791788e-05,1.0736986772032297e-05,73.0,20.0
"Triest Urban Center, Italy",,,,,,,,,,,,,,,,,,,,
"Uşak Urban Center, Turkey",,,,,,,,,,,,,,,,,,,,
"Zhangshu Urban Center, China",,,,,,,,,,,,,,,,,,,,
"Balangir Urban Center, India",,,,,,,,,,,,,,,,,,,,
"Jhunjhunu Urban Center, India",,,,,,,,,,,,,,,,,,,,
"Rushan Urban Center, China",,,,,,,,,,,,,,,,,,,,
"Kütahya Urban Center, Turkey",,,,,,,,,,,,,,,,,,,,
"Camaçari Urban Center, Brazil",,,,,,,,,,,,,,,,,,,,
"Auchi Urban Center, Nigeria",,,,,,,,,,,,,,,,,,,,
"Somerset West Urban Center, South Africa",,,,,,,,,,,,,,,,,,,,
"Makrana Urban Center, India",,,,,,,,,,,,,,,,,,,,
"Demba Urban Center, Democratic Republic of the Congo",,,,,,,,,,,,,,,,,,,,
"Entebbe Urban Center, Uganda",,,,,,,,,,,,,,,,,,,,
"Birmingham Urban Center, USA",0.8602977905019671,0.004071478521978699,0.036658696410677455,0.020588334162235013,0.06711695922112745,0.3060742520472972,,0.4885626658490063,,0.171066380715094,,0.03429670138860248,,0.131919105120205,0.868080894879795,0.4386688134957915,0.00019597363263851772,5.182773755729394e-05,363.0,96.0
"Nagaur Urban Center, India",,,,,,,,,,,,,,,,,,,,
"Kaspiysk Urban Center, Russia",,,,,,,,,,,,,,,,,,,,
"Tete Urban Center, Mozambique",,,,,,,,,,,,,,,,,,,,
"平邑县 Urban Center, China",,,,,,,,,,,,,,,,,,,,
"Chittorgarh Urban Center, India",,,,,,,,,,,,,,,,,,,,
"San Cristóbal Urban Center, Mexico",,,,,,,,,,,,,,,,,,,,
"Myaungmya Urban Center, Myanmar",,,,,,,,,,,,,,,,,,,,
"Ahmadpur East Urban Center, Pakistan",,,,,,,,,,,,,,,,,,,,
"Sucre Urban Center, Bolivia",,,,,,,,,,,,,,,,,,,,
"Santarém Urban Center, Brazil",,,,,,,,,,,,,,,,,,,,
"Chía Urban Center, Colombia",,,,,,,,,,,,,,,,,,,,
"Hafoon Urban Center, Yemen",,,,,,,,,,,,,,,,,,,,
"Kotabumi Urban Center, Indonesia",,,,,,,,,,,,,,,,,,,,
"Lens Urban Center, France",,,,,,,,,,,,,,,,,,,,
"Balrampur Urban Center, India",,,,,,,,,,,,,,,,,,,,
"Ile Oluji Urban Center, Nigeria",,,,,,,,,,,,,,,,,,,,
"Makeni Urban Center, Sierra Leone",,,,,,,,,,,,,,,,,,,,
"San Cristóbal Urban Center, Dominican Republic",,,,,,,,,,,,,,,,,,,,
"Zijin Urban Center, China",,,,,,,,,,,,,,,,,,,,
"Washim Urban Center, India",,,,,,,,,,,,,,,,,,,,
"Kolar Urban Center, India",,,,,,,,,,,,,,,,,,,,
"Anji Urban Center, China",,,,,,,,,,,,,,,,,,,,
"Laghouat Urban Center, Algeria",,,,,,,,,,,,,,,,,,,,
"Kindia Urban Center, Guinea",,,,,,,,,,,,,,,,,,,,
"Baode Urban Center, China",,,,,,,,,,,,,,,,,,,,
"Shaodong Urban Center, China",,,,,,,,,,,,,,,,,,,,
"Rabak Urban Center, Sudan",,,,,,,,,,,,,,,,,,,,
"Taraz Urban Center, Kazakhstan",,,,,,,,,,,,,,,,,,,,
"Macaé Urban Center, Brazil",,,,,,,,,,,,,,,,,,,,
"Puli Khumri Urban Center, Afghanistan",,,,,,,,,,,,,,,,,,,,
"Armant Al-Waburat Urban Center, Egypt",,,,,,,,,,,,,,,,,,,,
"Merauke Urban Center, Indonesia",,,,,,,,,,,,,,,,,,,,
"Ras Al Khaimah Urban Center, United Arab Emirates",,,,,,,,,,,,,,,,,,,,
"Rongcheng Urban Center, China",,,,,,,,,,,,,,,,,,,,
"Hammam-Lif Urban Center, Tunisia",,,,,,,,,,,,,,,,,,,,
"El Eulma Urban Center, Algeria",,,,,,,,,,,,,,,,,,,,
