"Kobo Urban Center, Ethiopia",,,,,,,,,,,,,,
"Jiaocheng Urban Center, China",,,,,,,,,,,,,,
"Madhobani Urban Center, India",,,,,,,,,,,,,,
"Springfield (Illinois) Urban Center, USA",0.2046996748091189,,0.4844625255419056,0.2975945694248325,0.21794290503326183,,,,0.6848280369553422,0.23180636236730967,0.08336560067734824,,,
"Las Piedras Urban Center, Uruguay",,,,,,,,,,,,,,
"Shikarpur Urban Center, India",,,,,,,,,,,,,,
"Waco Urban Center, USA",0.2546151831372132,,0.5969584518791163,0.24681258698681527,0.1562289611340684,,,,0.8061434209708557,0.14368242262667955,0.050174156402464885,,,
"Hagadera Refugee Camp Urban Center, Kenya",,,,,,,,,,,,,,
"Jamui Urban Center, India",,,,,,,,,,,,,,
"Açailândia Urban Center, Brazil",,,,,,,,,,,,,,
"Khurai Urban Center, India",,,,,,,,,,,,,,
"Orléans Urban Center, Canada",,0.02388611114021257,,,,0.05934197076877069,0.27977936832255734,0.6608786609086719,,,,0.44832491741322156,0.37741532307762526,0.17425975950915326
"São Tomé Urban Center, São Tomé and Príncipe",,,,,,,,,,,,,,
"Murom Urban Center, Russia",,,,,,,,,,,,,,
"Kribi Urban Center, Cameroon",,,,,,,,,,,,,,
"Gondal Urban Center, India",,,,,,,,,,,,,,
"Kabirwala Urban Center, Pakistan",,,,,,,,,,,,,,
"Bolzano - Bozen Urban Center, Italy",,,,,,,,,,,,,,
"Rajgir Urban Center, India",,,,,,,,,,,,,,
"Jaudiri Urban Center, Nigeria",,,,,,,,,,,,,,
"Old Reynella Urban Center, Australia",,,,,,,,,,,,,,
"Coronel Urban Center, Chile",,,,,,,,,,,,,,
"Baqubah Urban Center, Iraq",,,,,,,,,,,,,,
"Ocotlán Urban Center, Mexico",,,,,,,,,,,,,,
"Maidstone Urban Center, United Kingdom",,,,,,,,,,,,,,
"Lázaro Cárdenas Urban Center, Mexico",,,,,,,,,,,,,,
"Aalborg Urban Center, Denmark",,,,,,,,,,,,,,
"Xinshao Urban Center, China",,,,,,,,,,,,,,
"Pucheng (Shaanxi Sheng) Urban Center, China",,,,,,,,,,,,,,
"Cheltenham Urban Center, United Kingdom",,,,,,,,,,,,,,
"Sunzha Urban Center, Russia",,,,,,,,,,,,,,
"Kafr al Hawi Urban Center, Egypt",,,,,,,,,,,,,,
"Ilhéus Urban Center, Brazil",,,,,,,,,,,,,,
"Sarnia Urban Center, Canada-USA",,,,,,,,,,,,,,
"Thul Urban Center, Pakistan",,,,,,,,,,,,,,
"Montego Bay Urban Center, Jamaica",,,,,,,,,,,,,,
"Maghnia Urban Center, Algeria",,,,,,,,,,,,,,
"Shegaon Urban Center, India",,,,,,,,,,,,,,
"Tumbes Urban Center, Peru",,,,,,,,,,,,,,
"Cabo de Santo Agostinho Urban Center, Brazil",,,,,,,,,,,,,,
"Tangyin Urban Center, China",,,,,,,,,,,,,,
"Bardoli Urban Center, India",,,,,,,,,,,,,,
"Chongyang Urban Center, China",,,,,,,,,,,,,,
"Xincai Urban Center, China",,,,,,,,,,,,,,
"Chenggu Urban Center, China",,,,,,,,,,,,,,
"Mishan Urban Center, China",,,,,,,,,,,,,,
"Wuhe Urban Center, China",,,,,,,,,,,,,,
"Huangmei Urban Center, China",,,,,,,,,,,,,,
"Panruti Urban Center, India",,,,,,,,,,,,,,
"Zinna Urban Center, Nigeria",,,,,,,,,,,,,,
"Yuanbaoshan Urban Center, China",,,,,,,,,,,,,,
"Binchuan Urban Center, China",,,,,,,,,,,,,,
"Paechon Urban Center, North Korea",,,,,,,,,,,,,,
"Quibdó Urban Center, Colombia",,,,,,,,,,,,,,
"Hodal Urban Center, India",,,,,,,,,,,,,,
"Brockton Urban Center, USA",0.11363026220327375,,0.36606001231403806,0.2961817150004808,0.3377582726854812,,,,0.6783195650504278,0.2544319817508544,0.06724845319871761,,,
"Massa Urban Center, Italy",,,,,,,,,,,,,,
"Oktjabrski Urban Center, Russia",,,,,,,,,,,,,,
"Majalengka Urban Center, Indonesia",,,,,,,,,,,,,,
"‎Jiaolin Urban Center, China",,,,,,,,,,,,,,
"Barretos Urban Center, Brazil",,,,,,,,,,,,,,
"Emure Urban Center, Nigeria",,,,,,,,,,,,,,
"Renala Khurd Urban Center, Pakistan",,,,,,,,,,,,,,
"Bedford Urban Center, United Kingdom",,,,,,,,,,,,,,
"Shenquan Urban Center, China",,,,,,,,,,,,,,
"Zichang Urban Center, China",,,,,,,,,,,,,,
"Sampang Urban Center, Indonesia",,,,,,,,,,,,,,
"Bairgania Urban Center, India-Nepal",,,,,,,,,,,,,,
"Ingolstadt Urban Center, Germany",,,,,,,,,,,,,,
"Comayagua Urban Center, Honduras",,,,,,,,,,,,,,
"Koko Urban Center, Nigeria",,,,,,,,,,,,,,
"Oleksandriia Urban Center, Ukraine",,,,,,,,,,,,,,
"Yongfeng Urban Center, China",,,,,,,,,,,,,,
"York Urban Center, USA",0.17762678023138623,,0.47008072238688453,0.3074101827832053,0.2225090948299102,,,,0.7275146287814224,0.21625483387902222,0.0562305373395554,,,
"Lushan (Jiangxi Sheng) Urban Center, China",,,,,,,,,,,,,,
"Kalimva Urban Center, Democratic Republic of the Congo",,,,,,,,,,,,,,
"Suket Urban Center, India",,,,,,,,,,,,,,
"Timbuktu Urban Center, Mali",,,,,,,,,,,,,,
"Kolomna Urban Center, Russia",,,,,,,,,,,,,,
"Al Saaida Urban Center, Egypt",,,,,,,,,,,,,,
"Tabaco Urban Center, Philippines",,,,,,,,,,,,,,
"Campbelltown Urban Center, Australia",,,,,,,,,,,,,,
"Bougara Urban Center, Algeria",,,,,,,,,,,,,,
"Huaibin Urban Center, China",,,,,,,,,,,,,,
"Dadaab Urban Center, Kenya",,,,,,,,,,,,,,
"Kafr al Dayr Urban Center, Egypt",,,,,,,,,,,,,,
"Sursand Urban Center, India",,,,,,,,,,,,,,
"Wansheng Urban Center, China",,,,,,,,,,,,,,
"Masohi Urban Center, Indonesia",,,,,,,,,,,,,,
"庆安县 Urban Center, China",,,,,,,,,,,,,,
"Mechelen Urban Center, Belgium",,,,,,,,,,,,,,
"Dimitrovgrad Urban Center, Russia",,,,,,,,,,,,,,
"泉町黒須野 Urban Center, Japan",,,,,,,,,,,,,,
"Akluj Urban Center, India",,,,,,,,,,,,,,
"Mamoudzou Urban Center, France",,,,,,,,,,,,,,
"Huailai Urban Center, China",,,,,,,,,,,,,,
"La Piedad de Cabadas Urban Center, Mexico",,,,,,,,,,,,,,
"Lichuan (Hubei Sheng) Urban Center, China",,,,,,,,,,,,,,
"Kpalimé Urban Center, Togo",,,,,,,,,,,,,,
"Zhangbei Urban Center, China",,,,,,,,,,,,,,
"Maldonado Urban Center, Uruguay",,,,,,,,,,,,,,
"Olympia Urban Center, USA",0.11360490938050616,,0.3434620069366976,0.3274542752461666,0.32908371781713575,,,,0.6077205671207343,0.2846449810702512,0.10763445180901439,,,
"濠江区 Urban Center, China",,,,,,,,,,,,,,
"Songzi Urban Center, China",,,,,,,,,,,,,,
"Nakhon Sawan Urban Center, Thailand",,,,,,,,,,,,,,
"Catanduva Urban Center, Brazil",,,,,,,,,,,,,,
"Nanling Urban Center, China",,,,,,,,,,,,,,
"Sohna Urban Center, India",,,,,,,,,,,,,,
"Arnavutköy Urban Center, Turkey",,,,,,,,,,,,,,
"Baoqing Urban Center, China",,,,,,,,,,,,,,
"Senapati Urban Center, India",,,,,,,,,,,,,,
"El Vigía Urban Center, Venezuela",,,,,,,,,,,,,,
"Nawabganj Urban Center, India",,,,,,,,,,,,,,
"Stabat Urban Center, Indonesia",,,,,,,,,,,,,,
"Pingshan Urban Center, China",,,,,,,,,,,,,,
"Anak Urban Center, North Korea",,,,,,,,,,,,,,
"Udine Urban Center, Italy",,,,,,,,,,,,,,
"San Miguel de Cozumel Urban Center, Mexico",,,,,,,,,,,,,,
"Calauan Urban Center, Philippines",,,,,,,,,,,,,,
"Yuanyang Urban Center, China",,,,,,,,,,,,,,
"Erigavo Urban Center, Somalia",,,,,,,,,,,,,,
"Méagui Urban Center, Ivory Coast",,,,,,,,,,,,,,
"Santa Lucía Cotzumalguapa Urban Center, Guatemala",,,,,,,,,,,,,,
"Baia Mare Urban Center, Romania",,,,,,,,,,,,,,
"Taoyuan Urban Center, China",,,,,,,,,,,,,,
"Salmas Urban Center, Iran",,,,,,,,,,,,,,
"Serui Kota Urban Center, Indonesia",,,,,,,,,,,,,,
"Weishi Urban Center, China",,,,,,,,,,,,,,
"Fengcheng (Jiangxi Sheng) Urban Center, China",,,,,,,,,,,,,,
"Jiayu Urban Center, China",,,,,,,,,,,,,,
"Tongcheng (Anhui Sheng) Urban Center, China",,,,,,,,,,,,,,
"Yidu Urban Center, China",,,,,,,,,,,,,,
"Lucheng (Shanxi Sheng) Urban Center, China",,,,,,,,,,,,,,
"Xiaochang Urban Center, China",,,,,,,,,,,,,,
"Hukou Urban Center, China",,,,,,,,,,,,,,
"Wereta Urban Center, Ethiopia",,,,,,,,,,,,,,
"Kamianets-Podilskyi Urban Center, Ukraine",,,,,,,,,,,,,,
"Resende Urban Center, Brazil",,,,,,,,,,,,,,
"Pingluo Urban Center, China",,,,,,,,,,,,,,
"Jianyang (Fujian Sheng) Urban Center, China",,,,,,,,,,,,,,
"Sievierodonetsk Urban Center, Ukraine",,,,,,,,,,,,,,
"Gejiu Urban Center, China",,,,,,,,,,,,,,
"Kotdwar Urban Center, India",,,,,,,,,,,,,,
"Qixian (Southern Henan Sheng) Urban Center, China",,,,,,,,,,,,,,
"Valle de la Pascua Urban Center, Venezuela",,,,,,,,,,,,,,
"Pau Urban Center, France",,,,,,,,,,,,,,
"Sahaswan Urban Center, India",,,,,,,,,,,,,,
"Ede Urban Center, Nigeria",,,,,,,,,,,,,,
"Pingquan Urban Center, China",,,,,,,,,,,,,,
"Gao Urban Center, Mali",,,,,,,,,,,,,,
"Xinchengzi Urban Center, China",,,,,,,,,,,,,,
"Palitana Urban Center, India",,,,,,,,,,,,,,
"Seka Urban Center, Ethiopia",,,,,,,,,,,,,,
"Mandapeta Urban Center, India",,,,,,,,,,,,,,
"Mangaldoi Urban Center, India",,,,,,,,,,,,,,
"Kottarakara Urban Center, India",,,,,,,,,,,,,,
"Cary Urban Center, USA",0.05352192587188991,,0.19646875160997695,0.2591929270956846,0.5443383212943386,,,,0.48013279354469907,0.25805190265445294,0.261815303800848,,,
"Pyu Urban Center, Myanmar",,,,,,,,,,,,,,
"Anpara Urban Center, India",,,,,,,,,,,,,,
"Pforzheim Urban Center, Germany",,,,,,,,,,,,,,
"Mutare Urban Center, Zimbabwe",,,,,,,,,,,,,,
"Västerhaninge Urban Center, Sweden",,,,,,,,,,,,,,
"Port Arthur Urban Center, USA",0.1748239539191461,,0.45717741167780673,0.29101927610958056,0.25180331221261276,,,,0.6827118215679747,0.23049767080981196,0.08679050762221331,,,
"Santa Cruz Urban Center, USA",0.13999532453556665,,0.2866850154178269,0.24186847523851857,0.47144650934365445,,,,0.552318646642125,0.24438044244619153,0.2033009109116835,,,
"Dongchuan Urban Center, China",,,,,,,,,,,,,,
"Sancti Spiritus Urban Center, Cuba",,,,,,,,,,,,,,
"Tenkasi Urban Center, India",,,,,,,,,,,,,,
"Esteli Urban Center, Nicaragua",,,,,,,,,,,,,,
"Sheopur Urban Center, India",,,,,,,,,,,,,,
"Quốc Oai Urban Center, Vietnam",,,,,,,,,,,,,,
"Jianping Urban Center, China",,,,,,,,,,,,,,
"Daishan Urban Center, China",,,,,,,,,,,,,,
"Ningyuan Urban Center, China",,,,,,,,,,,,,,
"Jinfeng Urban Center, China",,,,,,,,,,,,,,
"Norristown Urban Center, USA",0.09464838075577224,,0.3097755993741318,0.31029478095012497,0.3799296196757432,,,,0.5703531993656696,0.2800905200836359,0.14955628055069442,,,
"Lantian (Shaanxi Sheng) Urban Center, China",,,,,,,,,,,,,,
"As Suwayda Urban Center, Syria",,,,,,,,,,,,,,
"Florence Urban Center, USA",0.08163206895808309,,0.3348183862052474,0.344057231985764,0.32112438180898867,,,,0.6406483318266828,0.2609348544102895,0.09841681376302776,,,
"Digboi Urban Center, India",,,,,,,,,,,,,,
"Xing'an Urban Center, China",,,,,,,,,,,,,,
"Georgiyevsk Urban Center, Russia",,,,,,,,,,,,,,
"Ipiales Urban Center, Colombia",,,,,,,,,,,,,,
"Hamju Urban Center, North Korea",,,,,,,,,,,,,,
"Birigui Urban Center, Brazil",,,,,,,,,,,,,,
"Facatativá Urban Center, Colombia",,,,,,,,,,,,,,
"Teresópolis Urban Center, Brazil",,,,,,,,,,,,,,
"Tecoman Urban Center, Mexico",,,,,,,,,,,,,,
"Sukorejo Urban Center, Indonesia",,,,,,,,,,,,,,
"Mongo Kamba Urban Center, Congo",,,,,,,,,,,,,,
"Tanjung Enim Urban Center, Indonesia",,,,,,,,,,,,,,
"Mekarjaya (Northern Banten) Urban Center, Indonesia",,,,,,,,,,,,,,
"Wugang (Henan Sheng) Urban Center, China",,,,,,,,,,,,,,
"Paardekraal Urban Center, South Africa",,,,,,,,,,,,,,
"Kinwat Urban Center, India",,,,,,,,,,,,,,
"Badajoz Urban Center, Spain",,,,,,,,,,,,,,
"Panna Urban Center, India",,,,,,,,,,,,,,
"Sikandra Rao Urban Center, India",,,,,,,,,,,,,,
"Ghayyadah al Gharbiyah Urban Center, Egypt",,,,,,,,,,,,,,
"Navojoa Urban Center, Mexico",,,,,,,,,,,,,,
"Balaghat Urban Center, India",,,,,,,,,,,,,,
"Winneba Urban Center, Ghana",,,,,,,,,,,,,,
"Phyongwon Urban Center, North Korea",,,,,,,,,,,,,,
"Anjar Urban Center, India",,,,,,,,,,,,,,
"Itu Urban Center, Brazil",,,,,,,,,,,,,,
"Ido Ekiti Urban Center, Nigeria",,,,,,,,,,,,,,
"Dong'e Urban Center, China",,,,,,,,,,,,,,
"Manawar Urban Center, India",,,,,,,,,,,,,,
"Nazran Urban Center, Russia",,,,,,,,,,,,,,
"Chaibasa Urban Center, India",,,,,,,,,,,,,,
"Savannakhet Urban Center, Laos-Thailand",,,,,,,,,,,,,,
"Kotabaru Urban Center, Indonesia",,,,,,,,,,,,,,
"Dhar Urban Center, India",,,,,,,,,,,,,,
"Kaliyaganj Urban Center, India",,,,,,,,,,,,,,
"Purnea Urban Center, India",,,,,,,,,,,,,,
"Tiraspol Urban Center, Moldova",,,,,,,,,,,,,,
"Chomu Urban Center, India",,,,,,,,,,,,,,
"Isna Urban Center, Egypt",,,,,,,,,,,,,,
"Linzhang Urban Center, China",,,,,,,,,,,,,,
"Idanre Urban Center, Nigeria",,,,,,,,,,,,,,
"Khemis Miliana Urban Center, Algeria",,,,,,,,,,,,,,
"Pueblo Urban Center, USA",0.21746963069890612,,0.5476296382559336,0.30378067835009864,0.14858968339396783,,,,0.7685706321963863,0.18907593485591218,0.04235343294770159,,,
"Sukoharjo Urban Center, Indonesia",,,,,,,,,,,,,,
"Quva Urban Center, Uzbekistan",,,,,,,,,,,,,,
"Marigaon Urban Center, India",,,,,,,,,,,,,,
"Baghpat (Uttar Pradesh) Urban Center, India",,,,,,,,,,,,,,
"Muroran Urban Center, Japan",,,,,,,,,,,,,,
"Puttur Urban Center, India",,,,,,,,,,,,,,
"Rubuchi Urban Center, Nigeria",,,,,,,,,,,,,,
"Andimeshk Urban Center, Iran",,,,,,,,,,,,,,
"Passos Urban Center, Brazil",,,,,,,,,,,,,,
"Jeju-si Urban Center, South Korea",,,,,,,,,,,,,,
"Tacheng/Sawesek Urban Center, China",,,,,,,,,,,,,,
"Meishan (Anhui Sheng) Urban Center, China",,,,,,,,,,,,,,
"Kumya Urban Center, North Korea",,,,,,,,,,,,,,
"Hod al Salmiya al Qibli al Gharbi Urban Center, Egypt",,,,,,,,,,,,,,
"Kawthaung Urban Center, Myanmar",,,,,,,,,,,,,,
"Barysaw Urban Center, Belarus",,,,,,,,,,,,,,
"Baturaja Urban Center, Indonesia",,,,,,,,,,,,,,
"Lishu Urban Center, China",,,,,,,,,,,,,,
"Argungu Urban Center, Nigeria",,,,,,,,,,,,,,
"Neemuch Urban Center, India",,,,,,,,,,,,,,
"Quchan Urban Center, Iran",,,,,,,,,,,,,,
"Bagé Urban Center, Brazil",,,,,,,,,,,,,,
"Piduguralla Urban Center, India",,,,,,,,,,,,,,
"Wangcheng Urban Center, China",,,,,,,,,,,,,,
"Juye Urban Center, China",,,,,,,,,,,,,,
"Karimpur Urban Center, India",,,,,,,,,,,,,,
"Kandi Urban Center, India",,,,,,,,,,,,,,
"Waku Kungo Urban Center, Angola",,,,,,,,,,,,,,
"Shuitou Urban Center, China",,,,,,,,,,,,,,
"五通桥区 Urban Center, China",,,,,,,,,,,,,,
"Ambah Urban Center, India",,,,,,,,,,,,,,
"Jiyang Urban Center, China",,,,,,,,,,,,,,
"Yima Urban Center, China",,,,,,,,,,,,,,
"Mahagi Urban Center, Democratic Republic of the Congo",,,,,,,,,,,,,,
"Pilani Urban Center, India",,,,,,,,,,,,,,
"Mogok Urban Center, Myanmar",,,,,,,,,,,,,,
"Panjunan Urban Center, Indonesia",,,,,,,,,,,,,,
"Marj Urban Center, Libya",,,,,,,,,,,,,,
"كيلو Kelo Urban Center, Chad",,,,,,,,,,,,,,
"Fatehabad (Haryāna) Urban Center, India",,,,,,,,,,,,,,
"Bodinayakkanur Urban Center, India",,,,,,,,,,,,,,
"Doğubayazıt Urban Center, Turkey",,,,,,,,,,,,,,
"Musiri Urban Center, India",,,,,,,,,,,,,,
"Milange Urban Center, Mozambique",,,,,,,,,,,,,,
"Reconquista Urban Center, Argentina",,,,,,,,,,,,,,
"Andria Urban Center, Italy",,,,,,,,,,,,,,
"Kırıkhan Urban Center, Turkey",,,,,,,,,,,,,,
"Silao Urban Center, Mexico",,,,,,,,,,,,,,
"Beanibazar Urban Center, Bangladesh",,,,,,,,,,,,,,
"Santa Rita Urban Center, Brazil",,,,,,,,,,,,,,
"Bush Urban Center, Egypt",,,,,,,,,,,,,,
"Wen Urban Center, China",,,,,,,,,,,,,,
"Wonosari Urban Center, Indonesia",,,,,,,,,,,,,,
"Shaxian Urban Center, China",,,,,,,,,,,,,,
"Boulder Urban Center, USA",0.22072472030414444,,0.3826343081780421,0.2290144954632205,0.3883511963587375,,,,0.6359458471268206,0.18866066018282146,0.17539349269035806,,,
"Lenasia Urban Center, South Africa",,,,,,,,,,,,,,
"Tang Urban Center, China",,,,,,,,,,,,,,
"Berdiansk Urban Center, Ukraine",,,,,,,,,,,,,,
"Oued Zem Urban Center, Morocco",,,,,,,,,,,,,,
"Xiuyan Urban Center, China",,,,,,,,,,,,,,
"Musoma Urban Center, Tanzania",,,,,,,,,,,,,,
"Ashkelon Urban Center, Israel",,,,,,,,,,,,,,
"Göttingen Urban Center, Germany",,,,,,,,,,,,,,
"Jalalpur Urban Center, India",,,,,,,,,,,,,,
"Kuandian Urban Center, China",,,,,,,,,,,,,,
"Tangyan Urban Center, Myanmar",,,,,,,,,,,,,,
"Maymana Urban Center, Afghanistan",,,,,,,,,,,,,,
"Xuyong Urban Center, China",,,,,,,,,,,,,,
"Ruaka Urban Center, Kenya",,,,,,,,,,,,,,
"San Félix Urban Center, Venezuela",,,,,,,,,,,,,,
"Anhua Urban Center, China",,,,,,,,,,,,,,
"Onomichi Urban Center, Japan",,,,,,,,,,,,,,
"Bafra Urban Center, Turkey",,,,,,,,,,,,,,
"Pilar Urban Center, Argentina",,,,,,,,,,,,,,
"Baneh Urban Center, Iran",,,,,,,,,,,,,,
"Gorzów Wielkopolski Urban Center, Poland",,,,,,,,,,,,,,
"Bantwal Cross Road Urban Center, India",,,,,,,,,,,,,,
"Neihuang Urban Center, China",,,,,,,,,,,,,,
"新河镇 Urban Center, China",,,,,,,,,,,,,,
"Gulistan Urban Center, Uzbekistan",,,,,,,,,,,,,,
"Honghu Urban Center, China",,,,,,,,,,,,,,
"Salto Urban Center, Brazil",,,,,,,,,,,,,,
"Nagda Urban Center, India",,,,,,,,,,,,,,
"Peddapuram Urban Center, India",,,,,,,,,,,,,,
"Fukaya Urban Center, Japan",,,,,,,,,,,,,,
"Deqing (Guangdong Sheng) Urban Center, China",,,,,,,,,,,,,,
"Hexian Urban Center, China",,,,,,,,,,,,,,
"Três Lagoas Urban Center, Brazil",,,,,,,,,,,,,,
"Delingat Urban Center, Egypt",,,,,,,,,,,,,,
"Repentigny Urban Center, Canada",,0.02701497147479156,,,,0.1948422051550147,0.3541853051533684,0.4509724896916171,,,,0.5588346832331409,0.3526888819175682,0.08847643484929078
"Ardakan Urban Center, Iran",,,,,,,,,,,,,,
"Iltifatganj Urban Center, India",,,,,,,,,,,,,,
"Huarong (Hubei Sheng) Urban Center, China",,,,,,,,,,,,,,
"Fairfield Urban Center, USA",0.11096819605983899,,0.29229664369514774,0.3274314232131166,0.3802719330917357,,,,0.6543015611331194,0.2532553705584636,0.09244306830841698,,,
"Stuart Urban Center, USA",0.12302844360211161,,0.4031044088044891,0.3079887904939612,0.2889068007015497,,,,0.6821989636417,0.21279660963405822,0.1050044267242418,,,
"Vicenza Urban Center, Italy",,,,,,,,,,,,,,
"Chenxi Urban Center, China",,,,,,,,,,,,,,
"Mendi Urban Center, Papua New Guinea",,,,,,,,,,,,,,
"Kahama Urban Center, Tanzania",,,,,,,,,,,,,,
"Gangoh Urban Center, India",,,,,,,,,,,,,,
"Trois-Rivières Urban Center, Canada",,0.06699573222428934,,,,0.45867516325337704,0.3338600842862462,0.20746475246037677,,,,0.696913885057936,0.2522638730648864,0.0508222418771777
"Akçaabat Urban Center, Turkey",,,,,,,,,,,,,,
"Asamankese Urban Center, Ghana",,,,,,,,,,,,,,
"Tyre Urban Center, Lebanon",,,,,,,,,,,,,,
"Laoting Urban Center, China",,,,,,,,,,,,,,
"Godda Urban Center, India",,,,,,,,,,,,,,
"Kibre Mengist Urban Center, Ethiopia",,,,,,,,,,,,,,
"Rudauli Urban Center, India",,,,,,,,,,,,,,
"Al Qurayyat Urban Center, Saudi Arabia",,,,,,,,,,,,,,
"崇福镇 Urban Center, China",,,,,,,,,,,,,,
"Sagamu Urban Center, Nigeria",,,,,,,,,,,,,,
"Ahar Urban Center, Iran",,,,,,,,,,,,,,
"Pringsewu Urban Center, Indonesia",,,,,,,,,,,,,,
"Bandipora Urban Center, India",,,,,,,,,,,,,,
"Okwuohia Urban Center, Nigeria",,,,,,,,,,,,,,
"Tanjung Pinang Urban Center, Indonesia",,,,,,,,,,,,,,
"Charleston Urban Center, USA",0.23709431601840544,,0.5191645224995234,0.2680861241692242,0.2127493533312524,,,,0.7351167620081563,0.1764343076097012,0.08844893038214238,,,
"Xinfeng (Guangdong Sheng) Urban Center, China",,,,,,,,,,,,,,
"Dharmavaram Urban Center, India",,,,,,,,,,,,,,
"Nazlet al Khalayfa Urban Center, Egypt",,,,,,,,,,,,,,
"Pithapuram Urban Center, India",,,,,,,,,,,,,,
"Botoșani Urban Center, Romania",,,,,,,,,,,,,,
"Injerak Urban Center, Afghanistan",,,,,,,,,,,,,,
"Aqaba Urban Center, Jordan",,,,,,,,,,,,,,
"Neem Ka Thana Urban Center, India",,,,,,,,,,,,,,
"Tandil Urban Center, Argentina",,,,,,,,,,,,,,
"Bori Urban Center, Nigeria",,,,,,,,,,,,,,
"Yacuiba Urban Center, Argentina-Bolivia",,,,,,,,,,,,,,
"成武县 Urban Center, China",,,,,,,,,,,,,,
"Mukalla Urban Center, Yemen",,,,,,,,,,,,,,
"Tuga Nama Urban Center, Nigeria",,,,,,,,,,,,,,
"Xiongxiangcun Urban Center, China",,,,,,,,,,,,,,
"Ponce Urban Center, USA",0.5188478865971912,,0.8521214949856122,0.11159658681092585,0.036281918203461945,,,,0.9363618282743039,0.050529398489914376,0.013108773235781595,,,
"Brianka Urban Center, Ukraine",,,,,,,,,,,,,,
"`Uthman Urban Center, Syria",,,,,,,,,,,,,,
"Cili Urban Center, China",,,,,,,,,,,,,,
"Pukhrayan Urban Center, India",,,,,,,,,,,,,,
"琯头镇 Urban Center, China",,,,,,,,,,,,,,
"Huanghua Urban Center, China",,,,,,,,,,,,,,
"Bangkalan Urban Center, Indonesia",,,,,,,,,,,,,,
"Nanxiong Urban Center, China",,,,,,,,,,,,,,
"Wakama Urban Center, Nigeria",,,,,,,,,,,,,,
"Maharajganj (Bihār) Urban Center, India",,,,,,,,,,,,,,
"Ishiagu Urban Center, Nigeria",,,,,,,,,,,,,,
"Rayong Urban Center, Thailand",,,,,,,,,,,,,,
"Planaltina (Distrito Federal) Urban Center, Brazil",,,,,,,,,,,,,,
"Wenshang Urban Center, China",,,,,,,,,,,,,,
"Demak Urban Center, Indonesia",,,,,,,,,,,,,,
"Al Milhi Urban Center, Yemen",,,,,,,,,,,,,,
"Kakdwip Urban Center, India",,,,,,,,,,,,,,
"Xiangyun Urban Center, China",,,,,,,,,,,,,,
"Sittwe Urban Center, Myanmar",,,,,,,,,,,,,,
"Qianshan Urban Center, China",,,,,,,,,,,,,,
"Chungju-si Urban Center, South Korea",,,,,,,,,,,,,,
"Hoshangabad Urban Center, India",,,,,,,,,,,,,,
"Waterbury Urban Center, USA",0.2139128711770357,,0.5158709261750534,0.2926860741706111,0.19144299965433556,,,,0.7428019332422777,0.20755222381647992,0.0496458429412423,,,
"Wangjiang Urban Center, China",,,,,,,,,,,,,,
"Joura Urban Center, India",,,,,,,,,,,,,,
"Akim Oda Urban Center, Ghana",,,,,,,,,,,,,,
"Khartsyzk Urban Center, Ukraine",,,,,,,,,,,,,,
"El Kelaa des Sraghna Urban Center, Morocco",,,,,,,,,,,,,,
"Hongjiang Urban Center, China",,,,,,,,,,,,,,
"Gutian Urban Center, China",,,,,,,,,,,,,,
"Abu Tig Urban Center, Egypt",,,,,,,,,,,,,,
"Obinomba Urban Center, Nigeria",,,,,,,,,,,,,,
"Calumpit Urban Center, Philippines",,,,,,,,,,,,,,
"Zhengyang Urban Center, China",,,,,,,,,,,,,,
"Wuyang Urban Center, China",,,,,,,,,,,,,,
"Bhamo Urban Center, Myanmar",,,,,,,,,,,,,,
"Suizhong Urban Center, China",,,,,,,,,,,,,,
"Hossana Urban Center, Ethiopia",,,,,,,,,,,,,,
"Biruaca Urban Center, Venezuela",,,,,,,,,,,,,,
"Apucarana Urban Center, Brazil",,,,,,,,,,,,,,
"Khuzdar Urban Center, Pakistan",,,,,,,,,,,,,,
"Al Arish Urban Center, Egypt",,,,,,,,,,,,,,
"青秀区 Urban Center, China",,,,,,,,,,,,,,
"Mmopane Urban Center, Botswana",,,,,,,,,,,,,,
"Ndiuka Urban Center, Tanzania",,,,,,,,,,,,,,
"Huaining Urban Center, China",,,,,,,,,,,,,,
"Granada Urban Center, Nicaragua",,,,,,,,,,,,,,
"Rano Urban Center, Nigeria",,,,,,,,,,,,,,
"Changtu Urban Center, China",,,,,,,,,,,,,,
"Bontang Urban Center, Indonesia",,,,,,,,,,,,,,
"Sithana Urban Center, India",,,,,,,,,,,,,,
"Mazatenango Urban Center, Guatemala",,,,,,,,,,,,,,
"Las Anod Urban Center, Somalia",,,,,,,,,,,,,,
"Meftah Urban Center, Algeria",,,,,,,,,,,,,,
"Errachidia Urban Center, Morocco",,,,,,,,,,,,,,
"Gopalganj Urban Center, India",,,,,,,,,,,,,,
"Luoxiong Urban Center, China",,,,,,,,,,,,,,
"Sharurah Urban Center, Saudi Arabia",,,,,,,,,,,,,,
"Nanxi Urban Center, China",,,,,,,,,,,,,,
"Fotang Urban Center, China",,,,,,,,,,,,,,
"Xixiang Urban Center, China",,,,,,,,,,,,,,
"Lancaster Urban Center, United Kingdom",,,,,,,,,,,,,,
"Dhire Kot Urban Center, India",,,,,,,,,,,,,,
"Otaru Urban Center, Japan",,,,,,,,,,,,,,
"Guangshan Urban Center, China",,,,,,,,,,,,,,
"Wałbrzych Urban Center, Poland",,,,,,,,,,,,,,
"Asosa Urban Center, Ethiopia",,,,,,,,,,,,,,
"Shahrud Urban Center, Iran",,,,,,,,,,,,,,
"She Urban Center, China",,,,,,,,,,,,,,
"Leping (Guangdong Sheng) Urban Center, China",,,,,,,,,,,,,,
"Banyo Urban Center, Cameroon",,,,,,,,,,,,,,
"Ogwashi Uku Urban Center, Nigeria",,,,,,,,,,,,,,
"Nahodka Urban Center, Russia",,,,,,,,,,,,,,
"威宁县 Urban Center, China",,,,,,,,,,,,,,
"Xiazhou Urban Center, China",,,,,,,,,,,,,,
"Tongjiang Urban Center, China",,,,,,,,,,,,,,
"Ihnasya al Madinah Urban Center, Egypt",,,,,,,,,,,,,,
"Mecheria Urban Center, Algeria",,,,,,,,,,,,,,
"Bondoukou Urban Center, Ivory Coast",,,,,,,,,,,,,,
"Al Rahad Urban Center, Sudan",,,,,,,,,,,,,,
"Shangli Urban Center, China",,,,,,,,,,,,,,
"Wakema Urban Center, Myanmar",,,,,,,,,,,,,,
"Tepi Urban Center, Ethiopia",,,,,,,,,,,,,,
"Xiushan Urban Center, China",,,,,,,,,,,,,,
"Valencia Urban Center, Philippines",,,,,,,,,,,,,,
"Jinsha Urban Center, China",,,,,,,,,,,,,,
"Fethiye Urban Center, Turkey",,,,,,,,,,,,,,
"Asassa Urban Center, Ethiopia",,,,,,,,,,,,,,
"Shahr-e Kord Urban Center, Iran",,,,,,,,,,,,,,
"Ganda Urban Center, Angola",,,,,,,,,,,,,,
"Vigan Urban Center, Philippines",,,,,,,,,,,,,,
"Medford Urban Center, USA",0.14060303615346584,,0.4396413256939592,0.34663180065857785,0.21372687364746293,,,,0.7359773161418908,0.2086759356017315,0.0553467482563777,,,
"Kisii Urban Center, Kenya",,,,,,,,,,,,,,
"Masuri Urban Center, Nigeria",,,,,,,,,,,,,,
"Ji-Paraná Urban Center, Brazil",,,,,,,,,,,,,,
"Bagh-e Zahra Urban Center, Iran",,,,,,,,,,,,,,
"Banzeng Urban Center, China",,,,,,,,,,,,,,
"Laem Chabang Urban Center, Thailand",,,,,,,,,,,,,,
"Haveri Urban Center, India",,,,,,,,,,,,,,
"Pengshui Urban Center, China",,,,,,,,,,,,,,
"Stevenage Urban Center, United Kingdom",,,,,,,,,,,,,,
"Pangkajene (Southern Sulawesi Selatan) Urban Center, Indonesia",,,,,,,,,,,,,,
"Vahdat Urban Center, Tajikistan",,,,,,,,,,,,,,
"Jagatsinghpur Urban Center, India",,,,,,,,,,,,,,
"La Louvière Urban Center, Belgium",,,,,,,,,,,,,,
"Xinning (Jiangxi Sheng) Urban Center, China",,,,,,,,,,,,,,
"Una (Gujarāt) Urban Center, India",,,,,,,,,,,,,,
"Kotkapura Urban Center, India",,,,,,,,,,,,,,
"Lạng Sơn Urban Center, Vietnam",,,,,,,,,,,,,,
"Urgut Urban Center, Uzbekistan",,,,,,,,,,,,,,
"কালীগঞ্জ Urban Center, Bangladesh",,,,,,,,,,,,,,
"Iğdır Urban Center, Turkey",,,,,,,,,,,,,,
"Xiyang Urban Center, China",,,,,,,,,,,,,,
"Poitiers Urban Center, France",,,,,,,,,,,,,,
"Boditi Urban Center, Ethiopia",,,,,,,,,,,,,,
"São Sebastião Urban Center, Brazil",,,,,,,,,,,,,,
"Phyongsan Urban Center, North Korea",,,,,,,,,,,,,,
"Narwana Urban Center, India",,,,,,,,,,,,,,
"Leeuwarden Urban Center, Netherlands",,,,,,,,,,,,,,
"Sabha Urban Center, Libya",,,,,,,,,,,,,,
"Xinjiang Urban Center, China",,,,,,,,,,,,,,
"Shubra Khit Urban Center, Egypt",,,,,,,,,,,,,,
"Curicó Urban Center, Chile",,,,,,,,,,,,,,
"Sunam Urban Center, India",,,,,,,,,,,,,,
"Örebro Urban Center, Sweden",,,,,,,,,,,,,,
"Raha Urban Center, Indonesia",,,,,,,,,,,,,,
"Worcester Urban Center, United Kingdom",,,,,,,,,,,,,,
"Mianzhu Urban Center, China",,,,,,,,,,,,,,
"Pingyuan Urban Center, China",,,,,,,,,,,,,,
"Gummi Urban Center, Nigeria",,,,,,,,,,,,,,
"Aruppukkottai Urban Center, India",,,,,,,,,,,,,,
"Dafang Urban Center, China",,,,,,,,,,,,,,
"Meru Urban Center, Kenya",,,,,,,,,,,,,,
"Rada'a Urban Center, Yemen",,,,,,,,,,,,,,
"Salon Urban Center, India",,,,,,,,,,,,,,
"Amasya Urban Center, Turkey",,,,,,,,,,,,,,
"Kyaukme Urban Center, Myanmar",,,,,,,,,,,,,,
"Dajie Urban Center, China",,,,,,,,,,,,,,
"Wannian Urban Center, China",,,,,,,,,,,,,,
