"Ashburn Urban Center, USA",0.030573136723452507,,0.10179663968609366,0.1578146075784032,0.7403887527355031,,,,0.37885944950212,0.24933469227383395,0.37180585822404594,,,
"Xiuwen Urban Center, China",,,,,,,,,,,,,,
"Guarapari Urban Center, Brazil",,,,,,,,,,,,,,
"Bordj Menaiel Urban Center, Algeria",,,,,,,,,,,,,,
"Mazabuka Urban Center, Zambia",,,,,,,,,,,,,,
"Nchelenge Urban Center, Zambia",,,,,,,,,,,,,,
"Gandia Urban Center, Spain",,,,,,,,,,,,,,
"Baiquan Urban Center, China",,,,,,,,,,,,,,
"An Numaniyah Urban Center, Iraq",,,,,,,,,,,,,,
"Bignona Urban Center, Senegal",,,,,,,,,,,,,,
"Sahuayo de Morelos Urban Center, Mexico",,,,,,,,,,,,,,
"Ferizaj Urban Center, Serbia",,,,,,,,,,,,,,
"Xianfeng Urban Center, China",,,,,,,,,,,,,,
"Жуково Urban Center, Russia",,,,,,,,,,,,,,
"Shouyang Urban Center, China",,,,,,,,,,,,,,
"Anliu Urban Center, China",,,,,,,,,,,,,,
"Lorica Urban Center, Colombia",,,,,,,,,,,,,,
"São João del-Rei Urban Center, Brazil",,,,,,,,,,,,,,
"An Khê Urban Center, Vietnam",,,,,,,,,,,,,,
"Târgoviște Urban Center, Romania",,,,,,,,,,,,,,
"Medenine Urban Center, Tunisia",,,,,,,,,,,,,,
"Hamilton Urban Center, United Kingdom",,,,,,,,,,,,,,
"Shapar - Veraval Urban Center, India",,,,,,,,,,,,,,
"Al ‘Azīzīyah Urban Center, Iraq",,,,,,,,,,,,,,
"Bairin Right Banner Urban Center, China",,,,,,,,,,,,,,
"Humanabad Urban Center, India",,,,,,,,,,,,,,
"Barhiya Urban Center, India",,,,,,,,,,,,,,
"Tonghua (Western Jilin Sheng) Urban Center, China",,,,,,,,,,,,,,
"Royal Tunbridge Wells Urban Center, United Kingdom",,,,,,,,,,,,,,
"Challakere Urban Center, India",,,,,,,,,,,,,,
"Olavarría Urban Center, Argentina",,,,,,,,,,,,,,
"Butondo Urban Center, Democratic Republic of the Congo",,,,,,,,,,,,,,
"Isarun Urban Center, Nigeria",,,,,,,,,,,,,,
"Yanjin Urban Center, China",,,,,,,,,,,,,,
"Dhaka Urban Center, India",,,,,,,,,,,,,,
"Bouar Urban Center, Central African Republic",,,,,,,,,,,,,,
"Itajubá Urban Center, Brazil",,,,,,,,,,,,,,
"Una (Himāchal Pradesh) Urban Center, India",,,,,,,,,,,,,,
"Kakenge Urban Center, Democratic Republic of the Congo",,,,,,,,,,,,,,
"Malacatán Urban Center, Guatemala",,,,,,,,,,,,,,
"Irun Urban Center, Spain-France",,,,,,,,,,,,,,
"Mindelo Urban Center, Cape Verde",,,,,,,,,,,,,,
"Gebre gurach Urban Center, Ethiopia",,,,,,,,,,,,,,
"Nyeri Urban Center, Kenya",,,,,,,,,,,,,,
"Delmenhorst Urban Center, Germany",,,,,,,,,,,,,,
"Salaga Urban Center, Ghana",,,,,,,,,,,,,,
"Giade Urban Center, Nigeria",,,,,,,,,,,,,,
"Daurala Urban Center, India",,,,,,,,,,,,,,
"Anguo Urban Center, China",,,,,,,,,,,,,,
"Botshabelo Rural Urban Center, South Africa",,,,,,,,,,,,,,
"Uzun Urban Center, Uzbekistan",,,,,,,,,,,,,,
"Bitola Urban Center, North Macedonia",,,,,,,,,,,,,,
"Paranavaí Urban Center, Brazil",,,,,,,,,,,,,,
"Miri Urban Center, Malaysia",,,,,,,,,,,,,,
"União da Vitória Urban Center, Brazil",,,,,,,,,,,,,,
"Tumbaco Urban Center, Ecuador",,,,,,,,,,,,,,
"Gbadolite Urban Center, Democratic Republic of the Congo",,,,,,,,,,,,,,
"Umred Urban Center, India",,,,,,,,,,,,,,
"Konongo Urban Center, Ghana",,,,,,,,,,,,,,
"Ruyang Urban Center, China",,,,,,,,,,,,,,
"Vakhsh Urban Center, Tajikistan",,,,,,,,,,,,,,
"Hà Tĩnh Urban Center, Vietnam",,,,,,,,,,,,,,
"Mitrovicë Urban Center, Serbia",,,,,,,,,,,,,,
"Lodi Urban Center, USA",0.14760985398959298,,0.3576086464378873,0.3113692290899395,0.3310221244721732,,,,0.6691981766133034,0.22869032686833252,0.10211149651836397,,,
"Massinga Urban Center, Mozambique",,,,,,,,,,,,,,
"Lingwu Urban Center, China",,,,,,,,,,,,,,
"Huating Urban Center, China",,,,,,,,,,,,,,
"La Croix Urban Center, Haiti",,,,,,,,,,,,,,
"Calulo Urban Center, Angola",,,,,,,,,,,,,,
"Didimtu Urban Center, Ethiopia",,,,,,,,,,,,,,
"Isahaya Urban Center, Japan",,,,,,,,,,,,,,
"Bafatá Urban Center, Guinea-Bissau",,,,,,,,,,,,,,
"Dédougou Urban Center, Burkina Faso",,,,,,,,,,,,,,
"Chachoengsao Urban Center, Thailand",,,,,,,,,,,,,,
"Qinggang Urban Center, China",,,,,,,,,,,,,,
"Umarkhed Urban Center, India",,,,,,,,,,,,,,
"Jangareddygudem Urban Center, India",,,,,,,,,,,,,,
"Maguan Urban Center, China",,,,,,,,,,,,,,
"Yokoo Urban Center, Japan",,,,,,,,,,,,,,
"Puerto Cortés Urban Center, Honduras",,,,,,,,,,,,,,
"Tipaturu Urban Center, India",,,,,,,,,,,,,,
"Dedaye Urban Center, Myanmar",,,,,,,,,,,,,,
"Gbarnga Urban Center, Liberia",,,,,,,,,,,,,,
"Musanze Urban Center, Rwanda",,,,,,,,,,,,,,
"Bender Urban Center, Moldova",,,,,,,,,,,,,,
"Brajarajnagar Urban Center, India",,,,,,,,,,,,,,
"Guildford Urban Center, United Kingdom",,,,,,,,,,,,,,
"Toliara Urban Center, Madagascar",,,,,,,,,,,,,,
"Badulla Urban Center, Sri Lanka",,,,,,,,,,,,,,
"Mao Urban Center, Dominican Republic",,,,,,,,,,,,,,
"Laifeng (Hubei Sheng-Hunan Sheng) Urban Center, China",,,,,,,,,,,,,,
"Karang Baru Urban Center, Indonesia",,,,,,,,,,,,,,
"Zrenjanin Urban Center, Serbia",,,,,,,,,,,,,,
"Tecate Urban Center, Mexico-USA",,,,,,,,,,,,,,
"Palm Coast Urban Center, USA",0.1018325393563951,,0.40579604907081834,0.3138233320422057,0.28038061888697596,,,,0.7111038488770725,0.2053149145937907,0.08358123652913689,,,
"Baishui Urban Center, China",,,,,,,,,,,,,,
"Al Qatn Urban Center, Yemen",,,,,,,,,,,,,,
"Qixian (Northern Henan Sheng) Urban Center, China",,,,,,,,,,,,,,
"Barentu Urban Center, Eritrea",,,,,,,,,,,,,,
"Playa Blanca Urban Center, Colombia",,,,,,,,,,,,,,
"Sidi Aissa Urban Center, Algeria",,,,,,,,,,,,,,
"Fengqiao Urban Center, China",,,,,,,,,,,,,,
"Burton-on-Trent Urban Center, United Kingdom",,,,,,,,,,,,,,
"Agwa Urban Center, Nigeria",,,,,,,,,,,,,,
"Iguatu Urban Center, Brazil",,,,,,,,,,,,,,
"Nahavand Urban Center, Iran",,,,,,,,,,,,,,
"Richard-Toll Urban Center, Senegal",,,,,,,,,,,,,,
"招信镇 Urban Center, China",,,,,,,,,,,,,,
"Tam Quan Urban Center, Vietnam",,,,,,,,,,,,,,
"Nippani Urban Center, India",,,,,,,,,,,,,,
"Ghaliya Urban Center, Sudan",,,,,,,,,,,,,,
"Shrewsbury Urban Center, United Kingdom",,,,,,,,,,,,,,
"Datian Urban Center, China",,,,,,,,,,,,,,
"Zhongxin Urban Center, China",,,,,,,,,,,,,,
"Metu Urban Center, Ethiopia",,,,,,,,,,,,,,
"Yellandu Urban Center, India",,,,,,,,,,,,,,
"Fakfak Urban Center, Indonesia",,,,,,,,,,,,,,
"Qingyang (Jiangsu Sheng) Urban Center, China",,,,,,,,,,,,,,
"Porto Seguro Urban Center, Brazil",,,,,,,,,,,,,,
"Santa Inês Urban Center, Brazil",,,,,,,,,,,,,,
"Mansa (Gujarāt) Urban Center, India",,,,,,,,,,,,,,
"Gießen Urban Center, Germany",,,,,,,,,,,,,,
"Natitingou Urban Center, Benin",,,,,,,,,,,,,,
"Nattalin Urban Center, Myanmar",,,,,,,,,,,,,,
"Nowshera Virkan Urban Center, Pakistan",,,,,,,,,,,,,,
"Tongxu Urban Center, China",,,,,,,,,,,,,,
"Nova Serrana Urban Center, Brazil",,,,,,,,,,,,,,
"San Carlos Urban Center, Philippines",,,,,,,,,,,,,,
"Manzil Bourguiba Urban Center, Tunisia",,,,,,,,,,,,,,
"Çankırı Urban Center, Turkey",,,,,,,,,,,,,,
"Polvilho Urban Center, Brazil",,,,,,,,,,,,,,
"Tafawa-Balewa Urban Center, Nigeria",,,,,,,,,,,,,,
"棘洪滩街道 Urban Center, China",,,,,,,,,,,,,,
"Jhargram Urban Center, India",,,,,,,,,,,,,,
"Peddapalli Urban Center, India",,,,,,,,,,,,,,
"Usulután Urban Center, El Salvador",,,,,,,,,,,,,,
"Qiaotou (Zhejiang Sheng) Urban Center, China",,,,,,,,,,,,,,
"Bolgatanga Urban Center, Ghana",,,,,,,,,,,,,,
"Makanza Urban Center, Democratic Republic of the Congo",,,,,,,,,,,,,,
"Redenção Urban Center, Brazil",,,,,,,,,,,,,,
"Slavyansk-na-Kubani Urban Center, Russia",,,,,,,,,,,,,,
"魏桥镇 Urban Center, China",,,,,,,,,,,,,,
"Kuichong Sub-district Urban Center, China",,,,,,,,,,,,,,
"Zenica Urban Center, Bosnia and Herzegovina",,,,,,,,,,,,,,
"Masvingo Urban Center, Zimbabwe",,,,,,,,,,,,,,
"Pulivendula Urban Center, India",,,,,,,,,,,,,,
"良庆区 Urban Center, China",,,,,,,,,,,,,,
"Rishton Urban Center, United Kingdom",,,,,,,,,,,,,,
"Azua Urban Center, Dominican Republic",,,,,,,,,,,,,,
"Talcher Urban Center, India",,,,,,,,,,,,,,
"Zhudong Urban Center, China",,,,,,,,,,,,,,
"Ongjin Urban Center, North Korea",,,,,,,,,,,,,,
"Luomen Urban Center, China",,,,,,,,,,,,,,
"Quanzhou (Guangxi Zhuangzu Zizhiqu) Urban Center, China",,,,,,,,,,,,,,
"Avilés Urban Center, Spain",,,,,,,,,,,,,,
"Safipur Urban Center, India",,,,,,,,,,,,,,
"Huehuetenango Urban Center, Guatemala",,,,,,,,,,,,,,
"Alphen aan den Rijn Urban Center, Netherlands",,,,,,,,,,,,,,
"El Puerto de Santa María Urban Center, Spain",,,,,,,,,,,,,,
"Liucun Urban Center, China",,,,,,,,,,,,,,
"Shexian Urban Center, China",,,,,,,,,,,,,,
"Pucheng (Fujian Sheng) Urban Center, China",,,,,,,,,,,,,,
"Xikou Urban Center, China",,,,,,,,,,,,,,
"Serov Urban Center, Russia",,,,,,,,,,,,,,
"Katoro Urban Center, Tanzania",,,,,,,,,,,,,,
"Quzhou (Hebei Sheng) Urban Center, China",,,,,,,,,,,,,,
"Kempten (Allgäu) Urban Center, Germany",,,,,,,,,,,,,,
"Kanyabayonga Urban Center, Democratic Republic of the Congo",,,,,,,,,,,,,,
"Santa Cruz del Quiché Urban Center, Guatemala",,,,,,,,,,,,,,
"Kirishima Urban Center, Japan",,,,,,,,,,,,,,
"Dungun Urban Center, Malaysia",,,,,,,,,,,,,,
"Pervomaisk Urban Center, Ukraine",,,,,,,,,,,,,,
"Hòa Bình Urban Center, Vietnam",,,,,,,,,,,,,,
"院桥镇 Urban Center, China",,,,,,,,,,,,,,
"Caxito Urban Center, Angola",,,,,,,,,,,,,,
"Ifakara Urban Center, Tanzania",,,,,,,,,,,,,,
"Kalyanpur Urban Center, India",,,,,,,,,,,,,,
"Nkoranza Urban Center, Ghana",,,,,,,,,,,,,,
"Kanigiri Urban Center, India",,,,,,,,,,,,,,
"Vikramasingapuram Urban Center, India",,,,,,,,,,,,,,
"Lijiazui Urban Center, China",,,,,,,,,,,,,,
"Xia Urban Center, China",,,,,,,,,,,,,,
"Pardubice Urban Center, Czech Republic",,,,,,,,,,,,,,
"Inowrocław Urban Center, Poland",,,,,,,,,,,,,,
"Jhinjhak Urban Center, India",,,,,,,,,,,,,,
"Mithapur Urban Center, India",,,,,,,,,,,,,,
"Lakuwe Urban Center, Nigeria",,,,,,,,,,,,,,
"Ngong Urban Center, Kenya",,,,,,,,,,,,,,
"Mossel Bay Urban Center, South Africa",,,,,,,,,,,,,,
"Xiecun Urban Center, China",,,,,,,,,,,,,,
"Isfara Urban Center, Tajikistan",,,,,,,,,,,,,,
"Calbayog Urban Center, Philippines",,,,,,,,,,,,,,
"Caldas Urban Center, Colombia",,,,,,,,,,,,,,
"Freiburg im Üechtland Urban Center, Switzerland",,,,,,,,,,,,,,
"Dayangshu Urban Center, China",,,,,,,,,,,,,,
"Jendouba Urban Center, Tunisia",,,,,,,,,,,,,,
"Vélingara Urban Center, Senegal",,,,,,,,,,,,,,
"Arbe Gona Urban Center, Ethiopia",,,,,,,,,,,,,,
"Linkou Urban Center, China",,,,,,,,,,,,,,
"Diphu Urban Center, India",,,,,,,,,,,,,,
"Apalit Urban Center, Philippines",,,,,,,,,,,,,,
"Helmond Urban Center, Netherlands",,,,,,,,,,,,,,
"Dinalupihan Urban Center, Philippines",,,,,,,,,,,,,,
"Gossaigaon Urban Center, India",,,,,,,,,,,,,,
"Durham Urban Center, USA",0.2703306182322402,,0.5598290073612217,0.23528896263984686,0.2048820299989315,,,,0.7335517884879758,0.17935987015103175,0.08708834136099255,,,
"Xonacatlán Urban Center, Mexico",,,,,,,,,,,,,,
"Venado Tuerto Urban Center, Argentina",,,,,,,,,,,,,,
"Great Yarmouth Urban Center, United Kingdom",,,,,,,,,,,,,,
"Yanchi Urban Center, China",,,,,,,,,,,,,,
"Bognor Regis Urban Center, United Kingdom",,,,,,,,,,,,,,
"Shamsabad Urban Center, India",,,,,,,,,,,,,,
"Jarqurgon Urban Center, Uzbekistan",,,,,,,,,,,,,,
"9th Urban Center, Egypt",,,,,,,,,,,,,,
"Xiaohe Urban Center, China",,,,,,,,,,,,,,
"Bushehr Urban Center, Iran",,,,,,,,,,,,,,
"Deroua Urban Center, Morocco",,,,,,,,,,,,,,
"Fatehpora Urban Center, India",,,,,,,,,,,,,,
"Islamnagar Urban Center, India",,,,,,,,,,,,,,
"Sihora Urban Center, India",,,,,,,,,,,,,,
"Nuzvid Urban Center, India",,,,,,,,,,,,,,
"Taitung Urban Center, China",,,,,,,,,,,,,,
"Shangdang Urban Center, China",,,,,,,,,,,,,,
"Majenang Urban Center, Indonesia",,,,,,,,,,,,,,
"Luján Urban Center, Argentina",,,,,,,,,,,,,,
"Dias d'Ávila Urban Center, Brazil",,,,,,,,,,,,,,
"Sinhung Urban Center, North Korea",,,,,,,,,,,,,,
"Morrumbala Urban Center, Mozambique",,,,,,,,,,,,,,
"Lucapa Urban Center, Angola",,,,,,,,,,,,,,
"白溪村 Urban Center, China",,,,,,,,,,,,,,
"Candelaria Urban Center, Philippines",,,,,,,,,,,,,,
"Lorain Urban Center, USA",0.26091636783065564,,0.5833074197962966,0.28526109515813364,0.13143148504556984,,,,0.8050103310671531,0.1640705987770574,0.030919070155789465,,,
"Jenin Urban Center, State of Palestine",,,,,,,,,,,,,,
"Wettingen Urban Center, Switzerland",,,,,,,,,,,,,,
"Érd Urban Center, Hungary",,,,,,,,,,,,,,
"Fatick Urban Center, Senegal",,,,,,,,,,,,,,
"Safur Urban Center, Egypt",,,,,,,,,,,,,,
"华亭村 Urban Center, China",,,,,,,,,,,,,,
"Tataouine Urban Center, Tunisia",,,,,,,,,,,,,,
"Tambakrejo Urban Center, Indonesia",,,,,,,,,,,,,,
"Định Quán Urban Center, Vietnam",,,,,,,,,,,,,,
"Cubatão Urban Center, Brazil",,,,,,,,,,,,,,
"Matian Urban Center, China",,,,,,,,,,,,,,
"Wencheng Urban Center, China",,,,,,,,,,,,,,
"Yongshun Urban Center, China",,,,,,,,,,,,,,
"Tilda Neora Urban Center, India",,,,,,,,,,,,,,
"Qipanjing Urban Center, China",,,,,,,,,,,,,,
"Al Zayyatin al Qibliyah Urban Center, Egypt",,,,,,,,,,,,,,
"Izbat al Hawwashah Urban Center, Egypt",,,,,,,,,,,,,,
"Abu Kamal Urban Center, Syria",,,,,,,,,,,,,,
"Puerto Barrios Urban Center, Guatemala",,,,,,,,,,,,,,
"Wolfsburg Urban Center, Germany",,,,,,,,,,,,,,
"Chone Urban Center, Ecuador",,,,,,,,,,,,,,
"Rupnagar Urban Center, India",,,,,,,,,,,,,,
"Trindade Urban Center, Brazil",,,,,,,,,,,,,,
"Mahgawan Urban Center, India",,,,,,,,,,,,,,
"Gela Urban Center, Italy",,,,,,,,,,,,,,
"Tagawa Urban Center, Japan",,,,,,,,,,,,,,
"Itiya Urban Center, Ethiopia",,,,,,,,,,,,,,
"Pulwama Urban Center, India",,,,,,,,,,,,,,
"Aketi Urban Center, Democratic Republic of the Congo",,,,,,,,,,,,,,
"Oke Atan Urban Center, Nigeria",,,,,,,,,,,,,,
"Belfort Urban Center, France",,,,,,,,,,,,,,
"Kandiaro Urban Center, Pakistan",,,,,,,,,,,,,,
"Dinalaoan Urban Center, Philippines",,,,,,,,,,,,,,
"Dongfeng Urban Center, China",,,,,,,,,,,,,,
"Huji Urban Center, China",,,,,,,,,,,,,,
"Khoái Châu Urban Center, Vietnam",,,,,,,,,,,,,,
"Ijuí Urban Center, Brazil",,,,,,,,,,,,,,
"Periyakulam Urban Center, India",,,,,,,,,,,,,,
"Siguatepeque Urban Center, Honduras",,,,,,,,,,,,,,
"Hradec Králové Urban Center, Czech Republic",,,,,,,,,,,,,,
"Dera Urban Center, Ethiopia",,,,,,,,,,,,,,
"Tetovo Urban Center, North Macedonia",,,,,,,,,,,,,,
"Shushah Urban Center, Egypt",,,,,,,,,,,,,,
"Arima Urban Center, Trinidad and Tobago",,,,,,,,,,,,,,
"Ruwa Urban Center, Zimbabwe",,,,,,,,,,,,,,
"Nilanga Urban Center, India",,,,,,,,,,,,,,
"Manteca Urban Center, USA",0.11894188851470239,,0.31013297846133375,0.3392041112934133,0.350662910245253,,,,0.6385620575045475,0.24566002471680393,0.11577791777864853,,,
"Krasnodon Urban Center, Ukraine",,,,,,,,,,,,,,
"Cây Xăng Urban Center, Vietnam",,,,,,,,,,,,,,
"Huoshan Urban Center, China",,,,,,,,,,,,,,
"Abhar Urban Center, Iran",,,,,,,,,,,,,,
"Béziers Urban Center, France",,,,,,,,,,,,,,
"Standerton Urban Center, South Africa",,,,,,,,,,,,,,
"Feodosia Urban Center, Ukraine",,,,,,,,,,,,,,
"Xingye Urban Center, China",,,,,,,,,,,,,,
"Vạn Giã Urban Center, Vietnam",,,,,,,,,,,,,,
"Taishun Urban Center, China",,,,,,,,,,,,,,
"Pimpalgaon Basvant Urban Center, India",,,,,,,,,,,,,,
"Khistevarz Urban Center, Tajikistan",,,,,,,,,,,,,,
"Baoshan (Heilongjiang Sheng) Urban Center, China",,,,,,,,,,,,,,
"Palencia Urban Center, Spain",,,,,,,,,,,,,,
"Agre Salam Urban Center, Ethiopia",,,,,,,,,,,,,,
"Gniezno Urban Center, Poland",,,,,,,,,,,,,,
"Automobile City Urban Center, China",,,,,,,,,,,,,,
"Majene Urban Center, Indonesia",,,,,,,,,,,,,,
"Alessandria Urban Center, Italy",,,,,,,,,,,,,,
"Novovolynsk Urban Center, Ukraine",,,,,,,,,,,,,,
"Monapo Urban Center, Mozambique",,,,,,,,,,,,,,
"Spring Hill Urban Center, USA",0.13422335046130737,,0.46613551262195674,0.3583847444289702,0.17547974294907304,,,,0.7738703134313651,0.18365509601294142,0.042474590555693484,,,
"Viedma Urban Center, Argentina",,,,,,,,,,,,,,
"Sikandarpur Urban Center, India",,,,,,,,,,,,,,
"Wuping Urban Center, China",,,,,,,,,,,,,,
"盐亭县 Urban Center, China",,,,,,,,,,,,,,
"Sangzhi Urban Center, China",,,,,,,,,,,,,,
"Dambai Urban Center, Ghana",,,,,,,,,,,,,,
"Yurga Urban Center, Russia",,,,,,,,,,,,,,
"Paracatu Urban Center, Brazil",,,,,,,,,,,,,,
"Renukut Urban Center, India",,,,,,,,,,,,,,
"Jand Urban Center, Pakistan",,,,,,,,,,,,,,
"Nashua Urban Center, USA",0.0952397307529027,,0.36815872449915926,0.27870414965024665,0.35313712585059404,,,,0.6374176148117489,0.2532632347278454,0.10931915046040583,,,
"Matsusaka Urban Center, Japan",,,,,,,,,,,,,,
"Risod Urban Center, India",,,,,,,,,,,,,,
"Mit Musa Urban Center, Egypt",,,,,,,,,,,,,,
"Loveland Urban Center, USA",0.07399089933311545,,0.33446019877150956,0.3675199364855445,0.298019864742946,,,,0.6312765159119377,0.27862097694167487,0.09010250714638744,,,
"Fengzhen Urban Center, China",,,,,,,,,,,,,,
"Mersa Urban Center, Ethiopia",,,,,,,,,,,,,,
"Yeysk Urban Center, Russia",,,,,,,,,,,,,,
"Huaying Urban Center, China",,,,,,,,,,,,,,
"Mahdasht Urban Center, Iran",,,,,,,,,,,,,,
"Kansk Urban Center, Russia",,,,,,,,,,,,,,
"Legionowo Urban Center, Poland",,,,,,,,,,,,,,
"Colonelganj Urban Center, India",,,,,,,,,,,,,,
"Partapur Urban Center, India",,,,,,,,,,,,,,
"Sault Ste. Marie Urban Center, Canada-USA",,,,,,,,,,,,,,
"Bechena Urban Center, Ethiopia",,,,,,,,,,,,,,
"Gulavthi Urban Center, India",,,,,,,,,,,,,,
"Lozova Urban Center, Ukraine",,,,,,,,,,,,,,
"Nidadavolu Urban Center, India",,,,,,,,,,,,,,
"Souk Sebt Oulad Nemma Urban Center, Morocco",,,,,,,,,,,,,,
"Korem Urban Center, Ethiopia",,,,,,,,,,,,,,
"Sibiti Urban Center, Congo",,,,,,,,,,,,,,
"Zhushan Urban Center, China",,,,,,,,,,,,,,
"Dogonbadan Urban Center, Iran",,,,,,,,,,,,,,
"Shaowu Urban Center, China",,,,,,,,,,,,,,
"Sherobod Urban Center, Uzbekistan",,,,,,,,,,,,,,
"Cəlilabad Urban Center, Azerbaijan",,,,,,,,,,,,,,
"Campana Urban Center, Argentina",,,,,,,,,,,,,,
"Pardisan Urban Center, Iran",,,,,,,,,,,,,,
"Saundatti Urban Center, India",,,,,,,,,,,,,,
"Rosarito Urban Center, Mexico",,,,,,,,,,,,,,
"Turbaco Urban Center, Colombia",,,,,,,,,,,,,,
"Dongola Urban Center, Sudan",,,,,,,,,,,,,,
"Saint Helier Urban Center, Jersey",,,,,,,,,,,,,,
"Đăk Mil Urban Center, Vietnam",,,,,,,,,,,,,,
"Yuanshi Urban Center, China",,,,,,,,,,,,,,
"Cam Ranh Urban Center, Vietnam",,,,,,,,,,,,,,
"Midu Urban Center, China",,,,,,,,,,,,,,
"San Rafael del Mojan Urban Center, Venezuela",,,,,,,,,,,,,,
"Chalchuapa Urban Center, El Salvador",,,,,,,,,,,,,,
"Ksar Chellala Urban Center, Algeria",,,,,,,,,,,,,,
"Bimbila Urban Center, Ghana",,,,,,,,,,,,,,
"Danfeng Urban Center, China",,,,,,,,,,,,,,
"Qala i Naw Urban Center, Afghanistan",,,,,,,,,,,,,,
"Wanquan Urban Center, China",,,,,,,,,,,,,,
"Seririt Urban Center, Indonesia",,,,,,,,,,,,,,
"Altamura Urban Center, Italy",,,,,,,,,,,,,,
"Kadoma Urban Center, Zimbabwe",,,,,,,,,,,,,,
"Talavera de la Reina Urban Center, Spain",,,,,,,,,,,,,,
"Shanzhou Urban Center, China",,,,,,,,,,,,,,
"Hīt Urban Center, Iraq",,,,,,,,,,,,,,
"Paravada Urban Center, India",,,,,,,,,,,,,,
"Baniyas Urban Center, Syria",,,,,,,,,,,,,,
"Wangcang Urban Center, China",,,,,,,,,,,,,,
"Wuxuan Urban Center, China",,,,,,,,,,,,,,
"Okaya Urban Center, Japan",,,,,,,,,,,,,,
"Fairland Urban Center, USA",0.09825827858516784,,0.26250371020182284,0.3189171912227032,0.418579098575474,,,,0.5757684793717741,0.26926134751515746,0.15497017311306854,,,
"Longyao Urban Center, China",,,,,,,,,,,,,,
"Dabou Urban Center, Ivory Coast",,,,,,,,,,,,,,
"Aurora Business Park Urban Center, Canada",,0.04316348044501427,,,,0.12412620333978196,0.3051636427242586,0.5707101539359594,,,,0.5674110901675469,0.3013168964041802,0.13127201342827277
"Machakos Urban Center, Kenya",,,,,,,,,,,,,,
"Tenkodogo Urban Center, Burkina Faso",,,,,,,,,,,,,,
"Wennappuwa Urban Center, Sri Lanka",,,,,,,,,,,,,,
"Nimbahera Urban Center, India",,,,,,,,,,,,,,
"Kruševac Urban Center, Serbia",,,,,,,,,,,,,,
"Pavia Urban Center, Italy",,,,,,,,,,,,,,
"Longview Urban Center, USA",0.17646534820880197,,0.4443788487941185,0.32935612922780777,0.22626502197807372,,,,0.7206958470752164,0.21494986608159253,0.06435428684319115,,,
"Azrou Urban Center, Morocco",,,,,,,,,,,,,,
"Dongjingcheng Urban Center, China",,,,,,,,,,,,,,
"Geita Urban Center, Tanzania",,,,,,,,,,,,,,
"Gampola Urban Center, Sri Lanka",,,,,,,,,,,,,,
"Chimyon Urban Center, Uzbekistan",,,,,,,,,,,,,,
"El Menia Urban Center, Algeria",,,,,,,,,,,,,,
"Springdale Urban Center, USA",0.15141087455298963,,0.4700088788976904,0.3291843273189207,0.2008067937833888,,,,0.7733161686643301,0.1689602282314184,0.05772360310425161,,,
"Nadbai Urban Center, India",,,,,,,,,,,,,,
"Tarutung Urban Center, Indonesia",,,,,,,,,,,,,,
"Сылва Urban Center, Russia",,,,,,,,,,,,,,
"Kan'onji Urban Center, Japan",,,,,,,,,,,,,,
"Al Khan Urban Center, Iraq",,,,,,,,,,,,,,
"Fryazino Urban Center, Russia",,,,,,,,,,,,,,
"Zumpango Urban Center, Mexico",,,,,,,,,,,,,,
"Singaraja (Jawa Barat) Urban Center, Indonesia",,,,,,,,,,,,,,
"Havířov Urban Center, Czech Republic",,,,,,,,,,,,,,
"Shangdu Urban Center, China",,,,,,,,,,,,,,
"Dejiang Urban Center, China",,,,,,,,,,,,,,
"Cachoeira do Sul Urban Center, Brazil",,,,,,,,,,,,,,
"Tübingen Urban Center, Germany",,,,,,,,,,,,,,
"Заречный Urban Center, Russia",,,,,,,,,,,,,,
"Angoulême Urban Center, France",,,,,,,,,,,,,,
"Fazenda Rio Grande Urban Center, Brazil",,,,,,,,,,,,,,
"Araras Urban Center, Brazil",,,,,,,,,,,,,,
"Avodim Urban Center, Nigeria",,,,,,,,,,,,,,
"Ain Sefra Urban Center, Algeria",,,,,,,,,,,,,,
"Neemrana Urban Center, India",,,,,,,,,,,,,,
"Jinxi Urban Center, China",,,,,,,,,,,,,,
"Sidi Bennour Urban Center, Morocco",,,,,,,,,,,,,,
"Pato Branco Urban Center, Brazil",,,,,,,,,,,,,,
"Gembu Urban Center, Nigeria",,,,,,,,,,,,,,
"Qiaotou (Liaoning Sheng) Urban Center, China",,,,,,,,,,,,,,
"Sơn La Urban Center, Vietnam",,,,,,,,,,,,,,
"Matão Urban Center, Brazil",,,,,,,,,,,,,,
"Changning (Sichuan Sheng) Urban Center, China",,,,,,,,,,,,,,
"Saint-Brieuc Urban Center, France",,,,,,,,,,,,,,
"Ishim Urban Center, Russia",,,,,,,,,,,,,,
"Mashi Urban Center, Nigeria",,,,,,,,,,,,,,
"Anren Urban Center, China",,,,,,,,,,,,,,
"Ati Urban Center, Chad",,,,,,,,,,,,,,
"Greenock Urban Center, United Kingdom",,,,,,,,,,,,,,
"Zuoyun Urban Center, China",,,,,,,,,,,,,,
"청하역 Urban Center, North Korea",,,,,,,,,,,,,,
"Coatepec Urban Center, Mexico",,,,,,,,,,,,,,
"Sivaganga Urban Center, India",,,,,,,,,,,,,,
"Khutsong Urban Center, South Africa",,,,,,,,,,,,,,
"淮北北 Urban Center, China",,,,,,,,,,,,,,
"Nong Khai Urban Center, Laos-Thailand",,,,,,,,,,,,,,
"Mogi Mirim Urban Center, Brazil",,,,,,,,,,,,,,
"Esfarayen Urban Center, Iran",,,,,,,,,,,,,,
"Veenendaal Urban Center, Netherlands",,,,,,,,,,,,,,
"Pancevo Urban Center, Serbia",,,,,,,,,,,,,,
"Jize Urban Center, China",,,,,,,,,,,,,,
"Risalpur Urban Center, Pakistan",,,,,,,,,,,,,,
"Izbat Abu Sir Urban Center, Egypt",,,,,,,,,,,,,,
"筠连县 Urban Center, China",,,,,,,,,,,,,,
"Paithan Urban Center, India",,,,,,,,,,,,,,
"Al Ikhsas Urban Center, Egypt",,,,,,,,,,,,,,
"Melipilla Urban Center, Chile",,,,,,,,,,,,,,
"Diu Urban Center, India",,,,,,,,,,,,,,
"Mayang Urban Center, China",,,,,,,,,,,,,,
"Xihe (Gansu Sheng) Urban Center, China",,,,,,,,,,,,,,
"和桥镇 Urban Center, China",,,,,,,,,,,,,,
"Niono Urban Center, Mali",,,,,,,,,,,,,,
"Norton Urban Center, Zimbabwe",,,,,,,,,,,,,,
"Palmerston North Urban Center, New Zealand",,,,,,,,,,,,,,
"Hinche Urban Center, Haiti",,,,,,,,,,,,,,
"Tierralta Urban Center, Colombia",,,,,,,,,,,,,,
"Itapetinga Urban Center, Brazil",,,,,,,,,,,,,,
"Soron Urban Center, India",,,,,,,,,,,,,,
"Redhill Urban Center, United Kingdom",,,,,,,,,,,,,,
"Tlapa de Comonfort Urban Center, Mexico",,,,,,,,,,,,,,
"Garhmuktesar Urban Center, India",,,,,,,,,,,,,,
"Thái Bình (Phú Thọ-Hà Nội) Urban Center, Vietnam",,,,,,,,,,,,,,
"Södertälje Urban Center, Sweden",,,,,,,,,,,,,,
"Silay Urban Center, Philippines",,,,,,,,,,,,,,
"Ajibarang Urban Center, Indonesia",,,,,,,,,,,,,,
"Jaén Urban Center, Peru",,,,,,,,,,,,,,
"Gros Morne Urban Center, Haiti",,,,,,,,,,,,,,
"Ataye Urban Center, Ethiopia",,,,,,,,,,,,,,
"Sujapur Urban Center, India",,,,,,,,,,,,,,
"Atlantic City Urban Center, USA",0.261346114061463,,0.5450995459422605,0.21819928771034658,0.2367011663473928,,,,0.7112902330225078,0.1853359268906735,0.10337384008681873,,,
"Macabebe Urban Center, Philippines",,,,,,,,,,,,,,
"Madera Urban Center, USA",0.27170326840022857,,0.4628557769451405,0.30068338077661805,0.23646084227824152,,,,0.7880773902859638,0.16324132571791336,0.048681283996122836,,,
"Laï Urban Center, Chad",,,,,,,,,,,,,,
"Holland Urban Center, USA",0.09908106697520629,,0.3803867939143239,0.364035715810405,0.25557749027527105,,,,0.7323468409737146,0.20729503170970467,0.06035812731658084,,,
"Ungwan Sarki Urban Center, Nigeria",,,,,,,,,,,,,,
"Laharpur Urban Center, India",,,,,,,,,,,,,,
"Laxmangarh Urban Center, India",,,,,,,,,,,,,,
"Pandua Urban Center, India",,,,,,,,,,,,,,
"Pen Urban Center, India",,,,,,,,,,,,,,
"Gongping Urban Center, China",,,,,,,,,,,,,,
"Bethlehem Urban Center, South Africa",,,,,,,,,,,,,,
"Suiyang Urban Center, China",,,,,,,,,,,,,,
"Managua Urban Center, Cuba",,,,,,,,,,,,,,
"Acámbaro Urban Center, Mexico",,,,,,,,,,,,,,
"Ambad Urban Center, India",,,,,,,,,,,,,,
"Agboville Urban Center, Ivory Coast",,,,,,,,,,,,,,
"Pesaro Urban Center, Italy",,,,,,,,,,,,,,
"Старокирпичный Urban Center, Russia",,,,,,,,,,,,,,
"Lingshou Urban Center, China",,,,,,,,,,,,,,
"京陇村 Urban Center, China",,,,,,,,,,,,,,
"Al Khor Urban Center, Qatar",,,,,,,,,,,,,,
"Yongqing Urban Center, China",,,,,,,,,,,,,,
"Sanggau Urban Center, Indonesia",,,,,,,,,,,,,,
"Suichang Urban Center, China",,,,,,,,,,,,,,
"Macenta Urban Center, Guinea",,,,,,,,,,,,,,
"Chukai Urban Center, Malaysia",,,,,,,,,,,,,,
"Shinshicho Urban Center, Ethiopia",,,,,,,,,,,,,,
"Arandas Urban Center, Mexico",,,,,,,,,,,,,,
"Dera Murad Jamali Urban Center, Pakistan",,,,,,,,,,,,,,
"War Kha Yu Urban Center, Myanmar",,,,,,,,,,,,,,
"San Jose (Mindoro Occidental) Urban Center, Philippines",,,,,,,,,,,,,,
"Mokokchung Urban Center, India",,,,,,,,,,,,,,
"Santo Ângelo Urban Center, Brazil",,,,,,,,,,,,,,
"Kasba Tadla Urban Center, Morocco",,,,,,,,,,,,,,
"Longmen Urban Center, China",,,,,,,,,,,,,,
"Serra Talhada Urban Center, Brazil",,,,,,,,,,,,,,
