"Oshkosh Urban Center, USA",0.8816304303001898,0.010749111110656753,0.036746437272705865,0.009114342713753085,0.05865281026464809,0.48176794040519616,,0.32941585659349665,,0.15850564201492628,,0.030310560986380863,,0.07498843407815675,0.9250115659218432,0.5750140990091507,3.588570403265599e-05,7.476188340136665e-06,24.0,5.0
"Bza`a Urban Center, Syria",,,,,,,,,,,,,,,,,,,,
"Gombi Urban Center, Nigeria",,,,,,,,,,,,,,,,,,,,
"Hanggin Rear Banner Urban Center, China",,,,,,,,,,,,,,,,,,,,
"Mezhdurechensk Urban Center, Russia",,,,,,,,,,,,,,,,,,,,
"Huoqiu Urban Center, China",,,,,,,,,,,,,,,,,,,,
"Fuhe Urban Center, China",,,,,,,,,,,,,,,,,,,,
"Salubindza Urban Center, South Africa",,,,,,,,,,,,,,,,,,,,
"Itaituba Urban Center, Brazil",,,,,,,,,,,,,,,,,,,,
"Fanshi Urban Center, China",,,,,,,,,,,,,,,,,,,,
"Mbalmayo Urban Center, Cameroon",,,,,,,,,,,,,,,,,,,,
"Jaboticabal Urban Center, Brazil",,,,,,,,,,,,,,,,,,,,
"Togtoh Urban Center, China",,,,,,,,,,,,,,,,,,,,
"Dengi Urban Center, Nigeria",,,,,,,,,,,,,,,,,,,,
"Latacunga Urban Center, Ecuador",,,,,,,,,,,,,,,,,,,,
"Kondagaon Urban Center, India",,,,,,,,,,,,,,,,,,,,
"Biel/Bienne Urban Center, Switzerland",,,,,,,,,,,,,,,,,,,,
"Qalat Saleh Urban Center, Iraq",,,,,,,,,,,,,,,,,,,,
"Xihu Township Urban Center, China",,,,,,,,,,,,,,,,,,,,
"Gobesa Urban Center, Ethiopia",,,,,,,,,,,,,,,,,,,,
"Lubin Urban Center, Poland",,,,,,,,,,,,,,,,,,,,
"Naic Urban Center, Philippines",,,,,,,,,,,,,,,,,,,,
"Dishna Urban Center, Egypt",,,,,,,,,,,,,,,,,,,,
"Kadiri Urban Center, India",,,,,,,,,,,,,,,,,,,,
"Huauchinango Urban Center, Mexico",,,,,,,,,,,,,,,,,,,,
"Dongming Urban Center, China",,,,,,,,,,,,,,,,,,,,
"Necochea Urban Center, Argentina",,,,,,,,,,,,,,,,,,,,
"Leominster Urban Center, USA",0.8598425251787941,0.005522095081794161,0.029681751377780244,0.017914747118541012,0.08134908405324491,0.3340236761049703,,0.28618249843249677,,0.2737662096198858,,0.10602761584264704,,0.12364199385513842,0.8763580061448615,0.505407541681947,5.71445757767151e-05,1.5038046257030288e-05,38.0,10.0
"Duren Urban Center, Germany",,,,,,,,,,,,,,,,,,,,
"Namhkam Urban Center, Myanmar",,,,,,,,,,,,,,,,,,,,
"Sorriso Urban Center, Brazil",,,,,,,,,,,,,,,,,,,,
"Talesh Urban Center, Iran",,,,,,,,,,,,,,,,,,,,
"Shunufa Urban Center, Egypt",,,,,,,,,,,,,,,,,,,,
"Barbil Urban Center, India",,,,,,,,,,,,,,,,,,,,
"Galway Urban Center, Ireland",,,,,,,,,,,,,,,,,,,,
"Dakingari Urban Center, Nigeria",,,,,,,,,,,,,,,,,,,,
"Koi Urban Center, Nigeria",,,,,,,,,,,,,,,,,,,,
"Sanremo Urban Center, Italy",,,,,,,,,,,,,,,,,,,,
"Carpina Urban Center, Brazil",,,,,,,,,,,,,,,,,,,,
"Itapeva Urban Center, Brazil",,,,,,,,,,,,,,,,,,,,
"Nanpu Urban Center, China",,,,,,,,,,,,,,,,,,,,
"Emin/Dörbiljin Urban Center, China",,,,,,,,,,,,,,,,,,,,
"Pelaihari Urban Center, Indonesia",,,,,,,,,,,,,,,,,,,,
"Kotchadpur Urban Center, Bangladesh",,,,,,,,,,,,,,,,,,,,
"Sora-myeon Urban Center, South Korea",,,,,,,,,,,,,,,,,,,,
"Aïn Oulmane Urban Center, Algeria",,,,,,,,,,,,,,,,,,,,
"Sadabad Urban Center, India",,,,,,,,,,,,,,,,,,,,
"Hengshan (Shaanxi Sheng) Urban Center, China",,,,,,,,,,,,,,,,,,,,
"Ashburn Urban Center, USA",0.7541832533320941,0.004609486194160447,0.009252109316543574,0.02440306755292635,0.19826264769832758,0.1910522028909356,,0.35236314830587956,,0.3172511630779571,,0.13933348572522772,,0.03504540300508627,0.9649545969949136,0.7223761777569238,2.4146934093961755e-05,4.5275501426178295e-06,16.0,3.0
"Xiuwen Urban Center, China",,,,,,,,,,,,,,,,,,,,
"Guarapari Urban Center, Brazil",,,,,,,,,,,,,,,,,,,,
"Bordj Menaiel Urban Center, Algeria",,,,,,,,,,,,,,,,,,,,
"Mazabuka Urban Center, Zambia",,,,,,,,,,,,,,,,,,,,
"Nchelenge Urban Center, Zambia",,,,,,,,,,,,,,,,,,,,
"Gandia Urban Center, Spain",,,,,,,,,,,,,,,,,,,,
"Baiquan Urban Center, China",,,,,,,,,,,,,,,,,,,,
"An Numaniyah Urban Center, Iraq",,,,,,,,,,,,,,,,,,,,
"Bignona Urban Center, Senegal",,,,,,,,,,,,,,,,,,,,
"Sahuayo de Morelos Urban Center, Mexico",,,,,,,,,,,,,,,,,,,,
"Ferizaj Urban Center, Serbia",,,,,,,,,,,,,,,,,,,,
"Xianfeng Urban Center, China",,,,,,,,,,,,,,,,,,,,
"Жуково Urban Center, Russia",,,,,,,,,,,,,,,,,,,,
"Shouyang Urban Center, China",,,,,,,,,,,,,,,,,,,,
"Anliu Urban Center, China",,,,,,,,,,,,,,,,,,,,
"Lorica Urban Center, Colombia",,,,,,,,,,,,,,,,,,,,
"São João del-Rei Urban Center, Brazil",,,,,,,,,,,,,,,,,,,,
"An Khê Urban Center, Vietnam",,,,,,,,,,,,,,,,,,,,
"Târgoviște Urban Center, Romania",,,,,,,,,,,,,,,,,,,,
"Medenine Urban Center, Tunisia",,,,,,,,,,,,,,,,,,,,
"Hamilton Urban Center, United Kingdom",,,,,,,,,,,,,,,,,,,,
"Shapar - Veraval Urban Center, India",,,,,,,,,,,,,,,,,,,,
"Al ‘Azīzīyah Urban Center, Iraq",,,,,,,,,,,,,,,,,,,,
"Bairin Right Banner Urban Center, China",,,,,,,,,,,,,,,,,,,,
"Humanabad Urban Center, India",,,,,,,,,,,,,,,,,,,,
"Barhiya Urban Center, India",,,,,,,,,,,,,,,,,,,,
"Tonghua (Western Jilin Sheng) Urban Center, China",,,,,,,,,,,,,,,,,,,,
"Royal Tunbridge Wells Urban Center, United Kingdom",,,,,,,,,,,,,,,,,,,,
"Challakere Urban Center, India",,,,,,,,,,,,,,,,,,,,
"Olavarría Urban Center, Argentina",,,,,,,,,,,,,,,,,,,,
"Butondo Urban Center, Democratic Republic of the Congo",,,,,,,,,,,,,,,,,,,,
"Isarun Urban Center, Nigeria",,,,,,,,,,,,,,,,,,,,
"Yanjin Urban Center, China",,,,,,,,,,,,,,,,,,,,
"Dhaka Urban Center, India",,,,,,,,,,,,,,,,,,,,
"Bouar Urban Center, Central African Republic",,,,,,,,,,,,,,,,,,,,
"Itajubá Urban Center, Brazil",,,,,,,,,,,,,,,,,,,,
"Una (Himāchal Pradesh) Urban Center, India",,,,,,,,,,,,,,,,,,,,
"Kakenge Urban Center, Democratic Republic of the Congo",,,,,,,,,,,,,,,,,,,,
"Malacatán Urban Center, Guatemala",,,,,,,,,,,,,,,,,,,,
"Irun Urban Center, Spain-France",,,,,,,,,,,,,,,,,,,,
"Mindelo Urban Center, Cape Verde",,,,,,,,,,,,,,,,,,,,
"Gebre gurach Urban Center, Ethiopia",,,,,,,,,,,,,,,,,,,,
"Nyeri Urban Center, Kenya",,,,,,,,,,,,,,,,,,,,
"Delmenhorst Urban Center, Germany",,,,,,,,,,,,,,,,,,,,
"Salaga Urban Center, Ghana",,,,,,,,,,,,,,,,,,,,
"Giade Urban Center, Nigeria",,,,,,,,,,,,,,,,,,,,
"Daurala Urban Center, India",,,,,,,,,,,,,,,,,,,,
"Anguo Urban Center, China",,,,,,,,,,,,,,,,,,,,
"Botshabelo Rural Urban Center, South Africa",,,,,,,,,,,,,,,,,,,,
"Uzun Urban Center, Uzbekistan",,,,,,,,,,,,,,,,,,,,
"Bitola Urban Center, North Macedonia",,,,,,,,,,,,,,,,,,,,
"Paranavaí Urban Center, Brazil",,,,,,,,,,,,,,,,,,,,
"Miri Urban Center, Malaysia",,,,,,,,,,,,,,,,,,,,
"União da Vitória Urban Center, Brazil",,,,,,,,,,,,,,,,,,,,
"Tumbaco Urban Center, Ecuador",,,,,,,,,,,,,,,,,,,,
"Gbadolite Urban Center, Democratic Republic of the Congo",,,,,,,,,,,,,,,,,,,,
"Umred Urban Center, India",,,,,,,,,,,,,,,,,,,,
"Konongo Urban Center, Ghana",,,,,,,,,,,,,,,,,,,,
"Ruyang Urban Center, China",,,,,,,,,,,,,,,,,,,,
"Vakhsh Urban Center, Tajikistan",,,,,,,,,,,,,,,,,,,,
"Hà Tĩnh Urban Center, Vietnam",,,,,,,,,,,,,,,,,,,,
"Mitrovicë Urban Center, Serbia",,,,,,,,,,,,,,,,,,,,
"Lodi Urban Center, USA",0.8918262900144664,0.01036653248192052,0.016823511145722975,0.00725014853270723,0.06898735210611104,0.37542252989396274,,0.26483482307771067,,0.2507184182868958,,0.10902422874143072,,0.07035587072164512,0.9296441292783548,0.6416276682519529,6.570201842712424e-05,1.6807493086008527e-05,43.0,11.0
"Massinga Urban Center, Mozambique",,,,,,,,,,,,,,,,,,,,
"Lingwu Urban Center, China",,,,,,,,,,,,,,,,,,,,
"Huating Urban Center, China",,,,,,,,,,,,,,,,,,,,
"La Croix Urban Center, Haiti",,,,,,,,,,,,,,,,,,,,
"Calulo Urban Center, Angola",,,,,,,,,,,,,,,,,,,,
"Didimtu Urban Center, Ethiopia",,,,,,,,,,,,,,,,,,,,
"Isahaya Urban Center, Japan",,,,,,,,,,,,,,,,,,,,
"Bafatá Urban Center, Guinea-Bissau",,,,,,,,,,,,,,,,,,,,
"Dédougou Urban Center, Burkina Faso",,,,,,,,,,,,,,,,,,,,
"Chachoengsao Urban Center, Thailand",,,,,,,,,,,,,,,,,,,,
"Qinggang Urban Center, China",,,,,,,,,,,,,,,,,,,,
"Umarkhed Urban Center, India",,,,,,,,,,,,,,,,,,,,
"Jangareddygudem Urban Center, India",,,,,,,,,,,,,,,,,,,,
"Maguan Urban Center, China",,,,,,,,,,,,,,,,,,,,
"Yokoo Urban Center, Japan",,,,,,,,,,,,,,,,,,,,
"Puerto Cortés Urban Center, Honduras",,,,,,,,,,,,,,,,,,,,
"Tipaturu Urban Center, India",,,,,,,,,,,,,,,,,,,,
"Dedaye Urban Center, Myanmar",,,,,,,,,,,,,,,,,,,,
"Gbarnga Urban Center, Liberia",,,,,,,,,,,,,,,,,,,,
"Musanze Urban Center, Rwanda",,,,,,,,,,,,,,,,,,,,
"Bender Urban Center, Moldova",,,,,,,,,,,,,,,,,,,,
"Brajarajnagar Urban Center, India",,,,,,,,,,,,,,,,,,,,
"Guildford Urban Center, United Kingdom",,,,,,,,,,,,,,,,,,,,
"Toliara Urban Center, Madagascar",,,,,,,,,,,,,,,,,,,,
"Badulla Urban Center, Sri Lanka",,,,,,,,,,,,,,,,,,,,
"Mao Urban Center, Dominican Republic",,,,,,,,,,,,,,,,,,,,
"Laifeng (Hubei Sheng-Hunan Sheng) Urban Center, China",,,,,,,,,,,,,,,,,,,,
"Karang Baru Urban Center, Indonesia",,,,,,,,,,,,,,,,,,,,
"Zrenjanin Urban Center, Serbia",,,,,,,,,,,,,,,,,,,,
"Tecate Urban Center, Mexico-USA",,,,,,,,,,,,,,,,,,,,
"Palm Coast Urban Center, USA",0.8686060667799,0.005416114983613718,0.00303672840661234,0.00309583210836291,0.1111573612341462,0.28870855378708726,,0.2902128975006311,,0.3305841274067315,,0.09049442130555017,,0.032033527677035885,0.967966472322964,0.6161605351908758,9.826651721967174e-05,1.535414331557371e-05,64.0,10.0
"Baishui Urban Center, China",,,,,,,,,,,,,,,,,,,,
"Al Qatn Urban Center, Yemen",,,,,,,,,,,,,,,,,,,,
"Qixian (Northern Henan Sheng) Urban Center, China",,,,,,,,,,,,,,,,,,,,
"Barentu Urban Center, Eritrea",,,,,,,,,,,,,,,,,,,,
"Playa Blanca Urban Center, Colombia",,,,,,,,,,,,,,,,,,,,
"Sidi Aissa Urban Center, Algeria",,,,,,,,,,,,,,,,,,,,
"Fengqiao Urban Center, China",,,,,,,,,,,,,,,,,,,,
"Burton-on-Trent Urban Center, United Kingdom",,,,,,,,,,,,,,,,,,,,
"Agwa Urban Center, Nigeria",,,,,,,,,,,,,,,,,,,,
"Iguatu Urban Center, Brazil",,,,,,,,,,,,,,,,,,,,
"Nahavand Urban Center, Iran",,,,,,,,,,,,,,,,,,,,
"Richard-Toll Urban Center, Senegal",,,,,,,,,,,,,,,,,,,,
"招信镇 Urban Center, China",,,,,,,,,,,,,,,,,,,,
"Tam Quan Urban Center, Vietnam",,,,,,,,,,,,,,,,,,,,
"Nippani Urban Center, India",,,,,,,,,,,,,,,,,,,,
"Ghaliya Urban Center, Sudan",,,,,,,,,,,,,,,,,,,,
"Shrewsbury Urban Center, United Kingdom",,,,,,,,,,,,,,,,,,,,
"Datian Urban Center, China",,,,,,,,,,,,,,,,,,,,
"Zhongxin Urban Center, China",,,,,,,,,,,,,,,,,,,,
"Metu Urban Center, Ethiopia",,,,,,,,,,,,,,,,,,,,
"Yellandu Urban Center, India",,,,,,,,,,,,,,,,,,,,
"Fakfak Urban Center, Indonesia",,,,,,,,,,,,,,,,,,,,
"Qingyang (Jiangsu Sheng) Urban Center, China",,,,,,,,,,,,,,,,,,,,
"Porto Seguro Urban Center, Brazil",,,,,,,,,,,,,,,,,,,,
"Santa Inês Urban Center, Brazil",,,,,,,,,,,,,,,,,,,,
"Mansa (Gujarāt) Urban Center, India",,,,,,,,,,,,,,,,,,,,
"Gießen Urban Center, Germany",,,,,,,,,,,,,,,,,,,,
"Natitingou Urban Center, Benin",,,,,,,,,,,,,,,,,,,,
"Nattalin Urban Center, Myanmar",,,,,,,,,,,,,,,,,,,,
"Nowshera Virkan Urban Center, Pakistan",,,,,,,,,,,,,,,,,,,,
"Tongxu Urban Center, China",,,,,,,,,,,,,,,,,,,,
"Nova Serrana Urban Center, Brazil",,,,,,,,,,,,,,,,,,,,
"San Carlos Urban Center, Philippines",,,,,,,,,,,,,,,,,,,,
"Manzil Bourguiba Urban Center, Tunisia",,,,,,,,,,,,,,,,,,,,
"Çankırı Urban Center, Turkey",,,,,,,,,,,,,,,,,,,,
"Polvilho Urban Center, Brazil",,,,,,,,,,,,,,,,,,,,
"Tafawa-Balewa Urban Center, Nigeria",,,,,,,,,,,,,,,,,,,,
"棘洪滩街道 Urban Center, China",,,,,,,,,,,,,,,,,,,,
"Jhargram Urban Center, India",,,,,,,,,,,,,,,,,,,,
"Peddapalli Urban Center, India",,,,,,,,,,,,,,,,,,,,
"Usulután Urban Center, El Salvador",,,,,,,,,,,,,,,,,,,,
"Qiaotou (Zhejiang Sheng) Urban Center, China",,,,,,,,,,,,,,,,,,,,
"Bolgatanga Urban Center, Ghana",,,,,,,,,,,,,,,,,,,,
"Makanza Urban Center, Democratic Republic of the Congo",,,,,,,,,,,,,,,,,,,,
"Redenção Urban Center, Brazil",,,,,,,,,,,,,,,,,,,,
"Slavyansk-na-Kubani Urban Center, Russia",,,,,,,,,,,,,,,,,,,,
"魏桥镇 Urban Center, China",,,,,,,,,,,,,,,,,,,,
"Kuichong Sub-district Urban Center, China",,,,,,,,,,,,,,,,,,,,
"Zenica Urban Center, Bosnia and Herzegovina",,,,,,,,,,,,,,,,,,,,
"Masvingo Urban Center, Zimbabwe",,,,,,,,,,,,,,,,,,,,
"Pulivendula Urban Center, India",,,,,,,,,,,,,,,,,,,,
"良庆区 Urban Center, China",,,,,,,,,,,,,,,,,,,,
"Rishton Urban Center, United Kingdom",,,,,,,,,,,,,,,,,,,,
"Azua Urban Center, Dominican Republic",,,,,,,,,,,,,,,,,,,,
"Talcher Urban Center, India",,,,,,,,,,,,,,,,,,,,
"Zhudong Urban Center, China",,,,,,,,,,,,,,,,,,,,
"Ongjin Urban Center, North Korea",,,,,,,,,,,,,,,,,,,,
"Luomen Urban Center, China",,,,,,,,,,,,,,,,,,,,
"Quanzhou (Guangxi Zhuangzu Zizhiqu) Urban Center, China",,,,,,,,,,,,,,,,,,,,
"Avilés Urban Center, Spain",,,,,,,,,,,,,,,,,,,,
"Safipur Urban Center, India",,,,,,,,,,,,,,,,,,,,
"Huehuetenango Urban Center, Guatemala",,,,,,,,,,,,,,,,,,,,
"Alphen aan den Rijn Urban Center, Netherlands",,,,,,,,,,,,,,,,,,,,
"El Puerto de Santa María Urban Center, Spain",,,,,,,,,,,,,,,,,,,,
"Liucun Urban Center, China",,,,,,,,,,,,,,,,,,,,
"Shexian Urban Center, China",,,,,,,,,,,,,,,,,,,,
"Pucheng (Fujian Sheng) Urban Center, China",,,,,,,,,,,,,,,,,,,,
"Xikou Urban Center, China",,,,,,,,,,,,,,,,,,,,
"Serov Urban Center, Russia",,,,,,,,,,,,,,,,,,,,
"Katoro Urban Center, Tanzania",,,,,,,,,,,,,,,,,,,,
"Quzhou (Hebei Sheng) Urban Center, China",,,,,,,,,,,,,,,,,,,,
"Kempten (Allgäu) Urban Center, Germany",,,,,,,,,,,,,,,,,,,,
"Kanyabayonga Urban Center, Democratic Republic of the Congo",,,,,,,,,,,,,,,,,,,,
"Santa Cruz del Quiché Urban Center, Guatemala",,,,,,,,,,,,,,,,,,,,
"Kirishima Urban Center, Japan",,,,,,,,,,,,,,,,,,,,
"Dungun Urban Center, Malaysia",,,,,,,,,,,,,,,,,,,,
"Pervomaisk Urban Center, Ukraine",,,,,,,,,,,,,,,,,,,,
"Hòa Bình Urban Center, Vietnam",,,,,,,,,,,,,,,,,,,,
"院桥镇 Urban Center, China",,,,,,,,,,,,,,,,,,,,
"Caxito Urban Center, Angola",,,,,,,,,,,,,,,,,,,,
"Ifakara Urban Center, Tanzania",,,,,,,,,,,,,,,,,,,,
"Kalyanpur Urban Center, India",,,,,,,,,,,,,,,,,,,,
"Nkoranza Urban Center, Ghana",,,,,,,,,,,,,,,,,,,,
"Kanigiri Urban Center, India",,,,,,,,,,,,,,,,,,,,
"Vikramasingapuram Urban Center, India",,,,,,,,,,,,,,,,,,,,
"Lijiazui Urban Center, China",,,,,,,,,,,,,,,,,,,,
"Xia Urban Center, China",,,,,,,,,,,,,,,,,,,,
"Pardubice Urban Center, Czech Republic",,,,,,,,,,,,,,,,,,,,
"Inowrocław Urban Center, Poland",,,,,,,,,,,,,,,,,,,,
"Jhinjhak Urban Center, India",,,,,,,,,,,,,,,,,,,,
"Mithapur Urban Center, India",,,,,,,,,,,,,,,,,,,,
"Lakuwe Urban Center, Nigeria",,,,,,,,,,,,,,,,,,,,
"Ngong Urban Center, Kenya",,,,,,,,,,,,,,,,,,,,
"Mossel Bay Urban Center, South Africa",,,,,,,,,,,,,,,,,,,,
"Xiecun Urban Center, China",,,,,,,,,,,,,,,,,,,,
"Isfara Urban Center, Tajikistan",,,,,,,,,,,,,,,,,,,,
"Calbayog Urban Center, Philippines",,,,,,,,,,,,,,,,,,,,
"Caldas Urban Center, Colombia",,,,,,,,,,,,,,,,,,,,
"Freiburg im Üechtland Urban Center, Switzerland",,,,,,,,,,,,,,,,,,,,
"Dayangshu Urban Center, China",,,,,,,,,,,,,,,,,,,,
"Jendouba Urban Center, Tunisia",,,,,,,,,,,,,,,,,,,,
"Vélingara Urban Center, Senegal",,,,,,,,,,,,,,,,,,,,
"Arbe Gona Urban Center, Ethiopia",,,,,,,,,,,,,,,,,,,,
"Linkou Urban Center, China",,,,,,,,,,,,,,,,,,,,
"Diphu Urban Center, India",,,,,,,,,,,,,,,,,,,,
"Apalit Urban Center, Philippines",,,,,,,,,,,,,,,,,,,,
"Helmond Urban Center, Netherlands",,,,,,,,,,,,,,,,,,,,
"Dinalupihan Urban Center, Philippines",,,,,,,,,,,,,,,,,,,,
"Gossaigaon Urban Center, India",,,,,,,,,,,,,,,,,,,,
"Durham Urban Center, USA",0.6985434293250535,0.022862442740983886,0.08208236831755973,0.053103905931139506,0.13074193890103467,0.3355095600355571,,0.41343922357469676,,0.20236229102937806,,0.04868892536036807,,0.14741290714722144,0.8525870928527786,0.3628567036882637,9.394375900294356e-05,2.348593975073589e-05,60.0,15.0
"Xonacatlán Urban Center, Mexico",,,,,,,,,,,,,,,,,,,,
"Venado Tuerto Urban Center, Argentina",,,,,,,,,,,,,,,,,,,,
"Great Yarmouth Urban Center, United Kingdom",,,,,,,,,,,,,,,,,,,,
"Yanchi Urban Center, China",,,,,,,,,,,,,,,,,,,,
"Bognor Regis Urban Center, United Kingdom",,,,,,,,,,,,,,,,,,,,
"Shamsabad Urban Center, India",,,,,,,,,,,,,,,,,,,,
"Jarqurgon Urban Center, Uzbekistan",,,,,,,,,,,,,,,,,,,,
"9th Urban Center, Egypt",,,,,,,,,,,,,,,,,,,,
"Xiaohe Urban Center, China",,,,,,,,,,,,,,,,,,,,
"Bushehr Urban Center, Iran",,,,,,,,,,,,,,,,,,,,
"Deroua Urban Center, Morocco",,,,,,,,,,,,,,,,,,,,
"Fatehpora Urban Center, India",,,,,,,,,,,,,,,,,,,,
"Islamnagar Urban Center, India",,,,,,,,,,,,,,,,,,,,
"Sihora Urban Center, India",,,,,,,,,,,,,,,,,,,,
"Nuzvid Urban Center, India",,,,,,,,,,,,,,,,,,,,
"Taitung Urban Center, China",,,,,,,,,,,,,,,,,,,,
"Shangdang Urban Center, China",,,,,,,,,,,,,,,,,,,,
"Majenang Urban Center, Indonesia",,,,,,,,,,,,,,,,,,,,
"Luján Urban Center, Argentina",,,,,,,,,,,,,,,,,,,,
"Dias d'Ávila Urban Center, Brazil",,,,,,,,,,,,,,,,,,,,
"Sinhung Urban Center, North Korea",,,,,,,,,,,,,,,,,,,,
"Morrumbala Urban Center, Mozambique",,,,,,,,,,,,,,,,,,,,
"Lucapa Urban Center, Angola",,,,,,,,,,,,,,,,,,,,
"白溪村 Urban Center, China",,,,,,,,,,,,,,,,,,,,
"Candelaria Urban Center, Philippines",,,,,,,,,,,,,,,,,,,,
"Lorain Urban Center, USA",0.9199786271146929,0.0019480198737810957,0.011475495665396235,0.00772710000576708,0.033319436834692066,0.27097599509889253,,0.4235548221008324,,0.25936454760174255,,0.04610463519853248,,0.09072479885847044,0.9092752011415296,0.48590600447554344,4.875517040718432e-05,9.436484594938901e-06,31.0,6.0
"Jenin Urban Center, State of Palestine",,,,,,,,,,,,,,,,,,,,
"Wettingen Urban Center, Switzerland",,,,,,,,,,,,,,,,,,,,
"Érd Urban Center, Hungary",,,,,,,,,,,,,,,,,,,,
"Fatick Urban Center, Senegal",,,,,,,,,,,,,,,,,,,,
"Safur Urban Center, Egypt",,,,,,,,,,,,,,,,,,,,
"华亭村 Urban Center, China",,,,,,,,,,,,,,,,,,,,
"Tataouine Urban Center, Tunisia",,,,,,,,,,,,,,,,,,,,
"Tambakrejo Urban Center, Indonesia",,,,,,,,,,,,,,,,,,,,
"Định Quán Urban Center, Vietnam",,,,,,,,,,,,,,,,,,,,
"Cubatão Urban Center, Brazil",,,,,,,,,,,,,,,,,,,,
"Matian Urban Center, China",,,,,,,,,,,,,,,,,,,,
"Wencheng Urban Center, China",,,,,,,,,,,,,,,,,,,,
"Yongshun Urban Center, China",,,,,,,,,,,,,,,,,,,,
"Tilda Neora Urban Center, India",,,,,,,,,,,,,,,,,,,,
"Qipanjing Urban Center, China",,,,,,,,,,,,,,,,,,,,
"Al Zayyatin al Qibliyah Urban Center, Egypt",,,,,,,,,,,,,,,,,,,,
"Izbat al Hawwashah Urban Center, Egypt",,,,,,,,,,,,,,,,,,,,
"Abu Kamal Urban Center, Syria",,,,,,,,,,,,,,,,,,,,
"Puerto Barrios Urban Center, Guatemala",,,,,,,,,,,,,,,,,,,,
"Wolfsburg Urban Center, Germany",,,,,,,,,,,,,,,,,,,,
"Chone Urban Center, Ecuador",,,,,,,,,,,,,,,,,,,,
"Rupnagar Urban Center, India",,,,,,,,,,,,,,,,,,,,
"Trindade Urban Center, Brazil",,,,,,,,,,,,,,,,,,,,
"Mahgawan Urban Center, India",,,,,,,,,,,,,,,,,,,,
"Gela Urban Center, Italy",,,,,,,,,,,,,,,,,,,,
"Tagawa Urban Center, Japan",,,,,,,,,,,,,,,,,,,,
"Itiya Urban Center, Ethiopia",,,,,,,,,,,,,,,,,,,,
"Pulwama Urban Center, India",,,,,,,,,,,,,,,,,,,,
"Aketi Urban Center, Democratic Republic of the Congo",,,,,,,,,,,,,,,,,,,,
"Oke Atan Urban Center, Nigeria",,,,,,,,,,,,,,,,,,,,
"Belfort Urban Center, France",,,,,,,,,,,,,,,,,,,,
"Kandiaro Urban Center, Pakistan",,,,,,,,,,,,,,,,,,,,
"Dinalaoan Urban Center, Philippines",,,,,,,,,,,,,,,,,,,,
"Dongfeng Urban Center, China",,,,,,,,,,,,,,,,,,,,
"Huji Urban Center, China",,,,,,,,,,,,,,,,,,,,
"Khoái Châu Urban Center, Vietnam",,,,,,,,,,,,,,,,,,,,
"Ijuí Urban Center, Brazil",,,,,,,,,,,,,,,,,,,,
"Periyakulam Urban Center, India",,,,,,,,,,,,,,,,,,,,
"Siguatepeque Urban Center, Honduras",,,,,,,,,,,,,,,,,,,,
"Hradec Králové Urban Center, Czech Republic",,,,,,,,,,,,,,,,,,,,
"Dera Urban Center, Ethiopia",,,,,,,,,,,,,,,,,,,,
"Tetovo Urban Center, North Macedonia",,,,,,,,,,,,,,,,,,,,
"Shushah Urban Center, Egypt",,,,,,,,,,,,,,,,,,,,
"Arima Urban Center, Trinidad and Tobago",,,,,,,,,,,,,,,,,,,,
"Ruwa Urban Center, Zimbabwe",,,,,,,,,,,,,,,,,,,,
"Nilanga Urban Center, India",,,,,,,,,,,,,,,,,,,,
"Manteca Urban Center, USA",0.9032939215338665,0.0038822658086259698,0.011858695134652455,0.01685512048525347,0.06146665217596441,0.22355897130454644,,0.3022075138121325,,0.19282051478425255,,0.28141300009906844,,0.039048764546485926,0.960951235453514,0.7190130474980115,9.69762487679247e-05,3.1795491399319574e-05,61.0,20.0
"Krasnodon Urban Center, Ukraine",,,,,,,,,,,,,,,,,,,,
"Cây Xăng Urban Center, Vietnam",,,,,,,,,,,,,,,,,,,,
"Huoshan Urban Center, China",,,,,,,,,,,,,,,,,,,,
"Abhar Urban Center, Iran",,,,,,,,,,,,,,,,,,,,
"Béziers Urban Center, France",,,,,,,,,,,,,,,,,,,,
"Standerton Urban Center, South Africa",,,,,,,,,,,,,,,,,,,,
"Feodosia Urban Center, Ukraine",,,,,,,,,,,,,,,,,,,,
"Xingye Urban Center, China",,,,,,,,,,,,,,,,,,,,
"Vạn Giã Urban Center, Vietnam",,,,,,,,,,,,,,,,,,,,
"Taishun Urban Center, China",,,,,,,,,,,,,,,,,,,,
"Pimpalgaon Basvant Urban Center, India",,,,,,,,,,,,,,,,,,,,
"Khistevarz Urban Center, Tajikistan",,,,,,,,,,,,,,,,,,,,
"Baoshan (Heilongjiang Sheng) Urban Center, China",,,,,,,,,,,,,,,,,,,,
"Palencia Urban Center, Spain",,,,,,,,,,,,,,,,,,,,
"Agre Salam Urban Center, Ethiopia",,,,,,,,,,,,,,,,,,,,
"Gniezno Urban Center, Poland",,,,,,,,,,,,,,,,,,,,
"Automobile City Urban Center, China",,,,,,,,,,,,,,,,,,,,
"Majene Urban Center, Indonesia",,,,,,,,,,,,,,,,,,,,
"Alessandria Urban Center, Italy",,,,,,,,,,,,,,,,,,,,
"Novovolynsk Urban Center, Ukraine",,,,,,,,,,,,,,,,,,,,
"Monapo Urban Center, Mozambique",,,,,,,,,,,,,,,,,,,,
"Spring Hill Urban Center, USA",0.88075048933841,0.00472846655684128,0.00189930797504669,0.003787926070730322,0.0902763954708842,0.2514082831996703,,0.34528431014683164,,0.25464502685935175,,0.1486623797941462,,0.05691128140264447,0.9430887185973555,0.557275742174162,0.00010057310707044908,3.03315719736275e-05,63.0,19.0
"Viedma Urban Center, Argentina",,,,,,,,,,,,,,,,,,,,
"Sikandarpur Urban Center, India",,,,,,,,,,,,,,,,,,,,
"Wuping Urban Center, China",,,,,,,,,,,,,,,,,,,,
"盐亭县 Urban Center, China",,,,,,,,,,,,,,,,,,,,
"Sangzhi Urban Center, China",,,,,,,,,,,,,,,,,,,,
"Dambai Urban Center, Ghana",,,,,,,,,,,,,,,,,,,,
"Yurga Urban Center, Russia",,,,,,,,,,,,,,,,,,,,
"Paracatu Urban Center, Brazil",,,,,,,,,,,,,,,,,,,,
"Renukut Urban Center, India",,,,,,,,,,,,,,,,,,,,
"Jand Urban Center, Pakistan",,,,,,,,,,,,,,,,,,,,
"Nashua Urban Center, USA",0.8705591726334376,0.0028594015770775035,0.024110499077392444,0.02189970633031073,0.07350578502231149,0.30259440004549826,,0.3494552324762413,,0.27615860817129717,,0.07179175930696328,,0.10005629335300288,0.8999437066469971,0.53640826373762,4.480143364587667e-05,1.1200358411469169e-05,28.0,7.0
"Matsusaka Urban Center, Japan",,,,,,,,,,,,,,,,,,,,
"Risod Urban Center, India",,,,,,,,,,,,,,,,,,,,
"Mit Musa Urban Center, Egypt",,,,,,,,,,,,,,,,,,,,
"Loveland Urban Center, USA",0.8407037958769853,0.006950095671089956,0.015255829762195708,0.006874300724958851,0.12024996050646355,0.2592082190174095,,0.3684692323307607,,0.2871280010376545,,0.08519454761417525,,0.05016160662553542,0.9498383933744646,0.6475870008292965,4.1655985644706485e-05,1.1215073058190206e-05,26.0,7.0
"Fengzhen Urban Center, China",,,,,,,,,,,,,,,,,,,,
"Mersa Urban Center, Ethiopia",,,,,,,,,,,,,,,,,,,,
"Yeysk Urban Center, Russia",,,,,,,,,,,,,,,,,,,,
"Huaying Urban Center, China",,,,,,,,,,,,,,,,,,,,
"Mahdasht Urban Center, Iran",,,,,,,,,,,,,,,,,,,,
"Kansk Urban Center, Russia",,,,,,,,,,,,,,,,,,,,
"Legionowo Urban Center, Poland",,,,,,,,,,,,,,,,,,,,
"Colonelganj Urban Center, India",,,,,,,,,,,,,,,,,,,,
"Partapur Urban Center, India",,,,,,,,,,,,,,,,,,,,
"Sault Ste. Marie Urban Center, Canada-USA",,,,,,,,,,,,,,,,,,,,
"Bechena Urban Center, Ethiopia",,,,,,,,,,,,,,,,,,,,
"Gulavthi Urban Center, India",,,,,,,,,,,,,,,,,,,,
"Lozova Urban Center, Ukraine",,,,,,,,,,,,,,,,,,,,
"Nidadavolu Urban Center, India",,,,,,,,,,,,,,,,,,,,
"Souk Sebt Oulad Nemma Urban Center, Morocco",,,,,,,,,,,,,,,,,,,,
"Korem Urban Center, Ethiopia",,,,,,,,,,,,,,,,,,,,
"Sibiti Urban Center, Congo",,,,,,,,,,,,,,,,,,,,
"Zhushan Urban Center, China",,,,,,,,,,,,,,,,,,,,
"Dogonbadan Urban Center, Iran",,,,,,,,,,,,,,,,,,,,
"Shaowu Urban Center, China",,,,,,,,,,,,,,,,,,,,
"Sherobod Urban Center, Uzbekistan",,,,,,,,,,,,,,,,,,,,
"Cəlilabad Urban Center, Azerbaijan",,,,,,,,,,,,,,,,,,,,
"Campana Urban Center, Argentina",,,,,,,,,,,,,,,,,,,,
"Pardisan Urban Center, Iran",,,,,,,,,,,,,,,,,,,,
"Saundatti Urban Center, India",,,,,,,,,,,,,,,,,,,,
"Rosarito Urban Center, Mexico",,,,,,,,,,,,,,,,,,,,
"Turbaco Urban Center, Colombia",,,,,,,,,,,,,,,,,,,,
"Dongola Urban Center, Sudan",,,,,,,,,,,,,,,,,,,,
"Saint Helier Urban Center, Jersey",,,,,,,,,,,,,,,,,,,,
"Đăk Mil Urban Center, Vietnam",,,,,,,,,,,,,,,,,,,,
"Yuanshi Urban Center, China",,,,,,,,,,,,,,,,,,,,
"Cam Ranh Urban Center, Vietnam",,,,,,,,,,,,,,,,,,,,
"Midu Urban Center, China",,,,,,,,,,,,,,,,,,,,
"San Rafael del Mojan Urban Center, Venezuela",,,,,,,,,,,,,,,,,,,,
"Chalchuapa Urban Center, El Salvador",,,,,,,,,,,,,,,,,,,,
"Ksar Chellala Urban Center, Algeria",,,,,,,,,,,,,,,,,,,,
"Bimbila Urban Center, Ghana",,,,,,,,,,,,,,,,,,,,
"Danfeng Urban Center, China",,,,,,,,,,,,,,,,,,,,
"Qala i Naw Urban Center, Afghanistan",,,,,,,,,,,,,,,,,,,,
"Wanquan Urban Center, China",,,,,,,,,,,,,,,,,,,,
"Seririt Urban Center, Indonesia",,,,,,,,,,,,,,,,,,,,
"Altamura Urban Center, Italy",,,,,,,,,,,,,,,,,,,,
"Kadoma Urban Center, Zimbabwe",,,,,,,,,,,,,,,,,,,,
"Talavera de la Reina Urban Center, Spain",,,,,,,,,,,,,,,,,,,,
"Shanzhou Urban Center, China",,,,,,,,,,,,,,,,,,,,
"Hīt Urban Center, Iraq",,,,,,,,,,,,,,,,,,,,
"Paravada Urban Center, India",,,,,,,,,,,,,,,,,,,,
"Baniyas Urban Center, Syria",,,,,,,,,,,,,,,,,,,,
"Wangcang Urban Center, China",,,,,,,,,,,,,,,,,,,,
"Wuxuan Urban Center, China",,,,,,,,,,,,,,,,,,,,
"Okaya Urban Center, Japan",,,,,,,,,,,,,,,,,,,,
"Fairland Urban Center, USA",0.7930622526324571,0.001806048321331782,0.008849583742790153,0.09516452267713452,0.09314578559504395,0.10771472520107563,,0.24805223183920802,,0.4777765822304638,,0.16645646072925258,,0.10312119865342938,0.8968788013465707,0.5277903720142146,4.8464483610927125e-05,9.692896722185425e-06,30.0,6.0
"Longyao Urban Center, China",,,,,,,,,,,,,,,,,,,,
"Dabou Urban Center, Ivory Coast",,,,,,,,,,,,,,,,,,,,
